Toys,Atomic 2-in-1 Flip-Top Game Table,
Toys,Razor Kids' E Prime III Electric Scooter,
Toys,Victory Tailgate Clemson University Logo Design Table Tennis Paddle,
Toys,Ozone 500 Girls' Shock Force 24 in 21-Speed Full Suspension Mountain Bike,
Toys,EastPoint Go! Gater Bean Bag Toss Game,
Toys,Melissa & Doug Camo Chameleon Bean Bag Toss Game,
Toys,Fubbles No Spill Bubble Tumbler,
Toys,Casemaster® Accolade Dart Case,
Toys,Franklin MLB 30 in Authentic Plastic Bat & Ball Set,
Toys,Huffy 12V HWX 12,
Toys,GLD Sinister Series Pool Cue Stick,
Toys,Viper Underground Rock & Roll 18-Gram Soft-Tip Darts 3-Pack,
Toys,Sky Viper X-Quad Stunt Quadcopter Drone,
Toys,"Triumph Sports USA 72"" Swivel 5-in-1 Combo Table",
Toys,Maxx Action Kids' Pop Up Camo Tent,
Toys,Viper Sneaky Pete Pool Cue Stick,
Toys,Quest Repeat 32 in  Cruiser Longboard,
Toys,Shaun White Supply Co. Skateboarding Helmet S/M,
Toys,Franklin Flying Darts Game with Target,
Toys,Rollerblade Kids' Microblade ALU 3WD In-Line Skates,
Toys,Franklin LED Net and Paddle Set,
Toys,Roller Derby Boys' Blazer Lighted Wheels Roller Skates,
Toys,Roller Derby Men's Aerio Q-60 In-Line Skates,
Toys,Ozone 500 Boys' X Scream 18 in Bike,
Toys,Plug City Electric Scooter,
Toys,Mossy Oak™ Kids' Camo Toy Pump Shotgun,
Toys,Razor A2 Kick Scooter,
Toys,NERF Rival Ammo Refill 50-Pack,
Toys,"GLD 2BA Tufflex Tips III Soft Dart Tips 1,000-Pack",
Toys,Air Zone Girls' Aftershock 20 in 6-Speed Mountain Bike,
Toys,Mongoose Kids' Force 3 Folding Scooter,
Toys,Fat Cat Supernova LED 6 foot Air Hockey Table,
Toys,Sunny Days Barbie Dream Camper Pop-Up Play Tent,
Toys,Mobo Cruiser Kids' Tot Rockabilly 3-Wheel Cruiser,
Toys,ZURU X-Shot Excel Reflex Combo Pack,
Toys,Magna Boys' Throttle 20 in BMX Bike,
Toys,Pulse Kids' GRT-11 Electric Scooter,
Toys,Westminster 4-in-1 Quad Sport Table Games,
Toys,NHT Spider Self-Balancing Hoverboard,
Toys,Dynacraft Boys' Thomas and Friends 14 in Bike,
Toys,Roller Derby Girls' FireStar Roller Skates,
Toys,Razor Adults' RazorX Cruiser Electric Skateboard,
Toys,Kan Jam Game Set,
Toys,Ozone 500 Boys' Ultra Shock 20 in Bike,
Toys,Heelys Girls' Straight Up Skate Shoes,
Toys,Huffy Nex6 Motorcycle Electric Ride-On Toy,
Toys,Kettler Eden Weatherproof Outdoor Table Tennis Table,
Toys,Casemaster Plazma Plus Pro Dart Case,
Toys,NERF N-Sports Bash Ball,
Toys,GLD Flight Card with 40 Dimplex Flights,
Toys,Franklin Kids' 24 in x 16 in x 16 in Soccer Goal with Ball and Pump,
Toys,Mongoose Kids' Stance Elite Freestyle Scooter,
Toys,Dynacraft Boys' Hot Wheels 18 in Bike,
Toys,Baden 8.5 in Rubber Playground Ball,
Toys,Stiga® Apex Table Tennis Racket,
Toys,"Mainstreet Classics 36"" Tabletop Soccer Foosball Table",
Toys,Flybar Foam Master Pogo Stick,
Toys,NERF Rival Refill Ammo,
Toys,Huffy Vespa H1 Ride-On Toy,
Toys,B4 Adventure Slackers 100 ft Zipline Night Riderz Kit with Spring Brake Kit,
Toys,b4 Adventure Stick the Kick Set,
Toys,Fisher-Price I Can Play™ Basketball Hoop,
Toys,NERF Rival 50-Round Refill Pack,
Toys,Viper Sure Grip Soft-Tip Darts 3-Pack,
Toys,Bravo Sports Boys' Ultimate Spider-Man 3-Wheel Electric Scooter,
Toys,Magna Boys' Throttle 20 in Bike,
Toys,Mizerak™ Shorty Cue Stick,
Toys,Rollerblade Girls' Spitfire XT In-Line Adjustable Skates,
Toys,Cardinal Dice 5-Pack,
Toys,Viper V-Factor 20-Gram Soft-Tip Darts 3-Pack,
Toys,Victory Tailgate Auburn University Logo Design Table Tennis Paddle,
Toys,Dynacraft Clifford 6V Plush Ride-On Toy,
Toys,Kryptonics Super Fat Cruiser Blue Fish 30.5 in Skateboard,
Toys,Mainstreet Classics Sinister Table Top Billiards,
Toys,Elkadart Razor Steel-Tip Darts 3-Pack,
Toys,Melissa & Doug Trixie Kickball,
Toys,Pulse Kids' Patriotic 3-Wheel Leaning Scooter,
Toys,Triumph Multi-Sport Combo Net Set,
Toys,Mizerak™ Composite Neon Fade Cue,
Toys,Buzz Bee Toys Air Warriors Tactical Storm Blaster,
Toys,Viper Bobcat Adjustable Soft-Tip Darts 3-Pack,
Toys,Viper Showdown Electronic Dartboard,
Toys,NERF™ Modulus Tri-Strike Blaster,
Toys,Jetson Adults' Bolt 12 in Electric Bike,
Toys,STIGA VOLT Portable Table Tennis Table,
Toys,Stiga® Tournament Series STS285 Table Tennis Table,
Toys,Viper Freak Soft-Tip Darts Set,
Toys,Franklin Playbook End Zone Mini Football,
Toys,Aerobie Skylighter Flying Disc,
Toys,Prince Fusion Elite Table Tennis Table,
Toys,The Cardiff Skate Company Men's S1 Bootless Skates,
Toys,Flybar Super Pogo 2 Pogo Stick,
Toys,Epic Skates Youth Rage Inline Skates,
Toys,JoJo Siwa Kids' Adjustable Roller Skates,
Toys,Viper Revolution Relic Pool Cue Stick,
Toys,Razor A6 Kick Scooter,
Toys,Razor E300S Electric Scooter,
Toys,Little Tikes Easy Score Basketball Arcade,
Toys,Triumph 7’ Maverick Billiard Table,
Toys,Casemaster Sport Zippered Dart Case,
Toys,Dynacraft Kids' Magna Starburst 16 in Bike,
Toys,Stiga® Baja Outdoor Table Tennis Table,
Toys,B4 Adventure Slackers 90 ft Eagle Zipline with Free Spring Brake Kit,
Toys,Rollerblade Men's Maxxum Edge 90 In-Line Skates,
Toys,Stiga® SensorScore Digital Table Tennis Scoring System,
Toys,Victory Tailgate University of Oklahoma Logo Design Table Tennis Paddle,
Toys,Stiga Stars and Stripes Table Tennis Balls 6-Pack,
Toys,Jetson Kids' Jupiter Iridescent Scooter,
Toys,"Viper Revolution Sure Grip Pro 58"" Pool Cue Stick",
Toys,Casemaster Sentry Zippered Dart Case,
Toys,Peg Perego John Deere Ground Loader 12 v Ride-On Vehicle,
Toys,GLD Dimplex Slim Dart Flights,
Toys,Professor Puzzle Trivia Time Sports Trivia Game,
Toys,Swagtron Swagboard T6 Off-Road Hoverboard,
Toys,Viper Sidewinder Steel-Tip Darts 3-Pack,
Toys,Quest Rings Cruiser 33 in Skateboard,
Toys,Hover-1 Adults' Folding Electric Scooter,
Toys,Magna Boys' Hot Rod 12-inch Bike,
Toys,Mizerak™ Vinyl Billiard Table Cover,
Toys,Hot Wheels® Car Assortment 5-Pack,
Toys,Rollerblade Boys' Spitfire XT In-Line Adjustable Skates,
Toys,Slackers Ninja Net,
Toys,Funphix Create and Play Wheelies Buildable Play Structure Set with Wheels,
Toys,Realtree Camouflage Playing Cards,
Toys,Razor® Adults' California Longboard Kick Scooter,
Toys,Razor® A1/A2 Replacement Wheel Kit,
Toys,My Little Pony Toddlers' Twilight Sparkle Plush 6V Quad Ride-On Toy,
Toys,Franklin Kids' Indoor Spin N Putt Golf Set,
Toys,Elkadart Orbital 22 g Steel-Tip Darts,
Toys,GameMaster Blitzball Bat and Ball,
Toys,Austin Collection LED Pre-lit 54” Foosball Table,
Toys,Elkadart Razor 21 g Tungsten Steel-Tip Darts 3-Pack,
Toys,Roller Derby Girls' Roller Star 350 Quad Skates,
Toys,Viper Element 18-Gram Soft-Tip Darts Set,
Toys,Elkadart Ultra Sonic 18 g 80 Percent Tungsten Soft-Tip Darts 3-Pack,
Toys,Crayola Neon Sidewalk Chalk 5-Pack,
Toys,Viper Billiard Master Pool Ball Set,
Toys,Viper Sure Grip Soft-Tip Darts 3-Pack,
Toys,Victory Tailgate North Carolina State University Logo Design Table Tennis Paddle,
Toys,Razor Kids' 3-Wheel Lil' Kick Scooter,
Toys,Unicorn Vanquish Electronic Dartboard,
Toys,Razor Kids' Spark Scooter,
Toys,Franklin Kids' 3 Strikes Baseball Set,
Toys,Mizerak™ Replacement Cue Ball,
Toys,12V Chevy Silverado,
Toys,NERF Rival Artemis XVII-3000 Blaster,
Toys,RollPlay Kids' 6V Porsche Macan Ride-On,
Toys,"Mizerak™ 57"" Recreational Cue Stick",
Toys,Atomic Jumpball Shootout Electronic Basketball Game,
Toys,Baden 8.5 inch Playground Ball,
Toys,Viper Chroma Sisal Dartboard,
Toys,Franklin I-Color Mini Basketball,
Toys,Big Joe Large Fuf Chair,
Toys,Little Tikes Gas 'N Go Mower,
Toys,Mizerak™ Billiard Bridgehead,
Toys,Pulse Kids' KR2 Freestyle Scooter,
Toys,Huffy Boys' Lil Cruizer Balance Bike,
Toys,Maxx Bubbles Bubble N Fun Leaf Blower,
Toys,Huffy Boys’ Kinetic 16 in Bike,
Toys,Xkites QuikRetrieve Kite Winder,
Toys,Ozone 500 Girls' Fragment 20 in 7-Speed Mountain Bike,
Toys,Maxx Bubbles Bubble N Go Mower,
Toys,Maui Toys Cosmic Hoop,
Toys,Viper Colours Wrapped In Diamonds Pool Cue Stick,
Toys,Huffy Girls' Disney Princess 12 in Bike,
Toys,KidTrax 12V Land Rover Defender Motorized Ride-On Vehicle,
Toys,Victory Tailgate Dallas Mavericks Logo Design Table Tennis Paddle,
Toys,Jetson Jupiter Mini Light-Up 3-Wheel Scooter,
Toys,Razor A3 Kick Scooter,
Toys,Franklin Sports Field Day 5-Piece Throw Down Base Set,
Toys,Fat Cat Trifold Poker Tabletop with Texas Hold'Em Chip Set,
Toys,"Maple Complete Popsicle 31"" Skateboard",
Toys,Franklin Electronic Dartboard,
Toys,Viper Sidewinder 18-Gram Darts 3-Pack,
Toys,Casemaster Plazma Dart Case,
Toys,Viper Diamond 18-Gram Soft-Tip Darts Set,
Toys,SKLZ Pro Mini Basketball Hoop System,
Toys,Superior™ Crusader Maple Billiard Cue,
Toys,GOTRAX Nova Pro Self-Balancing Hoverboard,
Toys,Triumph Tabletop Soccer Game,
Toys,NERF Rival Face Mask,
Toys,Imperial KAOS® Water Bombs 250-Pack,
Toys,"Coop Reactorz 10"" Light-Up Disc",
Toys,NERF FireVision Ignite Football,
Toys,Stiga Premium Clipper 72 in Net and Post Set,
Toys,Surge Girls' City Scooter,
Toys,Fat Cat Realtree Camo Darts Set,
Toys,Imperial Star Wars Bubble Bottles Assortment,
Toys,Viper Diamond Pool Cue Stick,
Toys,Peg Perego Polaris Ranger RZR 24 V Ride-On Vehicle,
Toys,Huffy Girls' Disney Princess 12 in Bike,
Toys,Pulse Kids' Freewheel Electric Scooter,
Toys,Stiga® Legacy Table Tennis Table,
Toys,Stiga® Flow Spin Indoor/Outdoor Table Tennis Racket,
Toys,Huffy Electric 12V Broadlawn Bubble Tractor Ride-On Toy,
Toys,RoseArt Washable Sidewalk Chalk Paint Super Set,
Toys,Mizerak Premium Hardwood Cue,
Toys,Casemaster® Ternion Dart Case,
Toys,"Baden 8.5"" Playground Ball",
Toys,Dynacraft Boys' Camo Decoy 18 in Bike,
Toys,Razor® Youth Dirt Rocket MX-500 Electric Dirt Bike,
Toys,Stiga® Tournament Series STS420 Table Tennis Table,
Toys,Triumph Sports USA Tx 120 Steel-Tip Darts 12-Pack,
Toys,Huffy Boys' Marvel 12 in Spider-Man Bike,
Toys,GOTRAX Remix Self-Balancing Hoverboard,
Toys,Razor Kids' E300 Electric Scooter,
Toys,Elkadart Tornado 18 g Tungsten Soft-Tip Darts,
Toys,Chicago Skates Kids' Pulse Roller Skates,
Toys,Stiga Blaze Table Tennis Racket,
Toys,Viper Silver Thunder 18-Gram Soft-Tip Darts 3-Pack,
Toys,Baden 10 in Kickball,
Toys,NERF N-Strike Elite SurgeFire Blaster,
Toys,"Maui Toys 4"" Camo SkyBall",
Toys,Fubbles Bubble Wand 3-Pack,
Toys,Huffy Girls' Disney Frozen 2 16 in Bike,
Toys,Franklin Sports Kids Mini Basketball Hoop,
Toys,Magna Boys' Throttle 20 in BMX Bike,
Toys,Victory Tailgate San Antonio Spurs Logo Design Table Tennis Paddle,
Toys,Peg Perego 12 V Quick Charger,
Toys,Razor Turbo Jetts,
Toys,"Triumph Sports USA 48"" 4-in-1 Swivel Table",
Toys,Viper League Pro Sisal Fiber Dartboard,
Toys,Water Sports Swim Thru Rings 3-Pack,
Toys,Ozone 500 Boys' 18 in Trixter Bike,
Toys,Elkadart Wizard 24 g Tungsten Steel-Tip Darts 3-Pack,
Toys,Razor® Kids' FLASHRIDER™ 360 Tricycle,
Toys,Rollerblade Kids' RB JR Helmet,
Toys,Viper Vault Dartboard Cabinet with Shot King Sisal Dartboard,
Toys,"Mizerak™ 57"" 2-Piece Hardwood Cue Stick",
Toys,Victory Tailgate Texas Rangers Logo Design Table Tennis Paddle,
Toys,Magna Boys' Major Damage 16 in BMX Bike,
Toys,NERF Zombie Strike Arrow Refills,
Toys,Kids' Dodge Viper SRT 12V Ride-On,
Toys,GLD Viper Hideaway Steel-Tip Dartboard Cabinet,
Toys,GLD Silver Cup Cone Chalk,
Toys,Arachnid Voyager Electronic Dartboard,
Toys,Franklin Football Target Indoor Pass Game,
Toys,Magna Girls' Jewel 12 in Bike,
Toys,Viper Black Ice Soft-Tip Darts 3-Pack,
Toys,Quest Super Cruiser Remix 36 in Longboard,
Toys,Little Tikes TotSports Easy Hit Golf Set,
Toys,Kryptonics Drop In Flag 31 in Skateboard,
Toys,Maui Toys Mickey Mouse Tic Tac Toss,
Toys,Crayola Neon Sidewalk Paint Marker,
Toys,Viper Elite Steel-Tip Darts 3-Pack,
Toys,KidTrax Toddlers' CAT Steamroller Ride-On,
Toys,Rollerblade Kids' Bladerunner Dynamo Hockey In-Line Skates,
Toys,SmarTrike Kids' 3-in-1 Magic Tricycle,
Toys,Jelly Belly BeanBoozled Spinner Jelly Bean Gift Box,
Toys,Zing Air Huntress Z-Bow,
Toys,Victory Tailgate Kansas City Royals Logo Design Table Tennis Paddle,
Toys,Fat Cat Wood Triangle Billiard Rack,
Toys,GLD Viper Slash Sisal Dartboard,
Toys,B4 Adventure Slackers Sky Board with LED Underglow,
Toys,"Kryptonics Torpedo Board 22.5"" Skateboard",
Toys,Huffy Boys' Shockwave 20 in Bike,
Toys,Casemaster Warden Zippered Dart Case,
Toys,Super Miracle® Bubbles 64 oz. Tinted Bubble Bottle Refill,
Toys,Prime Time Toys Dart Zone Powerbolt Belt Blaster,
Toys,GLD Sinister Series Pool Cue Stick,
Toys,Stiga Eclipse Table Tennis Table,
Toys,Elkadart Storm Soft-Tip Darts,
Toys,Roller Derby Men's Sting 5500 Roller Skates,
Toys,Imperial KAOS® Team Tubes Water Balloons 175-Pack,
Toys,Toysmith Multivoice Changer,
Toys,Arachnid SFA400 Advanced Series 16-Gram Soft-Tip Darts 3-Pack,
Toys,AGame 5-Game Backyard Set,
Toys,Stiga 3-Star Table Tennis Balls 6-Pack,
Toys,Casemaster® Mini Pro Dart Case,
Toys,American Legend Kensington 9 ft Shuffleboard,
Toys,Viper Diamond Soft-Tip Darts 3-Pack,
Toys,Mainstreet Classics Pennsylvania Ave Backgammon Set,
Toys,Viper Freak Soft-Tip Darts Set,
Toys,Segway E22 Ninebot eKick Electric Scooter w/ Detachable Seat,
Toys,KaZAM Kids' V2E 12 in Balance Bike,
Toys,Poolmaster Outdoor Junior Table Tennis Game,
Toys,NERF™ Modulus System Grip Blaster Upgrade Kit,
Toys,MD Sports Barrington 58 in x 30 in Foosball Table,
Toys,Fat Cat Traveling Poker Set,
Toys,NERF N-Strike Mega DoubleBreach Blaster,
Toys,Fat Cat Aluminum Dart Shafts 3-Pack,
Toys,Maxx Action Wild West Western Series Toy Cap Pistol,
Toys,Razor A5 Air Kick Scooter,
Toys,Viper Tungsten Bee 18-Gram Soft-Tip Darts 3-Pack,
Toys,Viper Comix 22-Gram Steel-Tip Darts 3-Pack,
Toys,Razor RipStik G Caster Board,
Toys,NERF Rival Apollo XV-700 Blaster,
Toys,Dynacraft Toddler Boys' Surge 6 V Little Quad Ride-On Toy,
Toys,Franklin Superskin™ Dodgeball 6-Pack,
Toys,GLD 9V DC 300mA Power Adapter,
Toys,NERF Rival Helios XVIII 700 Blaster,
Toys,Ozone 500 Girls' Shock Force 20 in Full Suspension Mountain Bike,
Toys,NERF LaserOps Pro DeltaBurst Blaster,
Toys,Huffy Toddlers' Elephant Plush 6V Electric Ride-On Toy,
Toys,Bladerunner Boys' 21 Phoenix Adjustable In-Line Skates,
Toys,Viper Sinister 16-Gram Soft-Tip Dart Set,
Toys,Dynacraft Sesame Street 6V Quad,
Toys,Spalding NBA Breakaway 180 Over-the-Door Basketball Hoop,
Toys,Razor RipStik RipSurf Caster Board,
Toys,Viper Sinister Steel-Tip Darts 3-Pack,
Toys,Best Ride On Cars 12 V Mercedes Unimog UTV,
Toys,"Franklin 22"" Rod Hockey Table",
Toys,GLD Table Soccer Balls 4-Pack,
Toys,Vision Popsicle OG Shredder 31 in Skateboard,
Toys,Magna Boys' 20 in Throttle Bike,
Toys,Franklin NHL Kids' Street Hockey Goalie and Player Stick Set,
Toys,Junk Ball Neon Bat and Ball Set,
Toys,Huffy Boys' Star Wars Mandalorian 16 in Bike,
Toys,NERF Rebelle Heartbreaker Bow,
Toys,Casemaster® Legion Aluminum Dart Case,
Toys,Mongoose Boys' Motivator 20 in Bike,
Toys,Razor® Kids' A3 Kick Scooter,
Toys,HearthSong Brick Fantasy Forts Kit,
Toys,Ozone 500 Boys' Shock Force 24 in 21-Speed Full Suspension Mountain Bike,
Toys,Life is good Girls' Cruiser 24 in Bike,
Toys,Roller Derby Slide Street Surf Sunset Beach 32 in Skateboard,
Toys,Viper Deluxe Cone Chalk Holder,
Toys,Magna Girls’ Jewel 16 in Bike,
Toys,Spalding Full Court 2-Player Arcade Basketball Game,
Toys,GOTRAX Nova Pro Chrome LED Hoverboard,
Toys,Triumph 9 ft 2-in-1 PowerGlide Shuffleboard and Bowling Game Table,
Toys,Pulse Boys' TMNT Safe Start 3-Wheel Electric Scooter,
Toys,Rec-Tek™ Accurate Aim™ Baseball Trainer,
Toys,Radio Flyer Kids' Scoot 2 Scooter,
Toys,Atomic AH800 Air Hockey Table,
Toys,Pulse Kids' 2-Wheel Folding Scooter,
Toys,PJ Masks Boys' 12 in Sidewalk Bike,
Toys,Roller Derby Girls' Flux Inline/Roller Combo Skates,
Toys,Little Tikes First Slide,
Toys,Unicorn Steel Ultracore Dart Set,
Toys,Roller Derby Slide Street Surf Maui Wowie 32 in Skateboard,
Toys,"Kryptonics 22.5"" Torpedo Board",
Toys,JEF World of Golf Kids' Plastic Golf Set,
Toys,Little Tikes Triple Play Splash T-ball Set,
Toys,Rollerblade 80 mm/82A Wheels 8-Pack,
Toys,Maui Toys Girls' Jelly Brights Hopper,
Toys,Razor DeltaWing Scooter,
Toys,Razor Kids' Tekno LED Electric Scooter,
Toys,Viper Diamond 16-Gram Soft-Tip Darts 3-Pack,
Toys,MD Sports Official Size Table Tennis Table,
Toys,Fat Cat Storm MMXI Air Hockey Table,
Toys,Mattel Phase 10 Card Game,
Toys,Huffy Boys' Disney Cars 16 in Bike,
Toys,b4 Adventure American Ninja Warrior Competition Set,
Toys,Franklin Ryan's World 8.5 in Playground Ball,
Toys,Cardinal 2-Card Deck And 5-Dice Set,
Toys,Victory Tailgate University of Kentucky Logo Design Table Tennis Paddle,
Toys,Maccabi Art Pro Ball Sports Portable Basketball Hoop,
Toys,Viper 1-Piece 52 in Hardwood Billiard Cue,
Toys,KidTrax Dodge Police Car,
Toys,Elkadart Rainbow 90 Tungsten Steel-Tip Darts 3-Pack,
Toys,Maxx Action Toy Hunting Pistol with Scope,
Toys,Mr. Bubble Light & Sound Bubble Spinner,
Toys,SmarTrike STR3 Folding Stroller Trike,
Toys,Viper Sinister Soft-Tip Darts 3-Pack,
Toys,Elkadart Black 150 Steel-Tip Darts,
Toys,Ozone 500 Boys' Malibu 24 in Cruiser Bike,
Toys,Huffy True Timber 6V Mini ATV Ride-On Toy,
Toys,Mizerak™ Soft Billiard Cue Case,
Toys,Hover-1 Adults' Beast Self-Balancing Electric Scooter,
Toys,Viper Atomic Bee 16-Gram Soft-Tip Darts 3-Pack,
Toys,Peg Perego Girls' Polaris RZR 900 12 v Ride-On Vehicle,
Toys,DMI Sports Nodor 90% Tungsten Steel-Tip Darts Set,
Toys,Kid Trax 24V Land Rover Defender,
Toys,Football Darts AFDL Official Tournament Dartboard,
Toys,Quest Sunset Cruiser 40 in Skateboard,
Toys,RollPlay Kids' 6V Mini Cooper Ride-On,
Toys,Arcade1 Up Big Buck Hunter Pro,
Toys,Franklin 1-Star 40 mm Table Tennis Balls 36-Pack,
Toys,Buzz Bee Toys Air Warriors Zenith Blaster,
Toys,Viper Metropolitan Dartboard Cabinet,
Toys,RoseArt Washable Sidewalk Chalk Paint Refill Bucket,
Toys,Roller Derby Boys' Flux In-Line/Quad Combo Skates,
Toys,Amloid 8-Piece Ultimate Bucket Set,
Toys,ESPN Fast-Line 7 ft Air-Powered Hockey Table,
Toys,Viper 797 Electronic Dartboard,
Toys,Razor Beast V6 Sport Scooter,
Toys,Shaun White Supply Co. Skateboarding Helmet L/XL,
Toys,Razor Kids' Junior T3 Scooter,
Toys,Franklin Sports Whirl Ball Arcade Game,
Toys,Roller Derby Boys' Tracer Size Adjustable Inline Skates,
Toys,Bestway The Mainframe Gamers Armchair,
Toys,Franklin Kids' Ryan's World Baseball and Glove Set,
Toys,Pulse Kids' Camo ATV Quad,
Toys,B4 Adventure Slackers 50 ft Slackline Prism Classic Set,
Toys,Peg Perego 24 V Battery,
Toys,GLD Sinister Series Pool Cue Stick,
Toys,Viper Bully Steel-Tip Darts 3-Pack,
Toys,Elkadart Black Mamba Soft-Tip Darts 3-Pack,
Toys,Atomic Classic Bumper Pool Game,
Toys,Swagtron Kids' K1 Adjustable Kick Scooter,
Toys,"Airwalk EZ Cruiser 28.5"" Skateboard",
Toys,HearthSong Kids' Tumbling Mat,
Toys,Fat Cat Volt LED Illuminated 7 foot Air Hockey Table,
Toys,Best Ride On Cars 12 V Realtree Truck,
Toys,Franklin Disney Frozen Mini Air Tech® Football,
Toys,Huffy Boys' Alpine 24 in 18-Speed Mountain Bike,
Toys,"Coop Reactorz 8"" Playground Ball",
Toys,NERF N-STRIKE ELITE 30-Dart Refill Pack,
Toys,Gazillion Power Bubble Wand,
Toys,Franklin Double Shot Hoops Pro Electronic Basketball Game,
Toys,Hover-1 Falcon-1 Hoverboard Buggy Attachment,
Toys,Razor Kids' Spark Ultra Kick Scooter,
Toys,Mobo Cruiser Kids' Mega Mini Roll-to-Ride Luxury 3-Wheel Cruiser,
Toys,Segway Ninebot Kids' 14 in Bike with Training Wheels,
Toys,RollPlay 6V Ride-On Chevy Silverado Police Truck,
Toys,Franklin Elite Pro Carbon Core Paddles 4-Player Table Tennis Set,
Toys,Schwinn Quad Steer 4x4 Wagon,
Toys,Roadmaster 34 In Steel Wagon,
Toys,Rollerblade Girls' Microblade Adjustable Fitness In-Line Skates,
Toys,b4 Adventure American Ninja Warrior Timer,
Toys,Huffy Lil Cruizer Balance Bike,
Toys,Quest Seascape Cruiser 36 in Skateboard,
Toys,Tangle NightBall LED Indoor/Outdoor Light-Up Football,
Toys,Roller Derby Light 'Em Up 45 in LED Laces,
Toys,Ozone 500 Girls' Elevate 24 in Mountain Bike,
Toys,Victory Tailgate Georgia Tech Logo Design Table Tennis Paddle,
Toys,Ball Bounce and Sport Wowza Sportball,
Toys,Franklin Sports Mini Playbook Football,
Toys,NERF Rival Zeus MXV-1200 Motorized Blaster,
Toys,Dynacraft Girls' Trolls 12 in Bike,
Toys,Minnesota Fats Quick-Lock Graphite Cue,
Toys,GOTRAX Adults' Glider Electric Kick Scooter,
Toys,Magna Girls' Girls Rule 20-inch Bike,
Toys,Swagtron Swagboard T580 Warrior Hoverboard,
Toys,Funphix Glow Rainbow Building Kit,
Toys,Funphix Create and Play Classic Construction Toy Set,
Toys,Viper Vault Cabinet Bundle,
Toys,Dynacraft Snoopy 6V Plush Ride On,
Toys,Mizerak™ Billiard Cue Ball,
Toys,Stiga® ProCarbon Table Tennis Racket,
Toys,Viper Wings 16-Gram Soft-Tip Darts 3-Pack,
Toys,Franklin 2-Player Table Tennis Paddle and Ball Set,
Toys,NSG Deluxe Archery Set,
Toys,Huffy Girls' Disney Princess 16 in Bike,
Toys,Huffy Girls' Disney Frozen 16 in Bike,
Toys,Huffy Kids' Disney Princess Electro-Light Scooter,
Toys,Viper Cold Steel Tungsten Steel-Tip Darts 3-Pack,
Toys,KENT Girls' Starshine 16 in Bike,
Toys,X-SHOT Typhoon Thunder Medium Water Blaster,
Toys,Triumph Sports USA Pro Level Hy-Mark Bristle Dartboard,
Toys,"Mikasa 8.5"" Dodgeball",
Toys,Viper Leading Edge Table Tennis Racket,
Toys,Franklin Mini Foosball Table Game,
Toys,KidTrax Girls' Disney Frozen Electric Scooter,
Toys,GOTRAX XR Ultra Commuting Electric Scooter,
Toys,Ping Pong 3 in 1 Pop Up Table Tennis Set,
Toys,Viper 2-Racket Table Tennis Set,
Toys,NERF Laser Ops Pro AlphaPoint Blaster,
Toys,Dynacraft Girls' Hello Kitty 18 in Bike,
Toys,Quest Island Sunset 42 in Longboard,
Toys,Ozone 500 Girls’ 16 in Sweetheart Bike,
Toys,Franklin Sports Ryan's World Arcade Basketball Game Set,
Toys,Huffy Girls' Sienna 24 in 7-Speed Comfort Hybrid Bike,
Toys,Atomic Azure LED Light Up Foosball Table,
Toys,Stiga Talon Table Tennis Racket,
Toys,Viper Sure Grip Soft-Tip Darts 3-Pack,
Toys,Fat Cat 3-in-1 Flip Air Hockey/Billiards/Table Tennis Game Table,
Toys,Cardinal® Giant-Size Jumbling Tower,
Toys,Razor Electric Longboard,
Toys,Mongoose Boys' Stun 18 in Bike,
Toys,Huffy Kids' Prizm 100 Inline Scooter,
Toys,PlayWheels Kids' Paw Patrol Junior Skate Combo,
Toys,Huffy Girls' Glitzy 20 in Bike,
Toys,HearthSong Backyard Kids' Yoga Set,
Toys,Epic Skates Youth Blush Roller Skates,
Toys,GLD Dimplex Dart Flights 150-Count,
Toys,Fubbles 64 oz Bottle of Bubbles,
Toys,Elkadart Titanium Tungsten Soft-Tip Darts 3-Pack,
Toys,Viper Vanity Dart Diva Steel-Tip Darts 3-Pack,
Toys,Aqua-Leisure Drencher Ball,
Toys,Viper Cold Steel Tungsten Steel-Tip Darts 3-Pack,
Toys,Nodor Supawire2 Bristle Dartboard,
Toys,Hedstrom Kids' Licensed Light-Up Ball,
Toys,Barrington Allendale Collection 56 in Foosball Table,
Toys,Superior™ Deluxe 6-Player Croquet Set,
Toys,Xkites Kids' MicroKites 12-Pack,
Toys,SmarTrike T1 Scooter,
Toys,Franklin Sports MLB Kids' Oversize Foam Baseballs 4-Pack,
Toys,Vision Mini Cruiser GNZ 28 in Skateboard,
Toys,RollPlay Toddler Boys' Camo Mini Quad 6V Ride-On,
Toys,American Legend Courtside Arcade Basketball Shootout Game,
Toys,Elkadart Lone Wolf Steel-Tip Darts,
Toys,Elkadart Wizard 20 g Tungsten Steel-Tip Darts 3-Pack,
Toys,Magna Girls' Jewel 16 in Bike,
Toys,Franklin Ryan's World Over-the-Door Mini Basketball Hoop,
Toys,Razor Jr. t3 Scooter,
Toys,SmarTrike 2-in-1 Running Bike,
Toys,Viper Clutch Pool Cue Stick,
Toys,"Lick-A-Bubble Create Flavored Bubbles, 2-pack",
Toys,Radio Flyer 4-in-1 Stroll 'N Tricycle,
Toys,Triumph Sports USA Lumen-X Light Up Gridiron Football Bag Toss Game,
Toys,Triumph Milan Foosball Table,
Toys,SmarTrike STR3 6 in 1 Folding Stroller Trike,
Toys,"Triumph Sports USA MLS 57"" Foosball Table",
Toys,Ozone 500 Girls' 20 in Slingshot Bike,
Toys,Roller Derby Boys' Stryde Size Adjustable In-Line Skates,
Toys,Funphix Princess Castle Building Kit,
Toys,Quest Tag Script 45 in Pintail Longboard,
Toys,Magna Girls' Magna Star Burst 16 in Bike,
Toys,Viper Element 18-Gram Soft-Tip Darts Set,
Toys,Yvolution Youth Neon Viper Scooter,
Toys,Hedstrom Playball,
Toys,Tangle NightBall Softball,
Toys,Huffy Toddlers' Tilt N Turn Star Wars The Child Scooter,
Toys,Viper Super Bee 16-Gram Soft-Tip Darts 3-Pack,
Toys,NERF Boys' N-Strike Mega Big Shock Blaster,
Toys,Arcade 1UP Pacman 40th Anniversary Edition Head2Head Game,
Toys,Little Tikes TotSports T-Ball Set,
Toys,Viper Sure Grip Soft-Tip Darts 3-Pack,
Toys,Maui Toys Glitter Sky Ball®,
Toys,Razor® Sweet Pea Pocket Mod Electric Scooter,
Toys,Quest Buena Karma 44 in Longboard,
Toys,Pulse Kids' KR2 Freestyle Scooter,
Toys,Quest Fishtail Cruiser 27 in Skateboard,
Toys,Xkites Kids' Star Wars™ MicroKite,
Toys,Razor® Pocket Mod Bellezza Electric Scooter,
Toys,Franklin Plastic Bat and Ball Set,
Toys,Franklin Ryan's World Air Hockey Table,
Toys,Imperial Blitz Mighty Bubble Wand,
Toys,New-Ray Toys Light and Sound Camouflage Toy Shotgun,
Toys,Unicorn Team Dart Tune-Up Accessory Kit,
Toys,Melissa & Doug Dilly Dally Target Game,
Toys,Viper 850 Electronic Dartboard,
Toys,Elkadart Orbital 16 g Soft-Tip Darts,
Toys,Air Zone Boys' Aftershock 20 in 6-Speed Mountain Bike,
Toys,NERF Zombie Strike HammerShot Blaster,
Toys,Casemaster® Quiver Dart Case,
Toys,Best Ride On Cars 12 V Realtree Sporty ATV,
Toys,Gazillion Giant Bubble Mill Bubble Machine,
Toys,Pulse Kids' California Cruiser Scooter,
Toys,Mobo Cruiser Kids' Triton 3-Wheel Cruiser,
Toys,Triumph Sports USA 13-in-1 Combo Game Table,
Toys,Viper Ranger Soft-Tip Darts Set,
Toys,RollPlay Dino Explorer 6 V SUV,
Toys,Franklin Future Champs Punching Bag and Gloves,
Toys,Viper Wind Runner 18-Gram Soft-Tip Darts 3-Pack,
Toys,Schwinn Boys' Scorch 16 in Bike,
Toys,Elkadart Prism Ringed 24 g Steel-Tip Darts 3-Pack,
Toys,Fat Cat Rebel Foosball Table,
Toys,HearthSong Inflatable Art Easel,
Toys,GLD Portable 3-in-1 Multigame Table Tennis Top,
Toys,Epic Skates Youth Princess Twilight Roller Skates,
Toys,Funphix Fort Building Kit with Glow-in-the-Dark Sticks,
Toys,Disney Princess Girls' Safe Start 3-Wheel Electric Scooter,
Toys,Maxx Bubbles Super Big Bubble Blower,
Toys,Gazillion Giant Bubble 1 Liter Bubble Solution,
Toys,Big Joe Sportsball,
Toys,Hover-1 Adults' Matrix Electric Scooter,
Toys,b4 Adventure American Ninja Warrior Race Hop Ball Set,
Toys,KidTrax Toddlers' CAT 6V Quad Ride-On,
Toys,Stiga® Table Tennis Table Conversion Top,
Toys,Professor Puzzle Giant Playing Cards,
