Sports Medicine,Zamst Elbow Band,
Sports Medicine,KT Tape Gentle Therapeutic Tape,
Sports Medicine,Pro-Tec 3-D Flat Premium Compression Elbow Sleeve,
Sports Medicine,Zamst Adults' Wrist Band,
Sports Medicine,McDavid Elite Engineered Elastic Knee Support with Dual Wrap and Stays,
Sports Medicine,KT Tape Original Precut Strips 20-Pack,
Sports Medicine,RumbleRoller Beastie Xtra Firm Massage Peanut,
Sports Medicine,Cramer 2 in Eco-Flex Stretch Tape 24-Pack,
Sports Medicine,McDavid Active Comfort Compression Ankle Sleeve,
Sports Medicine,Biofreeze Topical Roll-On Pain Reliever,
Sports Medicine,Trigger Point CHARGE VIBE Vibrating Massage Roller,
Sports Medicine,DonJoy Performance Defender Elbow Pads,
Sports Medicine,RumbleRoller Midsize Original Deep-Tissue Massage Roller,
Sports Medicine,BCG Neoprene Thigh Support,
Sports Medicine,McDavid Adults' Hex Leg Sleeves,
Sports Medicine,Cramer Eco-Flex Stretch Self-Stick Tape,
Sports Medicine,Hyperice Sport Right Shoulder Ice Compression Device,
Sports Medicine,Cramer Athletic Tape,
Sports Medicine,BCG Neoprene Knee Support,
Sports Medicine,Pro-Tec ORB Extreme Mini 3 in Myofascial Release Ball,
Sports Medicine,Battle Turf Tape,
Sports Medicine,"GoFit Pro 36"" Foam Roll",
Sports Medicine,Trigger Point Universal Massage Roller,
Sports Medicine,BCG Fitness Foam Roller,
Sports Medicine,"Trigger Point 36"" CORE Foam Roller",
Sports Medicine,McDavid Hex™ Kids' Knee/Elbow Sleeves,
Sports Medicine,McDavid HyperBlend Knee Sleeve with Gel and Stay,
Sports Medicine,McDavid Adults' Elastic Bandage,
Sports Medicine,"Cramer 2"" Self-Stick Stretch Athletic Tape",
Sports Medicine,Pro-Tec 3-D Flat Premium Calf Support,
Sports Medicine,Southern Sport Sublimated Arm Sleeve,
Sports Medicine,Copper Fit Adults' Elbow Sleeve,
Sports Medicine,McDavid Dual Band Elbow Support,
Sports Medicine,BCG Elastic Knee Support,
Sports Medicine,DonJoy Performance Compex LT TENS Unit,
Sports Medicine,BCG Dual Peanut Massager,
Sports Medicine,McDavid X Fitness Arm Sleeves,
Sports Medicine,Cramer Athletic Tape 6-Pack,
Sports Medicine,Compex Performance Men's Bionic Knee Brace,
Sports Medicine,KT Tape Elastic Athletic Tape,
Sports Medicine,MISSION VaporActive Cooling Skullcap,
Sports Medicine,Zamst Adults' SK-1 Knee Brace,
Sports Medicine,MISSION Men's VaporActive Dwyane Wade Flash Arm Sleeves,
Sports Medicine,Trigger Point NANO LTE Foot Roller,
Sports Medicine,MISSION Men's VaporActive Long Sleeve Baselayer Top,
Sports Medicine,Cramer Athletic Tape,
Sports Medicine,MISSION HydroActive Fitness Multicool Headwear,
Sports Medicine,Trigger Point AcuCurve Massage Cane,
Sports Medicine,MISSION Max Plus Cooling Towel,
Sports Medicine,Pro-Tec Adults' Gel-Force Ankle Support,
Sports Medicine,BODYGLIDE® Original Anti-Chafe Balm,
Sports Medicine,McDavid Elite Compression Recovery Calf Sleeves,
Sports Medicine,McDavid HyperBlend Elbow Sleeve,
Sports Medicine,Zamst Adults' A2-DX Ankle Brace,
Sports Medicine,McDavid HyperBlend Knee Sleeve,
Sports Medicine,Cramer Instant Cold Pack,
Sports Medicine,McDavid Adults' Ankle Brace with Straps,
Sports Medicine,Cramer Athletic Tape,
Sports Medicine,Nike Elbow Sleeve,
Sports Medicine,DonJoy Performance Bionic Reel-Adjust Wrist Brace,
Sports Medicine,DonJoy Performance Bionic Fullstop Knee Brace,
Sports Medicine,McDavid Adults' Compression Arm Sleeves 2-Pack,
Sports Medicine,McDavid Hex Leg Sleeves,
Sports Medicine,McDavid Adults' Level 2 Knee Strap,
Sports Medicine,Venture Products Safe and Sound Light-Up Heel Clip,
Sports Medicine,Zamst Adults' Shoulder Wrap,
Sports Medicine,DonJoy Performance Bionic Stirrup Right Ankle Brace,
Sports Medicine,KT Tape Blister Prevention Tape,
Sports Medicine,PainCakes Mini Stickable Cold Packs 2-Pack,
Sports Medicine,McDavid HyperBlend Ankle Sleeve,
Sports Medicine,Trigger Point GRID Foam Roller,
Sports Medicine,Pro-Tec Ice-Up Portable Ice Massager,
Sports Medicine,PHUEL Topical Muscle Nutrition Foam,
Sports Medicine,MISSION DuoMax Cooling Towel,
Sports Medicine,DonJoy Performance Bionic Drytex Knee Sleeve,
Sports Medicine,McDavid Dual Compression™ Ankle Sleeve,
Sports Medicine,McDavid Adults' uCool Compression Leg Sleeves 2-Pack,
Sports Medicine,McDavid Adults' Elastic Wrist Support,
Sports Medicine,Omron electroTHERAPY Long-Life Pads 2-Pack,
Sports Medicine,MISSION VaporActive Cooling Lockdown Headband,
Sports Medicine,DonJoy Performance Bionic Stirrup Left Ankle Brace,
Sports Medicine,Pro-Tec Shin Splints Compression Wrap,
Sports Medicine,GoFit Guide Roller,
Sports Medicine,RumbleRoller Deep Tissue Foam Roller,
Sports Medicine,Copper Fit Small/Medium Ice Knee Sleeve,
Sports Medicine,BCG Ice Bag,
Sports Medicine,McDavid Adults' Knee Support with Stays and Cross Straps,
Sports Medicine,McDavid Level 2 Elbow Support,
Sports Medicine,McDavid Adults' Recovery Knee Sleeve,
Sports Medicine,ASICS® Super Sleeve™ Knee Brace,
Sports Medicine,Gaiam Adjustable Massage Roller,
Sports Medicine,DonJoy Performance Defender Knee Pads,
Sports Medicine,Pro-Tec Ankle Support Wrap,
Sports Medicine,Impex Bionic Body Massage Ball,
Sports Medicine,MISSION Men's VaporActive Arm Sleeves,
Sports Medicine,GoFit Double Thick Plus XL Extreme Massage Bar,
Sports Medicine,BCG Elastic Elbow Support,
Sports Medicine,McDavid Adults' Thumb Stabilizer,
Sports Medicine,McDavid Adults' Sports Med Compression Arm Sleeves,
Sports Medicine,TheraBand Massage Roller,
Sports Medicine,SKLZ Cold Roller Ball,
Sports Medicine,"Tiger Tail Classic 18"" Massage Stick",
Sports Medicine,McDavid Adults' Elite Engineered Elastic Knee Support with Dual Wrap and Stays,
Sports Medicine,McDavid Level 1 Elastic Knee Sleeve,
Sports Medicine,Zamst Adults' ZW-7 Back Brace,
Sports Medicine,Copper Fit Rapid Relief Ankle and Foot Wrap,
Sports Medicine,Cramer Underwrap 3-pack,
Sports Medicine,GoFit Polar Roll-On Massager,
Sports Medicine,DonJoy Performance TRIZONE Left Knee Brace,
Sports Medicine,DonJoy Performance Men's Anaform Shin Splint Sleeve,
Sports Medicine,"GoFit 18"" Massage Roller",
Sports Medicine,MISSION EnduraCool Half Multicool Towel,
Sports Medicine,"Trigger Point 18"" CORE Foam Roller",
Sports Medicine,Copper Fit Pro Series Knee Sleeve,
Sports Medicine,McDavid Adults' Multi-Action Knee Strap,
Sports Medicine,Trigger Point GRID STK Foam Roller,
Sports Medicine,McDavid Adults' Ankle Support,
Sports Medicine,BODYGLIDE® For Her™,
Sports Medicine,MISSION HydroActive Fitness Multi-Cool Cooling Neck Gaiter,
Sports Medicine,Copper Fit Rapid Relief Back Wrap,
Sports Medicine,McDavid Adults' TEFLX™ Leg Sleeves/Pair,
Sports Medicine,Pro-Tec 3-D Flat Premium Ankle Support,
Sports Medicine,BODYGLIDE® Antichafe Balm,
Sports Medicine,O'Keeffe's Lip Repair SPF 35 Lip Balm,
Sports Medicine,"Pro-Tec 22"" Roller Massager",
Sports Medicine,McDavid uCool™ Headband,
Sports Medicine,Trigger Point NANO X Foot Roller,
Sports Medicine,Nike 22 oz Large Bottle Belt,
Sports Medicine,McDavid Phantom Ankle Brace with Straps and Flex-Support Stays,
Sports Medicine,SKLZ AccuStick Massage Tool,
Sports Medicine,Pro-Tec RM Extreme Mini Roller Massager,
Sports Medicine,McDavid Adults' Hex™ Technology Leg Sleeves,
Sports Medicine,McDavid Adults' Universal Back Support Back Brace,
Sports Medicine,BCG Targeted Compression Calf Sleeves 2-Pack,
Sports Medicine,MISSION EnduraCool Cooling Microfiber Towel,
Sports Medicine,Reebok Distance Waist Belt,
Sports Medicine,Pro-Tec Wrist Wrap Support,
Sports Medicine,Pro-Tec Hot/Cold Therapy Wrap,
Sports Medicine,McDavid Adults' 4-Way Elastic Back Support,
Sports Medicine,Harbinger Adults' Red Line Knee Wraps,
Sports Medicine,BCG Textured Foam Roller with Caps,
Sports Medicine,BCG High-Density Foam Roller,
Sports Medicine,KT Tape Elastic Athletic Tape,
Sports Medicine,Mizuno Adults' DXS2 Left Ankle Brace,
Sports Medicine,McDavid Adults' TEFLX™ Dual Density Volleyball Knee/Elbow Pads 2-Pack,
Sports Medicine,McDavid Adults' TEFLX™ 3/4 Length Tight,
Sports Medicine,BCG Posture Corrector,
Sports Medicine,BCG Illuminated Massager,
Sports Medicine,HumanX by Harbinger Adults' Stabilizer Knee Sleeve,
Sports Medicine,BCG Hot/Cold Pack,
Sports Medicine,Cramer Cold Shoulder Wrap,
Sports Medicine,McDavid Adults' Hex Leg Sleeves,
Sports Medicine,ASICS® Jr. GEL® Knee Brace,
Sports Medicine,Copper Fit Rapid Relief Knee Wrap,
Sports Medicine,Copper Fit Ice Elbow Sleeve,
Sports Medicine,McDavid Adults' Ankle Sleeve,
Sports Medicine,DonJoy Performance Bionic Comfort Hinged Knee Brace,
Sports Medicine,McDavid Bio-Logix Left Knee Brace,
Sports Medicine,GoFit Body Fat Caliper,
Sports Medicine,BCG Soothing Massage Bar,
Sports Medicine,Nike Inflatable Recovery Ball,
Sports Medicine,PlayMakar Pro Wireless Electrical Muscle Stimulator,
Sports Medicine,GoFit Polar Roll-On Massager,
Sports Medicine,MISSION HydroActive Max Cinched Reversible Cooling Headband,
Sports Medicine,Nike Cooling Towel,
Sports Medicine,McDavid Adults' Level 2 Ankle Support,
Sports Medicine,BCG Shoulder Wrap with 2 Hot/Cold Packs,
Sports Medicine,McDavid Adjustable Groin Wrap,
Sports Medicine,RumbleRoller Beastie® X-Firm Massage Ball,
Sports Medicine,Gaiam Relax Lower Back Wrap,
Sports Medicine,MISSION Cooling Techknit Towel,
Sports Medicine,Shock Doctor Adults' Ice Recovery Shoulder Compression Wrap,
Sports Medicine,RumbleRoller Beastie® Double-Track Wall System,
Sports Medicine,KT Tape Blister Treatment Patches,
Sports Medicine,Pro-Tec Ice/Cold Therapy Wrap,
Sports Medicine,McDavid Adults' uCool Compression Arm Sleeves,
Sports Medicine,McDavid Lightweight Ankle Brace,
Sports Medicine,MISSION Men's RadiantActive Performance Headband,
Sports Medicine,PlayMakar Pro Pod Wraps for Arms and Legs 2-Pack,
Sports Medicine,BCG Multi Hot/Cold Wrap,
Sports Medicine,"Cramer 3"" Self Stick Blister",
Sports Medicine,McDavid Adults' Elite Engineered Elastic™ Achilles Tendon Sleeve with Gel Buttress,
Sports Medicine,RumbleRoller Firm Deep Tissue Foam Roller,
Sports Medicine,"GoFit 18"" Foam Roller",
Sports Medicine,Tiger Balm Pain-Relieving Patches 5-Pack,
Sports Medicine,McDavid uCool™ Wristband,
Sports Medicine,Pro-Tec 3-D Flat Premium Knee Support,
Sports Medicine,Trigger Point NANO Foot Roller,
Sports Medicine,McDavid Adults' PS II Hinged Knee Brace,
Sports Medicine,MISSION EnduraCool Yoga Tech Knit Cooling Towel,
Sports Medicine,Biofreeze Large Patches 5-Pack,
Sports Medicine,RumbleRoller Beastie® Massage Ball Set,
Sports Medicine,Gaiam Relax Neck and Shoulder Wrap,
Sports Medicine,Impex Bionic Body Rechargeable Vibrating Massage Roller,
Sports Medicine,Gaiam Restore Hand Therapy Kit,
Sports Medicine,BODYGLIDE Foot Glide Anti-Blister Balm,
Sports Medicine,Pro-Tec Knee Patellar Tendon Strap,
Sports Medicine,Pro-Tec Hollow Core High-Density Foam Roller,
Sports Medicine,DonJoy Performance POD Right Ankle Brace,
Sports Medicine,McDavid Adults' Knee Brace with Polycentric Hinges and Cross Straps,
Sports Medicine,Pro-Tec RM Extreme Contoured Roller Massager,
Sports Medicine,McDavid Ligament Knee Support,
Sports Medicine,DonJoy Performance Men's Bionic Left Ankle Brace,
Sports Medicine,BCG Vibrating Foam Roller,
Sports Medicine,BCG Textured Foam Roller,
Sports Medicine,GoFit GoTape,
Sports Medicine,Pro-Tec ORB Extreme Massage Ball,
Sports Medicine,RumbleRoller Beastie® Original Massage Ball,
Sports Medicine,DonJoy Performance Bionic Back Support,
Sports Medicine,McDavid Adults' Arm Sleeves 2-Pack,
Sports Medicine,DonJoy Performance ANAFORM Shin Splint Sleeve,
Sports Medicine,Copper Fit Men's Copper-Infused Knee-High Compression Socks,
Sports Medicine,DonJoy Performance Anaform PinPoint Knee Strap,
Sports Medicine,McDavid Kids' Hex™ Leg Sleeve,
Sports Medicine,Trigger Point GRID Ball Foam Massage Ball,
Sports Medicine,McDavid Carpal Tunnel Wrist Support,
Sports Medicine,Cramer Athletic Tape Kit,
Sports Medicine,McDavid Adults' Knee Support with Stays,
Sports Medicine,McDavid Adults' HEX TUF Shin/Knee/Elbow Pads,
Sports Medicine,Zamst JK-2 Knee Brace,
Sports Medicine,Pro-Tec Adults' Arch Support,
Sports Medicine,Aduro Products Foot Massage Roller,
Sports Medicine,McDavid Level 1 Elastic Elbow Sleeve,
Sports Medicine,Zamst ZK-X Knee Brace,
Sports Medicine,KT Tape Original Precut Elastic Athletic Tape 20-Strip Pack,
Sports Medicine,McDavid 30 yd Underwrap 2-Pack,
Sports Medicine,McDavid Elite Elastic Knee Sleeve with Gel Buttress and Stays,
Sports Medicine,KT Tape Elastic Athletic Tape,
Sports Medicine,BCG Targeted Compression Knee Sleeve,
Sports Medicine,GoFit Adults' Regular Pink Neoprene Waist Trimmer,
Sports Medicine,McDavid 10 yd Athletic Tape 2-Pack,
Sports Medicine,Zamst JK Band,
Sports Medicine,McDavid Adults' Sports Med Double-Wrap Knee Support,
Sports Medicine,Shock Doctor Shoulder Support with Stability Strap Brace,
Sports Medicine,Trigger Point MobiPoint Massage Ball,
Sports Medicine,RumbleRoller Gator Massager,
Sports Medicine,DonJoy Performance Trizone Tennis/Golf Elbow Sleeve,
Sports Medicine,Trigger Point Impact Handheld Percussive Device,
Sports Medicine,Trigger Point Grid Vibe Plus Foam Roller,
Sports Medicine,DonJoy Performance Coldform Shoulder Wrap,
Sports Medicine,BCG Copper Compression Socks,
Sports Medicine,RumbleRoller X-Firm Foam Roller,
Sports Medicine,Pro-Tec Adults' PF Sleeve for Plantar Fasciitis,
Sports Medicine,BCG Adjustable Tension Massager,
Sports Medicine,GoFit Foot and Hand Massage Roller,
Sports Medicine,Gaiam Restore Marbled Foam Roller,
Sports Medicine,Pro-Tec IT Band Compression Wrap,
Sports Medicine,McDavid Ankle Sleeve,
Sports Medicine,MISSION Cooling Classic Headband,
Sports Medicine,GoFit Extreme Massage Bar,
Sports Medicine,Cramer Athletic Tape,
Sports Medicine,McDavid Level 3 Dual-Disk Knee Brace,
Sports Medicine,Theragun Prime Massager,
Sports Medicine,McDavid Adults' Versatile Knee Wrap with Stays,
Sports Medicine,McDavid Adult's Elbow Sleeve,
Sports Medicine,McDavid Adults' Sports Med 4-Way Elastic Elbow Support,
Sports Medicine,McDavid Adults' Knee Brace with Polycentric Hinges,
Sports Medicine,MISSION Lite Knit Cooling Towel,
Sports Medicine,Mizuno Adults' DXS2 Right Ankle Brace,
Sports Medicine,Shock Doctor Adults' Ice Recovery Ankle Compression Wrap,
Sports Medicine,McDavid Adults' Ankle Support,
Sports Medicine,KT Tape Pro Precut Strips 20-Pack,
Sports Medicine,Trigger Point STK GRIP Handheld Massage Roller,
Sports Medicine,Zamst Adults' A1 Ankle Brace,
Sports Medicine,GoFit Polar Roller,
Sports Medicine,KT Tape KT Recovery+ Time-Release Pain Roll-On Gel,
Sports Medicine,PlayMakar Pro Pod Wrap for Back and Abs,
Sports Medicine,Cramer Tape Underwrap,
Sports Medicine,BCG Copper Compression Elbow Sleeve,
Sports Medicine,KT Tape Pro Precut Strips 20-Pack,
Sports Medicine,BCG Wrist Brace,
Sports Medicine,Copper Fit  Knee-High Compression Socks,
Sports Medicine,McDavid Adults' mmHg Recovery Arm Sleeves 2-Pack,
Sports Medicine,MISSION EnduraCool Instant Cooling Towel,
Sports Medicine,BCG Arm Compression Sleeves,
Sports Medicine,Gaiam Restore Hot/Cold Foot Roller,
Sports Medicine,Zamst Thumb Guard,
Sports Medicine,Powerstep UltraStretch Night Sock,
Sports Medicine,BCG Adjustable Wrist Support,
Sports Medicine,Battle Adults' Xfast Ankle Support System,
Sports Medicine,BCG Copper Compression Ankle Sleeve,
Sports Medicine,Gaiam Pressure Point Massage Roller,
Sports Medicine,Muscle Rehab 29 oz Bath Soak for Athletes,
Sports Medicine,Shock Doctor Adults' Elite SVR Compression Recovery Calf Sleeves 2-Pack,
Sports Medicine,Century Men's Compression Tight,
Sports Medicine,McDavid Adults' mmHg Calf Sleeves,
Sports Medicine,Nike Recovery Ball,
Sports Medicine,BCG Targeted Compression Wrist Sleeve,
Sports Medicine,McDavid Compression Calf Sleeves 2-Pack,
Sports Medicine,Copper Fit Adults' Knee Sleeve,
Sports Medicine,McDavid Adults' Neoprene Short,
Sports Medicine,MISSION Adults' Instant Cooling Bandana,
Sports Medicine,Stamina® BackTrac Back Massager,
Sports Medicine,Trigger Point Grid 1.0 Foam Roller,
Sports Medicine,Zamst Adults' A1 Ankle Brace,
Sports Medicine,BCG Copper Compression Knee Sleeve,
Sports Medicine,Shock Doctor Adults' Compression Knit Elbow Sleeve with Gel Support,
Sports Medicine,MISSION HydroActive MAX Cooling Towel,
Sports Medicine,"MISSION EnduraCool 3"" Reversible Cooling Headband",
Sports Medicine,Gaiam Restore Textured Foam Roller,
Sports Medicine,Venture Products Safe and Sound Reflective Band,
Sports Medicine,Trigger Point GRID VIBE Vibrating Foam Roller,
Sports Medicine,BCG Adjustable Ankle Support,
Sports Medicine,BCG Neoprene Knee Brace,
Sports Medicine,Cramer AS1 Pro Ankle Brace,
Sports Medicine,Copper Fit Energy Plus Hydrating Compression Socks,
Sports Medicine,Lifeline Hand Renewal Set,
Sports Medicine,McDavid Adults' TEFLX Leg Sleeves,
Sports Medicine,McDavid Bio-Logix Right Ankle Brace,
Sports Medicine,Pro-Tec Gel-Force Knee Support,
Sports Medicine,McDavid Youth HEX™ Leg Sleeves 2-Pack,
Sports Medicine,MISSION HydroActive Max Fitness Multi-Cool Cooling Neck Gaiter,
Sports Medicine,Cramer Athletic Tape,
Sports Medicine,Pro-Tec 3-D Flat Premium Calf Support,
Sports Medicine,Gaiam Restore Cold Therapy Total Body Massager,
Sports Medicine,Cramer Athletic Tape 2-Pack,
Sports Medicine,DonJoy Performance Men's Bionic Right Ankle Brace,
Sports Medicine,Hyperice Pro Knee Ice Compression Device,
Sports Medicine,McDavid Adults' Thermal Shoulder Wrap with Hot-Cold Gel Packs,
Sports Medicine,Zamst ZK-1 Knee Brace,
Sports Medicine,McDavid Adults' Compression Calf Sleeves 2-Pack,
Sports Medicine,GoFit Polar Foot and Hand Roller,
Sports Medicine,PlayMakar PRO Self Adhering Electrode Pads,
Sports Medicine,GoFit GoStretch,
Sports Medicine,DonJoy Performance Adults' Deluxe Knit Knee Sleeve,
Sports Medicine,McDavid Adults' Ultralight Ankle Brace with Strap,
Sports Medicine,DonJoy Performance POD Left Ankle Brace,
Sports Medicine,DonJoy Performance Men's Trizone Ankle Support,
Sports Medicine,McDavid Adults' ELITE Engineered Elastic Knee Sleeve with Gel Buttress and Stays,
Sports Medicine,BCG Adjustable Knee Brace,
Sports Medicine,McDavid Dual Compression™ Knee Sleeve,
Sports Medicine,MISSION Hydro Active Microfiber USA Flag Towel,
Sports Medicine,Nathan SaferRun Ripcord Siren Personal Alarm,
Sports Medicine,MISSION HydroActive Premium 10 in x 13 in Cooling Towel,
Sports Medicine,GoFit Muscle Pain Management Thermal Roll-On Massager,
Sports Medicine,Powerstep Plantar Fasciitis Support Sleeve,
Sports Medicine,DonJoy Performance Coldform Knee Wrap,
Sports Medicine,GoFit GoBall Targeted Massage Ball,
Sports Medicine,Trigger Point STK Contour Flexible Massage Stick,
Sports Medicine,BCG Neoprene Ankle Support,
Sports Medicine,BCG Open Patella Knee Support,
Sports Medicine,McDavid Adults' True Ice Therapy Shoulder Wrap,
Sports Medicine,Copper Fit Small Ice Gloves,
Sports Medicine,Cramer Coach's First Aid Kit 102-Pieces,
Sports Medicine,DonJoy Performance Anaform Lace-Up Ankle Brace,
Sports Medicine,McDavid Waist Trimmer,
Sports Medicine,Gaiam Restore Deep Tissue Massage Roller,
Sports Medicine,McDavid Active Comfort Compression Elbow Sleeve,
Sports Medicine,Gaiam Restore Hot and Cold Neck Cradle,
Sports Medicine,McDavid Bio-Logix Right Knee Brace,
Sports Medicine,Muscle Rehab 16 oz Bath Bombs for Athletes,
Sports Medicine,Theragun Wave Solo,
Sports Medicine,McDavid Adults' Waist Trimmer,
Sports Medicine,Cramer Eco-Flex Stretch Self-Stick Tape,
Sports Medicine,Theragun Supersoft Attachment,
Sports Medicine,Copper Fit Back Pro Adjustable Back Support,
Sports Medicine,Zamst ZK-7 Knee Brace,
Sports Medicine,2Toms SportShield For Her 1.5 oz Antichafe Roll On,
Sports Medicine,MISSION Men's VaporActive Legging,
Sports Medicine,Zamst Adults' A2-DX Ankle Brace,
Sports Medicine,DonJoy Performance TRIZONE Right Knee Brace,
Sports Medicine,Trigger Point STK Target Massage Bar,
Sports Medicine,McDavid Adults' Freelastics Knee Sleeve,
Sports Medicine,HoMedics Thera-P Shiatsu Massage Pillow with Heat,
Sports Medicine,Trigger Point CHARGE Foam Roller,
Sports Medicine,KT Tape Pro Extreme Precut Strips 20-Pack,
Sports Medicine,Zamst Adults' Ice Bag,
Sports Medicine,McDavid Elite Engineered Elastic Ankle Brace,
Sports Medicine,BCG Neoprene Calf Support,
Sports Medicine,BCG Adjustable Shoulder Wrap with Hot/Cold Packs,
Sports Medicine,Cramer 3 in Eco-Flex Stretch Tape 16-Pack,
Sports Medicine,McDavid Adults' Elastic Ankle Support,
Sports Medicine,Pro-Tec Arch Support,
Sports Medicine,Trigger Point Grid Travel Foam Roller,
Sports Medicine,DonJoy Performance Anaform Compression Thigh Sleeve,
Sports Medicine,DonJoy Performance ANAFORM Closed Patella Knee Sleeve,
Sports Medicine,Cramer Flexi-Cold Reusable Cold Pack,
Sports Medicine,McDavid Adults' TEFLX Knee/Elbow/Shin Pads,
Sports Medicine,McDavid Level 2 Knee Support,
Sports Medicine,McDavid Elite Engineered Elastic Knee Brace with Dual Wrap and Hinges,
Sports Medicine,McDavid Elite Engineered Elastic Ankle Brace with Figure-6 Strap and Stays,
Sports Medicine,McDavid Adults' Thigh High Rebound Compression Socks,
Sports Medicine,Trigger Point CORE Mini 12 in Foam Roller,
Sports Medicine,KT Tape Pro Precut Elastic Athletic Tape 20-Strip Pack,
Sports Medicine,GoFit Trigger Ballx2,
Sports Medicine,McDavid Adults' True Ice Therapy Ankle Wrap,
Sports Medicine,Gaiam Restore Spine Align Dual Massage Roller,
Sports Medicine,Copper Fit Pro Series Elbow Sleeve,
Sports Medicine,RumbleRoller Beastie Bar™ Muscle Massager,
Sports Medicine,GoFit Polar Bar,
Sports Medicine,O'Keeffe's Working Hands Cream 3.4 oz Jar,
Sports Medicine,Dr. Cool Adults' Ice and Compression Small Recovery Wrap,
Sports Medicine,KT Tape Original Precut Elastic Athletic Tape 20-Strip Pack,
Sports Medicine,McDavid Multiaction Knee Wrap,
Sports Medicine,DonJoy Performance Compex TENS/Heat Knee Wrap,
Sports Medicine,"Cramer 2"" Self-Stick Tape",
Sports Medicine,DonJoy Performance Webtech Elbow Strap,
Sports Medicine,McDavid Adults' Recovery Elbow Sleeve,
Sports Medicine,McDavid Adults' Knee Sleeve,
Sports Medicine,GoFit Adults' GoSlim Leg Slimmers,
Sports Medicine,Tiger Balm Ultra-Strength Pain-Relieving Ointment,
Sports Medicine,Gaiam Restore Deep Tissue Foam Roller,
Sports Medicine,BCG Lace-Up Ankle Brace,
Sports Medicine,DonJoy Performance Anaform Tennis/Golf Elbow Strap,
Sports Medicine,"Cramer 3"" Self Stick Blister",
Sports Medicine,TheraBand Foot Roller,
Sports Medicine,Everlast™ F.I.T. Massage Belt,
Sports Medicine,DonJoy Performance Coldform Back Wrap,
Sports Medicine,RumbleRoller Midsize Extra Firm Deep Tissue Massage Roller,
Sports Medicine,McDavid Adults' Level 2 Ankle Sleeve,
Sports Medicine,GoFit Muscle Hook,
Sports Medicine,Nike Adults' Intensity Knee Sleeves 2-Pack,
Sports Medicine,Shock Doctor Adults' Ice Recovery Gel Packs 3-Pack,
Sports Medicine,Gaiam Restore Vibrating Foot Roller,
Sports Medicine,DonJoy Performance Men's Webtech Knee Brace,
Sports Medicine,DonJoy Performance WEBTECH Short Knee Brace,
Sports Medicine,DonJoy Performance Bionic Speed-Wrap Ankle,
Sports Medicine,McDavid Elite Compression Recovery Socks,
Sports Medicine,GoFit Muscle Pain Management GoVibe Accu-Massager,
Sports Medicine,Reebok Sprint Storage Belt,
Sports Medicine,BCG Back Support with Hot/Cold Packs,
Sports Medicine,Nike Small Handheld Flask,
Sports Medicine,Copper Fit Pro Series Ankle Sleeve,
Sports Medicine,McDavid Primary Protection Open Patella Knee Support,
Sports Medicine,Trigger Point GRID 2.0 Foam Roller,
Sports Medicine,McDavid Adults' Level 2 Knee Sleeve,
Sports Medicine,Trigger Point Handheld Massage Ball,
Sports Medicine,Lifeline 23 in Progression Foam Roller,
Sports Medicine,Theragun Elite Percussive Massage Therapy Device,
Sports Medicine,McDavid Adults' Deluxe Calf Support,
Sports Medicine,SKLZ Trigger Strap,
Sports Medicine,McDavid uCool Cooling Towel,
Sports Medicine,Aurora Vibrating Foam Roller Massager,
Sports Medicine,DonJoy Performance BIONIC Elbow Brace,
Sports Medicine,DonJoy Performance ANAFORM Open Patella Knee Sleeve,
Sports Medicine,Shock Doctor Runner's Therapy Shin Splint Sleeve,
Sports Medicine,DonJoy Performance Adults' Bionic Elastic Wrist Brace,
Sports Medicine,Trigger Point STK Sleek Massage Stick,
Sports Medicine,Theragun Wave Duo,
Sports Medicine,Cramer Athletic 10 yds Athletic Tape,
Sports Medicine,Hot Dot Alert Patches 6-Pack,
Sports Medicine,GoFit Adults' Full Pink Neoprene Waist Trimmer,
Sports Medicine,BCG Targeted Compression Ankle Sleeve,
Sports Medicine,KT Tape Pro Wide Therapeutic Tape,
Sports Medicine,Nike Recovery Ball,
Sports Medicine,McDavid Adults' Compression Arm Sleeves 2-Pack,
Sports Medicine,DonJoy Performance Trizone Elbow Sleeve,
Sports Medicine,Gaiam Restore Performance Massager,
Sports Medicine,McDavid uCool Ultra Cooling Towel,
Sports Medicine,Zamst Filmsta Wrist Brace,
Sports Medicine,BODYGLIDE Original Anti-Chafe Balm,
Sports Medicine,PlayMakar Pro Expandable Wireless Receiver Pods,
Sports Medicine,DonJoy Performance WEBTECH Knee Strap,
Sports Medicine,McDavid Vow Versatile Stays & Straps Over Knee Wrap,
Sports Medicine,Trigger Point Deep Tissue Massage Ball,
Sports Medicine,Venture Products Safe and Sound Light-Up Safety Bands 2-Pack,
Sports Medicine,McDavid Adults' True Ice Therapy Knee/Leg Wrap,
Sports Medicine,Cramer 10-yard Athletic Tape 2-Pack,
Sports Medicine,McDavid Adults' True Ice Therapy Back/Ribs Wrap,
Sports Medicine,Fairtex Adults' Ankle Supports,
Sports Medicine,Zamst Adults' ZK-7 Knee Brace,
Sports Medicine,BCG Adjustable Elbow Support,
Sports Medicine,McDavid Underwrap Box 2-Pack,
Sports Medicine,PainCakes Full-Size Stickable Cold Pack,
Sports Medicine,2Toms SportShield 1.5 oz Antichafe Roll-On,
Sports Medicine,Pro-Tec 3-D Flat Premium Compression Wrist Support,
Sports Medicine,"GoFit Extreme 13"" Massage Roller",
Sports Medicine,BCG Tennis Elbow Band,
Sports Medicine,McDavid Calf Sleeves 2-Pack,
Sports Medicine,McDavid Bio-Logix Left Ankle Brace,
Sports Medicine,Shock Doctor Adults' SVR Recovery Compression Calf Sleeves,
Sports Medicine,McDavid Knee Sleeve,
Sports Medicine,MISSION Matrix Camo Bearing Sea Cooling Towel,
