Dog Supplies,D. T. Systems Super-Pro™ Series Dummy Launcher with Dummy,
Dog Supplies,Remington 3 in x 12 in Canvas Dummy,
Dog Supplies,Scott Pet Big Sky Medium Antler Rope Toy,
Dog Supplies,Carhartt Nylon Duck Travel Dog Bowl,
Dog Supplies,PetSafe® Basic Bark Control Collar,
Dog Supplies,Eyenimal 450 Remote Trainer Collar,
Dog Supplies,Carhartt Training Retrieving Bumper Dog Toy,
Dog Supplies,D. T. Systems Small Canvas Puppy Training Dummy,
Dog Supplies,Motorola Shock-Free No-Bark Dog Collar,
Dog Supplies,Nite Ize Meteorlight K-9 LED Dog Ball,
Dog Supplies,"Aspen Pet 36"" x 24"" 8-Panel Exercise Pen",
Dog Supplies,Solvit Waterproof Sta-Put™ Bucket Seat Cover,
Dog Supplies,Grillerz Natural Treats Bronto Bone,
Dog Supplies,Nite Ize PetLit LED Collar Light,
Dog Supplies,Dallas Manufacturing Company Bone and Blanket Pet Gift Set,
Dog Supplies,Browning Classic Webbing Camo Collar,
Dog Supplies,Dogtra ARC Dog Training Collar,
Dog Supplies,Aspen Pet Prong Training Collar,
Dog Supplies,PetSafe Stubborn Dog Receiver Collar,
Dog Supplies,Bow Wow Pet Holiday Printed Stocking Chew Dog Toy,
Dog Supplies,Aspen Pet Large Webbed Retractable Leash,
Dog Supplies,Kurgo Zippy Bowl,
Dog Supplies,Carhartt Nylon Duck Dog Collar,
Dog Supplies,Kurgo Small Journey Air Harness,
Dog Supplies,Hyper Pet™ Real Skinz™ Opossum Dog Toy,
Dog Supplies,Browning Neoprene Dog Vest,
Dog Supplies,SportDOG Brand FieldTrainer 425XS Remote Trainer,
Dog Supplies,Dogtra T&B Dual 1-Dog E-Collar,
Dog Supplies,Petmate Ultra Heavyweight Dish,
Dog Supplies,Ruffmaxx Reflective Dog Collar,
Dog Supplies,SportDOG Brand® Wetland A-Series Camo Add-A-Dog Receiver Collar,
Dog Supplies,Dallas Manufacturing Company 30 in x 40 in x 6 in Orthopedic Pet Bed,
Dog Supplies,Browning Walking Harness,
Dog Supplies,Westminster Ruffin' It Plush Sports Ball,
Dog Supplies,Remington Double-Snap Lanyard,
Dog Supplies,Team Realtree Rubber Dog Training Dummy,
Dog Supplies,Solvit Sta-Put™ Waterproof Bench Seat Cover,
Dog Supplies,Carhartt Nylon Ripstop Service Dog Harness,
Dog Supplies,Ruffmaxx Adjustable Mossy Oak Dog Collar,
Dog Supplies,Tonka Seismic Tread with Insert 3.5 in Dog Toy,
Dog Supplies,SportDOG Brand SBC-10 NoBark Bark Collar,
Dog Supplies,PetSafe Solvit Premium Bench Seat Cover,
Dog Supplies,Grillerz Natural Treats Large Pork Bone,
Dog Supplies,Kurgo Mash N Stash Collapsible Dog Bowl,
Dog Supplies,"Aspen Pet Home Training 38"" Wire Kennel",
Dog Supplies,Aspen Pet Camo Paracord Collar,
Dog Supplies,D. T. Systems Micro-iDT Plus Training Collar,
Dog Supplies,GameWear University of Arkansas Reflective Football Collar,
Dog Supplies,Carhartt Cargo Series Nylon Ripstop Storage Bag,
Dog Supplies,SportDOG Brand Contain + Train Add-A-Dog System,
Dog Supplies,Tonka Tri-Stack 4 in Tread Feeder Dog Toy,
Dog Supplies,Dogtra iQ Plus Additional Receiver Training Collar,
Dog Supplies,Remington Canvas Dog Bone with Squeaker,
Dog Supplies,NERF Dog 3.25 in Soccer Squeak Ball,
Dog Supplies,Aspen Pet 48 in Home Training Wire Kennel,
Dog Supplies,Dogtra Ball Trainer Pro,
Dog Supplies,Petmate 12-Cup Stainless-Steel Dog Bowl,
Dog Supplies,SportDOG Brand Yard Trainer 300 Remote Trainer,
Dog Supplies,Nite Ize SpotLit LED Collar Light,
Dog Supplies,SportDOG Brand® Roy Gonia Clear Competition Whistle,
Dog Supplies,D. T. Systems H2O 1810 Plus Electronic Training Collar,
Dog Supplies,Ideal Eyenimal Spin and Treat Ball,
Dog Supplies,Aspen Pet 36 in Home Training Wire Kennel,
Dog Supplies,NERF Dog 6 in Scented Chicken Ring,
Dog Supplies,PetSafe Ultralight Receiver Collar,
Dog Supplies,NERF Dog 16 in Tennis Ball Blaster,
Dog Supplies,D. T. Systems Bark Boss Rechargeable No-Bark Dog Collar,
Dog Supplies,Dogswell® Happy Hips® Chicken Breast Dog Treats,
Dog Supplies,"Aspen Pet Medium 16"" Spiral Stake",
Dog Supplies,Nite Ize NiteDawg LED Pet Leash,
Dog Supplies,ArcticShield Uninsulated Dog Kennel Cover,
Dog Supplies,Browning Duck Rope Toy,
Dog Supplies,Spotty XL Ultrasorb 26 in x 30 in Puppy Pads 50-Pack,
Dog Supplies,Scott Pet Howl's Kitchen 42 oz Premium Grill Biscuits,
Dog Supplies,PetSafe® Elite Big Dog Rechargeable Static Remote Trainer,
Dog Supplies,Browning Shotshell Treat Dispenser Chew Toy,
Dog Supplies,Academy Sports + Outdoors Holiday Pet Bed,
Dog Supplies,SportDOG Brand HoundHunter 3225 Remote Trainer,
Dog Supplies,Carhartt Tradesman Dog Collar,
Dog Supplies,Nylabone® Daily Health Edible Chews with Glucosamine 10-Pack,
Dog Supplies,Aerobie® Dogobie Flying Disc for Dogs,
Dog Supplies,Hyper Pet™ Hyper Shakes Rabbit Dog Toy,
Dog Supplies,NERF Dog 6 in Tire Squeak Football,
Dog Supplies,Chuckit! Kick-and-Fetch Ball,
Dog Supplies,Carhartt Universal Nylon Duck Pet Barrier,
Dog Supplies,Remington Silent Whistle,
Dog Supplies,Browning Hammock Seat Cover,
Dog Supplies,Game Winner® Realtree® MAX-4 Boater's Neoprene Dog Vest,
Dog Supplies,Dogtra 2702T&B Training and Beeper e-Collars 2-Pack,
Dog Supplies,Realtree Squeeze Meeze Goose Dog Toy,
Dog Supplies,GameWear Carolina Panthers Reflective Football Leash,
Dog Supplies,Scott Pet Premium Pork Chomps Ribz 10-Pack,
Dog Supplies,Carhartt Cargo Series Nylon Ripstop Storage Pocket,
Dog Supplies,Scott Pet Nutri Chomps 6 in Assorted Flavor Braids 4-Pack,
Dog Supplies,Petmate Pet Porter® 2 Dog Kennel,
Dog Supplies,Garmin Delta XC Remote Dog Training System,
Dog Supplies,SportDOG Brand SportHunter 1825X Remote,
Dog Supplies,GameWear University of Missouri Reflective Football Leash,
Dog Supplies,JW Pet® iSqueak Ball Dog Toy,
Dog Supplies,Hyper Products® Hyper Pet Flying Duck,
Dog Supplies,Dogtra YS300 No-Bark Collar,
Dog Supplies,Ideal Eyenimal Small Pet Feeder,
Dog Supplies,Dallas Manufacturing Company 30 in x 40 in Gusseted Faux-Linen Textured Dog Bed,
Dog Supplies,Carhartt Firm Duck Insulated Dog Camo Chore Coat,
Dog Supplies,SportDOG Brand SportTrainer 875 Remote,
Dog Supplies,Chuckit! Medium Ultra Ball,
Dog Supplies,Aspen Pet Chain-Link Outdoor Dog Run,
Dog Supplies,NERF Dog 10.5 in Nylon Zone Flyer,
Dog Supplies,Dallas Manufacturing Company 30 in x 40 in Plaid Gusseted Pet Bed,
Dog Supplies,Chuckit! Classic Ball Launcher,
Dog Supplies,Dallas Manufacturing Company 27 in x 36 in Camo Corner Patch Bed,
Dog Supplies,Browning Stainless Extra Large Pet Dish,
Dog Supplies,Dingo Dog Training Treats 120-Pack,
Dog Supplies,SportDog Brand Contain + Train System,
Dog Supplies,Pork Chomps Premium Roasted Pork Earz 10-Pack,
Dog Supplies,Dogtra RR Deluxe Remote,
Dog Supplies,Kurgo YORM Dog Travel Treat Bag,
Dog Supplies,Dogtra 1902S 2-Dog Training System,
Dog Supplies,Magellan Outdoors Tufted Pet Bed,
Dog Supplies,SportDOG Brand® FieldTrainer® 425,
Dog Supplies,Browning Fabric Pheasant Squeaker Chew Toy,
Dog Supplies,SportDOG Brand YardTrainer 100S Remote Trainer for Stubborn Dogs,
Dog Supplies,Kurgo RSG Small Townie Harness,
Dog Supplies,Nite Ize PetLit LED Collar Light,
Dog Supplies,Kurgo Large Journey Air Harness,
Dog Supplies,Carhartt 6 ft Dog Leash,
Dog Supplies,Browning Neoprene Dog Vest,
Dog Supplies,PetSafe® Wireless Pet Containment System™,
Dog Supplies,Dogtra 200C 1-Dog Training Collar,
Dog Supplies,Ruffmaxx Nylon 5' Blaze Orange Dog Leash,
Dog Supplies,Carpenter Pet Bed with Realtree Camo Accents,
Dog Supplies,Dallas Manufacturing Company Large Gusseted Pet Bed,
Dog Supplies,Browning Classic Webbing Camo Small Dog Collar,
Dog Supplies,Dogtra Edge Dog Collar,
Dog Supplies,SportDOG Brand NoBark SBC-8 Dog Collar,
Dog Supplies,Carhartt Quick Duck Fleece-Lined Dog Jacket,
Dog Supplies,GameWear New England Patriots Reflective Football Collar,
Dog Supplies,PetSafe Solvit CareLift Lifting Harness,
Dog Supplies,Big Sky Large Antler Chew Treat,
Dog Supplies,Dogtra E-FENCE 3500,
Dog Supplies,Kurgo RSG Dog Hydration Flask,
Dog Supplies,Remington Shurshot Foam Dove Trainer,
Dog Supplies,SportDOG Brand ProHunter 2525 Remote Trainer,
Dog Supplies,Carhartt Firm Duck Bumper Dog Felt Chew,
Dog Supplies,Nite Ize NiteHowl LED Dog Safety Necklace,
Dog Supplies,Ideal Eyenimal Pet Data Recorder,
Dog Supplies,Dallas Manufacturing Company Bone and Blanket Pet Gift Set,
Dog Supplies,NERF Dog DogTrax 10 in Tire Flyer,
Dog Supplies,Dogtra Pathfinder Mini Training Collar,
Dog Supplies,Remington Duck Training Kit,
Dog Supplies,Dallas Manufacturing Company Cuddler Pet Bed,
Dog Supplies,SportDOG Brand® FieldTrainer® 425,
Dog Supplies,Dogtra Pathfinder GPS E-Collar System,
Dog Supplies,Browning Squirrel Squeaker Chew Toy,
Dog Supplies,Dallas Manufacturing Company Ortho Kennel Pad,
Dog Supplies,Dogtra iQ Mini Training Collar System,
Dog Supplies,Aspen Pet Home Training Wire Crate,
Dog Supplies,Ideal Eyenimal 350 Remote Trainer,
Dog Supplies,Chuckit! Medium Confetti Ball,
Dog Supplies,Dogtra 2700T&B Training and Beeper e-Collar System,
Dog Supplies,Dogtra Edge Additional Receiver Training Collar,
Dog Supplies,Ideal Eyenimal Rolling Ball,
Dog Supplies,World Pet Dog Life Jacket,
Dog Supplies,Aspen Pet 48 in Home Training Wire Kennel,
Dog Supplies,NERF Dog 2.5 in Squeak Tennis Ball 4 Pack,
Dog Supplies,Ruffmaxx Rope Snap Dog Leash,
Dog Supplies,Rascals® 3-Knot Rope Toy,
Dog Supplies,Dogtra 1900S Black Edition Training Collar System,
Dog Supplies,Remington Large Waterfowl Foam Trainer,
Dog Supplies,Aspen Pet 1-Gallon LeBistro® Waterer,
Dog Supplies,Carhartt Rubber Handle Monkey Fist Dog Pull,
Dog Supplies,Petmate Reflective Padded Adjustable Dog Collar,
Dog Supplies,Dallas Manufacturing Company Gusseted Pet Bed,
Dog Supplies,Kurgo RSG Dog Pack Pannier,
Dog Supplies,Ideal Eyenimal Intelligent XL Pet Bowl,
Dog Supplies,Pork Chomps Premium Assorted Munchy Sticks 50-Pack,
Dog Supplies,Premium Nutri Chomps Assorted Knots 9-Pack,
Dog Supplies,Carhartt Cargo Series Nylon Ripstop Work Dog Harness,
Dog Supplies,Dirty Dog Doormat Paw Print 35 in x 26 in Large Mat,
Dog Supplies,Realtree Chew Resistant Crate Mat,
Dog Supplies,Aspen Pet 30 in Home Training Wire Kennel,
Dog Supplies,GameWear Houston Texans Classic Leather Football Collar,
Dog Supplies,Garmin Delta™ Delta Sport™ Dog Device,
Dog Supplies,Dallas Manufacturing Company Cuddler Pet Bed,
Dog Supplies,SportDOG Brand SBC-R Prem Bark Collar,
Dog Supplies,Dogtra Edge RT Dog Collar,
Dog Supplies,PetSafe® Drinkwell® Everflow Indoor/Outdoor Pet Fountain,
Dog Supplies,Chuckit! Fetch Medley 2 Fetch Balls Set,
Dog Supplies,Dogtra iQ Plus Remote Trainer,
Dog Supplies,Kong Traxx Medium/Large Dog Chew Toy,
Dog Supplies,Browning Neoprene Vest,
Dog Supplies,SportDOG Brand WetlandHunter 1825X Remote,
Dog Supplies,Dallas Manufacturing Company Gusseted Pet Bed,
Dog Supplies,ArcticShield Insulated Dog Kennel Cover,
Dog Supplies,Browning Safety Vest,
Dog Supplies,Carhartt Nylon Duck Dog Leash,
Dog Supplies,Team Realtree Rubber Dog Training Dummies 3-Pack,
Dog Supplies,Dogtra 202c 2-Dog Training Collars 2-Pack,
Dog Supplies,Aspen Pet 42 in Home Training Wire Kennel,
Dog Supplies,Dogtra Pathfinder RX GPS Dog Collar,
Dog Supplies,Kurgo RSG Active Utility Belt,
Dog Supplies,NERF Dog 11 in Tuff Rubber Bone,
Dog Supplies,SportDOG Brand SportHunter 1225X Remote,
Dog Supplies,Carhartt Pet Napper Pad,
Dog Supplies,Browning Classic Webbing Camo Dog Collar,
Dog Supplies,Dogtra 282C 2-Dog Training System,
Dog Supplies,Dogtra 3500X Training Collar System,
Dog Supplies,Browning Pet Dish Mat 4 Pack,
Dog Supplies,Nite Ize PetLit LED Collar Light,
Dog Supplies,Petmate 10 lb. Ultra Kibble Keeper,
Dog Supplies,Ideal Eyenimal USB Rechargeable Light Collar,
Dog Supplies,Carhartt Neoprene Dog Vest,
Dog Supplies,Kurgo RSG Medium Townie Harness,
Dog Supplies,GameWear New Orleans Saints Reflective Football Leash,
Dog Supplies,Carhartt Nylon Duck Horse Halter,
Dog Supplies,Cozy Pet Orthopedic 27 in x 36 in Pet Bed,
Dog Supplies,Carhartt Rope Bone Dog Chew,
Dog Supplies,Nite Ize GlowStreak LED Ball-Disc-O,
Dog Supplies,Dallas Manufacturing Company Gusseted Pet Bed,
Dog Supplies,PetSafe Rechargeable In-Ground Fence,
Dog Supplies,Aspen Pet Camo Paracord Leash,
Dog Supplies,Hyper Pet™ Real Skinz™ Raccoon Dog Toy,
Dog Supplies,Aspen Pet 42 in Home Training Wire Kennel,
Dog Supplies,SportDOG Brand WetlandHunter 425X E-Collar,
Dog Supplies,Aspen Pet Black Mountain Leash,
Dog Supplies,Scott Pet Big Sky Small Split Antler Chew,
Dog Supplies,Kurgo Loft Hammock,
Dog Supplies,PetSafe Vehicle Safety Tether,
Dog Supplies,Carhartt Dog Walking Harness,
Dog Supplies,Dallas Manufacturing Company 30 in x 40 in Pillow Topper Pet Bed,
Dog Supplies,Carhartt Horse Lead Rope,
Dog Supplies,Aspen Pet 36 in Home Training Wire Kennel,
Dog Supplies,"Redbarn 12"" Braided Bully Sticks 2-Pack",
Dog Supplies,Chuckit Sport Launcher,
Dog Supplies,Scrubby Rinse Free Instant Pet Bath Mittens 5-Pack,
Dog Supplies,Dogtra 280C Dog Training System,
Dog Supplies,Chuckit! Amphibious Bumper,
Dog Supplies,PetSafe YardMax Rechargeable Receiver,
Dog Supplies,Hyper Pet™ Real Tree™ Squirrel Dog Toy,
Dog Supplies,NERF Dog 2.5 in Squeak Tennis Balls 3-Pack,
Dog Supplies,Chuckit! Junior Ball Launcher,
Dog Supplies,Remington 20' Heavy Cable Dog Tie Out,
Dog Supplies,"Dallas Manufacturing Company 32"" x 42"" Plaid Boxed Dog Bed",
Dog Supplies,Browning Duck Call Squeaker Chew Toy,
Dog Supplies,PetPal Training Systems Canine Coach 360 Collar System,
Dog Supplies,Nature's Choice Knotted Rawhide Dog Bones 7-Pack,
Dog Supplies,Dokken's™ Pheasant Scent Kit,
Dog Supplies,Game Winner 2-in-1 Dog Run,
Dog Supplies,D. T. Systems Ultra Min-E 2090 No-Bark Training Collar,
Dog Supplies,Dallas Manufacturing Company 30 in x 25 in Cuddler Pet Bed,
Dog Supplies,Browning Classic Webbing Collar,
Dog Supplies,D. T. Systems R.A.P.T. 1400 Remote Training Collar,
Dog Supplies,Browning Classic Webbing Leash,
Dog Supplies,Dallas Manufacturing Company 32 in x 42 in Gusseted Dog Bed,
Dog Supplies,Petmate Ruffmaxx Camo Kennel,
Dog Supplies,Aspen Pet Soft Bite™ Plush Hamburger Toy,
Dog Supplies,Bow Wow Pet Holiday Printed Bunjeez Rope Dog Toy,
Dog Supplies,Browning Classic Webbing Camo Dog Leash,
Dog Supplies,Dallas Manufacturing Company Gusseted Pet Bed,
Dog Supplies,Scott Pet Howl's Kitchen 12 oz Beef Training Bites,
Dog Supplies,"Dallas Manufacturing Company 27"" x 36"" Plaid Boxed Dog Bed",
Dog Supplies,Alliance 3.8 mm x 20' Welded-Link Tie-Out Dog Chain,
Dog Supplies,Nite Ize Nite Dawg LED Dog Collar,
Dog Supplies,Browning Shock-Absorbing Leash,
Dog Supplies,Nite Ize Pack-A-Poo Refill Bags 4-Pack,
Dog Supplies,Cozy Pet Plaid Bolster Pet Bed,
Dog Supplies,Nite Ize SpotLit XL Rechargeable Collar Light,
Dog Supplies,Ruffin' It Captain Jack Chicken Pet Squeaky Toy,
Dog Supplies,Chuckit! Medium Ultra Squeaker Ball,
Dog Supplies,"Aspen Pet Medium Home Training 34"" Wire Kennel",
Dog Supplies,YETI Boomer 4 Dog Bowl,
Dog Supplies,Nite Ize NiteDawg LED Collar Cover,
Dog Supplies,Carhartt Rubber Handle Monkey Fist Dog Pull,
Dog Supplies,Coleman® Bushy Tail Coyote,
Dog Supplies,Kong Medium Squeezz Stick Dog Toy,
Dog Supplies,PetSafe® Outdoor Bark Control,
Dog Supplies,Dallas Manufacturing Company Cuddler Pet Bed,
Dog Supplies,Carhartt Firm Duck Wheel Dog Pull,
Dog Supplies,YETI Boomer 8 Dog Bowl,
Dog Supplies,Kurgo Medium Journey Air Harness,
Dog Supplies,JW Pet Hol-ee Roller Rubber Medium Dog Toy,
Dog Supplies,Dallas Manufacturing Company Antler Bone and Blanket Set,
Dog Supplies,Kurgo X-Large Journey Air Harness,
Dog Supplies,Kurgo Mash N' Stash Jumbo Collapsible Dog Bowl,
Dog Supplies,"Pork Chomps Premium 7"" Baked Knots 8-Pack",
Dog Supplies,Carpenter Nancy Pet Bed,
Dog Supplies,Dogtra 1900S Hands-Free Training Collar System,
Dog Supplies,Dallas Manufacturing Company 29 in x 23 in Cuddler Dog Bed,
Dog Supplies,Spot Skinneez Jumbo Dog Toy,
Dog Supplies,Dallas Manufacturing Company Cuddler Pet Bed,
Dog Supplies,"Hyper Pet™ 9"" Flippy Flopper",
Dog Supplies,SportDOG Brand Rechargeable In-Ground Fence Add-A-Dog Collar,
Dog Supplies,PetSafe Solvit Premium Bucket Seat Cover,
Dog Supplies,PetSafe Solvit Deluxe Vehicle Safety Harness,
Dog Supplies,Browning Antler Chew Toy,
Dog Supplies,Aspen Pet 2.5-Gallon LeBistro® Waterer,
Dog Supplies,D. T. Systems Soft-Mouth Trainer™,
Dog Supplies,Kong Traxx Small Dog Chew Toy,
Dog Supplies,Bone-A-Fide Antler Fetch Toy,
Dog Supplies,Carhartt Dog Chore Coat,
Dog Supplies,Dokken's™ Dead Fowl Trainers Mallard,
Dog Supplies,Ruffmaxx 2-Ply O-Ring Blaze Orange Dog Collar,
Dog Supplies,Dogtra 1900S Training System,
Dog Supplies,PetSafe Spray Bark Collar,
Dog Supplies,PetSafe In-Ground Fence,
Dog Supplies,SportDOG Brand® Locator Beacon,
Dog Supplies,Browning Classic Webbing Dog Leash,
Dog Supplies,Remington 2 in x 11 in Vinyl Dummy,
Dog Supplies,PetSafe 300 Yard Remote Spray Trainer,
Dog Supplies,Aspen Pet Grunts Dog Toy,
Dog Supplies,SportDOG Brand SportTrainer 575 Remote,
Dog Supplies,Dingo Bacon Bites Beef-n-Bac'n Flavor,
Dog Supplies,Nite Ize Pack-A-Poo Bag Dispenser,
Dog Supplies,SportDOG Brand SportHunter 825X Remote Trainer,
Dog Supplies,Dogtra Arc Hands-Free e-Collar System,
Dog Supplies,Dog Bone Shed Antler Retrieving System,
Electronics,Garmin echoMAP Ultra 102sv Chartplotter,
Electronics,Fitbit Ionic Horween Leather Accessory Band,
Electronics,Garmin Foretrex 701 Ballistic Edition GPS Navigator,
Electronics,Garmin fenix 6X Pro Solar Titanium Smart Watch,
Electronics,Star Wars™ Episode VII Kids' Kylo Ren Watch,
Electronics,Humminbird PiranhaMAX 4 DI Fishfinder,
Electronics,Duracell Coppertop AA Batteries 4-Pack,
Electronics,Columbia Stainless Analog Leather Strap Watch,
Electronics,Tommy Bahama Men's Barracuda Bay Dual Time Sport Watch,
Electronics,Lowrance Elite FS 7 Active Imaging 3-in-1 Transducer,
Electronics,Garmin Approach G12 Golf Range Finder,
Electronics,Lifeworks LUXE Slim Leatherette Case for iPhone® 6 Plus,
Electronics,Aqua-Vu HD7i Gen2 200-7502 Underwater Digital Camera,
Electronics,Star Wars™ Kids' R2D2 Flashing Watch,
Electronics,Quest Sports Wireless Baseball Charging Pad,
Electronics,adidas RPT-01 Bluetooth Sport On-Ear Headphones,
Electronics,Wenger Adults' Escort Running Watch,
Electronics,Humminbird Helix 5 G2 CHIRP GPS Chartplotter,
Electronics,Reactor Men's Gryphon Sport Watch,
Electronics,Nikon COOLSHOT PRO STABILIZED 6x Laser Range Finder,
Electronics,Casio Men's G-Shock Analog/Digital Sport Watch,
Electronics,ECOXGEAR EcoDrop IPX5 Waterproof Bluetooth Speaker,
Electronics,Garmin Montana 610t Camo Handheld GPS,
Electronics,iHome Disney Character Earbuds with Pouch,
Electronics,Prime Brands Group University of Louisiana at Lafayette ShockBox LED Speaker,
Electronics,Energizer® Max Alkaline AAAA Batteries 2-Pack,
Electronics,Fugoo Sport 2.0 Portable Bluetooth Speaker,
Electronics,Jillian Michaels Yoga Inferno,
Electronics,PopSockets Glitter Phone PopGrip,
Electronics,Midland 75-785 Handheld CB Radio,
Electronics,Garmin Vivoactive 4 GPS Smartwatch,
Electronics,JBL Clip 2 IPX7 Bluetooth Speaker,
Electronics,Fitbit Horween Leather Double Wrap Band,
Electronics,Monster Octagon Over-Ear Headphones,
Electronics,Timex Men's Ironman 30-Lap Digital Watch,
Electronics,iHome iB83 Wireless Headphones,
Electronics,Star Wars Boys' R2D2 Watch,
Electronics,Fisher F22 Weatherproof All-Purpose Metal Detector,
Electronics,adidas™ Men's Furano Watch,
Electronics,Timex Women's Ironman Traditional 30-Lap Watch,
Electronics,iWorld™ USB Cable with Lightning™ Connector,
Electronics,Leica CRF Rangemaster 2400.COM 7 x 24 Rangefinder,
Electronics,Casio Men's 60-Lap Sport Running Watch,
Electronics,Casio Men's Super Illuminator Watch,
Electronics,Timex Adults' Expedition  Core Analog Watch,
Electronics,Fitbit Kids' Ace Pedometer,
Electronics,Casio Men's Twin Sensor Compass Watch,
Electronics,FOXPRO FX7 2 Speaker Electronic Predator Call System,
Electronics,Taylor Body Composition Analyzer Scale,
Electronics,Timex Men's Weekender Full-Size Watch,
Electronics,MZB Kids' Despicable Me Digital Watch,
Electronics,Casio Men's Mud-Resist Resin Strap Watch,
Electronics,Everlast® Men's Analog/Digital Watch,
Electronics,Spot Gen4 Satellite GPS Messenger,
Electronics,Garmin Adults' fenix 5S Multisport GPS Watch,
Electronics,Luminox Adults' 8800 Anniversary Quartz Watch,
Electronics,Hasbro Girls' My Little Pony Digital Watch,
Electronics,Nikon COOLSHOT 20 GII Golf Laser Range Finder,
Electronics,ECOXGEAR BW30 Bluetooth IPX5 5HR Sportbuds,
Electronics,Garmin Striker Plus 7sv GPS Fishfinder,
Electronics,NCAA University of Florida LED Shock Box Bluetooth Speaker,
Electronics,Leupold PinCaddie 6 x 23 Golf Range Finder,
Electronics,Fitbit Inspire Print Band,
Electronics,Garmin vivoactive 4 GPS Smartwatch,
Electronics,Skullcandy Inkd Earbuds,
Electronics,Tommy Bahama Women's Pearl Palm Tree Watch,
Electronics,iHome Slider Headrest Tablet Car Mount,
Electronics,Deeper DP0H10S10 Wireless Fishfinder,
Electronics,Timex Women's Ironman® Essential 10-Lap Watch,
Electronics,Quest Sport Tiki LED Speaker,
Electronics,Bounty Hunter Lone Star Metal Detector,
Electronics,Casio Men's Waveceptor Watch,
Electronics,Timex Adults' Marathon Watch,
Electronics,Arccos 360 Golf Performance Tracking System,
Electronics,Monster Mobile PowerCord Portable Battery,
Electronics,Jawbone UP MOVE Activity Tracker,
Electronics,Timex Women's Ironman Essentials 10 Digital Watch,
Electronics,Humminbird ONIX10ci SI Sonar/GPS Chartplotter Combo,
Electronics,Suunto Adults' Ambit2 R Integrated GPS Watch,
Electronics,Armitron Women's Pro Sport Watch,
Electronics,Timex Women's IQ+Move Midsize Watch,
Electronics,Casio Men's Twin Sensor Multifunction Analog/Digital Watch,
Electronics,Lowrance FishHunter Pro Transducer,
Electronics,Timex Adults' Expedition® Chrono Alarm Timer Watch,
Electronics,Lowrance HOOK2-4x GPS Bullet Fishfinder,
Electronics,Coleman® Men's Digital Watch,
Electronics,Killer Concepts Smartphone Flip Stand,
Electronics,eKids Frozen Over-the-Ear Light-Up Headphones,
Electronics,iWorld Spark Bluetooth Earbuds,
Electronics,Omron 3 Series Wrist Blood Pressure Monitor,
Electronics,ReelSonar iBobber Portable Sonar Fish Finder,
Electronics,Prime Brands Group Dallas Cowboys ShockBox LED Speaker,
Electronics,Timex Men's Ironman® Essential 10 Full-Size Watch,
Electronics,PopSockets PopMount 2 Dash and Windshield Mount,
Electronics,"iHome 6"" Dual SR Nylon micro USB Charge and Sync Cable",
Electronics,Timex Men's Expedition Watch,
Electronics,Garmin fenix 6S Pro Solar Edition Smartwatch,
Electronics,Kenwood Marine 6.5 in 2-Way Speakers - Pair,
Electronics,Tune Belt Sport Armband for iPhone® 6 Plus with Case,
Electronics,Magpul iPhone® 5/5S Bump Case,
Electronics,ECOXGEAR SoundExtreme Bluetooth Waterproof 18 in Speaker,
Electronics,PopSockets Glitter Twisted Tie-Dye PopSocket,
Electronics,Garmin echoMAP Plus 73sv Chartplotter with GT52 Transducer,
Electronics,Casio Women's Eco-Friendly Running Watch,
Electronics,Fitbit Charging Cable for Fitbit Flex 2,
Electronics,Casio Men's G-Shock Digital Watch,
Electronics,Timex Adults' Expedition Global Shock Watch,
Electronics,Prime Brands Group Carolina Panthers Shockbox Bluetooth Speaker,
Electronics,iWorld™ High Performance Sport Wireless Headphones,
Electronics,Timex Men's Expedition Oversize Scout Watch,
Electronics,iHome Soft Touch 5' Male-to-Male 3.5 mm Audio Cable,
Electronics,Skullcandy Fix Rapid Dual USB Port Car Charger,
Electronics,CoreAudio Shock Bluetooth Headphones,
Electronics,JBL Tune 510 Bluetooth On-Ear Headphones,
Electronics,Nite Ize Wide Load Clip Case Cargo Holster,
Electronics,Fitbit Blaze Metal Link Accessory Band,
Electronics,WeGo™ Elite All Day Activity Tracker,
Electronics,Midland X-Talker T295VP4 2-Way Radios 2-Pack,
Electronics,Fitbit Blaze™ Fitness Watch,
Electronics,Fitbit Woven Hybrid Band,
Electronics,Duracell Coppertop D Batteries 2-Pack,
Electronics,Tune Belt Reflective Sport Armband,
Electronics,ECOXGEAR SoundExtreme Battery Version Waterproof Bluetooth 26 in Speaker,
Electronics,Garmin Vivomove Style Activity Tracker Watch,
Electronics,DC Comics Boys' Batman Watch,
Electronics,MZB Girls' Disney Princess Digital Watch,
Electronics,Nite Ize Leather Cargo Clip Case,
Electronics,L2 Tech Talk2Me Headphones,
Electronics,Casio Men's Databank AW80-7AV Analog/Digital Watch,
Electronics,"ECOXGEAR EcoBike Speaker, Lamp and Charger",
Electronics,Guard Dog Security Personal Key Chain Alarm,
Electronics,Lowrance HOOK Reveal 7x SplitShot Fishfinder,
Electronics,Tommy Bahama Men's Shark Reef Diver Watch,
Electronics,Tommy Bahama Women's Golden Pineapple Watch,
Electronics,Academy Sports + Outdoors Men's Fast-Wrap Digital Watch,
Electronics,Garmin Instinct Rugged GPS Watch,
Electronics,Timex Men's Ironman® Core 50-Lap Full-Size Watch,
Electronics,JBL Endurance Sprint IPX7 Bluetooth Earbuds,
Electronics,MarCum LXi Digital Handheld Sonar System,
Electronics,Fitbit Sense Health Smartwatch,
Electronics,Garmin vivofit Jr. 2 Kids' Disney Light Side Fitness Tracker with Interactive App Experience,
Electronics,Tommy Bahama Women's Palm Beach Bangle Watch,
Electronics,Soleus Men's Sprint Watch,
Electronics,Aqualite Women's Watch,
Electronics,Minions Kids' Digital Watch,
Electronics,IZZO Golf Swami 6000 Handheld Golf GPS,
Electronics,Duracell PowerPack Pro 1300,
Electronics,Scosche MagicMount Pro Dash Phone Mount,
Electronics,Humminbird 410250-1 Helix 5 Portable Sonar Fish Finder,
Electronics,Perfect Fitness Scale Pro,
Electronics,JLab Audio JBuds Air Earbuds Wireless Earbuds,
Electronics,Columbia Sportswear Adults' Canyon Ridge Chronograph Date Nylon Watch,
Electronics,Columbia Sportswear Men's Fieldmaster III Watch,
Electronics,LoveHandle Texas Phone Grip,
Electronics,LoveHandle Plastic & Elastic Phone Grip,
Electronics,Scosche Handlebar Phone Mount,
Electronics,Skullcandy Protective Travel Case,
Electronics,Timex Pedometer,
Electronics,Bounty Hunter Discovery 2200 Metal Detector,
Electronics,Magellan Outdoors™ Men's Quartz Analog Watch with Date,
Electronics,Matrix Adults' PowerWatch Smart Watch,
Electronics,Fitbit Blaze Classic Accessory Band,
Electronics,Beats UrBeats In-Ear 3.5 mm Cable Earbuds,
Electronics,SYNC Calorie Activity Tracker,
