Backpacks + Bags,Nike Elemental FA19 Backpack,
Backpacks + Bags,"Magellan Outdoors™ 30"" Wheeled Duffel",
Backpacks + Bags,adidas Stadium Team Backpack,
Backpacks + Bags,geckobrands Everyday Tote,
Backpacks + Bags,Carhartt Women's Legacy Collection North/South Tote,
Backpacks + Bags,geckobrands Crossbody Bag,
Backpacks + Bags,A. D. Sutton Animal Rolling Backpack,
Backpacks + Bags,Bixbee Kids' Rocketflyer Medium Backpack,
Backpacks + Bags,Under Armour Soccer Backpack,
Backpacks + Bags,adidas Classic 3S 4 Backpack,
Backpacks + Bags,JanSport Tilden Backpack,
Backpacks + Bags,YETI Daytrip Lunch Bag,
Backpacks + Bags,Maccabi Art Manchester City FC Lunch Cooler,
Backpacks + Bags,adidas Diablo Small Duffel Bag,
Backpacks + Bags,O'Rageous® Mesh Tote,
Backpacks + Bags,Maccabi Art Juventus FC Buckled Lunch Bag,
Backpacks + Bags,Austin Trading Co. Clear Backpack,
Backpacks + Bags,Under Armour Undeniable Duffel Bag,
Backpacks + Bags,Under Armour Huey Backpack,
Backpacks + Bags,SwissGear 5786 Laptop Backpack,
Backpacks + Bags,Under Armour Women's Undeniable Duffel Bag,
Backpacks + Bags,The North Face Vault Backpack,
Backpacks + Bags,adidas Stratton II Backpack,
Backpacks + Bags,adidas Santiago 2 Jersey Lunch Bag,
Backpacks + Bags,Picnic Time St. Louis Cardinals Pranzo Lunch Tote,
Backpacks + Bags,Under Armour Hustle Sports Backpack,
Backpacks + Bags,adidas Clear Mini Backpack,
Backpacks + Bags,adidas Prime II Backpack,
Backpacks + Bags,Nike Team Training Backpack,
Backpacks + Bags,Under Armour Crossbody Bag,
Backpacks + Bags,The North Face Women’s Borealis Backpack,
Backpacks + Bags,Timber Creek® Stuff Bag,
Backpacks + Bags,Nike Utility Speed Training Backpack,
Backpacks + Bags,Logo Clear Backpack,
Backpacks + Bags,Logo Gym Bag,
Backpacks + Bags,The North Face Wise Guy Backpack,
Backpacks + Bags,A. D. Sutton Women's Printed Cotton Quilted Backpack,
Backpacks + Bags,geckobrands Ambition School Backpack,
Backpacks + Bags,Magellan Outdoors 42 in x 15 in Cotton Canvas Barrel Duffel Bag,
Backpacks + Bags,adidas Team Speed Duffel Bag,
Backpacks + Bags,adidas Women's VFA II Backpack,
Backpacks + Bags,SwissGear 20 in Spinner Carry-On Luggage,
Backpacks + Bags,SwissGear 1186 Backpack,
Backpacks + Bags,O'Rageous Canvas Cactus Beach Tote,
Backpacks + Bags,The North Face Base Camp Extra Large Duffel Bag,
Backpacks + Bags,geckobrands Ocean geckoflage Waterproof 50L PVC Duffel Bag,
Backpacks + Bags,Nike 9.0 Brasilia Duffel Bag,
Backpacks + Bags,geckobrands Elevate School Backpack,
Backpacks + Bags,Picnic Time East Carolina University Pranzo Lunch Tote,
Backpacks + Bags,geckobrands School Backpack,
Backpacks + Bags,Picnic Time University of Mississippi Pranzo Lunch Tote,
Backpacks + Bags,Converse Go Backpack,
Backpacks + Bags,The North Face Advant Lumbar Backpack,
Backpacks + Bags,Austin Trading Co. Asher Mesh Backpack,
Backpacks + Bags,Magellan Outdoors Hewitt 21 in Rolling Spinner Suitcase,
Backpacks + Bags,Under Armour Boys' Lunch Cooler,
Backpacks + Bags,Nike Sportswear RPM Backpack,
Backpacks + Bags,The North Face Youth Terra 55 Backpack,
Backpacks + Bags,Apera Sport Duffel Bag,
Backpacks + Bags,adidas League 3-Stripes Backpack,
Backpacks + Bags,Bixbee Kids' Meme Space Odyssey Backpack,
Backpacks + Bags,The North Face Women's Vault Backpack,
Backpacks + Bags,Carhartt Legacy 25 in Utility Duffel Bag,
Backpacks + Bags,"Magellan Outdoors™ 30"" Wheeled Duffle Bag",
Backpacks + Bags,Under Armour Adults' Team Hustle 3.0 Backpack,
Backpacks + Bags,adidas Clean Linear Backpack,
Backpacks + Bags,The North Face Bozer III Hip Pack,
Backpacks + Bags,JanSport SuperBreak Backpack,
Backpacks + Bags,Nike Kids' Halfday Backpack,
Backpacks + Bags,Columbia Sportswear Lightweight Packable 21L Tote Bag,
Backpacks + Bags,Logo™ Milwaukee Brewers Halftime Lunch Cooler,
Backpacks + Bags,High Sierra Titan 55 Hydration Pack,
Backpacks + Bags,Ful Navigator Backpack,
Backpacks + Bags,Magellan Outdoors Canvas Tote Bag,
Backpacks + Bags,Wenzel Tribute Boulderdasche 33 Backpack,
Backpacks + Bags,The North Face Men’s Borealis Backpack,
Backpacks + Bags,The North Face Base Camp Roller Duffel Bag,
Backpacks + Bags,SwissGear 1592 Deluxe Laptop Backpack,
Backpacks + Bags,Nike Vapor Power 2.0 Training Backpack,
Backpacks + Bags,Nike Futura Space-Dye Lunch Bag,
Backpacks + Bags,Under Armour Contain Duo 2.0 Backpack Duffel Bag,
Backpacks + Bags,Magellan Outdoors 48 Barrel Duffel Bag,
Backpacks + Bags,Solo Launch Backpack,
Backpacks + Bags,adidas Alliance II Sackpack,
Backpacks + Bags,The North Face Women's Borealis Backpack,
Backpacks + Bags,geckobrands Inspire School Backpack,
Backpacks + Bags,Bixbee Kids' Dino Camo Backpack,
Backpacks + Bags,"Realtree Adventure 20"" Casual Duffel Bag",
Backpacks + Bags,Under Armour Compel Sling 2.0 Bag,
Backpacks + Bags,adidas™ Estadio Team Backpack,
Backpacks + Bags,Logo Carolina Panthers Halftime Lunch Cooler,
Backpacks + Bags,"Tactical Performance™ 30"" Rolling Duffel Bag",
Backpacks + Bags,geckobrands Impact School Backpack,
Backpacks + Bags,"Carhartt Legacy Collection 23"" Gear Bag",
Backpacks + Bags,"Realtree Adventure 36"" Wheeled Drop Bottom Duffel Bag",
Backpacks + Bags,Picnic Time Minnesota Vikings Pranzo Lunch Tote,
Backpacks + Bags,adidas Condivo Team Backpack,
Backpacks + Bags,Carhartt Waist Pack,
Backpacks + Bags,Under Armour Undeniable 4.0 Medium Duffel Bag,
Backpacks + Bags,Under Armour Undeniable II Small Duffel Bag,
Backpacks + Bags,OGIO Discover Pack Backpack,
Backpacks + Bags,Picnic Time New Orleans Saints Pranzo Lunch Tote,
Backpacks + Bags,SwissDigital Xavie Speaker Backpack,
Backpacks + Bags,Marvel™ Boys' Spider-Man Backpack with Lunch Pack,
Backpacks + Bags,Columbia Sportswear Zigzag 1L Hip Pack,
Backpacks + Bags,The North Face Terra 50 Technical Backpack,
Backpacks + Bags,adidas Alliance II Sackpack,
Backpacks + Bags,Nike Utility Speed Printed Training Backpack,
Backpacks + Bags,The North Face Youth Recon Squash Backpack,
Backpacks + Bags,Forever Collectibles™ University of Alabama Clear Messenger Bag,
Backpacks + Bags,Transformers Backpack with Lunch Combo,
Backpacks + Bags,CamelBak Pivot Roll Top Backpack,
Backpacks + Bags,Picnic Time Mississippi State University Pranzo Lunch Tote,
Backpacks + Bags,Cloudveil Durango 36 Backpack,
Backpacks + Bags,geckobrands Impact School Backpack,
Backpacks + Bags,Magellan Outdoors 22 in Wheeled Duffel Bag,
Backpacks + Bags,Carhartt Legacy Deluxe Brief Bag,
Backpacks + Bags,Transformers Boys' Backpack,
Backpacks + Bags,Picnic Time University of Iowa Pranzo Lunch Tote,
Backpacks + Bags,Carhartt Legacy 25 in Utility Duffel Bag,
Backpacks + Bags,Nike Kids' Kevin Durant Max Air VIII Backpack,
Backpacks + Bags,adidas Defender IV Duffel Bag,
Backpacks + Bags,Disney Sophia the First Princess Backpack,
Backpacks + Bags,Picnic Time University of Kansas Pranzo Lunch Tote,
Backpacks + Bags,Black Diamond Trail Zip 14 Backpack,
Backpacks + Bags,Ful Troubleshooter Laptop Backpack,
Backpacks + Bags,Marvel™ Boys' Avengers Mesh Backpack,
Backpacks + Bags,Apera Performance Duffel Bag,
Backpacks + Bags,Reebok Thruster Laptop Backpack,
Backpacks + Bags,Under Armour Women's Favorite Metallic Tote Bag,
Backpacks + Bags,Chums Neo Pocket Waist Pack,
Backpacks + Bags,Carhartt Legacy Classic Work Backpack,
Backpacks + Bags,Ful Tennman Laptop Backpack,
Backpacks + Bags,Magellan Outdoors Rolling Duffel Bag,
Backpacks + Bags,"Olympia USA Apache II 21"" Carry-on Spinner",
Backpacks + Bags,Black Diamond Rock Blitz 15 Backpack,
Backpacks + Bags,Picnic Time Atlanta Braves Pranzo Lunch Tote,
Backpacks + Bags,Nike Brasilia Training Backpack,
Backpacks + Bags,The North Face Berkeley Small Duffel Bag,
Backpacks + Bags,The North Face Explore Bardu II Cross Body Bag,
Backpacks + Bags,"SwissGear Spinner 29"" Check-In Bag",
Backpacks + Bags,Nike Brasilia XL Backpack,
Backpacks + Bags,SwissDigital Terabyte Backpack,
Backpacks + Bags,Magellan Outdoors Castlewood 55L Hydration Pack,
Backpacks + Bags,Nike Women's Gym Club Training Duffel Bag,
Backpacks + Bags,The North Face Recon Backpack,
Backpacks + Bags,Fairtex Backpack,
Backpacks + Bags,geckobrands Pursuit Realtree Edge Backpack,
Backpacks + Bags,Magellan Outdoors Blaze Backpack,
Backpacks + Bags,The North Face Tote Backpack,
Backpacks + Bags,Ful Tennman Laptop Backpack,
Backpacks + Bags,Nike Brasilia 9.0 Training Backpack,
Backpacks + Bags,Black Diamond Magnum 16 Backpack,
Backpacks + Bags,The North Face Bozer III Lumbar Hip Pack,
Backpacks + Bags,Olympia USA Element 20 in Duffel Bag,
Backpacks + Bags,Schutt Varsity Individual Equipment Duffel Bag,
Backpacks + Bags,Picnic Time Miami Dolphins Pranzo Lunch Tote,
Backpacks + Bags,Magellan Outdoors Compression Bag,
Backpacks + Bags,Nike Hayward 2.0 Printed Backpack,
Backpacks + Bags,geckobrands Waterproof Lightweight Backpack,
Backpacks + Bags,Carhartt Classic Plus Work Backpack,
Backpacks + Bags,Magellan Outdoors Hewitt Travel Bag,
Backpacks + Bags,Accessories 22 Keely Sling Backpack,
Backpacks + Bags,adidas Defender IV Medium Duffel Bag,
Backpacks + Bags,Magellan Outdoors Expedition Duffel Bag,
Backpacks + Bags,adidas Hermosa II Mesh Backpack,
Backpacks + Bags,adidas Skyline Sackpack,
Backpacks + Bags,The North Face Women's Borealis Backpack,
Backpacks + Bags,Magellan Outdoors Women's Canvas Tote,
Backpacks + Bags,"Magellan Outdoors™ 22"" Wheeled Duffle Bag",
Backpacks + Bags,Bixbee Kids' Sparkalicious Medium Duffel Bag,
Backpacks + Bags,Reebok Warrior II Small Duffel Bag,
Backpacks + Bags,adidas Squad Backpack,
Backpacks + Bags,Nike Brasilia 9.0 Training Backpack,
Backpacks + Bags,Nike Brasilia Clear Training Backpack,
Backpacks + Bags,Gregory Men's Miwok 18 Backpack,
Backpacks + Bags,Nike Brasilia XL 9.0 Backpack,
Backpacks + Bags,Under Armour Boys' UA Storm Scrimmage Backpack,
Backpacks + Bags,geckobrands Convertible Tote And Backpack,
Backpacks + Bags,adidas Graphic Duffel Bag,
Backpacks + Bags,Nike Radiate Club Training Duffel Bag,
Backpacks + Bags,Picnic Time Carolina Panthers Pranzo Lunch Tote,
Backpacks + Bags,Columbia Sportswear Zigzag 30L Backpack,
Backpacks + Bags,adidas Women's Studio Hybrid Tote Bag,
Backpacks + Bags,Academy Sports + Outdoors Dog Hunting Graphic Insulated Tote Bag,
Backpacks + Bags,The North Face Men’s Jester Backpack,
Backpacks + Bags,Nike Men's Brasilia 7 Large Mesh Backpack,
Backpacks + Bags,O'Rageous Cabana Beach Tote with Bottom Cooler Pocket,
Backpacks + Bags,Dickies Study Hall Backpack,
Backpacks + Bags,Logo™ Kansas State University Athletic Duffel Bag,
Backpacks + Bags,Disney Kids' Eco Tote Bag,
Backpacks + Bags,adidas Rumble III Sackpack Drawstring Bag,
Backpacks + Bags,geckobrands Waterproof 50 L PVC Duffel,
Backpacks + Bags,JanSport Cool Student Remix Backpack,
Backpacks + Bags,Ecogear Mohave Tui II Backpack,
Backpacks + Bags,Avalanche Jenks Cinch Outdoor Backpack,
Backpacks + Bags,The North Face City Voyager Day Pack,
Backpacks + Bags,JanSport Classic Fifth Ave Camo Fanny Pack,
Backpacks + Bags,Under Armour Women's Favorite Bag,
Backpacks + Bags,Picnic Time Oklahoma State University Pranzo Lunch Tote,
Backpacks + Bags,Picnic Time Jacksonville Jaguars Pranzo Lunch Tote,
Backpacks + Bags,Under Armour Scrimmage 2.0 Backpack,
Backpacks + Bags,JanSport Way Out Waist Pack,
Backpacks + Bags,Under Armour Undeniable 3.0 Extra Small Duffel Bag,
Backpacks + Bags,Ful Refugee Backpack,
Backpacks + Bags,JanSport Half Pint Mini Backpack,
Backpacks + Bags,Nike 2.0 AOP Gym Club Bag,
Backpacks + Bags,Picnic Time North Carolina State University Pranzo Lunch Tote,
Backpacks + Bags,Nike Vapor Gymsack,
Backpacks + Bags,geckobrands 8 Pocket Flip Flop Tote Bag,
Backpacks + Bags,Nike Brasilia 9.0 Duffel Bag,
Backpacks + Bags,Nike Kids' Graphic Gym Sack,
Backpacks + Bags,adidas Defender IV Large Duffel Bag,
Backpacks + Bags,Under Armour Adaptable Backpack,
Backpacks + Bags,Under Armour Gameday 2.0 Backpack,
Backpacks + Bags,SwissDigital Surge Backpack,
Backpacks + Bags,JanSport® Sinder 15 Bag,
Backpacks + Bags,The North Face Mountain Lifestyle Recon Backpack,
Backpacks + Bags,The North Face Borealis Backpack,
Backpacks + Bags,The North Face Thunder 30 in Rolling Duffel Bag,
Backpacks + Bags,Arctic Zone Girls' Zipperless Lunch Pack,
Backpacks + Bags,adidas Diablo Small Duffel Bag,
Backpacks + Bags,"Timber Creek 26"" Large Stuff Bag",
Backpacks + Bags,Kelty Redwing 44L Backpack,
Backpacks + Bags,Under Armour Contain 4.0 Backpack Duffle Bag,
Backpacks + Bags,Concept One South Park Kenny McCormick Cosplay Backpack,
Backpacks + Bags,The North Face Terra 40 Backpack,
Backpacks + Bags,Nike Kids' Printed Gym Sack Drawstring Bag,
Backpacks + Bags,Nike Tanjun Backpack,
Backpacks + Bags,Under Armour Storm Contender Backpack,
Backpacks + Bags,Timber Creek® Compression Bag,
Backpacks + Bags,adidas Prime III Backpack,
Backpacks + Bags,Under Armour Women's Cinch Printed Tote Bag,
Backpacks + Bags,Under Armour 12-Can Cooler,
Backpacks + Bags,adidas Climacool Strength Backpack,
Backpacks + Bags,adidas Redondo Mesh Sling Backpack,
Backpacks + Bags,adidas Squad IV Duffel Bag,
Backpacks + Bags,Nike Team Training Duffel Bag,
Backpacks + Bags,Magellan Outdoors Reese Backpack,
Backpacks + Bags,Nike Hoops Elite Gym Sack,
Backpacks + Bags,Magellan Outdoors™ Owen Backpack,
Backpacks + Bags,Lewis N. Clark ElectroLight Tote Bag,
Backpacks + Bags,JanSport Big Student Backpack,
Backpacks + Bags,Magellan Outdoors Backpack Cover,
Backpacks + Bags,Mizuno Front Office 21 Backpack,
Backpacks + Bags,Ecogear Snow Leopard 40L Hiking Backpack,
Backpacks + Bags,Avalanche Provo Top Load Daypack Backpack,
Backpacks + Bags,Bell Tanker 800 Messenger Hydration Pack,
Backpacks + Bags,Kelty Redwing 32L Backpack,
Backpacks + Bags,adidas Team Issue Medium Duffel Bag,
Backpacks + Bags,SwissGear 5505 Laptop Backpack,
Backpacks + Bags,Under Armour Women's Big Wordmark Tote,
Backpacks + Bags,Nike SB RPM Printed Skate Backpack,
Backpacks + Bags,Carhartt Cargo Large Pack and Cooler,
Backpacks + Bags,geckobrands Swim Small Utility Bag,
Backpacks + Bags,SwissDigital Widget Backpack,
Backpacks + Bags,JanSport Indio Crossbody Backpack,
Backpacks + Bags,Nike Heritage GMSK 2.0 Drawstring Gym Sack,
Backpacks + Bags,JanSport Cross Town Backpack,
Backpacks + Bags,The North Face Mountain Lifestyle Borealis Backpack,
Backpacks + Bags,The North Face Base Camp Voyager 46 L Duffel Bag,
Backpacks + Bags,The North Face Women's Jester Backpack,
Backpacks + Bags,Under Armour Hustle 5.0 Backpack,
Backpacks + Bags,The North Face Bozer Cross Body Bag,
Backpacks + Bags,Under Armour Undeniable 4.0 Large Duffel Bag,
Backpacks + Bags,Magellan Outdoors™ Duffel Bag,
Backpacks + Bags,Under Armour Favorite Tote Bag,
Backpacks + Bags,JanSport® Klamath 55 Backpack,
Backpacks + Bags,Nike Men's Alpha Adapt Gym Sack,
Backpacks + Bags,Nike Elite Pro Basketball Backpack,
Backpacks + Bags,Bixbee Kids' Outer Space Backpack and Lunch Box,
Backpacks + Bags,The North Face Explore Hip Pack,
Backpacks + Bags,Logo™ University of Tennessee Halftime Lunch Cooler,
Backpacks + Bags,Under Armour Coalition 2.0 Backpack,
Backpacks + Bags,Under Armour Women's Favorite Logo Tote Bag,
Backpacks + Bags,Nike Boys' AOP Gym Sack Drawstring Bag,
Backpacks + Bags,Nike Brasilia 7 XL Backpack,
Backpacks + Bags,The North Face Women's Recon Backpack,
Backpacks + Bags,Austin Trading Co. Corey Backpack,
Backpacks + Bags,Under Armour Contender 2.0 Backpack,
Backpacks + Bags,SwissDigital Switch Backpack,
Backpacks + Bags,The North Face City Voyager Cross Body Bag,
Backpacks + Bags,Magellan Outdoors™ 40 Barrel Duffel Bag,
Backpacks + Bags,Maccabi Art FC Barcelona Lunch Cooler,
Backpacks + Bags,Reebok Power Pack II Laptop Backpack,
Backpacks + Bags,JanSport Big Student Backpack,
Backpacks + Bags,Nike Adults' HPS Elite Basketball Duffel Bag,
Backpacks + Bags,Nike Brasilia 9.0 Medium Training Duffel Bag,
Backpacks + Bags,Arctic Zone Zipperless Lunch Pack,
Backpacks + Bags,The North Face Women's Isabella Backpack,
Backpacks + Bags,Ful Wendell Laptop Backpack,
Backpacks + Bags,The North Face Large Base Camp Duffel Bag,
Backpacks + Bags,Marucci Team Duffel Bag,
Backpacks + Bags,geckobrands Convertible Tote Backpack,
Backpacks + Bags,Bixbee Kids' Soccer Star Large Duffel Bag With Ball Pouch,
Backpacks + Bags,Converse Straight Edge Backpack,
Backpacks + Bags,Nike Swoosh Lunch Tote,
Backpacks + Bags,Nike Heritage 2.0 Drawstring Bag,
Backpacks + Bags,Schutt Large Team Equipment Bag,
Backpacks + Bags,JanSport® Mesh Backpack,
Backpacks + Bags,Nike Kids' AOP Gym Sack Drawstring Bag,
Backpacks + Bags,adidas Sport to Street Tote Bag,
Backpacks + Bags,JanSport Far Out 40L Backpack,
Backpacks + Bags,Nike Advance Gym Sack,
Backpacks + Bags,Nike Deck Bag,
Backpacks + Bags,Magellan Outdoors 24 in Duffel Bag,
Backpacks + Bags,adidas Essentials 2 Backpack,
Backpacks + Bags,JanSport® Agave Backpack,
Backpacks + Bags,JanSport® Mesh Pack,
Backpacks + Bags,adidas Women's Studio Duffel,
Backpacks + Bags,JanSport Classic Fifth Ave Fanny Pack,
Backpacks + Bags,Maccabi Art Real Madrid FC Buckled Lunch Bag,
Backpacks + Bags,Costa Large Duffel Bag,
Backpacks + Bags,"Samsonite Aspire GR8 29"" Spinner Luggage",
Backpacks + Bags,Worth® Bat Backpack,
Backpacks + Bags,Nike Kids' Brasilia Insulated Lunch Duffel Bag,
Backpacks + Bags,A.D Sutton Girls' Vinyl Bottom Dome Backpack,
Backpacks + Bags,Under Armour Undeniable 4.0 Duffel Bag,
Backpacks + Bags,adidas Mission Backpack,
Backpacks + Bags,Magellan Outdoors Hadley Backpack,
Backpacks + Bags,Picnic Time Clemson University Pranzo Lunch Tote,
Backpacks + Bags,Pokemon Kids' 16 in Backpack,
Backpacks + Bags,JanSport Right Pack Backpack,
Backpacks + Bags,Nike Rolling Backpack,
Backpacks + Bags,The North Face Medium Base Camp Duffel Bag,
Backpacks + Bags,Magellan Outdoors 21 in Spinner Suitcase,
Backpacks + Bags,Under Armour Undeniable 4.0 XS Duffel Bag,
Backpacks + Bags,Under Armour Contain Duo Small Duffel Bag,
Backpacks + Bags,SwissDigital Zion Massage Backpack,
Backpacks + Bags,Star Wars™ Boys' Backpack,
Backpacks + Bags,Nike Brasilia 9.0 Gym Sack,
Backpacks + Bags,Global Degree Kids' Eco Tote,
Backpacks + Bags,Columbia Accessory Case,
Backpacks + Bags,SwissDigital Katy Rose Massage Backpack,
Backpacks + Bags,Nike Brasilia Training Duffel Bag,
Backpacks + Bags,geckobrands Waterproof Mahi geckoflage Beach Tote,
Backpacks + Bags,Coleman 29 in Faimont Upright Suitcase,
Backpacks + Bags,Nike Kids' Graphic Drawstring Gym Sack,
Backpacks + Bags,Apera Performance Duffel Bag,
Backpacks + Bags,Austin Trading Co.™ Classic Mesh Backpack,
Backpacks + Bags,Love & Pineapples Mini Backpack,
Backpacks + Bags,"Magellan Outdoors™ 36"" Wheeled Drop-Bottom Duffle Bag",
Backpacks + Bags,Nike Brasilia Training Drawstring Gym Sack,
Backpacks + Bags,Battle Lockdown 6 Sling Bag,
Backpacks + Bags,Picnic Time Texas Christian University Pranzo Lunch Tote,
Backpacks + Bags,"Carhartt Legacy Collection 20"" Gear Bag",
Backpacks + Bags,Nike Brasilia Mesh Backpack,
Backpacks + Bags,Under Armour Women's Midi 2.0 Backpack,
Backpacks + Bags,Logo™ Vanderbilt University Sandlot Duffle Bag,
Backpacks + Bags,Black Diamond Trail Blitz 16 Backpack,
Backpacks + Bags,Nike JDI Fuel Pack Lunch Bag,
Backpacks + Bags,Maccabi Art Real Madrid CF Lunch Cooler,
Backpacks + Bags,Ful Load Rider 25 in Hard-Sided Spinner Rolling Luggage,
Backpacks + Bags,Maccabi Art Real Madrid FC Lunch Bag,
Backpacks + Bags,Bixbee Girls' Sparkalicious Backpack,
Backpacks + Bags,Magellan Outdoors Compression Bag,
Backpacks + Bags,Kelty Trail Redwing 44 Backpack,
Backpacks + Bags,Team Beans Jacksonville Jaguars Clear Messenger Bag,
Backpacks + Bags,The North Face Women's Pivoter Backpack,
Backpacks + Bags,adidas Youth Classic 3S Backpack,
Backpacks + Bags,SwissDigital Sound Byte Speaker Backpack,
Backpacks + Bags,Under Armour Hudson Men's Backpack,
Backpacks + Bags,Logo™ University of Texas Halftime Lunch Cooler,
Backpacks + Bags,Nike Heritage Waist Pack,
Backpacks + Bags,The North Face Surge Backpack,
Backpacks + Bags,Under Armour Undeniable Sackpack,
Backpacks + Bags,The North Face Haystack Backpack,
Backpacks + Bags,The North Face Borealis Tote Bag,
Backpacks + Bags,geckobrands Limitless School Backpack,
Backpacks + Bags,JanSport Agave Backpack,
Backpacks + Bags,Academy Sports + Outdoors Crawfish Graphic Insulated Tote Bag,
Backpacks + Bags,The North Face Mountain Lifestyle Surge Backpack,
Backpacks + Bags,SwissDigital Pearl Rose Massage Backpack,
Backpacks + Bags,Timber Creek® Waistpack,
Backpacks + Bags,Maccabi Art FC Barcelona Lunch Bag,
Backpacks + Bags,Schutt Standing Roller Duffel Bag,
Backpacks + Bags,Picnic Time Baylor University Pranzo Lunch Tote,
Backpacks + Bags,Ful Brick House Laptop Sling Backpack,
Backpacks + Bags,adidas Prime 6 Backpack,
Backpacks + Bags,Coleman® Large Compression Stuff Sack,
Backpacks + Bags,JanSport Lunch Break Insulated Lunch Tote,
Backpacks + Bags,Picnic Time Texas Tech University Pranzo Lunch Tote,
Backpacks + Bags,Picnic Time Kansas City Royals Pranzo Lunch Tote,
Backpacks + Bags,Carhartt Legacy Collection Deluxe Work Pack,
Backpacks + Bags,Under Armour Undeniable 4.0 XL Duffel Bag,
Backpacks + Bags,The North Face Mountain Lifestyle Pivoter Backpack,
Backpacks + Bags,Ecogear Grizzly Backpack,
Backpacks + Bags,adidas Alliance Sport Sackpack,
Backpacks + Bags,Nike Just Do It Fuel Pack Lunch Bag,
Backpacks + Bags,Under Armour Hustle Bat Pack,
Backpacks + Bags,Nike Brasilia Varsity Training Backpack,
Backpacks + Bags,adidas Defender IV Small Duffel Bag,
Backpacks + Bags,SwissGear Rolling Office Tote Luggage,
Backpacks + Bags,Magellan Outdoors 27 in Upright Rolling Duffel Bag,
Backpacks + Bags,Arctic Zone Girls' Zipperless Lunch Pack,
Backpacks + Bags,The North Face Lumbar Fanny Pack,
Backpacks + Bags,JanSport Good Vibes Gear Hauler Duffel Bag,
Backpacks + Bags,The North Face Base Camp Voyager 32 L Duffel Bag,
Backpacks + Bags,ASICS® Gear Bag,
Backpacks + Bags,geckobrands Oversized Beach Tote,
Backpacks + Bags,Under Armour® PTH™ Victory Sackpack,
Backpacks + Bags,Logo™ University of Louisville Halftime Lunch Cooler,
Backpacks + Bags,Maccabi Art Tottenham FC Lunch Cooler,
Backpacks + Bags,adidas Santiago Lunch Bag,
Backpacks + Bags,JanSport Gnarly Gnapsack 30L Backpack,
Backpacks + Bags,Magellan Outdoors Blakeley Backpack,
Backpacks + Bags,Columbia Sportswear Lightweight Packable 21L Backpack,
Backpacks + Bags,The North Face Cross Body,
Backpacks + Bags,Nike Lunch Duffel,
Backpacks + Bags,SwissGear 28 in Spinner Check-In Luggage,
Backpacks + Bags,Avalanche Quincy Messenger Bag,
Backpacks + Bags,Logo™ University of Kentucky Halftime Lunch Cooler,
Backpacks + Bags,The North Face Base Camp Extra Large Duffel Bag,
Backpacks + Bags,"Carhartt Legacy Collection 30"" Gear Bag",
Backpacks + Bags,Nike Brasilia 9 Training Duffel Bag,
Backpacks + Bags,Team Beans Atlanta Falcons Clear Messenger Bag,
Backpacks + Bags,The North Face Mountain Lifestyle Jester Backpack,
Backpacks + Bags,Carhartt Women's Legacy Collection Carryall Crossbody Bag,
Backpacks + Bags,Magellan Outdoors 6-Can Cooler,
Backpacks + Bags,Academy Sports + Outdoors Baseball Graphic Insulated Tote Bag,
Backpacks + Bags,Nike Heritage Hip Waist Pack,
Backpacks + Bags,Nike Storm Slim Waistpack,
Backpacks + Bags,Chums Clear Jam Waist Pack,
Backpacks + Bags,Logo Kennesaw State University Halftime Lunch Cooler,
Backpacks + Bags,adidas™ Estadio II Team Backpack,
Backpacks + Bags,adidas Stratton II Backpack,
Backpacks + Bags,Black Diamond Trail Zip 18 Backpack,
Backpacks + Bags,Nike Hayward 2.0 Backpack,
Backpacks + Bags,Forever Collectibles™ University of Georgia Clear Messenger Bag,
Backpacks + Bags,Avalanche Yutan 20 in Outdoor Backpack,
Backpacks + Bags,Picnic Time University of Tennessee Pranzo Lunch Tote,
Backpacks + Bags,Nike Utility Speed Graphic Training Backpack,
Backpacks + Bags,Logo™ Virginia Tech Varsity Messenger Bag,
Backpacks + Bags,geckobrands Large Utility Tote Bag,
Backpacks + Bags,Picnic Time Georgia Tech Pranzo Lunch Tote,
Backpacks + Bags,Logo™ Florida State University Varsity Messenger Bag,
Backpacks + Bags,Xenith Training Bag,
Backpacks + Bags,Magellan Outdoors 34 in Barrel Duffel Bag,
Backpacks + Bags,Magellan Outdoors 18 in Duffel Bag,
Backpacks + Bags,JanSport Cross Town Backpack,
Backpacks + Bags,JanSport Disney SuperBreak Daypack,
Backpacks + Bags,adidas VFA III Backpack,
Backpacks + Bags,Maccabi Art FC Barcelona Soccer Ball to Lunch Bag,
Backpacks + Bags,Under Armour Undeniable 4.0 Extra Small Duffel Bag,
Backpacks + Bags,Logo™ Texas A&M University Halftime Lunch Cooler,
Backpacks + Bags,The North Face Recon Backpack,
Backpacks + Bags,The North Face Women’s Jester Backpack,
Backpacks + Bags,Under Armour Huey Backpack,
Backpacks + Bags,geckobrands Waterpoof Phone Tote Bag,
Backpacks + Bags,adidas Classic 3-Stripes Backpack,
Backpacks + Bags,Igloo Vertical Everyday Lunch Box with Hand Sanitizer,
Backpacks + Bags,Madison & Dakota Girls' Ultrasuede Fringe Backpack,
Backpacks + Bags,Reebok Men's Bumper Medium Duffel Bag,
Backpacks + Bags,Magellan Outdoors Ranger Waistpack,
Backpacks + Bags,Black Diamond Bullet 16 Backpack,
Backpacks + Bags,Under Armour VX2-Undeniable Backpack,
Backpacks + Bags,Under Armour Undeniable II Duffel Bag,
Backpacks + Bags,adidas Stratton XL Backpack,
Backpacks + Bags,JanSport Half Pint Lone Star Backpack,
Backpacks + Bags,JanSport Cool Student Backpack,
Backpacks + Bags,The North Face Women's Jester Backpack,
Backpacks + Bags,5.11 Tactical™ Covert Box Messenger Bag,
Backpacks + Bags,Maccabi Art FC Barcelona Buckled Lunch Bag,
Backpacks + Bags,Under Armour Big Logo 5.0 Backpack,
Backpacks + Bags,Nike Sportswear Essentials Backpack,
Backpacks + Bags,Under Armour Hustle 4.0 Backpack,
Backpacks + Bags,Nike Brasilia Printed Training Gym Sack,
Backpacks + Bags,Logo™ University of Missouri Halftime Lunch Cooler,
Backpacks + Bags,Nike Brasilia Large Duffel Bag,
Backpacks + Bags,geckobrands Optivate Realtree Camo 18 Backpack,
