flag,normal_image src,hover_image src,heart src,productGalleryOverride src,productGalleryOverride src 2,productGalleryOverride src 3,lazy_href,lazy_href href,part_number 2,title,key_details,key_details 2,key_details 3,key_details 4,ellip,morelink,morelink href,price,save,percent-box,final-price,ca-content-container,ca-price-focus,ca-link,ships,ca-link 2,text 2,text 3,text 4,price_guarantee,compareDefault,compareAdd,bv_main_container href,bv_stars_svg_no_wrap href,bv_text,bv_text 2,key_details 5,key_details 6,key_details 7,key_details 8,key_details 9,key_details 10,key_details 11,key_details 12,key_details 13
NEW ARRIVAL,https://p2-ofp.static.pub/ShareResource/560x450/SSNP/4X20V24707/4X20V24707-560x450-01.501494b9894e3f23.png,https://p1-ofp.static.pub/ShareResource/560x450/SSNP/4X20V24707/4X20V24707-560x450-02.7ca486961d85c4ed.png,https://p1-ofp.static.pub/fes/cms/2020/12/25/76apjfkml79bg5qcf172tvt0bw0c8s348607.png,https://p2-ofp.static.pub/fes/cms/2021/07/06/2h8n4ofixc8g8i94vopfat048ld37m944694.svg,https://p3-ofp.static.pub/fes/cms/2021/07/06/efrjjv1rz2xiuvpm0emnwj6y2gmai3506628.svg,https://p2-ofp.static.pub/fes/cms/2021/07/06/wxdfgadg28utnas6ca5d28oot1lcxj806083.svg,ThinkCentre 90W AC Adapter II (slim tip)-US/Can/Mexico/Philippines/Guam,https://www.lenovo.com/us/en/p/accessories-and-software/chargers-and-batteries/chargers/4X20V24707,4X20V24707,Key Details,Input 3pin (IEC 320 C6 type) model,Dimensions:129*53*30mm,Energy-star requirement based on EPA appliance,"Constant maximum output power voltage 90W, with power harmonics requirement",,,,,,,$74.99,6 Months Promotional Financing Available* On purchases of  or more made with the Lenovo Credit Card,$500,Learn More,Ships in 4+ months,Learn More,Earn,$2,in Rewards,Price Match Guarantee,Compare,Added!,,,,,Input 3pin (IEC 320 C6 type) model,Dimensions:129*53*30mm,Energy-star requirement based on EPA appliance,"Constant maximum output power voltage 90W, with power harmonics requirement",,,,,
,https://p1-ofp.static.pub/ShareResource/560x450/SSNP/GX31D10707/GX31D10707-560x450-01.5516c530ee1f7193.png,https://p1-ofp.static.pub/ShareResource/560x450/SSNP/GXC1D05522/GXC1D05522-500x400-01.ab2ceeb8d21d076c.png,https://p1-ofp.static.pub/fes/cms/2020/12/25/76apjfkml79bg5qcf172tvt0bw0c8s348607.png,https://p2-ofp.static.pub/fes/cms/2021/07/06/2h8n4ofixc8g8i94vopfat048ld37m944694.svg,https://p3-ofp.static.pub/fes/cms/2021/07/06/efrjjv1rz2xiuvpm0emnwj6y2gmai3506628.svg,https://p2-ofp.static.pub/fes/cms/2021/07/06/wxdfgadg28utnas6ca5d28oot1lcxj806083.svg,Mobility Bundle 2,https://www.lenovo.com/us/en/p/accessories-and-software/convenience-bundles/BUNDLE21012,BUNDLE21012,Includes,,,,,,,,$159.96,save $80.97,50% off,$78.99,6 Months Promotional Financing Available* On purchases of  or more made with the Lenovo Credit Card,$500,Learn More,,Learn More,Earn,$2,in Rewards,Price Match Guarantee,Compare,Added!,,,,,,,,,,,,,
,https://p1-ofp.static.pub/medias/bWFzdGVyfHJvb3R8MTMzNzh8aW1hZ2UvanBlZ3xoNDUvaDM1LzExNjAwMDc2MzA4NTEwLmpwZ3wzMGYxMDVmMzAzOTcyZTgzZTQ5Zjg4NTY2N2Q0NDQxNzcxYzI0MTgyZjM1NWE0ODQ5NWM2YmY5YmU3MmRjNGRl/EEC3B2D0-3C3D-4CDD-A0CC-2D26F6CE78CA.jpg,https://p1-ofp.static.pub/medias/bWFzdGVyfHJvb3R8MTMzNzh8aW1hZ2UvanBlZ3xoNDUvaDM1LzExNjAwMDc2MzA4NTEwLmpwZ3wzMGYxMDVmMzAzOTcyZTgzZTQ5Zjg4NTY2N2Q0NDQxNzcxYzI0MTgyZjM1NWE0ODQ5NWM2YmY5YmU3MmRjNGRl/EEC3B2D0-3C3D-4CDD-A0CC-2D26F6CE78CA.jpg,https://p1-ofp.static.pub/fes/cms/2020/12/25/76apjfkml79bg5qcf172tvt0bw0c8s348607.png,https://p2-ofp.static.pub/fes/cms/2021/07/06/2h8n4ofixc8g8i94vopfat048ld37m944694.svg,https://p3-ofp.static.pub/fes/cms/2021/07/06/efrjjv1rz2xiuvpm0emnwj6y2gmai3506628.svg,https://p2-ofp.static.pub/fes/cms/2021/07/06/wxdfgadg28utnas6ca5d28oot1lcxj806083.svg,VIDEO CAPTURE,https://www.lenovo.com/us/en/p/accessories-and-software/webcams-and-video/Webcams-&-Video_Video-Capture-Devices/78014797,78014797,Key Details,Turn analog video into iTunes-ready files,"Put family memories on your Mac, and more","Video to your Mac from a DVR, DVD player, or set-top box",,,,,,,,$87.99,6 Months Promotional Financing Available* On purchases of  or more made with the Lenovo Credit Card,$500,Learn More,Ships FREE in 1-3 business days,Learn More,Earn,$2,in Rewards,Price Match Guarantee,Compare,Added!,,,,,Turn analog video into iTunes-ready files,"Put family memories on your Mac, and more","Video to your Mac from a DVR, DVD player, or set-top box",,,,,,
,https://p1-ofp.static.pub/medias/bWFzdGVyfHJvb3R8MTMwMzJ8aW1hZ2UvanBlZ3xoNWIvaDc2LzExNjAwODAzNDYzMTk4LmpwZ3w0NmUzODdiZmM2MWEzNjcyYmY5ZTI2NWE4OGM3YzFlNmQwYzYwODI3ODIxNjA1ZDU0Zjk1MDNkYzdmZWZkMWNi/4C9F9C6A-4AE1-403E-811D-2F871A7426E9.jpg,https://p1-ofp.static.pub/medias/bWFzdGVyfHJvb3R8MTMwMzJ8aW1hZ2UvanBlZ3xoNWIvaDc2LzExNjAwODAzNDYzMTk4LmpwZ3w0NmUzODdiZmM2MWEzNjcyYmY5ZTI2NWE4OGM3YzFlNmQwYzYwODI3ODIxNjA1ZDU0Zjk1MDNkYzdmZWZkMWNi/4C9F9C6A-4AE1-403E-811D-2F871A7426E9.jpg,https://p1-ofp.static.pub/fes/cms/2020/12/25/76apjfkml79bg5qcf172tvt0bw0c8s348607.png,https://p2-ofp.static.pub/fes/cms/2021/07/06/2h8n4ofixc8g8i94vopfat048ld37m944694.svg,https://p3-ofp.static.pub/fes/cms/2021/07/06/efrjjv1rz2xiuvpm0emnwj6y2gmai3506628.svg,https://p2-ofp.static.pub/fes/cms/2021/07/06/wxdfgadg28utnas6ca5d28oot1lcxj806083.svg,TP-Link Omada Cloud Controller OC200 - network management device,https://www.lenovo.com/us/en/p/accessories-and-software/wireless-and-networking/wireless-accessories/78015093,78015093,Key Details,Omada Wi-Fi network controller,"Accessible through direct access, cloud portal or mobile app",Dual power selection PoE (802.3af/802.3at) and micro USB for flexible installation,Powerful CPU and USB auto backup for robustness and stability,,,,,,,$89.99,6 Months Promotional Financing Available* On purchases of  or more made with the Lenovo Credit Card,$500,Learn More,Ships FREE in 1-3 business days,Learn More,Earn,$2,in Rewards,Price Match Guarantee,Compare,Added!,,,,,Omada Wi-Fi network controller,"Accessible through direct access, cloud portal or mobile app",Dual power selection PoE (802.3af/802.3at) and micro USB for flexible installation,Powerful CPU and USB auto backup for robustness and stability,Secure guest network with multiple login options,,Secure guest network with multiple login options,,
,https://p1-ofp.static.pub/medias/bWFzdGVyfHJvb3R8MTE5Mjl8aW1hZ2UvanBlZ3xoNTkvaDRkLzExNjAwMTc3MzY1MDIyLmpwZ3xlMjdjMTFjMzM1MjY2NTNmMTdjZTdiOGNiNTQwMDFlNjRkMTNmOWIxNmE4NDI5OTg3ZTFiZDVjZjEyNGE0YzVj/06F69411-63A7-42E9-BA13-CF99A008AB64.jpg,https://p1-ofp.static.pub/medias/bWFzdGVyfHJvb3R8MTE1NDd8aW1hZ2UvanBlZ3xoZTQvaGZhLzExNzI0NTY5NDExNjE0LmpwZ3xiYTMzZDQzMTc0MzgxZTZjYTFlYzNiMjNmOTNkNTE3Mzg2YWE4YjcxNTA0YjdiZjIyZmRlNjU3MTM0ODQwOWZi/5FA575D7-7DA8-4F65-865A-8F325FEF846E.jpg,https://p1-ofp.static.pub/fes/cms/2020/12/25/76apjfkml79bg5qcf172tvt0bw0c8s348607.png,https://p2-ofp.static.pub/fes/cms/2021/07/06/2h8n4ofixc8g8i94vopfat048ld37m944694.svg,https://p3-ofp.static.pub/fes/cms/2021/07/06/efrjjv1rz2xiuvpm0emnwj6y2gmai3506628.svg,https://p2-ofp.static.pub/fes/cms/2021/07/06/wxdfgadg28utnas6ca5d28oot1lcxj806083.svg,EPOS I SENNHEISER GSP 300 - headset,https://www.lenovo.com/us/en/p/accessories-and-software/audio/headsets/78015236,78015236,Key Details,"Best""all round"" gaming headset",Closed-back for improved passive noise attenuation,High quality audio with deep bass,Microphone with flexible boom arm,,,,,,,$99.00,6 Months Promotional Financing Available* On purchases of  or more made with the Lenovo Credit Card,$500,Learn More,Ships FREE in 1-3 business days,Learn More,Earn Triple Rewards,$8,=,Price Match Guarantee,Compare,Added!,,,,,"Best""all round"" gaming headset",Closed-back for improved passive noise attenuation,High quality audio with deep bass,Microphone with flexible boom arm,Durable design,,Durable design,,
,https://p1-ofp.static.pub/medias/bWFzdGVyfHJvb3R8NDk2NHxpbWFnZS9qcGVnfGhiOC9oY2QvMTE2MDEyMzc4Njg1NzQuanBnfDVjMGY2NTMwZTQ2ODFjMzc3ZmI5ZWUxYzFmZTEwNzVhYmYxZjAzNmVlODU2MGE1NWE4ZmQxMzJlNWY3ZmE4ZGU/B341B94B-EA83-4FED-861C-4FC1C32D2162.jpg,https://p1-ofp.static.pub/medias/bWFzdGVyfHJvb3R8NDk2NHxpbWFnZS9qcGVnfGhiOC9oY2QvMTE2MDEyMzc4Njg1NzQuanBnfDVjMGY2NTMwZTQ2ODFjMzc3ZmI5ZWUxYzFmZTEwNzVhYmYxZjAzNmVlODU2MGE1NWE4ZmQxMzJlNWY3ZmE4ZGU/B341B94B-EA83-4FED-861C-4FC1C32D2162.jpg,https://p1-ofp.static.pub/fes/cms/2020/12/25/76apjfkml79bg5qcf172tvt0bw0c8s348607.png,https://p2-ofp.static.pub/fes/cms/2021/07/06/2h8n4ofixc8g8i94vopfat048ld37m944694.svg,https://p3-ofp.static.pub/fes/cms/2021/07/06/efrjjv1rz2xiuvpm0emnwj6y2gmai3506628.svg,https://p2-ofp.static.pub/fes/cms/2021/07/06/wxdfgadg28utnas6ca5d28oot1lcxj806083.svg,Linksys VELOP Whole Home Intelligent Mesh WHW0101P - Wi-Fi system - 802.11a/b/g/n/ac - plug-in module,https://www.lenovo.com/us/en/p/accessories-and-software/wireless-and-networking/Wireless-&-Networking_Networking/78015140,78015140,Key Details,Intelligent Mesh Technology adapts to WiFi needs,Fits any wall socket to boost coverage for all your devices,Automatic software updates keep your WiFi future-proofed,Easy setup with the Linksys App has you online in minutes,,,,$129.99,save $30.00,23% off,$99.99,6 Months Promotional Financing Available* On purchases of  or more made with the Lenovo Credit Card,$500,Learn More,Ships FREE in 1-3 business days,Learn More,Earn,$3,in Rewards,Price Match Guarantee,Compare,Added!,,,,,Intelligent Mesh Technology adapts to WiFi needs,Fits any wall socket to boost coverage for all your devices,Automatic software updates keep your WiFi future-proofed,Easy setup with the Linksys App has you online in minutes,,,,,
,https://p1-ofp.static.pub/medias/bWFzdGVyfHJvb3R8NDMzNnxpbWFnZS9qcGVnfGhlNS9oZDEvMTE2MDI2NzAzODcyMzAuanBnfDAxZDJhODIyNzE3OTJiYWY0NTE5MDgyZmY0MTJkYTIyNTBiZjk3YWY3Yzk1Y2JjN2FiODFkZDBkMzQwNWU1Yjg/16547F0A-B412-498F-8DC5-7C7E4035E147.jpg,https://p1-ofp.static.pub/medias/bWFzdGVyfHJvb3R8NDMzNnxpbWFnZS9qcGVnfGhlNS9oZDEvMTE2MDI2NzAzODcyMzAuanBnfDAxZDJhODIyNzE3OTJiYWY0NTE5MDgyZmY0MTJkYTIyNTBiZjk3YWY3Yzk1Y2JjN2FiODFkZDBkMzQwNWU1Yjg/16547F0A-B412-498F-8DC5-7C7E4035E147.jpg,https://p1-ofp.static.pub/fes/cms/2020/12/25/76apjfkml79bg5qcf172tvt0bw0c8s348607.png,https://p2-ofp.static.pub/fes/cms/2021/07/06/2h8n4ofixc8g8i94vopfat048ld37m944694.svg,https://p3-ofp.static.pub/fes/cms/2021/07/06/efrjjv1rz2xiuvpm0emnwj6y2gmai3506628.svg,https://p2-ofp.static.pub/fes/cms/2021/07/06/wxdfgadg28utnas6ca5d28oot1lcxj806083.svg,Linksys RE7000 - Wi-Fi range extender,https://www.lenovo.com/us/en/p/accessories-and-software/wireless-and-networking/Wireless-&-Networking_Range-Extenders/78015137,78015137,Key Details,Multi-user MIMO and seamless roaming for faster and more efficient throughput,"Supports two Wi-Fi modes, to extend router's connection or create a Wi-Fi access point",Works with all Wi-Fi routers,Easy setup with WPS and Spot Finder technology,,,,$129.99,save $30.02,23% off,$99.97,6 Months Promotional Financing Available* On purchases of  or more made with the Lenovo Credit Card,$500,Learn More,Ships FREE in 1-3 business days,Learn More,Earn,$2,in Rewards,Price Match Guarantee,Compare,Added!,https://www.lenovo.com/us/en/p/accessories-and-software/wireless-and-networking/Wireless-&-Networking_Range-Extenders/78015137,[object Object],4.1,(131),Multi-user MIMO and seamless roaming for faster and more efficient throughput,"Supports two Wi-Fi modes, to extend router's connection or create a Wi-Fi access point",Works with all Wi-Fi routers,Easy setup with WPS and Spot Finder technology,,,,,
,https://p1-ofp.static.pub/medias/bWFzdGVyfHJvb3R8NzEwNHxpbWFnZS9qcGVnfGgyYy9oMDgvMTE3MjQ3Njc2NTgwMTQuanBnfDg0MDViMzExNGUwMDU1YTVlOGY2ZTIzMDU5ODhiZGRkMDM1ZTY0N2M4YTRlOGM0NTY1Yjg5M2EwY2ZhYWZjMzA/F6E75E39-4BE8-4815-AC31-33E17483B345.jpg,https://p1-ofp.static.pub/medias/bWFzdGVyfHJvb3R8NzEwNHxpbWFnZS9qcGVnfGgyYy9oMDgvMTE3MjQ3Njc2NTgwMTQuanBnfDg0MDViMzExNGUwMDU1YTVlOGY2ZTIzMDU5ODhiZGRkMDM1ZTY0N2M4YTRlOGM0NTY1Yjg5M2EwY2ZhYWZjMzA/F6E75E39-4BE8-4815-AC31-33E17483B345.jpg,https://p1-ofp.static.pub/fes/cms/2020/12/25/76apjfkml79bg5qcf172tvt0bw0c8s348607.png,https://p2-ofp.static.pub/fes/cms/2021/07/06/2h8n4ofixc8g8i94vopfat048ld37m944694.svg,https://p3-ofp.static.pub/fes/cms/2021/07/06/efrjjv1rz2xiuvpm0emnwj6y2gmai3506628.svg,https://p2-ofp.static.pub/fes/cms/2021/07/06/wxdfgadg28utnas6ca5d28oot1lcxj806083.svg,JABRA EVOLVE2 40 USB-C UC MONO ACCS,https://www.lenovo.com/us/en/p/accessories-and-software/audio/headsets/78014878,78014878,,,,,,,,,,,,$129.00,6 Months Promotional Financing Available* On purchases of  or more made with the Lenovo Credit Card,$500,Learn More,Ships FREE in 1-3 business days,Learn More,Earn,$3,in Rewards,Price Match Guarantee,Compare,Added!,,,,,,,,,,,,,
,https://p1-ofp.static.pub/medias/bWFzdGVyfHJvb3R8NzA4N3xpbWFnZS9qcGVnfGgwYS9oMWEvMTE3MjQ3NjI5Mzk0MjIuanBnfGRkZmMyZDc1MmU1YmRlNjEzZTA3ZTM3ODE4M2NiODhiYWQ1ZDBmZTNhYzEwMzkxMGY5MjYyNGExYzZmOTlmMGE/6A5B4184-3036-4816-8E27-8EF7DC782238.jpg,https://p1-ofp.static.pub/medias/bWFzdGVyfHJvb3R8NzA4N3xpbWFnZS9qcGVnfGgwYS9oMWEvMTE3MjQ3NjI5Mzk0MjIuanBnfGRkZmMyZDc1MmU1YmRlNjEzZTA3ZTM3ODE4M2NiODhiYWQ1ZDBmZTNhYzEwMzkxMGY5MjYyNGExYzZmOTlmMGE/6A5B4184-3036-4816-8E27-8EF7DC782238.jpg,https://p1-ofp.static.pub/fes/cms/2020/12/25/76apjfkml79bg5qcf172tvt0bw0c8s348607.png,https://p2-ofp.static.pub/fes/cms/2021/07/06/2h8n4ofixc8g8i94vopfat048ld37m944694.svg,https://p3-ofp.static.pub/fes/cms/2021/07/06/efrjjv1rz2xiuvpm0emnwj6y2gmai3506628.svg,https://p2-ofp.static.pub/fes/cms/2021/07/06/wxdfgadg28utnas6ca5d28oot1lcxj806083.svg,JABRA EVOLVE2 40 USB-A UC MONO ACCS,https://www.lenovo.com/us/en/p/accessories-and-software/audio/headsets/78014879,78014879,,,,,,,,,,,,$129.00,6 Months Promotional Financing Available* On purchases of  or more made with the Lenovo Credit Card,$500,Learn More,Ships FREE in 1-3 business days,Learn More,Earn,$3,in Rewards,Price Match Guarantee,Compare,Added!,,,,,,,,,,,,,
,https://p1-ofp.static.pub/medias/bWFzdGVyfHJvb3R8ODU1MXxpbWFnZS9qcGVnfGhkOS9oOTQvMTE2MDAxMzE5MTU4MDYuanBnfDgwNmMwMTA5YmE1NjU2MDIxZTdjNGQ5NDYzYzUxOWY3YTIzNjBjMDQxMjJhNTI4ODBkYmQzMGUzYWU4Yzk4OGU/2E6DEA81-D84F-4138-B778-C4A2D3F0A65C.jpg,https://p1-ofp.static.pub/medias/bWFzdGVyfHJvb3R8ODU1MXxpbWFnZS9qcGVnfGhkOS9oOTQvMTE2MDAxMzE5MTU4MDYuanBnfDgwNmMwMTA5YmE1NjU2MDIxZTdjNGQ5NDYzYzUxOWY3YTIzNjBjMDQxMjJhNTI4ODBkYmQzMGUzYWU4Yzk4OGU/2E6DEA81-D84F-4138-B778-C4A2D3F0A65C.jpg,https://p1-ofp.static.pub/fes/cms/2020/12/25/76apjfkml79bg5qcf172tvt0bw0c8s348607.png,https://p2-ofp.static.pub/fes/cms/2021/07/06/2h8n4ofixc8g8i94vopfat048ld37m944694.svg,https://p3-ofp.static.pub/fes/cms/2021/07/06/efrjjv1rz2xiuvpm0emnwj6y2gmai3506628.svg,https://p2-ofp.static.pub/fes/cms/2021/07/06/wxdfgadg28utnas6ca5d28oot1lcxj806083.svg,EZVIZ LC1C - network surveillance camera,https://www.lenovo.com/us/en/p/accessories-and-software/smart-home-essentials/Smart-Home-Essentials_Smart-Security/78015323,78015323,Key Details,"Dual lights, 2000-lumen brightness",1080p FHD resolution,Starlight standard sensor,Infrared night vision up to 25m / 82 ft.,,,,,,,$149.99,6 Months Promotional Financing Available* On purchases of  or more made with the Lenovo Credit Card,$500,Learn More,Ships FREE in 1-3 business days,Learn More,Earn,$4,in Rewards,Price Match Guarantee,Compare,Added!,https://www.lenovo.com/us/en/p/accessories-and-software/smart-home-essentials/Smart-Home-Essentials_Smart-Security/78015323,[object Object],4.2,(21),"Dual lights, 2000-lumen brightness",1080p FHD resolution,Starlight standard sensor,Infrared night vision up to 25m / 82 ft.,H.265 video compression,PIR motion-activated floodlights,H.265 video compression,PIR motion-activated floodlights,Built-in siren
,https://p1-ofp.static.pub/medias/bWFzdGVyfHJvb3R8NDg4OHxpbWFnZS9qcGVnfGhlMi9oYjkvMTE2MDEzMTMxNjk0MzguanBnfGQ0ZTI0YjU3MjMxZDA2YzEwODNmYjlmY2IxYzNhZGQ2YWNlYTJjMDY3Nzk1OGQzYzIwMzQ0NTlhYjM3ZTg1OWI/661E854D-FFC9-4215-B0B9-C3E35E220ECB.jpg,https://p1-ofp.static.pub/medias/bWFzdGVyfHJvb3R8NDg4OHxpbWFnZS9qcGVnfGhlMi9oYjkvMTE2MDEzMTMxNjk0MzguanBnfGQ0ZTI0YjU3MjMxZDA2YzEwODNmYjlmY2IxYzNhZGQ2YWNlYTJjMDY3Nzk1OGQzYzIwMzQ0NTlhYjM3ZTg1OWI/661E854D-FFC9-4215-B0B9-C3E35E220ECB.jpg,https://p1-ofp.static.pub/fes/cms/2020/12/25/76apjfkml79bg5qcf172tvt0bw0c8s348607.png,https://p2-ofp.static.pub/fes/cms/2021/07/06/2h8n4ofixc8g8i94vopfat048ld37m944694.svg,https://p3-ofp.static.pub/fes/cms/2021/07/06/efrjjv1rz2xiuvpm0emnwj6y2gmai3506628.svg,https://p2-ofp.static.pub/fes/cms/2021/07/06/wxdfgadg28utnas6ca5d28oot1lcxj806083.svg,"Linksys VELOP Whole Home Mesh Wi-Fi System WHW0102 - Wi-Fi system - 802.11a/b/g/n/ac, Bluetooth 4.1 - desktop",https://www.lenovo.com/us/en/p/accessories-and-software/wireless-and-networking/Wireless-&-Networking_Networking/78015141,78015141,Key Details,"Coverage for 2-3 bedroom home or apartment up to 3,000 square feet",Ideal for basic internet plans,Dual-Band series (AC2600 Wi-Fi speeds),Intelligent Mesh technology enables dynamic improvements to your home Wi-Fi,,,,$179.99,save $30.00,16% off,$149.99,6 Months Promotional Financing Available* On purchases of  or more made with the Lenovo Credit Card,$500,Learn More,Ships FREE in 1-3 business days,Learn More,Earn,$4,in Rewards,Price Match Guarantee,Compare,Added!,https://www.lenovo.com/us/en/p/accessories-and-software/wireless-and-networking/Wireless-&-Networking_Networking/78015141,[object Object],4.3,(46),"Coverage for 2-3 bedroom home or apartment up to 3,000 square feet",Ideal for basic internet plans,Dual-Band series (AC2600 Wi-Fi speeds),Intelligent Mesh technology enables dynamic improvements to your home Wi-Fi,,,,,
,https://p1-ofp.static.pub/medias/bWFzdGVyfHJvb3R8MTQxNjJ8aW1hZ2UvanBlZ3xoZGUvaDNjLzExNjAwNDcxMTYyOTEwLmpwZ3w5YTM5NDYxYWMzNDFkMTA1NDFlNjk1N2VlYWMzYWUxNGEwY2EwYzk0MzAyNTYzZmZiMDZhY2UzNjk4MTVlYjcz/AD876DC7-6C11-4449-B089-59C607D33557.jpg,https://p1-ofp.static.pub/medias/bWFzdGVyfHJvb3R8MTQxNjJ8aW1hZ2UvanBlZ3xoZGUvaDNjLzExNjAwNDcxMTYyOTEwLmpwZ3w5YTM5NDYxYWMzNDFkMTA1NDFlNjk1N2VlYWMzYWUxNGEwY2EwYzk0MzAyNTYzZmZiMDZhY2UzNjk4MTVlYjcz/AD876DC7-6C11-4449-B089-59C607D33557.jpg,https://p1-ofp.static.pub/fes/cms/2020/12/25/76apjfkml79bg5qcf172tvt0bw0c8s348607.png,https://p2-ofp.static.pub/fes/cms/2021/07/06/2h8n4ofixc8g8i94vopfat048ld37m944694.svg,https://p3-ofp.static.pub/fes/cms/2021/07/06/efrjjv1rz2xiuvpm0emnwj6y2gmai3506628.svg,https://p2-ofp.static.pub/fes/cms/2021/07/06/wxdfgadg28utnas6ca5d28oot1lcxj806083.svg,Linksys MAX-STREAM MR7350 - wireless router - 802.11ax - desktop,https://www.lenovo.com/us/en/p/accessories-and-software/wireless-and-networking/Wireless-&-Networking_Networking/78015298,78015298,Key Details,"Powered by Intelligent Mesh Technology, easily expand full speed Wi-Fi coverage","Smarter security with automatic updates, parental controls and guest mode",Setup and control your network from anywhere with the Linksys App,,,,,$169.99,save $20.00,11% off,$149.99,6 Months Promotional Financing Available* On purchases of  or more made with the Lenovo Credit Card,$500,Learn More,Ships FREE in 1-3 business days,Learn More,Earn,$4,in Rewards,Price Match Guarantee,Compare,Added!,https://www.lenovo.com/us/en/p/accessories-and-software/wireless-and-networking/Wireless-&-Networking_Networking/78015298,[object Object],4.3,(39),"Powered by Intelligent Mesh Technology, easily expand full speed Wi-Fi coverage","Smarter security with automatic updates, parental controls and guest mode",Setup and control your network from anywhere with the Linksys App,,,,,,
,https://p1-ofp.static.pub/medias/bWFzdGVyfHJvb3R8ODY2OHxpbWFnZS9qcGVnfGg5MC9oYjYvMTE2MDI2Njg4Nzk5MDIuanBnfDQ4MDE4YjE1MzY0MWI1OTA3MWNjYmE1NzdmNDBkY2QwODMzZDQ0ZDhmMzY1MDg0MDk0ZTkyZjRkM2FhNWQ5YWU/D56F88E4-2CD4-4CAA-99B2-9824C78501F2.jpg,https://p1-ofp.static.pub/medias/bWFzdGVyfHJvb3R8ODY2OHxpbWFnZS9qcGVnfGg5MC9oYjYvMTE2MDI2Njg4Nzk5MDIuanBnfDQ4MDE4YjE1MzY0MWI1OTA3MWNjYmE1NzdmNDBkY2QwODMzZDQ0ZDhmMzY1MDg0MDk0ZTkyZjRkM2FhNWQ5YWU/D56F88E4-2CD4-4CAA-99B2-9824C78501F2.jpg,https://p1-ofp.static.pub/fes/cms/2020/12/25/76apjfkml79bg5qcf172tvt0bw0c8s348607.png,https://p2-ofp.static.pub/fes/cms/2021/07/06/2h8n4ofixc8g8i94vopfat048ld37m944694.svg,https://p3-ofp.static.pub/fes/cms/2021/07/06/efrjjv1rz2xiuvpm0emnwj6y2gmai3506628.svg,https://p2-ofp.static.pub/fes/cms/2021/07/06/wxdfgadg28utnas6ca5d28oot1lcxj806083.svg,GAME CAPTURE HD60 S,https://www.lenovo.com/us/en/p/accessories-and-software/webcams-and-video/Webcams-&-Video_Game-Capture-Devices/78014796,78014796,,,,,,,,,,,,$179.99,6 Months Promotional Financing Available* On purchases of  or more made with the Lenovo Credit Card,$500,Learn More,Ships FREE in 1-3 business days,Learn More,Earn,$5,in Rewards,Price Match Guarantee,Compare,Added!,,,,,,,,,,,,,
,https://p1-ofp.static.pub/ShareResource/SSNP/4XJ1D33884/4XJ1D33884-01-200x150.81b67b6f1280d165.png,https://p4-ofp.static.pub/ShareResource/SSNP/4XJ1D33884/4XJ1D33884-500x400-02.c048638030fcfa74.png,https://p1-ofp.static.pub/fes/cms/2020/12/25/76apjfkml79bg5qcf172tvt0bw0c8s348607.png,https://p2-ofp.static.pub/fes/cms/2021/07/06/2h8n4ofixc8g8i94vopfat048ld37m944694.svg,https://p3-ofp.static.pub/fes/cms/2021/07/06/efrjjv1rz2xiuvpm0emnwj6y2gmai3506628.svg,https://p2-ofp.static.pub/fes/cms/2021/07/06/wxdfgadg28utnas6ca5d28oot1lcxj806083.svg,Lenovo Privacy Filter for 32 inch W9 Infinity screen Monitors from 3M,https://www.lenovo.com/us/en/p/accessories-and-software/privacy-and-protection/privacy-filters-black/4XJ1D33884,4XJ1D33884,Key Details,Lenovo Privacy Filter for 32 inch W9 Infinity screen Monitors from 3M,Lenovo Privacy Filter for 32 inch W9 Infinity screen Monitors from 3M,,,,,,,,,$189.99,6 Months Promotional Financing Available* On purchases of  or more made with the Lenovo Credit Card,$500,Learn More,"Ships FREE by Thu, Oct 14",Learn More,Earn,$5,in Rewards,Price Match Guarantee,Compare,Added!,,,,,,,,,,,,,
,https://p1-ofp.static.pub/medias/bWFzdGVyfHJvb3R8MTEyMTh8aW1hZ2UvanBlZ3xoNTUvaDgyLzExNzI0NjA3NDg4MDMwLmpwZ3w1ZTc1NzBlZmViM2NkMjkyNmY3Y2Y3OGVmNmY5N2Q4NTk1ZGFhYmJiMDcwYTc3ZGIyMTc1YjNkYTBiZjcyZGU4/49604AED-FBB7-47D1-9A07-E2123B588F64.jpg,https://p1-ofp.static.pub/medias/bWFzdGVyfHJvb3R8MTEyMTh8aW1hZ2UvanBlZ3xoNTUvaDgyLzExNzI0NjA3NDg4MDMwLmpwZ3w1ZTc1NzBlZmViM2NkMjkyNmY3Y2Y3OGVmNmY5N2Q4NTk1ZGFhYmJiMDcwYTc3ZGIyMTc1YjNkYTBiZjcyZGU4/49604AED-FBB7-47D1-9A07-E2123B588F64.jpg,https://p1-ofp.static.pub/fes/cms/2020/12/25/76apjfkml79bg5qcf172tvt0bw0c8s348607.png,https://p2-ofp.static.pub/fes/cms/2021/07/06/2h8n4ofixc8g8i94vopfat048ld37m944694.svg,https://p3-ofp.static.pub/fes/cms/2021/07/06/efrjjv1rz2xiuvpm0emnwj6y2gmai3506628.svg,https://p2-ofp.static.pub/fes/cms/2021/07/06/wxdfgadg28utnas6ca5d28oot1lcxj806083.svg,EPOS I SENNHEISER GSP 600 - headset,https://www.lenovo.com/us/en/p/accessories-and-software/audio/headsets/78015240,78015240,Key Details,Engineered for the competitive gamer,Closed acoustic design and ergonomic ear pads for passive noise attenuation,Exceptional audio realism,Lift-to-mute boom arm adjusts for best voice pick up position,,,,,,,$219.00,6 Months Promotional Financing Available* On purchases of  or more made with the Lenovo Credit Card,$500,Learn More,Ships FREE in 1-3 business days,Learn More,Earn Triple Rewards,$19,=,Price Match Guarantee,Compare,Added!,,,,,Engineered for the competitive gamer,Closed acoustic design and ergonomic ear pads for passive noise attenuation,Exceptional audio realism,Lift-to-mute boom arm adjusts for best voice pick up position,Adjustable contact pressure headband for long-lasting comfort,,Adjustable contact pressure headband for long-lasting comfort,,
,https://p1-ofp.static.pub/medias/bWFzdGVyfHJvb3R8MTMzMDR8aW1hZ2UvanBlZ3xoYWUvaDFhLzExNzI0NTg5NjYyMjM4LmpwZ3w1MzQwYTUyN2NkMDlhNWNjMmQ0OTgwNzM2YjA1ZTU1ODgxOTFlNmM1OGRkNjM2YmZkMmQ2OTljNjE1MWY3MGZl/694FF07B-0788-4E70-9688-91B933B30BBB.jpg,https://p1-ofp.static.pub/medias/bWFzdGVyfHJvb3R8MTMzMDR8aW1hZ2UvanBlZ3xoYWUvaDFhLzExNzI0NTg5NjYyMjM4LmpwZ3w1MzQwYTUyN2NkMDlhNWNjMmQ0OTgwNzM2YjA1ZTU1ODgxOTFlNmM1OGRkNjM2YmZkMmQ2OTljNjE1MWY3MGZl/694FF07B-0788-4E70-9688-91B933B30BBB.jpg,https://p1-ofp.static.pub/fes/cms/2020/12/25/76apjfkml79bg5qcf172tvt0bw0c8s348607.png,https://p2-ofp.static.pub/fes/cms/2021/07/06/2h8n4ofixc8g8i94vopfat048ld37m944694.svg,https://p3-ofp.static.pub/fes/cms/2021/07/06/efrjjv1rz2xiuvpm0emnwj6y2gmai3506628.svg,https://p2-ofp.static.pub/fes/cms/2021/07/06/wxdfgadg28utnas6ca5d28oot1lcxj806083.svg,EPOS I SENNHEISER GSX 1000 - headphone amplifier,https://www.lenovo.com/us/en/p/accessories-and-software/audio/Audio_Sound-Cards/78015235,78015235,Key Details,7.1 surround sound through Binaural Rendering Engine,Enhanced audio performance,Precise control of your sound with a dedicated DAC chip,Compatible with both the PC and Mac with all 2-jack analog headsets,,,,,,,$229.00,6 Months Promotional Financing Available* On purchases of  or more made with the Lenovo Credit Card,$500,Learn More,Ships FREE in 1-3 business days,Learn More,Earn,$6,in Rewards,Price Match Guarantee,Compare,Added!,,,,,7.1 surround sound through Binaural Rendering Engine,Enhanced audio performance,Precise control of your sound with a dedicated DAC chip,Compatible with both the PC and Mac with all 2-jack analog headsets,Four customized sound profiles,,Four customized sound profiles,,
