flag,normal_image src,hover_image src,heart src,productGalleryOverride src,productGalleryOverride src 2,productGalleryOverride src 3,lazy_href,lazy_href href,part_number 2,title,key_details,key_details 2,key_details 3,key_details 4,ellip,morelink,morelink href,price,save,percent-box,final-price,ca-content-container,ca-price-focus,ca-link,ships,ca-link 2,text 2,text 3,text 4,price_guarantee,compareDefault,compareAdd,bv_main_container href,bv_stars_svg_no_wrap href,bv_text,bv_text 2,key_details 5,key_details 6,key_details 7,key_details 8,key_details 9,key_details 10,key_details 11,key_details 12,key_details 13
DOORBUSTER,https://p1-ofp.static.pub/medias/bWFzdGVyfHJvb3R8OTUxMnxpbWFnZS9qcGVnfGgyMi9oMzkvMTE2MDE1NTg5NjIyMDYuanBnfGJiMTg0YzFmOTExOWY0NDEzZTg3ZTUyZTM5NWY1ODA5ZTFjOGFlMDNkYTZiZjAyNDY0MTRhOTA4YWQ5MzE5NzA/D580BE2A-2C55-4457-BC6B-3F7A77C8E663.jpg,https://p1-ofp.static.pub/medias/bWFzdGVyfHJvb3R8OTUxMnxpbWFnZS9qcGVnfGgyMi9oMzkvMTE2MDE1NTg5NjIyMDYuanBnfGJiMTg0YzFmOTExOWY0NDEzZTg3ZTUyZTM5NWY1ODA5ZTFjOGFlMDNkYTZiZjAyNDY0MTRhOTA4YWQ5MzE5NzA/D580BE2A-2C55-4457-BC6B-3F7A77C8E663.jpg,https://p1-ofp.static.pub/fes/cms/2020/12/25/76apjfkml79bg5qcf172tvt0bw0c8s348607.png,https://p2-ofp.static.pub/fes/cms/2021/07/06/2h8n4ofixc8g8i94vopfat048ld37m944694.svg,https://p3-ofp.static.pub/fes/cms/2021/07/06/efrjjv1rz2xiuvpm0emnwj6y2gmai3506628.svg,https://p2-ofp.static.pub/fes/cms/2021/07/06/wxdfgadg28utnas6ca5d28oot1lcxj806083.svg,"Logitech MX Master 2S - mouse - Bluetooth, 2.4 GHz - graphite",https://www.lenovo.com/us/en/p/accessories-and-software/keyboards-and-mice/mice/78016250,78016250,Key Details,"With Logitech Flow, seamlessly control up to three computers with one mouse and copy-paste text, images and files between them","Darkfield High Precision tracking gives you flawless control virtually anywhere - even on glass with up to 4,000 DPI",Just plug MX Master 2S into your computer using the micro-USB charging cable and get enough power for a full day of usage in three minutes only,Scroll through long documents or web pages faster and easier with the speed-adaptive scroll wheel that auto-,...,See More Details,https://www.lenovo.com/us/en/p/accessories-and-software/keyboards-and-mice/mice/78016250,$99.99,save $40.00,40% off,$59.99,6 Months Promotional Financing Available* On purchases of  or more made with the Lenovo Credit Card,$500,Learn More,Ships FREE in 1-3 business days,Learn More,Earn,$1,in Rewards,Price Match Guarantee,Compare,Added!,https://www.lenovo.com/us/en/p/accessories-and-software/keyboards-and-mice/mice/78016250,[object Object],4.8,(5),"With Logitech Flow, seamlessly control up to three computers with one mouse and copy-paste text, images and files between them","Darkfield High Precision tracking gives you flawless control virtually anywhere - even on glass with up to 4,000 DPI",Just plug MX Master 2S into your computer using the micro-USB charging cable and get enough power for a full day of usage in three minutes only,Scroll through long documents or web pages faster and easier with the speed-adaptive scroll wheel that auto-,,,,,
,https://p1-ofp.static.pub/medias/bWFzdGVyfHJvb3R8OTY0NHxpbWFnZS9qcGVnfGhhYi9oOTIvMTE3MjUxNTEzMDU3NTguanBnfDhmZDNlMmM3MDE2NzUxMzRhMjVlYWMyZmQyYzVlZDFhY2JmZTQ2ZDVlMDg0ODhkMTYyNzdkMzdiOTZmMDcwY2I/F0EEE8D7-6E1F-4ADE-BC3F-13B621B4378D.jpg,https://p1-ofp.static.pub/medias/bWFzdGVyfHJvb3R8OTY0NHxpbWFnZS9qcGVnfGhhYi9oOTIvMTE3MjUxNTEzMDU3NTguanBnfDhmZDNlMmM3MDE2NzUxMzRhMjVlYWMyZmQyYzVlZDFhY2JmZTQ2ZDVlMDg0ODhkMTYyNzdkMzdiOTZmMDcwY2I/F0EEE8D7-6E1F-4ADE-BC3F-13B621B4378D.jpg,https://p1-ofp.static.pub/fes/cms/2020/12/25/76apjfkml79bg5qcf172tvt0bw0c8s348607.png,https://p2-ofp.static.pub/fes/cms/2021/07/06/2h8n4ofixc8g8i94vopfat048ld37m944694.svg,https://p3-ofp.static.pub/fes/cms/2021/07/06/efrjjv1rz2xiuvpm0emnwj6y2gmai3506628.svg,https://p2-ofp.static.pub/fes/cms/2021/07/06/wxdfgadg28utnas6ca5d28oot1lcxj806083.svg,JABRA EVOLVE2 40 USB-A UC      ACCS,https://www.lenovo.com/us/en/p/accessories-and-software/audio/headsets/78014784,78014784,,,,,,,,,,,,$139.00,6 Months Promotional Financing Available* On purchases of  or more made with the Lenovo Credit Card,$500,Learn More,Ships FREE in 1-3 business days,Learn More,Earn,$4,in Rewards,Price Match Guarantee,Compare,Added!,,,,,,,,,,,,,
NEW ARRIVAL,https://p2-ofp.static.pub/fes/cms/2021/08/06/ioczpx0dtq1a8kg9x8nrvevihbylwf540665.png,,,,,,Lenovo USB-C to Ethernet Adapter,https://www.lenovo.com/us/en/p/accessories-and-software/cables-and-adapters/adapters/4X91D96889,4X91D96889,Key Details,Sleek design,Full-size RJ45 connector,LEDs on RJ45 connector to indicate activity and link status,"Support PXE boot, Wake-On-LAN, MAC pass through if host notebook supports",,,,,,,$29.99,6 Months Promotional Financing Available* On purchases of  or more made with the Lenovo Credit Card,$500,Learn More,Ships in 1+ month,Learn More,Earn,$0.90,in Rewards,Price Match Guarantee,Compare,Added!,,,,,Sleek design,Full-size RJ45 connector,LEDs on RJ45 connector to indicate activity and link status,"Support PXE boot, Wake-On-LAN, MAC pass through if host notebook supports",,,,,
,https://p3-ofp.static.pub/ShareResource/560x450/SSNP/GX41C86982/GX41C86982-500x400-01.0e61cbcf2ea5a38e.png,https://p4-ofp.static.pub/ShareResource/560x450/SSNP/GX41C86982/GX41C86982-500x400-02.8b194f7a25b6db9c.png,https://p1-ofp.static.pub/fes/cms/2020/12/25/76apjfkml79bg5qcf172tvt0bw0c8s348607.png,https://p2-ofp.static.pub/fes/cms/2021/07/06/2h8n4ofixc8g8i94vopfat048ld37m944694.svg,https://p3-ofp.static.pub/fes/cms/2021/07/06/efrjjv1rz2xiuvpm0emnwj6y2gmai3506628.svg,https://p2-ofp.static.pub/fes/cms/2021/07/06/wxdfgadg28utnas6ca5d28oot1lcxj806083.svg,Lenovo Legion Active Gaming Backpack,https://www.lenovo.com/us/en/p/accessories-and-software/cases-and-bags/backpacks/GX41C86982,GX41C86982,Key Details,10 PET 500ml bottles are reborn to make part of the case,Easy access front pockets make grabbing your gadgets easy,Versatile main compartment keeps your gear protected and organized,Quick access opening on the main compartment enables fast packing and unpacking,...,See More Details,https://www.lenovo.com/us/en/p/accessories-and-software/cases-and-bags/backpacks/GX41C86982,$59.99,save $15.00,25% off,$44.99,6 Months Promotional Financing Available* On purchases of  or more made with the Lenovo Credit Card,$500,Learn More,"Ships FREE by Thu, Oct 14",Learn More,Earn Triple Rewards,$4,=,Price Match Guarantee,Compare,Added!,https://www.lenovo.com/us/en/p/accessories-and-software/cases-and-bags/backpacks/GX41C86982,[object Object],4.6,(29),10 PET 500ml bottles are reborn to make part of the case,Easy access front pockets make grabbing your gadgets easy,Versatile main compartment keeps your gear protected and organized,Quick access opening on the main compartment enables fast packing and unpacking,Ventilated back padding with padded shoulder straps ensure lasting comfort,Waterproof cap and base are made of coated RPET materials for added durability,Spacious multi-function compartment effortlessly stores a 17” la,Ventilated back padding with padded shoulder straps ensure lasting comfort,Waterproof cap and base are made of coated RPET materials for added durability
,https://p1-ofp.static.pub/ShareResource/560x450/SSNP/GXC1D05522/GXC1D05522-500x400-01.ab2ceeb8d21d076c.png,https://p3-ofp.static.pub/ShareResource/560x450/SSNP/GXC1D05522/GXC1D05522-500x400-02.ee08b51e80d14d4c.png,https://p1-ofp.static.pub/fes/cms/2020/12/25/76apjfkml79bg5qcf172tvt0bw0c8s348607.png,https://p2-ofp.static.pub/fes/cms/2021/07/06/2h8n4ofixc8g8i94vopfat048ld37m944694.svg,https://p3-ofp.static.pub/fes/cms/2021/07/06/efrjjv1rz2xiuvpm0emnwj6y2gmai3506628.svg,https://p2-ofp.static.pub/fes/cms/2021/07/06/wxdfgadg28utnas6ca5d28oot1lcxj806083.svg,Lenovo Select FHD Webcam,https://www.lenovo.com/us/en/p/accessories-and-software/webcams-and-video/Webcams-&-Video_Webcams/GXC1D05522,GXC1D05522,Key Details,FHD 1080P camera,Ultra-wide 95° lens,2 powerful built-in microphone,Flexible mounting mechanism,...,See More Details,https://www.lenovo.com/us/en/p/accessories-and-software/webcams-and-video/Webcams-&-Video_Webcams/GXC1D05522,$49.99,save $25.00,50% off,$24.99,6 Months Promotional Financing Available* On purchases of  or more made with the Lenovo Credit Card,$500,Learn More,"Ships FREE by Thu, Oct 14",Learn More,Earn,$0.75,in Rewards,Price Match Guarantee,Compare,Added!,https://www.lenovo.com/us/en/p/accessories-and-software/webcams-and-video/Webcams-&-Video_Webcams/GXC1D05522,[object Object],4.2,(9),FHD 1080P camera,Ultra-wide 95° lens,2 powerful built-in microphone,Flexible mounting mechanism,360° rotation,Tilt controls,Physical privacy shutter,360° rotation,Tilt controls
,https://p2-ofp.static.pub/ShareResource/560x450/SSNP/4X41C12468/4X41C12468-500x400-01.63d7a40ddd6b00ae.png,https://p1-ofp.static.pub/ShareResource/560x450/SSNP/4X41C12468/4X41C12468-500x400-03.e8c03f8518183040.png,https://p1-ofp.static.pub/fes/cms/2020/12/25/76apjfkml79bg5qcf172tvt0bw0c8s348607.png,https://p2-ofp.static.pub/fes/cms/2021/07/06/2h8n4ofixc8g8i94vopfat048ld37m944694.svg,https://p3-ofp.static.pub/fes/cms/2021/07/06/efrjjv1rz2xiuvpm0emnwj6y2gmai3506628.svg,https://p2-ofp.static.pub/fes/cms/2021/07/06/wxdfgadg28utnas6ca5d28oot1lcxj806083.svg,ThinkPad Essential 16-inch Backpack (Eco),https://www.lenovo.com/us/en/p/accessories-and-software/cases-and-bags/backpacks/4X41C12468,4X41C12468,Key Details,"Two main compartments, including a dedicated padded PC pocket, designed to fit Lenovo ThinkPad laptops up to 16 inches",Two additional front zip pockets for quick accessory access,One mesh side water bottle holder to keep you hydrated,Convenient luggage strap on back panel for travel and commutes,...,See More Details,https://www.lenovo.com/us/en/p/accessories-and-software/cases-and-bags/backpacks/4X41C12468,$34.99,save $17.00,48% off,$17.99,6 Months Promotional Financing Available* On purchases of  or more made with the Lenovo Credit Card,$500,Learn More,"Ships FREE by Thu, Oct 14",Learn More,Earn,$0.54,in Rewards,Price Match Guarantee,Compare,Added!,https://www.lenovo.com/us/en/p/accessories-and-software/cases-and-bags/backpacks/4X41C12468,[object Object],4.6,(19),"Two main compartments, including a dedicated padded PC pocket, designed to fit Lenovo ThinkPad laptops up to 16 inches",Two additional front zip pockets for quick accessory access,One mesh side water bottle holder to keep you hydrated,Convenient luggage strap on back panel for travel and commutes,Easy-grip zippers for effortless packing and unpacking,"Classic black nylon exterior, grey interior lining, with splashes of classic red accents",Each bag contains the equivalent of at,Easy-grip zippers for effortless packing and unpacking,"Classic black nylon exterior, grey interior lining, with splashes of classic red accents"
NEW ARRIVAL,https://p2-ofp.static.pub/fes/cms/2021/08/06/j2fzxrabrnbis1sftoupe2eby6f1h2488984.png,,,,,,ThinkPad USB3.0 to Ethernet Adapter for NA,https://www.lenovo.com/us/en/p/accessories-and-software/cables-and-adapters/adapters/4X91D96891,4X91D96891,Key Details,Sleek design,Full-size RJ45 connector,LEDs on RJ45 connector to indicate activity and link status,"Support PXE boot, Wake-On-LAN, MAC pass through if host notebook supports",...,See More Details,https://www.lenovo.com/us/en/p/accessories-and-software/cables-and-adapters/adapters/4X91D96891,,,,$17.99,6 Months Promotional Financing Available* On purchases of  or more made with the Lenovo Credit Card,$500,Learn More,Ships in 3+ months,Learn More,Earn,$0.54,in Rewards,Price Match Guarantee,Compare,Added!,,,,,Sleek design,Full-size RJ45 connector,LEDs on RJ45 connector to indicate activity and link status,"Support PXE boot, Wake-On-LAN, MAC pass through if host notebook supports","Depending on many factors such as the processing capability of the host and peripheral devices, file attributes, and other factors related to system configuration and operating environments, the actual data transfer rate will be slower than 5 Gbit/s on USB 3.1 Gen 1 (USB 3.0) connectors, slower than",Note:,Note:,"Depending on many factors such as the processing capability of the host and peripheral devices, file attributes, and other factors related to system configuration and operating environments, the actual data transfer rate will be slower than 5 Gbit/s on USB 3.1 Gen 1 (USB 3.0) connectors, slower than",
NEW ARRIVAL,https://p1-ofp.static.pub/fes/cms/2021/08/06/ex0gv90su2f3jiaduukofh9jltg6k1135975.png,https://p2-ofp.static.pub/fes/cms/2021/08/06/5s5kwkjuv6naycgiho80o1ojlr6mny610759.png,https://p1-ofp.static.pub/fes/cms/2020/12/25/76apjfkml79bg5qcf172tvt0bw0c8s348607.png,https://p2-ofp.static.pub/fes/cms/2021/07/06/2h8n4ofixc8g8i94vopfat048ld37m944694.svg,https://p3-ofp.static.pub/fes/cms/2021/07/06/efrjjv1rz2xiuvpm0emnwj6y2gmai3506628.svg,https://p2-ofp.static.pub/fes/cms/2021/07/06/wxdfgadg28utnas6ca5d28oot1lcxj806083.svg,Lenovo Go Wireless Vertical Mouse,https://www.lenovo.com/us/en/p/accessories-and-software/keyboards-and-mice/mice/4Y51C33792,4Y51C33792,Key Details,True Ergonomic vertical design,Natural handshake position to reduce forearm and wrist strain,Comfort grip with UV-coated cork material,"Easy to wipe and clean, resistant to common liquids and gels",...,See More Details,https://www.lenovo.com/us/en/p/accessories-and-software/keyboards-and-mice/mice/4Y51C33792,$49.99,save $5.00,10% off,$44.99,6 Months Promotional Financing Available* On purchases of  or more made with the Lenovo Credit Card,$500,Learn More,Ships FREE in 4-7 business days,Learn More,Earn,$1,in Rewards,Price Match Guarantee,Compare,Added!,https://www.lenovo.com/us/en/p/accessories-and-software/keyboards-and-mice/mice/4Y51C33792,[object Object],4.7,(6),True Ergonomic vertical design,Natural handshake position to reduce forearm and wrist strain,Comfort grip with UV-coated cork material,"Easy to wipe and clean, resistant to common liquids and gels","6 button mouse, 3 programmable side buttons","On-the-fly DPI adjustment, Up to 2400 DPI",Blue optical sensor,"6 button mouse, 3 programmable side buttons","On-the-fly DPI adjustment, Up to 2400 DPI"
,https://p2-ofp.static.pub/ShareResource/560x450/SSNP/GXH1C97869/GXH1C97869-500x400-01.2384221512bd39fe.png,https://p4-ofp.static.pub/ShareResource/560x450/SSNP/GXH1C97869/GXH1C97869-500x400-02.b6db10ee61708252.png,https://p1-ofp.static.pub/fes/cms/2020/12/25/76apjfkml79bg5qcf172tvt0bw0c8s348607.png,https://p2-ofp.static.pub/fes/cms/2021/07/06/2h8n4ofixc8g8i94vopfat048ld37m944694.svg,https://p3-ofp.static.pub/fes/cms/2021/07/06/efrjjv1rz2xiuvpm0emnwj6y2gmai3506628.svg,https://p2-ofp.static.pub/fes/cms/2021/07/06/wxdfgadg28utnas6ca5d28oot1lcxj806083.svg,Lenovo Legion Gaming Control Mouse Pad XXL,https://www.lenovo.com/us/en/p/accessories-and-software/keyboards-and-mice/mice/GXH1C97869,GXH1C97869,Key Details,"Optimized for precision, low DPI tracking movements",Skid-proof rubberized base provides stability when gliding and aiming,High-density microfiber cloth on the top surface is water-repellent and durable,Braided locked edge design for durability and long-life,...,See More Details,https://www.lenovo.com/us/en/p/accessories-and-software/keyboards-and-mice/mice/GXH1C97869,$19.99,save $8.00,40% off,$11.99,6 Months Promotional Financing Available* On purchases of  or more made with the Lenovo Credit Card,$500,Learn More,"Ships FREE by Thu, Oct 14",Learn More,Earn Triple Rewards,$1,=,Price Match Guarantee,Compare,Added!,https://www.lenovo.com/us/en/p/accessories-and-software/keyboards-and-mice/mice/GXH1C97869,[object Object],4.5,(23),"Optimized for precision, low DPI tracking movements",Skid-proof rubberized base provides stability when gliding and aiming,High-density microfiber cloth on the top surface is water-repellent and durable,Braided locked edge design for durability and long-life,As thin as 2 mm to keep your mouse virtually level with your desk,Separate rolling package design for easy storage,Size: L*W*H: 900 * 400 * 2 mm,As thin as 2 mm to keep your mouse virtually level with your desk,Separate rolling package design for easy storage
,https://p3-ofp.static.pub/ShareResource/560x450/SSNP/GXH1C97873/GXH1C97873-500x400-01.113309e2e9dc5e26.png,https://p4-ofp.static.pub/ShareResource/560x450/SSNP/GXH1C97873/GXH1C97873-500x400-02.bdeacaac917df3a0.png,https://p1-ofp.static.pub/fes/cms/2020/12/25/76apjfkml79bg5qcf172tvt0bw0c8s348607.png,https://p2-ofp.static.pub/fes/cms/2021/07/06/2h8n4ofixc8g8i94vopfat048ld37m944694.svg,https://p3-ofp.static.pub/fes/cms/2021/07/06/efrjjv1rz2xiuvpm0emnwj6y2gmai3506628.svg,https://p2-ofp.static.pub/fes/cms/2021/07/06/wxdfgadg28utnas6ca5d28oot1lcxj806083.svg,Lenovo IdeaPad Gaming Cloth Mouse Pad M,https://www.lenovo.com/us/en/p/accessories-and-software/keyboards-and-mice/mice/GXH1C97873,GXH1C97873,Key Details,High-quality cloth surface for smooth sweeping and accurate tracking,Anti-slip rubber base that keeps the pad firmly in place,Medium and large sizes for perfect for all gamers,Only 2mm thick to keep your mouse level with your desk,...,See More Details,https://www.lenovo.com/us/en/p/accessories-and-software/keyboards-and-mice/mice/GXH1C97873,$6.99,save $2.00,28% off,$4.99,6 Months Promotional Financing Available* On purchases of  or more made with the Lenovo Credit Card,$500,Learn More,"Ships FREE by Thu, Oct 14",Learn More,Earn Triple Rewards,$0.44,=,Price Match Guarantee,Compare,Added!,https://www.lenovo.com/us/en/p/accessories-and-software/keyboards-and-mice/mice/GXH1C97873,[object Object],5.0,(14),High-quality cloth surface for smooth sweeping and accurate tracking,Anti-slip rubber base that keeps the pad firmly in place,Medium and large sizes for perfect for all gamers,Only 2mm thick to keep your mouse level with your desk,Water repellent and tear-resistant surface for long-term use,Washable and soft for cleaning and storage,Size: L*W*H: 360 * 275 * 2 mm,Water repellent and tear-resistant surface for long-term use,Washable and soft for cleaning and storage
,https://p2-ofp.static.pub/ShareResource/560x450/SSNP/G0A6GC65WW/G0A6GC65WW-560x450-01.ebb2e8857ae418bf.png,https://p2-ofp.static.pub/ShareResource/560x450/SSNP/G0A6GC65WW/G0A6GC65WW-560x450-02.2382e7b4a602fae9.png,https://p1-ofp.static.pub/fes/cms/2020/12/25/76apjfkml79bg5qcf172tvt0bw0c8s348607.png,https://p2-ofp.static.pub/fes/cms/2021/07/06/2h8n4ofixc8g8i94vopfat048ld37m944694.svg,https://p3-ofp.static.pub/fes/cms/2021/07/06/efrjjv1rz2xiuvpm0emnwj6y2gmai3506628.svg,https://p2-ofp.static.pub/fes/cms/2021/07/06/wxdfgadg28utnas6ca5d28oot1lcxj806083.svg,Lenovo 65W USB-C GaN Adapter,https://www.lenovo.com/us/en/p/accessories-and-software/chargers-and-batteries/chargers/G0A6GC65WW,G0A6GC65WW,Key Details,65W has a smaller profile and wight thanks to GaN technology,Ultra-portable design with a foldable plug for easy storage,Elegant and stylish with cable management to keep organized,Quickly refuel your laptop or mobile devices via USB-C,...,See More Details,https://www.lenovo.com/us/en/p/accessories-and-software/chargers-and-batteries/chargers/G0A6GC65WW,,,,$64.99,6 Months Promotional Financing Available* On purchases of  or more made with the Lenovo Credit Card,$500,Learn More,"Ships FREE by Thu, Oct 14",Learn More,Earn,$1,in Rewards,Price Match Guarantee,Compare,Added!,https://www.lenovo.com/us/en/p/accessories-and-software/chargers-and-batteries/chargers/G0A6GC65WW,[object Object],4.8,(40),65W has a smaller profile and wight thanks to GaN technology,Ultra-portable design with a foldable plug for easy storage,Elegant and stylish with cable management to keep organized,Quickly refuel your laptop or mobile devices via USB-C,Reliable PD 3.0 support with adjustable output voltages of 5V/9V/15V/20V,Rapid charging for USB-C devices with up to 65W,Never run out of room with a cable length up to 1.8m,Reliable PD 3.0 support with adjustable output voltages of 5V/9V/15V/20V,Rapid charging for USB-C devices with up to 65W
,https://p3-ofp.static.pub/ShareResource/560x450/SSNP/4X41C12469/4X41C12469-500x400-01.d252a98ccb87b8cf.png,https://p1-ofp.static.pub/ShareResource/560x450/SSNP/4X41C12469/4X41C12469-500x400-04.9a21d33b9532fe02.png,https://p1-ofp.static.pub/fes/cms/2020/12/25/76apjfkml79bg5qcf172tvt0bw0c8s348607.png,https://p2-ofp.static.pub/fes/cms/2021/07/06/2h8n4ofixc8g8i94vopfat048ld37m944694.svg,https://p3-ofp.static.pub/fes/cms/2021/07/06/efrjjv1rz2xiuvpm0emnwj6y2gmai3506628.svg,https://p2-ofp.static.pub/fes/cms/2021/07/06/wxdfgadg28utnas6ca5d28oot1lcxj806083.svg,ThinkPad Essential 16-inch Topload (Eco),https://www.lenovo.com/us/en/p/accessories-and-software/cases-and-bags/briefcases-toploads/4X41C12469,4X41C12469,Key Details,"Two main compartments, including a dedicated padded PC pocket, designed to fit Lenovo ThinkPad laptops up to 16”",Two additional front zip pockets for quick accessory access,"Removable, adjustable shoulder strap for added comfort while carrying",Convenient luggage strap on back panel for travel and commuting,...,See More Details,https://www.lenovo.com/us/en/p/accessories-and-software/cases-and-bags/briefcases-toploads/4X41C12469,$29.99,save $10.00,33% off,$19.99,6 Months Promotional Financing Available* On purchases of  or more made with the Lenovo Credit Card,$500,Learn More,"Ships FREE by Thu, Oct 14",Learn More,Earn,$0.60,in Rewards,Price Match Guarantee,Compare,Added!,https://www.lenovo.com/us/en/p/accessories-and-software/cases-and-bags/briefcases-toploads/4X41C12469,[object Object],4.8,(9),"Two main compartments, including a dedicated padded PC pocket, designed to fit Lenovo ThinkPad laptops up to 16”",Two additional front zip pockets for quick accessory access,"Removable, adjustable shoulder strap for added comfort while carrying",Convenient luggage strap on back panel for travel and commuting,Easy-grip zippers for easy packing and unpacking,"Classic black nylon exterior, grey interior lining, with splashes of classic red accents",Each bag contains the equivalent of,Easy-grip zippers for easy packing and unpacking,"Classic black nylon exterior, grey interior lining, with splashes of classic red accents"
,https://p1-ofp.static.pub/medias/bWFzdGVyfHJvb3R8MTEzNTd8aW1hZ2UvanBlZ3xoNmIvaDE3LzExNjAwMTE5MTM2Mjg2LmpwZ3xjZDFjM2JhM2FmNmQ3MDhmYjA2MDY2NTgzZDQ2NTU0YjI4MTg2ZjUwNWYxNDViYTg0YzMyN2IyMzhkZGI5Njhh/6AE0F0DC-6EF2-4B34-BA05-C7E1F928A3A5.jpg,https://p1-ofp.static.pub/medias/bWFzdGVyfHJvb3R8MTEzNTd8aW1hZ2UvanBlZ3xoNmIvaDE3LzExNjAwMTE5MTM2Mjg2LmpwZ3xjZDFjM2JhM2FmNmQ3MDhmYjA2MDY2NTgzZDQ2NTU0YjI4MTg2ZjUwNWYxNDViYTg0YzMyN2IyMzhkZGI5Njhh/6AE0F0DC-6EF2-4B34-BA05-C7E1F928A3A5.jpg,https://p1-ofp.static.pub/fes/cms/2020/12/25/76apjfkml79bg5qcf172tvt0bw0c8s348607.png,https://p2-ofp.static.pub/fes/cms/2021/07/06/2h8n4ofixc8g8i94vopfat048ld37m944694.svg,https://p3-ofp.static.pub/fes/cms/2021/07/06/efrjjv1rz2xiuvpm0emnwj6y2gmai3506628.svg,https://p2-ofp.static.pub/fes/cms/2021/07/06/wxdfgadg28utnas6ca5d28oot1lcxj806083.svg,Microsoft Xbox Wireless Controller- Robot White,https://www.lenovo.com/us/en/p/accessories-and-software/gaming-consoles/Gaming-Consoles_Gaming-Console-Accessories/78015886,78015886,Key Details,Ergonomic design,Redesigned thumbsticks and D-pad,,,,,,,,,$59.99,6 Months Promotional Financing Available* On purchases of  or more made with the Lenovo Credit Card,$500,Learn More,Ships FREE in 1-3 business days,Learn More,Earn,$1,in Rewards,Price Match Guarantee,Compare,Added!,,,,,Ergonomic design,Redesigned thumbsticks and D-pad,,,,,,,
,https://p1-ofp.static.pub/fes/cms/2021/09/10/z2avrxeuel36k4ta94gwwjhzrve04i127689.png,https://p3-ofp.static.pub/fes/cms/2021/09/10/vxrdxs33ik2w27k1mx2bupo7ftqarj587359.png,https://p1-ofp.static.pub/fes/cms/2020/12/25/76apjfkml79bg5qcf172tvt0bw0c8s348607.png,https://p2-ofp.static.pub/fes/cms/2021/07/06/2h8n4ofixc8g8i94vopfat048ld37m944694.svg,https://p3-ofp.static.pub/fes/cms/2021/07/06/efrjjv1rz2xiuvpm0emnwj6y2gmai3506628.svg,https://p2-ofp.static.pub/fes/cms/2021/07/06/wxdfgadg28utnas6ca5d28oot1lcxj806083.svg,Lenovo Go USB-C Wireless Mouse (Storm Grey),https://www.lenovo.com/us/en/p/accessories-and-software/keyboards-and-mice/mice/GY51C21210,GY51C21210,Key Details,Compact ambidextrous design,Ergonomic design with Villi painted grip,"Blue optical sensor, tracks on most surfaces",Silent left/right keys with 2-way scroll wheel (up / down),...,See More Details,https://www.lenovo.com/us/en/p/accessories-and-software/keyboards-and-mice/mice/GY51C21210,$39.99,save $8.00,20% off,$31.99,6 Months Promotional Financing Available* On purchases of  or more made with the Lenovo Credit Card,$500,Learn More,"Ships FREE by Thu, Oct 14",Learn More,Earn,$0.96,in Rewards,Price Match Guarantee,Compare,Added!,https://www.lenovo.com/us/en/p/accessories-and-software/keyboards-and-mice/mice/GY51C21210,[object Object],4.7,(3),Compact ambidextrous design,Ergonomic design with Villi painted grip,"Blue optical sensor, tracks on most surfaces",Silent left/right keys with 2-way scroll wheel (up / down),800 – 1600 - 2400 adjustable DPI,Wireless connection via USB-C dongle,Supports Lenovo Unified Pairing Receiver,800 – 1600 - 2400 adjustable DPI,Wireless connection via USB-C dongle
