flag,normal_image src,hover_image src,heart src,productGalleryOverride src,productGalleryOverride src 2,productGalleryOverride src 3,lazy_href,lazy_href href,part_number 2,title,key_details,key_details 2,key_details 3,key_details 4,ellip,morelink,morelink href,price,save,percent-box,final-price,ca-content-container,ca-price-focus,ca-link,ships,ca-link 2,text 2,text 3,text 4,price_guarantee,compareDefault,compareAdd,bv_main_container href,bv_stars_svg_no_wrap href,bv_text,bv_text 2,key_details 5,key_details 6,key_details 7,key_details 8,key_details 9,key_details 10,key_details 11,key_details 12,key_details 13
,https://p1-ofp.static.pub/medias/bWFzdGVyfHJvb3R8MTM1Nzh8aW1hZ2UvanBlZ3xoMWIvaDY3LzExNzI0NjM0NDIzMzI2LmpwZ3w2M2ZiZmJkNzMxZjFiZWY5MjNiZDU1N2QzNjQxZjI0N2VjZjc4YzI5MGVhYThiOWUzNTE1ZjM3MGI3MTE2MTUz/3BCD2757-4EA2-4005-85ED-B6281BDC1F7C.jpg,https://p1-ofp.static.pub/medias/bWFzdGVyfHJvb3R8MTM1Nzh8aW1hZ2UvanBlZ3xoMWIvaDY3LzExNzI0NjM0NDIzMzI2LmpwZ3w2M2ZiZmJkNzMxZjFiZWY5MjNiZDU1N2QzNjQxZjI0N2VjZjc4YzI5MGVhYThiOWUzNTE1ZjM3MGI3MTE2MTUz/3BCD2757-4EA2-4005-85ED-B6281BDC1F7C.jpg,https://p1-ofp.static.pub/fes/cms/2020/12/25/76apjfkml79bg5qcf172tvt0bw0c8s348607.png,https://p2-ofp.static.pub/fes/cms/2021/07/06/2h8n4ofixc8g8i94vopfat048ld37m944694.svg,https://p3-ofp.static.pub/fes/cms/2021/07/06/efrjjv1rz2xiuvpm0emnwj6y2gmai3506628.svg,https://p2-ofp.static.pub/fes/cms/2021/07/06/wxdfgadg28utnas6ca5d28oot1lcxj806083.svg,EPOS I SENNHEISER GSP 670 - headset,https://www.lenovo.com/us/en/p/accessories-and-software/audio/headsets/78015229,78015229,Key Details,No-compromise engineered audio performance,Premium high-fidelity game sound performance in a wireless gaming headset,Lag-free transmission delivers instant feedback for better game performance,Separate controls for chat and game audio built directly into the headset,,,,,,,$319.00,6 Months Promotional Financing Available* On purchases of  or more made with the Lenovo Credit Card,$500,Learn More,,Learn More,Earn Triple Rewards,$28,=,Price Match Guarantee,Compare,Added!,,,,,No-compromise engineered audio performance,Premium high-fidelity game sound performance in a wireless gaming headset,Lag-free transmission delivers instant feedback for better game performance,Separate controls for chat and game audio built directly into the headset,Customize 7.1 Surround Sound in the EPOS Gaming Suite for Windows 10,,Customize 7.1 Surround Sound in the EPOS Gaming Suite for Windows 10,,
,https://p1-ofp.static.pub/medias/bWFzdGVyfHJvb3R8OTk4OHxpbWFnZS9qcGVnfGhjNy9oYTYvMTE3MjQ1MTQ3NTQ1OTAuanBnfDVmZTYzNzlkM2JkZDY5YzM2MGRlYjZmMTNmZTJhMDIzNzBkNGZkMDJmMmQxYzFlOTY2MmMyYTgyZTg4Zjg3NjI/1D8E9FF9-C57B-4D72-94A1-1A349390C515.jpg,https://p1-ofp.static.pub/medias/bWFzdGVyfHJvb3R8OTk4OHxpbWFnZS9qcGVnfGhjNy9oYTYvMTE3MjQ1MTQ3NTQ1OTAuanBnfDVmZTYzNzlkM2JkZDY5YzM2MGRlYjZmMTNmZTJhMDIzNzBkNGZkMDJmMmQxYzFlOTY2MmMyYTgyZTg4Zjg3NjI/1D8E9FF9-C57B-4D72-94A1-1A349390C515.jpg,https://p1-ofp.static.pub/fes/cms/2020/12/25/76apjfkml79bg5qcf172tvt0bw0c8s348607.png,https://p2-ofp.static.pub/fes/cms/2021/07/06/2h8n4ofixc8g8i94vopfat048ld37m944694.svg,https://p3-ofp.static.pub/fes/cms/2021/07/06/efrjjv1rz2xiuvpm0emnwj6y2gmai3506628.svg,https://p2-ofp.static.pub/fes/cms/2021/07/06/wxdfgadg28utnas6ca5d28oot1lcxj806083.svg,AKRacing Core Series EX Wide Gaming Chair - Black/Red,https://www.lenovo.com/us/en/p/accessories-and-software/furniture/Furniture_Gaming-Chairs/78015265,78015265,Key Details,Fabric cover on front and back,Wide metal frame with cold-cured foam padding for maximum comfort and durability,Standard mechanism with rocking function,3D adjustable armrests,,,,$429.00,save $80.00,18% off,$349.00,6 Months Promotional Financing Available* On purchases of  or more made with the Lenovo Credit Card,$500,Learn More,,Learn More,Earn,$10,in Rewards,Price Match Guarantee,Compare,Added!,,,,,Fabric cover on front and back,Wide metal frame with cold-cured foam padding for maximum comfort and durability,Standard mechanism with rocking function,3D adjustable armrests,,,,,
,https://p1-ofp.static.pub/medias/bWFzdGVyfHJvb3R8OTE1M3xpbWFnZS9qcGVnfGgwMC9oNmQvMTE3MjQ0NTUxODIzNjYuanBnfDU2YmQ3OGQxYjg4NDhlZDk4MjQ2ZGI5ZWIwMGUwZjgzM2Q1YTUwNWQ5OGJhOTUyNTc0OGZiOGU2MDE5YjIwNDA/943FDF0B-DEC7-424D-9DF3-90A80816E8DD.jpg,https://p1-ofp.static.pub/medias/bWFzdGVyfHJvb3R8OTE1M3xpbWFnZS9qcGVnfGgwMC9oNmQvMTE3MjQ0NTUxODIzNjYuanBnfDU2YmQ3OGQxYjg4NDhlZDk4MjQ2ZGI5ZWIwMGUwZjgzM2Q1YTUwNWQ5OGJhOTUyNTc0OGZiOGU2MDE5YjIwNDA/943FDF0B-DEC7-424D-9DF3-90A80816E8DD.jpg,https://p1-ofp.static.pub/fes/cms/2020/12/25/76apjfkml79bg5qcf172tvt0bw0c8s348607.png,https://p2-ofp.static.pub/fes/cms/2021/07/06/2h8n4ofixc8g8i94vopfat048ld37m944694.svg,https://p3-ofp.static.pub/fes/cms/2021/07/06/efrjjv1rz2xiuvpm0emnwj6y2gmai3506628.svg,https://p2-ofp.static.pub/fes/cms/2021/07/06/wxdfgadg28utnas6ca5d28oot1lcxj806083.svg,AKRacing Masters Series Premium Gaming Chair - Black,https://www.lenovo.com/us/en/p/accessories-and-software/furniture/Furniture_Gaming-Chairs/78015275,78015275,Key Details,Durable steel frame,Adjustable backrest,Class-4 gaslift,Strong 5-star base,,,,$549.00,save $50.00,9% off,$499.00,6 Months Promotional Financing Available* On purchases of  or more made with the Lenovo Credit Card,$500,Learn More,,Learn More,Earn,$14,in Rewards,Price Match Guarantee,Compare,Added!,,,,,Durable steel frame,Adjustable backrest,Class-4 gaslift,Strong 5-star base,,,,,
,https://p1-ofp.static.pub/medias/bWFzdGVyfHJvb3R8MTIyMTF8aW1hZ2UvanBlZ3xoMWQvaDBiLzExNjA3NDUxNDAyMjcwLmpwZ3xjZTQ3NjhjN2NiZGI0NWQ1YTFjNmVmNzJlODljNjhjN2VmZmY1ZDY2N2UyYTIyY2FjMTJiN2M2ZTc2ZGU3YTI1/8D33AF07-05C8-40B2-8B4C-BBD5DE76B41D.jpg,https://p1-ofp.static.pub/medias/bWFzdGVyfHJvb3R8MTIyMTF8aW1hZ2UvanBlZ3xoMWQvaDBiLzExNjA3NDUxNDAyMjcwLmpwZ3xjZTQ3NjhjN2NiZGI0NWQ1YTFjNmVmNzJlODljNjhjN2VmZmY1ZDY2N2UyYTIyY2FjMTJiN2M2ZTc2ZGU3YTI1/8D33AF07-05C8-40B2-8B4C-BBD5DE76B41D.jpg,https://p1-ofp.static.pub/fes/cms/2020/12/25/76apjfkml79bg5qcf172tvt0bw0c8s348607.png,https://p2-ofp.static.pub/fes/cms/2021/07/06/2h8n4ofixc8g8i94vopfat048ld37m944694.svg,https://p3-ofp.static.pub/fes/cms/2021/07/06/efrjjv1rz2xiuvpm0emnwj6y2gmai3506628.svg,https://p2-ofp.static.pub/fes/cms/2021/07/06/wxdfgadg28utnas6ca5d28oot1lcxj806083.svg,Belkin notebook sleeve,https://www.lenovo.com/us/en/p/accessories-and-software/cases-and-bags/sleeves/78015077,78015077,Key Details,Multi-layer technology includes shear neopro exterior and cushy fleece interior.,Form-fitting sleeve ensures a precise fit,Quick side-loading access with secure zipper closure,Self-retracting handle prevents snags when slipping into your favorite bag,,,,,,,$14.99,6 Months Promotional Financing Available* On purchases of  or more made with the Lenovo Credit Card,$500,Learn More,,Learn More,Earn,$0.45,in Rewards,Price Match Guarantee,Compare,Added!,https://www.lenovo.com/us/en/p/accessories-and-software/cases-and-bags/sleeves/78015077,[object Object],4.9,(15),Multi-layer technology includes shear neopro exterior and cushy fleece interior.,Form-fitting sleeve ensures a precise fit,Quick side-loading access with secure zipper closure,Self-retracting handle prevents snags when slipping into your favorite bag,Woven side webbing protects against wear,"Product Dimensions (l x w x h): 13.6"" x 8.8"" x 1.1"" (fits MacBook Air 11"" small Chromebooks, and other 11"" devices)",Woven side webbing protects against wear,"Product Dimensions (l x w x h): 13.6"" x 8.8"" x 1.1"" (fits MacBook Air 11"" small Chromebooks, and other 11"" devices)",1-Year Warranty
,https://p1-ofp.static.pub/medias/bWFzdGVyfHJvb3R8NjM2MXxpbWFnZS9qcGVnfGgyZC9oYjEvMTE2MDc5ODY2Njc1NTAuanBnfGZkNTNlYWQxMTkzZTIwNWNmZGU0NjIxMjU5YjBmNGFhMGFkMGIyOTYyZDIzNTJjOTZhNWMzYWJiOWM5MWI4Njc/5A5AEE1F-562E-4DB2-B746-2100133248BF.jpg,https://p1-ofp.static.pub/medias/bWFzdGVyfHJvb3R8NjM2MXxpbWFnZS9qcGVnfGgyZC9oYjEvMTE2MDc5ODY2Njc1NTAuanBnfGZkNTNlYWQxMTkzZTIwNWNmZGU0NjIxMjU5YjBmNGFhMGFkMGIyOTYyZDIzNTJjOTZhNWMzYWJiOWM5MWI4Njc/5A5AEE1F-562E-4DB2-B746-2100133248BF.jpg,https://p1-ofp.static.pub/fes/cms/2020/12/25/76apjfkml79bg5qcf172tvt0bw0c8s348607.png,https://p2-ofp.static.pub/fes/cms/2021/07/06/2h8n4ofixc8g8i94vopfat048ld37m944694.svg,https://p3-ofp.static.pub/fes/cms/2021/07/06/efrjjv1rz2xiuvpm0emnwj6y2gmai3506628.svg,https://p2-ofp.static.pub/fes/cms/2021/07/06/wxdfgadg28utnas6ca5d28oot1lcxj806083.svg,6OUT SURGE PROTECTOR 4FT CORD  PERP,https://www.lenovo.com/us/en/p/accessories-and-software/chargers-and-batteries/Chargers-&-Batteries_Power-Strips-&-Surge-Protectors/78000668,78000668,Key Details,720 Joule energy rating,6 surge-protected outlets,8' heavy-duty power cord,Right-angle rotating plug,...,See More Details,https://www.lenovo.com/us/en/p/accessories-and-software/chargers-and-batteries/Chargers-&-Batteries_Power-Strips-&-Surge-Protectors/78000668,,,,$15.99,6 Months Promotional Financing Available* On purchases of  or more made with the Lenovo Credit Card,$500,Learn More,,Learn More,Earn,$0.48,in Rewards,Price Match Guarantee,Compare,Added!,,,,,720 Joule energy rating,6 surge-protected outlets,8' heavy-duty power cord,Right-angle rotating plug,Advanced power filtration,Oversized Metal Oxide Varistors (MOVs),Damage-resistant housing,Advanced power filtration,Oversized Metal Oxide Varistors (MOVs)
,https://p1-ofp.static.pub/medias/bWFzdGVyfHJvb3R8ODQzMTF8aW1hZ2UvcG5nfGhhNC9oNzkvMTE2MjQ4MDExMDc5OTgucG5nfDk1NTgxOTVkNGEzODUyOTQ3OTdlNjA1MGYyNjViNjI3OWVhZjk5OTBiNzU4YjU3NjIyMTFjMDM2NGEzYTkzMjY/4X91D11453-500x400-01.png,,,,,,ThinkStation mDP + USB-A 3.0 to DP + USB-B 3.0 Dual Head Cable,https://www.lenovo.com/us/en/p/accessories-and-software/cables-and-adapters/adapters/4X91D11453,4X91D11453,Key Details,Mini DisplayPort to DisplayPort cable transmits audio and video from computer to HD display,"USB 3.0 A Male to B Male Cable,Super Speed Data Transfer","Built to the Highest Standards ：Strong, Durable and Robust ensures Maximum performance",Measures 0.43 meters,,,,,,,$16.99,6 Months Promotional Financing Available* On purchases of  or more made with the Lenovo Credit Card,$500,Learn More,,Learn More,Earn,$0.51,in Rewards,Price Match Guarantee,Compare,Added!,,,,,Mini DisplayPort to DisplayPort cable transmits audio and video from computer to HD display,"USB 3.0 A Male to B Male Cable,Super Speed Data Transfer","Built to the Highest Standards ：Strong, Durable and Robust ensures Maximum performance",Measures 0.43 meters,,,,,
,https://p1-ofp.static.pub/medias/bWFzdGVyfHJvb3R8Njc5NnxpbWFnZS9qcGVnfGgyMi9oN2UvMTE2MDc5Mzg4MjYyNzAuanBnfGMzM2IyM2EyMTRhNDQ1YmM4MDViODE3NTNiYTk4ZjQ4ZDljZDYwMmZmNWI3NzMyNjFiNjc1NDE3YjNiZDg1ZTA/4A9E7D97-A7B0-426C-B137-F0010A71CDE3.jpg,https://p1-ofp.static.pub/medias/bWFzdGVyfHJvb3R8Njc5NnxpbWFnZS9qcGVnfGgyMi9oN2UvMTE2MDc5Mzg4MjYyNzAuanBnfGMzM2IyM2EyMTRhNDQ1YmM4MDViODE3NTNiYTk4ZjQ4ZDljZDYwMmZmNWI3NzMyNjFiNjc1NDE3YjNiZDg1ZTA/4A9E7D97-A7B0-426C-B137-F0010A71CDE3.jpg,https://p1-ofp.static.pub/fes/cms/2020/12/25/76apjfkml79bg5qcf172tvt0bw0c8s348607.png,https://p2-ofp.static.pub/fes/cms/2021/07/06/2h8n4ofixc8g8i94vopfat048ld37m944694.svg,https://p3-ofp.static.pub/fes/cms/2021/07/06/efrjjv1rz2xiuvpm0emnwj6y2gmai3506628.svg,https://p2-ofp.static.pub/fes/cms/2021/07/06/wxdfgadg28utnas6ca5d28oot1lcxj806083.svg,6FT DISPLAYPORT DP-M/DP-M      CABL,https://www.lenovo.com/us/en/p/accessories-and-software/cables-and-adapters/cables/78015172,78015172,,,,,,,,,,,,$22.99,6 Months Promotional Financing Available* On purchases of  or more made with the Lenovo Credit Card,$500,Learn More,,Learn More,Earn,$0.69,in Rewards,Price Match Guarantee,Compare,Added!,,,,,,,,,,,,,
,https://p1-ofp.static.pub/medias/bWFzdGVyfHJvb3R8NjE0MnxpbWFnZS9qcGVnfGhmMC9oNjcvMTE3MjU0MTA0MzUxMDIuanBnfDg2YmZlNDljYjkyZGRmMGE1NmYxYmQyNTZmZjhjYzI0N2QyNzUzYmNlYzFkZGNhZTAwY2MyYjlkNGM1ODkzZGQ/C8C63EF4-7E04-427A-A749-9CD8CFAD413C.jpg,https://p1-ofp.static.pub/medias/bWFzdGVyfHJvb3R8NjE0MnxpbWFnZS9qcGVnfGhmMC9oNjcvMTE3MjU0MTA0MzUxMDIuanBnfDg2YmZlNDljYjkyZGRmMGE1NmYxYmQyNTZmZjhjYzI0N2QyNzUzYmNlYzFkZGNhZTAwY2MyYjlkNGM1ODkzZGQ/C8C63EF4-7E04-427A-A749-9CD8CFAD413C.jpg,https://p1-ofp.static.pub/fes/cms/2020/12/25/76apjfkml79bg5qcf172tvt0bw0c8s348607.png,https://p2-ofp.static.pub/fes/cms/2021/07/06/2h8n4ofixc8g8i94vopfat048ld37m944694.svg,https://p3-ofp.static.pub/fes/cms/2021/07/06/efrjjv1rz2xiuvpm0emnwj6y2gmai3506628.svg,https://p2-ofp.static.pub/fes/cms/2021/07/06/wxdfgadg28utnas6ca5d28oot1lcxj806083.svg,7OUT SURGE PROTECTOR 6FT CORD  PERP,https://www.lenovo.com/us/en/p/accessories-and-software/chargers-and-batteries/chargers/78000991,78000991,,,,,,,,,,,,$24.99,6 Months Promotional Financing Available* On purchases of  or more made with the Lenovo Credit Card,$500,Learn More,,Learn More,Earn,$0.75,in Rewards,Price Match Guarantee,Compare,Added!,,,,,,,,,,,,,
,https://p1-ofp.static.pub/medias/bWFzdGVyfHJvb3R8MTA4OTB8aW1hZ2UvanBlZ3xoYzUvaDM2LzExNzI1NDIzODA0NDQ2LmpwZ3w4MGRiYTFjMmQwNTdlNmE2YWVlNjIxYzc0ZTg5OTVlYmNmYzJjYWQxMTJhZDY3NjBiNjVjYWZiNTdlOWY1NTg5/3997B722-4ECE-4E53-AB84-300BA7055A45.jpg,https://p1-ofp.static.pub/medias/bWFzdGVyfHJvb3R8MTA4OTB8aW1hZ2UvanBlZ3xoYzUvaDM2LzExNzI1NDIzODA0NDQ2LmpwZ3w4MGRiYTFjMmQwNTdlNmE2YWVlNjIxYzc0ZTg5OTVlYmNmYzJjYWQxMTJhZDY3NjBiNjVjYWZiNTdlOWY1NTg5/3997B722-4ECE-4E53-AB84-300BA7055A45.jpg,https://p1-ofp.static.pub/fes/cms/2020/12/25/76apjfkml79bg5qcf172tvt0bw0c8s348607.png,https://p2-ofp.static.pub/fes/cms/2021/07/06/2h8n4ofixc8g8i94vopfat048ld37m944694.svg,https://p3-ofp.static.pub/fes/cms/2021/07/06/efrjjv1rz2xiuvpm0emnwj6y2gmai3506628.svg,https://p2-ofp.static.pub/fes/cms/2021/07/06/wxdfgadg28utnas6ca5d28oot1lcxj806083.svg,DISPLAYPORT TO VGA M/F ADAPTER ADAP,https://www.lenovo.com/us/en/p/accessories-and-software/cables-and-adapters/cables/78004753,78004753,,,,,,,,,,,,$29.99,6 Months Promotional Financing Available* On purchases of  or more made with the Lenovo Credit Card,$500,Learn More,,Learn More,Earn,$0.90,in Rewards,Price Match Guarantee,Compare,Added!,,,,,,,,,,,,,
,https://p1-ofp.static.pub/medias/bWFzdGVyfHJvb3R8NzUyNnxpbWFnZS9qcGVnfGgxOC9oYTUvMTE2MDA5MTM4OTEzNTguanBnfDQzZWRhYTM3MTNmM2MyZjBjOTU5ZTBhY2ZjNzA0NTdmMWQwMmFhOTZhNDYzMjc2YTgwYjA2NWRhMzU1YTQ2NDc/6AA4379C-76AC-4416-BE68-CC621F8959BE.jpg,https://p1-ofp.static.pub/medias/bWFzdGVyfHJvb3R8NzUyNnxpbWFnZS9qcGVnfGgxOC9oYTUvMTE2MDA5MTM4OTEzNTguanBnfDQzZWRhYTM3MTNmM2MyZjBjOTU5ZTBhY2ZjNzA0NTdmMWQwMmFhOTZhNDYzMjc2YTgwYjA2NWRhMzU1YTQ2NDc/6AA4379C-76AC-4416-BE68-CC621F8959BE.jpg,https://p1-ofp.static.pub/fes/cms/2020/12/25/76apjfkml79bg5qcf172tvt0bw0c8s348607.png,https://p2-ofp.static.pub/fes/cms/2021/07/06/2h8n4ofixc8g8i94vopfat048ld37m944694.svg,https://p3-ofp.static.pub/fes/cms/2021/07/06/efrjjv1rz2xiuvpm0emnwj6y2gmai3506628.svg,https://p2-ofp.static.pub/fes/cms/2021/07/06/wxdfgadg28utnas6ca5d28oot1lcxj806083.svg,TP-Link EAP115 - V4 - wireless access point,https://www.lenovo.com/us/en/p/accessories-and-software/wireless-and-networking/wireless-accessories/78015096,78015096,Key Details,Powered by standard 802.3af PoE for convenient installation,Simple mounting design for easy attachment to a wall or ceiling,Web captive portal provides a professional and convenient way to get the Wi-Fi access,"Advertising page, Facebook Wi-Fi and SMS authentication help boost your business",...,See More Details,https://www.lenovo.com/us/en/p/accessories-and-software/wireless-and-networking/wireless-accessories/78015096,,,,$29.99,6 Months Promotional Financing Available* On purchases of  or more made with the Lenovo Credit Card,$500,Learn More,,Learn More,Earn,$0.90,in Rewards,Price Match Guarantee,Compare,Added!,,,,,Powered by standard 802.3af PoE for convenient installation,Simple mounting design for easy attachment to a wall or ceiling,Web captive portal provides a professional and convenient way to get the Wi-Fi access,"Advertising page, Facebook Wi-Fi and SMS authentication help boost your business",Enterprise-class Wi-Fi security helps lower network security threats,Multi-SSIDs separate the different groups of users with different resource privileges,Enterprise-class Wi-Fi security helps lower network security threats,Multi-SSIDs separate the different groups of users with different resource privileges,Supports management VLAN for enhanced network m
,https://p1-ofp.static.pub/medias/bWFzdGVyfHJvb3R8MTMxNTF8aW1hZ2UvanBlZ3xoZTQvaDQxLzExNzI0MzU3OTkyNDc4LmpwZ3xiZGE0ZjkzZmYwZDQ3ZDllMjZhYWFjZTNmYjA4ZTBlZGY4ZmY5YjM2MTRiMTMxZTMxNzU3OGVlNGVjYmI0N2Yz/6594EF97-058E-45F4-9BC0-162056C437E7.jpg,https://p1-ofp.static.pub/medias/bWFzdGVyfHJvb3R8MTMxNTF8aW1hZ2UvanBlZ3xoZTQvaDQxLzExNzI0MzU3OTkyNDc4LmpwZ3xiZGE0ZjkzZmYwZDQ3ZDllMjZhYWFjZTNmYjA4ZTBlZGY4ZmY5YjM2MTRiMTMxZTMxNzU3OGVlNGVjYmI0N2Yz/6594EF97-058E-45F4-9BC0-162056C437E7.jpg,https://p1-ofp.static.pub/fes/cms/2020/12/25/76apjfkml79bg5qcf172tvt0bw0c8s348607.png,https://p2-ofp.static.pub/fes/cms/2021/07/06/2h8n4ofixc8g8i94vopfat048ld37m944694.svg,https://p3-ofp.static.pub/fes/cms/2021/07/06/efrjjv1rz2xiuvpm0emnwj6y2gmai3506628.svg,https://p2-ofp.static.pub/fes/cms/2021/07/06/wxdfgadg28utnas6ca5d28oot1lcxj806083.svg,10OUT METAL SURGE 15FT CORD    PERP,https://www.lenovo.com/us/en/p/accessories-and-software/chargers-and-batteries/Chargers-&-Batteries_Power-Strips-&-Surge-Protectors/78015185,78015185,,,,,,,,,$39.99,save $5.00,12% off,$34.99,6 Months Promotional Financing Available* On purchases of  or more made with the Lenovo Credit Card,$500,Learn More,,Learn More,Earn,$1,in Rewards,Price Match Guarantee,Compare,Added!,,,,,,,,,,,,,
NEW ARRIVAL,https://p2-ofp.static.pub/fes/cms/2021/09/21/81bwdv8ns73qlxt9fw3fx1v3yvu3yz764730.png,https://p3-ofp.static.pub/fes/cms/2021/09/21/frn4lq03qu3if6tauc75f449tvw846435088.png,https://p1-ofp.static.pub/fes/cms/2020/12/25/76apjfkml79bg5qcf172tvt0bw0c8s348607.png,https://p2-ofp.static.pub/fes/cms/2021/07/06/2h8n4ofixc8g8i94vopfat048ld37m944694.svg,https://p3-ofp.static.pub/fes/cms/2021/07/06/efrjjv1rz2xiuvpm0emnwj6y2gmai3506628.svg,https://p2-ofp.static.pub/fes/cms/2021/07/06/wxdfgadg28utnas6ca5d28oot1lcxj806083.svg,Lenovo Integrated Pen for 300e/500e Gen 3 (Windows),https://www.lenovo.com/us/en/p/accessories-and-software/stylus-pens-and-supplies/Stylus-Pens-&-Supplies_Pens/4X81D34328,4X81D34328,Key Details,Diameter: 5.3mm,Wacom AES 1.0,Up to 4096 levels of pressure sensitivity,Rapid charge 15s for 85% and 5 minutes for 100% charge,,,,,,,$39.99,6 Months Promotional Financing Available* On purchases of  or more made with the Lenovo Credit Card,$500,Learn More,,Learn More,Earn,$1,in Rewards,Price Match Guarantee,Compare,Added!,,,,,Diameter: 5.3mm,Wacom AES 1.0,Up to 4096 levels of pressure sensitivity,Rapid charge 15s for 85% and 5 minutes for 100% charge,Up to 42 minutes active use for one single fully charge,Integrated storage and charging in notebook,,Up to 42 minutes active use for one single fully charge,Integrated storage and charging in notebook
,https://p1-ofp.static.pub/medias/bWFzdGVyfHJvb3R8NzY1OXxpbWFnZS9qcGVnfGhjZi9oZmUvMTE2MDc5MTg5Njg4NjIuanBnfGFiNTUxNTE3ZWIyMjIzNjkzZTlkNDdmMWY3YmMzMzg3ODQ2MjdhYTk1ZDE4YWYxODNkNmUzMGM1MTk5YjFjNmM/1C90996B-8416-4F71-AD0C-529D5BC8BF33.jpg,https://p1-ofp.static.pub/medias/bWFzdGVyfHJvb3R8NzY1OXxpbWFnZS9qcGVnfGhjZi9oZmUvMTE2MDc5MTg5Njg4NjIuanBnfGFiNTUxNTE3ZWIyMjIzNjkzZTlkNDdmMWY3YmMzMzg3ODQ2MjdhYTk1ZDE4YWYxODNkNmUzMGM1MTk5YjFjNmM/1C90996B-8416-4F71-AD0C-529D5BC8BF33.jpg,https://p1-ofp.static.pub/fes/cms/2020/12/25/76apjfkml79bg5qcf172tvt0bw0c8s348607.png,https://p2-ofp.static.pub/fes/cms/2021/07/06/2h8n4ofixc8g8i94vopfat048ld37m944694.svg,https://p3-ofp.static.pub/fes/cms/2021/07/06/efrjjv1rz2xiuvpm0emnwj6y2gmai3506628.svg,https://p2-ofp.static.pub/fes/cms/2021/07/06/wxdfgadg28utnas6ca5d28oot1lcxj806083.svg,3FT DISPLAYPORT TO DVI CABLE   CABL,https://www.lenovo.com/us/en/p/accessories-and-software/cables-and-adapters/cables/78015174,78015174,,,,,,,,,,,,$39.99,6 Months Promotional Financing Available* On purchases of  or more made with the Lenovo Credit Card,$500,Learn More,,Learn More,Earn,$1,in Rewards,Price Match Guarantee,Compare,Added!,,,,,,,,,,,,,
,,,,,,,ThinkSmart 10m Cable,https://www.lenovo.com/us/en/p/accessories-and-software/cables-and-adapters/cables/4X91C47404,4X91C47404,Key Details,Option cable (USB2.0 10m),Option cable (USB2.0 10m),,,,,,,,,$40.00,6 Months Promotional Financing Available* On purchases of  or more made with the Lenovo Credit Card,$500,Learn More,,Learn More,Earn,$1,in Rewards,Price Match Guarantee,Compare,Added!,,,,,,,,,,,,,
NEW ARRIVAL,https://p2-ofp.static.pub/ShareResource/560x450/SSNP/4X81D34328/4X81D34327-560x450-01.f29520e6c42f4d2f.png,https://p2-ofp.static.pub/ShareResource/560x450/SSNP/4X81D34328/4X81D34327-560x450-02.4092945252aa1c8e.png,https://p1-ofp.static.pub/fes/cms/2020/12/25/76apjfkml79bg5qcf172tvt0bw0c8s348607.png,https://p2-ofp.static.pub/fes/cms/2021/07/06/2h8n4ofixc8g8i94vopfat048ld37m944694.svg,https://p3-ofp.static.pub/fes/cms/2021/07/06/efrjjv1rz2xiuvpm0emnwj6y2gmai3506628.svg,https://p2-ofp.static.pub/fes/cms/2021/07/06/wxdfgadg28utnas6ca5d28oot1lcxj806083.svg,Lenovo Rechargeable USI Pen for 300e/500e Chromebook gen 3,https://www.lenovo.com/us/en/p/accessories-and-software/stylus-pens-and-supplies/Stylus-Pens-&-Supplies_Pens/4X81D34327,4X81D34327,Key Details,Diameter: 5.5mm,USI protocol supported Chrome OS,Up to 4096 levels of pressure sensitivity,Rapid charge 60s for 95% and 4 minutes for 100% charge at 150mA charge current,,,,,,,$44.99,6 Months Promotional Financing Available* On purchases of  or more made with the Lenovo Credit Card,$500,Learn More,,Learn More,Earn,$1,in Rewards,Price Match Guarantee,Compare,Added!,,,,,Diameter: 5.5mm,USI protocol supported Chrome OS,Up to 4096 levels of pressure sensitivity,Rapid charge 60s for 95% and 4 minutes for 100% charge at 150mA charge current,Up to 40 minutes active use for one single fully charge,Integrated storage and charging in Chromebook,,Up to 40 minutes active use for one single fully charge,Integrated storage and charging in Chromebook
READY TO SHIP,https://p4-ofp.static.pub/ShareResource/SSNP/4XJ1D33266/4XJ1D33266-500x400-01.e95733ca85992fc9.png,https://p4-ofp.static.pub/ShareResource/SSNP/4XJ1D33266/4XJ1D33266-500x400-02.24de93f841aa9f6c.png,https://p1-ofp.static.pub/fes/cms/2020/12/25/76apjfkml79bg5qcf172tvt0bw0c8s348607.png,https://p2-ofp.static.pub/fes/cms/2021/07/06/2h8n4ofixc8g8i94vopfat048ld37m944694.svg,https://p3-ofp.static.pub/fes/cms/2021/07/06/efrjjv1rz2xiuvpm0emnwj6y2gmai3506628.svg,https://p2-ofp.static.pub/fes/cms/2021/07/06/wxdfgadg28utnas6ca5d28oot1lcxj806083.svg,Lenovo 13.3 inch 1610 Privacy Filter for X13 Gen2 with COMPLY Attachment from 3M,https://www.lenovo.com/us/en/p/accessories-and-software/privacy-and-protection/privacy-filters-black/4XJ1D33266,4XJ1D33266,Key Details,Lenovo 13.3 inch 1610 Privacy Filter for X13 Gen2 with COMPLY Attachment from 3M,Lenovo 13.3 inch 1610 Privacy Filter for X13 Gen2 with COMPLY Attachment from 3M,,,,,,,,,$42.99,6 Months Promotional Financing Available* On purchases of  or more made with the Lenovo Credit Card,$500,Learn More,,Learn More,Earn,$1,in Rewards,Price Match Guarantee,Compare,Added!,,,,,,,,,,,,,
,https://p2-ofp.static.pub/ShareResource/SSNP/4XJ1D34303/4XJ1D34303-01-500x400.c0e38e76cfd6af23.png,https://p3-ofp.static.pub/ShareResource/SSNP/4XJ1D34303/4XJ1D34303-02-500x400.657c3a6fa493bf3f.png,https://p1-ofp.static.pub/fes/cms/2020/12/25/76apjfkml79bg5qcf172tvt0bw0c8s348607.png,https://p2-ofp.static.pub/fes/cms/2021/07/06/2h8n4ofixc8g8i94vopfat048ld37m944694.svg,https://p3-ofp.static.pub/fes/cms/2021/07/06/efrjjv1rz2xiuvpm0emnwj6y2gmai3506628.svg,https://p2-ofp.static.pub/fes/cms/2021/07/06/wxdfgadg28utnas6ca5d28oot1lcxj806083.svg,Lenovo 16.0 inch 1610 Privacy Filter for X1 Extreme P1 with COMPLY Attachment from 3M,https://www.lenovo.com/us/en/p/accessories-and-software/privacy-and-protection/privacy-filters-black/4XJ1D34303,4XJ1D34303,Key Details,Lenovo 16.0 inch 1610 Privacy Filter for X1 Extreme P1 with COMPLY Attachment from 3M,Lenovo 16.0 inch 1610 Privacy Filter for X1 Extreme P1 with COMPLY Attachment from 3M,,,,,,,,,$54.99,6 Months Promotional Financing Available* On purchases of  or more made with the Lenovo Credit Card,$500,Learn More,"Ships FREE by Thu, Oct 14",Learn More,Earn,$1,in Rewards,Price Match Guarantee,Compare,Added!,,,,,,,,,,,,,
,https://p3-ofp.static.pub/fes/cms/2021/09/06/1j5xhisnz4no9hoqzmmdn1k0xwh40f118199.jpg,https://p1-ofp.static.pub/ShareResource/560x450/SSNP/GXC1D05522/GXC1D05522-500x400-01.ab2ceeb8d21d076c.png,https://p1-ofp.static.pub/fes/cms/2020/12/25/76apjfkml79bg5qcf172tvt0bw0c8s348607.png,https://p2-ofp.static.pub/fes/cms/2021/07/06/2h8n4ofixc8g8i94vopfat048ld37m944694.svg,https://p3-ofp.static.pub/fes/cms/2021/07/06/efrjjv1rz2xiuvpm0emnwj6y2gmai3506628.svg,https://p2-ofp.static.pub/fes/cms/2021/07/06/wxdfgadg28utnas6ca5d28oot1lcxj806083.svg,Productivity LFH Bundle,https://www.lenovo.com/us/en/p/accessories-and-software/convenience-bundles/LFHBUNDLE723,LFHBUNDLE723,Includes,,,,,,,,$149.96,save $74.97,49% off,$74.99,6 Months Promotional Financing Available* On purchases of  or more made with the Lenovo Credit Card,$500,Learn More,,Learn More,Earn,$2,in Rewards,Price Match Guarantee,Compare,Added!,,,,,,,,,,,,,
