flag,normal_image src,hover_image src,heart src,productGalleryOverride src,productGalleryOverride src 2,productGalleryOverride src 3,lazy_href,lazy_href href,part_number 2,title,key_details,key_details 2,key_details 3,key_details 4,ellip,morelink,morelink href,price,save,percent-box,final-price,ca-content-container,ca-price-focus,ca-link,ships,ca-link 2,text 2,text 3,text 4,price_guarantee,compareDefault,compareAdd,bv_main_container href,bv_stars_svg_no_wrap href,bv_text,bv_text 2,key_details 5,key_details 6,key_details 7,key_details 8,key_details 9,key_details 10,key_details 11,key_details 12,key_details 13
,https://p2-ofp.static.pub/ShareResource/SSNP/4Y51C21217/4Y51C21217-500x400-02.785e19588b6b9cf5.png,https://p1-ofp.static.pub/fes/cms/2021/09/03/fotp1094ma7d47x6fr06571gw7bu7o228133.png,https://p1-ofp.static.pub/fes/cms/2020/12/25/76apjfkml79bg5qcf172tvt0bw0c8s348607.png,https://p2-ofp.static.pub/fes/cms/2021/07/06/2h8n4ofixc8g8i94vopfat048ld37m944694.svg,https://p3-ofp.static.pub/fes/cms/2021/07/06/efrjjv1rz2xiuvpm0emnwj6y2gmai3506628.svg,https://p2-ofp.static.pub/fes/cms/2021/07/06/wxdfgadg28utnas6ca5d28oot1lcxj806083.svg,Lenovo Go Wireless Multi-Device Mouse (Thunder Black),https://www.lenovo.com/us/en/p/accessories-and-software/keyboards-and-mice/mice/4Y51C21217,4Y51C21217,Key Details,Compact ambidextrous design,"Blue optical sensor, tracks on most surfaces",Silent left/right keys with 2-way scroll wheel (up / down),800 - 1600- 2400 on-the-fly adjustable DPI,...,See More Details,https://www.lenovo.com/us/en/p/accessories-and-software/keyboards-and-mice/mice/4Y51C21217,$59.99,save $8.00,13% off,$51.99,6 Months Promotional Financing Available* On purchases of  or more made with the Lenovo Credit Card,$500,Learn More,Ships FREE in 4-7 business days,Learn More,Earn,$1,in Rewards,Price Match Guarantee,Compare,Added!,,,,,Compact ambidextrous design,"Blue optical sensor, tracks on most surfaces",Silent left/right keys with 2-way scroll wheel (up / down),800 - 1600- 2400 on-the-fly adjustable DPI,"Wireless and connects to up to 3 devices: 1 x USB-C dongle, 2 x Bluetooth 5.0",Supports Lenovo Unified Pairing Receiver,Supports Bluetooth Switf Pair,"Wireless and connects to up to 3 devices: 1 x USB-C dongle, 2 x Bluetooth 5.0",Supports Lenovo Unified Pairing Receiver
,https://p1-ofp.static.pub/medias/bWFzdGVyfHJvb3R8MTI4MDl8aW1hZ2UvanBlZ3xoY2UvaDA2LzExNjAwMTEwMzg3MjMwLmpwZ3xkMGE1NmM5N2VkZGU5ZTMxOTA0MmQyOWI1Mzc3ZTZjMzIxMDdmYWE2OTAxODdlZTM3MjZiYjRiN2UxMzlhNDg1/4433B16B-12B9-4C76-8ED1-16A6532DF3B1.jpg,https://p1-ofp.static.pub/medias/bWFzdGVyfHJvb3R8MTI4MDl8aW1hZ2UvanBlZ3xoY2UvaDA2LzExNjAwMTEwMzg3MjMwLmpwZ3xkMGE1NmM5N2VkZGU5ZTMxOTA0MmQyOWI1Mzc3ZTZjMzIxMDdmYWE2OTAxODdlZTM3MjZiYjRiN2UxMzlhNDg1/4433B16B-12B9-4C76-8ED1-16A6532DF3B1.jpg,https://p1-ofp.static.pub/fes/cms/2020/12/25/76apjfkml79bg5qcf172tvt0bw0c8s348607.png,https://p2-ofp.static.pub/fes/cms/2021/07/06/2h8n4ofixc8g8i94vopfat048ld37m944694.svg,https://p3-ofp.static.pub/fes/cms/2021/07/06/efrjjv1rz2xiuvpm0emnwj6y2gmai3506628.svg,https://p2-ofp.static.pub/fes/cms/2021/07/06/wxdfgadg28utnas6ca5d28oot1lcxj806083.svg,Microsoft Xbox Wireless Controller – Shock Blue,https://www.lenovo.com/us/en/p/accessories-and-software/gaming-consoles/Gaming-Consoles_Gaming-Console-Accessories/78016331,78016331,Key Details,"Experience the modernized design of the Xbox Wireless Controller – Shock Blue, featuring sculpted surfaces and refined geometry for enhanced comfort and effortless control during gameplay  Make the controller your own by customizing button mapping. Plus, plug in any compatible headset with the 3.5mm audio headset jack  Includes Xbox Wireless and Bluetooth® technology for wireless gaming on supported consoles, Windo","Experience the modernized design of the Xbox Wireless Controller – Shock Blue, featuring sculpted surfaces and refined geometry for enhanced comfort and effortless control during gameplay  Make the controller your own by customizing button mapping. Plus, plug in any compatible headset with the 3.5mm audio headset jack  Includes Xbox Wireless and Bluetooth® technology for wireless gaming on supported consoles, Windo",Elevate your game:,Custom mapping:,...,See More Details,https://www.lenovo.com/us/en/p/accessories-and-software/gaming-consoles/Gaming-Consoles_Gaming-Console-Accessories/78016331,,,,$64.99,6 Months Promotional Financing Available* On purchases of  or more made with the Lenovo Credit Card,$500,Learn More,Ships FREE in 1-3 business days,Learn More,Earn,$1,in Rewards,Price Match Guarantee,Compare,Added!,,,,,Xbox Wireless and Bluetooth® technology:,Elevate your game:,Custom mapping:,Xbox Wireless and Bluetooth® technology:,,,,,
NEW ARRIVAL,https://p3-ofp.static.pub/fes/cms/2021/08/17/achzrs2djmunfcaksjnxf4qutqink1021439.png,https://p4-ofp.static.pub/fes/cms/2021/08/17/iy4y3hgi83vayauj732nut31gpitqp590436.png,https://p1-ofp.static.pub/fes/cms/2020/12/25/76apjfkml79bg5qcf172tvt0bw0c8s348607.png,https://p2-ofp.static.pub/fes/cms/2021/07/06/2h8n4ofixc8g8i94vopfat048ld37m944694.svg,https://p3-ofp.static.pub/fes/cms/2021/07/06/efrjjv1rz2xiuvpm0emnwj6y2gmai3506628.svg,https://p2-ofp.static.pub/fes/cms/2021/07/06/wxdfgadg28utnas6ca5d28oot1lcxj806083.svg,ThinkPad X12 Detachable Gen 1 Folio Keyboard US English,https://www.lenovo.com/us/en/p/accessories-and-software/tablet-accessories/Tablet-Accessories_Windows-Tablets/4Y41C14227,4Y41C14227,Key Details,"Supporting 4 positions(flat, tilt, close and flip mode) with ThinkPad X12 Detachable Gen 1","Pogo cover with guide pin, living hinge interface",Magnet bar,ThinkPad Red TrackPoint,...,See More Details,https://www.lenovo.com/us/en/p/accessories-and-software/tablet-accessories/Tablet-Accessories_Windows-Tablets/4Y41C14227,,,,$169.99,6 Months Promotional Financing Available* On purchases of  or more made with the Lenovo Credit Card,$500,Learn More,Ships FREE in 4-7 business days,Learn More,Earn,$5,in Rewards,Price Match Guarantee,Compare,Added!,,,,,"Supporting 4 positions(flat, tilt, close and flip mode) with ThinkPad X12 Detachable Gen 1","Pogo cover with guide pin, living hinge interface",Magnet bar,ThinkPad Red TrackPoint,Touchpad with Click Function,Finger Print Reader,Pen Holder,Touchpad with Click Function,Finger Print Reader
,https://p1-ofp.static.pub/ShareResource/560x450/SSNP/GX41D07809/GX41D07809-01-500X400.b166c545e49e3d5d.png,https://p4-ofp.static.pub/ShareResource/560x450/SSNP/GX41D07809/GX41D07809-02-500X400.1b56ec7ff3e17e7e.png,https://p1-ofp.static.pub/fes/cms/2020/12/25/76apjfkml79bg5qcf172tvt0bw0c8s348607.png,https://p2-ofp.static.pub/fes/cms/2021/07/06/2h8n4ofixc8g8i94vopfat048ld37m944694.svg,https://p3-ofp.static.pub/fes/cms/2021/07/06/efrjjv1rz2xiuvpm0emnwj6y2gmai3506628.svg,https://p2-ofp.static.pub/fes/cms/2021/07/06/wxdfgadg28utnas6ca5d28oot1lcxj806083.svg,Lenovo Select 14-inch Sleeve,https://www.lenovo.com/us/en/p/accessories-and-software/cases-and-bags/sleeves/GX41D07809,GX41D07809,Key Details,"Lenovo Select 14-inch Sleeve is a quality storage solution fit for any style-conscious on-the-go professional. Store your laptop, power bank, mouse, and other compact accessories securely inside the main laptop compartment and the extra zippered accessories pocket. Keep your items safe from the unexpected with a water-resistant polyester exterior and padded internal compartments.","Lenovo Select 14-inch Sleeve is a quality storage solution fit for any style-conscious on-the-go professional. Store your laptop, power bank, mouse, and other compact accessories securely inside the main laptop compartment and the extra zippered accessories pocket. Keep your items safe from the unexpected with a water-resistant polyester exterior and padded internal compartments.",,,,,,$19.99,save $10.00,50% off,$9.99,6 Months Promotional Financing Available* On purchases of  or more made with the Lenovo Credit Card,$500,Learn More,"Ships FREE by Thu, Oct 14",Learn More,Earn,$0.30,in Rewards,Price Match Guarantee,Compare,Added!,https://www.lenovo.com/us/en/p/accessories-and-software/cases-and-bags/sleeves/GX41D07809,[object Object],4.8,(28),,,,,,,,,
,https://p3-ofp.static.pub/fes/cms/2021/09/10/lsva57v4xunhj0ud7nudpjt8ejttii103581.png,https://p4-ofp.static.pub/fes/cms/2021/09/10/5v695ua1jhspdfh05sddcb2n92k8gu991776.png,https://p1-ofp.static.pub/fes/cms/2020/12/25/76apjfkml79bg5qcf172tvt0bw0c8s348607.png,https://p2-ofp.static.pub/fes/cms/2021/07/06/2h8n4ofixc8g8i94vopfat048ld37m944694.svg,https://p3-ofp.static.pub/fes/cms/2021/07/06/efrjjv1rz2xiuvpm0emnwj6y2gmai3506628.svg,https://p2-ofp.static.pub/fes/cms/2021/07/06/wxdfgadg28utnas6ca5d28oot1lcxj806083.svg,Lenovo Go Wireless Multi-Device Mouse (Storm Grey),https://www.lenovo.com/us/en/p/accessories-and-software/keyboards-and-mice/mice/GY51C21211,GY51C21211,Key Details,Compact ambidextrous design,"Blue optical sensor, tracks on most surfaces",Silent left/right keys with 2-way scroll wheel (up / down),800 - 1600- 2400 on-the-fly adjustable DPI,...,See More Details,https://www.lenovo.com/us/en/p/accessories-and-software/keyboards-and-mice/mice/GY51C21211,$59.99,save $8.00,13% off,$51.99,6 Months Promotional Financing Available* On purchases of  or more made with the Lenovo Credit Card,$500,Learn More,"Ships FREE by Thu, Oct 14",Learn More,Earn,$1,in Rewards,Price Match Guarantee,Compare,Added!,,,,,Compact ambidextrous design,"Blue optical sensor, tracks on most surfaces",Silent left/right keys with 2-way scroll wheel (up / down),800 - 1600- 2400 on-the-fly adjustable DPI,"Wireless and connects to up to 3 devices: 1 x USB-C dongle, 2 x Bluetooth 5.0",Supports Lenovo Unified Pairing Receiver,Supports Bluetooth Switf Pair,"Wireless and connects to up to 3 devices: 1 x USB-C dongle, 2 x Bluetooth 5.0",Supports Lenovo Unified Pairing Receiver
,https://p4-ofp.static.pub/ShareResource/560x450/SSNP/4XB1D04757/4XB1D04757-500x400-01.1c731ff7eb9678f8.png,,,,,,ThinkPad 1TB Performance PCIe Gen4 NVMe OPAL2 M.2 2280 SSD,https://www.lenovo.com/us/en/p/accessories-and-software/memory-and-storage/memory-and-storage-hard-drives/4XB1D04757,4XB1D04757,Key Details,1TB storage capacity,M.2 2280 form factor,PCIe Gen4 NVMe OPAL2 SSD,Qualified on select ThinkPad notebooks,,,,,,,$269.99,6 Months Promotional Financing Available* On purchases of  or more made with the Lenovo Credit Card,$500,Learn More,Ships FREE in 4-7 business days,Learn More,Earn,$8,in Rewards,Price Match Guarantee,Compare,Added!,https://www.lenovo.com/us/en/p/accessories-and-software/memory-and-storage/memory-and-storage-hard-drives/4XB1D04757,[object Object],5.0,(3),1TB storage capacity,M.2 2280 form factor,PCIe Gen4 NVMe OPAL2 SSD,Qualified on select ThinkPad notebooks,,,,,
,https://p1-ofp.static.pub/medias/bWFzdGVyfHJvb3R8MTE0MjN8aW1hZ2UvanBlZ3xoOGUvaDljLzExNjA3OTIyNTA3ODA2LmpwZ3xkNDIwNTIwZjc3YzMzYTFkNzNmMDIyYzYyNzM2NWYzMWVkNjAwNDAyZDdiMGRlNjgwZjMyOWE5MTVlNGY4NzU5/459E289D-A53A-4164-B22F-F97046A00C17.jpg,https://p1-ofp.static.pub/medias/bWFzdGVyfHJvb3R8MTE0MjN8aW1hZ2UvanBlZ3xoOGUvaDljLzExNjA3OTIyNTA3ODA2LmpwZ3xkNDIwNTIwZjc3YzMzYTFkNzNmMDIyYzYyNzM2NWYzMWVkNjAwNDAyZDdiMGRlNjgwZjMyOWE5MTVlNGY4NzU5/459E289D-A53A-4164-B22F-F97046A00C17.jpg,https://p1-ofp.static.pub/fes/cms/2020/12/25/76apjfkml79bg5qcf172tvt0bw0c8s348607.png,https://p2-ofp.static.pub/fes/cms/2021/07/06/2h8n4ofixc8g8i94vopfat048ld37m944694.svg,https://p3-ofp.static.pub/fes/cms/2021/07/06/efrjjv1rz2xiuvpm0emnwj6y2gmai3506628.svg,https://p2-ofp.static.pub/fes/cms/2021/07/06/wxdfgadg28utnas6ca5d28oot1lcxj806083.svg,DISPLAYPORT TO HDMI ADAPT      ADAP,https://www.lenovo.com/us/en/p/accessories-and-software/cables-and-adapters/cables/78004751,78004751,,,,,,,,,,,,$19.99,6 Months Promotional Financing Available* On purchases of  or more made with the Lenovo Credit Card,$500,Learn More,Ships FREE in 1-3 business days,Learn More,Earn,$0.60,in Rewards,Price Match Guarantee,Compare,Added!,,,,,,,,,,,,,
,https://p1-ofp.static.pub/medias/bWFzdGVyfHJvb3R8OTYyNHxpbWFnZS9qcGVnfGg0NS9oNGYvMTE2MDIwOTQ2ODYyMzguanBnfDc3ZjU2OTUwMmMzZjA0ZjhiN2YwOWQyOTgxOWI1MmMwYzRjM2EyZmZhNWU0MjFiN2Y0ZTU3NGRjZDM5NjFiYTI/52B39405-042E-4A63-A14A-D444BD4A5B16.jpg,https://p1-ofp.static.pub/medias/bWFzdGVyfHJvb3R8OTYyNHxpbWFnZS9qcGVnfGg0NS9oNGYvMTE2MDIwOTQ2ODYyMzguanBnfDc3ZjU2OTUwMmMzZjA0ZjhiN2YwOWQyOTgxOWI1MmMwYzRjM2EyZmZhNWU0MjFiN2Y0ZTU3NGRjZDM5NjFiYTI/52B39405-042E-4A63-A14A-D444BD4A5B16.jpg,https://p1-ofp.static.pub/fes/cms/2020/12/25/76apjfkml79bg5qcf172tvt0bw0c8s348607.png,https://p2-ofp.static.pub/fes/cms/2021/07/06/2h8n4ofixc8g8i94vopfat048ld37m944694.svg,https://p3-ofp.static.pub/fes/cms/2021/07/06/efrjjv1rz2xiuvpm0emnwj6y2gmai3506628.svg,https://p2-ofp.static.pub/fes/cms/2021/07/06/wxdfgadg28utnas6ca5d28oot1lcxj806083.svg,12OUT SURGE PROTECTOR 8FT CORD PERP,https://www.lenovo.com/us/en/p/accessories-and-software/chargers-and-batteries/Chargers-&-Batteries_Power-Strips-&-Surge-Protectors/78000994,78000994,,,,,,,,,$29.99,save $5.00,16% off,$24.99,6 Months Promotional Financing Available* On purchases of  or more made with the Lenovo Credit Card,$500,Learn More,Ships FREE in 1-3 business days,Learn More,Earn,$0.75,in Rewards,Price Match Guarantee,Compare,Added!,https://www.lenovo.com/us/en/p/accessories-and-software/chargers-and-batteries/Chargers-&-Batteries_Power-Strips-&-Surge-Protectors/78000994,[object Object],2.6,(11),,,,,,,,,
,https://p1-ofp.static.pub/ShareResource/SSNP/GXD1B87065/GXD1B87065-500x400-01.5d2e0c57ce57f7f3.png,https://p3-ofp.static.pub/ShareResource/SSNP/GXD1B87065/GXD1B87065-500x400-02.ede2b82acc2c6315.png,https://p1-ofp.static.pub/fes/cms/2020/12/25/76apjfkml79bg5qcf172tvt0bw0c8s348607.png,https://p2-ofp.static.pub/fes/cms/2021/07/06/2h8n4ofixc8g8i94vopfat048ld37m944694.svg,https://p3-ofp.static.pub/fes/cms/2021/07/06/efrjjv1rz2xiuvpm0emnwj6y2gmai3506628.svg,https://p2-ofp.static.pub/fes/cms/2021/07/06/wxdfgadg28utnas6ca5d28oot1lcxj806083.svg,Lenovo Legion H200 Gaming Headset,https://www.lenovo.com/us/en/p/accessories-and-software/audio/headsets/GXD1B87065,GXD1B87065,Key Details,Hear every detail with 50mm drivers delivering rich audio,"Audio tuned for perfection. (Frequency: 20Hz-20KHz, Impedance: 32 ohms)",Passive noise-cancelling microphone built for gamers who despise distractions,Intuitive volume control on headset earcup for quick in-game access,...,See More Details,https://www.lenovo.com/us/en/p/accessories-and-software/audio/headsets/GXD1B87065,$49.99,save $10.00,20% off,$39.99,6 Months Promotional Financing Available* On purchases of  or more made with the Lenovo Credit Card,$500,Learn More,"Ships FREE by Thu, Oct 14",Learn More,Earn Triple Rewards,$3,=,Price Match Guarantee,Compare,Added!,,,,,Hear every detail with 50mm drivers delivering rich audio,"Audio tuned for perfection. (Frequency: 20Hz-20KHz, Impedance: 32 ohms)",Passive noise-cancelling microphone built for gamers who despise distractions,Intuitive volume control on headset earcup for quick in-game access,Swivel-to-mute noise-cancelling microphone so you’ll always know when you’re muted,Lightweight design and quality earcup and padding for lasting comfort,Breathable cloth earcup cushions that keep you cool,Swivel-to-mute noise-cancelling microphone so you’ll always know when you’re muted,Lightweight design and quality earcup and padding for lasting comfort
NEW ARRIVAL,https://p2-ofp.static.pub/fes/cms/2021/08/11/5wjovb1zbu2o18pm0r43pbvcdoz4dc398852.png,,,,,,USB-C to VGA Adapter for NA,https://www.lenovo.com/us/en/p/accessories-and-software/cables-and-adapters/adapters/4X91D96883,4X91D96883,Key Details,"USB-C to VGA conversion delivers high-quality video to your display, projector or TV with resolutions up to 1920x1200","Lightweight, portable and sleek design to accompany your Lenovo system",,,,,,,,,$36.99,6 Months Promotional Financing Available* On purchases of  or more made with the Lenovo Credit Card,$500,Learn More,Ships FREE in 4-7 business days,Learn More,Earn,$1,in Rewards,Price Match Guarantee,Compare,Added!,,,,,"USB-C to VGA conversion delivers high-quality video to your display, projector or TV with resolutions up to 1920x1200","Lightweight, portable and sleek design to accompany your Lenovo system",,,,,,,
,https://p1-ofp.static.pub/ShareResource/560x450/SSNP/4XB1B85887/4XB1B85887-500x400-01.034fde9b78e715cd.png,,,,,,ThinkPad 1TB PCIe NVMe M.2 2242 SSD,https://www.lenovo.com/us/en/p/accessories-and-software/memory-and-storage/memory-and-storage-hard-drives/4XB1B85887,4XB1B85887,Key Details,1TB storage capacity,M.2 2242 form factor,PCIe NVMe SSD,Qualified on select ThinkPad notebooks,,,,,,,$269.99,6 Months Promotional Financing Available* On purchases of  or more made with the Lenovo Credit Card,$500,Learn More,Ships FREE in 4-7 business days,Learn More,Earn,$8,in Rewards,Price Match Guarantee,Compare,Added!,https://www.lenovo.com/us/en/p/accessories-and-software/memory-and-storage/memory-and-storage-hard-drives/4XB1B85887,[object Object],4.3,(3),1TB storage capacity,M.2 2242 form factor,PCIe NVMe SSD,Qualified on select ThinkPad notebooks,,,,,
NEW ARRIVAL,https://p4-ofp.static.pub/ShareResource/560x450/SSNP/4X61E26089/4X61E26089-560x450-01.902a65c70e3cd5d6.png,https://p3-ofp.static.pub/ShareResource/560x450/SSNP/4X61E26089/4X61E26089-560x450-03.056c6505a9a92154.png,https://p1-ofp.static.pub/fes/cms/2020/12/25/76apjfkml79bg5qcf172tvt0bw0c8s348607.png,https://p2-ofp.static.pub/fes/cms/2021/07/06/2h8n4ofixc8g8i94vopfat048ld37m944694.svg,https://p3-ofp.static.pub/fes/cms/2021/07/06/efrjjv1rz2xiuvpm0emnwj6y2gmai3506628.svg,https://p2-ofp.static.pub/fes/cms/2021/07/06/wxdfgadg28utnas6ca5d28oot1lcxj806083.svg,Nvidia RTX A4000 16GB DP*4 Graphics Card,https://www.lenovo.com/us/en/p/accessories-and-software/graphics-cards/graphics_cards/4X61E26089,4X61E26089,Key Details,16GB of GDDR6 memory,Peak memory bandwidth up to 448GB/s,Display Connectors: 4 VESA® DisplayPort® connectors,PCI Express Interface: PCIe 4.0 x 16,,,,,,,"$1,499.99",,,See How,Ships FREE in 4-7 business days,Prequalify,Earn,$45,in Rewards,Price Match Guarantee,Compare,Added!,,,,,16GB of GDDR6 memory,Peak memory bandwidth up to 448GB/s,Display Connectors: 4 VESA® DisplayPort® connectors,PCI Express Interface: PCIe 4.0 x 16,Power connector and header: 1x PCIe 6-Pin,,,Power connector and header: 1x PCIe 6-Pin,
READY TO SHIP,https://p2-ofp.static.pub/ShareResource/560x450/SSNP/GXH1C97872/GXH1C97872-500x400-01.2f658c72963b7e94.png,https://p4-ofp.static.pub/ShareResource/560x450/SSNP/GXH1C97872/GXH1C97872-500x400-02.d08f16f00b55437b.png,https://p1-ofp.static.pub/fes/cms/2020/12/25/76apjfkml79bg5qcf172tvt0bw0c8s348607.png,https://p2-ofp.static.pub/fes/cms/2021/07/06/2h8n4ofixc8g8i94vopfat048ld37m944694.svg,https://p3-ofp.static.pub/fes/cms/2021/07/06/efrjjv1rz2xiuvpm0emnwj6y2gmai3506628.svg,https://p2-ofp.static.pub/fes/cms/2021/07/06/wxdfgadg28utnas6ca5d28oot1lcxj806083.svg,Lenovo IdeaPad Gaming Cloth Mouse Pad L,https://www.lenovo.com/us/en/p/accessories-and-software/keyboards-and-mice/mice/GXH1C97872,GXH1C97872,Key Details,High-quality cloth surface for smooth sweeping and accurate tracking,Anti-slip rubber base that keeps the pad firmly in place,Medium and large sizes for perfect for all gamers,Only 2mm thick to keep your mouse level with your desk,...,See More Details,https://www.lenovo.com/us/en/p/accessories-and-software/keyboards-and-mice/mice/GXH1C97872,$8.99,save $2.00,22% off,$6.99,6 Months Promotional Financing Available* On purchases of  or more made with the Lenovo Credit Card,$500,Learn More,,Learn More,Earn Triple Rewards,$0.62,=,Price Match Guarantee,Compare,Added!,,,,,High-quality cloth surface for smooth sweeping and accurate tracking,Anti-slip rubber base that keeps the pad firmly in place,Medium and large sizes for perfect for all gamers,Only 2mm thick to keep your mouse level with your desk,Water repellent and tear-resistant surface for long-term use,Washable and soft for cleaning and storage,Size: L*W*H: 450 * 400 * 2 mm,Water repellent and tear-resistant surface for long-term use,Washable and soft for cleaning and storage
NEW ARRIVAL,https://p1-ofp.static.pub/fes/cms/2021/09/21/ucow0ynkq7p2vpnbk69lg3yu015ksx999715.png,,,,,,Lenovo HDMI to HDMI cable,https://www.lenovo.com/us/en/p/accessories-and-software/cables-and-adapters/cables/4X91D96900,4X91D96900,Key Details,High bandwidth of 340MHz/ 10.2 Gbps,Full 1080+ resolutions at 120Hz,4k support for up to 2 displays,Stereo 3D support,,,,,,,$14.99,6 Months Promotional Financing Available* On purchases of  or more made with the Lenovo Credit Card,$500,Learn More,,Learn More,Earn,$0.45,in Rewards,Price Match Guarantee,Compare,Added!,,,,,High bandwidth of 340MHz/ 10.2 Gbps,Full 1080+ resolutions at 120Hz,4k support for up to 2 displays,Stereo 3D support,3 year warranty,,,3 year warranty,
,https://p1-ofp.static.pub/fes/cms/2021/08/19/hhhs4bym3fm1vvetma8orvjlordo21556107.png,https://p4-ofp.static.pub/fes/cms/2021/08/19/dligljo8e2ptrz6awuhn4gkazd8dlw366483.png,https://p1-ofp.static.pub/fes/cms/2020/12/25/76apjfkml79bg5qcf172tvt0bw0c8s348607.png,https://p2-ofp.static.pub/fes/cms/2021/07/06/2h8n4ofixc8g8i94vopfat048ld37m944694.svg,https://p3-ofp.static.pub/fes/cms/2021/07/06/efrjjv1rz2xiuvpm0emnwj6y2gmai3506628.svg,https://p2-ofp.static.pub/fes/cms/2021/07/06/wxdfgadg28utnas6ca5d28oot1lcxj806083.svg,Lenovo Mini-DisplayPort to DisplayPort Adapter for NA,https://www.lenovo.com/us/en/p/accessories-and-software/cables-and-adapters/adapters/4X91D96901,4X91D96901,Key Details,High quality with low latency,Transmits video and audio in high definition,Low Profile connector that does not block adjacent ports on your computer,,,,,,,,$24.99,6 Months Promotional Financing Available* On purchases of  or more made with the Lenovo Credit Card,$500,Learn More,,Learn More,Earn,$0.75,in Rewards,Price Match Guarantee,Compare,Added!,,,,,High quality with low latency,Transmits video and audio in high definition,Low Profile connector that does not block adjacent ports on your computer,,,,,,
,https://p2-ofp.static.pub/ShareResource/560x450/SSNP/4XF0G94539/4XF0G94539-500x400-01.360e3cba1ba13dbe.png,,,,,,"ThinkStation 2.5"" to 3.5”  Conversion Kit",https://www.lenovo.com/us/en/p/accessories-and-software/ThinkCentre-and-ThinkStation/ThinkCentre-and-ThinkStation-hard-drives/4XF0G94539,4XF0G94539,Key Details,"Convert one 2.5” drive to a 3.5” drive. This module works on ThinkStation P500, P700 and P900 with highly reliability and stability.","Convert one 2.5” drive to a 3.5” drive. This module works on ThinkStation P500, P700 and P900 with highly reliability and stability.","For more Technical Support  information,",CLICK HERE,,,,,,,$29.99,6 Months Promotional Financing Available* On purchases of  or more made with the Lenovo Credit Card,$500,Learn More,,Learn More,Earn,$0.90,in Rewards,Price Match Guarantee,Compare,Added!,,,,,"For more Technical Support  information,",CLICK HERE,,,,,,,
,https://p2-ofp.static.pub/fes/cms/2021/08/19/z3k2v3of4e66d9jr2brmlaeiaf9j7c655432.png,https://p1-ofp.static.pub/fes/cms/2021/08/19/l1q0z4toz1hradsuahg2225muj4g1r050341.png,https://p1-ofp.static.pub/fes/cms/2020/12/25/76apjfkml79bg5qcf172tvt0bw0c8s348607.png,https://p2-ofp.static.pub/fes/cms/2021/07/06/2h8n4ofixc8g8i94vopfat048ld37m944694.svg,https://p3-ofp.static.pub/fes/cms/2021/07/06/efrjjv1rz2xiuvpm0emnwj6y2gmai3506628.svg,https://p2-ofp.static.pub/fes/cms/2021/07/06/wxdfgadg28utnas6ca5d28oot1lcxj806083.svg,Lenovo USB-C to HDMI Adapter with Power Pass-through for NA,https://www.lenovo.com/us/en/p/accessories-and-software/cables-and-adapters/adapters/4X91D96881,4X91D96881,Key Details,Connect to HDMI display at various resolutions up to and including 4K2K@30Hz,Able to charge system at the same time HDMI display is connected,HDMI can display does not require external power,Sleek design that’s durable and compliments ThinkPad systems,,,,,,,$49.99,6 Months Promotional Financing Available* On purchases of  or more made with the Lenovo Credit Card,$500,Learn More,,Learn More,Earn,$1,in Rewards,Price Match Guarantee,Compare,Added!,,,,,Connect to HDMI display at various resolutions up to and including 4K2K@30Hz,Able to charge system at the same time HDMI display is connected,HDMI can display does not require external power,Sleek design that’s durable and compliments ThinkPad systems,,,,,
