normal_image src,lazy_href,lazy_href href,part_number 2,key_details,key_details 2,key_details 3,final-price,ca-bold,ca-sub-content-container,ca-sub-content-container 2,ca-sub-content-container 3,ca-link,ca-link 2,ca-link 3,ca-link 4,text 2,text 3,text 4,key_details 4,key_details 5,key_details 7,key_details 8,ca-content-container,ca-price-focus,key_details 11,key_details 12,key_details 13
https://p1-ofp.static.pub/medias/bWFzdGVyfHJvb3R8MTU4NjB8aW1hZ2UvanBlZ3xoZDcvaGVjLzExNjk0MTA4MzExNTgyLmpwZ3xkMmQ0ZmZjMTg1ZDY1MDVkNmIwYTBhYjI2YTFiMzBiY2EwODg2NjAxNWZjMGE5OTc4MDFlMjRlOTdkNWE2YWUx/4FED4AA8-7422-419B-B9DB-F4983DC64CCB.jpg,HTC VIVE Pro 2 - 3D virtual reality headset,https://www.lenovo.com/us/en/p/accessories-and-software/vr-headsets/VR-Headsets_AR-VR/78019082,78019082,"Immerse yourself in next-gen visuals with industry-leading 5K resolution, wide 120˚ field of view, and an ultra-smooth 120Hz refresh rate",Feel fully immersed with the equipped Hi-Res Certified headphones,Experience best in class tracking performance and comfort,$799.00,$134/mo,suggested payments,w/6 mo,promo financing,See How,Prequalify,See How,Prequalify,Earn,$23,in Rewards,"Immerse yourself in next-gen visuals with industry-leading 5K resolution, wide 120˚ field of view, and an ultra-smooth 120Hz refresh rate",Feel fully immersed with the equipped Hi-Res Certified headphones,,,,,,,
https://p1-ofp.static.pub/medias/bWFzdGVyfHJvb3R8MTIzMjB8aW1hZ2UvanBlZ3xoNDUvaDUxLzExNjAxMTQ3OTIwNDE0LmpwZ3xjYzZlNzFhYTE0YmNiN2FkNTZlN2Y4ZmE0NDIyZjgzMTkyNjBiMDU4NjZhZDcyZGUwYTk0NzNlNzI5ZGI1ODc2/216D77E0-9AD6-4D34-80A9-01A45DB0871D.jpg,HTC VIVE Cosmos Elite - 3D virtual reality system,https://www.lenovo.com/us/en/p/accessories-and-software/vr-headsets/VR-Headsets_AR-VR/78014837,78014837,See the finer details in VR games,Sound that excites,Designed for gamers,$899.00,$150/mo,suggested payments,w/6 mo,promo financing,See How,Prequalify,See How,Prequalify,Earn,$26,in Rewards,See the finer details in VR games,Sound that excites,,,,,,,
https://p1-ofp.static.pub/medias/bWFzdGVyfHJvb3R8ODY0M3xpbWFnZS9qcGVnfGgwYy9oZGYvMTE2MDAzOTQxMjUzNDIuanBnfGNkMjQwYjAzMzZiNGVlNDlmNTkzMWI2MDdhNjYxYmY3NTE0MjIwMTA4MDlmMDI0NmZhNThlOGMyYjU0NTU2NjM/DBBA4785-ED2E-482E-A815-FC1BC6E51EDE.jpg,"HTC VIVE Link Box - port replicator - HDMI, Mini DP",https://www.lenovo.com/us/en/p/accessories-and-software/vr-headsets/VR-Headsets_AR-VR-Accessories/78014825,78014825,1 x display / video - HDMI input - 19 pin HDMI Type A,1 x display / video - HDMI output - 19 pin HDMI Type A,2 x USB - 4 pin USB Type A,$47.99,,,,,Learn More,Learn More,,,Earn Triple Rewards,$4,=,1 x display / video - HDMI input - 19 pin HDMI Type A,1 x display / video - HDMI output - 19 pin HDMI Type A,2 x power - power DC jack,1 x display / video - DisplayPort input - Mini DisplayPort,6 Months Promotional Financing Available* On purchases of  or more made with the Lenovo Credit Card,$500,,,
https://p1-ofp.static.pub/medias/bWFzdGVyfHJvb3R8NjkzMHxpbWFnZS9qcGVnfGg4OS9oZDcvMTE2MDM3OTMyODEwNTQuanBnfGRlNjljM2E1MTVmMjA5NDAyYTJmZTdiZjQyY2ExNGE4YWJkYjM2NjNlNzhmNzRjMTVlM2RkODZjZTAxYzVjZjA/DB0B79A1-8626-40FB-8092-08EC407BE428.jpg,HTC VIVE Base Station - virtual reality headset and controllers tracker,https://www.lenovo.com/us/en/p/accessories-and-software/vr-headsets/VR-Headsets_AR-VR-Accessories/78014831,78014831,"Now with wide-area tracking, Base Station 2.0 powers the presence and immersion of room-scale, virtual reality by helping the VIVE Pro or VIVE Pro Eye headsets and controllers track their exact locations. Features wireless syncing.","Now with wide-area tracking, Base Station 2.0 powers the presence and immersion of room-scale, virtual reality by helping the VIVE Pro or VIVE Pro Eye headsets and controllers track their exact locations. Features wireless syncing.",,$199.99,,,,,Learn More,Learn More,,,Earn Triple Rewards,$17,=,,,,,6 Months Promotional Financing Available* On purchases of  or more made with the Lenovo Credit Card,$500,,,
https://p1-ofp.static.pub/medias/bWFzdGVyfHJvb3R8ODkyN3xpbWFnZS9qcGVnfGg4NS9oZDYvMTE2MDA1MDcxMDk0MDYuanBnfDI2ZTMyMGE3Njc1YWJlYWJjMjhhYjEzYjlhNzkwNzQ4MThjODJjNmE3ZDYwYTEzZjg5ODkwNzMyZGU1ZDJiY2Q/58F36AD2-044E-4317-89F5-62BE039016AC.jpg,HTC Vive Controller (2018) - VR controller - wireless,https://www.lenovo.com/us/en/p/accessories-and-software/vr-headsets/VR-Headsets_AR-VR-Accessories/78014828,78014828,24 sensors,Multi-function trackpad,Dual-stage trigger,$199.99,,,,,Learn More,Learn More,,,Earn Triple Rewards,$17,=,24 sensors,Multi-function trackpad,HD haptic feedback,Rechargeable battery,6 Months Promotional Financing Available* On purchases of  or more made with the Lenovo Credit Card,$500,,,
https://p1-ofp.static.pub/medias/bWFzdGVyfHJvb3R8MTU5ODN8aW1hZ2UvanBlZ3xoMTEvaGE1LzExNjAyMTIyOTk3NzkwLmpwZ3w5OWExMzc1ZGMxMDI3NTAzZjM4YTcxYjcwZTA4N2JiODg3Y2VhNWRmZDk1ODY1OGFlMjhjYTM1Y2Y5N2RmN2Ix/90B39E26-117A-4E29-9A35-BA3877FB9BAF.jpg,HTC VIVE Deluxe Audio Strap - headphones,https://www.lenovo.com/us/en/p/accessories-and-software/vr-headsets/VR-Headsets_AR-VR-Accessories/78014826,78014826,Easy-to-use size adjustment dial and hard-sided construction,Integrated on-ear headphones with height and angle adjustment,Improved weight distribution and cable management,$99.99,,,,,Learn More,Learn More,,,Earn Triple Rewards,$8,=,Easy-to-use size adjustment dial and hard-sided construction,Integrated on-ear headphones with height and angle adjustment,,,6 Months Promotional Financing Available* On purchases of  or more made with the Lenovo Credit Card,$500,,,
https://p1-ofp.static.pub/medias/bWFzdGVyfHJvb3R8ODQwMHxpbWFnZS9qcGVnfGgwNy9oNjQvMTE2MDA1MDMyNDI3ODIuanBnfDYxYTI0Mzk2MjhlNjY5MDIwOTZkOWI5NjI1MmI2Nzc2NWYxOGZiNDdkZjFjODNmMzk2MjRlMTYwNDQ4MDMxOGQ/E3E39522-5FFD-4FDB-87E2-EC4461250976.jpg,HTC Vive Controller - VR controller - wireless,https://www.lenovo.com/us/en/p/accessories-and-software/vr-headsets/VR-Headsets_AR-VR-Accessories/78014823,78014823,"Lets you wirelessly interact and play with the virtual world. Features sensors, multi-function trackpad, dual-stage trigger, HD haptic feedback and a rechargeable battery.","Lets you wirelessly interact and play with the virtual world. Features sensors, multi-function trackpad, dual-stage trigger, HD haptic feedback and a rechargeable battery.",,$129.99,,,,,Learn More,Learn More,,,Earn Triple Rewards,$11,=,,,,,6 Months Promotional Financing Available* On purchases of  or more made with the Lenovo Credit Card,$500,,,
https://p1-ofp.static.pub/medias/bWFzdGVyfHJvb3R8MTQ1MDl8aW1hZ2UvanBlZ3xoMzgvaDZkLzExNjAzNzk2MDMzNTY2LmpwZ3w1YjU0ODEyN2ExMGM4MzdlZmJlZWE4MzZlMzNmZTMxOWFhMjc2MTJhYTQzNDc4NzZmYmY5MGU3MDdkZGRiY2Fi/F7877E4E-932A-44CB-B257-8744D92A7171.jpg,HTC VIVE Pro Eye - virtual reality headset,https://www.lenovo.com/us/en/p/accessories-and-software/vr-headsets/VR-Headsets_AR-VR/78014833,78014833,Precision eye tracking,Simplified input and navigation,Expanded user analytics,$799.00,$134/mo,suggested payments,w/6 mo,promo financing,See How,Prequalify,See How,Prequalify,Earn,$23,in Rewards,Precision eye tracking,Simplified input and navigation,Foveated rendering,Create lifelike interactions in VR,,,Premium visual fidelity,Designed for comfort and balance,Create expansive multi-user paradigms
https://p1-ofp.static.pub/medias/bWFzdGVyfHJvb3R8MTEzMjZ8aW1hZ2UvanBlZ3xoZDIvaGZiLzExNzI0ODAyMzI2NTU4LmpwZ3xiZDcwY2Q3NjdlODQwN2JlYzQ5MGM3ZmE2M2UxMDAwYjU2MWZiMmZkMTQ3ZWVkMDMxOTlhMThmY2M3YWE4MzNk/0B0211FA-A566-44D9-920B-5B1B89164893.jpg,HTC VIVE Standard - replacement strap for virtual reality headset,https://www.lenovo.com/us/en/p/accessories-and-software/vr-headsets/VR-Headsets_AR-VR-Accessories/78014832,78014832,Replacement strap for the VIVE headset.,Replacement strap for the VIVE headset.,,$94.99,,,,,Learn More,Learn More,,,Earn Triple Rewards,$8,=,,,,,6 Months Promotional Financing Available* On purchases of  or more made with the Lenovo Credit Card,$500,,,
https://p1-ofp.static.pub/medias/bWFzdGVyfHJvb3R8MTUzMTl8aW1hZ2UvanBlZ3xoNzEvaGMyLzExNzI0OTM4ODA1Mjc4LmpwZ3xkMmY1NGNkZDc0MzkwZmFiMmFiM2UzZWM3MGFlZjc0NjRkZDlkYjQzODVjZWI2NGM0NjEzZjk1YmQxMGQ4OGQ1/B9EDFE9F-F984-4780-B2B1-8589B2A9E02D.jpg,HTC VIVE Pro Eye Office - 3D virtual reality system,https://www.lenovo.com/us/en/p/accessories-and-software/vr-headsets/VR-Headsets_AR-VR/78015297,78015297,Advanced VR systems,Precision eye tracking,Understand intentions and improve feedback,"$1,599.00",$267/mo,suggested payments,w/6 mo,promo financing,See How,Prequalify,See How,Prequalify,Earn,$47,in Rewards,Advanced VR systems,Precision eye tracking,Simplified input and navigation,Create lifelike interactions in VR,,,Intelligent allocation of GPU workload,Premium visual fidelity,"Add essential audible cues, context and meaning"