product-img-link href,cleanDesc,part-info,part-info 2,price,wishlist-label href,short-description
https://www.turnermotorsport.com/p-2504-e46-323-325-328-right-rear-brake-caliper/,Genuine BMW Rear Brake Caliper - Right,2504,34216758136,$290.71,https://www.turnermotorsport.com/c-82-bmw-brake-calipers?No=240&Nrpp=48#,This RIGHT REAR brake caliper fits the following BMWs:
https://www.turnermotorsport.com/p-61951-34206779729-genuine-bmw-part/,Genuine MINI Brake Carrier Front Left,61951,34206779729,$117.91,https://www.turnermotorsport.com/c-82-bmw-brake-calipers?No=240&Nrpp=48#,Genuine MINI BRAKE CARRIER LEFT
https://www.turnermotorsport.com/p-368267-gasket-set-for-brake-repair/,Genuine BMW Gasket Set For Brake Repair,368267,34116769277,$21.31,https://www.turnermotorsport.com/c-82-bmw-brake-calipers?No=240&Nrpp=48#,
https://www.turnermotorsport.com/p-61793-34116759165-genuine-bmw-part/,Genuine BMW Caliper Guide Bushing - One Caliper,61793,34116759165,$25.11,https://www.turnermotorsport.com/c-82-bmw-brake-calipers?No=240&Nrpp=48#,"Genuine BMW Repair Kit Guide Bush    E60 M5,E63 M6,E53 48IS,E53 X5,E63,E65"
https://www.turnermotorsport.com/p-21832-34116776526-genuine-bmw-part/,Genuine BMW Retaining Clip,21832,34116776526,$16.17,https://www.turnermotorsport.com/c-82-bmw-brake-calipers?No=240&Nrpp=48#,"Genuine BMW Clip -     E82,E89 Z4,E90,E92,E93"
https://www.turnermotorsport.com/p-62328-34216793053-genuine-bmw-part/,"Calliper Carrier Left - F06, F10, F12, F13",62328,34216793053,$243.64,https://www.turnermotorsport.com/c-82-bmw-brake-calipers?No=240&Nrpp=48#,"Genuine BMW Brake Carrier Left -     F06,F10,F12,F13"
https://www.turnermotorsport.com/p-62266-34216769103-genuine-bmw-part/,Genuine BMW Rear Caliper Rebuild Kit,62266,34216769103,$62.23,https://www.turnermotorsport.com/c-82-bmw-brake-calipers?No=240&Nrpp=48#,"Genuine BMW Repair Set Brake Caliper -     E70 X5,E71,E90,E92,E93,F01,F02,F15,F16"
https://www.turnermotorsport.com/p-62311-34216791017-genuine-bmw-part/,"Genuine BMW Caliper Housing Left - 34216791017 - F25,F26",62311,34216791017,$359.13,https://www.turnermotorsport.com/c-82-bmw-brake-calipers?No=240&Nrpp=48#,"Genuine BMW Caliper Housing Left -     F25 X3,F26 X4"
https://www.turnermotorsport.com/p-178476-34217847227-genuine-bmw-part/,"Caliper Housing Left - Blue - E70, E71, F15, F16, F85, F86
        ...",178476,34217847227,$481.09,https://www.turnermotorsport.com/c-82-bmw-brake-calipers?No=240&Nrpp=48#,"Genuine BMW Caliper Housing Left - Dunkelblau    E70 X5M,E71 X6M,E70 X5,E71 X6,F15,F16"
https://www.turnermotorsport.com/p-61886-34116789294-genuine-bmw-part/,Genuine BMW Expansion Spring,61886,34116789294,$27.18,https://www.turnermotorsport.com/c-82-bmw-brake-calipers?No=240&Nrpp=48#,"Genuine BMW Expansion Spring    E70 X5M,E71 X6M,E70 X5,E71 X6,F15,F16"
https://www.turnermotorsport.com/p-25215-34112283364-genuine-bmw-part/,"Genuine BMW Front Caliper Carrier Bracket - E82 1M, E9X M3
        ...",25215,34112283364,$189.20,https://www.turnermotorsport.com/c-82-bmw-brake-calipers?No=240&Nrpp=48#,This caliper carrier is secured to the steering knuckle and aligns the caliper to the rotor.
https://www.turnermotorsport.com/p-19917-34211103482-genuine-bmw-part/,"FTE Rear Brake Caliper Rebuild Kit - E12, E24",19917,34211103482,$11.95,https://www.turnermotorsport.com/c-82-bmw-brake-calipers?No=240&Nrpp=48#,"Genuine BMW BRAKES REPAIR SET BRAKE CALIPER.--       - 528i, 530i    - 630csi, 633csi   --."
https://www.turnermotorsport.com/p-61916-34116850931-genuine-bmw-part/,"Caliper Housing Left - F30, F32, F33, F34, F36",61916,34116850931,$729.04,https://www.turnermotorsport.com/c-82-bmw-brake-calipers?No=240&Nrpp=48#,"Genuine BMW Caliper Housing Left -     F30,F32,F33,F34,F36"
https://www.turnermotorsport.com/p-62-brake-caliper-new-original-bmw-rear-left-e36-m3-1995-1999/,"Brake Caliper - New - Original BMW - Rear Left - E36 M3 1995-1999
 ...",62,34212227519,$827.06,https://www.turnermotorsport.com/c-82-bmw-brake-calipers?No=240&Nrpp=48#,
https://www.turnermotorsport.com/p-61978-34206855481-genuine-bmw-part/,"Genuine BMW Rear Brake Caliper - Left - F3X, F8X",61978,34206855481,$772.17,https://www.turnermotorsport.com/c-82-bmw-brake-calipers?No=240&Nrpp=48#,"Whether you are changing the color of your calipers or upgrading your brakes, this M Performance caliper will look great behind your wheels and will give you the performance you are looking for!"
https://www.turnermotorsport.com/p-61862-34116778399-genuine-bmw-part/,"Calliper Carrier Left - E70, E71, F15",61862,34116778399,$222.11,https://www.turnermotorsport.com/c-82-bmw-brake-calipers?No=240&Nrpp=48#,"Genuine BMW Brake Carrier Left -     E70 X5,E71"
https://www.turnermotorsport.com/p-61661-34111512711-genuine-bmw-part/,Genuine MINI Gasket Set For Brake Repair,61661,34111512711,$33.38,https://www.turnermotorsport.com/c-82-bmw-brake-calipers?No=240&Nrpp=48#,Genuine MINI REPAIR SET BRAKE CALIPER
https://www.turnermotorsport.com/p-154833-65752753429-genuine-bmw-part/,"Bracket Alternative Power Siren - Cooper, Cooper Coupe, Cooper Roads...",154833,65752753429,$23.26,https://www.turnermotorsport.com/c-82-bmw-brake-calipers?No=288&Nrpp=48#,Genuine MINI BRACKET ALTERNATIVE POWER SI
https://www.turnermotorsport.com/p-589902-remanufactured-front-brake-caliper-left/,Remanufactured Front Brake Caliper - Left,589902,34116776783,$191.04,https://www.turnermotorsport.com/c-82-bmw-brake-calipers?No=288&Nrpp=48#,
https://www.turnermotorsport.com/p-154866-65756949085-genuine-bmw-part/,Mounting Plate - E93,154866,65756949085,$11.50,https://www.turnermotorsport.com/c-82-bmw-brake-calipers?No=288&Nrpp=48#,Genuine BMW Mounting Plate -     E93
https://www.turnermotorsport.com/p-154856-65756937448-genuine-bmw-part/,Bracket Alternative Power Siren - Z4,154856,65756937448,$18.97,https://www.turnermotorsport.com/c-82-bmw-brake-calipers?No=288&Nrpp=48#,"Genuine BMW Bracket Alternative Power Siren    E85 Z4M,E85 Z4,E86 Z4"
https://www.turnermotorsport.com/p-61874-34116786820-genuine-bmw-part/,"Calliper Carrier - F01, F02, F06, F07, F10, F12, F13",61874,34116786820,$233.80,https://www.turnermotorsport.com/c-82-bmw-brake-calipers?No=288&Nrpp=48#,"Genuine BMW Brake Carrier -     F01,F02,F06,F10,F12,F13"
https://www.turnermotorsport.com/p-181199-34117846704-genuine-bmw-part/,"Calliper Carrier - F06, F12, F13",181199,34117846704,$268.86,https://www.turnermotorsport.com/c-82-bmw-brake-calipers?No=288&Nrpp=48#,"Genuine BMW Brake Carrier -     F06,F12,F13"
https://www.turnermotorsport.com/p-62312-34216791018-genuine-bmw-part/,"Genuine BMW Caliper Housing Right - 34216791018 - F25,F26",62312,34216791018,$359.13,https://www.turnermotorsport.com/c-82-bmw-brake-calipers?No=288&Nrpp=48#,"Genuine BMW Caliper Housing Right -     F25 X3,F26 X4"
https://www.turnermotorsport.com/p-61980-34206855485-genuine-bmw-part/,"Genuine BMW Rear Brake Caliper - Left - F3X, F8X",61980,34206855485,$772.17,https://www.turnermotorsport.com/c-82-bmw-brake-calipers?No=288&Nrpp=48#,"Whether you are changing the color of your calipers or upgrading your brakes, this M Performance caliper will look great behind your wheels and will give you the performance you are looking for!"
https://www.turnermotorsport.com/p-534239-brake-caliper-housin/,"Genuine BMW Rear Brake Caliper - Right - F3X, F8X",534239,34206855486,$772.17,https://www.turnermotorsport.com/c-82-bmw-brake-calipers?No=288&Nrpp=48#,"Whether you are changing the color of your calipers or upgrading your brakes, this M Performance caliper will look great behind your wheels and will give you the performance you are looking for!"
https://www.turnermotorsport.com/p-61508-34111103232-genuine-bmw-part/,"Genuine BMW Bleed Valve Screw for Brake Caliper - E12 E24 E28 E3
  ...",61508,34111103232,$8.15,https://www.turnermotorsport.com/c-82-bmw-brake-calipers?No=288&Nrpp=48#,Genuine BMW BLEEDER VALVE
https://www.turnermotorsport.com/p-362778-retaining-clip/,ATE Retaining Clip - E39,362778,34116752424,$12.95,https://www.turnermotorsport.com/c-82-bmw-brake-calipers?No=288&Nrpp=48#,Also known as anti rattle spring
https://www.turnermotorsport.com/p-370050-front-brake-caliper-anti-rattle-clip-priced-each/,"ATE Front Brake Caliper Anti Rattle Clip - E32, E34",370050,34111157687,$9.76,https://www.turnermotorsport.com/c-82-bmw-brake-calipers?No=288&Nrpp=48#,Fits both left and right sides
https://www.turnermotorsport.com/p-21833-34212282198-genuine-bmw-part/,"Genuine BMW Rear Anti-Rattle Spring - E39 M5, E46 M3, E60 M5, E63/64...",21833,34212282198,$12.12,https://www.turnermotorsport.com/c-82-bmw-brake-calipers?No=288&Nrpp=48#,"Anti-rattle springs secure the brake pad in a fixed position inside the caliper, preventing excess noise."
https://www.turnermotorsport.com/p-15839-34112283167-genuine-bmw-part/,"Genuine BMW Front Anti-Rattle Spring - E60 M5,E63 M6",15839,34112283167,$26.23,https://www.turnermotorsport.com/c-82-bmw-brake-calipers?No=288&Nrpp=48#,"Anti-rattle springs secure the brake pad in a fixed position inside the caliper, preventing excess noise."
https://www.turnermotorsport.com/p-21831-34116773203-genuine-bmw-part/,Genuine BMW Brake Caliper Carrier,21831,34116773203,$164.52,https://www.turnermotorsport.com/c-82-bmw-brake-calipers?No=288&Nrpp=48#,"Genuine BMW Brake Carrier -     E89 Z4,E90,E92,E93"
https://www.turnermotorsport.com/p-61736-34112283359-genuine-bmw-part/,"Genuine BMW Rear Caliper Carrier Bracket - E82 1M, E9X M3",61736,34112283359,$197.16,https://www.turnermotorsport.com/c-82-bmw-brake-calipers?No=288&Nrpp=48#,This caliper carrier is secured to the rear wheel carrier and aligns the caliper to the rotor.
https://www.turnermotorsport.com/p-19686-34111119022-genuine-bmw-part/,"Brake Caliper - New - Original BMW - Front Right -E12 528i, 530i 77-...",19686,34111119022,$434.64,https://www.turnermotorsport.com/c-82-bmw-brake-calipers?No=288&Nrpp=48#,
https://www.turnermotorsport.com/p-61842-34116776527-genuine-bmw-part/,Genuine BMW Caliper Housing Left - 34116776527 - E82,61842,34116776527,$362.56,https://www.turnermotorsport.com/c-82-bmw-brake-calipers?No=288&Nrpp=48#,Genuine BMW Caliper Housing Left -     E82
https://www.turnermotorsport.com/p-2503-e46-323-325-328-left-rear-brake-caliper/,Genuine BMW Rear Brake Caliper - Left,2503,34216758135,$290.71,https://www.turnermotorsport.com/c-82-bmw-brake-calipers?No=288&Nrpp=48#,This LEFT REAR brake caliper fits the following BMWs:
https://www.turnermotorsport.com/p-154865-65756949084-genuine-bmw-part/,Bracket Alternative Power Siren - E93,154865,65756949084,$15.81,https://www.turnermotorsport.com/c-82-bmw-brake-calipers?No=288&Nrpp=48#,Genuine BMW Bracket Alternative Power Siren -     E93
https://www.turnermotorsport.com/p-594022-rear-brake-caliper-right/,Rear Brake Caliper - Right,594022,34216793042,$214.02,https://www.turnermotorsport.com/c-82-bmw-brake-calipers?No=288&Nrpp=48#,The brake calipers tend to need replacement at least once during the life of your vehicle. They are exposed to the most extreme elements and have to endure constant use and heat.
https://www.turnermotorsport.com/p-360344-brake-caliper-rebuilt-front-right-e46-m3-2001-2006/,Brake Caliper - Rebuilt - Front Right - E46 M3 2001-2006,360344,34112282176CKT,$130.56,https://www.turnermotorsport.com/c-82-bmw-brake-calipers?No=288&Nrpp=48#,Price includes $66 core charge
https://www.turnermotorsport.com/p-62151-34212226876-genuine-bmw-part/,Calliper Carrier - E30,62151,34212226876,$259.34,https://www.turnermotorsport.com/c-82-bmw-brake-calipers?No=288&Nrpp=48#,"Genuine BMW Brake Carrier    E30 M3,E30"
https://www.turnermotorsport.com/p-362800-anti-rattle-clip/,ATE Anti Rattle Clip - E39,362800,34111164611,$10.80,https://www.turnermotorsport.com/c-82-bmw-brake-calipers?No=288&Nrpp=48#,Essential component for quiet operation
https://www.turnermotorsport.com/p-19986-34111116618-bmw-part/,"OEM FAG Caliper Rebuild Kit - Front - E21 320i (ATE Calipers Only)
...",19986,34111116618,$12.95,https://www.turnermotorsport.com/c-82-bmw-brake-calipers?No=288&Nrpp=48#,Includes new seals to properly rebuild your front caliper
https://www.turnermotorsport.com/p-5749-brake-caliper-rebuilt-front-right-e46-m3-2001-2006/,Brake Caliper - Rebuilt - Front Right - E46 M3 2001-2006,5749,34112282176C,$130.56,https://www.turnermotorsport.com/c-82-bmw-brake-calipers?No=288&Nrpp=48#,Includes $66.00 core charge to be refunded on return of your rebuildable core.
https://www.turnermotorsport.com/p-594024-caliper-housing-left/,Caliper Housing - Left,594024,34216793047,$385.94,https://www.turnermotorsport.com/c-82-bmw-brake-calipers?No=288&Nrpp=48#,Replacement Caliper Housing from TRW
https://www.turnermotorsport.com/p-61737-34112283362-genuine-bmw-part/,"Genuine BMW Front Caliper Housing - Right - E82 1M, E9X M3
        ...",61737,34112283362,$498.56,https://www.turnermotorsport.com/c-82-bmw-brake-calipers?No=288&Nrpp=48#,"This is a Genuine BMW replacement for your seized or damaged front right caliper. This caliper is exactly the same as what your BMW came with from the factory. Because it is Genuine BMW, high quality and perfect fitment are guaranteed!"
https://www.turnermotorsport.com/p-604341-/,"Brake Caliper Housing -  Red -  Left - 19"" M Perf. - G11, G30, ...",604341,34106880679,$647.20,https://www.turnermotorsport.com/c-82-bmw-brake-calipers?No=288&Nrpp=48#,
https://www.turnermotorsport.com/p-62284-34216776801-genuine-bmw-part/,"Calliper Carrier - E70, E71, F15, F16",62284,34216776801,$231.47,https://www.turnermotorsport.com/c-82-bmw-brake-calipers?No=288&Nrpp=48#,"Genuine BMW Brake Carrier -     E70 X5,E71,F15,F16"
https://www.turnermotorsport.com/p-62282-34216776789-genuine-bmw-part/,"Caliper Housing Left - E70, E71, F15, F16",62282,34216776789,$384.88,https://www.turnermotorsport.com/c-82-bmw-brake-calipers?No=288&Nrpp=48#,"Genuine BMW Caliper Housing Left -     E70 X5,E71,F15,F16"
https://www.turnermotorsport.com/p-61846-34116776785-genuine-bmw-part/,"Caliper Housing Left - E70, E71, F15, F16",61846,34116776785,$598.24,https://www.turnermotorsport.com/c-82-bmw-brake-calipers?No=288&Nrpp=48#,"Genuine BMW Caliper Housing Left -     E71,F15,F16"
https://www.turnermotorsport.com/p-13543-34112283361-genuine-bmw-part/,"Genuine BMW Front Caliper Housing - Left - E82 1M, E9X M3",13543,34112283361,$498.56,https://www.turnermotorsport.com/c-82-bmw-brake-calipers?No=288&Nrpp=48#,"This is a Genuine BMW replacement for your seized or damaged front left caliper. This caliper is exactly the same as what your BMW came with from the factory. Because it is Genuine BMW, high quality and perfect fitment are guaranteed!"
https://www.turnermotorsport.com/p-594019-caliper-housing-left/,Caliper Housing - Left - F25/F26,594019,34216791017,$387.24,https://www.turnermotorsport.com/c-82-bmw-brake-calipers?No=288&Nrpp=48#,Replacement Caliper Housing from TRW
https://www.turnermotorsport.com/p-61843-34116776528-genuine-bmw-part/,Genuine BMW Caliper Housing Right - 34116776528 - E82,61843,34116776528,$362.56,https://www.turnermotorsport.com/c-82-bmw-brake-calipers?No=288&Nrpp=48#,Genuine BMW Caliper Housing Right -     E82
https://www.turnermotorsport.com/p-594020-brake-caliper/,Brake Caliper,594020,34216791018,$305.65,https://www.turnermotorsport.com/c-82-bmw-brake-calipers?No=288&Nrpp=48#,Replacement Brake Caliper for F25/F26 from TRW
https://www.turnermotorsport.com/p-380166-remanufactured-rear-brake-caliper-left/,"Brake Caliper - Rebuilt - Rear Left - E38 740i 740il 1995-2001
    ...",380166,34211164579KT,$157.97,https://www.turnermotorsport.com/c-82-bmw-brake-calipers?No=288&Nrpp=48#,"Our rebuilt calipers start off with an original BMW caliper that is fully disassembled thoroughly inspected and carefully processed. All threads are chased, all groves are meticulously cleaned and checked. Pistons are replaced if any dents or scratches are found. All rubber components and hardware are replaced with new OE quality parts. The units are then air pressure tested and submitted to a thorough final inspection."
https://www.turnermotorsport.com/p-594021-rear-brake-caliper-left/,Rear Brake Caliper - Left,594021,34216793041,$217.06,https://www.turnermotorsport.com/c-82-bmw-brake-calipers?No=288&Nrpp=48#,The brake calipers tend to need replacement at least once during the life of your vehicle. They are exposed to the most extreme elements and have to endure constant use and heat.
https://www.turnermotorsport.com/p-62283-34216776790-genuine-bmw-part/,"Caliper Housing Right - E70, E71, F15, F16",62283,34216776790,$384.88,https://www.turnermotorsport.com/c-82-bmw-brake-calipers?No=288&Nrpp=48#,"Genuine BMW Caliper Housing Right -     E70 X5,E71,F15,F16"
https://www.turnermotorsport.com/p-380167-remanufactured-rear-brake-caliper-right/,"Brake Caliper - Rebuilt - Rear Right - E38 740i 740il 1995-2001
   ...",380167,34211164580KT,$181.19,https://www.turnermotorsport.com/c-82-bmw-brake-calipers?No=288&Nrpp=48#,"Our rebuilt calipers start off with an original BMW caliper that is fully disassembled thoroughly inspected and carefully processed. All threads are chased, all groves are meticulously cleaned and checked. Pistons are replaced if any dents or scratches are found. All rubber components and hardware are replaced with new OE quality parts. The units are then air pressure tested and submitted to a thorough final inspection.  1995-2001  740i 740iL"
https://www.turnermotorsport.com/p-61847-34116776786-genuine-bmw-part/,"Caliper Housing Right - E70, E71, F15, F16",61847,34116776786,$598.24,https://www.turnermotorsport.com/c-82-bmw-brake-calipers?No=288&Nrpp=48#,"Genuine BMW Caliper Housing Right -     E71,F15,F16"
https://www.turnermotorsport.com/p-589532-disc-brake-caliper-guide-pin-boot-kit/,Disc Brake Caliper Guide Pin Boot Kit,589532,16161,$6.28,https://www.turnermotorsport.com/c-82-bmw-brake-calipers?No=288&Nrpp=48#,
https://www.turnermotorsport.com/p-594560-front-brake-caliper-rebuild-kit-priced-each/,Front Brake Caliper Rebuild Kit - Priced Each,594560,34111158692,$46.71,https://www.turnermotorsport.com/c-82-bmw-brake-calipers?No=288&Nrpp=48#,
https://www.turnermotorsport.com/p-4059-rear-brake-caliper-rebuild-kit-for-e30-325-325e-325is/,"Centric Rear Caliper Rebuild Kit - E23, E24, E28, E30",4059,34211153194,$9.95,https://www.turnermotorsport.com/c-82-bmw-brake-calipers?No=288&Nrpp=48#,A kit to rebuild one rear caliper.
https://www.turnermotorsport.com/p-1195818-/,"TRW Rear Brake Caliper - Right - E23, E24, E28, E30",1195818,34211160398,$155.95,https://www.turnermotorsport.com/c-82-bmw-brake-calipers?No=288&Nrpp=48#,"New, not remanufactured. Does not include carrier."
https://www.turnermotorsport.com/p-62059-34211160336-genuine-bmw-part/,"Genuine BMW Rear Caliper Rebuild Kit - E36 318i 318is M42 1.8L
    ...",62059,34211160336,$37.68,https://www.turnermotorsport.com/c-82-bmw-brake-calipers?No=288&Nrpp=48#,Genuine BMW Repair Set Brake Caliper -     E36
https://www.turnermotorsport.com/p-212972-34216860103-genuine-bmw-part/,"Genuine BMW Design Retaining Spring - F30, F32, F36, F31, F34, F33
...",212972,34216860103,$19.45,https://www.turnermotorsport.com/c-82-bmw-brake-calipers?No=288&Nrpp=48#,"Genuine BMW Genuine BMW Bmw Design Retaining Spring - 34216860103    F30,F32,F33,F34,F36,"
https://www.turnermotorsport.com/p-8020-34111150554-genuine-bmw-part/,"ATE Brake pad mounting kit - E12, E23, E24",8020,34111150554,$20.80,https://www.turnermotorsport.com/c-82-bmw-brake-calipers?No=288&Nrpp=48#,OEM BMW BRAKES SET MOUNTING PARTS 34111150554
https://www.turnermotorsport.com/p-523468-caliper-housing-right/,Caliper Housing Right - Cooper,523468,34216860558,$282.17,https://www.turnermotorsport.com/c-82-bmw-brake-calipers?No=336&Nrpp=48#,
https://www.turnermotorsport.com/p-377586-caliper-piston-rebuild-kit-priced-each/,"ATE Front Brake Caliper Rebuild Kit - E9x M3, E82, E39, E60, & m...",377586,34111163647,$11.95,https://www.turnermotorsport.com/c-82-bmw-brake-calipers?No=336&Nrpp=48#,E39 BMW
https://www.turnermotorsport.com/p-362789-retaining-clip/,"ATE Retaining Clip - E60, E82, E84, E88, E90, E91, E92, E93, Z4
   ...",362789,34116776526,$13.60,https://www.turnermotorsport.com/c-82-bmw-brake-calipers?No=336&Nrpp=48#,Also known as anti rattle spring
https://www.turnermotorsport.com/p-392823-front-porsche-caliper-adapters-e46-csl-m3/,Front Porsche Caliper Adapters -- E46 CSL M3,392823,BR0019,$162.49,https://www.turnermotorsport.com/c-82-bmw-brake-calipers?No=336&Nrpp=48#,"If you've been looking to upgrade your calipers on your E46 CSL M3, Creations Motorsport have come up with adapters that will allow you to upgrade to Brembo Porsche 996 calipers. Designed to let you use CSL M3 345mm x 28mm rotors (part number: 2282445446), this is essentially a bolt-on setup. After having 5.5mm machined from the mounting boss of the caliper, you will get to experience the significantly higher stopping forces you've been looking for in a track vehicle."
https://www.turnermotorsport.com/p-61479-34106784593-genuine-bmw-part/,Genuine MINI Repair Set For Brake Caliper,61479,34106784593,$31.59,https://www.turnermotorsport.com/c-82-bmw-brake-calipers?No=336&Nrpp=48#,Genuine MINI REPAIR SET BRAKE CALIPER
https://www.turnermotorsport.com/p-181202-34119809287-genuine-bmw-part/,"Caliper Housing Left - Cooper Countryman, Cooper Paceman",181202,34119809287,$447.94,https://www.turnermotorsport.com/c-82-bmw-brake-calipers?No=336&Nrpp=48#,Orignal MINI CALIPER HOUSING LEFT
https://www.turnermotorsport.com/p-62298-34216784646-genuine-bmw-part/,Genuine MINI JCW Caliper Housing - Rear Right,62298,34216784646,$438.85,https://www.turnermotorsport.com/c-82-bmw-brake-calipers?No=336&Nrpp=48#,Genuine MINI CALIPER HOUSING LEFT
https://www.turnermotorsport.com/p-189363-34219809298-genuine-mini-part/,"Caliper Housing Right - Cooper Countryman, Cooper Paceman",189363,34219809298,$512.77,https://www.turnermotorsport.com/c-82-bmw-brake-calipers?No=336&Nrpp=48#,Genuine MINI Caliper Housing Right
https://www.turnermotorsport.com/p-1980639-retaining-clip/,"URO Retaining Clip - E60, E82, E84, E88, E90, E91, E92, E93, Z4
   ...",1980639,34116776526,$7.03,https://www.turnermotorsport.com/c-82-bmw-brake-calipers?No=336&Nrpp=48#,Also known as anti rattle spring
https://www.turnermotorsport.com/p-1980637-front-brake-anti-rattle-clip-priced-each/,"URO Front Brake Anti Rattle Clip - E60, E61, E63, E64, E65, E66, E84...",1980637,34116757253,$7.11,https://www.turnermotorsport.com/c-82-bmw-brake-calipers?No=336&Nrpp=48#,Essential component for quiet operation
https://www.turnermotorsport.com/p-1980635-retaining-clip-priced-each/,"URO Retaining Clip - E38, E39, E53",1980635,34111163488,$2.66,https://www.turnermotorsport.com/c-82-bmw-brake-calipers?No=336&Nrpp=48#,Also known as anti-rattle spring
https://www.turnermotorsport.com/p-1996193-rear-brake-caliper-anti-rattle-clip-priced-each/,URO Rear Brake Caliper Anti Rattle Clip - E39,1996193,34211163399,$4.83,https://www.turnermotorsport.com/c-82-bmw-brake-calipers?No=336&Nrpp=48#,Fits both left and right sides
https://www.turnermotorsport.com/p-1996181-retaining-clip/,URO Retaining Clip - E39,1996181,34116752424,$6.53,https://www.turnermotorsport.com/c-82-bmw-brake-calipers?No=336&Nrpp=48#,Also known as anti rattle spring
https://www.turnermotorsport.com/p-1996179-anti-rattle-clip/,URO Anti Rattle Clip - E39,1996179,34111164611,$4.74,https://www.turnermotorsport.com/c-82-bmw-brake-calipers?No=336&Nrpp=48#,Essential component for quiet operation
https://www.turnermotorsport.com/p-1996195-rear-brake-pad-anti-rattle-clip-priced-each/,"URO Rear Brake Pad Anti-Rattle Clip - E60, E61, E70, E71, F15, F16 
...",1996195,34216758059,$3.42,https://www.turnermotorsport.com/c-82-bmw-brake-calipers?No=336&Nrpp=48#,Install your rear brake pads properly using this clip
https://www.turnermotorsport.com/p-143792-61331379090-genuine-bmw-part/,"Horn - E30, E31, E32, E34, E36",143792,61331379090,$43.26,https://www.turnermotorsport.com/c-82-bmw-brake-calipers?No=336&Nrpp=48#,"Genuine BMW Horn - Hella 335Hz    E30 M3,E36 M3,E34 M5,E30,E34,E36"
https://www.turnermotorsport.com/p-19985-34111119021-genuine-bmw-part/,"Brake Caliper - New - Original BMW - Front Left -E12 528i, 530i 77-8...",19985,34111119021,$430.01,https://www.turnermotorsport.com/c-82-bmw-brake-calipers?No=336&Nrpp=48#,
https://www.turnermotorsport.com/p-62169-34212283163-genuine-bmw-part/,"Genuine BMW Rear Brake Caliper - Left - E82 1M, E9X M3, E60 M5, E63 ...",62169,34212283163,$397.60,https://www.turnermotorsport.com/c-82-bmw-brake-calipers?No=336&Nrpp=48#,"This is a Genuine BMW replacement for your seized or damaged rear left caliper. This caliper is exactly the same as what your BMW came with from the factory. Because it is Genuine BMW, high quality and perfect fitment are guaranteed!"
https://www.turnermotorsport.com/p-62246-34216765212-genuine-bmw-part/,Genuine BMW Rear Caliper Rebuild Kit,62246,34216765212,$30.00,https://www.turnermotorsport.com/c-82-bmw-brake-calipers?No=336&Nrpp=48#,Genuine BMW REPAIR SET BRAKE CALIPER
https://www.turnermotorsport.com/p-182772-34117846702-genuine-bmw-part/,"Caliper Housing Right - F06, F12, F13",182772,34117846702,$589.66,https://www.turnermotorsport.com/c-82-bmw-brake-calipers?No=336&Nrpp=48#,"Genuine BMW Caliper Housing Right -     F06,F12,F13"
https://www.turnermotorsport.com/p-2140-front-right-brake-caliper-e82-e88-135i/,Brake Caliper - New - Front Right - E82 E88 135i,2140,34106786060,$797.63,https://www.turnermotorsport.com/c-82-bmw-brake-calipers?No=336&Nrpp=48#,E93 BMW
https://www.turnermotorsport.com/p-178475-34217847226-genuine-bmw-part/,"Genuine BMW M Performance Brakes Brake Carrier, Blue - E70,E71,F15,F...",178475,34217847226,$265.03,https://www.turnermotorsport.com/c-82-bmw-brake-calipers?No=336&Nrpp=48#,"Genuine BMW Brake Carrier - Dunkelblau    E70 X5M,E71 X6M,E70 X5,E71 X6,F15,F16"
