product-img-link href,cleanDesc,part-info,part-info 2,price,wishlist-label href,short-description
https://www.turnermotorsport.com/p-362994-performance-caliper-guide-bushing-set/,ECS Performance Caliper Guide Bushing Set - Most Models,362994,003326ECS01,$100.76,https://www.turnermotorsport.com/c-82-bmw-brake-calipers#,"This caliper bushing kit will eliminate flex caused by weak rubber caliper bushings. As the brake pedal is pressed the caliper grabs the rotor and twists on its mounting bushings. The rubber bushings allow the caliper to deflect and twist which affects pedal feel and results in uneven pad wear. These solid brass bushings will not twist or deflect so your calipers can squeeze the pads evenly on both sides of the rotor (sort of like what multi-piston big brakes do). This will give you much longer pad life and a more consistent pedal feel. This is the most complete kit we have ever sold with stainless steel caliper slide bolts, o-rings, and new dust boots. Unlike other kits, these bushings are pressed into the caliper and will not shift or slide on their own."
https://www.turnermotorsport.com/p-381090-front-cslzcp-bracket-pair/,ECS Tuning Front CSL/ZCP Caliper Bracket Set - E46 M3,381090,34112282619KT,$163.12,https://www.turnermotorsport.com/c-82-bmw-brake-calipers#,"ECS Tuning designed these caliper brackets to allow you to upgrade to CSL rotors without the pricetag of OEM part #, they are functionally the same part."
https://www.turnermotorsport.com/p-388820-performance-brake-caliper-guide-bushing-installation-tool-set/,"ECS Performance Brake Caliper Guide Bushing Installation Tool Set
 ...",388820,003326ECS03,$29.40,https://www.turnermotorsport.com/c-82-bmw-brake-calipers#,Installs bushings straight and true with minimal effort. Includes tools for both iron and aluminum calipers. Purchase only one tool set for your entire caliper guide bushing upgrade - tools are not one time use.
https://www.turnermotorsport.com/p-363468-performance-caliper-guide-bushing-set/,"ECS Performance Caliper Guide Bushing Set - E90/2 E60 (Front)
     ...",363468,003326ECS02,$124.06,https://www.turnermotorsport.com/c-82-bmw-brake-calipers#,"This caliper bushing kit will eliminate flex caused by weak rubber caliper bushings. As the brake pedal is pressed the caliper grabs the rotor and twists on its mounting bushings. The rubber bushings allow the caliper to deflect and twist which affects pedal feel and results in uneven pad wear. These solid brass bushings will not twist or deflect so your calipers can squeeze the pads evenly on both sides of the rotor (sort of like what multi-piston big brakes do). This will give you much longer pad life and a more consistent pedal feel. This is the most complete kit we have ever sold with stainless steel caliper slide bolts, o-rings, and new dust boots. Unlike other kits, these bushings are pressed into the caliper and will not shift or slide on their own."
https://www.turnermotorsport.com/p-61817-genuine-bmw-repair-set-brake-caliper-34116769090/,Genuine BMW Front Caliper Rebuild Kit,61817,34116769090,$30.00,https://www.turnermotorsport.com/c-82-bmw-brake-calipers#,"Genuine BMW Repair Set Brake Caliper -     E89 Z4,E90,E92,E93"
https://www.turnermotorsport.com/p-207800-34216869617-genuine-bmw-part/,Genuine BMW Guide Bushing Set - Multiple BMWs,207800,34216869617,$33.57,https://www.turnermotorsport.com/c-82-bmw-brake-calipers#,
https://www.turnermotorsport.com/p-368270-rear-caliper-rebuild-kit/,Genuine BMW Rear Caliper Rebuild Kit,368270,34211153194,$24.24,https://www.turnermotorsport.com/c-82-bmw-brake-calipers#,
https://www.turnermotorsport.com/p-368272-rear-brake-caliper-rebuild-kit/,"Genuine BMW Rear Brake Caliper Rebuild Kit - E32 735i/iL, E30 M3, E3...",368272,34211157042,$26.15,https://www.turnermotorsport.com/c-82-bmw-brake-calipers#,
https://www.turnermotorsport.com/p-373986-front-caliper-rebuild-kit-priced-per-caliper/,"ATE Front Caliper Rebuild Kit - Priced Per Caliper - E31, E32, E34, ...",373986,34111157037,$20.95,https://www.turnermotorsport.com/c-82-bmw-brake-calipers#,Includes seals for rebuilding a caliper
https://www.turnermotorsport.com/p-15834-front-brake-caliper-rebuild-kit-e9x-m3-e82-e39-e60-more/,"Genuine BMW Front Brake Caliper Rebuild Kit - E9x M3, E82 E39 E60 &a...",15834,34111163647,$27.36,https://www.turnermotorsport.com/c-82-bmw-brake-calipers#,E39 BMW
https://www.turnermotorsport.com/p-13560-34211155716-genuine-bmw-part/,"Genuine BMW Brake Caliper Seal Kit - Single Caliper - E24 M6, E30 31...",13560,34211155716,$24.24,https://www.turnermotorsport.com/c-82-bmw-brake-calipers#,Genuine BMW Repair Set Brake Caliper -     E30
https://www.turnermotorsport.com/p-13555-34116786742-genuine-bmw-part/,"BMW M Performance Right Side 6-Piston Caliper - E82/88 135i
       ...",13555,34116786742,$485.71,https://www.turnermotorsport.com/c-82-bmw-brake-calipers#,"This is the genuine BMW replacement caliper built by Brembo for optimal performance on and off the track. This unit is new, not rebuilt, and does not include a core charge."
https://www.turnermotorsport.com/p-392826-front-porsche-caliper-adapters-e36-m3/,Front Porsche Caliper Adapters -- E36 M3,392826,BR0013,$185.06,https://www.turnermotorsport.com/c-82-bmw-brake-calipers#,"If you've been looking to upgrade your calipers on your E36 M3, Creations Motorsport have come up with adapters that will allow you to upgrade to Brembo Porsche 996 (Non-turbo) calipers. Designed to let you use one of two rotor options:"
https://www.turnermotorsport.com/p-22995-34116786741-genuine-bmw-part/,"BMW M Performance Left Side 6-Piston Caliper - E82/88 135i
        ...",22995,34116786741,$485.71,https://www.turnermotorsport.com/c-82-bmw-brake-calipers#,"This is the genuine BMW replacement caliper built by Brembo for optimal performance on and off the track. This unit is new, not rebuilt, and does not include a core charge."
https://www.turnermotorsport.com/p-187548-34216857152-genuine-bmw-part/,Genuine BMW Rear brake pad guide pin set - F33 F30 F82 F31 F36 F83 F...,187548,34216857152,$36.37,https://www.turnermotorsport.com/c-82-bmw-brake-calipers#,Set of replacement guide pins for carbon ceramic brake systems.
https://www.turnermotorsport.com/p-21828-34116757036-genuine-bmw-part/,Genuine BMW Caliper Guide Bolt - E53 E6X E82 E9X Z4,21828,34116757036,$23.11,https://www.turnermotorsport.com/c-82-bmw-brake-calipers#,"Genuine BMW Guiding Bolt    E60 M5,E63 M6,E82 1M Coupe,E53 48IS,E53 X5,E63,E65,E82,E89 Z4,E90,E92,E93"
https://www.turnermotorsport.com/p-368278-rear-caliper-rebuild-kit-priced-per-caliper/,"Genuine BMW Rear Caliper Rebuild Kit - Priced Per Caliper - E39 M5, ...",368278,34211166238,$29.89,https://www.turnermotorsport.com/c-82-bmw-brake-calipers#,
https://www.turnermotorsport.com/p-591534-front-brake-caliper-rebuild-kit-priced-each/,Front Brake Caliper Rebuild Kit - Priced Each,591534,34111158692,$22.40,https://www.turnermotorsport.com/c-82-bmw-brake-calipers#,
https://www.turnermotorsport.com/p-61908-34116798126-genuine-bmw-part/,Genuine BMW Front Anti Rattle Spring,61908,34116798126,$21.87,https://www.turnermotorsport.com/c-82-bmw-brake-calipers#,"Genuine BMW Clip -     E70 X5,E71,F15,F16"
https://www.turnermotorsport.com/p-368259-front-caliper-rebuild-kit-priced-per-caliper/,"Genuine BMW Front Caliper Rebuild Kit - Priced Per Caliper
        ...",368259,34111157037,$54.89,https://www.turnermotorsport.com/c-82-bmw-brake-calipers#,
https://www.turnermotorsport.com/p-368254-front-caliper-rebuild-kit/,Genuine BMW Front Caliper Rebuild Kit,368254,34111153202,$32.95,https://www.turnermotorsport.com/c-82-bmw-brake-calipers#,
https://www.turnermotorsport.com/p-368273-rear-caliper-rebuild-kit/,Genuine BMW Rear Caliper Rebuild Kit,368273,34211158578,$37.65,https://www.turnermotorsport.com/c-82-bmw-brake-calipers#,
https://www.turnermotorsport.com/p-61738-34112283363-genuine-bmw-part/,"Genuine BMW Front Anti-Rattle Spring - E82 1M, E9X M3",61738,34112283363,$23.31,https://www.turnermotorsport.com/c-82-bmw-brake-calipers#,"Anti-rattle springs secure the brake pad in a fixed position inside the caliper, preventing excess noise."
https://www.turnermotorsport.com/p-61849-34116776796-genuine-bmw-part/,Genuine BMW Brake Caliper Retainer Clip - E70 X5 xDrive50i E71 X6 xD...,61849,34116776796,$24.29,https://www.turnermotorsport.com/c-82-bmw-brake-calipers#,"Genuine BMW Clip -     E71,F15,F16"
https://www.turnermotorsport.com/p-13573-34216780513-genuine-bmw-part/,"Genuine BMW Brake Expansion Spring - E90 330i, E91 328i, E93 328i, E...",13573,34216780513,$22.67,https://www.turnermotorsport.com/c-82-bmw-brake-calipers#,"Genuine BMW Expansion Spring -     E82,E90,E93"
https://www.turnermotorsport.com/p-368258-front-brake-caliper-repair-kit-priced-each/,Genuine BMW Front Brake Caliper Repair Kit - E30 318i 318is 325e 325...,368258,34111154440,$24.24,https://www.turnermotorsport.com/c-82-bmw-brake-calipers#,
https://www.turnermotorsport.com/p-15890-34216753682-genuine-bmw-part/,"Genuine BMW Rear Brake Caliper Rebuild Kit - E9x M3, E82 E60 E63 E85...",15890,34216753682,$47.89,https://www.turnermotorsport.com/c-82-bmw-brake-calipers#,E60 BMW
https://www.turnermotorsport.com/p-5720-tms349099/,"Brake Caliper - Rebuilt Girling style - Front Right - E30 Non-M
   ...",5720,34111154380R,$93.96,https://www.turnermotorsport.com/c-82-bmw-brake-calipers#,"Our rebuilt calipers start off with an original BMW caliper that is fully disassembled thoroughly inspected and carefully processed. All threads are chased, all groves are meticulously cleaned and checked. Pistons are replaced if any dents or scratches are found. All rubber components and hardware are replaced with new OE quality parts. The units are then air pressure tested and submitted to a thorough final inspection."
https://www.turnermotorsport.com/p-300077-front-caliper-rebuild-kit-priced-each/,Front Caliper rebuild kit - priced each,300077,143.34031,$23.95,https://www.turnermotorsport.com/c-82-bmw-brake-calipers#,2 Required per car
https://www.turnermotorsport.com/p-8033-34111161936-genuine-bmw-part/,Genuine BMW Front Brake Caliper Guide Repair Kit,8033,34111161936,$33.92,https://www.turnermotorsport.com/c-82-bmw-brake-calipers#,Genuine BMW Repair Kit Guide Bush -     E30
https://www.turnermotorsport.com/p-62336-34216799462-genuine-bmw-part/,"Genuine BMW Rear Brake Caliper - Right - F3X, F8X",62336,34216799462,$775.97,https://www.turnermotorsport.com/c-82-bmw-brake-calipers#,"Whether you are changing the color of your calipers or upgrading your brakes, this M Performance caliper will look great behind your wheels and will give you the performance you are looking for!"
https://www.turnermotorsport.com/p-5440-brake-caliper-new-rear-right-e46-m3-cslzcp/,Brake Caliper - New - Rear Right - E46 M3 CSL/ZCP,5440,34212282858,$363.40,https://www.turnermotorsport.com/c-82-bmw-brake-calipers#,This item fits the following BMWs:
https://www.turnermotorsport.com/p-368264-front-caliper-rebuild-kit/,"Genuine BMW Front Caliper Rebuild Kit - E83 X3, E46 330, Z4 3.0Si
 ...",368264,34116750151,$34.49,https://www.turnermotorsport.com/c-82-bmw-brake-calipers#,
https://www.turnermotorsport.com/p-568489-front-csl-caliper-bracket-set/,Front CSL Caliper Bracket Set - E36 M3,568489,001121ECS03AKT,$163.12,https://www.turnermotorsport.com/c-82-bmw-brake-calipers#,This caliper bracket set allows you to use the much larger 345x28mm rotors found on the E46 M3 CSL and competition package. These bracket reqiure use of E46 M3 front caliper(Not included).
https://www.turnermotorsport.com/p-590327-bmw-135i-brembo-caliper-brackets-e46-m3-csl-rotor/,BMW 135i Brembo Caliper Brackets (E46 M3 CSL Rotor),590327,E46M3135CR-2,$154.99,https://www.turnermotorsport.com/c-82-bmw-brake-calipers#,
https://www.turnermotorsport.com/p-15884-34117845748-genuine-bmw-part/,"Genuine BMW Front Brake Caliper - Right - F10 M5, F12 F13 M6
      ...",15884,34117845748,"$1,034.35",https://www.turnermotorsport.com/c-82-bmw-brake-calipers#,"Genuine BMW Caliper Housing Right -     F06,F10,F12,F13"
https://www.turnermotorsport.com/p-392827-rear-porsche-caliper-adapters-e36-m3/,Rear Porsche Caliper Adapters -- E36 M3,392827,BR0012,$194.95,https://www.turnermotorsport.com/c-82-bmw-brake-calipers#,"If you've been looking to upgrade your rear calipers on your E46 M3, Creations Motorsport have come up with adapters that will allow you to upgrade to rear Brembo Porsche 996 calipers. Designed to let you use M3 328mm x 20mm rotors (part number: 34212229379), this is essentially a bolt-on setup. After installation, you will get to experience the significantly higher stopping forces you've been looking for in a track vehicle."
https://www.turnermotorsport.com/p-5715-brake-caliper-rebuilt-front-left-e28-535i-535is-e24-633csi-635csi-83-89/,"Brake Caliper - Rebuilt - Front Left - E28 535i 535is, E24 633csi 63...",5715,34111154041R,$92.96,https://www.turnermotorsport.com/c-82-bmw-brake-calipers#,Includes $30.00 core charge to be refunded on return of your rebuildable core.
https://www.turnermotorsport.com/p-5883-brake-caliper-rebuilt-rear-left-e36-318iis-323iis-325iis-328iis/,Brake Caliper - Rebuilt - Rear Left - E36 318i/is 323i/is 325i/is 32...,5883,34211160333R,$92.96,https://www.turnermotorsport.com/c-82-bmw-brake-calipers#,"Our rebuilt calipers start off with an original BMW caliper that is fully disassembled thoroughly inspected and carefully processed. All threads are chased, all groves are meticulously cleaned and checked. Pistons are replaced if any dents or scratches are found. All rubber components and hardware are replaced with new OE quality parts. The units are then air pressure tested and submitted to a thorough final inspection."
https://www.turnermotorsport.com/p-5716-brake-caliper-rebuilt-front-right-e28-535i-535is-e24-633csi-635csi-83-89/,"Brake Caliper - Rebuilt - Front Right - E28 535i 535is, E24 633csi 6...",5716,34111154042R,$92.96,https://www.turnermotorsport.com/c-82-bmw-brake-calipers#,Includes $30.00 core charge to be refunded on return of your rebuildable core.
https://www.turnermotorsport.com/p-20873-34116763995-genuine-bmw-part/,Genuine BMW Rear Caliper rebuild Kit,20873,34116763995,$79.10,https://www.turnermotorsport.com/c-82-bmw-brake-calipers#,"Genuine BMW Repair Set Brake Caliper    E60 M5,E63 M6,E70 X5M,E71 X6M,E63,E65,E70 X5,E71 X6,E82,E90,E92,E93,F15,F16"
https://www.turnermotorsport.com/p-5750-brake-caliper-rebuilt-front-left-e46-m3-csl-z4m/,"Brake Caliper - Rebuilt - Front Left - E46 M3, M3 CSL, Z4M 
       ...",5750,34112282617R,$155.96,https://www.turnermotorsport.com/c-82-bmw-brake-calipers#,"Our rebuilt calipers start off with an original BMW caliper that is fully disassembled thoroughly inspected and carefully processed. All threads are chased, all groves are meticulously cleaned and checked. Pistons are replaced if any dents or scratches are found. All rubber components and hardware are replaced with new OE quality parts. The units are then air pressure tested and submitted to a thorough final inspection."
https://www.turnermotorsport.com/p-5719-brake-caliper-rebuilt-front-left-e30-325e-325i-318is-girling/,Brake Caliper - Rebuilt - Front Left - E30 325e 325i 318is - Girling...,5719,34111154379R,$100.96,https://www.turnermotorsport.com/c-82-bmw-brake-calipers#,"Our rebuilt calipers start off with an original BMW caliper that is fully disassembled thoroughly inspected and carefully processed. All threads are chased, all groves are meticulously cleaned and checked. Pistons are replaced if any dents or scratches are found. All rubber components and hardware are replaced with new OE quality parts. The units are then air pressure tested and submitted to a thorough final inspection."
https://www.turnermotorsport.com/p-225912-brake-caliper-rebuilt-rear-right-e46-m3/,Brake Caliper - Rebuilt - Rear Right - E46 M3,225912,34212282196R,$124.95,https://www.turnermotorsport.com/c-82-bmw-brake-calipers#,"Our rebuilt calipers start off with an original BMW caliper that is fully disassembled thoroughly inspected and carefully processed. All threads are chased, all groves are meticulously cleaned and checked. Pistons are replaced if any dents or scratches are found. All rubber components and hardware are replaced with new OE quality parts. The units are then air pressure tested and submitted to a thorough final inspection."
https://www.turnermotorsport.com/p-366888-brake-caliper-rebuilt-front-right-e46-m3-csl-z4m/,"Brake Caliper - Rebuilt - Front Right - E46 M3, M3 CSL, Z4M 
      ...",366888,34112282618RKT,$125.96,https://www.turnermotorsport.com/c-82-bmw-brake-calipers#,"Our rebuilt calipers start off with an original BMW caliper that is fully disassembled thoroughly inspected and carefully processed. All threads are chased, all groves are meticulously cleaned and checked. Pistons are replaced if any dents or scratches are found. All rubber components and hardware are replaced with new OE quality parts. The units are then air pressure tested and submitted to a thorough final inspection."
https://www.turnermotorsport.com/p-62297-34216784645-genuine-bmw-part/,Genuine MINI JCW Caliper Housing - Rear Left,62297,34216784645,$508.10,https://www.turnermotorsport.com/c-82-bmw-brake-calipers#,Genuine MINI CALIPER HOUSING LEFT
https://www.turnermotorsport.com/p-4093-e36-e46-z3-z4-left-front-brake-caliper/,"Brake Caliper - New - Front Left - E36, E46, Z3, Z4",4093,34116758113,$121.41,https://www.turnermotorsport.com/c-82-bmw-brake-calipers#,
https://www.turnermotorsport.com/p-569359-brake-caliper-housin/,"Brake Caliper Housing - Orange - Left - ""M Performance"" - ...",569359,34106875655,$911.28,https://www.turnermotorsport.com/c-82-bmw-brake-calipers#,
https://www.turnermotorsport.com/p-19894-34116799469-genuine-bmw-part/,"Genuine BMW M Performance Caliper - Front Left - F3X, F8X",19894,34116799469,$906.82,https://www.turnermotorsport.com/c-82-bmw-brake-calipers?No=48&Nrpp=48#,Genuine BMW Caliper Housing Left
https://www.turnermotorsport.com/p-1556-caliper-rebuild-kit-rear-e46-330i-x3-30i-30si-x5-44i-46is-48is/,"Rear Caliper Rebuild Kit - E46 330i - X3 3.0i, 3.0si - X5 4.4i, 4.6i...",1556,34216750163,$56.99,https://www.turnermotorsport.com/c-82-bmw-brake-calipers?No=48&Nrpp=48#,
https://www.turnermotorsport.com/p-4095-e36-e46-z3-z4-right-front-brake-caliper/,"Brake Caliper - New - Front Right - E36, E46, Z3, Z4",4095,34116758114,$106.95,https://www.turnermotorsport.com/c-82-bmw-brake-calipers?No=48&Nrpp=48#,
https://www.turnermotorsport.com/p-13528-34106758104-genuine-bmw-part/,Genuine BMW Front Brake Caliper Carrier,13528,34106758104,$155.87,https://www.turnermotorsport.com/c-82-bmw-brake-calipers?No=48&Nrpp=48#,"Genuine BMW Brake Carrier -     E36,E46,E85"
https://www.turnermotorsport.com/p-61912-34116799470-genuine-bmw-part/,"Genuine BMW M Performance Caliper - Front Right - F3X, F8X
        ...",61912,34116799470,$906.82,https://www.turnermotorsport.com/c-82-bmw-brake-calipers?No=48&Nrpp=48#,"Genuine BMW Caliper Housing Right -     F30,F32,F33,F34,F36,F80 M3,F82 M4,F83"
https://www.turnermotorsport.com/p-1796-e36-m3-front-brake-caliper-carrier-bracket-left-right/,E36 M3 Front Brake Caliper Carrier Bracket (Left / Right),1796,34112226875,$744.47,https://www.turnermotorsport.com/c-82-bmw-brake-calipers?No=48&Nrpp=48#,
https://www.turnermotorsport.com/p-5438-front-right-brake-caliper-e46-m3-cslzcp/,Brake Caliper - New - Front Right - E46 M3,5438,34112282618,$414.22,https://www.turnermotorsport.com/c-82-bmw-brake-calipers?No=48&Nrpp=48#,This item fits the following BMWs:
https://www.turnermotorsport.com/p-198767-34117850464-genuine-bmw-part/,"M Carbon Ceramic Front Brake Caliper Assembly - Right - F80 M3,F82 M...",198767,34117850464,"$1,072.11",https://www.turnermotorsport.com/c-82-bmw-brake-calipers?No=48&Nrpp=48#,Genuine BMW Caliper Housing Right
https://www.turnermotorsport.com/p-62148-34212225445-genuine-bmw-part/,Genuine BMW Brake dust shield - right - E30 M3,62148,34212225445,$67.84,https://www.turnermotorsport.com/c-82-bmw-brake-calipers?No=48&Nrpp=48#,"Genuine BMW Protection Plate Right    E30 M3,E30"
https://www.turnermotorsport.com/p-360179-brake-caliper-rebuilt-rear-right-e46-330ici-e83-x3/,"Brake Caliper - Rebuilt - Rear Right - E46 330i/ci, E83 X3
        ...",360179,34216765884RKT,$176.96,https://www.turnermotorsport.com/c-82-bmw-brake-calipers?No=48&Nrpp=48#,"Our rebuilt calipers start off with an original BMW caliper that is fully disassembled thoroughly inspected and carefully processed. All threads are chased, all groves are meticulously cleaned and checked. Pistons are replaced if any dents or scratches are found. All rubber components and hardware are replaced with new OE quality parts. The units are then air pressure tested and submitted to a thorough final inspection."
https://www.turnermotorsport.com/p-4096-e36-318i325i328i-right-rear-brake-caliper/,E36 318i/325i/328i Right Rear Brake Caliper,4096,34211160334,$130.00,https://www.turnermotorsport.com/c-82-bmw-brake-calipers?No=48&Nrpp=48#,Right Rear. Fits all non-M3 E36 (318/323/325/328i). Does not fit 323/328i Convertible or 318ti.
https://www.turnermotorsport.com/p-61955-34206780863-genuine-bmw-part/,Genuine MINI JCW Brake Carrier - Rear Priced Each,61955,34206780863,$140.78,https://www.turnermotorsport.com/c-82-bmw-brake-calipers?No=48&Nrpp=48#,Genuine MINI BRAKE CARRIER
https://www.turnermotorsport.com/p-392817-front-bbk-caliper-adapter-e30-bmw/,Front BBK Caliper Adapter  --  E30 BMW,392817,BR0031,$132.19,https://www.turnermotorsport.com/c-82-bmw-brake-calipers?No=48&Nrpp=48#,"Creations Motorsports have solved the E30 big brake issue by allowing you to swap out your stock calipers from to calipers from the E34 540i. Resulting in a significant boost in stopping power, this can be used for more reliable daily driven brakes or track brakes that won't break the bank."
https://www.turnermotorsport.com/p-392818-front-porsche-caliper-adapters-e46-m3/,"Creation Motorsport Front Porsche Caliper Adapters - E46 M3
       ...",392818,BR0025,$149.99,https://www.turnermotorsport.com/c-82-bmw-brake-calipers?No=48&Nrpp=48#,
https://www.turnermotorsport.com/p-368255-front-caliper-rebuild-kit/,Genuine BMW Front Caliper Rebuild Kit,368255,34111153208,$26.86,https://www.turnermotorsport.com/c-82-bmw-brake-calipers?No=48&Nrpp=48#,
https://www.turnermotorsport.com/p-61979-34206855483-genuine-bmw-part/,"Genuine BMW Rear Brake Caliper - Left - F3X, F8X",61979,34206855483,$772.17,https://www.turnermotorsport.com/c-82-bmw-brake-calipers?No=48&Nrpp=48#,"Whether you are changing the color of your calipers or upgrading your brakes, this M Performance caliper will look great behind your wheels and will give you the performance you are looking for!"
https://www.turnermotorsport.com/p-182776-34206855484-genuine-bmw-part/,"Genuine BMW Rear Brake Caliper - Right - F3X, F8X",182776,34206855484,$772.17,https://www.turnermotorsport.com/c-82-bmw-brake-calipers?No=48&Nrpp=48#,"Whether you are changing the color of your calipers or upgrading your brakes, this M Performance caliper will look great behind your wheels and will give you the performance you are looking for!"
https://www.turnermotorsport.com/p-23011-34211119211-genuine-bmw-part/,"Caliper With Out Brake Pads Left - E24, E9",23011,34211119211,$332.17,https://www.turnermotorsport.com/c-82-bmw-brake-calipers?No=48&Nrpp=48#,"Genuine BMW CALIPER WITH OUT BRAKE PADS.--       - 3.0 Cs     - 630CSi, 633CSi   --."
https://www.turnermotorsport.com/p-418193-front-brake-caliper-rebuild-kit-priced-each/,Genuine BMW Front Brake Caliper Rebuild Kit,418193,34111158692,$114.12,https://www.turnermotorsport.com/c-82-bmw-brake-calipers?No=48&Nrpp=48#,
https://www.turnermotorsport.com/p-154874-65756970942-genuine-bmw-part/,"Tilt-Sirene With Inclination Indicator - E83, Z4",154874,65756970942,$226.65,https://www.turnermotorsport.com/c-82-bmw-brake-calipers?No=48&Nrpp=48#,"Genuine BMW Tilt-Sirene With Inclination Indicator    E85 Z4M,E83 X3,E85 Z4,E86 Z4"
https://www.turnermotorsport.com/p-195161-34117850463-genuine-bmw-part/,"Genuine BMW Front Caliper Assembly - Left - F80 M3,F82 M4,F83
     ...",195161,34117850463,"$1,072.11",https://www.turnermotorsport.com/c-82-bmw-brake-calipers?No=48&Nrpp=48#,Genuine BMW Caliper Housing Left
https://www.turnermotorsport.com/p-5439-rear-left-brake-caliper-e46-m3-cslzcp/,Brake Caliper - New - Rear Left - E46 M3 CSL/ZCP,5439,34212282857,$363.40,https://www.turnermotorsport.com/c-82-bmw-brake-calipers?No=48&Nrpp=48#,This item fits the following BMWs:
https://www.turnermotorsport.com/p-360180-brake-caliper-rebuilt-front-left-e46-330i-e83-x3-25-30-e85-z4-30si/,"Brake Caliper - Rebuilt - Front Left - E46 330i, E83 X3 2.5, 3.0, E8...",360180,34116765881RKT,$131.96,https://www.turnermotorsport.com/c-82-bmw-brake-calipers?No=48&Nrpp=48#,"Our rebuilt calipers start off with an original BMW caliper that is fully disassembled thoroughly inspected and carefully processed. All threads are chased, all groves are meticulously cleaned and checked. Pistons are replaced if any dents or scratches are found. All rubber components and hardware are replaced with new OE quality parts. The units are then air pressure tested and submitted to a thorough final inspection."
