product-img-link href,cleanDesc,part-info,part-info 2,price,wishlist-label href,short-description
https://www.turnermotorsport.com/p-194580-18307848046-genuine-bmw-part/,Genuine BMW Exhaust gasket - F80 F82 F83,194580,18307848046,$25.26,https://www.turnermotorsport.com/c-148-bmw-gaskets-hangers-and-parts?No=50&Nrpp=50#,"Genuine BMW Flange Steady -     F80 M3,F82 M4,F83     S55"
https://www.turnermotorsport.com/p-341630-tms341630/,"Febi Exhaust gasket - E31, E34, E36, E38, Z3",341630,18301716888,$9.95,https://www.turnermotorsport.com/c-148-bmw-gaskets-hangers-and-parts?No=50&Nrpp=50#,Gasket between header and catalytic converter
https://www.turnermotorsport.com/p-360762-turbo-to-downpipe-exhaust-gasket-priced-each/,Genuine BMW Turbo To Downpipe Exhaust Gasket - N54,360762,18307553601,$20.98,https://www.turnermotorsport.com/c-148-bmw-gaskets-hangers-and-parts?No=50&Nrpp=50#,
https://www.turnermotorsport.com/p-367958-exhaust-gasket-priced-each/,Genuine BMW Exhaust Gasket,367958,18301716888,$23.67,https://www.turnermotorsport.com/c-148-bmw-gaskets-hangers-and-parts?No=50&Nrpp=50#,
https://www.turnermotorsport.com/p-48661-18307843213-genuine-bmw-part/,"Genuine BMW Exhaust Gasket - F12 M6, F13 M6, F10 M5, F06 M6 Gran Cou...",48661,18307843213,$20.88,https://www.turnermotorsport.com/c-148-bmw-gaskets-hangers-and-parts?No=50&Nrpp=50#,"Genuine BMW Gasket -     F06,F10,F12,F13     S63N"
https://www.turnermotorsport.com/p-362568-gasket-ring-priced-each/,Elring Exhaust Manifold Gasket Ring - N54 3.0L,362568,11627558906,$4.95,https://www.turnermotorsport.com/c-148-bmw-gaskets-hangers-and-parts?No=50&Nrpp=50#,
https://www.turnermotorsport.com/p-181010-11621728489-genuine-bmw-part/,Exhaust Manifold Gasket - E34 E30 M20,181010,11621728489,$10.95,https://www.turnermotorsport.com/c-148-bmw-gaskets-hangers-and-parts?No=50&Nrpp=50#,Orignal BMW GASKET W/HEAT PROT.SHIELD AS
https://www.turnermotorsport.com/p-340661-tms340661/,Elring Downpipe to Midpipe Exhaust Gasket - N54 BMW,340661,18307553603,$17.95,https://www.turnermotorsport.com/c-148-bmw-gaskets-hangers-and-parts?No=50&Nrpp=50#,
https://www.turnermotorsport.com/p-48420-18307581970-genuine-bmw-part/,Genuine BMW Pre-catalyst Gasket ring,48420,18307581970,$21.34,https://www.turnermotorsport.com/c-148-bmw-gaskets-hangers-and-parts?No=50&Nrpp=50#,"Genuine BMW Gasket Ring -     E89 Z4,F10,F15,F16,F22,F25 X3,F26 X4,F30,F31,F32,F33,F34,F36,I12 i8     N20,N26,N55"
https://www.turnermotorsport.com/p-48564-18307620349-genuine-bmw-part/,Genuine BMW Exhaust Clamp,48564,18307620349,$32.95,https://www.turnermotorsport.com/c-148-bmw-gaskets-hangers-and-parts?No=50&Nrpp=50#,"Genuine BMW Clamp -     F22,F30,F32,F33,F34,F36     N55"
https://www.turnermotorsport.com/p-725971-exhaust-clamp-priced-each/,"HJS Exhaust Clamp - F02, F06, F10, F12, F13, F22, F30, F32, F33, F34...",725971,18307560815,$37.95,https://www.turnermotorsport.com/c-148-bmw-gaskets-hangers-and-parts?No=50&Nrpp=50#,Used in fastening and mounting exhaust components
https://www.turnermotorsport.com/p-382860-rear-muffler-hanger/,"Vaico Rear Muffler Hanger - E24, E28",382860,18211176395,$4.95,https://www.turnermotorsport.com/c-148-bmw-gaskets-hangers-and-parts?No=50&Nrpp=50#,Replacement rubber exhaust hanger
https://www.turnermotorsport.com/p-7509-18211712511-genuine-bmw-part/,Genuine BMW Exhaust Hanger Bracket,7509,18211712511,$28.00,https://www.turnermotorsport.com/c-148-bmw-gaskets-hangers-and-parts?No=50&Nrpp=50#,"Genuine BMW Bracket Exhaust Pipe -     E30,E36     M20,M42,M44,M52"
https://www.turnermotorsport.com/p-177162-18307633093-genuine-bmw-part/,Genuine BMW Rubber Mount For Exhaust,177162,18307633093,$30.75,https://www.turnermotorsport.com/c-148-bmw-gaskets-hangers-and-parts?No=50&Nrpp=50#,"Genuine BMW Rubber Mounting -     F30,F31,F32,F33,F34,F36     N20,N26,N55"
https://www.turnermotorsport.com/p-47488-e82-135i-n54n55-e84-x1-35ix-exhaust-gasket-ring/,"E82 135i N54/N55, E84 X1 35iX Exhaust Gasket Ring",47488,18117553130,$20.60,https://www.turnermotorsport.com/c-148-bmw-gaskets-hangers-and-parts?No=50&Nrpp=50#,This is the exhaust gasket ring that fits between the center exhaust and the rear muffler.
https://www.turnermotorsport.com/p-362205-electric-valve-for-secondary-air-system-or-exhaust-flap/,Electric Valve - For Secondary Air System Or Exhaust Flap,362205,11747810831,$33.95,https://www.turnermotorsport.com/c-148-bmw-gaskets-hangers-and-parts?No=50&Nrpp=50#,"This electric valve serves one of several purposes depending on which car it is used on. Please read the application listings below to ensure you are purchasing the correct part. Pierburg pumps are some of the most trusted and widely used on the market. From fuel, water, air and vacuum Pierburg has you covered with OE quality and reliable performance year after year."
https://www.turnermotorsport.com/p-114109-51481945429-genuine-bmw-part/,Genuine BMW Heat Shield - E30 318i 318is 325 325e 325es 325i 325is 3...,114109,51481945429,$45.74,https://www.turnermotorsport.com/c-148-bmw-gaskets-hangers-and-parts?No=50&Nrpp=50#,Genuine BMW Heat Resistant Plate -     E30
https://www.turnermotorsport.com/p-48525-18307606136-genuine-bmw-part/,Genuine BMW Exhaust Clamp,48525,18307606136,$32.51,https://www.turnermotorsport.com/c-148-bmw-gaskets-hangers-and-parts?No=50&Nrpp=50#,"Genuine BMW Clamp -     E89 Z4,F10,F15,F16,F22,F25 X3,F26 X4,F30,F31,F32,F33,F34,F36,I12 i8     N20,N26,N55"
https://www.turnermotorsport.com/p-390849-e36-exhaust-hanger-and-hardware/,E36 Exhaust Hanger And Hardware,390849,E36EXHHANGERS,$60.84,https://www.turnermotorsport.com/c-148-bmw-gaskets-hangers-and-parts?No=50&Nrpp=50#,"Complete set of hangers and hardware for the E36 325/328/M3 exhaust. Choose from only the rubber hangers, the metal hangers on the rear muffler with gaskets and hardware, or everything together. This kit is essential when removing the exhaust or upgrading to a performance cat-back."
https://www.turnermotorsport.com/p-127-e30-325-m20-525i-exhaust-manifold-gasket-set/,"E30 325, M20 525i Exhaust Manifold Gasket Set",127,11621728489-2,$29.70,https://www.turnermotorsport.com/c-148-bmw-gaskets-hangers-and-parts?No=50&Nrpp=50#,"E30 325, M20 525i Exhaust Manifold Gasket Set, price includes a pair."
https://www.turnermotorsport.com/p-1195885-/,HJS Exhaust Clamp (D=70mm),1195885,18307560780,$38.95,https://www.turnermotorsport.com/c-148-bmw-gaskets-hangers-and-parts?No=50&Nrpp=50#,Used to connect two pieces of exhaust tubing
https://www.turnermotorsport.com/p-210162-18308632154-genuine-bmw-part/,Genuine BMW Exhaust Flap Actuator,210162,18308632154,$110.38,https://www.turnermotorsport.com/c-148-bmw-gaskets-hangers-and-parts?No=100&Nrpp=50#,"Genuine BMW Actuator Drive, Exhaust Flap -     F15,F16,F22,F30,F31,F32,F33,F34,F36,I12 i8     N20,N26,N55"
https://www.turnermotorsport.com/p-381628-3-hi-flo-downpipes-with-race-cats/,AR Design Nord-Lock Downpipe Hardware Kit - N54/N55/N63/S63 135/335/...,381628,AR-01-03002,$13.95,https://www.turnermotorsport.com/c-148-bmw-gaskets-hangers-and-parts?No=100&Nrpp=50#,
https://www.turnermotorsport.com/p-206335-11537853849-genuine-bmw-part/,"Genuine BMW Heat Protection - F12 M6, F10 M5, F13 M6, F06 M6 Gran Co...",206335,11537853849,$22.11,https://www.turnermotorsport.com/c-148-bmw-gaskets-hangers-and-parts?No=100&Nrpp=50#,"Genuine BMW Heat Protection -     F06,F10,F12,F13     S63N"
https://www.turnermotorsport.com/p-362092-egr-valve-gasket/,"Victor Reinz EGR Valve Gasket - E39, E46, E53, E60, E66, E83, Z3, Z4...",362092,11727514860,$1.30,https://www.turnermotorsport.com/c-148-bmw-gaskets-hangers-and-parts?No=100&Nrpp=50#,Used to seal EGR valve to the cylinder head
https://www.turnermotorsport.com/p-13200-18207839657-genuine-bmw-part/,"Genuine BMW Exhaust Mount Hanger Support - S50 S52 S54 S62 S65
    ...",13200,18207839657,$58.09,https://www.turnermotorsport.com/c-148-bmw-gaskets-hangers-and-parts?No=100&Nrpp=50#,"Genuine BMW Support Rubber Mounting    E36 M3,E39 M5,E46 M3,E85 Z4M,E36,E39,E46,E85 Z4,E86 Z4,E90,E92,E93     S50,S52,S54,S62,S65"
https://www.turnermotorsport.com/p-7507-18211707923-genuine-bmw-part/,"Genuine BMW Exhaust Clamp - E30 318i 318is M42 325e 325i 325ix
    ...",7507,18211707923,$60.24,https://www.turnermotorsport.com/c-148-bmw-gaskets-hangers-and-parts?No=100&Nrpp=50#,"Genuine BMW Clamp -     E30     M20,M42"
https://www.turnermotorsport.com/p-7527-18311728237-genuine-bmw-part/,"Genuine BMW Clamp - 18311728237 - E36,E39,E36 M3",7527,18311728237,$24.82,https://www.turnermotorsport.com/c-148-bmw-gaskets-hangers-and-parts?No=100&Nrpp=50#,"Genuine BMW Clamp    E36 M3,E36,E39     M50,M52,S50"
https://www.turnermotorsport.com/p-37331-11721437884-genuine-bmw-part/,Genuine BMW Pressure hose assembly - Z3 2.5 2.8 2.5i 3.0i,37331,11721437884,$48.84,https://www.turnermotorsport.com/c-148-bmw-gaskets-hangers-and-parts?No=100&Nrpp=50#,"Genuine BMW PRESSURE HOSE ASSY    M52,M54"
https://www.turnermotorsport.com/p-22640-18311728235-genuine-bmw-part/,"Genuine BMW Exhaust Support Zf - 18311728235 - E36,E39,E36 M3
     ...",22640,18311728235,$37.26,https://www.turnermotorsport.com/c-148-bmw-gaskets-hangers-and-parts?No=100&Nrpp=50#,"Genuine BMW Exhaust Support - Zf    E36 M3,E36,E39     M50,M52,S50"
https://www.turnermotorsport.com/p-48238-18303413587-genuine-bmw-part/,"Vibration Absorber - 32 Hz - E82, E83, E84, E88, E90, E91, E92, E93
...",48238,18303413587,$65.11,https://www.turnermotorsport.com/c-148-bmw-gaskets-hangers-and-parts?No=100&Nrpp=50#,"Genuine BMW Vibration Absorber - 32 Hz    E82,E83 X3,E90,E92,E93     M54,N51,N52,N52N,N54,N55"
https://www.turnermotorsport.com/p-47817-18207578239-genuine-bmw-part/,Genuine BMW Exhaust Hanger - E63 E64 Z3,47817,18207578239,$25.86,https://www.turnermotorsport.com/c-148-bmw-gaskets-hangers-and-parts?No=100&Nrpp=50#,"Genuine BMW Rubber Ring -     E63     M52,M54,N51,N62,N62N"
https://www.turnermotorsport.com/p-12675-exhaust-system-rubber-mount-18207832991/,Genuine BMW Center Exhaust Pipe Hanger - Multiple BMW's,12675,18207832991,$28.86,https://www.turnermotorsport.com/c-148-bmw-gaskets-hangers-and-parts?No=100&Nrpp=50#,Replace worn or otherwise damaged hangers to reduce squeaks and rubbing from exhaust-on-body contact
https://www.turnermotorsport.com/p-1291-exhaust-manifold-gasket-m50-s50-engines/,Exhaust Manifold Gasket - M50 & S50 Engines,1291,11621728983,$4.95,https://www.turnermotorsport.com/c-148-bmw-gaskets-hangers-and-parts?No=100&Nrpp=50#,"This exhaust manifold gasket fits 2.5 liter 6 cylinder engines from 1992-1995, 1995 3.0 liter M3, and all 4 cylinder engines from 1990-1999 (M42 & M44).    It fits all 1992-1995 325i & 325is (E36), 1995 M3 3.0, 1991-1995 525i (E34), 318i/is/ti 1990-1995 (E30 & E36) and Z3 1.9 liter.    These are sold individually. 3 are required for 6 cylinder (M50/S50) and 2 are required for 4 cylinder (M42 & M44)."
https://www.turnermotorsport.com/p-48360-18307560815-genuine-bmw-part/,Genuine BMW Exhaust clamp,48360,18307560815,$50.22,https://www.turnermotorsport.com/c-148-bmw-gaskets-hangers-and-parts?No=100&Nrpp=50#,Genuine BMW CLAMPING BUSH
https://www.turnermotorsport.com/p-28833-07129904874-genuine-bmw-part/,Genuine BMW Hex Nut - BM8-8-ZNNIV-SI - Multiple BMWs,28833,07129904874,$1.92,https://www.turnermotorsport.com/c-148-bmw-gaskets-hangers-and-parts?No=100&Nrpp=50#,"Genuine BMW Hex Nut    E36 M3,E70 X5M,E71 X6M,E82 1M Coupe,E53 48IS,E36,E39,E53 X5 X5,E70 X5,E71 X6,E82,E90,E92,E93,F01,F02,F06,F10,F12,F13,F15"
https://www.turnermotorsport.com/p-385018-fiberglass-exhaust-wrap-black-2-x-50/,"Prosport Fiberglass Exhaust Wrap - Black - 2"" x 50'",385018,HEA-WRAPKIT-BLK,$28.00,https://www.turnermotorsport.com/c-148-bmw-gaskets-hangers-and-parts?No=100&Nrpp=50#,"Constructed of durable, tight-woven fiberglass, this heat wrap is designed to maintain proper thermal properties in your vehicles exhaust system. This material was hand selected specifically for it's heat characteristics and flexibility."
https://www.turnermotorsport.com/p-389542-gasket-ring-asbesto/,Genuine BMW Exhaust Gasket Ring - E23 E24 E28 E30 E34,389542,18111723533,$11.13,https://www.turnermotorsport.com/c-148-bmw-gaskets-hangers-and-parts?No=100&Nrpp=50#,This 45mm exhaust gasket ring seals the connection point between two exhaust pipes.
https://www.turnermotorsport.com/p-20724-18101433249-genuine-bmw-part/,"Genuine BMW Upper Support Clamp - E46 325Ci 325i 325xi 330i 330xi
 ...",20724,18101433249,$24.81,https://www.turnermotorsport.com/c-148-bmw-gaskets-hangers-and-parts?No=100&Nrpp=50#,Genuine BMW Clamp Upper - D=45mm/50mm    E46     M54
https://www.turnermotorsport.com/p-47432-18111245489-genuine-bmw-part/,Genuine BMW Exhaust Gasket Ring - 42mm - E21 E30 E12 E28 E34 E24 E23...,47432,18111245489,$6.37,https://www.turnermotorsport.com/c-148-bmw-gaskets-hangers-and-parts?No=100&Nrpp=50#,"This exhaust gasket ring seals the connection between the exhaust pipes, preventing exhaust gas from leaking out of the exhaust.         M30"
https://www.turnermotorsport.com/p-47463-18111719444-genuine-bmw-part/,Genuine BMW Rear Exhaust Flange,47463,18111719444,$21.27,https://www.turnermotorsport.com/c-148-bmw-gaskets-hangers-and-parts?No=100&Nrpp=50#,"Genuine BMW Flange    E36 M3,E36     M50,M52,S50,S52"
https://www.turnermotorsport.com/p-25142-18211436309-genuine-bmw-part/,Genuine BMW Center Exhaust Hanger Support,25142,18211436309,$77.83,https://www.turnermotorsport.com/c-148-bmw-gaskets-hangers-and-parts?No=100&Nrpp=50#,"Genuine BMW Connecting Support    E46 M3,E46,E83 X3,E90,E92,E93"
https://www.turnermotorsport.com/p-7504-18211178126-genuine-bmw-part/,"Genuine BMW Exhaust Clamp - E30 318i 318is M42 325e 325i 325ix
    ...",7504,18211178126,$60.24,https://www.turnermotorsport.com/c-148-bmw-gaskets-hangers-and-parts?No=100&Nrpp=50#,"Genuine BMW Clamp -     E30     M20,M42"
https://www.turnermotorsport.com/p-382438-rubber-exhaust-hanger-priced-each/,"Febi Rubber Exhaust Hanger - E30, E32, E34",382438,18211712838,$4.95,https://www.turnermotorsport.com/c-148-bmw-gaskets-hangers-and-parts?No=100&Nrpp=50#,Rubber hanger for rear of the rear muffler
https://www.turnermotorsport.com/p-22635-downpipe-gasket-n54-n55-s55-n63n-s63n-engines/,"Ajusa Downpipe Gasket - N54, N55, S55, N63N, S63N engines",22635,18307553601,$14.95,https://www.turnermotorsport.com/c-148-bmw-gaskets-hangers-and-parts?No=100&Nrpp=50#,"This is the gasket that goes between the turbo outlet and downpipe on BMW's with the N54,N54T,N55,N63,N63N,S55,S63 and S63N engines. Sold Individually."
https://www.turnermotorsport.com/p-396285-hjs-v-band-exhaust-clamp-priced-each/,HJS V-Band Exhaust Clamp - Priced Each,396285,11657620508,$15.95,https://www.turnermotorsport.com/c-148-bmw-gaskets-hangers-and-parts?No=100&Nrpp=50#,
https://www.turnermotorsport.com/p-7486-genuine-bmw-exhaust-flange-18111712064/,"Genuine BMW Flange - 18111712064 - E30,E34",7486,18111712064,$12.96,https://www.turnermotorsport.com/c-148-bmw-gaskets-hangers-and-parts?No=100&Nrpp=50#,"Genuine BMW Flange -     E30,E34     M20"
https://www.turnermotorsport.com/p-27402-07119902957-genuine-bmw-part/,Genuine BMW Exhaust Hex Bolt - Z4 M Coupe/Roadster,27402,07119902957,$4.82,https://www.turnermotorsport.com/c-148-bmw-gaskets-hangers-and-parts?No=100&Nrpp=50#,Used to join the separate sections of the exhaust together.
https://www.turnermotorsport.com/p-13197-genuine-bmw-exhaust-system-flange-steady-18107506146/,Genuine BMW Flange Steady - 18107506146 - E46,13197,18107506146,$15.74,https://www.turnermotorsport.com/c-148-bmw-gaskets-hangers-and-parts?No=100&Nrpp=50#,"Genuine BMW Flange Steady -     E46     M54,M56"
https://www.turnermotorsport.com/p-639555-muffler-strap/,Exhaust Clamp - E30 318i 318is M42 325e 325i 325ix,639555,18211178126,$15.72,https://www.turnermotorsport.com/c-148-bmw-gaskets-hangers-and-parts?No=100&Nrpp=50#,"URO Parts is one of the leading manufacturers of high quality direct replacement aftermarket components, covering a wide range of makes and models. All of their replacement parts are manufactured to ISO 9000 certification standards, so you can expect long lasting performance from URO Parts. As a leading source of high performance BMW parts and accessories since 1993, we at Turner Motorsport are honored to be the go-to supplier for tens of thousands of enthusiasts the world over. With over two decades of parts, service, and racing experience under our belt, we provide only quality performance and replacement parts. All of our performance parts are those we would (and do!) install and run on our own cars, as well as replacement parts that are Genuine BMW or from OEM manufacturers. We only offer parts we know you can trust to perform! This item fits the following BMW Chassis: E30 Fits BMW Engines including: M20,M42"
https://www.turnermotorsport.com/p-1196176-/,CRP Hose Clamp,1196176,11537547945,$2.04,https://www.turnermotorsport.com/c-148-bmw-gaskets-hangers-and-parts?No=100&Nrpp=50#,
https://www.turnermotorsport.com/p-580373-tool-exhaust-doughnut-stretcher-bavarian-autosport/,Bav Auto Exhaust Doughnut Stretcher,580373,B8800051,$10.95,https://www.turnermotorsport.com/c-148-bmw-gaskets-hangers-and-parts?No=100&Nrpp=50#,This tool is not vehicle specific and is a universal tool that may or may not work on all applications. This exhaust doughnut stretcher features an offset J-hook to grab onto the rubber rings used to mount most BMW exhaust systems. Features a large coated handle for a comfortable grip.
https://www.turnermotorsport.com/p-385019-titanium-exhaust-wrap-2-x-50/,"Prosport Titanium Exhaust Wrap - 2"" x 50'",385019,HEA-WRAPKIT-50,$49.95,https://www.turnermotorsport.com/c-148-bmw-gaskets-hangers-and-parts?No=100&Nrpp=50#,"Constructed for durability with a tight weave, this heat wrap is designed to maintain proper thermal properties in your vehicles exhaust system. This material was hand selected specifically for it's heat characteristics and flexibility. Fiberglass is rated for 1200 degrees, however, this titanium wrap can withstand 1800 degrees!"
https://www.turnermotorsport.com/p-636980-cylinder-head-to-exhaust-manifold-stud-nut-kit-e46-m3/,"Cylinder Head To Exhaust Manifold Stud & Nut Kit - E46 M3
     ...",636980,07129900298KT,$100.89,https://www.turnermotorsport.com/c-148-bmw-gaskets-hangers-and-parts?No=100&Nrpp=50#,"This convenient kit includes all the hardware you need to replace your old, rusted (or broken) exhaust manifold studs on your S54 engine's head."
https://www.turnermotorsport.com/p-36828-11627576992-genuine-bmw-part/,Genuine BMW Exhaust Nut - Exhaust Manifold to Cylinder Head - F01 F0...,36828,11627576992,$2.40,https://www.turnermotorsport.com/c-148-bmw-gaskets-hangers-and-parts?No=100&Nrpp=50#,"Genuine BMW Hex Nut Wiht Flange -     E71,F01,F02,F06,F10,F12,F13,F15,F16     N63,N63N"
https://www.turnermotorsport.com/p-363427-exhaust-manifold-nut-priced-each/,Rein Exhaust Manifold Nut,363427,11721437202,$2.95,https://www.turnermotorsport.com/c-148-bmw-gaskets-hangers-and-parts?No=100&Nrpp=50#,Used to secure the exhaust manifold to the cylinder head
https://www.turnermotorsport.com/p-47111-17427585290-genuine-bmw-part/,Screw - Self Tapping,47111,17427585290,$14.73,https://www.turnermotorsport.com/c-148-bmw-gaskets-hangers-and-parts?No=100&Nrpp=50#,"Genuine BMW Screw Self-Tapping - D5X20    E70 X5M,E71 X6M,E70 X5 X5,E71 X6,F01,F02,F06,F10,F12,F13,F15,F16,F80 M3,F82 M4,F83"
https://www.turnermotorsport.com/p-47800-18207571001-genuine-bmw-part/,Genuine BMW Exhaust Hanger Bracket - Left,47800,18207571001,$41.85,https://www.turnermotorsport.com/c-148-bmw-gaskets-hangers-and-parts?No=100&Nrpp=50#,"Genuine BMW Bracket -     E90,E92,E93     M57,N54,N54T,N55"
https://www.turnermotorsport.com/p-582098-muffler-hanger-kit-bosal/,Bosal Muffler Hanger Kit - E30,582098,254-909,$25.95,https://www.turnermotorsport.com/c-148-bmw-gaskets-hangers-and-parts?No=100&Nrpp=50#,Everything you need to give your muffler the support it deserves.
https://www.turnermotorsport.com/p-578786-exhaust-seal-ring/,Fischer and Plath Exhaust Gasket Ring - Left Pipe - E36,578786,101.048,$1.60,https://www.turnermotorsport.com/c-148-bmw-gaskets-hangers-and-parts?No=100&Nrpp=50#,Gasket ring for the left exhaust pipe
https://www.turnermotorsport.com/p-15181-18207553607-genuine-bmw-part/,Genuine BMW Exhaust bracket,15181,18207553607,$32.68,https://www.turnermotorsport.com/c-148-bmw-gaskets-hangers-and-parts?No=100&Nrpp=50#,"Genuine BMW Clamp    E82 1M Coupe,E82,E90,E92,E93     N54,N54T,N55"
https://www.turnermotorsport.com/p-593856-exhaust-manifold-gasket-price-each/,Exhaust Manifold Gasket - Price Each,593856,11621435366,$5.95,https://www.turnermotorsport.com/c-148-bmw-gaskets-hangers-and-parts?No=100&Nrpp=50#,This item fits the following BMW Chassis: E36
https://www.turnermotorsport.com/p-47853-18207833206-genuine-bmw-part/,Genuine BMW Rubber Muffler Mount,47853,18207833206,$22.85,https://www.turnermotorsport.com/c-148-bmw-gaskets-hangers-and-parts?No=100&Nrpp=50#,"Genuine BMW Rubber Mounting    E60 M5,E63 M6,E63     N54S85,N62N"
https://www.turnermotorsport.com/p-30789-11117557325-genuine-bmw-part/,Crankshaft Main Bearing Cap Bolt,30789,11117557325,$5.66,https://www.turnermotorsport.com/c-148-bmw-gaskets-hangers-and-parts?No=100&Nrpp=50#,"Genuine BMW Collar Screw - M8X70    E70 X5M,E71 X6M,E70 X5 X5,E71 X6,F01,F02,F06,F10,F12,F13,F15,F16     N63,N63N,S63,S63N"
https://www.turnermotorsport.com/p-47805-18207571006-genuine-bmw-part/,Genuine BMW Exhaust Hanger Bracket - right,47805,18207571006,$41.85,https://www.turnermotorsport.com/c-148-bmw-gaskets-hangers-and-parts?No=100&Nrpp=50#,"Genuine BMW Bracket, Resonator, Rear Right -     E90,E92,E93     M57,N54,N54T,N55"
https://www.turnermotorsport.com/p-47804-18207571005-genuine-bmw-part/,Genuine BMW Exhaust hanger bracket - left,47804,18207571005,$41.85,https://www.turnermotorsport.com/c-148-bmw-gaskets-hangers-and-parts?No=100&Nrpp=50#,"Genuine BMW Bracket, Resonator, Rear Left -     E90,E92,E93     M57,N54,N54T,N55"
https://www.turnermotorsport.com/p-13209-18307536426-genuine-bmw-part/,Genuine BMW 65mm Exhaust Clamp,13209,18307536426,$46.62,https://www.turnermotorsport.com/c-148-bmw-gaskets-hangers-and-parts?No=100&Nrpp=50#,"Genuine BMW Clamping Bush - D=65Mm    E60 M5,E63 M6,E39,E46,E63,E82,E90,E92,E93,F15,F25 X3,F26 X4 X4,F30,F31,F80 M3,F82 M4,F83"
https://www.turnermotorsport.com/p-48329-18307550851-genuine-bmw-part/,Genuine BMW Exhaust midpipe Mounting clamp - Bottom,48329,18307550851,$33.09,https://www.turnermotorsport.com/c-148-bmw-gaskets-hangers-and-parts?No=100&Nrpp=50#,"Genuine BMW Pipe Clamp, Bottom -     E90,E92,E93     N51,N51,N52,N52N"
https://www.turnermotorsport.com/p-118103-51718051597-genuine-bmw-part/,Genuine BMW Multifunctional trunk Floor Pan - E82 1 M Coupe N54 E82 ...,118103,51718051597,$210.12,https://www.turnermotorsport.com/c-148-bmw-gaskets-hangers-and-parts?No=100&Nrpp=50#,"Genuine BMW Multifunctional Pan, Trunk Floor    E82 1M Coupe,E82"
https://www.turnermotorsport.com/p-18980-11761711717-bmw-part/,"Elring Exhaust Gasket  - E30, E31, E32, E34",18980,11761711717,$12.11,https://www.turnermotorsport.com/c-148-bmw-gaskets-hangers-and-parts?No=100&Nrpp=50#,
https://www.turnermotorsport.com/p-47732-18207526850-genuine-bmw-part/,Genuine BMW Exhaust Pipe Hanger Bracket,47732,18207526850,$41.85,https://www.turnermotorsport.com/c-148-bmw-gaskets-hangers-and-parts?No=100&Nrpp=50#,"Genuine BMW Bracket -     E82,E90,E92,E93     N51,N52,N52N,N54"
https://www.turnermotorsport.com/p-377147-stainless-steel-sleeve-clamp-762mm/,NAPA Stainless Steel Sleeve Clamp - 76.2mm,377147,BK7333222,$15.95,https://www.turnermotorsport.com/c-148-bmw-gaskets-hangers-and-parts?No=150&Nrpp=50#,"Highly flexible sleeve clamp, great for custom applications"
https://www.turnermotorsport.com/p-47788-18207562612-genuine-bmw-part/,"Bracket - E82, E88, E90, E92, E93",47788,18207562612,$31.01,https://www.turnermotorsport.com/c-148-bmw-gaskets-hangers-and-parts?No=150&Nrpp=50#,"Genuine BMW Bracket    E82 1M Coupe,E82,E90,E92,E93     N54,N54T,N55"
https://www.turnermotorsport.com/p-48633-18307810318-genuine-bmw-part/,Transmission Holder - E90,48633,18307810318,$48.14,https://www.turnermotorsport.com/c-148-bmw-gaskets-hangers-and-parts?No=150&Nrpp=50#,Genuine BMW Transmission Holder -     E90     M57
https://www.turnermotorsport.com/p-194606-18308637404-genuine-bmw-part/,Genuine BMW Muffler Clamp,194606,18308637404,$33.09,https://www.turnermotorsport.com/c-148-bmw-gaskets-hangers-and-parts?No=150&Nrpp=50#,"Genuine BMW Muffler Clamp - D=85,6Mm    E71,F06,F10,F12,F13,F25 X3,F26 X4     N55"
https://www.turnermotorsport.com/p-554110-635mm-id-exhaust-clamp-priced-each/,"HJS 63.5mm ID Exhaust Clamp - E39, E65, E66",554110,18307536425,$34.15,https://www.turnermotorsport.com/c-148-bmw-gaskets-hangers-and-parts?No=150&Nrpp=50#,To connect the exhaust pipes
https://www.turnermotorsport.com/p-593630-turbocharger-gasket-priced-each/,"Genuine BMW Gasket Asbestos Free - 11657802593 - E70 X5,E90
       ...",593630,11657802593,$94.95,https://www.turnermotorsport.com/c-148-bmw-gaskets-hangers-and-parts?No=150&Nrpp=50#,"Genuine BMW Gasket Asbestos Free -     E70 X5,E90     M57"
https://www.turnermotorsport.com/p-528094-rubber-mounting/,"Rubber Mounting - F25, F26",528094,18208513515,$22.85,https://www.turnermotorsport.com/c-148-bmw-gaskets-hangers-and-parts?No=150&Nrpp=50#,
https://www.turnermotorsport.com/p-36835-11627589106-genuine-bmw-part/,Genuine BMW Exhaust Manifold Gasket - S63 4.4L,36835,11627589106,$52.70,https://www.turnermotorsport.com/c-148-bmw-gaskets-hangers-and-parts?No=150&Nrpp=50#,"Genuine BMW Gasket    E70 X5M,E71 X6M,E70 X5,E71 X6,F06,F10,F12,F13     S63,S63N"
https://www.turnermotorsport.com/p-36843-11627614095-genuine-bmw-part/,Genuine BMW Exhaust manifold gasket - N63 4.4L,36843,11627614095,$23.40,https://www.turnermotorsport.com/c-148-bmw-gaskets-hangers-and-parts?No=150&Nrpp=50#,"Genuine BMW Gasket -     E71,F01,F02,F06,F10,F12,F13,F15,F16     N63,N63N"
