product-img-link href,cleanDesc,part-info,part-info 2,price,starting-at,wishlist-label href,short-description
https://www.turnermotorsport.com/p-360273-kbs-diamond-finish-restoration-clearcoat/,KBS Diamond Finish Restoration Clearcoat,360273,8X04T,$34.95,Starting at,https://www.turnermotorsport.com/c-344-chassis-paint-coatings-sealants-and-rust-conversion#,"KBS Diamond Finish is a hardened finishing clearcoat that is applied directly to your prepped or painted surface. It provides an incredibly strong finished layer to protect your painted surface from nicks, dings, chemicals, solvents, brake fluid, and other harsh materials. Diamond Finish is easy to apply; unlike two-part clearcoats it doesn't need a hardener or other additives. Just stir and apply! It can be applied with a conventional spray gun, roller, and brushed on (it's self-leveling and won't leave brush marks behind). You can apply it to cured automotive paints, standard solid color paints, and single or two-part paints, enamels, and lacquered paints. You can even apply it to bare metals - aluminum, alloys, brass, chrome, or copper for a lustrous shine. Although UV-stable, it's not recommended for use on RustSeal where a standard automotive clearcoat will provide better UV protection. Diamond Finish is great as a glossy restoration clearcoat for bare metals like cylinder heads, intake manifolds, brake components, intercoolers, wheels, chrome trim, and more. It will resist yellowing up to temperatures of 325*F."
https://www.turnermotorsport.com/p-338446-kbs-motorcycle-fuel-tank-sealer-kit/,KBS Motorcycle Fuel Tank Sealer Kit,338446,520XX,$38.95,Starting at,https://www.turnermotorsport.com/c-344-chassis-paint-coatings-sealants-and-rust-conversion#,"KBS Fuel Tank Sealer Kit contains all of the essential products to completely clean, treat, and seal a motorcycle fuel tank (5 or 12 gallon sizes). The complete kit is formulated to stop fuel tank rust in its tracks and then coat and seal the tank, including filling small pinholes and weld seams. The final coating is impervious to fuels, alcohol additives, and most solvents. It's a tough ceramic-like barrier against future corrosion.KBS Fuel Tank Sealer Kit includes:+ KBS Klean - for 'washing' and stripping away other chemicals and foreign particles+ KBS Blast - dissolves rust and metal oxides and converts it to a zinc phosphate that is ready for coating+ KBS Gold Standard Tank Sealer - spreadable coating that leaves a rock-hard ceramic-like coating that is very resistant to salt and chemicals+ Chemical-resistant black nitrile gloves+ Brushes and stirring stick+ Detailed instructions The KBS process involves first treating and prepping the rusty area before the final coating is applied. The surfaces must first be cleaned with the KBS Klean to strip away grease and other chemicals that will interfere with coating adhesion. Klean is water based and biodegradable and doesn't have the harsh smells and effects of solvents or chemicals. Let Klean soak but rotate the tank every minutes to ensure complete coverage. The cleaner the tank the better the adhesion so repeat until you're satisfied. The Klean process should be left to completely dry before moving to Step 2. Rust Blast is the actual conversion of rust into zinc phosphate state and is etched for proper paint adhesion. This step is essential for stopping the rust in its tracks and from spreading. It's also a primer for the final stage of coating, leaving behind a white powdery residue. Like the Klean it's also water based and biodegradable. For the rust conversion to be complete pour the Blast into the tank and rotate several times to ensure coverage. Rinse and allow to dry completely before sealing. For the finishing touch, pour the KBS Tank Sealer into the tank. Choose from a Kit for a 5 gallon or 12 gallon tank. It's formulated to be applied as a single coat. Rotate the tank to ensure complete coverage and drain the excess. It's important to not allow the Tank Seal to pool or collect so make sure it drains well. Use any excess to coat and seal the outside of the tank, especially in areas that might have leaks. Tank Seal leaves a very tough and hard surface that is impervious to most solvents, fuels, acids, and road salt. When fully cured it's flexible, allowing it to move as the tank expands and contracts. It's self-leveling too which produces an even finish that will not crack, flake, or peel and will withstand temperatures up 600*F (316*C). The KBS process will need approximately one week to fully complete (the recommended drying time on the tank is four days). This is perfect for restoration jobs or longer builds where the car can sit for an extended period of time."
https://www.turnermotorsport.com/p-338953-kbs-fusion-self-etching-primer/,KBS Fusion Self-Etching Primer,338953,KBS-FUSION,$20.95,Starting at,https://www.turnermotorsport.com/c-344-chassis-paint-coatings-sealants-and-rust-conversion#,"KBS Fusion self-etching primer is the ideal prep layer between paint coatings. Fusion is the preferred primer over cured RustSeal coatings in preparation for a color topcoat. Fusion will promote adhesion between multiple surface coatings and even bare metals and most hard plastics. It's part of the ultimate corrosion protector - Blast, Seal, Fusion, and Topcoat. Apply Fusion to a cured RustSeal coating that's been lightly sanded with 280-320 grit sandpaper. Fusion should be used if the RustSeal layer is older than a few days. Apply a thin coat and it will be ready for topcoat in 20-30 minutes. If your RustSeal is not your final top layer the Fusion is the best adhesion primer you'll find."
https://www.turnermotorsport.com/p-2181291-ceramic-3-in-1-wax-1-gallon/,Ceramic 3 in 1 Wax 1 Gallon,2181291,10983,$84.99,,https://www.turnermotorsport.com/c-344-chassis-paint-coatings-sealants-and-rust-conversion#,"Griot's customers asked for a Griot's Garage ceramic... here it is. We've stepped up to create, formulate, and manufacture our own"
https://www.turnermotorsport.com/p-25039-07589062376-genuine-bmw-part/,Genuine BMW Drei Bond Sealing Compound 1209,25039,07589062376,$24.00,,https://www.turnermotorsport.com/c-344-chassis-paint-coatings-sealants-and-rust-conversion#,Genuine BMW SEALING COMPOUND DREI BOND 1
https://www.turnermotorsport.com/p-350692-kbs-motor-coater-high-temp-paint-engine-or-brake-caliper-paint/,"KBS Motor Coater High Temp Paint (Engine Or Brake Caliper Paint)
  ...",350692,TMS209169DK,$22.95,Starting at,https://www.turnermotorsport.com/c-344-chassis-paint-coatings-sealants-and-rust-conversion#,"KBS Motor Coater is the perfect finishing touch to your engine build. Motor Coater is a high temp resilient acrylic enamel paint designed especially for high temp areas like engine blocks or even brake calipers. Engine paint is a must-do for the perfect finishing touch on an engine build. Most professional engine builders will use it as their signature. A quality engine build is marked by the proper appearance and KBS literally has this covered. Motor Coater is a fast drying and tough acrylic paint. It will not blister, flake, crack, or peel up to temperatures of 450*F. It's special formula resists oils, fluids, gasoline, and other solvents. It's UV resistant and you can use the Diamond Finish clearcoat for added protection. And it comes in a large variety of colors with many OEM and factory shades. For more extreme temperature components like headers and exhausts use the KBS Xtreme coating.   Motor Coater is a lot like the KBS RustSeal chassis paint and the key to a proper and long-lasting finish is with the prep. In order for the paint to properly adhere, it must be cleaned and treated to remove all dirt, solvents, and other contanaments. Using KBS Klean and RustBlast are strongly encouraged to achieve the best adhesion and etching for Motor Coater to work. Application is very easy and can be done via brush or spray gun (diluted). No primer is necessary. Brush strokes will flow out leaving a uniform finish behind. 1-2 coats is all that's needed for full coverage and color depth. Average cure times are 2-4 hours, depending on humidity and temperature, but curing stars rapidly after 30 minutes. A pint will be enough to do most BMW engines. Prep and application are the same for brake calipers. KBS Motor Coater comes in a pint-sized container unless specified differently.   While BMW engine blocks have always been glossy black from the factory, there's nothing stopping you from using another color! A bright engine block is one way to stand apart and impress anyone looking under the hood. And a clean, painted block is a big indicator that your motor is fresh and well taken care of. We want to see your colored engine blocks - send us some KBS BMW engine photos!   Proper prep and cleaning is essential! To get a lifelong finish and protection follow the KBS procedures for cleaning the surface (KBS Klean), treating and etching rust and corrosion (KBS Blast), and then the finished sealcoat (KBS Motor Coater)."
https://www.turnermotorsport.com/p-339978-kbs-numetal-epoxy-putty/,KBS NuMetal Epoxy Putty,339978,7000X,$22.95,Starting at,https://www.turnermotorsport.com/c-344-chassis-paint-coatings-sealants-and-rust-conversion#,"NuMetal is an easy to use putty with thousands of uses. With most two-part epoxies you have to precisely measure out each ingredient to get the correct mix. But NuMetal uses two equal parts, making the mix very easy to work with. It has a very good shelf life so you only use what you need and save the rest for later. It bonds to almost everything, including wet surfaces, and will not shrink or sag. It sets in one hour and fully cured in twelve. After curing, NuMetal can be sanded, drilled, routed, screwed, chiseled, surfaced, tapped, sawed, turned, filed, carved, stained or painted. In addition to a filler it can also serve as a bonding agent for wood, concrete, stone, plastic, tile, and all types of fiberglass and most types of metals. Fabricators and craftsmen will really like this putty because it is easy to use, excellent bonding strength, and low cost.   Available as a 1lb block in grey, black, or tan."
https://www.turnermotorsport.com/p-340326-kbs-xtreme-temperature-coating/,KBS Xtreme Temperature Coating,340326,KBS-XTC,$22.95,Starting at,https://www.turnermotorsport.com/c-344-chassis-paint-coatings-sealants-and-rust-conversion#,"KBS Xtreme Temperature Coating (XTC) is for extremely high temp areas like headers, exhausts, or even engine blocks where the Motor Coater is not rated high enough. XTC has a temperature range of 500-1,500*F (1,200* for aerosols) whereas Motor Coater has an upper limit of 450*F. Motor Coater is intended for engine blocks and other external metal surfaces. XTC is what you need on the really hot surfaces like headers and exhaust manifolds. XTC coating acts like a ceramic or header wrap and will retain heat in a header system. This reduces underhood temperatures (less heat soak in the engine bay) and improves exhaust gas velocity (better breathing for the engine). XTC has been especially formulated for high heat applications and will resist heat, weathering, thermal shock, and corrosion. It won't peel, flake, or chalk and lasts a long time. It's actually a very good paint for BBQs and cast iron stoves too.   XTC is very easy to apply with either a brush, paint spray gun, or in a convenient aerosol can. Proper prep with KBS Klean and RustBlast is recommended. A silicone zinc primer is also recommended for maximum corrosion protection. The aerosol or 8oz size is enough to coat most BMW headers with two coats. It's dry to the touch in under an hour and then fully cured at 350*F for 20 minutes. Nine colors are offered from several shades of grey to red, blue, and even white."
https://www.turnermotorsport.com/p-209170-kbs-xtreme-temperature-zinc-primer/,KBS Xtreme Temperature Zinc Primer,209170,65100,$27.11,,https://www.turnermotorsport.com/c-344-chassis-paint-coatings-sealants-and-rust-conversion#,"KBS Xtreme Temperature Coating (XTC) is a specially formulated silicone zinc primer for high heat applications such as engine blocks, headers, and exhausts. It helps prevent corrosion on metals subject to high temps, high humidity, condensation, and salt air. Use it to form another barrier against corrosion on headers and manifolds or engine blocks. It acts just like a galvanizing process. It can even be used on its own as a finishing layer (it is grey in color) or use it with a high temp topcoat such as KBS Motor Coater or KBS Xtreme Temperature Coating paint. It withstands temps in excess of 1,200*F. XTC Primer is available in either a convenient 12oz aerosol spray or in a larger quart size container (dilluting with KBS Thinner is recommended)."
https://www.turnermotorsport.com/p-580307-foaming-poly-gloss-35-oz-griots-garage/,Foaming Poly Gloss - 35 oz - Griot's Garage,580307,B3303,$24.99,,https://www.turnermotorsport.com/c-344-chassis-paint-coatings-sealants-and-rust-conversion#,Add hydrophobic protection and get more miles out of your shine
https://www.turnermotorsport.com/p-200126-kbs-auto-gold-standard-fuel-tank-sealer-kit/,KBS Auto Gold Standard Fuel Tank Sealer Kit,200126,53000,$77.55,,https://www.turnermotorsport.com/c-344-chassis-paint-coatings-sealants-and-rust-conversion#,"KBS Fuel Tank Sealer Kit contains all of the essential products to completely clean, treat, and seal a 25-gallon automotive fuel tank. The complete kit is formulated to stop fuel tank rust in its tracks and then coat and seal the tank, including filling small pinholes and weld seams. The final coating is impervious to fuels, alcohol additives, and most solvents. It's a tough ceramic-like barrier against future corrosion.   KBS Fuel Tank Sealer Kit includes:  + KBS Klean - for 'washing' and stripping away other chemicals and foreign particles  + KBS Blast - dissolves rust and metal oxides and converts it to a zinc phosphate that is ready for coating  + KBS Gold Standard Tank Sealer - brushable coating that leaves a rock-hard ceramic-like coating that is very resistant to salt and chemicals  + Chemical-resistant black nitrile gloves  + Brushes and stirring stick  + Detailed instructions     The KBS process involves first treating and prepping the rusty area before the final coating is applied. The surfaces must first be cleaned with the KBS Klean to strip away grease and other chemicals that will interfere with coating adhesion. Klean is water based and biodegradable and doesn't have the harsh smells and effects of solvents or chemicals. Let Klean soak but rotate the tank every minutes to ensure complete coverage. The cleaner the tank the better the adhesion so repeat until you're satisfied. The Klean process should be left to completely dry before moving to Step 2.     Rust Blast is the actual conversion of rust into zinc phosphate state and is etched for proper paint adhesion. This step is essential for stopping the rust in its tracks and from spreading. It's also a primer for the final stage of coating, leaving behind a white powdery residue. Like the Klean it's also water based and biodegradable. For the rust conversion to be complete pour the Blast into the tank and rotate several times to ensure coverage. Rinse and allow to dry completely before sealing.     For the finishing touch, pour the KBS Tank Sealer into the tank. The Sample kit includes enough coating for a 25-gallon tank and it's formulated to be applied as a single coat. Rotate the tank to ensure complete coverage and drain the excess. It's important to not allow the Tank Seal to pool or collect so make sure it drains well. Use any excess to coat and seal the outside of the tank, especially in areas that might have leaks. Tank Seal leaves a very tough and hard surface that is impervious to most solvents, fuels, acids, and road salt. When fully cured it's flexible, allowing it to move as the tank expands and contracts. It's self-leveling too which produces an even finish that will not crack, flake, or peel and will withstand temperatures up 600*F (316*C).     The KBS process will need approximately one week to fully complete (the recommended drying time on the tank is four days). This is perfect for restoration jobs or longer builds where the car can sit for an extended period of time.    In order for the 3-step process to work correctly, you must closely follow KBS' instructions. You can view/download them here prior to receiving your order:"
https://www.turnermotorsport.com/p-11838-griots-garage-one-step-paint-sealant-16-oz/,Griot's Garage One-Step Paint Sealant 16 oz,11838,11075,$18.99,,https://www.turnermotorsport.com/c-344-chassis-paint-coatings-sealants-and-rust-conversion#,Get all the protection of an ultra-durable sealant and the defect removal of a gentle polish in one quick application
https://www.turnermotorsport.com/p-2438615-fabric-protectant-22oz/,Fabric Protectant - 22oz,2438615,10960,$16.99,,https://www.turnermotorsport.com/c-344-chassis-paint-coatings-sealants-and-rust-conversion#,"This versatile protectant safeguards numerous automotive materials, including cloth convertible tops, carpet, and upholstery."
https://www.turnermotorsport.com/p-2498316-spray-on-car-wash-35oz/,Spray-On Car Wash - 35oz,2498316,11065,$20.49,,https://www.turnermotorsport.com/c-344-chassis-paint-coatings-sealants-and-rust-conversion#,"Spray-On Car Wash's special high-lubricity formula provides a quick, safe wash without water. It whisks away dust, dirt, and road"
https://www.turnermotorsport.com/p-2498307-glass-sealant-8oz/,Glass Sealant - 8oz,2498307,11033,$8.99,,https://www.turnermotorsport.com/c-344-chassis-paint-coatings-sealants-and-rust-conversion#,This sealant dramatically increases your wet weather visibility making for a safer and much less stressful driving experience.
https://www.turnermotorsport.com/p-641238-griots-garage-engine-bay-dressing/,Griot's Garage Engine Bay Dressing,641238,20244KT,$15.99,,https://www.turnermotorsport.com/c-344-chassis-paint-coatings-sealants-and-rust-conversion#,Make your engine bay look factory-new again! This dressing is a surface enhancer and protectant for all materials and finishes inside
https://www.turnermotorsport.com/p-2438624-premium-carnauba-paste-wax-14oz/,Premium Carnauba Paste Wax - 14oz,2438624,11029,$39.99,,https://www.turnermotorsport.com/c-344-chassis-paint-coatings-sealants-and-rust-conversion#,"You'll love the bright shine, smooth paint, and unmatched protection our Premium Carnauba Paste Wax produces."
https://www.turnermotorsport.com/p-2438620-boss-finishing-cream-16oz/,BOSS Finishing Cream - 16oz,2438620,B140P,$20.00,,https://www.turnermotorsport.com/c-344-chassis-paint-coatings-sealants-and-rust-conversion#,"This paint care two-for-one adds rich, deep, durable protection to your finish while whisking away those last few blemishes."
https://www.turnermotorsport.com/p-580294-boss-correcting-cream-16-oz-griots-garage/,BOSS Correcting Cream - 16 oz - Griot's Garage,580294,B120P,$23.99,,https://www.turnermotorsport.com/c-344-chassis-paint-coatings-sealants-and-rust-conversion#,Eliminate moderate defects like light scratches and swirl marks while adding depth and clarity to your paint.
https://www.turnermotorsport.com/p-2498322-undercarriage-spray-22oz/,Undercarriage Spray - 22oz,2498322,10987,$15.99,,https://www.turnermotorsport.com/c-344-chassis-paint-coatings-sealants-and-rust-conversion#,"It's no longer a messy job detailing your wheel wells, frame, springs, and all of the other black items underneath your car's body."
https://www.turnermotorsport.com/p-2135097-g9-random-orbital-polisher/,G9 Random Orbital Polisher,2135097,10901,$159.99,,https://www.turnermotorsport.com/c-344-chassis-paint-coatings-sealants-and-rust-conversion#,At every turn the feature-rich G9 has the precise attention to detail... the nuance that makes great tools great.
https://www.turnermotorsport.com/p-2498321-best-of-show-spray-wax-22oz/,Best of Show Spray Wax 22oz,2498321,10968,$14.99,,https://www.turnermotorsport.com/c-344-chassis-paint-coatings-sealants-and-rust-conversion#,"Best of Show Spray Wax doesn't just add color, depth, and clarity, its rich carnauba/polymer formula also creates class-leading paint"
https://www.turnermotorsport.com/p-2498331-boss-perfecting-cream-1-gallon/,BOSS Perfecting Cream - 1 Gallon,2498331,B130G,$109.99,,https://www.turnermotorsport.com/c-344-chassis-paint-coatings-sealants-and-rust-conversion#,Easily eliminates minute swirl marks and hazing holograms
https://www.turnermotorsport.com/p-2498373-bug-smudge-remover-gallon/,Bug & Smudge Remover - Gallon,2498373,11015,$44.99,,https://www.turnermotorsport.com/c-344-chassis-paint-coatings-sealants-and-rust-conversion#,"Griot's Garage Bug & Smudge Remover softens baked-on bug jerky so removal is quick, easy, and safe... No drama, no mess."
https://www.turnermotorsport.com/p-2498323-convertible-top-cleaner-22oz/,Convertible Top Cleaner - 22oz,2498323,10855,$9.99,,https://www.turnermotorsport.com/c-344-chassis-paint-coatings-sealants-and-rust-conversion#,"Convertible tops bear the brunt of Mother Nature's worst: bird droppings, tree-sap, fallout, pollen, dirt, grime, and more."
https://www.turnermotorsport.com/p-2181292-g15-long-throw-orbital-polisher/,G15 Long-Throw Orbital Polisher,2181292,10915,$239.99,,https://www.turnermotorsport.com/c-344-chassis-paint-coatings-sealants-and-rust-conversion#,"Designed to perfection, the G15 has the power, pad rotation, and control to take your paint correcting to the next level."
https://www.turnermotorsport.com/p-2498382-brilliant-finish-foam-on-wax-64oz/,Brilliant Finish Foam On Wax 64oz,2498382,10914,$16.99,,https://www.turnermotorsport.com/c-344-chassis-paint-coatings-sealants-and-rust-conversion#,Here's an easy and fast way to wax every exterior surface on your vehicle while enjoying the fun of foam.
https://www.turnermotorsport.com/p-2498327-complete-polish-16oz/,Complete Polish - 16oz,2498327,10876,$14.99,,https://www.turnermotorsport.com/c-344-chassis-paint-coatings-sealants-and-rust-conversion#,Get an astonishing shine by hand. Complete Polish provides fine polishing for those who take a hands-on approach to their paint care.
https://www.turnermotorsport.com/p-2498335-boss-correcting-cream-gallon/,BOSS Correcting Cream - Gallon,2498335,B120G,$129.99,,https://www.turnermotorsport.com/c-344-chassis-paint-coatings-sealants-and-rust-conversion#,Eliminate moderate defects like light scratches and swirl marks while adding depth and clarity to your paint.
https://www.turnermotorsport.com/p-2498317-liquid-gloss-poly-wax-16oz/,Liquid Gloss Poly Wax - 16oz,2498317,10916,$24.99,,https://www.turnermotorsport.com/c-344-chassis-paint-coatings-sealants-and-rust-conversion#,"Insane gloss, unbelievable protection, and effortless removal are the calling cards of this technically advanced synthetic wax."
https://www.turnermotorsport.com/p-2498365-best-of-show-wash-wax-1-gallon/,Best of Show Wash & Wax 1 Gallon,2498365,11396,$39.99,,https://www.turnermotorsport.com/c-344-chassis-paint-coatings-sealants-and-rust-conversion#,Drop a quality wash on your ride and add stout carnauba wax protection to its finish in one easy step.
https://www.turnermotorsport.com/p-2181293-g21-long-throw-orbital-polisher/,G21 Long-Throw Orbital Polisher,2181293,10921,$249.99,,https://www.turnermotorsport.com/c-344-chassis-paint-coatings-sealants-and-rust-conversion#,Need professional-grade paint correction? The feature-packed G21 is the most capable paint perfecting tool we’ve ever created.
https://www.turnermotorsport.com/p-2498376-best-of-show-wash-wax-16oz/,Best of Show Wash & Wax 16oz,2498376,10974,$8.99,,https://www.turnermotorsport.com/c-344-chassis-paint-coatings-sealants-and-rust-conversion#,Drop a quality wash on your ride and add stout carnauba wax protection to its finish in one easy step.
https://www.turnermotorsport.com/p-2119654-ceramic-trim-wipes-4-count/,Ceramic Trim Wipes - 4 Count,2119654,11524,$19.99,,https://www.turnermotorsport.com/c-344-chassis-paint-coatings-sealants-and-rust-conversion#,"Stop patching over a problem and discover a true solution to faded, discolored trim with this easy to use kit."
https://www.turnermotorsport.com/p-2498395-rinseless-wash-wax-1-gallon/,Rinseless Wash & Wax - 1 Gallon,2498395,10497,$79.99,,https://www.turnermotorsport.com/c-344-chassis-paint-coatings-sealants-and-rust-conversion#,Short on Time? Short on Water? Here's a great way to get a fast-and-easy wash in your garage or driveway without rinsing.
https://www.turnermotorsport.com/p-2498362-speed-shine-5-gallons/,Speed Shine - 5 Gallons,2498362,55104,$119.99,,https://www.turnermotorsport.com/c-344-chassis-paint-coatings-sealants-and-rust-conversion#,Speed Shine maintains your car's lustrous finish between washings
https://www.turnermotorsport.com/p-2498303-fine-glass-polish-16oz/,Fine Glass Polish - 16oz,2498303,11017,$22.99,,https://www.turnermotorsport.com/c-344-chassis-paint-coatings-sealants-and-rust-conversion#,"Fine Glass Polish is for mild spots you normally see on your windshield, sunroof, and side glass."
https://www.turnermotorsport.com/p-2498396-rinseless-wash-wax-16oz/,Rinseless Wash & Wax - 16oz,2498396,10493,$19.99,,https://www.turnermotorsport.com/c-344-chassis-paint-coatings-sealants-and-rust-conversion#,Short on Time? Short on Water? Here's a great way to get a fast-and-easy wash in your garage or driveway without rinsing.
https://www.turnermotorsport.com/p-2498318-bug-barricade-22oz/,Bug Barricade - 22oz,2498318,10953,$9.99,,https://www.turnermotorsport.com/c-344-chassis-paint-coatings-sealants-and-rust-conversion#,"Create an invisible, water-soluble barrier so when you wash your vehicle after a summer drive the bug jerky comes right off!"
