product-img-link href,cleanDesc,part-info,part-info 2,price,starting-at,wishlist-label href,short-description
https://www.turnermotorsport.com/p-11843-griots-garage-spray-on-wax-1-gallon/,Griot's Garage Spray-On Wax 1 gallon,11843,11097,$44.99,,https://www.turnermotorsport.com/c-344-chassis-paint-coatings-sealants-and-rust-conversion#,A base wax enhancer that extends the life of your natural waxes and paint sealants
https://www.turnermotorsport.com/p-11862-griots-garage-speed-shine-1-gallon/,Griot's Garage Speed Shine 1 gallon,11862,11148,$34.99,,https://www.turnermotorsport.com/c-344-chassis-paint-coatings-sealants-and-rust-conversion#,Speed Shine maintains your car's lustrous finish between washings
https://www.turnermotorsport.com/p-2498338-boss-fast-correcting-cream-gallon/,BOSS Fast Correcting Cream - Gallon,2498338,B110G,$130.00,,https://www.turnermotorsport.com/c-344-chassis-paint-coatings-sealants-and-rust-conversion#,"Utilizing high loads of sub-micron abrasives, BOSS Fast Correcting Cream quickly removes severe defects while adding depth and clarity."
https://www.turnermotorsport.com/p-2438622-fine-tip-touch-up-applicators/,Fine-Tip Touch-Up Applicators,2438622,50487,$6.99,,https://www.turnermotorsport.com/c-344-chassis-paint-coatings-sealants-and-rust-conversion#,"The days of using match stick ends to fill paint chips are gone! Make precision touch ups on the smallest chips, dings, and scratches."
https://www.turnermotorsport.com/p-337885-kbs-cavity-coater-internal-sealer/,KBS Cavity Coater Internal Sealer,337885,75100,$25.95,Starting at,https://www.turnermotorsport.com/c-344-chassis-paint-coatings-sealants-and-rust-conversion#,"Coating and sealing the exterior surfaces is only half the battle. There's the internal and hidden areas that are also susceptible to rust and corrosion. This is where KBS Cavity Coater comes in. The Cavity Coater is a one-step super-penetrating sealant that you spray into frame rails, rocker panels, fenders, hoods, doors, etc. and it will protect from the inside out. It's been tested to give 4,000+ hours of salt spray protection. Initial prep is minimal - remove loose pieces and spray onto dry surfaces or de-grease with KBS Klean or Cavity Coater Remover first. Cavity Coater is thin and will work its way into crevices and joints. For the hardest to reach spots, attach the 18"" wand (sold separately). The 12oz aerosol will cover approximately 90 sq-ft. It's the perfect addition to your E36 or E46 rear subframe repair so you can coat the insides of the rear floor.   We also recommend getting the KBS Cavity Coater Remover for clean-up. Use the Remover on excess Coater and to clean the extension wand. The Remover can also be used to prep the surface to be coated. Remover is sold separately, see below."
https://www.turnermotorsport.com/p-338490-kbs-gold-standard-fuel-tank-sealer/,KBS Gold Standard Fuel Tank Sealer,338490,5X00,$10.95,Starting at,https://www.turnermotorsport.com/c-344-chassis-paint-coatings-sealants-and-rust-conversion#,"KBS Fuel Tank Sealer is formulated to coat and seal a fuel tank, including filling small pinholes and weld seams. The final coating is impervious to fuels, alcohol additives, and most solvents. It's a tough ceramic-like barrier against future corrosion. Gold Standard Tank Sealer can applied as a single coat after cleaning and treating the rust areas with KBS Klean and KBS RustBlast (a sample kit is also available with everything you need). Rotate the tank to ensure complete coverage and drain the excess. It's important to not allow the Tank Seal to pool or collect so make sure it drains well. Use any excess to coat and seal the outside of the tank, especially in areas that might have leaks. Tank Seal leaves a very tough and hard surface that is impervious to most solvents, fuels, acids, and road salt. When fully cured it's flexible, allowing it to move as the tank expands and contracts. It's self-leveling too which produces an even finish that will not crack, flake, or peel and will withstand temperatures up 600*F (316*C).   TankSealer is available in    aimed at different projects:  8oz for 5-gallon tanks (motorcycle)  pint for up to 12-gallon tanks (automotive, light truck)  quart for up to 25-gallons tanks     The KBS process will need approximately one week to fully complete (the recommended drying time on the tank is four days). This is perfect for restoration jobs or longer builds where the car can sit for an extended period of time.    In order for the 3-step process to work correctly, you must closely follow KBS' instructions. You can view/download them here prior to receiving your order:"
https://www.turnermotorsport.com/p-339977-kbs-paint-thinner-8oz-or-quart/,KBS Paint Thinner (8oz or quart),339977,6X00,$6.95,Starting at,https://www.turnermotorsport.com/c-344-chassis-paint-coatings-sealants-and-rust-conversion#,"KBS seal and coating products sometimes need to be thinned to work as intended (running through a spray gun for instance). And because KBS products have special formulations any off-the-shelf paint thinner may not give the expected results. The KBS #1 Thinner is especially formulated to thin their products. Regular solvents may contain moisture that can adversely affect the performance of their coatings. When in doubt, stick with what the manufacturer recommends.   Available in 8oz or quart sized containers."
https://www.turnermotorsport.com/p-580304-foaming-surface-wash-35-oz-griots-garage/,Foaming Surface Wash - 35 oz - Griot's Garage,580304,B3203,$19.99,,https://www.turnermotorsport.com/c-344-chassis-paint-coatings-sealants-and-rust-conversion#,"This fluffy foam gently loosens, lifts, encapsulates, and releases contaminants, deep cleaning your paint while avoiding wash-induced"
https://www.turnermotorsport.com/p-340325-kbs-rustseal-waterproof-and-chemical-resistant-chassis-coating/,"KBS RustSeal Waterproof and Chemical-Resistant Chassis Coating
    ...",340325,KBS-RUST-SEAL,$17.95,Starting at,https://www.turnermotorsport.com/c-344-chassis-paint-coatings-sealants-and-rust-conversion#,"KBS RustSeal is a permanent, single-component, ceramic-like coating that is applied over    rust and forms an impenetrable barrier against salt, chemicals, acids, and other harmful materials. Rust Seal is brushed, rolled, or sprayed on after treating the area with KBS Klean and RustBlast. Rust Seal hardens with exposure to atmospheric moisture - it gets harder and more durable when exposed to the atmosphere! It's extremely durable and very resistant to chips, scratches, cracks, or peeling which helps ensure the rusted area will never be re-exposed. It's also flexible so it bends with the surface. You can install it with a brush, roller, or with a spray gun (when properly diluted) and it's self-leveling. We use it on BMW subframe repairs, reinforcements, roll cage, and other chassis work. It's often used in restoration and hot rod shops as a frame coating. It's extremely tough and durable and can be painted with any top coat. Top coating is recommended as a finish because KBS Seal will change color after prolonged UV exposure (but its protective properties will not change). This is an excellent coating to use for E36 or E46 rear subframe reinforcements, coating and sealing subframes, sheetmetal, chassis reinforcements, roll cages, and so much more.   For the best adhesion, the surface    prepped with KBS Klean and RustBlast. These products will strip away contaminants, grease, and oils, as well as neutralize the rust and prepare the rusted areas for sealing. The KBS instructions are very clear and easy to follow. A handy 3-step sampler kit is available with enough RustSeal to cover 12sq ft (see below).   In order for the 3-step process to work correctly, you must closely follow KBS' instructions. You can view/download them here prior to receiving your order:"
https://www.turnermotorsport.com/p-338952-kbs-blacktop-waterproof-and-chemical-resistant-topcoat/,KBS BlackTop Waterproof and Chemical-Resistant Topcoat,338952,KBS-BLACKTOP,$21.95,Starting at,https://www.turnermotorsport.com/c-344-chassis-paint-coatings-sealants-and-rust-conversion#,"KBS BlackTop is similar to their brushable Rust Seal but used as a UV-resistant topcoat. It's a permanent, single-component, ceramic-like coating that is applied over    rust and forms an impenetrable barrier against salt, chemicals, acids, and other harmful materials. BlackTop is applied after treating the area with KBS Klean and RustBlast or can be applied directly over Rust Seal as a UV-stable topcoat. Just like Rust Seal, it hardens with exposure to atmospheric moisture - it gets harder and more durable when exposed to the atmosphere! It's extremely durable and very resistant to chips, scratches, cracks, or peeling which helps ensure the rusted area will never be re-exposed. It's also flexible so it bends with the surface. This is an excellent coating to use for E36 or E46 rear subframe reinforcements, coating and sealing subframes, sheetmetal, chassis reinforcements, roll cages, and so much more. It's often used in restoration and hot rod shops as a frame coating. It also works great as a touch up or finisher for Rust Seal applications.   For the best adhesion, the surface should be cleaned with KBS Klean. BlackTop works best over a surface that has been pre-sealed with KBS RustSeal. Apply a light self-etching primer and then apply BlackTop. The KBS instructions are very clear and easy to follow.   BlackTop is available as a clear topcoat called Diamond Finish (see below)."
https://www.turnermotorsport.com/p-204873-kbs-cavity-coater-remover/,KBS Cavity Coater Remover,204873,75199,$20.95,,https://www.turnermotorsport.com/c-344-chassis-paint-coatings-sealants-and-rust-conversion#,"KBS Cavity Coater Remover is a solvent-based degreaser that is most commonly used in prepping and clean-up for the Cavity Coater sealant. For finished areas where you don't want coverage with the Cavity Coater, simply spray the Remover for clean-up. It also works great for degreasing and cleansing areas before coating. This is also the best product to clean the inside of the Cavity Coater Wand. Simply attach the Wand to the Remover can and spray."
https://www.turnermotorsport.com/p-11836-griots-garage-spray-on-car-wash/,Griot's Garage Spray-On Car Wash,11836,11066,$49.99,,https://www.turnermotorsport.com/c-344-chassis-paint-coatings-sealants-and-rust-conversion?No=50&Nrpp=50#,"Spray-On Car Wash's special high-lubricity formula provides a quick, safe wash without water. It whisks away dust, dirt, and road"