product-img-link href,cleanDesc,part-info,part-info 2,price,wishlist-label href,short-description
https://www.turnermotorsport.com/p-379096-race-polyurethane-rear-subframe-bushing-set-front-mount/,Powerflex Race Polyurethane Rear Subframe Bushing Set (Anti-squat) -...,379096,PFR5-1220BX2,$228.99,https://www.turnermotorsport.com/c-600-bmw-subframe?No=96&Nrpp=48#,"Raises front of the rear subframe giving additional anti-squat similar to the M range. For standard subframe location use PFR5-420. Tasked with keeping the vehicles rear end firmly mounted while absorbing noise, vibration, and harshness (NVH) factory rubber subframe bushings were engineered to provide a balance of control while keeping the ride quality soft and supple. As a factory bushings age, they become brittle and begin to harden. When this happens the bushing will actually shrink and allow excess play, or movement in the subframe. This is typically felt by a sudden jerk or ""thunking"" noise under acceleration and is a leading cause of ""sloppy"" or ""loose"" suspension feel. By replacing the bushings with full polyurethane this play is eliminated since the subframe is being held in place by a much stiffer material that will not harden or shrink over time. Additionally, the inherent stiffness of the urethane material translates body forces much more directly. This means steering and acceleration inputs from the driver are effectively transferred to the wheels and vital road information is transmitted properly from the wheels to the driver. Powerflex street bushings are ideal for street driven vehicles and those that see occasional autocross or track time. Need bushings for a dedicated track car? Powerflex Black Series bushings are the ultimate in track and race bushings. Featuring 95A durometer polyurethane, Black Series bushings are 25% stiffer than street bushings. Engineered to perform, Powerflex performance polyurethane bushings offer a supreme level of control, while still providing enough comfort for the street, with advanced polyurethane that reduces NVH that often accompanies lesser bushings. Expect improved steering feel, turn in, more responsive handling and overall improved chassis composure with Powerflex performance polyurethane control arm bushings. Poweflex is a leading manufacturer of aftermarket suspension bushings. Using state of the art design and manufacturing, all replacement bushings are engineered to out-perform and out-last the ones that came in the car. Each line of bushings is meticulously tested and then re-tested to ensure perfect fitment and enduring quality through the life of the vehicle. A full lifetime warranty backs every one of their products and demonstrates the level of confidence and commitment Powerflex has to their customers."
https://www.turnermotorsport.com/p-398505-low-compliance-bushing-kit-for-the-bmw-e8x-128i-135i-135is-and-e9x-325i-328i-330i-335i-335is/,Dinan Performance Bushing Kit - E8x 128i/135i/135is and E9x 325i/328...,398505,D280-0004A,$756.95,https://www.turnermotorsport.com/c-600-bmw-subframe?No=96&Nrpp=48#,"The performance bushing kit from Dinan adds stiffer bushings to both the rear subframe and the front lower control arm. This helps increase the steering feel and responsiveness, as well as making handling much more predictable."
https://www.turnermotorsport.com/p-376545-performance-polyurethane-differential-bushing-front-position/,"Powerflex Performance Polyurethane Differential Bushing - E60, E61, ...",376545,PFR5-725X2,$78.99,https://www.turnermotorsport.com/c-600-bmw-subframe?No=96&Nrpp=48#,"Differential bushings are responsible for keeping the differential in solid alignment while dampening drivetrain vibration. While OE rubber bushings are fine when they are new from the factory, aged and worn out rubber bushings create a multitude of issues that can range from annoying to dangerous. As a factory bushing ages, it begins to harden and become brittle. When this happens the bushing will actually shrink and allow for movement at the differential mounting point. At this point, the differential is free to shift under load causing a noticeable clunking noise under acceleration and deceleration and massively increasing the stress on the driveshaft and axles. Manual transmissions suffer the worst from this as it can make shifting difficult since the differential will shift when the clutch is engaged and disengaged."
https://www.turnermotorsport.com/p-376438-performance-polyurethane-differential-bushing-rear-position/,Powerflex Polyurethane Differential Bushing - E6X Non-M,376438,PFR5-726X2,$57.98,https://www.turnermotorsport.com/c-600-bmw-subframe?No=96&Nrpp=48#,
https://www.turnermotorsport.com/p-554715-rear-diff-rear-mounting-bushing-race/,"Powerflex Rear Diff Rear Mounting Bushing - F8X M2,M3,M4",554715,PFR5-4026B,$118.99,https://www.turnermotorsport.com/c-600-bmw-subframe?No=96&Nrpp=48#,"Differential bushings are responsible for keeping the differential in solid alignment while dampening drivetrain vibration. While OE rubber bushings are fine when they are new from the factory, aged and worn out rubber bushings create a multitude of issues that can range from annoying to dangerous. As a factory bushing ages, it begins to harden and become brittle. When this happens the bushing will actually shrink and allow for movement at the differential mounting point. At this point, the differential is free to shift under load causing a noticeable clunking noise under acceleration and deceleration and massively increasing the stress on the driveshaft and axles. Manual transmissions suffer the worst from this as it can make shifting difficult since the differential will shift when the clutch is engaged and disengaged."
https://www.turnermotorsport.com/p-399251-bmw-lemfoerder-axle-beam-mounting/,"Genuine BMW Rubber Mounting - 33311128670 - E34, E32",399251,33311128670,$34.56,https://www.turnermotorsport.com/c-600-bmw-subframe?No=96&Nrpp=48#,"Exposure to the elements and stress/pressure can lead to failing and splitting subframe bushings. Ensure your subframe is mounted perfectly steady to prevent vibrations, knocks, suspension issues, and potential damage to the body of the vehicle or suspension components. OEM Lemforder is the perfect replacement to make sure that everything is mounted properly."
https://www.turnermotorsport.com/p-379321-race-polyurethane-rear-differential-bushings-front-mount/,"Race Polyurethane Rear Differential Bushings, Front Mount - E38, E39...",379321,PFR5-525B,$46.80,https://www.turnermotorsport.com/c-600-bmw-subframe?No=96&Nrpp=48#,"Differential bushings are responsible for keeping the differential in solid alignment while dampening drivetrain vibration. While OE rubber bushings are fine when they are new from the factory, aged and worn out rubber bushings create a multitude of issues that can range from annoying to dangerous. As a factory bushing ages, it begins to harden and become brittle. When this happens the bushing will actually shrink and allow for movement at the differential mounting point. At this point, the differential is free to shift under load causing a noticeable clunking noise under acceleration and deceleration and massively increasing the stress on the driveshaft and axles. Manual transmissions suffer the worst from this as it can make shifting difficult since the differential will shift when the clutch is engaged and disengaged."
https://www.turnermotorsport.com/p-577568-rear-subframe-bushings-325-ix-only/,"Condor Speed Shop Solid Rear Subframe Bushings - E30 325ix
        ...",577568,RSBIX,$109.99,https://www.turnermotorsport.com/c-600-bmw-subframe?No=96&Nrpp=48#,"Solid Rear Subframe Bushing Set - UHMW with aluminum sleeves. The subframe and differential mounting point is the heart of the rear suspension in an E30. When they move, so do all of the rear suspension mounting points. Replacing the stock rubber subframe and differential bushings with UHMW will limit drivetrain and suspension movement and keep your car’s suspension geometry the way it’s supposed to be. They will last longer than the original rubber and do not 'wind up' under load/unload, transferring more power through the axles to the wheels."
https://www.turnermotorsport.com/p-398299-bmw-lemfoerder-axle-beam-mounting/,"OEM Lemforder Rear Subframe Bushing - E38 740i 740iL 750iL
        ...",398299,33311090956,$25.95,https://www.turnermotorsport.com/c-600-bmw-subframe?No=144&Nrpp=48#,"Exposure to the elements and stress/pressure can lead to failing and splitting subframe bushings. Ensure your subframe is mounted perfectly steady to prevent vibrations, knocks, suspension issues, and potential damage to the body of the vehicle or suspension components. OEM Lemforder is the perfect replacement to make sure that everything is mounted properly."
https://www.turnermotorsport.com/p-376511-race-polyurethane-subframe-bushing-set/,Race Polyurethane Subframe Bushing Set - E34,376511,PFR5-507BX2,$114.99,https://www.turnermotorsport.com/c-600-bmw-subframe?No=144&Nrpp=48#,"Tasked with keeping the vehicles rear end firmly mounted while absorbing noise, vibration, and harshness (NVH) factory rubber subframe bushings were engineered to provide a balance of control while keeping the ride quality soft and supple. As a factory bushings age, they become brittle and begin to harden. When this happens the bushing will actually shrink and allow excess play, or movement in the subframe. This is typically felt by a sudden jerk or ""thunking"" noise under acceleration and is a leading cause of ""sloppy"" or ""loose"" suspension feel. By replacing the bushings with full polyurethane this play is eliminated since the subframe is being held in place by a much stiffer material that will not harden or shrink over time. Additionally, the inherent stiffness of the urethane material translates body forces much more directly. This means steering and acceleration inputs from the driver are effectively transferred to the wheels and vital road information is transmitted properly from the wheels to the driver."
https://www.turnermotorsport.com/p-376495-performance-polyurethane-subframe-bushing-set/,"Powerflex Performance Polyurethane Subframe Bushing Set - E53
     ...",376495,PFR5-908X4,$529.99,https://www.turnermotorsport.com/c-600-bmw-subframe?No=144&Nrpp=48#,"Tasked with keeping the vehicles rear end firmly mounted while absorbing noise, vibration, and harshness (NVH) factory rubber subframe bushings were engineered to provide a balance of control while keeping the ride quality soft and supple. As a factory bushings age, they become brittle and begin to harden. When this happens the bushing will actually shrink and allow excess play, or movement in the subframe. This is typically felt by a sudden jerk or ""thunking"" noise under acceleration and is a leading cause of ""sloppy"" or ""loose"" suspension feel. By replacing the bushings with full polyurethane this play is eliminated since the subframe is being held in place by a much stiffer material that will not harden or shrink over time. Additionally, the inherent stiffness of the urethane material translates body forces much more directly. This means steering and acceleration inputs from the driver are effectively transferred to the wheels and vital road information is transmitted properly from the wheels to the driver."
https://www.turnermotorsport.com/p-379930-race-polyurethane-subframe-bushing-insert-set-front/,"Race Polyurethane Subframe Bushing Insert Set, front - E70
        ...",379930,PFR5-1421BX2,$96.99,https://www.turnermotorsport.com/c-600-bmw-subframe?No=144&Nrpp=48#,"Tasked with keeping the vehicles rear end firmly mounted while absorbing noise, vibration, and harshness (NVH) factory rubber subframe bushings were engineered to provide a balance of control while keeping the ride quality soft and supple. As a factory bushings age, they become brittle and begin to harden. When this happens the bushing will actually shrink and allow excess play, or movement in the subframe. This is typically felt by a sudden jerk or ""thunking"" noise under acceleration and is a leading cause of ""sloppy"" or ""loose"" suspension feel. By replacing the bushings with full polyurethane this play is eliminated since the subframe is being held in place by a much stiffer material that will not harden or shrink over time. Additionally, the inherent stiffness of the urethane material translates body forces much more directly. This means steering and acceleration inputs from the driver are effectively transferred to the wheels and vital road information is transmitted properly from the wheels to the driver."
https://www.turnermotorsport.com/p-384021-race-rear-subframe-bushing-front-position/,Powerflex Race Polyurethane Rear Subframe Bushing Insert Set - Front...,384021,PFR5-4614BX2,$86.99,https://www.turnermotorsport.com/c-600-bmw-subframe?No=144&Nrpp=48#,"Fits into voids of OE bushings: 33316770783 and 33316770784 Tasked with keeping the vehicles rear end firmly mounted while absorbing noise, vibration, and harshness (NVH) factory rubber subframe bushings were engineered to provide a balance of control while keeping the ride quality soft and supple. As a factory bushings age, they become brittle and begin to harden. When this happens the bushing will actually shrink and allow excess play, or movement in the subframe. This is typically felt by a sudden jerk or ""thunking"" noise under acceleration and is a leading cause of ""sloppy"" or ""loose"" suspension feel. By replacing the bushings with full polyurethane this play is eliminated since the subframe is being held in place by a much stiffer material that will not harden or shrink over time. Additionally, the inherent stiffness of the urethane material translates body forces much more directly. This means steering and acceleration inputs from the driver are effectively transferred to the wheels and vital road information is transmitted properly from the wheels to the driver. Powerflex Black Series bushings are the ultimate in track and race bushings. Featuring 95A durometer polyurethane, Black Series bushings are 25% stiffer than street bushings. Engineered to perform, Powerflex performance polyurethane bushings offer a supreme level of control, while still providing enough comfort for the street, with advanced polyurethane that reduces NVH that often accompanies lesser bushings. Expect improved steering feel, turn in, more responsive handling and overall improved chassis composure with Powerflex performance polyurethane control arm bushings. Poweflex is a leading manufacturer of aftermarket suspension bushings. Using state of the art design and manufacturing, all replacement bushings are engineered to out-perform and out-last the ones that came in the car. Each line of bushings is meticulously tested and then re-tested to ensure perfect fitment and enduring quality through the life of the vehicle. A full lifetime warranty backs every one of their products and demonstrates the level of confidence and commitment Powerflex has to their customers. This part fits the following BMWs: 1999 - 2001 E46 Convertible 323ci 325ci 330ci 2002-2006 E46 Convertible 325ci 330ci 1998 - 2001 E46 323ci 325ci 330ci 2002 - 2006 E46 325ci 330ci 1998 - 2001 E46 Touring 323i 325i 2002 - 2006 E46 Touring 325i 325xi 1998 - 2001 E46 Sedan 320i 323i 325i 328i 330i 2002 - 2006 E46 Sedan 320i 325i 325xi 330i 330xi"
https://www.turnermotorsport.com/p-639965-performance-polyurethane-subframe-bushings-front-position-set/,"Performance Polyurethane Subframe Bushings - Front Position Set
   ...",639965,PFR5-720BLK,$169.99,https://www.turnermotorsport.com/c-600-bmw-subframe?No=144&Nrpp=48#,
https://www.turnermotorsport.com/p-379931-race-polyurethane-subframe-bushing-insert-set-rear/,"Race Polyurethane Subframe Bushing insert Set, Rear - E70",379931,PFR5-1423BX2,$96.99,https://www.turnermotorsport.com/c-600-bmw-subframe?No=144&Nrpp=48#,"Tasked with keeping the vehicles rear end firmly mounted while absorbing noise, vibration, and harshness (NVH) factory rubber subframe bushings were engineered to provide a balance of control while keeping the ride quality soft and supple. As a factory bushings age, they become brittle and begin to harden. When this happens the bushing will actually shrink and allow excess play, or movement in the subframe. This is typically felt by a sudden jerk or ""thunking"" noise under acceleration and is a leading cause of ""sloppy"" or ""loose"" suspension feel. By replacing the bushings with full polyurethane this play is eliminated since the subframe is being held in place by a much stiffer material that will not harden or shrink over time. Additionally, the inherent stiffness of the urethane material translates body forces much more directly. This means steering and acceleration inputs from the driver are effectively transferred to the wheels and vital road information is transmitted properly from the wheels to the driver."
https://www.turnermotorsport.com/p-379940-race-polyurethane-subframe-bushing-insert-set-rear/,"Race Polyurethane Subframe Bushing Insert Set, Rear - E39",379940,PFR5-523BX2,$82.99,https://www.turnermotorsport.com/c-600-bmw-subframe?No=144&Nrpp=48#,"Tasked with keeping the vehicles rear end firmly mounted while absorbing noise, vibration, and harshness (NVH) factory rubber subframe bushings were engineered to provide a balance of control while keeping the ride quality soft and supple. As a factory bushings age, they become brittle and begin to harden. When this happens the bushing will actually shrink and allow excess play, or movement in the subframe. This is typically felt by a sudden jerk or ""thunking"" noise under acceleration and is a leading cause of ""sloppy"" or ""loose"" suspension feel. By replacing the bushings with full polyurethane this play is eliminated since the subframe is being held in place by a much stiffer material that will not harden or shrink over time. Additionally, the inherent stiffness of the urethane material translates body forces much more directly. This means steering and acceleration inputs from the driver are effectively transferred to the wheels and vital road information is transmitted properly from the wheels to the driver."
https://www.turnermotorsport.com/p-577958-rear-subframe-bushings-e34/,Condor Speed Shop Rear Subframe Bushings - E34 BMW,577958,E34RSB,$109.99,https://www.turnermotorsport.com/c-600-bmw-subframe?No=144&Nrpp=48#,"The subframe and differential mounting point is the heart of the rear suspension in an E34. When they move, so do all of the rear suspension mounting points. Replacing the stock rubber subframe and differential bushings with UHMW will limit drivetrain and suspension movement and keep your car’s suspension geometry the way it’s supposed to be. They will last longer than the original rubber and do not 'wind up' under load/unload, transferring more power through the axles to the wheels. Recommended for street or race use. Set of 2 subframe bushings."
https://www.turnermotorsport.com/p-376502-performance-polyurethane-subframe-bushing-insert-set/,Powerflex Performance Polyurethane Subframe Bushing Insert Set - E60...,376502,PFR5-721X2,$78.99,https://www.turnermotorsport.com/c-600-bmw-subframe?No=144&Nrpp=48#,"Tasked with keeping the vehicles rear end firmly mounted while absorbing noise, vibration, and harshness (NVH) factory rubber subframe bushings were engineered to provide a balance of control while keeping the ride quality soft and supple. As a factory bushings age, they become brittle and begin to harden. When this happens the bushing will actually shrink and allow excess play, or movement in the subframe. This is typically felt by a sudden jerk or ""thunking"" noise under acceleration and is a leading cause of ""sloppy"" or ""loose"" suspension feel. By replacing the bushings with full polyurethane this play is eliminated since the subframe is being held in place by a much stiffer material that will not harden or shrink over time. Additionally, the inherent stiffness of the urethane material translates body forces much more directly. This means steering and acceleration inputs from the driver are effectively transferred to the wheels and vital road information is transmitted properly from the wheels to the driver."
https://www.turnermotorsport.com/p-379939-race-polyurethane-subframe-bushing-set-rear/,"Race Polyurethane Subframe Bushing Set, Rear - E39",379939,PFR5-522BX2,$158.99,https://www.turnermotorsport.com/c-600-bmw-subframe?No=144&Nrpp=48#,"Tasked with keeping the vehicles rear end firmly mounted while absorbing noise, vibration, and harshness (NVH) factory rubber subframe bushings were engineered to provide a balance of control while keeping the ride quality soft and supple. As a factory bushings age, they become brittle and begin to harden. When this happens the bushing will actually shrink and allow excess play, or movement in the subframe. This is typically felt by a sudden jerk or ""thunking"" noise under acceleration and is a leading cause of ""sloppy"" or ""loose"" suspension feel. By replacing the bushings with full polyurethane this play is eliminated since the subframe is being held in place by a much stiffer material that will not harden or shrink over time. Additionally, the inherent stiffness of the urethane material translates body forces much more directly. This means steering and acceleration inputs from the driver are effectively transferred to the wheels and vital road information is transmitted properly from the wheels to the driver."
https://www.turnermotorsport.com/p-379937-race-polyurethane-subframe-bushing-set-front/,"Race Polyurethane Subframe Bushing Set, front - E39 Non-M",379937,PFR5-520BX2,$158.99,https://www.turnermotorsport.com/c-600-bmw-subframe?No=144&Nrpp=48#,"Tasked with keeping the vehicles rear end firmly mounted while absorbing noise, vibration, and harshness (NVH) factory rubber subframe bushings were engineered to provide a balance of control while keeping the ride quality soft and supple. As a factory bushings age, they become brittle and begin to harden. When this happens the bushing will actually shrink and allow excess play, or movement in the subframe. This is typically felt by a sudden jerk or ""thunking"" noise under acceleration and is a leading cause of ""sloppy"" or ""loose"" suspension feel. By replacing the bushings with full polyurethane this play is eliminated since the subframe is being held in place by a much stiffer material that will not harden or shrink over time. Additionally, the inherent stiffness of the urethane material translates body forces much more directly. This means steering and acceleration inputs from the driver are effectively transferred to the wheels and vital road information is transmitted properly from the wheels to the driver."
https://www.turnermotorsport.com/p-379934-race-polyurethane-differential-bushing-set-front/,"Race Polyurethane Differential Bushing Set, Front E36 M3",379934,PFR5-324B,$52.99,https://www.turnermotorsport.com/c-600-bmw-subframe?No=144&Nrpp=48#,"Differential bushings are responsible for keeping the differential in solid alignment while dampening drivetrain vibration. While OE rubber bushings are fine when they are new from the factory, aged and worn out rubber bushings create a multitude of issues that can range from annoying to dangerous. As a factory bushing ages, it begins to harden and become brittle. When this happens the bushing will actually shrink and allow for movement at the differential mounting point. At this point, the differential is free to shift under load causing a noticeable clunking noise under acceleration and deceleration and massively increasing the stress on the driveshaft and axles. Manual transmissions suffer the worst from this as it can make shifting difficult since the differential will shift when the clutch is engaged and disengaged."
https://www.turnermotorsport.com/p-379938-race-polyurethane-subframe-bushing-insert-set-front/,"Race Polyurethane Subframe Bushing Insert Set, Front - E39
        ...",379938,PFR5-521BX2,$82.99,https://www.turnermotorsport.com/c-600-bmw-subframe?No=144&Nrpp=48#,"Tasked with keeping the vehicles rear end firmly mounted while absorbing noise, vibration, and harshness (NVH) factory rubber subframe bushings were engineered to provide a balance of control while keeping the ride quality soft and supple. As a factory bushings age, they become brittle and begin to harden. When this happens the bushing will actually shrink and allow excess play, or movement in the subframe. This is typically felt by a sudden jerk or ""thunking"" noise under acceleration and is a leading cause of ""sloppy"" or ""loose"" suspension feel. By replacing the bushings with full polyurethane this play is eliminated since the subframe is being held in place by a much stiffer material that will not harden or shrink over time. Additionally, the inherent stiffness of the urethane material translates body forces much more directly. This means steering and acceleration inputs from the driver are effectively transferred to the wheels and vital road information is transmitted properly from the wheels to the driver."
