product-img-link href,cleanDesc,part-info,part-info 2,price,wishlist-label href,short-description,starting-at
https://www.turnermotorsport.com/p-11790-e9x-335ixi-n54-stage-1-turner-power-package-with-afe-dci-intake/,"E9X 335i/xi N54 Stage 1 Turner Power Package (with aFe DCI Intake)
...",11790,TMS11790,"$1,226.51",https://www.turnermotorsport.com/c-218-bmw-performance-packages?No=50&Nrpp=50#,"Our Stage 1 kit features a cold-air intake kit and performance software for a staggering increase in power and torque on the N54 motor. We offer this package with the aFe Dual Cone Intake (DCI) to open up the breathing. The larger surface area of the filters allows more air to enter the engine - creating more power and torque, a richer engine sound, and better throttle response. The kit is supplied complete with aFe Pro5R filters, mounting shield, intake tubes, sealing materials, hardware, and install instructions. The torque increase from low-mid RPM is sensational.   We have paired the aFe DCI with the Cobb AccessPort performance software. The Cobb software tool puts multiple tuning stages in the palm of your hand. Our Stage 1 Performance Package is aligned with the Cobb Stage 1 tuning maps (91 or 93+ octane fuel). Simply plug it in, select the Stage 1 map with your octane preference, and install. Select different maps for other upgrades, throttle settings, octane ratings, valet mode, or revert back to stock! If you're moving up in Stages simply download a new file from the Cobb website and update your AccessPort programmer! The AccessPort triples as a diagnostic tester/reader and a data logger. It's the most feature-packed programmer on the market today.   We have taken the guesswork out of choosing the best upgrades for the N54 engine. If you follow the upgrade path we have laid out you will have very satisfying and reliable results. This Stage 1 package is a great 'bang for the buck' upgrade - this power kit makes more power and torque at every RPM and makes a fantastic snarling sound every time you dip into the throttle. Note that peak power gains are quoted above but this package has even bigger performance gains in the lower RPM!     2007-2010    335i 335xi 335i xDrive - Sedan  2007-2010    335i 335is* 335xi 335i xDrive - Coupe  2007-2010    335i - Convertible  * 335is horsepower gains are lower due to the factory power boost in the ""is"" package",
https://www.turnermotorsport.com/p-11783-e82-135i-n54-stage-1-turner-power-package-with-afe-dci-intake/,"E82/E88 135i N54 Stage 1 Turner Power Package (with aFe DCI Intake)
...",11783,TMS11783,"$1,408.39",https://www.turnermotorsport.com/c-218-bmw-performance-packages?No=50&Nrpp=50#,"Our Stage 1 kit features a cold-air intake kit and performance software for a staggering increase in power and torque on the N54 motor. We offer this package with the aFe Dual Cone Intake (DCI) to open up the breathing. The larger surface area of the filters allows more air to enter the engine - creating more power and torque, a richer engine sound, and better throttle response. The kit is supplied complete with aFe Pro5R filters, mounting shield, intake tubes, sealing materials, hardware, and install instructions. The torque increase from low-mid RPM is sensational.   We have paired the aFe DCI with the Cobb AccessPort performance software. The Cobb software tool puts multiple tuning stages in the palm of your hand. Our Stage 1 Performance Package is aligned with the Cobb Stage 1 tuning maps (91 or 93+ octane fuel). Simply plug it in, select the Stage 1 map with your octane preference, and install. Select different maps for other upgrades, throttle settings, octane ratings, valet mode, or revert back to stock! If you're moving up in Stages simply download a new file from the Cobb website and update your AccessPort programmer! The AccessPort triples as a diagnostic tester/reader and a data logger. It's the most feature-packed programmer on the market today.   We have taken the guesswork out of choosing the best upgrades for the N54 engine. If you follow the upgrade path we have laid out you will have very satisfying and reliable results. This Stage 1 package is a great 'bang for the buck' upgrade - this power kit makes more power and torque at every RPM and makes a fantastic snarling sound every time you dip into the throttle. Note that peak power gains are quoted above but this package has even bigger performance gains in the lower RPM!     2008-2010    135i (N54 engine)",
https://www.turnermotorsport.com/p-340219-e82-135i-n54-stage-2-turner-power-package/,E82 135i N54 Stage 2+ Turner Power Package,340219,TMS224340,"$2,630.85",https://www.turnermotorsport.com/c-218-bmw-performance-packages?No=50&Nrpp=50#,"For a 135i race or competition car, the exhaust is an important area for upgrades. Removing the catalytic converters eliminates a choke point in the exhaust system and will free up power and torque. It also eliminates the cats as a potential failure point - a broken up cat can clog the exhaust and severly damage your motor. These cat-less DP from CP-E are some of the best we have seen. They are made from 304 stainless steel mandrel-bent piping. The flow characteristics of the piping was especially important to maximize the efficiency of the turbos. With less restriction the turbos work more efficiently and last longer.   In this package we also address the shortcomings in the factory intercooler setup. With higher boost comes more heat in the intake air and the factory intercooler does a poor job of cooling that air before it enters the engine. In the Stage 2+ package we offer multiple intercooler upgrades in increasing levels of capacity - Wagner Evo I, Wagner Evo II, and Active Autowerke Race FMIC. Each is a significant upgrade over the stock 135i FMIC. The Wagner Evo I is our standard FMIC upgrade and fits with the stock piping and requires no modification for fitment. The Wagner Evo II has greater cooling capacity and silicone piping to the stock intake. Some minor modification to plastic trim pieces is required for installation. The AA Race FMIC is the biggest and most extensive that we sell. It features a ram-air effect thanks to a special shroud around the intercooler. The installation is more extensive because AA has chosen to locate the FMIC where it will catch the most airflow from the car's frontal area.   The aFe Dual Cone intake and Cobb Accessport programmer complete the Stage 2+ package. The larger surface area of the aFe cone filters allows more air to enter the engine - creating more power and torque, a richer engine sound, and better throttle response. The kit is supplied complete with aFe Pro5R filters, mounting shield, intake tubes, sealing materials, hardware, and install instructions. The torque increase and sound from the open intake from low-mid RPM is sensational.   The Cobb software tool puts multiple tuning stages in the palm of your hand. Our Stage 2+ package lines up with the Cobb Stage 2+ tuning maps for an intake and DP (91 or 93+ octane fuel). Simply download the Stage 2+ race map from the Cobb website, plug it in, and install. Select different maps for other upgrades, throttle settings, octane ratings, valet mode, or revert back to stock! If you're moving among Stages simply download a new file from the Cobb website and update your AccessPort programmer! The AccessPort triples as a diagnostic tester/reader and a data logger. It's the most feature-packed programmer on the market today.   * Note that peak power gains are quoted remain the same as Stage 2 but the cooler intake air means there is less of a chance the engine computer will cut power from heatsoak. Adding a full exhaust (from the DP) will make this a Stage 3 kit in the Cobb tuning catalog.       2008-2010    135i (N54 engine)",Starting at
https://www.turnermotorsport.com/p-338763-e60-535ixi-07-10-stage-1-motorsport-performance-package/,E60 535i/xi 07-10 Stage 1 Motorsport Performance Package,338763,TMS11770,"$1,226.51",https://www.turnermotorsport.com/c-218-bmw-performance-packages?No=50&Nrpp=50#,"Peak Power Gain:    Octane:    or higher   Our Stage 1 kit features a cold-air intake kit and performance software for a staggering increase in power and torque. We offer this package with the aFe Dual Cone Intake (DCI) to open up the breathing. The larger surface area of the filters allows more air to enter the engine - creating more power and torque, a richer engine sound, and better throttle response. The kit is supplied complete with aFe Pro5R filters, mounting shield, intake tubes, sealing materials, hardware, and install instructions. The torque increase from low-mid RPM is sensational.   We have paired the aFe DCI with the Cobb AccessPort performance software. The Cobb software tool puts multiple tuning stages in the palm of your hand. Our Stage 1 Performance Package is aligned with the Cobb Stage 1 tuning map. Simply plug it in, select the Stage 1 map with your octane preference, and install. Select different maps for other upgrades, throttle settings, octane ratings, valet mode, or revert back to stock! If you're moving up in Stages simply download a new file from the Cobb website and update your AccessPort programmer! The AccessPort triples as a diagnostic tester/reader and a data logger. It's the most feature-packed programmer on the market today.   We have taken the guesswork out of choosing the best upgrades for the N54 engine. If you follow the upgrade path we have laid out you will have very satisfying and reliable results. This Stage 1 package is a great 'bang for the buck' upgrade - this power kit makes more power and torque at every RPM and makes a fantastic snarling sound every time you dip into the throttle. Note that peak power gains are quoted above but this package has even bigger performance gains in the lower RPM!!     aFe Dual-Cone Intake (filter, mounting shield, intake tubes)  Cobb AccessPort Performance Programmer     2007-2010    535i 535xi 535i xDrive",Starting at
https://www.turnermotorsport.com/p-224335-e9x-335ixi-n54-stage-1-turner-power-package/,E9X 335i/xi N54 Stage 1+ Turner Power Package,224335,TMS224335,"$1,740.76",https://www.turnermotorsport.com/c-218-bmw-performance-packages?No=50&Nrpp=50#,"More power = more heat. It's easy to make more power one time but to continue making that power consistently requires careful planning and design. With the additional boost the air entering the engine is also warmer, making the intercooler more important than ever. In testing, the stock BMW intercooler was quickly overwhelmed and cannot keep the intake air cool enough. The engine computer recognizes that and dials back the boost. A more efficient intercooler will keep boost levels up, delivering consistently higher boost levels. The Stage 1+ package includes a Wagner Evo I plug and play intercooler upgrade. We get great feedback from our customers and technicians about the Wagner FMIC - it's a direct bolt in part using all of the factory piping and it offers 85% more surface area than the factory intercooler.   The aFe Dual Cone intake and Cobb Accessport programmer complete the Stage 1+ package. The larger surface area of the aFe cone filters allows more air to enter the engine - creating more power and torque, a richer engine sound, and better throttle response. The kit is supplied complete with aFe Pro5R filters, mounting shield, intake tubes, sealing materials, hardware, and install instructions. The torque increase and sound from the open intake from low-mid RPM is sensational.   The Cobb software tool puts multiple tuning stages in the palm of your hand. Our Stage 1+ package lines up with the Cobb Stage 1 tuning maps for an intake and FMIC (91 or 93+ octane fuel). Simply download the Stage 1+ map from the Cobb website, plug it in, and install. Select different maps for other upgrades, throttle settings, octane ratings, valet mode, or revert back to stock! If you're moving up in Stages simply download a new file from the Cobb website and update your AccessPort programmer! The AccessPort triples as a diagnostic tester/reader and a data logger. It's the most feature-packed programmer on the market today.   We have taken the guesswork out of choosing the best upgrades for the N54 engine. If you follow the upgrade path we have laid out you will have very satisfying and reliable results. The addition of the larger intercooler makes Stage 1 more enjoyable and won't let you down at the track or dragstrip. * Note that peak power gains are quoted remain the same as Stage 1 but the cooler intake air means there is less of a chance the engine computer will cut power from heatsoak.     2007-2010    335i 335xi 335i xDrive - Sedan  2007-2010    335i 335is* 335xi 335i xDrive - Coupe  2007-2010    335i - Convertible  * 335is horsepower gains are lower due to the factory power boost in the ""is"" package",
https://www.turnermotorsport.com/p-582818-turner-e82e9x-n52-performance-package-stage-1/,Turner E82/E9X N52 Performance Package - Stage 1,582818,N52S1PPKT,"$1,224.36",https://www.turnermotorsport.com/c-218-bmw-performance-packages?No=50&Nrpp=50#,"If you want to get the most out of your BMW's N52 3.0L, it is important to have the proper supporting modifications to achieve your goals. We have built out our power packages that include all the needed items to build upon each other for the best possible power gains. This kit includes our performance tune and cold air intake to maximize performance with an otherwise stock vehicle.",
https://www.turnermotorsport.com/p-582819-turner-e82e9x-n52-performance-package-stage-2/,Turner E82/E9X N52 Performance Package - Stage 2,582819,N52S2PPKT,"$2,607.30",https://www.turnermotorsport.com/c-218-bmw-performance-packages?No=50&Nrpp=50#,"If you want to get the most out of your BMW's N52 3.0L, it is important to have the proper supporting modifications to achieve your goals. We have built out our power packages that include all the needed items to build upon each other for the best possible power gains. This kit includes our performance tune, a cold air intake, and an OEM 3-stage intake manifold with dual DISA valves to maximize performance and power at both low and high rpm ranges.",
https://www.turnermotorsport.com/p-558459-f3x-328ixdrive-428ixdrive-n20-12-16-stage-2-turner-motorsport-performance-package/,"F3X F22/23 N20 12-16 Stage 2 Turner Motorsport Performance Package
...",558459,F3XN20S2,"$1,739.26",https://www.turnermotorsport.com/c-218-bmw-performance-packages?No=50&Nrpp=50#,Max HP gain up to = Max Trq gain up to =,
https://www.turnermotorsport.com/p-586768-turner-motorsport-f8x-power-pack-stage-3-f8x-m3-m4/,Turner Motorsport F8X Power Pack - Stage 3+ - F8X M3 M4,586768,F8XPPS3P,"$3,775.68",https://www.turnermotorsport.com/c-218-bmw-performance-packages?No=50&Nrpp=50#,"Looking to get the most out of your engine? Our Power Packs are developed with performance in mind, giving you multiple options to choose from when you want more power out of your BMW! Included in this kit are products that we trust, all having been tried and tested, to increase horsepower and torque without sacrificing daily driven reliability. Included in this Stage 3+ kit is our very own Turner S55 Performance Software, our Turner Motorsport Performance Intake, Active Autowerke's Performance Stainless Catless Downpipes, FTP Motorsport's Charge Pipe Kit, Turner Test Pipes, and the CSF Top Mount Charge-Air-Cooler. Our carbon fiber performance intake is designed to significantly outflow the stock intake, providing your engine with more air at all RPMs. FTP's charge pipes further boost airflow potential while increasing reliability by getting rid of the stock charge pipes that have been known to fail. The stock intercooler/charge-air-cooler is very limited in its cooling capacity. With more air becoming available from the intake, the need for a beefier cooler becomes apparent. CSF's Performance Top Mount Aluminum Charge-Air-Cooler is the perfect choice to keep intake temps as low as possible to keep the charged air cool and dense, improving power. Active's F8X downpipes are strategically engineered to virtually eliminate the immensely restrictive characteristics of the factory F80 M3 and F82 M4 downpipes – therefore reducing radiant heat and increasing performance. Our Turner M3/M4 Test Pipes delete the secondary cats for more sound and performance. With the Turner Test Pipes, we got just enough exhaust sound in the cabin without it being obnoxious or intrusive. We especially love the subtle bark this setup gives when letting off the throttle! This part alters or deletes the emissions equipment on your car. Because of this, we require a waiver of emissions compliance to be signed and sent in to TMS. You can download the waiver here. To make the most out of the bump in airflow and other additions to your BMW, our Turner S55 Tune allows us to dial in the proper settings to squeeze out as much power as possible!",Starting at
https://www.turnermotorsport.com/p-586759-turner-motorsport-f8x-power-pack-stage-2-f8x-m3-m4/,Turner Motorsport F8X Power Pack - Stage 2+ - F8X M3 M4,586759,F8XPPS2P,"$3,775.68",https://www.turnermotorsport.com/c-218-bmw-performance-packages?No=50&Nrpp=50#,"Looking to get the most out of your engine? Our Power Packs are developed with performance in mind, giving you multiple options to choose from when you want more power out of your BMW! Included in this kit are products that we trust, all having been tried and tested, to increase horsepower and torque without sacrificing daily driven reliability. Included in this Stage 2+ kit is our very own Turner S55 Performance Software, our Turner Motorsport Performance Intake, FTP Motorsport's Charge Pipe Kit, Turner Test Pipes, and the CSF Top Mount Charge-Air-Cooler. Our carbon fiber performance intake is designed to significantly outflow the stock intake, providing your engine with more air at all RPMs. FTP's charge pipes further boost airflow potential while increasing reliability by getting rid of the stock charge pipes that have been known to fail. The stock intercooler/charge-air-cooler is very limited in its cooling capacity. With more air becoming available from the intake, the need for a beefier cooler becomes apparent. CSF's Performance Top Mount Aluminum Charge-Air-Cooler is the perfect choice to keep intake temps as low as possible to keep the charged air cool and dense, improving power. Our Turner M3/M4 Test Pipes delete the secondary cats for more sound and performance. With the Turner Test Pipes, we got just enough exhaust sound in the cabin without it being obnoxious or intrusive. We especially love the subtle bark this setup gives when letting off the throttle! This part alters or deletes the emissions equipment on your car. Because of this, we require a waiver of emissions compliance to be signed and sent in to TMS. You can download the waiver here. To make the most out of the bump in airflow and other additions to your BMW, our Turner S55 Tune allows us to dial in the proper settings to squeeze out as much power as possible!",Starting at
https://www.turnermotorsport.com/p-586756-turner-motorsport-f8x-power-pack-stage-1-f8x-m2-competition-m3-m4/,Turner Motorsport F8X Power Pack - Stage 1 - F8X M2 Competition M3 M...,586756,F8XPPS1,"$1,310.68",https://www.turnermotorsport.com/c-218-bmw-performance-packages?No=50&Nrpp=50#,"Looking to get the most out of your engine? Our Power Packs are developed with performance in mind, giving you multiple options to choose from when you want more power out of your BMW! Included in this kit are products that we trust, all having been tried and tested, to increase horsepower and torque without sacrificing daily driven reliability. Included in this Stage 1 kit is our very own Turner S55 Performance Software and our Turner Motorsport Performance Intake. Our carbon fiber performance intake is designed to significantly outflow the stock intake, providing your engine with more air at all RPMs. To make the most out of the bump in airflow, our Turner S55 Tune allows us to dial in the proper settings to compensate for more available air and allows your engine to perform its best.",Starting at
https://www.turnermotorsport.com/p-586757-turner-motorsport-f8x-power-pack-stage-1-f8x-m2-competition-m3-m4/,Turner Motorsport F8X Power Pack - Stage 1+ - F8X M2 Competition M3 ...,586757,F8XPPS1P,"$1,780.68",https://www.turnermotorsport.com/c-218-bmw-performance-packages?No=50&Nrpp=50#,"Looking to get the most out of your engine? Our Power Packs are developed with performance in mind, giving you multiple options to choose from when you want more power out of your BMW! Included in this kit are products that we trust, all having been tried and tested, to increase horsepower and torque without sacrificing daily driven reliability. Included in this Stage 1+ kit is our very own Turner S55 Performance Software, our Turner Motorsport Performance Intake, and FTP Motorsport Charge Pipes. Our carbon fiber performance intake is designed to significantly outflow the stock intake, providing your engine with more air at all RPMs. FTP's charge pipes further boost airflow potential while increasing reliability by getting rid of the stock charge pipes that have been known to fail. To make the most out of the bump in airflow, our Turner S55 Tune allows us to dial in the proper settings to compensate for more available air and allows your engine to perform its best.",Starting at
https://www.turnermotorsport.com/p-586758-turner-motorsport-f8x-power-pack-stage-2-f8x-m2-competition-m3-m4/,Turner Motorsport F8X Power Pack - Stage 2 - F8X M2 Competition M3 M...,586758,F8XPPS2,"$3,305.68",https://www.turnermotorsport.com/c-218-bmw-performance-packages?No=50&Nrpp=50#,"Looking to get the most out of your engine? Our Power Packs are developed with performance in mind, giving you multiple options to choose from when you want more power out of your BMW! Included in this kit are products that we trust, all having been tried and tested, to increase horsepower and torque without sacrificing daily driven reliability. Included in this Stage 2 kit is our very own Turner S55 Performance Software, our Turner Motorsport Performance Intake, and the CSF Top Mount Charge-Air-Cooler. Our carbon fiber performance intake is designed to significantly outflow the stock intake, providing your engine with more air at all RPMs. The stock intercooler/charge-air-cooler is very limited in its cooling capacity. With more air becoming available from the intake, the need for a beefier cooler becomes apparent. CSF's Performance Top Mount Aluminum Charge-Air-Cooler is the perfect choice to keep intake temps as low as possible to keep the charged air cool and dense, improving power. To make the most out of the bump in airflow and other additions to your BMW, our Turner S55 Tune allows us to dial in the proper settings to squeeze out as much power as possible.",Starting at
https://www.turnermotorsport.com/p-586763-turner-motorsport-f8x-power-pack-stage-3-f8x-m3-m4/,Turner Motorsport F8X Power Pack - Stage 3 - F8X M3 M4,586763,F8XPPS3,"$3,305.68",https://www.turnermotorsport.com/c-218-bmw-performance-packages?No=50&Nrpp=50#,"Looking to get the most out of your engine? Our Power Packs are developed with performance in mind, giving you multiple options to choose from when you want more power out of your BMW! Included in this kit are products that we trust, all having been tried and tested, to increase horsepower and torque without sacrificing daily driven reliability. Included in this Stage 3 kit is our very own Turner S55 Performance Software, our Turner Motorsport Performance Intake, Active Autowerke's Performance Stainless Catless Downpipes, and the CSF Top Mount Charge-Air-Cooler. Our carbon fiber performance intake is designed to significantly outflow the stock intake, providing your engine with more air at all RPMs. Active's F8X downpipes are strategically engineered to virtually eliminate the immensely restrictive characteristics of the factory F80 M3 and F82 M4 downpipes – therefore reducing radiant heat and increasing performance. The stock intercooler/charge-air-cooler is very limited in its cooling capacity. With more air becoming available from the intake, the need for a beefier cooler becomes apparent. CSF's Performance Top Mount Aluminum Charge-Air-Cooler is the perfect choice to keep intake temps as low as possible to keep the charged air cool and dense, improving power. To make the most out of the bump in airflow and other additions to your BMW, our Turner S55 Tune allows us to dial in the proper settings to squeeze out as much power as possible!",Starting at
https://www.turnermotorsport.com/p-584419-e46-325ici-power-pack/,E46 325i/Ci Power Pack,584419,787406KKT,"$1,535.08",https://www.turnermotorsport.com/c-218-bmw-performance-packages?No=50&Nrpp=50#,Improve your cars performance with this effective and simple upgrade kit!,
