product-img-link href,cleanDesc,part-info,part-info 2,price,short-description
https://www.turnermotorsport.com/p-47878-18210151442-genuine-bmw-part/,"Genuine BMW Muffler Installation Kit - Z3 M Roadster Z3 M Coupe
   ...",47878,18210151442,$64.42,"Genuine BMW SET OF ADD-ON PARTS, SILENCE    S54"
https://www.turnermotorsport.com/p-374460-muffler-installation-kit/,Muffler Installation Kit,374460,18111723379KT,$80.37,
https://www.turnermotorsport.com/p-375206-exhaust-center-pipe-installation-kit-rear/,"Genuine BMW Exhaust Center Pipe Installation Kit - Rear - E46 M3
  ...",375206,18307830674KT,$173.63,
https://www.turnermotorsport.com/p-587400-downpipe-installation-kit-n54-30l/,Downpipe Installation Kit - N54 3.0L,587400,N54DPINSTALLKT,$115.25,"This kit includes everything you need to install 2 new downpipes. All parts included are genuine BMW or high-quality aftermarket, and every necessary component is accounted for. See kit contents tab for a list of included components"
https://www.turnermotorsport.com/p-369479-exhaust-manifold-install-kit/,Genuine BMW Exhaust Manifold Install Kit - E46 M3,369479,E46M311_30,$239.40,
https://www.turnermotorsport.com/p-639936-center-exhaust-section-installation-kit/,Center Exhaust Section Installation Kit - E46 M54,639936,18107502346KT1,$32.72,"Includes mounting hardware and gaskets. If you are installing a new front muffler on your BMW, you will need new gaskets and hardware. Over time, heat and road grime will cause your hardware to deteriorate, and should not be reused. This kit includes mounting hardware and gaskets. See kit contents tab for a list of included components"
https://www.turnermotorsport.com/p-48-e46-m3-header-hardware-and-gasket-kit/,Header Hardware and Gasket Kit - E46 M3,48,E46M3HEADERKIT,$99.42,"Includes longer studs for aftermarket headers! If you're swapping in new headers on your E46 M3 this kit of gaskets and hardware is the perfect finishing touch! Everyone knows that headers are one of the best performance gains you can do on the E46 M3 and we sell a lot of them. But new gaskets are required if you want a leak-free install and to avoid re-doing the work. This kit fits all E46 M3 (LHD only). Includes: 6 x 11627830667, manifold to head gaskets 18 x 11721437202, exhaust manifold nut 18 x 11121744057, exhaust manifold stud 2 x 11627830668, manifold to section 1 crush rings 1 x 11727505259, air pump valve gasket This item fits the following BMWs: 2001-2006 E46 BMW M3"
https://www.turnermotorsport.com/p-3239402-exhaust-clamp/,Exhaust Clamp,3239402,18305A04BD6,$40.09,