product-img-link href,cleanDesc,part-info,part-info 2,price,wishlist-label href,short-description
https://www.turnermotorsport.com/p-568811-water-pump-and-thermostat-kit/,"Genuine BMW Water Pump And Thermostat Kit - F01 N54, F06/07/10/12/13...",568811,11517632426KT-1,$702.04,https://www.turnermotorsport.com/c-845-bmw-thermostats#,"Water pumps in certain BMW models are known for failure near 80,000 miles, often times leaving the owner stranded. The OEM kit offered provides a single stop for water pump and thermostat replacement needs to save the search and get you back on the road. Kit includes: Genuine BMW thermostat Genuine BMW water pump Genuine BMW coolant Mounting hardware"
https://www.turnermotorsport.com/p-381785-thermostat-80c/,"Febi Thermostat - 80C - E30, E32, E34",381785,11531713040S1,$27.95,https://www.turnermotorsport.com/c-845-bmw-thermostats#,Includes sealing O-ring
https://www.turnermotorsport.com/p-36074-11537586784-genuine-bmw-part/,Genuine BMW Thermostat - F25 xDrive35i F26 X4 xDrive35i,36074,11537586784,$129.10,https://www.turnermotorsport.com/c-845-bmw-thermostats#,"Genuine BMW Thermostat -     F25 X3,F26 X4     N55"
https://www.turnermotorsport.com/p-377551-thermostat-replacement-kit/,"Genuine BMW Thermostat Replacement Kit - E90 E92 E93 M3 S65
       ...",377551,11537836155KT,$144.75,https://www.turnermotorsport.com/c-845-bmw-thermostats#,This kit includes all of the Genuine BMW components you need to replace your thermostat.
https://www.turnermotorsport.com/p-367692-thermostat/,Genuine BMW Thermostat - E31 850Ci 850CSi E32 750iL,367692,11531729720,$79.14,https://www.turnermotorsport.com/c-845-bmw-thermostats?No=50&Nrpp=50#,
https://www.turnermotorsport.com/p-394624-thermostat-71c/,Gates Performance Thermostat - 71*C - BMW S65 S85,394624,11537836155,$50.95,https://www.turnermotorsport.com/c-845-bmw-thermostats?No=50&Nrpp=50#,"Performance low-temperature thermostat for E90, E92, E93 M3 - S65 engine- E60 M5 E63 M6 with S85 engine. Your car may still operate fine according to the instrument display but the electrically-operated thermostat may be going bad."
https://www.turnermotorsport.com/p-554075-thermostat-replacement-kit/,"Thermostat Replacement Kit - E82 E9X E84 E70 E71 With N55 Engines
 ...",554075,11537601158KT2,$84.56,https://www.turnermotorsport.com/c-845-bmw-thermostats?No=50&Nrpp=50#,Wahler Thermostat
https://www.turnermotorsport.com/p-348481-tms348481/,Genuine BMW Thermostat - 79*C - S65 S85,348481,11537836155,$108.00,https://www.turnermotorsport.com/c-845-bmw-thermostats?No=50&Nrpp=50#,"Replacement stock thermostat for E90, E92, E93 M3 - S65 engine- E60 M5 E63 M6 with S85 engine. Your car may still operate fine according to the instrument display but the electrically-operated thermostat may be going bad."
https://www.turnermotorsport.com/p-3923-thermostat-e30-m3/,Thermostat - E30 M3,3923,11531315537,$163.71,https://www.turnermotorsport.com/c-845-bmw-thermostats?No=50&Nrpp=50#,"Engine running a little hot or is the temp gauge not telling you anything? The thermostat might be the likely problem. High-revving, spirited driven cars like the E30 M3 require the tip-top condition to perform well. The cooling system of the S14 one of those critical systems. This thermostat fits all 1987, 1988, 1989, 1990, and 1991 M3 (E30 chassis with S14 engine). Genuine BMW.   When doing any sort of repair or maintenance there is no replacement for genuine factory parts. Turner Motorsport carries the Genuine BMW brand with pride and has the parts you need to complete your next project with confidence.     1987-1991    M3"
https://www.turnermotorsport.com/p-2303-thermostat-with-o-rings-e46-m3-mz3-z4-m/,"Thermostat With O-Rings - E46 M3, MZ3, Z4 M",2303,11531318274-K,$115.64,https://www.turnermotorsport.com/c-845-bmw-thermostats?No=50&Nrpp=50#,"Replacement stock thermostat for E46 M3, Z3M w S54 engine, Z4M.The thermostat can be replaced on the E46 M3 without removing the water pump. This can save you money if the pump still has life left on it but the thermostat needs to be done now. Symptoms of a bad thermostat include an erratic temp gauge and a fault code. When replacing the thermostat, there are three o-rings that will likely need to be replaced between the thermostat and the water pump housing, and two on the coolant tube going to the head. We also recommend new hoses, clamps, and BMW coolant. Replacement should take about one hour.   Note: even though this can be done without replacing the water pump, the job involves removing the same items to access this area. And opening the thermostat housing will spill a lot of coolant. In other words, if you don't replace the water pump at the same time, you're going to repeat this process when the pump needs replacing. We offer a complete water pump overhaul package that covers everything you need if you want to it all at once. You can the thermostat to that package and get everything without any duplicate parts.     On S54 engines (E46 M3, MZ3, Z4 M) there is a flanged head bolt going into the cylinder head, behind the thermostat cover. This holds the left side timing chain guide rail in place and if it's loose or falls out you could have a very serious engine failure to deal with. Make sure to check this bolt while you have the thermostat cover off. You only need to make sure it's tight. But if it's come loose you may want to replace the seal ring and use a small touch of oil-resistant thread sealer.     2000-2001    M3 M3 Convertible 2000-2006  2001-2002    Z3 M Roadster Z3 M Coupe w S54 Engine  2006-2008    Z4 M Roadster Z4 M Coupe"
https://www.turnermotorsport.com/p-382407-thermostat-88c/,"Febi Thermostat - 88Â°C - E30, E34, E36, Z3",382407,11537511580,$23.95,https://www.turnermotorsport.com/c-845-bmw-thermostats?No=50&Nrpp=50#,Includes sealing O-ring gasket
https://www.turnermotorsport.com/p-569021-thermostat-replacement-kit/,Thermostat Replacement Kit,569021,115376011591-2KT,$154.20,https://www.turnermotorsport.com/c-845-bmw-thermostats?No=50&Nrpp=50#,
https://www.turnermotorsport.com/p-554073-thermostat-replacement-kit/,"Thermostat Replacement Kit - E39 E46 E60 E53 Z3 Z4 With M54, M52TU E...",554073,11537509227KT3,$86.55,https://www.turnermotorsport.com/c-845-bmw-thermostats?No=50&Nrpp=50#,Mahle-Behr thermostat with gasket
https://www.turnermotorsport.com/p-382406-thermostat-92c/,"Febi Thermostat - 92C - E34, E36, E39",382406,11537511083S1,$19.95,https://www.turnermotorsport.com/c-845-bmw-thermostats?No=50&Nrpp=50#,Includes gasket
https://www.turnermotorsport.com/p-36175-11537838480-genuine-bmw-part/,Genuine BMW Thermostat Housing - E90 E92 E93 M3,36175,11537838480,$115.54,https://www.turnermotorsport.com/c-845-bmw-thermostats?No=50&Nrpp=50#,"Genuine BMW Thermostat Housing -     E90,E92,E93     S65"
https://www.turnermotorsport.com/p-591812-thermostat/,"URO Thermostat - E60, E61, E82, E83, E88, E90, E91, E92, E93, Z4
  ...",591812,11537549476,$45.49,https://www.turnermotorsport.com/c-845-bmw-thermostats?No=50&Nrpp=50#,Restore proper function to your cooling system
https://www.turnermotorsport.com/p-569020-thermostat-replacement-kit/,Thermostat Replacement Kit,569020,115376011591-1KT,$94.91,https://www.turnermotorsport.com/c-845-bmw-thermostats?No=50&Nrpp=50#,
https://www.turnermotorsport.com/p-360668-thermostat-with-housing/,"Genuine BMW Thermostat With Housing - E39 540i, E38 740i",360668,11531436386,$114.07,https://www.turnermotorsport.com/c-845-bmw-thermostats?No=50&Nrpp=50#,Don't take chances! Proper maintenance is required to keep your BMW performing at peak levels. The thermostat basically controls when your car will overheat. The sensor on the housing is also used by the engine computer to set the fuel mapping on the engine. A faulty sensor or thermostat will lead to the engine running rich (too much fuel). This thermostat fits BMW E39 540i 99-03 E38 740i 99-01 X5 4.4i 4.6is 99-2003 with M62 engine.
https://www.turnermotorsport.com/p-384144-water-pump-and-thermostat-kit/,Water Pump And Thermostat Kit - E60 M5 E63 M6 E64 M6,384144,11517838201KT3KT,$620.37,https://www.turnermotorsport.com/c-845-bmw-thermostats?No=50&Nrpp=50#,"The water pumps in BMW's should be serviced near 80,000 miles and may become an issue often times leaving the owner stranded. The aftermarket kit offered provides a single stop for water pump and thermostat replacement needs to save the search and get you back on the road. Kit includes: Genuine BMW thermostat Genuine BMW water pump Genuine BMW coolant Mounting hardware required for the water pump O-rings for the thermostat housing This item fits the following BMWs: 2005+ E60 BMW M5 2005+ E63 BMW M6"
https://www.turnermotorsport.com/p-360697-thermostat-79-c/,Genuine BMW Thermostat - 79ºC - E52 Z8 E39 M5,360697,11537835558,$98.45,https://www.turnermotorsport.com/c-845-bmw-thermostats?No=50&Nrpp=50#,
https://www.turnermotorsport.com/p-6941-11531710959-genuine-bmw-part/,Genuine BMW Thermostat Housing,6941,11531710959,$51.06,https://www.turnermotorsport.com/c-845-bmw-thermostats?No=50&Nrpp=50#,Genuine BMW Thermostat Housing -     E34     M30
https://www.turnermotorsport.com/p-35859-11531406762-genuine-bmw-part/,Genuine BMW Thermostat Housing - S62,35859,11531406762,$217.03,https://www.turnermotorsport.com/c-845-bmw-thermostats?No=50&Nrpp=50#,"Genuine BMW Thermostat Housing    E39 M5,E39     S62"
https://www.turnermotorsport.com/p-12476-oem-bmw-engine-thermostat-11537511083/,"Mahle-Behr Thermostat - 92C - E34, E36, E39",12476,11537511083,$18.95,https://www.turnermotorsport.com/c-845-bmw-thermostats?No=50&Nrpp=50#,OEM BMW THERMOSTAT:115040
https://www.turnermotorsport.com/p-341080-thermostat-m62tu-e39-540i-e38-740i-1999-2003/,Thermostat M62tu - E39 540i E38 740i 1999-2003,341080,11531436386,$93.52,https://www.turnermotorsport.com/c-845-bmw-thermostats?No=50&Nrpp=50#,"Don't take chances! Proper maintenance is required to keep your BMW performing at peak levels. The thermostat basically controls when your car will overheat. The sensor on the housing is also used by the engine computer to set the fuel mapping on the engine. A faulty sensor or thermostat will lead to the engine running rich (too much fuel). This thermostat fits BMW E39 540i 99-03 E38 740i 99-01 X5 4.4i 4.6is 99-2003 with M62 engine.   Hailing from Stuttgart, Mahle-Behr specializes in automotive cooling systems. From air conditioning to engine cooling M-B has you covered with OE-quality replacement parts.     1999-2001    740i 740il  1999-2003    540i  1999-2003    X5 4.4i X5 4.6is"
https://www.turnermotorsport.com/p-384802-thermostat-cover/,Thermostat Cover,384802,11531268650,$21.60,https://www.turnermotorsport.com/c-845-bmw-thermostats?No=50&Nrpp=50#,"Made to fit just like the stock unit, this replacement will get your coolant system back in top shape quickly. Broken, cracked, or brittle flanges are no longer a problem. Take the worries out of your morning commute with an inexpensive piece of mind."
https://www.turnermotorsport.com/p-594781-thermostat-with-housing/,Thermostat With Housing,594781,11537605431,$74.79,https://www.turnermotorsport.com/c-845-bmw-thermostats?No=50&Nrpp=50#,"If your vehicle is experiencing cooling issues, chances are the thermostat is the cause. Common symptoms include prolonged warm-up at highway speeds from the thermostat being stuck open, or consistent overheating issues from the thermostat being stuck in the closed position. Either condition can result in poor performance, and potential damage to vital components in your vehicle."
https://www.turnermotorsport.com/p-375968-auxiliary-thermostat/,"Wahler Auxiliary Thermostat - E34, E36",375968,13541730682,$45.36,https://www.turnermotorsport.com/c-845-bmw-thermostats?No=50&Nrpp=50#,Thermostat that controls water flow temperature to the throttle body
https://www.turnermotorsport.com/p-579617-thermostat-71-degree-celsius-wahler/,"Wahler Thermostat - E12, E23, E24, E28",579617,4231.71D,$32.58,https://www.turnermotorsport.com/c-845-bmw-thermostats?No=50&Nrpp=50#,"Stop your overheating problem, 71 Degree Celsius."
https://www.turnermotorsport.com/p-381790-thermostat-housing/,"Febi Thermostat Housing - E34, E36, Z3",381790,11531722531,$31.95,https://www.turnermotorsport.com/c-845-bmw-thermostats?No=50&Nrpp=50#,Replacement plastic thermostat housing
https://www.turnermotorsport.com/p-14560-oem-hella-80-degreec-thermostat-e30-325e-84-85-e28-528e-82-85/,"OEM Hella 80 Degree(C) Thermostat - E30 325e 84-85, E28 528e 82-85
...",14560,11531265085,$17.95,https://www.turnermotorsport.com/c-845-bmw-thermostats?No=50&Nrpp=50#,"Replacement OEM Hella thermostat, 80 Degree C. High quality replacement for stock needs."
https://www.turnermotorsport.com/p-361004-thermostat-m62-e39-540i-e38-740i-1996-1998/,"OEM Mahle-Behr Thermostat M62 - E39 540i E38 740i 1996-1998
       ...",361004,11531437526,$80.82,https://www.turnermotorsport.com/c-845-bmw-thermostats?No=50&Nrpp=50#,Don't take chances! Proper maintenance is required to keep your BMW performing at peak levels. The thermostat basically controls when your car will overheat. This thermostat fits BMW E39 540i 97-98 E38 740i 96-98 with M62 engine.     1996-1998    740i 740il  1997-1998    540i
https://www.turnermotorsport.com/p-596630-/,"Mahle-Behr Thermostat with O-Ring (92 deg. C) - E36 Z3 E34 E39
    ...",596630,11537511083,$21.07,https://www.turnermotorsport.com/c-845-bmw-thermostats?No=50&Nrpp=50#,
https://www.turnermotorsport.com/p-594783-thermostat-with-housing/,Thermostat With Housing,594783,11537550172,$71.69,https://www.turnermotorsport.com/c-845-bmw-thermostats?No=50&Nrpp=50#,Overheating your N52 or N54 engine can be detrimental to the longevity of your engine.
https://www.turnermotorsport.com/p-594782-thermostat-with-housing/,Thermostat With Housing,594782,11538671517,$103.98,https://www.turnermotorsport.com/c-845-bmw-thermostats?No=50&Nrpp=50#,"The thermostat on your vehicle controls the flow of coolant based on temperature. When you just start your engine, the thermostat remains closed to accelerate the warm up process. After a few minutes, it opens up to allow the warm fluid to flow. If your vehicle is overheating but not blowing warm air from the heater, the problem is more than likely your thermostat."
https://www.turnermotorsport.com/p-641962-thermostat/,Thermostat,641962,11537549476,$69.08,https://www.turnermotorsport.com/c-845-bmw-thermostats?No=50&Nrpp=50#,
https://www.turnermotorsport.com/p-591727-thermostat/,"Mahle-Behr Thermostat - F10, F15, F30, F31",591727,11518512234,$54.95,https://www.turnermotorsport.com/c-845-bmw-thermostats?No=50&Nrpp=50#,No heat? Overheating? Time for a cooling system service.
https://www.turnermotorsport.com/p-369466-thermostat-88c/,"Wahler Thermostat - 88ï¿½C - E30, E34, E36, Z3",369466,11537511580,$16.95,https://www.turnermotorsport.com/c-845-bmw-thermostats?No=50&Nrpp=50#,Common point of failure in the cooling system.
https://www.turnermotorsport.com/p-337995-thermostat-e34-e39-m5-z8/,"OEM Behr Thermostat - E34 E39 M5, Z8",337995,11537835558,$40.95,https://www.turnermotorsport.com/c-845-bmw-thermostats?No=50&Nrpp=50#,Don't take chances! Proper maintenance is required to keep your car performing at peak levels. The thermostat basically controls when your car will overheat. Don't let it fail on you. This thermostat fits BMW E39 M5 E34 M5 and Z8     1991-1993    BMW M5  1998-2004    BMW M5  2000-2003    BMW Z8
https://www.turnermotorsport.com/p-341062-thermostat-88-degree-e24-e28-e30-e32-e34-e36-e39-z3/,"Thermostat - 88 Degree - E24, E28, E30, E32, E34, E36, E39, Z3
    ...",341062,11537511580,$22.85,https://www.turnermotorsport.com/c-845-bmw-thermostats?No=50&Nrpp=50#,"The thermostat regulates the temperature of your coolant. At a predetermined temperature the thermostat will open to let coolant flow to the radiator and be cooled by airflow or the fan. Over time the thermostat will become stuck open or closed, leading to a variety of issues. A closed thermostat will never allow the coolant to reach the radiator and be cooled. Hot coolant will continue to circulate through the engine and absorb even more heat until boiling and the system overheats. An open thermostat is not as bad but is still not ideal - the coolant is always cool, with the temp needle always reading in the cool range. This tells the ECU to richen the fuel mixture to bring the car up to normal operating temp. So your fuel mileage decreases and the car runs rich.Replacing the thermostat is an easy but messy job. This thermostat includes the main o-ring (but a housing gasket may be required). Consider replacing the housing and any associated temp sensors while you're in there. The cooling system will need to be bled after.Most of the engines from the mid-1980s through the 1990s use the same thermostat design and they are interchangeable among the different temperatures. This is the 88* thermostat, towards the top of the range. However, keep in mind that BMW spent a lot of time engineering the cooling system to work in all kinds of conditions and changing thermostat temperature is not recommended to fix any failures in the cooling system."
https://www.turnermotorsport.com/p-362746-thermostat-e36-318i-z3-19-with-m44-engine/,Thermostat - E36 318i Z3 1.9 with M44 engine,362746,11531743017,$33.95,https://www.turnermotorsport.com/c-845-bmw-thermostats?No=50&Nrpp=50#,Don't take chances! Proper maintenance is required to keep your BMW performing at peak levels. The thermostat basically controls when your car will overheat. This thermostat fits BMW E36 318i 318is 318ti 318ic and Z3 1.9 with M44 engine.     1996-1998    318i 318is 318ti 318ic  1996-1998    Z3 1.9
https://www.turnermotorsport.com/p-2369-aluminum-thermostat-housing-cover-e32-e34-e38-e31-with-m60-v8-engine/,Aluminum Thermostat Housing Cover - E32 E34 E38 E31 with M60 V8 engi...,2369,11531720173,$12.70,https://www.turnermotorsport.com/c-845-bmw-thermostats?No=50&Nrpp=50#,"This aluminum thermostat housing cover is a direct replacement for the factory unit. It fits BMW E32 740i 740il E34 530i 540i E38 740i 740il 1995, E31 840i thru 1995."
https://www.turnermotorsport.com/p-341209-tms341209/,"Mahle-Behr Thermostat - 79Âº C - E34, E39, E52",341209,11537835558,$40.95,https://www.turnermotorsport.com/c-845-bmw-thermostats?No=50&Nrpp=50#,Includes sealing o-ring
https://www.turnermotorsport.com/p-194250-11531251041-genuine-bmw-part/,Genuine BMW Thermostat - 80ºC,194250,11531251041,$53.13,https://www.turnermotorsport.com/c-845-bmw-thermostats?No=50&Nrpp=50#,M30
https://www.turnermotorsport.com/p-368855-thermostat-80c/,Genuine BMW Thermostat - 80ºC - E30 318i 1602 2002 2002tii E21 320i...,368855,11531253249,$88.42,https://www.turnermotorsport.com/c-845-bmw-thermostats?No=50&Nrpp=50#,
https://www.turnermotorsport.com/p-360690-thermostat-92c/,Genuine BMW Thermostat - 92ºC,360690,11537511083,$71.22,https://www.turnermotorsport.com/c-845-bmw-thermostats?No=50&Nrpp=50#,
https://www.turnermotorsport.com/p-6880-11531265059-genuine-bmw-part/,Genuine BMW Thermostat Housing Cover,6880,11531265059,$26.59,https://www.turnermotorsport.com/c-845-bmw-thermostats?No=50&Nrpp=50#,"Genuine BMW Cover -     E30,E34     M20"
https://www.turnermotorsport.com/p-581451-thermostat-92-degree-celcius-vernet/,"Vernet Thermostat - 92 Degree Celcius - Vernet - E34, E36, E39, Z3
...",581451,TH6243.92J,$20.95,https://www.turnermotorsport.com/c-845-bmw-thermostats?No=50&Nrpp=50#,92 Degree Celcius/ 197 Degree Farenheit.
https://www.turnermotorsport.com/p-579650-thermostat-wahler/,"Wahler Thermostat - E31, E32",579650,4516.85,$32.29,https://www.turnermotorsport.com/c-845-bmw-thermostats?No=50&Nrpp=50#,Stop your overheating problem.
https://www.turnermotorsport.com/p-14600-11537550172-genuine-bmw-part/,"Genuine BMW Thermostat - E70 N52 3.0L E71 X6 xDrive35i N54 3.0L
   ...",14600,11537550172,$130.72,https://www.turnermotorsport.com/c-845-bmw-thermostats?No=50&Nrpp=50#,"Genuine BMW Thermostat -     E70 X5,E71     N52N,N54"
https://www.turnermotorsport.com/p-554086-thermostat-replacement-kit/,Thermostat Replacement Kit - E39 M5,554086,11537835558KT7,$99.15,https://www.turnermotorsport.com/c-845-bmw-thermostats?No=50&Nrpp=50#,"When it comes time to replace your thermostat, be sure you have everything you need. This kit includes everything you need to replace your thermostat, including the thermostat."
https://www.turnermotorsport.com/p-539226-heat-management-modu/,"Genuine BMW - Thermostat with housing and gasket - 11537644811
    ...",539226,11537644811,$264.19,https://www.turnermotorsport.com/c-845-bmw-thermostats?No=50&Nrpp=50#,11537644811 - Thermostat with housing and gasket. The thermostat controls the flow of coolant based on temperatures in the engine. This is a crucial component to your cooling system and making sure your car is operating properly.
https://www.turnermotorsport.com/p-22335-11537834271-genuine-bmw-part/,"Genuine BMW Thermostat Housing with Hollow Bolt, Hose Connector and ...",22335,11537834271,$302.18,https://www.turnermotorsport.com/c-845-bmw-thermostats?No=50&Nrpp=50#,"Genuine BMW Thermostat Housing    E60 M5,E63 M6,E63     S85"
https://www.turnermotorsport.com/p-6900-11531268650-genuine-bmw-part/,Genuine BMW Thermostat Cover,6900,11531268650,$38.18,https://www.turnermotorsport.com/c-845-bmw-thermostats?No=50&Nrpp=50#,Genuine BMW Cover -     E34     M30
https://www.turnermotorsport.com/p-377723-thermostat-92c/,"Calorstat Thermostat - 92Â°C - E34, E36, E39",377723,11531712043,$16.81,https://www.turnermotorsport.com/c-845-bmw-thermostats?No=50&Nrpp=50#,Includes sealing ring
https://www.turnermotorsport.com/p-367686-thermostat-housing/,Genuine BMW Thermostat Housing - M60,367686,11531720173,$22.28,https://www.turnermotorsport.com/c-845-bmw-thermostats?No=100&Nrpp=50#,
https://www.turnermotorsport.com/p-384981-thermostat/,Thermostat,384981,11538671517,$111.11,https://www.turnermotorsport.com/c-845-bmw-thermostats?No=100&Nrpp=50#,
https://www.turnermotorsport.com/p-35887-11531710493-genuine-bmw-part/,"Engine Coolant Thermostat Housing - E31, E32",35887,11531710493,$59.06,https://www.turnermotorsport.com/c-845-bmw-thermostats?No=100&Nrpp=50#,"Genuine BMW COVER    M70,S70"
https://www.turnermotorsport.com/p-36153-11537831103-genuine-bmw-part/,Genuine BMW Thermostat Housing - E46 M3 S54 3.2L,36153,11537831103,$115.54,https://www.turnermotorsport.com/c-845-bmw-thermostats?No=100&Nrpp=50#,"Genuine BMW Thermostat Housing    E46 M3,E85 Z4M,E46,E85 Z4,E86 Z4     S54"
https://www.turnermotorsport.com/p-222844-11537642854-genuine-bmw-part/,Genuine BMW Heat Management Module - 11537642854,222844,11537642854,$370.17,https://www.turnermotorsport.com/c-845-bmw-thermostats?No=100&Nrpp=50#,Genuine Bmw Heat Management Module - 11537642854
https://www.turnermotorsport.com/p-360671-thermostat-assembly/,Genuine BMW Thermostat With Housing - E39 540i,360671,11531437526,$126.10,https://www.turnermotorsport.com/c-845-bmw-thermostats?No=100&Nrpp=50#,
https://www.turnermotorsport.com/p-591800-thermostat-88c/,"Rein Thermostat - 88ï¿½C - E30, E34, E36, Z3",591800,11537511580,$24.95,https://www.turnermotorsport.com/c-845-bmw-thermostats?No=100&Nrpp=50#,Common point of failure in the cooling system.
https://www.turnermotorsport.com/p-594281-thermostat-80c/,Thermostat - 80°C,594281,11531466174,$12.92,https://www.turnermotorsport.com/c-845-bmw-thermostats?No=100&Nrpp=50#,"If the thermostat gets stuck closed, it allows no fluid to flow and ends up overheating the coolant already in the engine. If your vehicle is not getting up to temperature when driving, the thermostat is more than likely stuck open. Your engine does not get up to the proper operating temperature where it runs the most efficiently. To fix this problem and get your vehicle's heat restored, replace your thermostat."
https://www.turnermotorsport.com/p-594650-thermostat-92c/,Thermostat - 92°C,594650,11606015672,$24.13,https://www.turnermotorsport.com/c-845-bmw-thermostats?No=100&Nrpp=50#,"The thermostat on your vehicle controls the flow of coolant based on temperature. When you just start your engine, the thermostat remains closed to accelerate the warm up process. After a few minutes, it opens up to allow the warm fluid to flow. If your vehicle is overheating but not blowing warm air from the heater, the problem is more than likely your thermostat."
https://www.turnermotorsport.com/p-594651-thermostat/,Thermostat,594651,11531729841,$33.17,https://www.turnermotorsport.com/c-845-bmw-thermostats?No=100&Nrpp=50#,Replacement Thermostat from MotoRad for E32 750iL
https://www.turnermotorsport.com/p-212377-thermostat-f22-f30-f32-f10-f25-f26-e89-with-n20n26-engine/,"Thermostat - F22 F30 F32 F10 F25 F26 E89 with N20/N26 engine
      ...",212377,11538648791,$73.79,https://www.turnermotorsport.com/c-845-bmw-thermostats?No=100&Nrpp=50#,"Engine running a little hot or is the temp gauge not telling you anything? The thermostat might be the likely problem. Many cooling issues start with the thermostat. This is electronically controlled by the engine computer based on the cooling demands from the engine. And cooling components are working harder than ever. Engine performance is also dependant on temperature - as temperatures rise and pass a certain threshold the engine computer will begin reducing power. Stay on top of your cooling maintenance by replacing critical components preventatively. This replacement thermostat fits many of the N20 N26 4 cylinder engines. Alternate part numbers: 11538635689, 11537633476, 11538636595, 11538636594."
https://www.turnermotorsport.com/p-591144-thermostat-o-ring-60-x-35-mm/,Rein Thermostat O-Ring (60 X 3.5 mm) - E28 E30 E32 E34 E36 E39 Z3 E2...,591144,11531265084,$1.95,https://www.turnermotorsport.com/c-845-bmw-thermostats?No=100&Nrpp=50#,This O-ring seals the thermostat to the cylinder head.
