product-img-link href,cleanDesc,part-info,part-info 2,price,wishlist-label href,short-description
https://www.turnermotorsport.com/p-360523-thermostat-92c/,"Wahler Thermostat - 92C - E34, E36, E39",360523,11537511083,$23.87,https://www.turnermotorsport.com/c-845-bmw-thermostats?No=100&Nrpp=50#,Gasket is included
https://www.turnermotorsport.com/p-13004-genuine-bmw-engine-connection-flange-11531721966/,"Genuine BMW Thermostat Housing - E36 318i 318is 318ti M42 1.8L
    ...",13004,11531721966,$70.38,https://www.turnermotorsport.com/c-845-bmw-thermostats?No=100&Nrpp=50#,"Genuine BMW Connection Flange -     E30,E36     M42"
https://www.turnermotorsport.com/p-554083-thermostat-replacement-kit/,Thermostat Replacement Kit - E39 540i 1996-1998,554083,11531437526KT2,$94.24,https://www.turnermotorsport.com/c-845-bmw-thermostats?No=100&Nrpp=50#,Behr thermostat with O-ring
https://www.turnermotorsport.com/p-2302749-performance-thermostat-bypassdelete-tube/,Active Autowerke Thermostat Bypass/Delete Tube - S65,2302749,14-016,$142.00,https://www.turnermotorsport.com/c-845-bmw-thermostats?No=100&Nrpp=50#,CNC machined coolant/water thermostat bypass tube to improve flow on and off the track. Easy plug and play installation and a durable anodized coating make this a simple and reliable temperature control solution.
https://www.turnermotorsport.com/p-554085-thermostat-replacement-kit/,Thermostat Replacement Kit - E39 540i 1999-2003,554085,11531436386KT3,$106.31,https://www.turnermotorsport.com/c-845-bmw-thermostats?No=100&Nrpp=50#,"When it comes time to replace your thermostat, be sure you have everything you need. This kit includes everything you need to replace your thermostat, including the thermostat."
https://www.turnermotorsport.com/p-397225-thermostat-71-degrees/,71°C Thermostat - M50,397225,14-008,$40.00,https://www.turnermotorsport.com/c-845-bmw-thermostats?No=100&Nrpp=50#,
https://www.turnermotorsport.com/p-397222-thermostat-housing-kit-all-aluminum/,Aluminum Thermostat Housing Kit - M50,397222,14-009,$56.00,https://www.turnermotorsport.com/c-845-bmw-thermostats?No=100&Nrpp=50#,"Here are your choices: you can wait for the plastic factory thermostat housing cover to break and cause major overheating. (Even with a new stock cover, it won’t take long.) Or you can install a thoughtfully engineered all-aluminum thermostat housing cover from Active Autowerke and never experience this type of failure again. Currently there is no factory upgraded part to this problem. This is an aluminum extruded part that has all of the openings machine properly to fit like factory; from the mounting bolt holes, the seating of the thermostat to the sealing opening for the ORANGE gasket. Forged to exact factory tolerances, everything fits and this unit is a true easy bolt-on – especially suited for racing or load conditions like heavy traffic, where engine temp can rise rapidly. The housing is guaranteed never to break from overheating or over-tightening, and its CNC machined surface ensures a precise seat.   Unit comes complete with a new ORANGE sealing gasket; a new thermostat is recommended but not included.  For hotter climates, a 71 degree thermostat is recommended over the 82 degree unit.   Anything and everything BMW is the mantra at Active Autowerke. Since 1981 they have been serving the BMW community with custom turbocharger kits to a myriad of other innovative and inspiring performance parts."
https://www.turnermotorsport.com/p-594727-thermostat-80c/,Thermostat - 80°C,594727,11531713040,$22.95,https://www.turnermotorsport.com/c-845-bmw-thermostats?No=100&Nrpp=50#,"The thermostat on your vehicle controls the flow of coolant based on temperature. When you just start your engine, the thermostat remains closed to accelerate the warm up process. After a few minutes, it opens up to allow the warm fluid to flow. If your vehicle is overheating but not blowing warm air from the heater, the problem is more than likely your thermostat."
https://www.turnermotorsport.com/p-2246-thermostat-e32-750il-e31-850i/,OEM Mahle-Behr Thermostat - E32 750il E31 850i,2246,11531729720,$35.95,https://www.turnermotorsport.com/c-845-bmw-thermostats?No=100&Nrpp=50#,"Don't take chances! Proper maintenance is required to keep your BMW performing at peak levels. The thermostat basically controls when your car will overheat. This thermostat fits BMW E32 750il and E31 850i with M70 engine.   Hailing from Stuttgart, Mahle-Behr specializes in automotive cooling systems. From air conditioning to engine cooling M-B has you covered with OE-quality replacement parts.     1989-1994    750il  1991-1995    850i with M70 engine"
https://www.turnermotorsport.com/p-2264-oem-hella-thermostat-e28-m5-e24-m6/,OEM Hella Thermostat - E28 M5 E24 M6,2264,11531307737,$32.95,https://www.turnermotorsport.com/c-845-bmw-thermostats?No=100&Nrpp=50#,"Don't take chances! Proper maintenance is required to keep your BMW performing at peak levels. The thermostat is important in keeping your vehicle cool, allowing coolant to pass once the engine has reached a certain temperature. Use a high quality thermostat such as this OEM Hella thermostat to ensure reliability and long engine life."
https://www.turnermotorsport.com/p-594733-automatic-transmission-thermostat/,Automatic Transmission Thermostat,594733,17111437362,$40.95,https://www.turnermotorsport.com/c-845-bmw-thermostats?No=100&Nrpp=50#,"This unit controls the temperature of your automatic transmission fluid. Heat exchanger for your automatic transmission, usually changed when you replace your expansion tank."
https://www.turnermotorsport.com/p-402163-thermostat/,"Rein Thermostat - E60, E61, E82, E83, E88, E90, E91, E92, E93, Z4
 ...",402163,11537549476,$61.95,https://www.turnermotorsport.com/c-845-bmw-thermostats?No=100&Nrpp=50#,Restore proper function to your cooling system
https://www.turnermotorsport.com/p-596332-/,"Gates Thermostat with Housing and O-Ring (105 deg. C) - E38 E39
   ...",596332,11531437526,$127.95,https://www.turnermotorsport.com/c-845-bmw-thermostats?No=100&Nrpp=50#,
https://www.turnermotorsport.com/p-638870-thermostat-105c/,Bremmen Thermostat - 105*C - E53 E6X E70 F10 F12 F13 F8X,638870,11537586885-105,$67.95,https://www.turnermotorsport.com/c-845-bmw-thermostats?No=100&Nrpp=50#,Don't take chances! Proper maintenance is required to keep your car performing at peak levels. The thermostat basically controls when your car will overheat. Don't let it fail on you.
https://www.turnermotorsport.com/p-3-e46-m3-motorsport-thermostat-55-degree-c/,Genuine BMW Motorsport BMW Motorsport Thermostat - 55°C - E46 S54 3...,3,11531417215,$161.95,https://www.turnermotorsport.com/c-845-bmw-thermostats?No=100&Nrpp=50#,"E46 M3 Motorsport Thermostat, 55*C (Also fits Euro E36 M3 engine). A Genuine BMW part this thermostat opens at a much lower temperature than stock to keep your S54 engine running cooler in race applications."
https://www.turnermotorsport.com/p-337991-motorsport-thermostat-55-c-e46-m3/,Motorsport Thermostat - 55� C - E46 M3,337991,11531417215,$176.46,https://www.turnermotorsport.com/c-845-bmw-thermostats?No=100&Nrpp=50#,E46M3 Motorsport Thermostat 55C (Also fits Euro E36 M3 engine) A Genuine BMW part this thermostat opens at a much lower temperature than stock to keep your S54 engine (or Euro S50/S52 engine) running cooler in race applications.
https://www.turnermotorsport.com/p-637725-thermostat-assembly/,Thermostat Assembly,637725,11537598865,$111.06,https://www.turnermotorsport.com/c-845-bmw-thermostats?No=100&Nrpp=50#,A quality replacement from URO. This is a common source of cracks and leaks.
https://www.turnermotorsport.com/p-639269-thermostat-housing-gasket/,Thermostat Housing Gasket,639269,11537509357,$1.72,https://www.turnermotorsport.com/c-845-bmw-thermostats?No=100&Nrpp=50#,Needs to be replaced once removed
https://www.turnermotorsport.com/p-3428544-thermostat-assembly/,Uro - Thermostat Housing with O-ring,3428544,11531436386,$42.69,https://www.turnermotorsport.com/c-845-bmw-thermostats?No=100&Nrpp=50#,- Guaranteed fitment - High-flow OE-style design for optimal engine cooling performance - Thermostat housing assembly is manufactured to factory housing dimensions for easy bolt-on installation and reliable hose connections - Includes temperature sensor where applicable - High-quality alloy or composite material is temperature-stable to resist warping or cracking that can lead to coolant leakage - 24 Month Unlimited Mileage Warranty
https://www.turnermotorsport.com/p-637724-thermostat-with-adapter/,Thermostat With Adapter,637724,11517805811,$28.33,https://www.turnermotorsport.com/c-845-bmw-thermostats?No=100&Nrpp=50#,
https://www.turnermotorsport.com/p-639573-thermostat-assembly/,Thermostat With Housing - E39 540i,639573,11531437526,$47.67,https://www.turnermotorsport.com/c-845-bmw-thermostats?No=100&Nrpp=50#,
https://www.turnermotorsport.com/p-637726-thermostat/,Thermostat,637726,11538671517,$59.15,https://www.turnermotorsport.com/c-845-bmw-thermostats?No=100&Nrpp=50#,
https://www.turnermotorsport.com/p-373138-coolant-hose/,Coolant Hose,373138,11531266459,$2.94,https://www.turnermotorsport.com/c-845-bmw-thermostats?No=100&Nrpp=50#,Water pump to thermostat housing
https://www.turnermotorsport.com/p-362014-coolant-hose/,Coolant Hose,362014,13541289976,$2.48,https://www.turnermotorsport.com/c-845-bmw-thermostats?No=100&Nrpp=50#,Connects to the thermostat housing
https://www.turnermotorsport.com/p-35797-11531279456-genuine-bmw-part/,Engine Coolant Thermostat Housing - E28,35797,11531279456,$156.01,https://www.turnermotorsport.com/c-845-bmw-thermostats?No=100&Nrpp=50#,Genuine BMW COVER
https://www.turnermotorsport.com/p-369356-thermostat-105c/,Wahler Thermostat - 105C,369356,11537586885,$56.95,https://www.turnermotorsport.com/c-845-bmw-thermostats?No=100&Nrpp=50#,Includes housing and sealing o-ring
https://www.turnermotorsport.com/p-592900-thermostat-hose/,Thermostat Hose,592900,11531266461,$7.56,https://www.turnermotorsport.com/c-845-bmw-thermostats?No=100&Nrpp=50#,Replace your leaking hose
https://www.turnermotorsport.com/p-592908-thermostat-gasket/,Thermostat Gasket,592908,11531440192,$0.95,https://www.turnermotorsport.com/c-845-bmw-thermostats?No=100&Nrpp=50#,Seals the thermostat to the water pump
https://www.turnermotorsport.com/p-596518-/,FAE Thermostat with O-Ring (88 deg. C) - E30 E36 Z3 E34,596518,11537511580,$21.95,https://www.turnermotorsport.com/c-845-bmw-thermostats?No=100&Nrpp=50#,
https://www.turnermotorsport.com/p-1171-m54-m52tu-motorsport-thermostat-60-degree-c-complete-with-housing/,"Motorsport Thermostat - 60C - Complete with Housing - M54 / M52tu
 ...",1171,TMS1171,$347.24,https://www.turnermotorsport.com/c-845-bmw-thermostats?No=100&Nrpp=50#,"This is a genuine BMW Motorsport part, designed specifically for BMW racing applications. We use this exact thermostat setup in our Championship-winning E46 330i race car. It is designed to be used on all M54 and M52TU double-VAN0S engines, as used in the 1999-2000 E46 323/328 and 2001-2005 E46 325/330. This 60 degree C (140 defrees F) thermostat comes complete with plastic thermostat housing. It does not use the plug and wiring for the stock DME so this should only be used with an aftermarket engine management system (Motec, Bosch, etc).   When doing any sort of repair or maintenance there is no replacement for genuine factory parts. Turner Motorsport carries the Genuine BMW brand with pride and has the parts you need to complete your next project with confidence."
https://www.turnermotorsport.com/p-596517-/,FAE Thermostat with O-Ring (92 deg. C) - E36 Z3 E34 E39,596517,11537511083,$19.95,https://www.turnermotorsport.com/c-845-bmw-thermostats?No=100&Nrpp=50#,
https://www.turnermotorsport.com/p-579865-thermostat-housing-aluminum-jl-germany/,"JL Germany Thermostat Housing - E34, E36, Z3",579865,54402,$18.95,https://www.turnermotorsport.com/c-845-bmw-thermostats?No=100&Nrpp=50#,Upgraded aluminum thermostat housing
https://www.turnermotorsport.com/p-2199-thermostat-80-degree-e24-e28-e30-e32-e34-e36-e39-z3/,"OEM Mahle-Behr Thermostat - 80 Degree - E24, E28, E30, E32, E34, E36...",2199,11531713040,$27.95,https://www.turnermotorsport.com/c-845-bmw-thermostats?No=100&Nrpp=50#,"The thermostat regulates the temperature of your coolant. At a predetermined temperature the thermostat will open to let coolant flow to the radiator and be cooled by airflow or the fan. Over time the thermostat will become stuck open or closed, leading to a variety of issues. A closed thermostat will never allow the coolant to reach the radiator and be cooled. Hot coolant will continue to circulate through the engine and absorb even more heat until boiling and the system overheats. An open thermostat is not as bad but is still not ideal - the coolant is always cool, with the temp needle always reading in the cool range. This tells the ECU to richen the fuel mixture to bring the car up to normal operating temp. So your fuel mileage decreases and the car runs rich.   Replacing the thermostat is an easy but messy job. This thermostat includes the main o-ring (but a housing gasket may be required). Consider replacing the housing and any associated temp sensors while you're in there. The cooling system will need to be bled after.   Most of the engines from the mid-1980s through the 1990s use the same thermostat design and they are interchangeable among the different temperatures. This is the 80* thermostat, towards the lower end of the range. However, keep in mind that BMW spent a lot of time engineering the cooling system to work in all kinds of conditions and changing thermostat temperature is not recommended to fix any failures in the cooling system.     1977-1983    323i   1986-1991    318is 318ic 325e 325es 325i 325ic 325is 325ix  1992-1999    318i 318is 318ti 318ic 323is 323ic 325i 325is 325ic 328i 328is 328ic M3  1982-1988    528e  1986-1988    535i  1989-1995    525i 535i  1997-1998    528i  1986-1989    635csi  1988-1994    735i 735il  1997-2000    Z3 2.8 M Roadster M Coupe"
https://www.turnermotorsport.com/p-381782-thermostat-71c/,"Febi Thermostat - 71Â°C - E10, E21, E30",381782,11531253249,$28.95,https://www.turnermotorsport.com/c-845-bmw-thermostats?No=100&Nrpp=50#,Includes a complete housing
https://www.turnermotorsport.com/p-403980-thermostat/,"Rein Thermostat - E70, E71",403980,11537550172,$51.95,https://www.turnermotorsport.com/c-845-bmw-thermostats?No=100&Nrpp=50#,Replaces failed thermostat or as preventative maintenance for your cooling system
https://www.turnermotorsport.com/p-341654-tms341654/,"Vemo Thermostat - 92C - E34, E36, E39",341654,11537511083,$19.95,https://www.turnermotorsport.com/c-845-bmw-thermostats?No=100&Nrpp=50#,Includes gasket
https://www.turnermotorsport.com/p-388457-thermostat-assembly/,"Bremmen Parts Thermostat Assembly - E38, E39",388457,11531437526,$45.95,https://www.turnermotorsport.com/c-845-bmw-thermostats?No=100&Nrpp=50#,"Comes with aluminum housing, o-ring & sensor"
https://www.turnermotorsport.com/p-363269-thermostat-105c/,Mahle-Behr Thermostat - 105C,363269,11537586885,$50.95,https://www.turnermotorsport.com/c-845-bmw-thermostats?No=100&Nrpp=50#,Includes housing and sealing o-ring
https://www.turnermotorsport.com/p-2743-thermostat-for-bmw-e32-740i-e34-530i-540i-e38-740i-e31-840ci/,"Thermostat M60 - E32 740i E34 530i 540i E38 740i E31 840ci
        ...",2743,11531702279,$31.68,https://www.turnermotorsport.com/c-845-bmw-thermostats?No=150&Nrpp=50#,"Don't take chances! Proper maintenance is required to keep your car performing at peak levels. The thermostat basically controls when your car will overheat. Don't let it fail on you. This thermostat fits BMW E32 740i E34 530i 540i E38 740i E31 840ci with M60 engine.   Manufacturing OE-grade replacement cooling parts is Wahler’s specialty. When you need to replace a component in your vehicle’s water system, high grade, and long-lasting parts from Wahler ensure the job is done properly the first time.     1992-1994    740i 740il  1993-1995    530i 530i wagon 540i  1995-1996    740i 740il  1991-1996    840i 840ci with M60 engine"
https://www.turnermotorsport.com/p-381058-thermostat-80c/,Thermostat - 80Â°C,381058,11531254065,$21.38,https://www.turnermotorsport.com/c-845-bmw-thermostats?No=150&Nrpp=50#,
https://www.turnermotorsport.com/p-594831-thermostat-80c/,Thermostat - 80C,594831,11531713040,$23.02,https://www.turnermotorsport.com/c-845-bmw-thermostats?No=150&Nrpp=50#,
https://www.turnermotorsport.com/p-594780-thermostat-105c/,Thermostat - 105C,594780,11537586885,$61.26,https://www.turnermotorsport.com/c-845-bmw-thermostats?No=150&Nrpp=50#,Don't take chances! Proper maintenance is required to keep your car performing at peak levels. The thermostat basically controls when your car will overheat. Don't let it fail on you. This thermostat fits BMW N62 engines in E60 545i 550i X5 4.4i 4.8i 650i 745i 750i 745li 750li 760i 760li X6 xDrive50i
https://www.turnermotorsport.com/p-375084-coolant-bleed-screw-priced-each/,"OES Coolant Bleed Screw - E12, E23, E24, E28, E3, E30, E32, E34, E9
...",375084,11531275881,$5.17,https://www.turnermotorsport.com/c-845-bmw-thermostats?No=150&Nrpp=50#,Found in the thermostat housing cover
https://www.turnermotorsport.com/p-591826-thermostat-80c/,"Mahle Thermostat - 80ï¿½C - E12, E23, E24, E28",591826,11539055588,$20.11,https://www.turnermotorsport.com/c-845-bmw-thermostats?No=150&Nrpp=50#,Stop your overheating problem.
https://www.turnermotorsport.com/p-1196157-/,"Vernet Thermostat - 80Â°C - E12, E23, E24, E28",1196157,11531254065,$12.92,https://www.turnermotorsport.com/c-845-bmw-thermostats?No=150&Nrpp=50#,Stop your overheating problem.
https://www.turnermotorsport.com/p-373145-coolant-hose/,Coolant Hose,373145,13541735173,$8.93,https://www.turnermotorsport.com/c-845-bmw-thermostats?No=150&Nrpp=50#,Cylinder head to thermostat
https://www.turnermotorsport.com/p-594737-thermostat-80c/,Thermostat - 80°C,594737,11531254065,$20.02,https://www.turnermotorsport.com/c-845-bmw-thermostats?No=150&Nrpp=50#,"The thermostat on your vehicle controls the flow of coolant based on temperature. When you just start your engine, the thermostat remains closed to accelerate the warm up process. After a few minutes, it opens up to allow the warm fluid to flow. If your vehicle is overheating but not blowing warm air from the heater, the problem is more than likely your thermostat."
https://www.turnermotorsport.com/p-578630-thermostat-replacement-kit/,"Thermostat Replacement Kit - E28, E30, E34 M20B25/27",578630,11531730470K2KT,$74.23,https://www.turnermotorsport.com/c-845-bmw-thermostats?No=150&Nrpp=50#,
https://www.turnermotorsport.com/p-367495-thermostat-housing/,Thermostat Housing - E30 E36,367495,11531721966,$61.28,https://www.turnermotorsport.com/c-845-bmw-thermostats?No=150&Nrpp=50#,Main housing that holds thermostat & that bolts to the engine block
https://www.turnermotorsport.com/p-378446-thermostat-71c/,"Vernet Thermostat - 71Â°C - E10, E21",378446,1153905558771,$19.41,https://www.turnermotorsport.com/c-845-bmw-thermostats?No=150&Nrpp=50#,Includes a complete housing
https://www.turnermotorsport.com/p-402164-thermostat-80c/,"Rein Thermostat - 80ï¿½C - E46, Z3, Z4",402164,11531318274,$58.95,https://www.turnermotorsport.com/c-845-bmw-thermostats?No=150&Nrpp=50#,Does not include gasket
https://www.turnermotorsport.com/p-1196215-/,"Calorstat Thermostat - 71Â°C - E10, E21",1196215,1153905558771,$21.32,https://www.turnermotorsport.com/c-845-bmw-thermostats?No=150&Nrpp=50#,
https://www.turnermotorsport.com/p-554060-thermostat-with-adapter/,"Facet Thermostat With Adapter - E70, E90",554060,11517805811,$54.06,https://www.turnermotorsport.com/c-845-bmw-thermostats?No=150&Nrpp=50#,Includes gasket and O-rings
https://www.turnermotorsport.com/p-568620-thermostat-with-adapter/,"Mahle-Behr Thermostat With Adapter - E70, E90",568620,11517805811,$53.95,https://www.turnermotorsport.com/c-845-bmw-thermostats?No=150&Nrpp=50#,Includes gasket and O-rings
https://www.turnermotorsport.com/p-2742-thermostat-for-e90-335d-and-x5-xdrive35d/,Thermostat - E90 335d and X5 xDrive35d,2742,11517805811,$72.95,https://www.turnermotorsport.com/c-845-bmw-thermostats?No=150&Nrpp=50#,"Don't take chances! Proper maintenance is required to keep your BMW performing at peak levels. The thermostat basically controls when your car will overheat. This thermostat fits BMW E90 335d and E70 X5 xDrive35d with the diesel engine.   Since the late 1800’s Febi has been fabricating replacement metal parts. This history is self evident in the quality and vast amount of applications they service. With more than 34,000 repair solutions for cars and commercial vehicles you can be sure Febi has you covered.     2009+    335d  2009+    X5 xDrive35d"
https://www.turnermotorsport.com/p-582479-thermostat-housing-w-thermostat-kit/,Thermostat Housing W/ Thermostat Kit,582479,11538674895,$88.95,https://www.turnermotorsport.com/c-845-bmw-thermostats?No=150&Nrpp=50#,
https://www.turnermotorsport.com/p-2257-thermostat-for-mini-cooper-s-r52-r53/,Thermostat - MINI Cooper S R52 R53,2257,11531485847,$18.95,https://www.turnermotorsport.com/c-845-bmw-thermostats?No=150&Nrpp=50#,Don't take chances! Proper maintenance is required to keep your MINI performing at peak levels. The thermostat basically controls when your car will overheat. This thermostat fits MINI Cooper S R52 R53 with supercharged engine.
https://www.turnermotorsport.com/p-591532-thermostat-replacement-kit/,Thermostat Replacement Kit,591532,11538674895KT1KT,$103.80,https://www.turnermotorsport.com/c-845-bmw-thermostats?No=150&Nrpp=50#,
https://www.turnermotorsport.com/p-546869-thermostat-housing-w/,THERMOSTAT HOUSING W,546869,11538699290,$139.95,https://www.turnermotorsport.com/c-845-bmw-thermostats?No=150&Nrpp=50#,
https://www.turnermotorsport.com/p-20682-12517646145-genuine-bmw-part/,Genuine MINI Adapter Lead,20682,12517646145,$40.60,https://www.turnermotorsport.com/c-845-bmw-thermostats?No=150&Nrpp=50#,"Genuine MINI ADAPTER LEAD 12517646145    N14,N16"
https://www.turnermotorsport.com/p-587660-thermostat-housing-aluminum/,Thermostat Housing - Aluminum,587660,11537512733-PRM,$42.95,https://www.turnermotorsport.com/c-845-bmw-thermostats?No=150&Nrpp=50#,Metal version of the plastic thermostat housing
https://www.turnermotorsport.com/p-1211191-thermostat/,Thermostat,1211191,11518601366,$85.95,https://www.turnermotorsport.com/c-845-bmw-thermostats?No=150&Nrpp=50#,
https://www.turnermotorsport.com/p-583871-thermostat-housing-w-thermostat-kit-priced-as-kit/,Thermostat Housing W/ Thermostat Kit - Priced As Kit,583871,11538699290,$73.95,https://www.turnermotorsport.com/c-845-bmw-thermostats?No=150&Nrpp=50#,
https://www.turnermotorsport.com/p-393397-genuine-mini-thermostat-housing-w-thermostat-kit/,Genuine MINI Thermostat Housing W/ Thermostat Kit,393397,11538674895,$173.30,https://www.turnermotorsport.com/c-845-bmw-thermostats?No=150&Nrpp=50#,"This Genuine MINI part is typically referred to as the thermostat neck / housing, this part mounts on the highest point on the head and controls the flow back to the pressure tank. Cracking, which usually occurs around the gasket seal and leaks, are symptoms that it’s worn out. Up to 7/2012 production will need adapter     .   Production  7/2012 - 2/2013 will need adapter   .  2/2013 + need no adapter."
https://www.turnermotorsport.com/p-174393-13628603908-genuine-bmw-part/,Genuine MINI Temperature Sensor,174393,13628603908,$36.06,https://www.turnermotorsport.com/c-845-bmw-thermostats?No=150&Nrpp=50#,"Genuine MINI TEMPERATURE SENSOR, COOLANT"
https://www.turnermotorsport.com/p-19202-11531486703-genuine-bmw-part/,Genuine MINI Thermostat Housing Cap / Radiator Cap,19202,11531486703,$21.00,https://www.turnermotorsport.com/c-845-bmw-thermostats?No=150&Nrpp=50#,Genuine MINI ENGINE RADIATOR CAP    W10
https://www.turnermotorsport.com/p-599063-thermostat-housing-w-thermostat-kit/,Thermostat Housing W/ Thermostat Kit,599063,11538674895,$57.95,https://www.turnermotorsport.com/c-845-bmw-thermostats?No=150&Nrpp=50#,
https://www.turnermotorsport.com/p-567822-thermostat-housing-w-thermostat-kit/,Thermostat Housing W/ Thermostat Kit,567822,11538674895,$102.96,https://www.turnermotorsport.com/c-845-bmw-thermostats?No=150&Nrpp=50#,
https://www.turnermotorsport.com/p-637163-thermostat-housing-cap-radiator-cap/,Thermostat Housing Cap / Radiator Cap,637163,11531486703,$4.95,https://www.turnermotorsport.com/c-845-bmw-thermostats?No=150&Nrpp=50#,
https://www.turnermotorsport.com/p-600498-adapter-lead/,Adapter Lead,600498,12517646145,$26.25,https://www.turnermotorsport.com/c-845-bmw-thermostats?No=150&Nrpp=50#,