product-img-link href,cleanDesc,part-info,part-info 2,price,wishlist-label href,short-description
https://www.turnermotorsport.com/p-10162-genuine-bmw-trim-knurled-bolt-51718181460/,"Genuine BMW Rear Subframe Mounting Bolt - E34, E30, E32",10162,51718181460,$15.87,https://www.turnermotorsport.com/c-600-bmw-subframe?No=96&Nrpp=48#,"Genuine BMW Knurled Bolt    E30 M3,E34 M5,E30,E34"
https://www.turnermotorsport.com/p-340768-e46-non-m-oemhd-rear-subframe-mount-set/,E46 non-M OEM/HD Rear Subframe Mount Set,340768,33316770781KT,$68.21,https://www.turnermotorsport.com/c-600-bmw-subframe?No=96&Nrpp=48#,"The heart of the rear suspension, the subframe (or carrier) mounts located the entire rear suspension to the car. There are four mounts in total and bolt up into the rear floor. Worn subframe mounts are one of the leading contributors to rear floor-subframe failure. As the mounts flex, so does the sheetmetal of the chassis, which will fatigue the sheetmetal and crack the spot welds. Therefore, replacement of the subframe mounts is critical and a must when doing the subframe reinforcement or repair. This kit comprises OEM Lemforder and Meyle HD rubber subframe mounts. Solid aluminum mounts are also available with very little increase in NVH."
https://www.turnermotorsport.com/p-348921-e46-non-m-rear-subframe-mount-front-left/,"Meyle Heavy Duty Rear Subframe Front Left Mount - E46 non-M
       ...",348921,33316770783,$24.95,https://www.turnermotorsport.com/c-600-bmw-subframe?No=96&Nrpp=48#,"Bushings tends to wear over time and split or even break free from the internal sleeve, causing excessive movement and sloppy control feel.  Meyle HD bushings are the perfect option to improve your suspension."
https://www.turnermotorsport.com/p-371847-rear-subframe-bushings-pair/,Febi Rear Subframe Bushings - Pair - E36,371847,33319059300,$25.95,https://www.turnermotorsport.com/c-600-bmw-subframe?No=96&Nrpp=48#,Bushings in the front location of the axle carrier
https://www.turnermotorsport.com/p-174560-22116784824-genuine-bmw-part/,"Engine Supporting Bracket - Right - F25, F26, F30, F31, F32, F33, F3...",174560,22116784824,$114.22,https://www.turnermotorsport.com/c-600-bmw-subframe?No=96&Nrpp=48#,"Genuine BMW Engine Supporting Bracket, Right -     F25 X3,F26 X4,F30,F31,F32,F33,F34"
https://www.turnermotorsport.com/p-60038-33311136428-genuine-bmw-part/,Genuine BMW Subframe Bushing Bolt,60038,33311136428,$18.11,https://www.turnermotorsport.com/c-600-bmw-subframe?No=96&Nrpp=48#,Genuine BMW Threaded Bolt -     E36
https://www.turnermotorsport.com/p-383992-performance-polyurethane-rear-subframe-bushing-set-front-position/,"Powerflex Performance Polyurethane Rear Subframe Bushing Set - E36
...",383992,PFR5-3617X2,$79.99,https://www.turnermotorsport.com/c-600-bmw-subframe?No=96&Nrpp=48#,"Tasked with keeping the vehicles rear end firmly mounted while absorbing noise, vibration, and harshness (NVH) factory rubber subframe bushings were engineered to provide a balance of control while keeping the ride quality soft and supple. As a factory bushings age, they become brittle and begin to harden. When this happens the bushing will actually shrink and allow excess play, or movement in the subframe. This is typically felt by a sudden jerk or ""thunking"" noise under acceleration and is a leading cause of ""sloppy"" or ""loose"" suspension feel. By replacing the bushings with full polyurethane this play is eliminated since the subframe is being held in place by a much stiffer material that will not harden or shrink over time. Additionally, the inherent stiffness of the urethane material translates body forces much more directly. This means steering and acceleration inputs from the driver are effectively transferred to the wheels and vital road information is transmitted properly from the wheels to the driver."
https://www.turnermotorsport.com/p-362769-rear-subframe-bushing-front-right/,"Vaico Rear Subframe Bushing - Front Right - E46, E83",362769,33316757394,$14.95,https://www.turnermotorsport.com/c-600-bmw-subframe?No=96&Nrpp=48#,Front right position on the rear subframe
https://www.turnermotorsport.com/p-376546-performance-polyurethane-subframe-inserts-rear-position-set/,Powerflex Performance Polyurethane Rear Subframe Rear Position Inser...,376546,PFR5-423X2,$82.99,https://www.turnermotorsport.com/c-600-bmw-subframe?No=96&Nrpp=48#,"Tasked with keeping the vehicles rear end firmly mounted while absorbing noise, vibration, and harshness (NVH) factory rubber subframe bushings were engineered to provide a balance of control while keeping the ride quality soft and supple. As a factory bushings age, they become brittle and begin to harden. When this happens the bushing will actually shrink and allow excess play, or movement in the subframe. This is typically felt by a sudden jerk or ""thunking"" noise under acceleration and is a leading cause of ""sloppy"" or ""loose"" suspension feel. These poly inserts provide the inherent benefit of stiffness, which translates body forces much more directly. This means steering and acceleration inputs from the driver are effectively transferred to the wheels and vital road information is transmitted properly from the wheels to the driver."
https://www.turnermotorsport.com/p-12734-oem-lemforder-rear-subframe-mount-rear-mount-e46-non-m/,"OEM Lemforder Rear Subframe Mount (Rear Mount) - E46 non-M
        ...",12734,33316770781,$19.95,https://www.turnermotorsport.com/c-600-bmw-subframe?No=96&Nrpp=48#,"Exposure to the elements and stress/pressure can lead to failing and splitting subframe bushings. Ensure your subframe is mounted perfectly steady to prevent vibrations, knocks, suspension issues, and potential damage to the body of the vehicle or suspension components. OEM Lemforder is the perfect replacement to make sure that everything is mounted properly."
https://www.turnermotorsport.com/p-18978-genuine-bmw-rubber-mounting-rear-33312283383/,Genuine BMW Rubber Mounting Rear 33312283383,18978,33312283383,$94.95,https://www.turnermotorsport.com/c-600-bmw-subframe?No=96&Nrpp=48#,Genuine BMW REAR AXLE RUBBER MOUNTING REAR
https://www.turnermotorsport.com/p-379914-performance-polyurethane-rear-subframe-bushing-set-rear-position/,Powerflex Polyurethane Rear Subframe Rear Position Bushing Insert Se...,379914,PFR5-1423X2,$87.99,https://www.turnermotorsport.com/c-600-bmw-subframe?No=96&Nrpp=48#,"Tasked with keeping the vehicles rear end firmly mounted while absorbing noise, vibration, and harshness (NVH) factory rubber subframe bushings were engineered to provide a balance of control while keeping the ride quality soft and supple. As a factory bushings age, they become brittle and begin to harden. When this happens the bushing will actually shrink and allow excess play, or movement in the subframe. This is typically felt by a sudden jerk or ""thunking"" noise under acceleration and is a leading cause of ""sloppy"" or ""loose"" suspension feel. These poly inserts provide the inherent benefit of stiffness, which translates body forces much more directly. This means steering and acceleration inputs from the driver are effectively transferred to the wheels and vital road information is transmitted properly from the wheels to the driver."
https://www.turnermotorsport.com/p-362768-rear-subframe-bushing-front-left/,"Vaico Rear Subframe Bushing - Front Left - E46, E83",362768,33316757393,$14.95,https://www.turnermotorsport.com/c-600-bmw-subframe?No=96&Nrpp=48#,Front left position on the rear subframe
https://www.turnermotorsport.com/p-20833-33176760342-genuine-bmw-part/,Genuine BMW Hex Bolt With Washer 33176760342,20833,33176760342,$11.14,https://www.turnermotorsport.com/c-600-bmw-subframe?No=96&Nrpp=48#,Genuine BMW Hex Bolt With Washer.
https://www.turnermotorsport.com/p-363818-rear-subframe-bushing-priced-each/,"Febi Rear Subframe Bushing - E46, E83, Z4",363818,33316770781,$10.95,https://www.turnermotorsport.com/c-600-bmw-subframe?No=96&Nrpp=48#,"Rear position of the subframe, 2 required per car"
https://www.turnermotorsport.com/p-362124-rear-subframe-bushing-priced-each/,Rear Subframe Bushing - Priced Each,362124,33311090946,$11.85,https://www.turnermotorsport.com/c-600-bmw-subframe?No=96&Nrpp=48#,The subframe provides mounting for your rear suspension. The subframe connects to the body with bushings to absorb vibration at all mounting locations. These bushings absorb any vibration that would normally be transmitted to the cabin and keep the subframe solid. They also provide a solid mounting location to keep everything tight.
https://www.turnermotorsport.com/p-638045-polyurethane-subframe-bushings-f30-f32-ecs/,"ECS Performance Polyurethane Subframe Bushing Set - 95A - F3x 
    ...",638045,006012LA01KT,$268.80,https://www.turnermotorsport.com/c-600-bmw-subframe?No=96&Nrpp=48#,95A Polyurethane bushings reduce subframe bushing deflection while keeping vibrations associated with such modification to a minimum.
https://www.turnermotorsport.com/p-383991-performance-polyurethane-rear-subframe-bushing-set-rear-position/,Powerflex Polyurethane Rear Subframe Rear Position Bushing Set - E36...,383991,PFR5-3616X2,$79.99,https://www.turnermotorsport.com/c-600-bmw-subframe?No=96&Nrpp=48#,"Tasked with keeping the vehicles rear end firmly mounted while absorbing noise, vibration, and harshness (NVH) factory rubber subframe bushings were engineered to provide a balance of control while keeping the ride quality soft and supple. As a factory bushings age, they become brittle and begin to harden. When this happens the bushing will actually shrink and allow excess play, or movement in the subframe. This is typically felt by a sudden jerk or ""thunking"" noise under acceleration and is a leading cause of ""sloppy"" or ""loose"" suspension feel. By replacing the bushings with full polyurethane this play is eliminated since the subframe is being held in place by a much stiffer material that will not harden or shrink over time. Additionally, the inherent stiffness of the urethane material translates body forces much more directly. This means steering and acceleration inputs from the driver are effectively transferred to the wheels and vital road information is transmitted properly from the wheels to the driver."
https://www.turnermotorsport.com/p-206392-22116860273-genuine-bmw-part/,"Engine Supporting Bracket - Left - F32, F33, F34, F36",206392,22116860273,$100.33,https://www.turnermotorsport.com/c-600-bmw-subframe?No=96&Nrpp=48#,"Genuine BMW Engine Supporting Bracket, Left -     F32,F33,F34,F36"
https://www.turnermotorsport.com/p-362252-heavy-duty-rear-subframe-bushing-priced-each/,Meyle Heavy Duty Rear Subframe Bushing - E53 X5,362252,33316770454,$32.95,https://www.turnermotorsport.com/c-600-bmw-subframe?No=96&Nrpp=48#,"Bushings tends to wear over time and split or even break free from the internal sleeve, causing excessive movement and sloppy control feel. OEM Lemförder bushings are the perfect option to upgrade your suspension.Meyle is a German brand in business since 1958 and all of their products are TUV approved and meet or exceed ISO standards. Heavy Duty components are designed to provide significantly long lifespans than other aftermarket and stock OE components. Each part includes a 4 year warranty."
https://www.turnermotorsport.com/p-579245-bmw-rear-subframe-bushing-meyle/,"Meyle Rear Subframe Bushing - E36, Z3",579245,3003331001,$13.95,https://www.turnermotorsport.com/c-600-bmw-subframe?No=96&Nrpp=48#,Bushing that holds the subframe onto the body
https://www.turnermotorsport.com/p-360863-rear-differential-bushing-priced-each/,Genuine BMW Rear Differential Bushing - E39,360863,33171093008,$26.14,https://www.turnermotorsport.com/c-600-bmw-subframe?No=96&Nrpp=48#,
https://www.turnermotorsport.com/p-382073-rear-subframe-bushings-pair/,Febi Rear Subframe Bushings - Pair - E36,382073,33319059301,$37.95,https://www.turnermotorsport.com/c-600-bmw-subframe?No=96&Nrpp=48#,Bushings in the rear location of the axle carrier
https://www.turnermotorsport.com/p-340200-3-series-rear-suspension-mount-package-solid-race-bushings-e46-m3/,3-series Rear Suspension Mount Package - Solid Race Bushings - E46 M...,340200,TMS11755,$196.95,https://www.turnermotorsport.com/c-600-bmw-subframe?No=96&Nrpp=48#,"Building a track-only or racecar means swapping out the flexible rubber bushings and mounts for non-distorting solid pieces. The stock rubber bushings have serious drawbacks when used hard on the racetrack - they wear out quickly, and the flexible material allows extreme changes in alignment. Switching to solid bushings will eliminate the deflection and flex, keeping the suspension motions in their intended alignment and providing more feedback to the driver. On the E46 M3, solid bushings can help prevent rear subframe failure as the sheetmetal chassis will no longer flex along with the rubber mount. Depending on the bushing's intended purpose, the material we use is either aluminum or Delrin. Delrin is a dense plastic material that has almost zero deflection and long life. It's self-lubricating so it won't ever need grease or lube. All of our bushings are designed by our in-house R&D engineers and tested on our various racing cars, with many used in professional racing series around the world.   If you're building a car for a racing class, the parts and materials you can change to are specified in the rules. Consult your rulebook or tech steward for any clarification. As these bushings have no play or deflection in them, they are not intended for street-focused cars - they do not absorb impacts and vibration like rubber will.     subframe mounts x 4 (aluminum)  inner-upper control arm bushings x 2 (aluminum with bearing)  differential mounts x 3 (1 Delrin, 2 aluminum)  outer upper/lower control arm bushings x 4 (OE-spec replacements) (steel with bearing)  trailing arm bushings (RTABs) x 2 (aluminum with bearing or Delrin)  suggested: front control arm bushings (FCABs) (Delrin)  suggested: rear shock mounts (RSMs) x 2 (aluminum with bearing)     Note 1: there is also a inner-lower camber arm bushing. We never developed a solid bushing for this point because every racing class allows adjustable camber arms to be used in this location and we offer those with solid inner bushings.  Note 2: some racing classes require a non-bearing bushing for the rear trailing arm bushings. In cases like this, we use a Delrin bushing.  Note 3: the outer upper and lower bushings are already a monoball-style bearing from the factory on all M3 models. They are a great design and last a long time. We offer them here as direct replacements.     2001-2006    M3 M3 CSL"
https://www.turnermotorsport.com/p-13483-33321095102-genuine-bmw-part/,"Genuine BMW Eccentric Bolt M12X1,5X98 - 33321095102 - E39",13483,33321095102,$19.46,https://www.turnermotorsport.com/c-600-bmw-subframe?No=96&Nrpp=48#,"Genuine BMW Eccentric Bolt - M12X1,5X98    E39"
https://www.turnermotorsport.com/p-372986-subframe-mount-bushing-priced-each/,Subframe Mount Bushing - Priced Each,372986,33311129760,$19.98,https://www.turnermotorsport.com/c-600-bmw-subframe?No=96&Nrpp=48#,The subframe provides mounting for your rear suspension. The subframe connects to the body with bushings to absorb vibration at all mounting locations. These bushings absorb any vibration that would normally be transmitted to the cabin and keep the subframe solid. They also provide a solid mounting location to keep everything tight.
https://www.turnermotorsport.com/p-580375-tool-subframe-bushing-tool-bavarian-autosport/,Tool - Subframe Bushing Tool - Bavarian Autosport,580375,B8800054,$145.95,https://www.turnermotorsport.com/c-600-bmw-subframe?No=96&Nrpp=48#,
https://www.turnermotorsport.com/p-194638-22116854886-genuine-bmw-part/,Engine Supporting Bracket - Right - F10,194638,22116854886,$100.33,https://www.turnermotorsport.com/c-600-bmw-subframe?No=96&Nrpp=48#,"Genuine BMW Engine Supporting Bracket, Right -     F10"
https://www.turnermotorsport.com/p-60002-33311093936-genuine-bmw-part/,Genuine BMW Rear sub frame bushing stop - E39,60002,33311093936,$17.96,https://www.turnermotorsport.com/c-600-bmw-subframe?No=96&Nrpp=48#,"Genuine BMW Stopper    E39 M5,E39"
https://www.turnermotorsport.com/p-338094-rear-subframe-bushingsmounts-forefront-pair-e36-m3-upgrade-for-e36-non-m-pair/,Rear Subframe Bushings/Mounts - Fore/Front Pair - E36 M3 (Upgrade fo...,338094,33319066671,$128.37,https://www.turnermotorsport.com/c-600-bmw-subframe?No=96&Nrpp=48#,"On 1992-1999 E36 chassis 3 series, the subframe mounts are known to suffer failures, particularly after many miles and/or harsher driving conditions. When subframe bushings fail, it wreaks havoc with your BMW's suspension alignment and geometry.   There are four bushings/mounts connecting the subframe to the chassis.    (stock) for the 1995-1999 M3 (E36), but can also be used on all 1992-1999 3 series (E36 chassis) BMW's as an upgrade over the stock subframe mounts. **We highly recommend also getting the aft (rear) pair of rear subframe bushings as well. These are available seperately (pn# 33319059301), or they can be combined with these (simply select that you also want the rear-most pair as well on the drop-down box below).      The slightly firmer rubber is more durable than the stock non-M subframe mounts, and as such we highly recommend these bushings for all E36 chassis 318i, 318is, 325i, 325is, 323is, 328i, and 328is.    These mounts are sold as a pair, so two are included for this price."
https://www.turnermotorsport.com/p-376390-performance-polyurethane-subframe-bushings-rear-position-set/,"Powerflex Performance Polyurethane Subframe Bushings - E6X Non-M
  ...",376390,PFR5-722X2,$154.99,https://www.turnermotorsport.com/c-600-bmw-subframe?No=96&Nrpp=48#,"Tasked with keeping the vehicles rear end firmly mounted while absorbing noise, vibration, and harshness (NVH) factory rubber subframe bushings were engineered to provide a balance of control while keeping the ride quality soft and supple. As a factory bushings age, they become brittle and begin to harden. When this happens the bushing will actually shrink and allow excess play, or movement in the subframe. This is typically felt by a sudden jerk or ""thunking"" noise under acceleration and is a leading cause of ""sloppy"" or ""loose"" suspension feel. By replacing the bushings with full polyurethane this play is eliminated since the subframe is being held in place by a much stiffer material that will not harden or shrink over time. Additionally, the inherent stiffness of the urethane material translates body forces much more directly. This means steering and acceleration inputs from the driver are effectively transferred to the wheels and vital road information is transmitted properly from the wheels to the driver."
https://www.turnermotorsport.com/p-361985-rear-subframe-bushings-pair/,URO Rear Subframe Bushings - Pair - E36,361985,33319059300,$13.32,https://www.turnermotorsport.com/c-600-bmw-subframe?No=96&Nrpp=48#,Bushings in the front location of the axle carrier
https://www.turnermotorsport.com/p-382591-rear-subframe-bushing-front-left/,"Febi Rear Subframe Bushing - Front Left - E46, E83",382591,33316770783,$13.22,https://www.turnermotorsport.com/c-600-bmw-subframe?No=96&Nrpp=48#,Front left position on the rear subframe
https://www.turnermotorsport.com/p-579502-rear-suspension-carrier-mount-lemfoerder/,"Lemforder Rear Subframe Bushing Mount - F01, F02, F06, F07, F10, F12...",579502,3470901,$67.95,https://www.turnermotorsport.com/c-600-bmw-subframe?No=96&Nrpp=48#,Front position bushing.
https://www.turnermotorsport.com/p-376496-race-polyurethane-subframe-insert-set/,"Race Polyurethane Subframe Insert Set - E8X, E9X",376496,PFR5-421BX2,$91.99,https://www.turnermotorsport.com/c-600-bmw-subframe?No=96&Nrpp=48#,"Tasked with keeping the vehicles rear end firmly mounted while absorbing noise, vibration, and harshness (NVH) factory rubber subframe bushings were engineered to provide a balance of control while keeping the ride quality soft and supple. As a factory bushings age, they become brittle and begin to harden. When this happens the bushing will actually shrink and allow excess play, or movement in the subframe. This is typically felt by a sudden jerk or ""thunking"" noise under acceleration and is a leading cause of ""sloppy"" or ""loose"" suspension feel. By replacing the bushings with full polyurethane this play is eliminated since the subframe is being held in place by a much stiffer material that will not harden or shrink over time. Additionally, the inherent stiffness of the urethane material translates body forces much more directly. This means steering and acceleration inputs from the driver are effectively transferred to the wheels and vital road information is transmitted properly from the wheels to the driver."
https://www.turnermotorsport.com/p-379913-performance-polyurethane-rear-subframe-bushing-set-front-position/,Powerflex Polyurethane Rear Subframe Front Position Bushing Insert S...,379913,PFR5-1421X2,$87.99,https://www.turnermotorsport.com/c-600-bmw-subframe?No=96&Nrpp=48#,"Tasked with keeping the vehicles rear end firmly mounted while absorbing noise, vibration, and harshness (NVH) factory rubber subframe bushings were engineered to provide a balance of control while keeping the ride quality soft and supple. As a factory bushings age, they become brittle and begin to harden. When this happens the bushing will actually shrink and allow excess play, or movement in the subframe. This is typically felt by a sudden jerk or ""thunking"" noise under acceleration and is a leading cause of ""sloppy"" or ""loose"" suspension feel. These poly inserts provide the inherent benefit of stiffness, which translates body forces much more directly. This means steering and acceleration inputs from the driver are effectively transferred to the wheels and vital road information is transmitted properly from the wheels to the driver."
https://www.turnermotorsport.com/p-577546-2002-subframe-mount-uhmw/,Condor Speed Shop Solid Subframe Mount Set - UHMW with Aluminum Slee...,577546,SUB02,$99.00,https://www.turnermotorsport.com/c-600-bmw-subframe?No=96&Nrpp=48#,"2002 Solid Subframe Mount Set - UHMW with Aluminum Sleeve for your ""E10 Series"" BMW. 1600-2: 1966–1971 2002: 1968–1976 1602, 1802: 1971–1975 1502: 1975–1977 UHMW is an excellent general-purpose plastic with a unique combination of wear and corrosion resistance, low friction surface and impact strength. It is resistant to chemical attack and moisture absorption and retains key physical properties to -30 C."
https://www.turnermotorsport.com/p-376430-performance-polyurethane-rear-subframe-bushings-rear-position-set/,"Powerflex Performance Polyurethane Rear Subframe Bushings - E8X, E9X...",376430,PFR5-422X2,$161.99,https://www.turnermotorsport.com/c-600-bmw-subframe?No=96&Nrpp=48#,"Sway bars transmit cornering forces from the outside wheels to the inside wheels, helping to keep the vehicle flat during cornering. This in turn reduces body roll and improves the driver's cornering confidence. OEM rubber sway bar bushings are designed with comfort in mind, allowing the sway bar to articulate while permitting additional movement, leading to less-than-ideal bar retention and causes unnecessary body roll."
