product-img-link href,cleanDesc,part-info,part-info 2,price,wishlist-label href,short-description
https://www.turnermotorsport.com/p-194581-18307850435-genuine-bmw-part/,"Pipe Clamp - Bottom - F80, F82, F83, F87",194581,18307850435,$33.09,https://www.turnermotorsport.com/c-148-bmw-gaskets-hangers-and-parts?No=150&Nrpp=50#,"Genuine BMW Pipe Clamp, Bottom -     F80 M3,F82 M4,F83     S55"
https://www.turnermotorsport.com/p-47462-18111719371-genuine-bmw-part/,Genuine BMW Exhaust Flange - E31 850Ci 850CSi E32 740i 740iL E34 540...,47462,18111719371,$20.72,https://www.turnermotorsport.com/c-148-bmw-gaskets-hangers-and-parts?No=150&Nrpp=50#,"Genuine BMW Flange -     E34     M60,M70,S70"
https://www.turnermotorsport.com/p-2631921-genuine-v-band-exhaust-clamp-priced-each/,Genuine V-Band Exhaust Clamp - Priced Each,2631921,11658585233,$26.86,https://www.turnermotorsport.com/c-148-bmw-gaskets-hangers-and-parts?No=150&Nrpp=50#,
https://www.turnermotorsport.com/p-580077-exhaust-manifold-heat-shield-gasket-elring/,Elring Exhaust Manifold Heat Shield Gasket - Elring - E30,580077,835.102,$11.95,https://www.turnermotorsport.com/c-148-bmw-gaskets-hangers-and-parts?No=150&Nrpp=50#,Replacement equivalent to OE
https://www.turnermotorsport.com/p-48655-18307841713-genuine-bmw-part/,"Exhaust Clamp - E90, E92, E93",48655,18307841713,$24.81,https://www.turnermotorsport.com/c-148-bmw-gaskets-hangers-and-parts?No=150&Nrpp=50#,"Genuine BMW Right Pipe Clamp -     E90,E92,E93     S65"
https://www.turnermotorsport.com/p-198704-18307850436-genuine-bmw-part/,"Pipe Clamp - Top - F80, F82, F83, F87",198704,18307850436,$33.09,https://www.turnermotorsport.com/c-148-bmw-gaskets-hangers-and-parts?No=150&Nrpp=50#,"Genuine BMW Pipe Clamp, Top -     F80 M3,F82 M4,F83     S55"
https://www.turnermotorsport.com/p-47764-18207548740-genuine-bmw-part/,Genuine BMW Exhaust clamp - E70 X5 xDrive48i,47764,18207548740,$33.09,https://www.turnermotorsport.com/c-148-bmw-gaskets-hangers-and-parts?No=150&Nrpp=50#,Genuine BMW Clamp - D = 76mm    E70 X5     N62N
https://www.turnermotorsport.com/p-587720-exhaust-manifold-gasket-priced-each/,Elring Exhaust Manifold Gasket - F30,587720,11657625293,$3.95,https://www.turnermotorsport.com/c-148-bmw-gaskets-hangers-and-parts?No=150&Nrpp=50#,Gasket between exhaust manifold and cylinder head
https://www.turnermotorsport.com/p-114778-51488051598-genuine-bmw-part/,Genuine BMW Underbody heat shield - E82 1 M Coupe,114778,51488051598,$71.52,https://www.turnermotorsport.com/c-148-bmw-gaskets-hangers-and-parts?No=150&Nrpp=50#,"Genuine BMW Heat Insulator Rear Silencer    E82 1M Coupe,E82"
https://www.turnermotorsport.com/p-363233-exhaust-downpipe-gasket-priced-each/,Victor Reinz Exhaust Downpipe Gasket,363233,18107549447,$9.95,https://www.turnermotorsport.com/c-148-bmw-gaskets-hangers-and-parts?No=150&Nrpp=50#,Exhaust gasket for the exhaust manifold downpipe
https://www.turnermotorsport.com/p-48709-18311716874-genuine-bmw-part/,Holder - E31,48709,18311716874,$13.57,https://www.turnermotorsport.com/c-148-bmw-gaskets-hangers-and-parts?No=150&Nrpp=50#,"Genuine BMW BRACKET    M70,S70"
https://www.turnermotorsport.com/p-47362-18107549447-genuine-bmw-part/,Genuine BMW Exhaust Downpipe Gasket - N52 3.0L,47362,18107549447,$23.52,https://www.turnermotorsport.com/c-148-bmw-gaskets-hangers-and-parts?No=150&Nrpp=50#,"Genuine BMW Flat Gasket -     E82,E83 X3,E85,E86,E89 Z4,E90,E92,E93,F10,F25 X3     N51,N52,N52N"
https://www.turnermotorsport.com/p-37245-11717809743-genuine-bmw-part/,Genuine BMW Exhaust Gasket - EGR Cooler to Diesel Particulate Filter...,37245,11717809743,$14.35,https://www.turnermotorsport.com/c-148-bmw-gaskets-hangers-and-parts?No=150&Nrpp=50#,Genuine BMW Gasket Steel -     E70 X5     M57
https://www.turnermotorsport.com/p-48719-18311742800-genuine-bmw-part/,Bracket Left - E38,48719,18311742800,$22.10,https://www.turnermotorsport.com/c-148-bmw-gaskets-hangers-and-parts?No=150&Nrpp=50#,"Genuine BMW Bracket Left -     E38     M73,M73N"
https://www.turnermotorsport.com/p-36845-11627789015-genuine-bmw-part/,Genuine BMW Copper Flange Nut - Exhaust Manifold to Cylinder Head - ...,36845,11627789015,$0.99,https://www.turnermotorsport.com/c-148-bmw-gaskets-hangers-and-parts?No=150&Nrpp=50#,"Genuine BMW Flange Nut - M8    E70 X5,E90     M57"
https://www.turnermotorsport.com/p-600485-powerflex-rear-muffler-hanger-race-version-e36-e46-e9x-m3-e39-m5-z4-m/,"Powerflex Rear Muffler Hanger - Race Version - E36 E46 E9X M3, E39 M...",600485,EXH034BLK,$96.99,https://www.turnermotorsport.com/c-148-bmw-gaskets-hangers-and-parts?No=150&Nrpp=50#,"BMW's original muffler hanger (part number 18201401797) works great at first but tends to fail over time, leading to sloppy exhaust movement and excessive noise. This failure is due to both heat and the heavy exhaust wearing down the hanger until it eventually tears, allowing the exhaust to shift around freely, banging off of nearby components. In order to address this common problem, Powerflex developed their own polyurethane rear muffler hanger that features a heavy-duty, yet lightweight, machined aluminum bracket. Polyurethane is significantly more resistant to the effects of heat and weight over time compared to rubber, meaning you can expect this exhaust hanger to last many times longer than your stock BMW hanger."
https://www.turnermotorsport.com/p-388461-exhaust-gasket-ring/,"HJS Exhaust Gasket Ring - E36, E46, Z3, Z4",388461,18111723379,$7.95,https://www.turnermotorsport.com/c-148-bmw-gaskets-hangers-and-parts?No=150&Nrpp=50#,Seals the mid-pipe to the muffler
https://www.turnermotorsport.com/p-379087-gasket-ring-priced-each/,"Gasket Ring - N51, N52 -  Priced Each",379087,18407530606,$4.69,https://www.turnermotorsport.com/c-148-bmw-gaskets-hangers-and-parts?No=150&Nrpp=50#,"This item fits the following BMW Chassis: E70 X5,E82,E83 X3,E85,E86,E89 Z4,E90,E92,E93,F10,F25 X3 Fits BMW Engines including: N51,N52,N52N"
https://www.turnermotorsport.com/p-378106-rubber-exhaust-hanger-priced-each/,HJS Rubber Exhaust Hanger - E34,378106,18211728332,$3.30,https://www.turnermotorsport.com/c-148-bmw-gaskets-hangers-and-parts?No=150&Nrpp=50#,Keeps your exhaust secure.
https://www.turnermotorsport.com/p-594661-exhaust-gasket-priced-each/,Exhaust Gasket - Priced Each,594661,18301716888,$1.99,https://www.turnermotorsport.com/c-148-bmw-gaskets-hangers-and-parts?No=150&Nrpp=50#,
https://www.turnermotorsport.com/p-222785-e36-track-pipe-mid-section-gasket/,E36 Track Pipe Mid-Section Gasket,222785,TMS222785,$19.95,https://www.turnermotorsport.com/c-148-bmw-gaskets-hangers-and-parts?No=150&Nrpp=50#,"This is the metal flange gasket that fits between the two sections of the Active Autowerke Track Pipe for E36. It's a 2-bolt gasket with 3.0"" ID.   Fits    with AA Track Pipe."
https://www.turnermotorsport.com/p-370064-exhaust-manifold-gasket-victor-reinz/,"Victor Reinz Exhaust Manifold Gasket - E31, E32, E34, E38, E39, E52,...",370064,11627509677,$7.95,https://www.turnermotorsport.com/c-148-bmw-gaskets-hangers-and-parts?No=150&Nrpp=50#,Located between the exhaust manifold and the engine
https://www.turnermotorsport.com/p-1293-e36-rubber-exhaust-hanger-non-m/,E36 Rubber Exhaust Hanger (non-M),1293,18211723101,$6.08,https://www.turnermotorsport.com/c-148-bmw-gaskets-hangers-and-parts?No=150&Nrpp=50#,"This is the rubber exhaust hanger that supports the rear muffler on non-M E36 3 series from 1992-1999. It fits 318i/is/iC 1992-1995, 325i/is/iC 1992-1995, and 328i/is/iC 1996-1999."
https://www.turnermotorsport.com/p-567716-akrapovic-sound-kit-f87-m2-competition/,Akrapovic Sound Kit - F87 M2 Competition,567716,AKRP-HF1177,$682.52,https://www.turnermotorsport.com/c-148-bmw-gaskets-hangers-and-parts?No=150&Nrpp=50#,"The optional Akrapovič Sound Kit enables owners of selected Akrapovič car exhausts to control the sound of the system from the cockpit of their machine. Using Akrapovič technology, drivers can easily switch between the quiet mode and a sportier sound. With the use of a receiver to drive the actuators that open or close the valves at the end of the exhaust system, drivers can use the Sound Remote Controller or the new smartphone app (for iOS and Android) to regulate the valves."
https://www.turnermotorsport.com/p-589973-awe-quad-tip-marking-template-for-bmw-f3x-328i428i-non-m-sport/,"AWE Quad Tip Marking Template for BMW F3X 328i/428i Non-M Sport
   ...",589973,6510-11016,$89.95,https://www.turnermotorsport.com/c-148-bmw-gaskets-hangers-and-parts?No=150&Nrpp=50#,Quad tip Template For Non-M Bumper. This template is designed to make the trimming of the rear diffuser much easier. Use this template to trace a cutout for the dual exhaust. This will allow for an accurate cut that looks like it's from the factory.
https://www.turnermotorsport.com/p-342439-tms342439/,Wireless Exhaust Valve Control - Sound Kit,342439,P-HF878,$924.46,https://www.turnermotorsport.com/c-148-bmw-gaskets-hangers-and-parts?No=150&Nrpp=50#,
https://www.turnermotorsport.com/p-13175-oem-lemforder-radiator-rubber-mounting-e21-e30-e36-e12-e28-e34-e39-e24-e23-e38-e31-z3/,OEM Lemforder Radiator Rubber Mounting - E21 E30 E36 E12 E28 E34 E39...,13175,17111113699,$3.06,https://www.turnermotorsport.com/c-148-bmw-gaskets-hangers-and-parts?No=150&Nrpp=50#,"Bushings tends to wear over time and split or even break free from the internal sleeve, causing excessive movement and sloppy control feel. OEM Lemförder bushings are the perfect option to restore suspension back to day 1 quality."
https://www.turnermotorsport.com/p-591912-bmw-gasket-exhaust-manifold/,Elring Exhaust Manifold Gasket - Manifold to Cylinder Head - F01 F02...,591912,11627614095,$21.43,https://www.turnermotorsport.com/c-148-bmw-gaskets-hangers-and-parts?No=150&Nrpp=50#,
https://www.turnermotorsport.com/p-13202-18211712838-genuine-bmw-part/,"Fischer and Plath Rubber Exhaust Hanger - E30, E32, E34",13202,18211712838,$1.03,https://www.turnermotorsport.com/c-148-bmw-gaskets-hangers-and-parts?No=150&Nrpp=50#,RUBBER RING:H1810D
https://www.turnermotorsport.com/p-394612-exhaust-valve-controller-sound-kit-f8586-x5-m-x6-m/,"Exhaust Valve Controller Sound Kit - F85/86 X5 M, X6 M",394612,P-HF947,$756.07,https://www.turnermotorsport.com/c-148-bmw-gaskets-hangers-and-parts?No=150&Nrpp=50#,The Akrapovic Sound Kit is a wireless exhaust valve control system that allows you full control over the valve system in your titanium Akrapovic exhaust. This enable you to open the exhaust valve when you want to turn as many heads as possible or keep it closed when your out for an easy Sunday drive.
https://www.turnermotorsport.com/p-592228-bmw-gasket-exhaust-pipe/,Elring BMW Gasket exhaust pipe,592228,18307793678,$6.30,https://www.turnermotorsport.com/c-148-bmw-gaskets-hangers-and-parts?No=150&Nrpp=50#,For the DPFE filter.
https://www.turnermotorsport.com/p-2706178-akrapovic-sound-kit-wireless-system/,Akrapovic Sound Kit - Wireless System,2706178,P-HF1351,$473.25,https://www.turnermotorsport.com/c-148-bmw-gaskets-hangers-and-parts?No=150&Nrpp=50#,The Akrapovic Sound Kit is a wireless exhaust valve control system that allows you full control over the valve system in your titanium Akrapovic exhaust. This enable you to open the exhaust valve when you want to turn as many heads as possible or keep it closed when your out for an easy Sunday drive.
https://www.turnermotorsport.com/p-557171-akrapovic-2014-bmw-m3-f80-sound-kit/,Akrapovic Sound Kit - F8X BMW M3 & M4,557171,P-HF1100,$798.48,https://www.turnermotorsport.com/c-148-bmw-gaskets-hangers-and-parts?No=150&Nrpp=50#,"The Sound Kit is a remote control for the valves on the Akrapovic muffler. While the muffler valves are also controlled like the factory valves in Comfort, Sport, and Sport+ modes, the Sound Kit will let you open or close the valves via handheld remote or even from your phone (iOS or Android app). The Sound Kit works with the existing wiring for the Akrapovic system so installation is a breeze."
https://www.turnermotorsport.com/p-381839-rubber-mounting-grommet-priced-each/,"Febi Rubber Mounting Grommet - E34, E36, E39, Z3",381839,17111113699,$1.65,https://www.turnermotorsport.com/c-148-bmw-gaskets-hangers-and-parts?No=150&Nrpp=50#,Rubber mounting grommet that mounts the exhaust mounting bracket to the body
https://www.turnermotorsport.com/p-587243-exhaust-clamp/,Exhaust Clamp,587243,18207793677,$32.64,https://www.turnermotorsport.com/c-148-bmw-gaskets-hangers-and-parts?No=150&Nrpp=50#,
https://www.turnermotorsport.com/p-362328-torx-bolt-w-washer/,OES Torx Bolt With Washer,362328,07146985055,$1.03,https://www.turnermotorsport.com/c-148-bmw-gaskets-hangers-and-parts?No=150&Nrpp=50#,M6x12
https://www.turnermotorsport.com/p-385017-fiberglass-exhaust-wrap-white-2-x-50/,"Prosport Fiberglass Exhaust Wrap - White - 2"" x 50'",385017,HEA-WRAPKIT-WHT,$22.00,https://www.turnermotorsport.com/c-148-bmw-gaskets-hangers-and-parts?No=150&Nrpp=50#,"Constructed of durable, tight-woven fiberglass, this heat wrap is designed to maintain proper thermal properties in your vehicles exhaust system. This material was hand selected specifically for it's heat characteristics and flexibility."
https://www.turnermotorsport.com/p-558677-akrapovic-18-bmw-m5-f90-sound-kit/,Akrapovic Sound Kit - F90 M5,558677,P-HF1132,$588.67,https://www.turnermotorsport.com/c-148-bmw-gaskets-hangers-and-parts?No=150&Nrpp=50#,"The Sound Kit is a remote control for the valves on the Akrapovic muffler. While the muffler valves are also controlled like the factory valves in Comfort, Sport, and Sport+ modes, the Sound Kit will let you open or close the valves via handheld remote or even from your phone (iOS or Android app). The Sound Kit works with the existing wiring for the Akrapovic system so installation is a breeze."
https://www.turnermotorsport.com/p-589971-awe-quad-tip-marking-template-for-bmw-f3x-328i-m-sport/,AWE Quad Tip Marking Template for BMW F3X 328i M Sport,589971,6510-11018,$89.95,https://www.turnermotorsport.com/c-148-bmw-gaskets-hangers-and-parts?No=150&Nrpp=50#,Quad tip Template For Non-M Bumper.This template is designed to make the trimming of the rear diffuser much easier. Use this template to trace a cutout for the dual exhaust. This will allow for an accurate cut that looks like it's from the factory.
https://www.turnermotorsport.com/p-596075-/,"Victor Reinz Exhaust Manifold Gasket - Cylinder Head to Manifold
  ...",596075,11627505789,$6.95,https://www.turnermotorsport.com/c-148-bmw-gaskets-hangers-and-parts?No=150&Nrpp=50#,
https://www.turnermotorsport.com/p-596074-/,Victor Reinz Exhaust Manifold Gasket - Cylinder Head to Manifold - E...,596074,11627509677,$6.03,https://www.turnermotorsport.com/c-148-bmw-gaskets-hangers-and-parts?No=150&Nrpp=50#,
https://www.turnermotorsport.com/p-593608-victor-reinz/,Victor Reinz Exhaust Manifold Gasket - Manifold/Catalyst to Center M...,593608,18107502346,$7.27,https://www.turnermotorsport.com/c-148-bmw-gaskets-hangers-and-parts?No=200&Nrpp=50#,
https://www.turnermotorsport.com/p-594771-gasket-ring-priced-each/,Gasket Ring - Priced Each,594771,11627830668,$4.79,https://www.turnermotorsport.com/c-148-bmw-gaskets-hangers-and-parts?No=200&Nrpp=50#,
https://www.turnermotorsport.com/p-1196148-/,"HJS Rubber Muffler Hanger - E12, E21, E23, E24",1196148,18211105638,$3.27,https://www.turnermotorsport.com/c-148-bmw-gaskets-hangers-and-parts?No=200&Nrpp=50#,Support your exhaust the correct way
https://www.turnermotorsport.com/p-1196184-/,HJS Exhaust Gasket - E30,1196184,18301723887,$2.78,https://www.turnermotorsport.com/c-148-bmw-gaskets-hangers-and-parts?No=200&Nrpp=50#,
https://www.turnermotorsport.com/p-591844-turbo-manifold-gasket-priced-each/,"Elring Turbo Manifold Gasket - F80, F82, F83, F87",591844,11657847039,$20.33,https://www.turnermotorsport.com/c-148-bmw-gaskets-hangers-and-parts?No=200&Nrpp=50#,Gasket for one bank of 3 cylinders
https://www.turnermotorsport.com/p-589910-awe-switchpath-conversion-kit-for-bmw-f90-m5/,AWE SwitchPath Conversion Kit for BMW F90 M5,589910,3825-41000,"$1,395.95",https://www.turnermotorsport.com/c-148-bmw-gaskets-hangers-and-parts?No=200&Nrpp=50#,Control your exhaust volume with Valves. The SwitchPath system works with the BMW driving modes to open or close the valves on your muffler. This will allow you to keep your exhaust tame for those early mornings while still having access to an unrestricted note with the push of a button.
https://www.turnermotorsport.com/p-47910-18211176713-genuine-bmw-part/,Genuine BMW Exhaust Clamp - E30 M42 1.8L M20 2.5L,47910,18211176713,$38.48,https://www.turnermotorsport.com/c-148-bmw-gaskets-hangers-and-parts?No=200&Nrpp=50#,"Genuine BMW Clamp -     E30     M20,M42"
https://www.turnermotorsport.com/p-205292-18208572512-genuine-bmw-part/,"Rubber Mounting - F80, F82, F83, F87, G01, G02",205292,18208572512,$22.85,https://www.turnermotorsport.com/c-148-bmw-gaskets-hangers-and-parts?No=200&Nrpp=50#,"Genuine BMW Rubber Mounting -     F80 M3,F82 M4,F83     S55"
https://www.turnermotorsport.com/p-374251-vacuum-control-valve/,"Pierburg Vacuum Control Valve - E36, E38, E39, E46, E65, E66, E83
 ...",374251,11741742712,$33.95,https://www.turnermotorsport.com/c-148-bmw-gaskets-hangers-and-parts?No=200&Nrpp=50#,Direct replacement
https://www.turnermotorsport.com/p-393263-e30-m3-s14-exhaust-manifold-stud-nut-kit/,E30 M3 S14 Exhaust Manifold Stud & Nut Kit,393263,TEN3090110KT,$41.61,https://www.turnermotorsport.com/c-148-bmw-gaskets-hangers-and-parts?No=200&Nrpp=50#,
https://www.turnermotorsport.com/p-222788-e34-m5-s38-exhaust-manifold-stud-nut-kit/,E34 M5 S38 Exhaust Manifold Stud & Nut Kit,222788,TEN3490121,$62.06,https://www.turnermotorsport.com/c-148-bmw-gaskets-hangers-and-parts?No=200&Nrpp=50#,"These studs will save the day! Stripped or corroded exhaust manifold studs are a major pain to deal with. Rusted studs fuse themselves to the nuts and back out of the cylinder head. These are M6x35    exhaust manifold studs with new copper nuts that will make your manifold install a breeze! These are a best seller for the E30 M3 and we put together a similar kit for the S38 in the E34 M5 (earlier M88/S38 use a different length stud). These studs have an internal 3mm hex so no more ""double-nutting"" or stud installers are needed, so no more galling threads!        1991-1995    M5 3.6/3.8"
https://www.turnermotorsport.com/p-198653-11657847039-genuine-bmw-part/,"Genuine BMW Turbo Manifold Gasket - F80 M3, F82 M4, F87 M2, F83 M4 S...",198653,11657847039,$26.33,https://www.turnermotorsport.com/c-148-bmw-gaskets-hangers-and-parts?No=200&Nrpp=50#,"Genuine BMW exhaust manifold gasket. This gasket fits both manifolds, 2 required per vehicle."
https://www.turnermotorsport.com/p-594026-exhaust-valve/,Exhaust Valve,594026,11347553772,$19.92,https://www.turnermotorsport.com/c-148-bmw-gaskets-hangers-and-parts?No=200&Nrpp=50#,Replacement Exhaust valve from TRW
https://www.turnermotorsport.com/p-12479-engine-gasket-asbestos-free-11727505259/,"Victor Reinz EGR Valve Gasket - E31, E34, E36, E38, E39, E46, E52, E...",12479,11727505259,$3.49,https://www.turnermotorsport.com/c-148-bmw-gaskets-hangers-and-parts?No=200&Nrpp=50#,GASKET ASBESTOS FREE:118523
https://www.turnermotorsport.com/p-19599-18111723540-genuine-bmw-part/,"HJS Gasket Sealing Ring - 50mm - E24, E28, E32, E34",19599,18111723540,$3.89,https://www.turnermotorsport.com/c-148-bmw-gaskets-hangers-and-parts?No=200&Nrpp=50#,"EXHAUST SYSTEM GASKET RING ASBESTO-FREE.--       - 525i, 525i Wagon, 535i   --."
https://www.turnermotorsport.com/p-7487-18111723541-genuine-bmw-part/,Genuine BMW Exhaust Gasket Ring - E23 E24 E28 E30 E34,7487,18111723541,$2.68,https://www.turnermotorsport.com/c-148-bmw-gaskets-hangers-and-parts?No=200&Nrpp=50#,This 45mm exhaust gasket ring seals the connection point between two exhaust pipes.
https://www.turnermotorsport.com/p-12981-genuine-bmw-engine-fillister-head-screw-11421740488/,Fillister Head Screw (M6X16),12981,11421740488,$16.10,https://www.turnermotorsport.com/c-148-bmw-gaskets-hangers-and-parts?No=200&Nrpp=50#,"Genuine BMW Fillister-Head Screw - M6X16    E60 M5,E63 M6,E36,E38,E39,E46,E53 X5 X5,E63,E65,E85 Z4,E90,E92,E93     M42,M44,M54,M56,M62,N73,S62,S65,S85"
https://www.turnermotorsport.com/p-47816-e63-e65-e82-e89-f25-i3-genuine-bmw-exhaust-hanger/,"E63, E65, E82, E89, F25, i3 Genuine BMW Exhaust Hanger",47816,18207578238,$20.80,https://www.turnermotorsport.com/c-148-bmw-gaskets-hangers-and-parts?No=200&Nrpp=50#,Genuine BMW rubber exhaust hanger.
https://www.turnermotorsport.com/p-13198-exhaust-system-bracket-18201402479/,Genuine BMW Rear Muffler Suppport Bracket - E36 M3,13198,18201402479,$44.11,https://www.turnermotorsport.com/c-148-bmw-gaskets-hangers-and-parts?No=200&Nrpp=50#,"REAR MUFFLER SUPPORT BRACKET SOLD INDIVIDUALLY / 2 REQUIRED PER CAR:183012    S50,S52"
https://www.turnermotorsport.com/p-381851-center-exhaust-hanger-priced-each/,"Febi Center Exhaust Hanger - E38, E39, E46, Z4",381851,18211745426,$4.38,https://www.turnermotorsport.com/c-148-bmw-gaskets-hangers-and-parts?No=200&Nrpp=50#,Rubber mounting for center muffler.
https://www.turnermotorsport.com/p-198707-18307851568-genuine-bmw-part/,Genuine BMW Exhaust Flap Actuator - F80 F82 F83 F85 F86,198707,18307851568,$115.92,https://www.turnermotorsport.com/c-148-bmw-gaskets-hangers-and-parts?No=200&Nrpp=50#,"Genuine BMW Actuator Drive, Exhaust Flap -     F80 M3,F82 M4,F83     S55"
https://www.turnermotorsport.com/p-19338-11621723656-bmw-part/,"Victor Reinz Exhaust Manifold Gasket - E23, E24, E28, E32, E34
    ...",19338,11621723656,$10.95,https://www.turnermotorsport.com/c-148-bmw-gaskets-hangers-and-parts?No=200&Nrpp=50#,
https://www.turnermotorsport.com/p-532634-remote-control-for-e/,BMW Remote Control for M Performance Exhaust Valve,532634,18302445006,$235.48,https://www.turnermotorsport.com/c-148-bmw-gaskets-hangers-and-parts?No=200&Nrpp=50#,
https://www.turnermotorsport.com/p-140859-61138366627-genuine-bmw-part/,"Genuine BMW Cable Grommet - E38, E39, E46",140859,61138366627,$24.12,https://www.turnermotorsport.com/c-148-bmw-gaskets-hangers-and-parts?No=200&Nrpp=50#,"Genuine BMW Cable Grommet    E39 M5,E46 M3,E38,E39,E46"
https://www.turnermotorsport.com/p-360712-secondary-air-pump-mount-priced-each/,Genuine BMW Secondary Air Pump Mount,360712,11727559515,$20.34,https://www.turnermotorsport.com/c-148-bmw-gaskets-hangers-and-parts?No=200&Nrpp=50#,
https://www.turnermotorsport.com/p-47859-18207841053-genuine-bmw-part/,"Front Transverse Element - E90, E92, E93",47859,18207841053,$54.41,https://www.turnermotorsport.com/c-148-bmw-gaskets-hangers-and-parts?No=200&Nrpp=50#,"Genuine BMW Front Transverse Element -     E90,E92,E93     S65"
https://www.turnermotorsport.com/p-48354-18307560781-genuine-bmw-part/,Genuine BMW Exhaust Clamp,48354,18307560781,$51.39,https://www.turnermotorsport.com/c-148-bmw-gaskets-hangers-and-parts?No=200&Nrpp=50#,"Genuine BMW Clamping Bush - D=75Mm    E70 X5M,E71 X6M,E65,E70 X5 X5,E71 X6,F15,F16,F22,F25 X3,F26 X4 X4,F30,F31,F32,F33,F34,F36     M57,N20,N26,N52,N52N,N55,N57N,N62,S63"
https://www.turnermotorsport.com/p-48425-18307583940-genuine-bmw-part/,Genuine BMW Rubber Exhaust Hanger,48425,18307583940,$22.22,https://www.turnermotorsport.com/c-148-bmw-gaskets-hangers-and-parts?No=200&Nrpp=50#,"Genuine BMW Rubber Mounting    E70 X5M,E71 X6M,E70 X5 X5,E71 X6,F15,F16,F80 M3,F82 M4,F83     N63,N63N,S55,S63"
https://www.turnermotorsport.com/p-187371-18302287042-genuine-bmw-part/,"Genuine BMW Intermediate Pipes ""M Performance"" - F22/F23 M...",187371,18302287042,$71.18,https://www.turnermotorsport.com/c-148-bmw-gaskets-hangers-and-parts?No=200&Nrpp=50#,
https://www.turnermotorsport.com/p-18826-18211178340-bmw-part/,Rear Silencer Bracket 18211178340,18826,18211178340,$33.35,https://www.turnermotorsport.com/c-148-bmw-gaskets-hangers-and-parts?No=200&Nrpp=50#,
https://www.turnermotorsport.com/p-47490-18119067822-genuine-bmw-part/,Genuine BMW Exhaust Seal Ring (42mm) - E12 E23 E24 E28,47490,18119067822,$8.50,https://www.turnermotorsport.com/c-148-bmw-gaskets-hangers-and-parts?No=200&Nrpp=50#,Genuine BMW GASKET RING ASBESTO-FREE    M30
https://www.turnermotorsport.com/p-48242-18303422385-genuine-bmw-part/,Pipe Clamp - E83,48242,18303422385,$33.09,https://www.turnermotorsport.com/c-148-bmw-gaskets-hangers-and-parts?No=200&Nrpp=50#,Genuine BMW Pipe Clamp -     E83 X3     N52N
https://www.turnermotorsport.com/p-48718-18311728547-genuine-bmw-part/,"Bracket - E36, E46, Z3",48718,18311728547,$31.01,https://www.turnermotorsport.com/c-148-bmw-gaskets-hangers-and-parts?No=200&Nrpp=50#,"Genuine BMW Bracket - Getrag    E36,E46     M50,M52,M54"
https://www.turnermotorsport.com/p-384838-downpipe-gasket-priced-each/,Ajusa Exhaust Gasket - Catalytic Converter to Front Muffler and Mani...,384838,18301440183,$4.77,https://www.turnermotorsport.com/c-148-bmw-gaskets-hangers-and-parts?No=200&Nrpp=50#,
https://www.turnermotorsport.com/p-1389-acoustiseal-exhaust-system-sealing-compound-5oz-tube/,Acousti/Seal Exhaust System Sealing Compound - 5oz Tube,1389,35959,$27.95,https://www.turnermotorsport.com/c-148-bmw-gaskets-hangers-and-parts?No=200&Nrpp=50#,"With years of experience with dealing with exhaust systems of all kinds, we've found this product to be the BEST at fixing or preventing exhaust leaks. Just apply a light coating of Acousti/seal to pipes, flanges or slip-fit clamps before assembly for a leak free installation. 5 ounce tube (142 grams). UPS Ground shipping to the lower 48 US states only."
https://www.turnermotorsport.com/p-13201-18211176029-genuine-bmw-part/,Genuine BMW Lower Muffler Clamp - E30 M20 2.5L 2.7L,13201,18211176029,$28.04,https://www.turnermotorsport.com/c-148-bmw-gaskets-hangers-and-parts?No=200&Nrpp=50#,Genuine BMW Bow -     E30     M20
