product-img-link href,cleanDesc,part-info,part-info 2,price,wishlist-label href,short-description
https://www.turnermotorsport.com/p-224291-supersprint-connecting-pipe-adapters-multiple-applications/,"Supersprint Connecting Pipe Adapters (multiple applications)
      ...",224291,769033,$87.78,https://www.turnermotorsport.com/c-148-bmw-gaskets-hangers-and-parts#,"Supersprint exhaust is widely recognized as the leader in complete exhaust system upgrades - extremely high quality, well designed for optimal flow, and amazing sound. Even at a premium price Supersprint is an unbeatable exhaust system because every aspect is done to such a high level. A Supersprint exhaust rewards you with a terrific sound, long lasting construction and excellent fitment. The Supersprint sound is very 'European' which fits the sporting sophistication of BMWs perfectly. Most systems are also modular - sections can be added or removed to custom tailor the exhaust sound to your preferance. Aside from 'Race' systems, their mufflers meet European noise laws so you get a refined and tuned sound without being excessively loud. Most Supersprint systems are built with larger diameter piping to improve exhaust flow which helps the engine do less work and make more horsepower! Supersprint exhausts generally run at a premium over other systems but no other system on the market can match their quality, performance, or reputation!"
https://www.turnermotorsport.com/p-189800-f10-m5-f13-m6-f06-m6-gran-coupe-supersprint-oem-connecting-sleeve-kit/,"F10 M5, F13 M6, F06 M6 Gran Coupe Supersprint OEM Connecting Sleeve ...",189800,986744,$132.33,https://www.turnermotorsport.com/c-148-bmw-gaskets-hangers-and-parts#,Free ground shipping!
https://www.turnermotorsport.com/p-558485-sleeve-pipe/,Sleeve Pipe,558485,721633,$81.18,https://www.turnermotorsport.com/c-148-bmw-gaskets-hangers-and-parts#,
https://www.turnermotorsport.com/p-184491-e34-540i-supersprint-connecting-flanges-resonator-to-oe-cat/,"E34 540i Supersprint Connecting Flanges (Resonator to OE Cat)
     ...",184491,784722,$165.69,https://www.turnermotorsport.com/c-148-bmw-gaskets-hangers-and-parts#,Free ground shipping!
https://www.turnermotorsport.com/p-184490-e34-530i-supersprint-connecting-flanges-resonator-to-oe-cat/,"E34 530i Supersprint Connecting Flanges (Resonator to OE Cat)
     ...",184490,784711,$165.69,https://www.turnermotorsport.com/c-148-bmw-gaskets-hangers-and-parts#,Free ground shipping!
https://www.turnermotorsport.com/p-354741-tms354741/,"BMW F30 (Sedan) 320i 2.0T (N20 184 Hp) 2011 -> 2015 Sleeve pipe
...",354741,987843,$65.61,https://www.turnermotorsport.com/c-148-bmw-gaskets-hangers-and-parts#,
https://www.turnermotorsport.com/p-22551-18100392258-genuine-bmw-part/,Genuine MINI Rubber Mount Mid Pipe,22551,18100392258,$33.55,https://www.turnermotorsport.com/c-148-bmw-gaskets-hangers-and-parts#,"Genuine MINI RUBBER MOUNTING.--     MINI Cooper - Mini Cooper, Mini Cooper Convt   --.   W10"
https://www.turnermotorsport.com/p-6582-11120543338-genuine-bmw-part/,Genuine BMW Nipple - E12,6582,11120543338,$30.28,https://www.turnermotorsport.com/c-148-bmw-gaskets-hangers-and-parts#,M10
https://www.turnermotorsport.com/p-47871-genuine-bmw-set-of-add-on-parts-silence-18210146036/,Genuine BMW Rear Muffler Brackets - Set - E36 325i 328i,47871,18210146036,$82.82,https://www.turnermotorsport.com/c-148-bmw-gaskets-hangers-and-parts#,"Genuine BMW SET OF ADD-ON PARTS, SILENCE"
https://www.turnermotorsport.com/p-12554-genuine-bmw-engine-hex-nut-11721437202/,Genuine BMW Exhaust Manifold Hex Nut - 11721437202,12554,11721437202,$1.95,https://www.turnermotorsport.com/c-148-bmw-gaskets-hangers-and-parts#,
https://www.turnermotorsport.com/p-7032-11621711954-genuine-bmw-part/,Genuine BMW M8 Copper Exhaust Lock Nut - BMW,7032,18307620549,$1.95,https://www.turnermotorsport.com/c-148-bmw-gaskets-hangers-and-parts#,Replaces your exhaust hardware every time it is taken apart to prevent seized nuts and bolts.
https://www.turnermotorsport.com/p-384839-gasket-ring-priced-each/,"Gasket Ring - N51, N52 -  Priced Each",384839,18407530606,$5.95,https://www.turnermotorsport.com/c-148-bmw-gaskets-hangers-and-parts#,"This item fits the following BMW Chassis: E70 X5,E82,E83 X3,E85,E86,E89 Z4,E90,E92,E93,F10,F25 X3 Fits BMW Engines including: N51,N52,N52N"
https://www.turnermotorsport.com/p-12678-18301737774-genuine-bmw-part/,Rein Self-Locking Nut,12678,18301737774,$2.95,https://www.turnermotorsport.com/c-148-bmw-gaskets-hangers-and-parts#,"Be sure to install new hardware with your new parts to ensure proper tightening and fitment. This is an M10 self-locking nut, used in various locations in the vehicle. Be sure to check for proper size and application prior to ordering."
https://www.turnermotorsport.com/p-12460-genuine-bmw-exhaust-gasket-ring-11627830668/,"Genuine BMW Exhaust Gasket Ring - E46 M3, Z4 M, E9X M3",12460,11627830668,$14.95,https://www.turnermotorsport.com/c-148-bmw-gaskets-hangers-and-parts#,Replace every time you unbolt your exhaust system.
https://www.turnermotorsport.com/p-12542-genuine-bmw-stud-bolt-m7x42-11121744057-e34e36e39e46e36-m3/,"Genuine BMW Exhaust Manifold Stud M7X42 - 11121744057 - E34,E36,E39,...",12542,11121744057,$4.95,https://www.turnermotorsport.com/c-148-bmw-gaskets-hangers-and-parts#,Standard exhaust stud bolts for the header connection to the engine head.
https://www.turnermotorsport.com/p-556847-exhaust-pipe-hanger-priced-each/,"HJS Exhaust Pipe Hanger - E36, E39, E46, E90, E92, E93, Z4
        ...",556847,18201401797,$25.47,https://www.turnermotorsport.com/c-148-bmw-gaskets-hangers-and-parts#,Rear muffler hanger
https://www.turnermotorsport.com/p-48753-genuine-bmw-flange-nut-18407502196/,Genuine BMW Flange Nut - 18407502196,48753,18407502196,$4.20,https://www.turnermotorsport.com/c-148-bmw-gaskets-hangers-and-parts#,
https://www.turnermotorsport.com/p-588632-exhaust-gasket/,"Elring Exhaust Gasket - F80, F82, F83",588632,18307851168,$12.95,https://www.turnermotorsport.com/c-148-bmw-gaskets-hangers-and-parts#,Replacement Gasket found between Primary and Secondary Catalytic Converters.
https://www.turnermotorsport.com/p-341254-exhaust-manifold-gasket-priced-each/,Elring Exhaust Manifold Gasket - S54 3.2L,341254,11627830667,$8.95,https://www.turnermotorsport.com/c-148-bmw-gaskets-hangers-and-parts#,This seals the exhaust manifold to the head. We recommend replacing this any time the exhaust manifold needs to be removed.
https://www.turnermotorsport.com/p-178286-18207590154-genuine-bmw-part/,Genuine BMW Rubber Exhaust Hanger,178286,18207590154,$21.84,https://www.turnermotorsport.com/c-148-bmw-gaskets-hangers-and-parts#,"Genuine BMW Rubber Mounting -     E90,E92,E93     N51,N52,N52N,N54,N54T,N55"
https://www.turnermotorsport.com/p-177032-11117628302-genuine-bmw-part/,Crankshaft Main Bearing Cap Bolt,177032,11117628302,$7.20,https://www.turnermotorsport.com/c-148-bmw-gaskets-hangers-and-parts#,"Genuine BMW Collar Screw - M11X99    E70 X5M,E71 X6M,E70 X5,E71 X6,F01,F02,F06,F10,F12,F13,F15,F16     N63,N63N,S63,S63N"
https://www.turnermotorsport.com/p-1712-m50m52-exhaust-manifold-to-cat-gasket/,M50/M52 Exhaust Manifold to Cat Gasket,1712,18301716888,$3.95,https://www.turnermotorsport.com/c-148-bmw-gaskets-hangers-and-parts#,M50/M52 Exhaust Manifold to Catalytic Converter Gasket. 2 needed per car. Fits all cars with M50 and M52 engines.
https://www.turnermotorsport.com/p-36860-11627833278-genuine-bmw-part/,Genuine BMW exhaust manifold gasket - Priced each - E60 M5 E63/64 M6...,36860,11627833278,$10.68,https://www.turnermotorsport.com/c-148-bmw-gaskets-hangers-and-parts#,"Genuine BMW Gasket Asbestos Free    E60 M5,E63 M6,E63     S85"
https://www.turnermotorsport.com/p-388324-cylinder-head-to-exhaust-manifold-stud-nut-kit-e39-e46-z3-w-m52tu-engine/,Cylinder Head To Exhaust Manifold Stud & Nut Kit - E39 E46 Z3 W ...,388324,TEN4649SK2,$108.58,https://www.turnermotorsport.com/c-148-bmw-gaskets-hangers-and-parts#,"This convenient kit includes all the hardware you need to replace your old, rusted (or broken) exhaust manifold studs on your M52tu-family engine's head.     1999-2000    323i 323ci 328i 328ci  1999-2000    528i  1999-2000    Z3 2.3 Z3 2.8"
https://www.turnermotorsport.com/p-584005-bmw-gasket-exhaust-manifold/,"Elring exhaust manifold gasket - Priced each - E60 M5 E63/64 M6
   ...",584005,11627833278,$6.95,https://www.turnermotorsport.com/c-148-bmw-gaskets-hangers-and-parts#,
https://www.turnermotorsport.com/p-385215-center-exhaust-hanger-priced-each/,"HJS Center Exhaust Hanger - E39, E46, E52, E60, E63, E64, E90, E92, ...",385215,18207832991,$14.95,https://www.turnermotorsport.com/c-148-bmw-gaskets-hangers-and-parts#,Located over the center exhaust support
https://www.turnermotorsport.com/p-348948-tms348948/,"Rein Exhaust Gasket - E31, E34, E36, E38, Z3",348948,18301716888,$7.95,https://www.turnermotorsport.com/c-148-bmw-gaskets-hangers-and-parts#,Gasket between header and catalytic converter
https://www.turnermotorsport.com/p-14628-11621732969-genuine-bmw-part/,Victor Reinz Exhaust Manifold Gasket With Heat Shield,14628,11621732969,$14.95,https://www.turnermotorsport.com/c-148-bmw-gaskets-hangers-and-parts#,GASKET W/HEAT PROT.SHIELD AS
https://www.turnermotorsport.com/p-194582-18307851168-genuine-bmw-part/,"Genuine BMW Gasket - 18307851168 - F80 M3,F82 M4,F83",194582,18307851168,$21.89,https://www.turnermotorsport.com/c-148-bmw-gaskets-hangers-and-parts#,Genuine BMW exhaust manifold gasket.
https://www.turnermotorsport.com/p-48579-18307633092-genuine-bmw-part/,Genuine BMW Exhaust Hanger - F30,48579,18307633092,$31.07,https://www.turnermotorsport.com/c-148-bmw-gaskets-hangers-and-parts#,"Genuine BMW Rubber Mounting -     F22,F30,F32,F33,F34,F36     N20,N26,N55"
https://www.turnermotorsport.com/p-19682-18301703634-bmw-part/,Vaico Exhaust Hanger - E36,19682,18301703634,$4.95,https://www.turnermotorsport.com/c-148-bmw-gaskets-hangers-and-parts#,EXHAUST SYSTEM RUBBER RING
https://www.turnermotorsport.com/p-348775-tms348775/,Rein Copper Exhaust Lock Nut,348775,11621711954,$2.95,https://www.turnermotorsport.com/c-148-bmw-gaskets-hangers-and-parts#,Flange copper nut
https://www.turnermotorsport.com/p-404046-self-locking-nut-priced-each/,"Febi Self-Locking Nut - E21, E24, E31, E36",404046,N90085001,$2.95,https://www.turnermotorsport.com/c-148-bmw-gaskets-hangers-and-parts#,Install new hardware with your new parts. M8
https://www.turnermotorsport.com/p-13035-engine-gasket-asbestos-free-11627830667/,"Exhaust Manifold Gasket - E46 M3, Z3M (S54), E85 Z4M",13035,11627830667,$9.95,https://www.turnermotorsport.com/c-148-bmw-gaskets-hangers-and-parts#,This is the individual triangular shaped gasket that goes between the exhaust manifold / header and the engine block. There are a total of 6 of these gaskets per S54 engine.Sold individually.  When doing any sort of repair or maintenance there is no replacement for genuine factory parts. Turner Motorsport carries the Genuine BMW brand with pride and has the parts you need to complete your next project with confidence.     2001-2006    M3  2001-2002    M Roadster M Coupe  2006-2008    Z4 M Roadster M Coupe
https://www.turnermotorsport.com/p-381798-exhaust-gasket-priced-each/,"Febi Exhaust Gasket - E30, E31, E32, E34",381798,11761711717,$6.95,https://www.turnermotorsport.com/c-148-bmw-gaskets-hangers-and-parts#,Manifold to downpipe
https://www.turnermotorsport.com/p-393895-turbo-to-downpipe-exhaust-gasket-priced-each/,Elring Turbo To Downpipe Exhaust Gasket - N54 BMW,393895,18307553601,$9.95,https://www.turnermotorsport.com/c-148-bmw-gaskets-hangers-and-parts#,This exhaust gasket is used to seal the turbo to downpipe connections.
https://www.turnermotorsport.com/p-48087-18217558661-genuine-bmw-part/,Genuine BMW Exhaust clamp - E90 E92 E93 M3 S65,48087,18217558661,$32.68,https://www.turnermotorsport.com/c-148-bmw-gaskets-hangers-and-parts#,"Genuine BMW Clamp -     E90,E92,E93     S65"
https://www.turnermotorsport.com/p-600480-powerflex-rear-muffler-hanger-street-version-e36-e46-e9x-m3-e39-m5-z4-m/,"Powerflex Rear Muffler Hanger - Street Version - E36 E46 E9X M3, E39...",600480,EXH034,$89.99,https://www.turnermotorsport.com/c-148-bmw-gaskets-hangers-and-parts#,"BMW's original muffler hanger (part number 18201401797) works great at first but tends to fail over time, leading to sloppy exhaust movement and excessive noise. This failure is due to both heat and the heavy exhaust wearing down the hanger until it eventually tears, allowing the exhaust to shift around freely, banging off of nearby components. In order to address this common problem, Powerflex developed their own polyurethane rear muffler hanger that features a heavy-duty, yet lightweight, machined aluminum bracket. Polyurethane is significantly more resistant to the effects of heat and weight over time compared to rubber, meaning you can expect this exhaust hanger to last many times longer than your stock BMW hanger."
https://www.turnermotorsport.com/p-400-exhaust-manifold-to-catalytic-gasket-set-e30-m3-e34-m5-e28-m5-e24-m6/,"Exhaust Manifold to Catalytic Gasket - E30 M3, E34 M5. E28 M5 , E24 ...",400,11761308686,$16.60,https://www.turnermotorsport.com/c-148-bmw-gaskets-hangers-and-parts#,"Exhaust Manifold to Catalytic Gasket , price is each. These mount between the output side of header and the catalytic converter or center section.     1988-1991    M3  1988    M5  1991-1993    M5  1987-1989    M6"
https://www.turnermotorsport.com/p-397614-exhaust-gasket-priced-each/,Elring Exhaust Gasket - N55 3.0L,397614,11657593303,$3.95,https://www.turnermotorsport.com/c-148-bmw-gaskets-hangers-and-parts#,Seals the exhaust manifold to the cylinder head.
https://www.turnermotorsport.com/p-14627-genuine-bmw-engine-torx-bolt-11621318568/,Genuine BMW Catalytic Converter Torx Bolt - Multiple BMWs,14627,11621318568,$11.95,https://www.turnermotorsport.com/c-148-bmw-gaskets-hangers-and-parts#,OE BMW Torx bolt that is used to connect the catalytic converter to the exhaust manifold headers.
https://www.turnermotorsport.com/p-36788-11621723655-genuine-bmw-part/,"Genuine BMW Exhaust Manifold Gasket - E30 M20, E34 525i M20
       ...",36788,11621723655,$25.86,https://www.turnermotorsport.com/c-148-bmw-gaskets-hangers-and-parts#,"Genuine BMW Gasket W/Heat Prot.Shield Asbestosfree -     E30,E34     M20"
https://www.turnermotorsport.com/p-362982-exhaust-pipe-gasket-priced-each/,"Victor Reinz Exhaust Pipe Gasket - E31, E32, E34, E38, E39, E52
   ...",362982,18301728734,$6.95,https://www.turnermotorsport.com/c-148-bmw-gaskets-hangers-and-parts#,Used to seal the flanges on the exhaust system
https://www.turnermotorsport.com/p-602316-/,Hex Bolt,602316,18309909376,$3.30,https://www.turnermotorsport.com/c-148-bmw-gaskets-hangers-and-parts#,
https://www.turnermotorsport.com/p-348631-m50m52s50s52-6-cylinder-head-to-exhaust-manifold-stud-nut-kit/,M50/M52/S50/S52 6 Cylinder Head To Exhaust Manifold Stud & Nut K...,348631,TEN3649SK1KT,$161.03,https://www.turnermotorsport.com/c-148-bmw-gaskets-hangers-and-parts#,"This convenient kit includes all the hardware you need to replace your old, rusted (or broken?) exhaust manifold studs on your M50-family engine's head (including M50, M52, S50, S52). The perfect time to preventatively replace your exhaust studs is anytime you remove the manifolds (perhaps to install headers) or are removing the head or complete engine. Kit includes the correct number of OEM studs, copper locking nuts, and also includes two jam-nuts to be used for removing your old studs and installing the new studs. This stud and nut kit Fits 325i, 325is, 328i, 328is, 323is, E36 M3 (3.0 & 3.2 liter), E34 525i (91+), E39 528i, Z3 2.8.     1992-1998    323is 323ic 325i 325is 325ic 328i 328is 328ic M3  1991-1995    525i  1997-1998   528i  1997-1998    Z3 2.8 M Roadster M Roadster"
https://www.turnermotorsport.com/p-360760-exhaust-pipe-gasket-priced-each/,Genuine BMW Exhaust Pipe Gasket,360760,18301728734,$16.38,https://www.turnermotorsport.com/c-148-bmw-gaskets-hangers-and-parts#,
https://www.turnermotorsport.com/p-25570-18207544809-genuine-bmw-part/,Genuine BMW Rubber Exhaust Hanger,25570,18207544809,$22.85,https://www.turnermotorsport.com/c-148-bmw-gaskets-hangers-and-parts#,
https://www.turnermotorsport.com/p-379594-exhaust-manifold-gasket-priced-each/,"Ajusa Exhaust manifold gasket - E36 E46 E53 E60 E70 E83 Z3/4
      ...",379594,18107502346,$8.95,https://www.turnermotorsport.com/c-148-bmw-gaskets-hangers-and-parts#,New exhaust gaskets ensure your exhaust is leak free and emissions compliant
https://www.turnermotorsport.com/p-384318-exhaust-gasket/,Elring Exhaust Gasket - S54,384318,18307830674,$10.95,https://www.turnermotorsport.com/c-148-bmw-gaskets-hangers-and-parts#,
https://www.turnermotorsport.com/p-539370-exhaust-flap-actuator-plug-cover/,M Performance Exhaust Flap Actuator Plug Cover - F2X F3X,539370,18302411427,$24.74,https://www.turnermotorsport.com/c-148-bmw-gaskets-hangers-and-parts#,This plug cover protects the actuator plug when a non-actuated exhaust is installed on the vehicle.
https://www.turnermotorsport.com/p-296-e30-m3-e28-m5-e24-m6-exhaust-manifold-gasket/,"E30 M3, E28 M5, E24 M6 Exhaust Manifold Gasket",296,11621312961,$4.93,https://www.turnermotorsport.com/c-148-bmw-gaskets-hangers-and-parts?No=50&Nrpp=50#,This is the metal gasket that seals the exhaust manifold to the head. These are sold    so order the appropriate quantity for your engine.
https://www.turnermotorsport.com/p-590224-gasket-ring-priced-each/,Gasket Ring - Priced Each,590224,18111245489,$2.54,https://www.turnermotorsport.com/c-148-bmw-gaskets-hangers-and-parts?No=50&Nrpp=50#,
https://www.turnermotorsport.com/p-3809-exhaust-manifold-gasket-m52-s52-engines/,Exhaust Manifold Gasket - M52 & S52 Engines,3809,11621744252,$5.95,https://www.turnermotorsport.com/c-148-bmw-gaskets-hangers-and-parts?No=50&Nrpp=50#,"This exhaust manifold gasket fits 2.8 and 3.2 liter engines, as came on all 1996-1999 M3, 328i/is & 323is (E36), 1997-2000 528i (E39), and Z3 2.8 liter. These are sold individually, and 2 are required for each car."
https://www.turnermotorsport.com/p-379332-exhaust-downpipe-gasket-priced-each/,Elring Exhaust Downpipe Gasket - N52 3.0L,379332,18107549447,$10.95,https://www.turnermotorsport.com/c-148-bmw-gaskets-hangers-and-parts?No=50&Nrpp=50#,Elring is one of the biggest OEM names in the manufacturing of high quality gaskets that are available for very affordable prices. Elring has supplied many automotive names for years with the gaskets that seal your car's components from day 1 so you can rest assured that these components will last for a long time to come!
https://www.turnermotorsport.com/p-370065-exhaust-manifold-gasket-priced-each/,Victor Reinz Exhaust Manifold Gasket,370065,11627505789,$8.95,https://www.turnermotorsport.com/c-148-bmw-gaskets-hangers-and-parts?No=50&Nrpp=50#,Located between the exhaust manifold and the engine
https://www.turnermotorsport.com/p-36772-11621711671-genuine-bmw-part/,Genuine BMW Exhaust Flange Stud - Manifold to Exhaust Pipe (10 X 35 ...,36772,11621711671,$7.34,https://www.turnermotorsport.com/c-148-bmw-gaskets-hangers-and-parts?No=50&Nrpp=50#,"Genuine BMW Stud Bolt - M10X35     E30     M10,M20,M30"
https://www.turnermotorsport.com/p-586669-bmw-gasket-exhaust-manifold/,Elring Exhaust Manifold Gasket,586669,11627505789,$5.95,https://www.turnermotorsport.com/c-148-bmw-gaskets-hangers-and-parts?No=50&Nrpp=50#,Located between the exhaust manifold and the engine
https://www.turnermotorsport.com/p-11785-exhaust-gasket-e36-m3-euro-e46-m3-z3m-z4m/,"Exhaust Gasket - E36 M3 Euro, E46 M3, Z3M, Z4M",11785,18111723379,$20.82,https://www.turnermotorsport.com/c-148-bmw-gaskets-hangers-and-parts?No=50&Nrpp=50#,This is the exhaust gasket seal ring.     1996-1999    M3 Euro S50  2001-2006    M3  1998-2002    M Roadster M Coupe  2006-2008    Z4 M Roadster M Coupe
https://www.turnermotorsport.com/p-367949-exhaust-pipe-hanger-priced-each/,Genuine BMW Exhaust Pipe Hanger - Multiple BMWs,367949,18201401797,$49.10,https://www.turnermotorsport.com/c-148-bmw-gaskets-hangers-and-parts?No=50&Nrpp=50#,Replace worn or otherwise damaged hangers to reduce squeaks and rubbing from exhaust-on-body contact
https://www.turnermotorsport.com/p-375234-exhaust-manifold-gasket-priced-each/,"Victor Reinz Exhaust Manifold Gasket - E30, E34, E36, Z3",375234,11621728983,$2.95,https://www.turnermotorsport.com/c-148-bmw-gaskets-hangers-and-parts?No=50&Nrpp=50#,Located between the exhaust manifold and the engine
https://www.turnermotorsport.com/p-591913-bmw-gasket-exhaust-manifold/,Elring Exhaust Manifold Gasket - Manifold to Cylinder Head - E90 E70...,591913,11627799728,$10.95,https://www.turnermotorsport.com/c-148-bmw-gaskets-hangers-and-parts?No=50&Nrpp=50#,
https://www.turnermotorsport.com/p-637232-secondary-air-pump-mount-priced-each/,Secondary Air Pump Mount - Priced Each,637232,11727559515,$2.46,https://www.turnermotorsport.com/c-148-bmw-gaskets-hangers-and-parts?No=50&Nrpp=50#,
https://www.turnermotorsport.com/p-381627-s55-3-hi-flo-catless-downpipes-w-resonators/,"AR Design Bomb-Proof Gasket Set - N54 N55 135i 335i 535i X5 X6
    ...",381627,AR-01-03001,$26.97,https://www.turnermotorsport.com/c-148-bmw-gaskets-hangers-and-parts?No=50&Nrpp=50#,"Ensure you have the best seal possible with the heavy duty Bomb-Proof Gasket Set from AR Design that is made to stand up to extremely high temperatures and pressures. Where other gasket would fail, this will stand up to the test and hold the seal as intended."
https://www.turnermotorsport.com/p-36858-11627832535-genuine-bmw-part/,"Genuine BMW Exhaust gasket - E63,E65,E60 M5,E63 M6",36858,11627832535,$14.65,https://www.turnermotorsport.com/c-148-bmw-gaskets-hangers-and-parts?No=50&Nrpp=50#,"Genuine BMW Gasket Ring    E60 M5,E63 M6,E63,E65     N62,S85"
https://www.turnermotorsport.com/p-382439-e36-catalytic-converter-center-hanger/,Febi Catalytic Converter Center Hanger - E36,382439,18301703634,$6.95,https://www.turnermotorsport.com/c-148-bmw-gaskets-hangers-and-parts?No=50&Nrpp=50#,
https://www.turnermotorsport.com/p-360757-exhaust-gasket/,Genuine BMW Exhaust Gasket,360757,18107502346,$24.55,https://www.turnermotorsport.com/c-148-bmw-gaskets-hangers-and-parts?No=50&Nrpp=50#,
https://www.turnermotorsport.com/p-13196-exhaust-system-flat-gasket-18107502346/,"Elring Exhaust Gasket - 18107502346 - M54, N52",13196,18107502346,$10.95,https://www.turnermotorsport.com/c-148-bmw-gaskets-hangers-and-parts?No=50&Nrpp=50#,
https://www.turnermotorsport.com/p-370814-exhaust-gasket-priced-each/,"Victor Reinz Exhaust Gasket  - E39, E46, E53, E60, E70, E83, Z3, Z4
...",370814,18107502346,$9.49,https://www.turnermotorsport.com/c-148-bmw-gaskets-hangers-and-parts?No=50&Nrpp=50#,Located in various junctions in your vehicle's exhaust system
https://www.turnermotorsport.com/p-379471-exhaust-manifold-gasket-set-of-six/,Genuine BMW Exhaust Manifold Gasket - Set of Six - S54,379471,11627830667KKT,$59.70,https://www.turnermotorsport.com/c-148-bmw-gaskets-hangers-and-parts?No=50&Nrpp=50#,
https://www.turnermotorsport.com/p-385020-gold-heat-reflective-tape-2-x-15/,"Prosport Gold Heat Reflective Tape - 2"" x 15'",385020,HEA-GWRAP-15,$29.00,https://www.turnermotorsport.com/c-148-bmw-gaskets-hangers-and-parts?No=50&Nrpp=50#,"Constructed of laminated light-weight glass cloth, this gold reflective heat tape is designed to reflect 80% of radiant heat. With excellent pliability, this tape is easy to install. It's as simple as peel and stick."
https://www.turnermotorsport.com/p-360708-exhaust-manifold-gasket-with-heat-shield-priced-each/,Genuine BMW Exhaust Manifold Gasket With Heat Shield,360708,11621732969,$39.95,https://www.turnermotorsport.com/c-148-bmw-gaskets-hangers-and-parts?No=50&Nrpp=50#,
https://www.turnermotorsport.com/p-361540-exhaust-manifold-gasket-priced-each/,"Elring Exhaust Manifold Gasket - E36, E39, Z3",361540,11621744252,$9.95,https://www.turnermotorsport.com/c-148-bmw-gaskets-hangers-and-parts?No=50&Nrpp=50#,Seals the exhaust manifold to the cylinder head
https://www.turnermotorsport.com/p-13207-18301440183-genuine-bmw-part/,"Rein Downpipe Gasket - E39, E46, Z3",13207,18301440183,$8.95,https://www.turnermotorsport.com/c-148-bmw-gaskets-hangers-and-parts?No=50&Nrpp=50#,FLAT GASKET:188520
https://www.turnermotorsport.com/p-360759-downpipe-gasket-priced-each/,Genuine BMW Downpipe Gasket,360759,18301440183,$23.67,https://www.turnermotorsport.com/c-148-bmw-gaskets-hangers-and-parts?No=50&Nrpp=50#,
https://www.turnermotorsport.com/p-19588-18101405737-genuine-bmw-part/,Genuine BMW Exhaust Gasket Ring - 18101405737,19588,18101405737,$19.95,https://www.turnermotorsport.com/c-148-bmw-gaskets-hangers-and-parts?No=50&Nrpp=50#,
https://www.turnermotorsport.com/p-2839845-vrsf-4-turbo-to-downpipe-clamp-bmw-135i-335i-535i-640i-z4-m3-m4-m5-m6-n54n55s55n63s63-4/,"VRSF 4"" Turbo to Downpipe Clamp - BMW",2839845,505040,$18.99,https://www.turnermotorsport.com/c-148-bmw-gaskets-hangers-and-parts?No=50&Nrpp=50#,"4"" Turbo to Downpipe Clamp for 4"" Downpipes"
https://www.turnermotorsport.com/p-48568-18307628660-genuine-bmw-part/,"Genuine BMW Muffler Clamp - F32 428i xDrive 428i 328i xDrive 328i
 ...",48568,18307628660,$32.34,https://www.turnermotorsport.com/c-148-bmw-gaskets-hangers-and-parts?No=50&Nrpp=50#,"Genuine BMW Muffler Clamp - D=65Mm    F22,F30,F32,F33,F34,F36     N26"
https://www.turnermotorsport.com/p-360763-exhaust-gasket/,Genuine BMW Exhaust Gasket - S54,360763,18307830674,$23.95,https://www.turnermotorsport.com/c-148-bmw-gaskets-hangers-and-parts?No=50&Nrpp=50#,
https://www.turnermotorsport.com/p-22615-18211704198-genuine-bmw-part/,Genuine BMW Exhaust Hanger,22615,18211704198,$18.27,https://www.turnermotorsport.com/c-148-bmw-gaskets-hangers-and-parts?No=50&Nrpp=50#,Genuine BMW RUBBER MOUNTING
