product-img-link href,cleanDesc,part-info,part-info 2,price,wishlist-label href,short-description
https://www.turnermotorsport.com/p-360177-brake-caliper-rebuilt-front-right-e46-330i-e83-x3-25-30-e85-z4-30si/,"Brake Caliper - Rebuilt - Front Right - E46 330i, E83 X3 2.5, 3.0, E...",360177,34116765882RKT,$124.96,https://www.turnermotorsport.com/c-82-bmw-brake-calipers?No=48&Nrpp=48#,"Our rebuilt calipers start off with an original BMW caliper that is fully disassembled thoroughly inspected and carefully processed. All threads are chased, all groves are meticulously cleaned and checked. Pistons are replaced if any dents or scratches are found. All rubber components and hardware are replaced with new OE quality parts. The units are then air pressure tested and submitted to a thorough final inspection."
https://www.turnermotorsport.com/p-348636-remanufactured-brake-caliper-front-right-e36-m3-z3m/,"Brake Caliper - Rebuilt - Front Right - E36 M3, Z3M",348636,34112227516RKT,$150.95,https://www.turnermotorsport.com/c-82-bmw-brake-calipers?No=48&Nrpp=48#,"Our rebuilt calipers start off with an original BMW caliper that is fully disassembled thoroughly inspected and carefully processed. All threads are chased, all groves are meticulously cleaned and checked. Pistons are replaced if any dents or scratches are found. All rubber components and hardware are replaced with new OE quality parts. The units are then air pressure tested and submitted to a thorough final inspection.**Please note these calipers do not have the ///M logo on them***We also stock the Genuine BMW calipers with the ///M logo.1995-1998  M3, M3 Convertible1998-2002  M Roadster M Coupe"
https://www.turnermotorsport.com/p-348635-remanufactured-brake-caliper-front-left-e36-m3-z3m-core-charge/,"Brake Caliper - Rebuilt - Front Left - E36 M3, Z3M",348635,34112227515RKT,$149.96,https://www.turnermotorsport.com/c-82-bmw-brake-calipers?No=48&Nrpp=48#,"Our rebuilt calipers start off with an original BMW caliper that is fully disassembled thoroughly inspected and carefully processed. All threads are chased, all groves are meticulously cleaned and checked. Pistons are replaced if any dents or scratches are found. All rubber components and hardware are replaced with new OE quality parts. The units are then air pressure tested and submitted to a thorough final inspection.**Please note these calipers do not have the ///M logo on them***We also stock the Genuine BMW calipers with the ///M logo.1995-1998  M3, M3 Convertible1998-2002  M Roadster M Coupe"
https://www.turnermotorsport.com/p-359623-remanufactured-brake-caliper-rear-right-e30-318is-325e-325i-325is-325ix/,"Brake Caliper - Rebuilt - Rear Right - E30 318is, 325e 325i 325is 32...",359623,34211153244RKT,$74.95,https://www.turnermotorsport.com/c-82-bmw-brake-calipers?No=48&Nrpp=48#,"Our rebuilt calipers start off with an original BMW caliper that is fully disassembled thoroughly inspected and carefully processed. All threads are chased, all groves are meticulously cleaned and checked. Pistons are replaced if any dents or scratches are found. All rubber components and hardware are replaced with new OE quality parts. The units are then air pressure tested and submitted to a thorough final inspection."
https://www.turnermotorsport.com/p-360178-remanufactured-brake-caliper-rear-left-e46-330ici-e83-x3/,"Remanufactured Brake Caliper - Rear Left - E46 330i/ci E83 X3
     ...",360178,34216765883RKT,$140.96,https://www.turnermotorsport.com/c-82-bmw-brake-calipers?No=48&Nrpp=48#,"Our rebuilt calipers start off with an original BMW caliper that is fully disassembled thoroughly inspected and carefully processed. All threads are chased, all groves are meticulously cleaned and checked. Pistons are replaced if any dents or scratches are found. All rubber components and hardware are replaced with new OE quality parts. The units are then air pressure tested and submitted to a thorough final inspection."
https://www.turnermotorsport.com/p-4094-e36-318i325i328i-left-rear-brake-caliper/,E36 318i/325i/328i Left Rear Brake Caliper,4094,34211160333,$130.00,https://www.turnermotorsport.com/c-82-bmw-brake-calipers?No=48&Nrpp=48#,Left Rear. Fits all non-M3 E36 (318/323/325/328i). Does not fit 323/328i Convertible or 318ti.
https://www.turnermotorsport.com/p-23012-34211119212-genuine-bmw-part/,"Caliper With Out Brake Pads Right - E24, E9",23012,34211119212,$335.74,https://www.turnermotorsport.com/c-82-bmw-brake-calipers?No=48&Nrpp=48#,"Genuine BMW CALIPER WITH OUT BRAKE PADS.--       - 3.0 Cs     - 630CSi, 633CSi   --."
https://www.turnermotorsport.com/p-348632-remanufactured-brake-caliper-rear-left-e36-m3/,Brake Caliper - Rebuilt - Rear Left - E36 M3,348632,34212227519RKT,$157.95,https://www.turnermotorsport.com/c-82-bmw-brake-calipers?No=48&Nrpp=48#,"Our rebuilt calipers start off with an original BMW caliper that is fully disassembled thoroughly inspected and carefully processed. All threads are chased, all groves are meticulously cleaned and checked. Pistons are replaced if any dents or scratches are found. All rubber components and hardware are replaced with new OE quality parts. The units are then air pressure tested and submitted to a thorough final inspection.1995-1999  M3, M3 Convertible"
https://www.turnermotorsport.com/p-348634-remanufactured-brake-caliper-rear-right-e36-m3/,Remanufactured Brake Caliper - Rear Right - E36 M3,348634,34212227520RKT,$157.95,https://www.turnermotorsport.com/c-82-bmw-brake-calipers?No=48&Nrpp=48#,"Our rebuilt calipers start off with an original BMW caliper that is fully disassembled thoroughly inspected and carefully processed. All threads are chased, all groves are meticulously cleaned and checked. Pistons are replaced if any dents or scratches are found. All rubber components and hardware are replaced with new OE quality parts. The units are then air pressure tested and submitted to a thorough final inspection.1995-1999  M3, M3 Convertible"
https://www.turnermotorsport.com/p-392821-rear-porsche-caliper-adapters-e46-m3/,Rear Porsche Caliper Adapters  --  E46 M3,392821,BR0020,$162.49,https://www.turnermotorsport.com/c-82-bmw-brake-calipers?No=48&Nrpp=48#,"If you've been looking to upgrade your rear calipers on your E46 M3, Creations Motorsport have come up with adapters that will allow you to upgrade to rear Brembo Porsche 996 calipers. Designed to let you use M3 328mm x 20mm rotors (part number 34212229379), this is essentially a bolt-on setup. After installation, you will get to experience the significantly higher stopping forces you've been looking for in a track vehicle."
https://www.turnermotorsport.com/p-12583-34111157038-genuine-bmw-part/,ATE Guide Bushing Set - Priced Per Caliper,12583,34111157038,$13.95,https://www.turnermotorsport.com/c-82-bmw-brake-calipers?No=48&Nrpp=48#,REPAIR KIT GUIDE BUSH:348030
https://www.turnermotorsport.com/p-4064-rear-brake-caliper-rebuild-kit-for-e36-m3-mz3-e46-323i323ci328i328ci/,"Rear Brake Caliper Rebuild Kit - E36 M3, MZ3, E46 323i/323Ci/328i/32...",4064,34211158578,$9.95,https://www.turnermotorsport.com/c-82-bmw-brake-calipers?No=48&Nrpp=48#,E32 BMW
https://www.turnermotorsport.com/p-383387-stainless-caliper-guide-bolt-42mm-length/,"Caliper Guide Bolt - Priced Each - 42mm Length - Multiple BMWs
    ...",383387,34111157041KT5,$14.21,https://www.turnermotorsport.com/c-82-bmw-brake-calipers?No=48&Nrpp=48#,The caliper sliding bolts are one of the most overlooked wear items in your braking system. Subjected to constant motion and often without adequate lubrication the guide bolts see a lot of wear and tear. Factory BMW caliper guide bolts are very expensive from the dealer - these 304 stainless steel bolts are less than half the price and provide outstanding resistance to corrosion and wear. They are manufacturered with tighter tolerances than the factory bolts too.
https://www.turnermotorsport.com/p-375326-bleeder-screw-priced-each/,ATE Brake Caliper Bleeder Screw - Multiple BMWs,375326,34116758107,$4.00,https://www.turnermotorsport.com/c-82-bmw-brake-calipers?No=48&Nrpp=48#,
https://www.turnermotorsport.com/p-360926-rear-anti-rattle-spring-priced-each/,"Genuine BMW Rear Anti-Rattle Spring - E39 M5, E46 M3, E60 M5, E63/64...",360926,34212282198,$19.03,https://www.turnermotorsport.com/c-82-bmw-brake-calipers?No=48&Nrpp=48#,"Anti-rattle springs secure the brake pad in a fixed position inside the caliper, preventing excess noise."
https://www.turnermotorsport.com/p-362208-caliper-guide-bolt-priced-each/,ATE Caliper Guide Bolt,362208,34111157041,$4.87,https://www.turnermotorsport.com/c-82-bmw-brake-calipers?No=48&Nrpp=48#,Lets the caliper slide back and forth
https://www.turnermotorsport.com/p-61918-34116850934-genuine-bmw-part/,"Genuine BMW Guide Pin - Front - F22,F30,F31,F32,F33,F34,F36,F80 M3,F...",61918,34116850934,$19.11,https://www.turnermotorsport.com/c-82-bmw-brake-calipers?No=48&Nrpp=48#,Guide pin for M Performance calipers.
https://www.turnermotorsport.com/p-8025-genuine-bmw-brakes-guiding-bolt-34111157041/,Genuine BMW Caliper Guide Bolt - Multiple BMWs,8025,34111157041,$26.79,https://www.turnermotorsport.com/c-82-bmw-brake-calipers?No=48&Nrpp=48#,
https://www.turnermotorsport.com/p-3259-brake-bleeder-screw-e30-e36-e34-e32-e38-e31-z3/,Brake Bleeder Screw - E30 E36 E34 E32 E38 E31 Z3,3259,34111153197,$2.72,https://www.turnermotorsport.com/c-82-bmw-brake-calipers?No=48&Nrpp=48#,E32 BMW
https://www.turnermotorsport.com/p-8047-34116772428-genuine-bmw-part/,Genuine BMW Caliper Carrier Bolt - E36 E46 E9X E82 Z4 Z3,8047,34116772428,$4.22,https://www.turnermotorsport.com/c-82-bmw-brake-calipers?No=48&Nrpp=48#,"Genuine BMW Collar Screw - M12X1,5X32 Zns3    E82 1M Coupe,E36,E46,E82,E85 Z4,E86 Z4,E89 Z4,E90,E92,E93"
https://www.turnermotorsport.com/p-61867-34116780509-genuine-bmw-part/,Genuine BMW Ventilation Valve - Multiple BMWs,61867,34116780509,$8.50,https://www.turnermotorsport.com/c-82-bmw-brake-calipers?No=48&Nrpp=48#,Bleeder screw for many BMW calipers
https://www.turnermotorsport.com/p-4062-front-brake-caliper-rebuild-kit-e36-m3-e39-530i-540i-m5-e46-m3-mz3/,"Front Brake Caliper Rebuild Kit - E36 M3, E39 530i 540i M5, E46 M3, ...",4062,34111157037,$10.95,https://www.turnermotorsport.com/c-82-bmw-brake-calipers?No=48&Nrpp=48#,
https://www.turnermotorsport.com/p-588978-guide-bushing-set-priced-per-caliper/,Guide Bushing Set - Priced Per Caliper,588978,34216869617,$5.16,https://www.turnermotorsport.com/c-82-bmw-brake-calipers?No=48&Nrpp=48#,
https://www.turnermotorsport.com/p-8056-rear-caliper-anti-rattle-clip-e36-e46-z3-z4-e82-e9x/,ATE Rear Anti Rattle Spring,8056,34211157046,$3.91,https://www.turnermotorsport.com/c-82-bmw-brake-calipers?No=48&Nrpp=48#,E91 BMW
https://www.turnermotorsport.com/p-62335-34216799461-genuine-bmw-part/,"Genuine BMW Rear Brake Caliper - Left - F3X, F8X",62335,34216799461,$775.97,https://www.turnermotorsport.com/c-82-bmw-brake-calipers?No=48&Nrpp=48#,"Whether you are changing the color of your calipers or upgrading your brakes, this M Performance caliper will look great behind your wheels and will give you the performance you are looking for!"
https://www.turnermotorsport.com/p-20872-34116757253-genuine-bmw-part/,Genuine BMW Front Brake Anti Rattle Clip,20872,34116757253,$19.03,https://www.turnermotorsport.com/c-82-bmw-brake-calipers?No=96&Nrpp=48#,"Genuine BMW Clip -     E63,E65,E89 Z4,E90,E92,E93"
https://www.turnermotorsport.com/p-8074-34216758059-genuine-bmw-part/,Genuine BMW Rear Brake Pad Anti-Rattle Clip,8074,34216758059,$16.06,https://www.turnermotorsport.com/c-82-bmw-brake-calipers?No=96&Nrpp=48#,"Genuine BMW Clip    E71 X6M,E70 X5,E71 X6,F15,F16"
https://www.turnermotorsport.com/p-21830-34116768018-genuine-bmw-part/,"Genuine BMW Ventilation Valve - 34116768018 - Multiple BMWs
       ...",21830,34116768018,$7.93,https://www.turnermotorsport.com/c-82-bmw-brake-calipers?No=96&Nrpp=48#,
https://www.turnermotorsport.com/p-3260-front-caliper-anti-rattle-clip-e36-e46-z3-z4/,Front Caliper Anti-Rattle Clip - E36 E46 Z3 Z4,3260,34111163801,$5.95,https://www.turnermotorsport.com/c-82-bmw-brake-calipers?No=96&Nrpp=48#,Z4 BMW
https://www.turnermotorsport.com/p-394625-torx-screw-with-wash/,"Genuine BMW Caliper Carrier Bolt - E8X E9X F1X F2X F3X F8X
        ...",394625,34106864424,$6.95,https://www.turnermotorsport.com/c-82-bmw-brake-calipers?No=96&Nrpp=48#,Genuine BMW replacement caliper carrier torx bolt for securing the caliper to the hub.
https://www.turnermotorsport.com/p-62091-34211163323-genuine-bmw-part/,"Genuine BMW Rear Caliper Rebuild Kit - E38 740i 740iL 750iL M73
   ...",62091,34211163323,$85.43,https://www.turnermotorsport.com/c-82-bmw-brake-calipers?No=96&Nrpp=48#,Genuine BMW Repair Set Brake Caliper -     E38
https://www.turnermotorsport.com/p-8055-rear-wheel-brake-cylinder-e30-318i-1984-1985/,Rear Wheel Brake Cylinder - E30 318i 1984-1985,8055,34211154236,$13.95,https://www.turnermotorsport.com/c-82-bmw-brake-calipers?No=96&Nrpp=48#,
https://www.turnermotorsport.com/p-15883-34117845747-genuine-bmw-part/,"Genuine BMW Front Brake Caliper - Left - F10 M5, F12 F13 M6
       ...",15883,34117845747,"$1,034.35",https://www.turnermotorsport.com/c-82-bmw-brake-calipers?No=96&Nrpp=48#,"Genuine BMW Caliper Housing Left -     F06,F10,F12,F13"
https://www.turnermotorsport.com/p-1195869-/,"ATE Rear Brake Pad Anti-Rattle Clip - E60, E61, E70, E71, F15, F16 
...",1195869,34216758059,$6.47,https://www.turnermotorsport.com/c-82-bmw-brake-calipers?No=96&Nrpp=48#,Install your rear brake pads properly using this clip
https://www.turnermotorsport.com/p-186433-34116862801-genuine-bmw-part/,Genuine BMW Anti rattle clip,186433,34116862801,$17.48,https://www.turnermotorsport.com/c-82-bmw-brake-calipers?No=96&Nrpp=48#,Provides tension on the brake pads that prevents noise and vibration.
https://www.turnermotorsport.com/p-363474-guide-bushing-set-priced-per-caliper/,"ATE Guide Bushing Set - Priced Per Caliper - E60, E61, E63, E64, E65...",363474,34116758707,$16.95,https://www.turnermotorsport.com/c-82-bmw-brake-calipers?No=96&Nrpp=48#,Rubber sleeves & caps to protect caliper guides.
https://www.turnermotorsport.com/p-362380-front-brake-anti-rattle-clip-priced-each/,"ATE Front Brake Anti Rattle Clip - E60, E61, E63, E64, E65, E66, E84...",362380,34116757253,$11.95,https://www.turnermotorsport.com/c-82-bmw-brake-calipers?No=96&Nrpp=48#,Essential component for quiet operation
https://www.turnermotorsport.com/p-374679-stainless-caliper-guide-bolt-54mm-length/,"ECS Stainless Caliper Guide Bolt - 54mm Length - E53 E6X E82 E9X Z4
...",374679,34116757036KT,$11.96,https://www.turnermotorsport.com/c-82-bmw-brake-calipers?No=96&Nrpp=48#,The caliper sliding bolts are one of the most overlooked wear items in your braking system. Subjected to constant motion and often without adequate lubrication the guide bolts see a lot of wear and tear. Factory BMW caliper guide bolts are very expensive from the dealer - these 304 stainless steel bolts are less than half the price and provide outstanding resistance to corrosion and wear. They are manufacturered with tighter tolerances than the factory bolts too.
https://www.turnermotorsport.com/p-11704-rear-brake-caliper-rebuild-kit-e82-135i/,Rear Brake Caliper Rebuild Kit - E82 135i,11704,34216780515,$15.93,https://www.turnermotorsport.com/c-82-bmw-brake-calipers?No=96&Nrpp=48#,
https://www.turnermotorsport.com/p-15902-34216772867-genuine-bmw-part/,Genuine MINI Repair Kit For Rear Brake Slider Boots,15902,34216772867,$20.97,https://www.turnermotorsport.com/c-82-bmw-brake-calipers?No=96&Nrpp=48#,Genuine MINI REPAIR KIT BELLOWS
https://www.turnermotorsport.com/p-391481-retaining-clip-priced-each/,"ATE Retaining Clip - E38, E39, E53",391481,34111163488,$4.39,https://www.turnermotorsport.com/c-82-bmw-brake-calipers?No=96&Nrpp=48#,Also known as anti-rattle spring
https://www.turnermotorsport.com/p-61575-genuine-bmw-caliper-housing-right-brembo-34111161178/,Genuine BMW Brembo Caliper - Right - E31 8 Series,61575,34111161178,$613.95,https://www.turnermotorsport.com/c-82-bmw-brake-calipers?No=96&Nrpp=48#,
https://www.turnermotorsport.com/p-62326-34216793051-genuine-bmw-part/,Calliper Carrier Left - F10,62326,34216793051,$243.64,https://www.turnermotorsport.com/c-82-bmw-brake-calipers?No=96&Nrpp=48#,Genuine BMW Brake Carrier Left -     F10
https://www.turnermotorsport.com/p-374465-front-brake-caliper-repair-kit-priced-each/,TRW Front Brake Caliper Repair Kit - E30,374465,34111154440,$7.87,https://www.turnermotorsport.com/c-82-bmw-brake-calipers?No=96&Nrpp=48#,New piston seals. For vehicles with Girling calipers.
https://www.turnermotorsport.com/p-360906-front-brake-caliper-anti-rattle-clip-priced-each/,Genuine BMW Front Brake Caliper Anti Rattle Clip,360906,34111163801,$16.17,https://www.turnermotorsport.com/c-82-bmw-brake-calipers?No=96&Nrpp=48#,
https://www.turnermotorsport.com/p-62294-34216780514-genuine-bmw-part/,"Genuine BMW Rear Caliper Guide Pin - 34216780514 - E82,E90,E93
    ...",62294,34216780514,$12.14,https://www.turnermotorsport.com/c-82-bmw-brake-calipers?No=96&Nrpp=48#,"Genuine BMW Guide Pin -     E82,E90,E93"
https://www.turnermotorsport.com/p-1196175-/,"ATE Brake Caliper Anti Rattle Clip - E36, Z3",1196175,34111160348,$6.47,https://www.turnermotorsport.com/c-82-bmw-brake-calipers?No=96&Nrpp=48#,Fits both left and right sides
https://www.turnermotorsport.com/p-13541-genuine-bmw-brake-carrier-34112282619/,Genuine BMW CSL Brake caliper carrier - E46 M3,13541,34112282619,$304.92,https://www.turnermotorsport.com/c-82-bmw-brake-calipers?No=96&Nrpp=48#,
https://www.turnermotorsport.com/p-189360-34119809290-genuine-mini-part/,"Calliper Carrier Right - Cooper Countryman, Cooper Paceman
        ...",189360,34119809290,$189.05,https://www.turnermotorsport.com/c-82-bmw-brake-calipers?No=96&Nrpp=48#,Genuine MINI Brake Carrier Right
https://www.turnermotorsport.com/p-61812-34116768189-genuine-bmw-part/,Genuine BMW Repair Kit For Front Brake Slider Boots,61812,34116768189,$19.34,https://www.turnermotorsport.com/c-82-bmw-brake-calipers?No=96&Nrpp=48#,Genuine BMW REPAIR KIT BELLOWS
https://www.turnermotorsport.com/p-206479-34216860097-genuine-bmw-part/,Genuine BMW Design Retaining Spring,206479,34216860097,$19.03,https://www.turnermotorsport.com/c-82-bmw-brake-calipers?No=96&Nrpp=48#,"Genuine BMW Bmw Design Retaining Spring -     F22,F30,F31,F32,F33,F34,F36"
https://www.turnermotorsport.com/p-359458-remanufactured-brake-caliper-front-right-e9x-335i-335xi-335is-335d/,"Brake Caliper - Rebuilt - Front Right - E9X 335i 335xi 335is 335d
 ...",359458,34116773202RKT,$175.95,https://www.turnermotorsport.com/c-82-bmw-brake-calipers?No=96&Nrpp=48#,"Our rebuilt calipers start off with an original BMW caliper that is fully disassembled thoroughly inspected and carefully processed. All threads are chased, all groves are meticulously cleaned and checked. Pistons are replaced if any dents or scratches are found. All rubber components and hardware are replaced with new OE quality parts. The units are then air pressure tested and submitted to a thorough final inspection.2006+  335d 335i 335xi 335i xDrive - Sedan2007+  335i 335is 335xi 335i xDrive - Coupe2007+  335i - Convertible"
https://www.turnermotorsport.com/p-189359-34106856301-genuine-mini-part/,Genuine MINI Expansion Spring,189359,34106856301,$19.90,https://www.turnermotorsport.com/c-82-bmw-brake-calipers?No=96&Nrpp=48#,Genuine MINI Expansion Spring
https://www.turnermotorsport.com/p-190025-34106855480-genuine-bmw-part/,"Genuine BMW Brake Caliper, Orange - 34106855480",190025,34106855480,"$1,013.21",https://www.turnermotorsport.com/c-82-bmw-brake-calipers?No=96&Nrpp=48#,"Genuine BMW Brake Caliper Housing, Orange, Right - ""M Performance""F30,F31"
https://www.turnermotorsport.com/p-23010-34211119088-genuine-bmw-part/,Genuine BMW Caliper With Out Brake Pads - 34211119088,23010,34211119088,$276.03,https://www.turnermotorsport.com/c-82-bmw-brake-calipers?No=96&Nrpp=48#,Genuine BMW CALIPER WITH OUT BRAKE PADS.--       - 733i   --.
https://www.turnermotorsport.com/p-11705-front-caliper-piston-upgrade-e82-135i/,Front Caliper Piston Upgrade - E82 135i,11705,ST-135-UPGRADE,$399.00,https://www.turnermotorsport.com/c-82-bmw-brake-calipers?No=96&Nrpp=48#,NOW LOCATED UNDER T#338975
https://www.turnermotorsport.com/p-62320-34216793041-genuine-bmw-part/,Genuine BMW Caliper Housing Left - 34216793041 - F10,62320,34216793041,$395.03,https://www.turnermotorsport.com/c-82-bmw-brake-calipers?No=96&Nrpp=48#,Genuine BMW Caliper Housing Left -     F10
https://www.turnermotorsport.com/p-61478-34106784592-genuine-bmw-part/,Genuine MINI Guide Pin - Set of 2,61478,34106784592,$16.11,https://www.turnermotorsport.com/c-82-bmw-brake-calipers?No=96&Nrpp=48#,Genuine MINI GUIDE PIN
https://www.turnermotorsport.com/p-350848-brake-caliper-rebuilt-rear-left-e34-540i-m5-e32-740iil-750il/,"Brake Caliper - Rebuilt - Rear Left - E34 540i, M5 - E32 740i/il, 75...",350848,34211160399RKT,$102.95,https://www.turnermotorsport.com/c-82-bmw-brake-calipers?No=96&Nrpp=48#,"Our rebuilt calipers start off with an original BMW caliper that is fully disassembled thoroughly inspected and carefully processed. All threads are chased, all groves are meticulously cleaned and checked. Pistons are replaced if any dents or scratches are found. All rubber components and hardware are replaced with new OE quality parts. The units are then air pressure tested and submitted to a thorough final inspection."
https://www.turnermotorsport.com/p-62321-34216793042-genuine-bmw-part/,Genuine BMW Caliper Housing Right - 34216793042 - F10,62321,34216793042,$395.03,https://www.turnermotorsport.com/c-82-bmw-brake-calipers?No=96&Nrpp=48#,Genuine BMW Caliper Housing Right -     F10
https://www.turnermotorsport.com/p-15832-34111161177-genuine-bmw-part/,Genuine BMW Brembo Caliper - Front Left - E31 8 Series,15832,34111161177,$559.95,https://www.turnermotorsport.com/c-82-bmw-brake-calipers?No=96&Nrpp=48#,
https://www.turnermotorsport.com/p-177284-34117845749-genuine-bmw-part/,Genuine BMW Brake Pad Guide Pin - F10 M5 F12 M6 F13 M6,177284,34117845749,$78.58,https://www.turnermotorsport.com/c-82-bmw-brake-calipers?No=96&Nrpp=48#,"Genuine BMW Guide Pin -     F06,F10,F12,F13,F80 M3,F82 M4,F83"
https://www.turnermotorsport.com/p-1575846-caliper-paint-red/,Caliper Paint Red,1575846,POR42806,$15.81,https://www.turnermotorsport.com/c-82-bmw-brake-calipers?No=96&Nrpp=48#,Absolute Coating ( POR15) in 8 oz can For best results use prep kit ES3221127 first
https://www.turnermotorsport.com/p-362253-rear-brake-caliper-anti-rattle-clip-priced-each/,ATE Rear Brake Caliper Anti Rattle Clip - E39,362253,34211163399,$8.95,https://www.turnermotorsport.com/c-82-bmw-brake-calipers?No=96&Nrpp=48#,Fits both left and right sides
https://www.turnermotorsport.com/p-181213-34219809297-genuine-bmw-part/,"Caliper Housing Left - Cooper Countryman, Cooper Paceman",181213,34219809297,$432.26,https://www.turnermotorsport.com/c-82-bmw-brake-calipers?No=96&Nrpp=48#,Orignal MINI CALIPER HOUSING LEFT
https://www.turnermotorsport.com/p-154903-65758377290-genuine-bmw-part/,Genuine BMW Alarm Siren Bracket - E46,154903,65758377290,$32.77,https://www.turnermotorsport.com/c-82-bmw-brake-calipers?No=96&Nrpp=48#,"Genuine BMW Bracket Alternative Power Siren    E46 M3,E46,E83 X3"
https://www.turnermotorsport.com/p-181204-34119809289-genuine-bmw-part/,"Calliper Carrier Left - Cooper Countryman, Cooper Paceman",181204,34119809289,$189.05,https://www.turnermotorsport.com/c-82-bmw-brake-calipers?No=96&Nrpp=48#,Orignal MINI BRAKE CARRIER LEFT
https://www.turnermotorsport.com/p-5827-brake-caliper-rebuilt-front-right-e9x-325ixi-328ixi-2006-2007/,Brake Caliper - Rebuilt - Front Right - E9x 325i/xi 328i/xi 2006-200...,5827,34116769092R,$198.46,https://www.turnermotorsport.com/c-82-bmw-brake-calipers?No=96&Nrpp=48#,Includes $85.00 core charge to be refunded on return of your rebuildable core.
https://www.turnermotorsport.com/p-338975-front-caliper-piston-upgrade-e82-135i/,Front Caliper Piston Upgrade - E82 135i,338975,ST-135-UPGRADE,$399.00,https://www.turnermotorsport.com/c-82-bmw-brake-calipers?No=96&Nrpp=48#,This item fits the following BMWs:
https://www.turnermotorsport.com/p-5868-brake-caliper-rebuilt-front-left-e9x-328i-328xi-2008-2010/,"Brake Caliper - Rebuilt - Front Left - E9X 328i 328xi 2008-2010
   ...",5868,34116778145R,$191.96,https://www.turnermotorsport.com/c-82-bmw-brake-calipers?No=96&Nrpp=48#,Includes $80.00 core charge to be refunded on return of your rebuildable core.
https://www.turnermotorsport.com/p-2750707-caliper-housing-left-scratch-and-dent/,CALIPER HOUSING LEFT - *Scratch And Dent*,2750707,34119809287SD,$447.94,https://www.turnermotorsport.com/c-82-bmw-brake-calipers?No=96&Nrpp=48#,
https://www.turnermotorsport.com/p-2750705-caliper-housing-righ-scratch-and-dent/,CALIPER HOUSING RIGH - *Scratch And Dent*,2750705,34119809288SD,$447.94,https://www.turnermotorsport.com/c-82-bmw-brake-calipers?No=96&Nrpp=48#,
https://www.turnermotorsport.com/p-637958-front-cslzcp-bracket-set-with-hardware/,Front CSL/ZCP Bracket set with hardware,637958,34112282619KT2,$280.67,https://www.turnermotorsport.com/c-82-bmw-brake-calipers?No=96&Nrpp=48#,
https://www.turnermotorsport.com/p-583848-new-caliper-no-core-no-bracket-hpbs-brake-caliper-disc-brake-caliper-hpd-front-right/,"New Caliper, No Core No Bracket HPBS BRAKE CALIPER DISC BRAKE CALIPE...",583848,355788961,$90.95,https://www.turnermotorsport.com/c-82-bmw-brake-calipers?No=144&Nrpp=48#,
