product-img-link href,cleanDesc,part-info,part-info 2,price,wishlist-label href,short-description
https://www.turnermotorsport.com/p-378984-performance-polyurethane-rear-subframe-bushing-set-insert/,Powerflex Polyurethane Rear Subframe Bushing Insert Set - Front Moun...,378984,PFR5-521X2,$75.99,https://www.turnermotorsport.com/c-600-bmw-subframe?No=48&Nrpp=48#,"To replace both pairs of bushings for your rear subframe, these bushings must also be paired with the rear mounted bushings T#378994 Tasked with keeping the vehicles rear end firmly mounted while absorbing noise, vibration, and harshness (NVH) factory rubber subframe bushings were engineered to provide a balance of control while keeping the ride quality soft and supple. As a factory bushings age, they become brittle and begin to harden. When this happens the bushing will actually shrink and allow excess play, or movement in the subframe. This is typically felt by a sudden jerk or ""thunking"" noise under acceleration and is a leading cause of ""sloppy"" or ""loose"" suspension feel. These poly inserts provide the inherent benefit of stiffness, which translates body forces much more directly. This means steering and acceleration inputs from the driver are effectively transferred to the wheels and vital road information is transmitted properly from the wheels to the driver. Powerflex street bushings are ideal for street driven vehicles and those that see occasional autocross or track time. Need bushings for a dedicated track car? Engineered to perform, Powerflex performance polyurethane bushings offer a supreme level of control, while still providing enough comfort for the street, with advanced polyurethane that reduces NVH that often accompanies lesser bushings. Expect improved steering feel, turn in, more responsive handling and overall improved chassis composure with Powerflex performance polyurethane control arm bushings. Poweflex is a leading manufacturer of aftermarket suspension bushings. Using state of the art design and manufacturing, all replacement bushings are engineered to out-perform and out-last the ones that came in the car. Each line of bushings is meticulously tested and then re-tested to ensure perfect fitment and enduring quality through the life of the vehicle. A full lifetime warranty backs every one of their products and demonstrates the level of confidence and commitment Powerflex has to their customers."
https://www.turnermotorsport.com/p-378994-performance-polyurethane-rear-subframe-bushing-set-insert/,Powerflex Polyurethane Rear Subframe Bushing Insert Set - Rear Mount...,378994,PFR5-523X2,$84.44,https://www.turnermotorsport.com/c-600-bmw-subframe?No=48&Nrpp=48#,"To replace both pairs of bushings for your rear subframe, these bushings must also be paired with the front mounted bushings T#378984 Tasked with keeping the vehicles rear end firmly mounted while absorbing noise, vibration, and harshness (NVH) factory rubber subframe bushings were engineered to provide a balance of control while keeping the ride quality soft and supple. As a factory bushings age, they become brittle and begin to harden. When this happens the bushing will actually shrink and allow excess play, or movement in the subframe. This is typically felt by a sudden jerk or ""thunking"" noise under acceleration and is a leading cause of ""sloppy"" or ""loose"" suspension feel. These poly inserts provide the inherent benefit of stiffness, which translates body forces much more directly. This means steering and acceleration inputs from the driver are effectively transferred to the wheels and vital road information is transmitted properly from the wheels to the driver. Powerflex street bushings are ideal for street driven vehicles and those that see occasional autocross or track time. Need bushings for a dedicated track car? Engineered to perform, Powerflex performance polyurethane bushings offer a supreme level of control, while still providing enough comfort for the street, with advanced polyurethane that reduces NVH that often accompanies lesser bushings. Expect improved steering feel, turn in, more responsive handling and overall improved chassis composure with Powerflex performance polyurethane control arm bushings. Poweflex is a leading manufacturer of aftermarket suspension bushings. Using state of the art design and manufacturing, all replacement bushings are engineered to out-perform and out-last the ones that came in the car. Each line of bushings is meticulously tested and then re-tested to ensure perfect fitment and enduring quality through the life of the vehicle. A full lifetime warranty backs every one of their products and demonstrates the level of confidence and commitment Powerflex has to their customers."
https://www.turnermotorsport.com/p-362726-performance-polyurethane-subframe-bushing-set-front-position/,Powerflex Polyurethane Rear Subframe Front Position Bushing Set - E3...,362726,PFR5-3607X2,$112.71,https://www.turnermotorsport.com/c-600-bmw-subframe?No=48&Nrpp=48#,"Tasked with keeping the vehicles rear end firmly mounted while absorbing noise, vibration, and harshness (NVH) factory rubber subframe bushings were engineered to provide a balance of control while keeping the ride quality soft and supple. As a factory bushings age, they become brittle and begin to harden. When this happens the bushing will actually shrink and allow excess play, or movement in the subframe. This is typically felt by a sudden jerk or ""thunking"" noise under acceleration and is a leading cause of ""sloppy"" or ""loose"" suspension feel. By replacing the bushings with full polyurethane this play is eliminated since the subframe is being held in place by a much stiffer material that will not harden or shrink over time. Additionally, the inherent stiffness of the urethane material translates body forces much more directly. This means steering and acceleration inputs from the driver are effectively transferred to the wheels and vital road information is transmitted properly from the wheels to the driver."
https://www.turnermotorsport.com/p-360171-rear-subframe-bushingsmounts-rubber-street-e30-pair/,"Rear Subframe Bushings/Mounts - Rubber Street - E30 (Pair)
        ...",360171,33311129144KT,$63.95,https://www.turnermotorsport.com/c-600-bmw-subframe?No=48&Nrpp=48#,"The E30 rear subframe is held into the chassis by two bolts going through these rubber mounts. A lot of suspension motion, chassis flex, and driveline torque has to go through these two points, which makes them notorious for failure. When they do, the subframe will move around, playing havoc with your suspension's alignment and settings and making a very annoying clunk. These are direct replacement rubber mounts, sold as a pair.     1984-1991    318i 318is 318ic 325e 325es 325i 325ic 325is M3"
https://www.turnermotorsport.com/p-638384-race-polyurethane-rear-subframe-bushing-front-position-set/,Race Polyurethane Rear Subframe Bushing Front Position - Race - E46 ...,638384,PFR5-4610M3BLK,$146.99,https://www.turnermotorsport.com/c-600-bmw-subframe?No=48&Nrpp=48#,"Tasked with keeping the vehicles rear end firmly mounted while absorbing noise, vibration, and harshness (NVH) factory rubber subframe bushings were engineered to provide a balance of control while keeping the ride quality soft and supple. As a factory bushings age, they become brittle and begin to harden. When this happens the bushing will actually shrink and allow excess play, or movement in the subframe. This is typically felt by a sudden jerk or ""thunking"" noise under acceleration and is a leading cause of ""sloppy"" or ""loose"" suspension feel. By replacing the bushings with full polyurethane this play is eliminated since the subframe is being held in place by a much stiffer material that will not harden or shrink over time. Additionally, the inherent stiffness of the urethane material translates body forces much more directly. This means steering and acceleration inputs from the driver are effectively transferred to the wheels and vital road information is transmitted properly from the wheels to the driver. Powerflex Black Series bushings are the ultimate in track and race bushings. Featuring 95A durometer polyurethane, Black Series bushings are 25% stiffer than street bushings. Engineered to perform, Powerflex performance polyurethane bushings offer a supreme level of control, while still providing enough comfort for the street, with advanced polyurethane that reduces NVH that often accompanies lesser bushings. Expect improved steering feel, turn in, more responsive handling and overall improved chassis composure with Powerflex performance polyurethane control arm bushings. Poweflex is a leading manufacturer of aftermarket suspension bushings. Using state of the art design and manufacturing, all replacement bushings are engineered to out-perform and out-last the ones that came in the car. Each line of bushings is meticulously tested and then re-tested to ensure perfect fitment and enduring quality through the life of the vehicle. A full lifetime warranty backs every one of their products and demonstrates the level of confidence and commitment Powerflex has to their customers."
https://www.turnermotorsport.com/p-378996-performance-polyurethane-rear-differential-bushings-rear-mount/,Powerflex Polyurethane Rear Differential Rear Position Bushings - E3...,378996,PFR5-526X2,$94.04,https://www.turnermotorsport.com/c-600-bmw-subframe?No=48&Nrpp=48#,"Differential bushings are responsible for keeping the differential in solid alignment while dampening drivetrain vibration. While OE rubber bushings are fine when they are new from the factory, aged and worn out rubber bushings create a multitude of issues that can range from annoying to dangerous. As a factory bushing ages, it begins to harden and become brittle. When this happens the bushing will actually shrink and allow for movement at the differential mounting point. At this point, the differential is free to shift under load causing a noticeable clunking noise under acceleration and deceleration and massively increasing the stress on the driveshaft and axles. Manual transmissions suffer the worst from this as it can make shifting difficult since the differential will shift when the clutch is engaged and disengaged."
https://www.turnermotorsport.com/p-60061-33312283384-genuine-bmw-part/,Genuine BMW Differential Carrier Bushing - Rear Position - E90 E92 E...,60061,33312283384,$131.87,https://www.turnermotorsport.com/c-600-bmw-subframe?No=48&Nrpp=48#,This is the rear differential carrier bushing located in the rear subframe.
https://www.turnermotorsport.com/p-378977-performance-polyurethane-rear-subframe-bushing-set/,Powerflex Performance Polyurethane Rear Subframe Bushing Set - Front...,378977,PFR5-520X2,$143.99,https://www.turnermotorsport.com/c-600-bmw-subframe?No=48&Nrpp=48#,"To replace both pairs of bushings for your rear subframe, these bushings must also be paired with the rear mounted bushings T#378983 Tasked with keeping the vehicles rear end firmly mounted while absorbing noise, vibration, and harshness (NVH) factory rubber subframe bushings were engineered to provide a balance of control while keeping the ride quality soft and supple. As a factory bushings age, they become brittle and begin to harden. When this happens the bushing will actually shrink and allow excess play, or movement in the subframe. This is typically felt by a sudden jerk or ""thunking"" noise under acceleration and is a leading cause of ""sloppy"" or ""loose"" suspension feel. By replacing the bushings with full polyurethane this play is eliminated since the subframe is being held in place by a much stiffer material that will not harden or shrink over time. Additionally, the inherent stiffness of the urethane material translates body forces much more directly. This means steering and acceleration inputs from the driver are effectively transferred to the wheels and vital road information is transmitted properly from the wheels to the driver. Powerflex street bushings are ideal for street driven vehicles and those that see occasional autocross or track time. Need bushings for a dedicated track car? Powerflex Black Series bushings are the ultimate in track and race bushings. Featuring 95A durometer polyurethane, Black Series bushings are 25% stiffer than street bushings. Engineered to perform, Powerflex performance polyurethane bushings offer a supreme level of control, while still providing enough comfort for the street, with advanced polyurethane that reduces NVH that often accompanies lesser bushings. Expect improved steering feel, turn in, more responsive handling and overall improved chassis composure with Powerflex performance polyurethane control arm bushings. Poweflex is a leading manufacturer of aftermarket suspension bushings. Using state of the art design and manufacturing, all replacement bushings are engineered to out-perform and out-last the ones that came in the car. Each line of bushings is meticulously tested and then re-tested to ensure perfect fitment and enduring quality through the life of the vehicle. A full lifetime warranty backs every one of their products and demonstrates the level of confidence and commitment Powerflex has to their customers."
https://www.turnermotorsport.com/p-376406-performance-polyurethane-subframe-bushing-set/,Powerflex Polyurethane Subframe Bushing Set - E34,376406,PFR5-507X2,$106.26,https://www.turnermotorsport.com/c-600-bmw-subframe?No=48&Nrpp=48#,"Tasked with keeping the vehicles rear end firmly mounted while absorbing noise, vibration, and harshness (NVH) factory rubber subframe bushings were engineered to provide a balance of control while keeping the ride quality soft and supple. As a factory bushings age, they become brittle and begin to harden. When this happens the bushing will actually shrink and allow excess play, or movement in the subframe. This is typically felt by a sudden jerk or ""thunking"" noise under acceleration and is a leading cause of ""sloppy"" or ""loose"" suspension feel. By replacing the bushings with full polyurethane this play is eliminated since the subframe is being held in place by a much stiffer material that will not harden or shrink over time. Additionally, the inherent stiffness of the urethane material translates body forces much more directly. This means steering and acceleration inputs from the driver are effectively transferred to the wheels and vital road information is transmitted properly from the wheels to the driver."
https://www.turnermotorsport.com/p-1573-rear-subframe-bushingsmount-set-turner-solid-delrinaluminum-e82-1m-e9x-m3/,Rear Subframe Bushings/Mount Set - Turner Solid Delrin/Aluminum - E8...,1573,TDR9080SM3,$489.56,https://www.turnermotorsport.com/c-600-bmw-subframe?No=48&Nrpp=48#,"These E90/E92 M3 solid rear sub-frame mounts are designed around Grand-Am, BMW CCA, and other series' regulations where a solid metal mount cannot be used. These are derived from, and currently used in our own Turner E92 M3 racecars. Thick Delrin casings are used as the non-metallic solid bushing. High quality aluminum sleeves, with increased surface area, are then pressed into each of the casings with washers integrated into each one. The washers are employed to add an extra safety factor for securing the sub-frame into position.   The E9x M3 rear sub-frame is the heart of its suspension, and we have found with a short amount of track time the stock bushings will start to degrade. When the M3 sub-frame moves, so do all the suspension mounting points. Replacing the stock rubber bushings limits drivetrain and suspension movement, and keeps your M3's setup the way it's supposed to be. These bushings are CNC machined in the USA and made with high-grade materials.   Feedback from a fellow tuning shop:  ""I never liked the vague feeling and lack of feedback through the rear suspension wit the stock rubber bushings. Also, with the added power of my ESS VT2-650 kit the car required slight steering corrections under WOT in a straight line due to bushing deflection and this really bothered me. It is important to note that I am ultra sensitive when it comes to NVH and other subtle noises and sensations in a car so when I say that the Delrin mounts add close to zero NVH you can trust me! If someone snuck into my garage and installed the mounts at 2am I doubt I would have ever noticed, apart from the super solid and precise feel they give at the rear of the car.""       2010-2012    1M  2008-2012    M3 - Sedan  2008-2012    M3 - Coupe  2008-2012    M3 - Convertible"
https://www.turnermotorsport.com/p-1688-rear-subframe-bushingsmounts-forefront-pair-e36-m3-upgrade-for-e36-non-m-pair/,Genuine BMW Rear Subframe Bushing Set - E36 M3,1688,33319066671,$128.37,https://www.turnermotorsport.com/c-600-bmw-subframe?No=48&Nrpp=48#,"The slightly firmer rubber is more durable than the stock non-M subframe mounts, and as such we highly recommend these bushings for all E36 chassis 318i, 318is, 325i, 325is, 323is, 328i, and 328is."
https://www.turnermotorsport.com/p-376504-performance-polyurethane-rear-subframe-bushings-front-position-set/,Powerflex Performance Polyurethane Rear Subframe Bushings - Front Po...,376504,PFR5-420X2,$189.99,https://www.turnermotorsport.com/c-600-bmw-subframe?No=48&Nrpp=48#,"Tasked with keeping the vehicles rear end firmly mounted while absorbing noise, vibration, and harshness (NVH) factory rubber subframe bushings were engineered to provide a balance of control while keeping the ride quality soft and supple. As a factory bushings age, they become brittle and begin to harden. When this happens the bushing will actually shrink and allow excess play, or movement in the subframe. This is typically felt by a sudden jerk or ""thunking"" noise under acceleration and is a leading cause of ""sloppy"" or ""loose"" suspension feel. By replacing the bushings with full polyurethane this play is eliminated since the subframe is being held in place by a much stiffer material that will not harden or shrink over time. Additionally, the inherent stiffness of the urethane material translates body forces much more directly. This means steering and acceleration inputs from the driver are effectively transferred to the wheels and vital road information is transmitted properly from the wheels to the driver."
https://www.turnermotorsport.com/p-362731-race-polyurethane-rear-subframe-bushing-front-position-set/,Race Polyurethane Rear Subframe Bushing Front Position - Race - E46 ...,362731,PFR5-4610BX2,$143.99,https://www.turnermotorsport.com/c-600-bmw-subframe?No=48&Nrpp=48#,"Tasked with keeping the vehicles rear end firmly mounted while absorbing noise, vibration, and harshness (NVH) factory rubber subframe bushings were engineered to provide a balance of control while keeping the ride quality soft and supple. As a factory bushings age, they become brittle and begin to harden. When this happens the bushing will actually shrink and allow excess play, or movement in the subframe. This is typically felt by a sudden jerk or ""thunking"" noise under acceleration and is a leading cause of ""sloppy"" or ""loose"" suspension feel. By replacing the bushings with full polyurethane this play is eliminated since the subframe is being held in place by a much stiffer material that will not harden or shrink over time. Additionally, the inherent stiffness of the urethane material translates body forces much more directly. This means steering and acceleration inputs from the driver are effectively transferred to the wheels and vital road information is transmitted properly from the wheels to the driver."
https://www.turnermotorsport.com/p-376544-race-polyurethane-subframe-inserts-front-position-set/,"Race Polyurethane Subframe Inserts, Front Position Set - E8X, E9X
 ...",376544,PFR5-419BX2,$102.21,https://www.turnermotorsport.com/c-600-bmw-subframe?No=48&Nrpp=48#,"Tasked with keeping the vehicles rear end firmly mounted while absorbing noise, vibration, and harshness (NVH) factory rubber subframe bushings were engineered to provide a balance of control while keeping the ride quality soft and supple. As a factory bushings age, they become brittle and begin to harden. When this happens the bushing will actually shrink and allow excess play, or movement in the subframe. This is typically felt by a sudden jerk or ""thunking"" noise under acceleration and is a leading cause of ""sloppy"" or ""loose"" suspension feel. By replacing the bushings with full polyurethane this play is eliminated since the subframe is being held in place by a much stiffer material that will not harden or shrink over time. Additionally, the inherent stiffness of the urethane material translates body forces much more directly. This means steering and acceleration inputs from the driver are effectively transferred to the wheels and vital road information is transmitted properly from the wheels to the driver."
https://www.turnermotorsport.com/p-376388-race-polyurethane-rear-subframe-bushings-rear-position-set/,Powerflex Race Polyurethane Subframe Bushings - Rear Position - E9X ...,376388,PFR5-422BX2,$180.99,https://www.turnermotorsport.com/c-600-bmw-subframe?No=48&Nrpp=48#,"Tasked with keeping the vehicles rear end firmly mounted while absorbing noise, vibration, and harshness (NVH) factory rubber subframe bushings were engineered to provide a balance of control while keeping the ride quality soft and supple. As a factory bushings age, they become brittle and begin to harden. When this happens the bushing will actually shrink and allow excess play, or movement in the subframe. This is typically felt by a sudden jerk or ""thunking"" noise under acceleration and is a leading cause of ""sloppy"" or ""loose"" suspension feel. By replacing the bushings with full polyurethane this play is eliminated since the subframe is being held in place by a much stiffer material that will not harden or shrink over time. Additionally, the inherent stiffness of the urethane material translates body forces much more directly. This means steering and acceleration inputs from the driver are effectively transferred to the wheels and vital road information is transmitted properly from the wheels to the driver."
https://www.turnermotorsport.com/p-376501-performance-polyurethane-subframe-insert-set/,"Powerflex Polyurethane Subframe Insert Set - E82, E88, E90, E92, E93...",376501,PFR5-421X2,$82.99,https://www.turnermotorsport.com/c-600-bmw-subframe?No=48&Nrpp=48#,"Tasked with keeping the vehicles rear end firmly mounted while absorbing noise, vibration, and harshness (NVH) factory rubber subframe bushings were engineered to provide a balance of control while keeping the ride quality soft and supple. As a factory bushings age, they become brittle and begin to harden. When this happens the bushing will actually shrink and allow excess play, or movement in the subframe. This is typically felt by a sudden jerk or ""thunking"" noise under acceleration and is a leading cause of ""sloppy"" or ""loose"" suspension feel. These poly inserts provide the inherent benefit of stiffness, which translates body forces much more directly. This means steering and acceleration inputs from the driver are effectively transferred to the wheels and vital road information is transmitted properly from the wheels to the driver."
https://www.turnermotorsport.com/p-376432-race-polyurethane-rear-subframe-bushings-front-position-set/,Powerflex Race Polyurethane Rear Subframe Bushings - Front Position ...,376432,PFR5-420BX2,$209.99,https://www.turnermotorsport.com/c-600-bmw-subframe?No=48&Nrpp=48#,"Tasked with keeping the vehicles rear end firmly mounted while absorbing noise, vibration, and harshness (NVH) factory rubber subframe bushings were engineered to provide a balance of control while keeping the ride quality soft and supple. As a factory bushings age, they become brittle and begin to harden. When this happens the bushing will actually shrink and allow excess play, or movement in the subframe. This is typically felt by a sudden jerk or ""thunking"" noise under acceleration and is a leading cause of ""sloppy"" or ""loose"" suspension feel. By replacing the bushings with full polyurethane this play is eliminated since the subframe is being held in place by a much stiffer material that will not harden or shrink over time. Additionally, the inherent stiffness of the urethane material translates body forces much more directly. This means steering and acceleration inputs from the driver are effectively transferred to the wheels and vital road information is transmitted properly from the wheels to the driver."
