product-img-link href,cleanDesc,part-info,part-info 2,price,wishlist-label href,short-description
https://www.turnermotorsport.com/p-597270-complete-muffler-hanger-kit/,E30 325i Complete Muffler Hanger Kit,597270,18211707923KT1,$248.18,https://www.turnermotorsport.com/c-148-bmw-gaskets-hangers-and-parts?No=300&Nrpp=50#,This is a complete exhaust hanger and bracket kit for the 1987-1992 E30 325i models. It's all of the hangers and gaskets needed for the rear muffler and a life-saving addition to any exhaust project on your car. Any of the hardware and hangers that have been on the car for a few years are prone to rust and seizing in place. So to get them off usually means breaking or cutting one or more pieces. So having this complete E30 hanger kit on hand will allow you to finish the job without scrambling for parts later on. And new hangers are always a good idea anyway.   This 325i hanger kit includes -  front upper muffler body clamp - 18201707925 (18211707923) - x 1  front lower muffler body clamps - 18201178132 (18211178126) - x 2  rear lower muffler body clamp - 18211176029 (18211176713) - x 1  rear muffler rubber hangers - 18211712838 - x 2  center muffler rubber hanger - 18211105635 - x 1  muffler to center section seal ring (45mm) - 18111723541 x 1  muffler to center section seal ring (42mm) - 18111245960 x 1  nuts & bolts for all of the above   There is an early and late version to the muffler band clamps but the only difference we saw was more holes in the band on the early style. The early style is included in this kit which might be better because water won't get trapped between the clamp and the muffler body.   If you're removing the center section from the exhaust manifolds you can add those gaskets as well.     1987-1992    325i 325ic 325is 325ix
https://www.turnermotorsport.com/p-7031-11621304755-genuine-bmw-part/,"Rein Hex Nut - E24, E28, E30, E34",7031,11621304755,$1.95,https://www.turnermotorsport.com/c-148-bmw-gaskets-hangers-and-parts?No=300&Nrpp=50#,"OEM BMW ENGINE HEX NUT 11621304755.--       - M3, M5, M6   --."
https://www.turnermotorsport.com/p-363430-exhaust-manifold-gasket-with-heat-shield-priced-each/,Exhaust Manifold Gasket With Heat Shield - Priced Each,363430,11621732969,$21.95,https://www.turnermotorsport.com/c-148-bmw-gaskets-hangers-and-parts?No=300&Nrpp=50#,
https://www.turnermotorsport.com/p-592034-exhaust-gasket-catalytic-converter-to-front-muffler-and-manifold-to-catalytic-converter/,Rein Exhaust Gasket - Catalytic Converter to Front Muffler and Manif...,592034,18301440183,$8.95,https://www.turnermotorsport.com/c-148-bmw-gaskets-hangers-and-parts?No=300&Nrpp=50#,
https://www.turnermotorsport.com/p-582099-exhaust-hanger-kit-bosal/,Bosal Exhaust Hanger Kit - E30,582099,254-980,$48.51,https://www.turnermotorsport.com/c-148-bmw-gaskets-hangers-and-parts?No=300&Nrpp=50#,Everything you need to give your muffler the support it deserves.
https://www.turnermotorsport.com/p-559442-exhaust-manifold-gasket/,"Exhaust Manifold Gasket - E30 M20, E34 525i M20",559442,11621723655,$12.95,https://www.turnermotorsport.com/c-148-bmw-gaskets-hangers-and-parts?No=300&Nrpp=50#,"This item fits the following BMW Chassis: E30,E34 Fits BMW Engines including: M20"
https://www.turnermotorsport.com/p-19242-11611730742-bmw-part/,"Victor Reinz Exhaust Gasket - E12, E21, E23, E24",19242,11611730742,$1.29,https://www.turnermotorsport.com/c-148-bmw-gaskets-hangers-and-parts?No=300&Nrpp=50#,
https://www.turnermotorsport.com/p-379781-muffler-suspension-loop-priced-each/,Rein Muffler Suspension Loop - E39,379781,18201433957,$13.95,https://www.turnermotorsport.com/c-148-bmw-gaskets-hangers-and-parts?No=300&Nrpp=50#,Used to isolate the muffler assembly from vibrations
https://www.turnermotorsport.com/p-384840-exhaust-gasket-priced-each/,Ajusa Exhaust Gasket,384840,11657593303,$5.95,https://www.turnermotorsport.com/c-148-bmw-gaskets-hangers-and-parts?No=300&Nrpp=50#,Used to seal the exhaust manifold to the cylinder head
https://www.turnermotorsport.com/p-341761-tms341761/,"Ajusa Exhaust Manifold Gasket - E30, E34",341761,11621728489,$11.95,https://www.turnermotorsport.com/c-148-bmw-gaskets-hangers-and-parts?No=300&Nrpp=50#,2 required per vehicle
https://www.turnermotorsport.com/p-12353-18111728363-genuine-bmw-part/,Elring Exhaust Gasket - E21,12353,18111728363,$4.95,https://www.turnermotorsport.com/c-148-bmw-gaskets-hangers-and-parts?No=300&Nrpp=50#,OEM BMW GASKET ASBESTOS FREE:H1810D
https://www.turnermotorsport.com/p-363429-exhaust-manifold-gasket-priced-each/,Ajusa Exhaust Manifold Gasket - S54 3.2L,363429,11627830667,$7.95,https://www.turnermotorsport.com/c-148-bmw-gaskets-hangers-and-parts?No=300&Nrpp=50#,This seals the exhaust manifold to the head. We recommend replacing this any time the exhaust manifold needs to be removed. Fits the following BMW engines: S54 3.2L
https://www.turnermotorsport.com/p-594006-exhaust-manifold-gasket-cylinder-head-to-manifold/,Ajusa Exhaust Manifold Gasket - Cylinder Head to Manifold - E31 E32 ...,594006,11627509677,$9.95,https://www.turnermotorsport.com/c-148-bmw-gaskets-hangers-and-parts?No=300&Nrpp=50#,
https://www.turnermotorsport.com/p-527208-flange/,Genuine BMW Exhaust Flange - F80 M3 F82 F83 M4,527208,18327850430,$24.14,https://www.turnermotorsport.com/c-148-bmw-gaskets-hangers-and-parts?No=300&Nrpp=50#,
https://www.turnermotorsport.com/p-378173-exhaust-manifold-gasket/,"Elring Exhaust Manifold Gasket - E23, E24, E28, E32, E34",378173,11621723656,$11.95,https://www.turnermotorsport.com/c-148-bmw-gaskets-hangers-and-parts?No=300&Nrpp=50#,Seals the exhaust manifold to the cylinder head
https://www.turnermotorsport.com/p-367946-downpipe-gasket-priced-each/,Downpipe Gasket - Priced Each,367946,18111728364,$17.60,https://www.turnermotorsport.com/c-148-bmw-gaskets-hangers-and-parts?No=300&Nrpp=50#,
https://www.turnermotorsport.com/p-642055-exhaust-flap-actuator-repair-kit/,"Genuine BMW Exhaust Flap Actuator Repair Kit - Multiple BMWs
      ...",642055,18308632154KT,$141.16,https://www.turnermotorsport.com/c-148-bmw-gaskets-hangers-and-parts?No=300&Nrpp=50#,"If the exhaust flap in you vehicle is stuck open or closed, it's likely that the exhaust actuator is the culprit. This piece is that rotates the flap's position 90 degrees, allowing for increased exhaust flow for better sound and performance. Replace yours with this kit that contains all the components necessary to do the job right."
https://www.turnermotorsport.com/p-12478-genuine-bmw-exhaust-manifold-flange-bolt-engine-hex-bolt-11621427586/,"Genuine BMW Hex Bolt M10X40 - 11621427586 - E36,E39,E46,E53,E83,E85
...",12478,11621427586,$16.38,https://www.turnermotorsport.com/c-148-bmw-gaskets-hangers-and-parts?No=300&Nrpp=50#,
https://www.turnermotorsport.com/p-48062-18211745300-genuine-bmw-part/,Genuine BMW Exhaust Center Support - E39 E38,48062,18211745300,$41.98,https://www.turnermotorsport.com/c-148-bmw-gaskets-hangers-and-parts?No=300&Nrpp=50#,"Genuine BMW Connecting Support    E39 M5,E38,E39     M52,M54,M62,M73,M73N,S62"
https://www.turnermotorsport.com/p-587614-vrsf-35-turbo-to-downpipe-gasket-for-bmw-135i-335i-535i-640i-z4-m3-m4-m5-m6-n54n55s55n63s63-18307553601/,"3.5"" Turbo to Downpipe Gasket for BMW",587614,GAS100,$19.95,https://www.turnermotorsport.com/c-148-bmw-gaskets-hangers-and-parts?No=300&Nrpp=50#,"3.5"" Turbo to Downpipe Gasket for BMW PN 18307553601"
https://www.turnermotorsport.com/p-12674-18201178132-genuine-bmw-part/,Genuine BMW Rear Muffler Hanger - Upper Section - E30 318 325i 325e ...,12674,18201178132,$28.04,https://www.turnermotorsport.com/c-148-bmw-gaskets-hangers-and-parts?No=300&Nrpp=50#,Genuine BMW Bow -     E30     M20
https://www.turnermotorsport.com/p-19618-18301723881-bmw-part/,"Rein Exhaust Gasket - E12, E23, E24, E28",19618,18301723881,$7.95,https://www.turnermotorsport.com/c-148-bmw-gaskets-hangers-and-parts?No=300&Nrpp=50#,
https://www.turnermotorsport.com/p-596076-/,"Meistersatz Exhaust Manifold Gasket with Heat Shield - E28 E30 E34
...",596076,11621723655,$12.95,https://www.turnermotorsport.com/c-148-bmw-gaskets-hangers-and-parts?No=300&Nrpp=50#,
https://www.turnermotorsport.com/p-379616-50x95-dual-clamp/,CRP Muffler Clamp - 50 mm for Exhaust Pipes - E39 E46 E53 E60 E61 Z3...,379616,18307560777,$10.95,https://www.turnermotorsport.com/c-148-bmw-gaskets-hangers-and-parts?No=300&Nrpp=50#,
https://www.turnermotorsport.com/p-638801-exhaust-clamp/,Exhaust Clamp,638801,18211707923,$16.34,https://www.turnermotorsport.com/c-148-bmw-gaskets-hangers-and-parts?No=300&Nrpp=50#,
https://www.turnermotorsport.com/p-40343-12521735478-genuine-bmw-part/,Lambda-Probe Bracket - E36,40343,12521735478,$16.95,https://www.turnermotorsport.com/c-148-bmw-gaskets-hangers-and-parts?No=350&Nrpp=50#,"Genuine BMW Lambda-Probe Bracket    E36 M3,E36     M50,S50"
https://www.turnermotorsport.com/p-48656-18307841714-genuine-bmw-part/,"Exhaust Clamp - E90, E92, E93",48656,18307841714,$24.81,https://www.turnermotorsport.com/c-148-bmw-gaskets-hangers-and-parts?No=350&Nrpp=50#,"Genuine BMW Left Pipe Clamp -     E90,E92,E93     S65"
https://www.turnermotorsport.com/p-48121-18301408018-genuine-bmw-part/,"Gearbox Support - E39, E52",48121,18301408018,$22.10,https://www.turnermotorsport.com/c-148-bmw-gaskets-hangers-and-parts?No=350&Nrpp=50#,"Genuine BMW Gearbox Support    E39 M5,E39     S62"
https://www.turnermotorsport.com/p-30713-11111741294-genuine-bmw-part/,"Crankshaft Main Bearing Cap Bolt - E31, E32, E34, E38",30713,11111741294,$5.37,https://www.turnermotorsport.com/c-148-bmw-gaskets-hangers-and-parts?No=350&Nrpp=50#,"Genuine BMW Collar Screw - M10X100    E34,E38     M60,M73,M73N,S70"
https://www.turnermotorsport.com/p-47774-18207551219-genuine-bmw-part/,"Exhaust Clamp - E82, E88",47774,18207551219,$24.81,https://www.turnermotorsport.com/c-148-bmw-gaskets-hangers-and-parts?No=350&Nrpp=50#,"Genuine BMW Pipe Clamp, Bottom -     E82     N51,N52N"
https://www.turnermotorsport.com/p-114469-51487117375-genuine-bmw-part/,Genuine BMW Heat Shield - E90 E92 E91,114469,51487117375,$47.67,https://www.turnermotorsport.com/c-148-bmw-gaskets-hangers-and-parts?No=350&Nrpp=50#,"Genuine BMW Tunnel Heat Insulator -     E90,E92"
https://www.turnermotorsport.com/p-27527-07119904277-genuine-bmw-part/,"Screw - Self Tapping - E70, E71, F06",27527,07119904277,$1.25,https://www.turnermotorsport.com/c-148-bmw-gaskets-hangers-and-parts?No=350&Nrpp=50#,"Genuine BMW Sheet Metal Screw    E70 X5M,E71 X6M,E70 X5,E71 X6,F06"
https://www.turnermotorsport.com/p-27497-07119904165-genuine-bmw-part/,"Screw - Self Tapping - E65, E66, Z4",27497,07119904165,$1.03,https://www.turnermotorsport.com/c-148-bmw-gaskets-hangers-and-parts?No=350&Nrpp=50#,"Genuine BMW Sheet Metal Screw    E85 Z4M,E65,E85 Z4,E86 Z4"
https://www.turnermotorsport.com/p-222983-33306862878-genuine-bmw-part/,"Vibration Absorber - 48Hz - F30, F32, F33, F34, F36",222983,33306862878,$163.39,https://www.turnermotorsport.com/c-148-bmw-gaskets-hangers-and-parts?No=350&Nrpp=50#,"Genuine BMW Vibration Absorber - 48Hz     F30,F33,F36,"
https://www.turnermotorsport.com/p-7510-18211715871-genuine-bmw-part/,"Genuine BMW Bracket, Exhaust Pipe Left - 18211715871 - E38
        ...",7510,18211715871,$22.10,https://www.turnermotorsport.com/c-148-bmw-gaskets-hangers-and-parts?No=350&Nrpp=50#,"Genuine BMW Bracket, Exhaust Pipe Left -     E38     M73N"
https://www.turnermotorsport.com/p-48175-18301728459-genuine-bmw-part/,"Exhaust Support - E36, Z3",48175,18301728459,$10.82,https://www.turnermotorsport.com/c-148-bmw-gaskets-hangers-and-parts?No=350&Nrpp=50#,"Genuine BMW Exhaust Support -     E36     M42,M44"
https://www.turnermotorsport.com/p-37654-11781738601-genuine-bmw-part/,"Guide - E32, E34",37654,11781738601,$50.40,https://www.turnermotorsport.com/c-148-bmw-gaskets-hangers-and-parts?No=350&Nrpp=50#,"Genuine BMW Guide    E34 M5,E34     M30,M50,S38"
https://www.turnermotorsport.com/p-48716-18311728408-genuine-bmw-part/,Clamp - E36,48716,18311728408,$11.53,https://www.turnermotorsport.com/c-148-bmw-gaskets-hangers-and-parts?No=350&Nrpp=50#,"Genuine BMW Clamp    E36 M3,E36     M50,S50"
https://www.turnermotorsport.com/p-140712-61138353711-genuine-bmw-part/,"Cable Holder - E38, E39, E46, E52, Z3",140712,61138353711,$8.30,https://www.turnermotorsport.com/c-148-bmw-gaskets-hangers-and-parts?No=350&Nrpp=50#,"Genuine BMW Cable Holder    E39 M5,E46 M3,E38,E39,E46"
https://www.turnermotorsport.com/p-37661-11781744542-genuine-bmw-part/,Guide Tube Lower Part - E36,37661,11781744542,$16.18,https://www.turnermotorsport.com/c-148-bmw-gaskets-hangers-and-parts?No=350&Nrpp=50#,"Genuine BMW Guide Tube Lower Part - Lambda    E36     M44,M52,S52"
https://www.turnermotorsport.com/p-7511-18211715872-genuine-bmw-part/,Bracket - Exhaust Pipe Right - E38,7511,18211715872,$22.10,https://www.turnermotorsport.com/c-148-bmw-gaskets-hangers-and-parts?No=350&Nrpp=50#,"Genuine BMW Bracket, Exhaust Pipe Right -     E38     M73N"
https://www.turnermotorsport.com/p-48168-18301728050-genuine-bmw-part/,Holder - E31,48168,18301728050,$66.14,https://www.turnermotorsport.com/c-148-bmw-gaskets-hangers-and-parts?No=350&Nrpp=50#,Genuine BMW BRACKET    M70
https://www.turnermotorsport.com/p-48649-18307836970-genuine-bmw-part/,"Genuine BMW Center Pipe Support Bracket - E60 M5 E63 M6 E64 M6
    ...",48649,18307836970,$54.41,https://www.turnermotorsport.com/c-148-bmw-gaskets-hangers-and-parts?No=350&Nrpp=50#,"Genuine BMW Connecting Support    E60 M5,E63 M6,E63     S85"
https://www.turnermotorsport.com/p-47670-18201439930-genuine-bmw-part/,"Support - E38, E39",47670,18201439930,$22.10,https://www.turnermotorsport.com/c-148-bmw-gaskets-hangers-and-parts?No=350&Nrpp=50#,"Genuine BMW Support -     E38,E39     M62"
https://www.turnermotorsport.com/p-48178-18301728585-genuine-bmw-part/,Exhaust Support - E36,48178,18301728585,$10.82,https://www.turnermotorsport.com/c-148-bmw-gaskets-hangers-and-parts?No=350&Nrpp=50#,Genuine BMW Exhaust Support -     E36     M42
https://www.turnermotorsport.com/p-47740-18207530608-genuine-bmw-part/,"Clamp - E60, E61",47740,18207530608,$24.81,https://www.turnermotorsport.com/c-148-bmw-gaskets-hangers-and-parts?No=350&Nrpp=50#,Genuine BMW CLAMP    N54
https://www.turnermotorsport.com/p-177075-11781734345-genuine-bmw-part/,Oxygen Sensor - E36,177075,11781734345,$267.30,https://www.turnermotorsport.com/c-148-bmw-gaskets-hangers-and-parts?No=350&Nrpp=50#,Genuine BMW Oxygen Sensor - L=570mm    E36     M42
https://www.turnermotorsport.com/p-48714-18311728254-genuine-bmw-part/,Bracket - E46,48714,18311728254,$53.87,https://www.turnermotorsport.com/c-148-bmw-gaskets-hangers-and-parts?No=350&Nrpp=50#,Genuine BMW Bracket - Zf    E46     M52
https://www.turnermotorsport.com/p-47671-18201440068-genuine-bmw-part/,"Support - E38, E39",47671,18201440068,$22.10,https://www.turnermotorsport.com/c-148-bmw-gaskets-hangers-and-parts?No=350&Nrpp=50#,"Genuine BMW Support -     E38,E39     M62"
https://www.turnermotorsport.com/p-48117-18301407092-genuine-bmw-part/,Genuine BMW Lower Exhaust Clamp - E39 M5,48117,18301407092,$24.82,https://www.turnermotorsport.com/c-148-bmw-gaskets-hangers-and-parts?No=350&Nrpp=50#,"Genuine BMW Pipe Clamp    E39 M5,E39     S62"
https://www.turnermotorsport.com/p-22620-18301436513-genuine-bmw-part/,Vibration Absorber - E39,22620,18301436513,$93.50,https://www.turnermotorsport.com/c-148-bmw-gaskets-hangers-and-parts?No=350&Nrpp=50#,Genuine BMW Vibration Absorber -     E39     M52
https://www.turnermotorsport.com/p-596073-/,Elring Exhaust Manifold Gasket - Cylinder Head to Manifold - E31 E32...,596073,11627509677,$6.95,https://www.turnermotorsport.com/c-148-bmw-gaskets-hangers-and-parts?No=350&Nrpp=50#,
https://www.turnermotorsport.com/p-383892-exhaust-manifold-gasket-with-heat-shield-priced-each/,"Elring Exhaust Manifold Gasket With Heat Shield - E39, E46, E53, E60...",383892,11621732969,$23.95,https://www.turnermotorsport.com/c-148-bmw-gaskets-hangers-and-parts?No=350&Nrpp=50#,2 required per vehicle
https://www.turnermotorsport.com/p-302060-m50m52s50uss52-exhaust-manifold-block-off-plates-pair/,"M50/M52/S50US/S52 Exhaust Manifold Block Off Plates (Pair)
        ...",302060,TMI3650115,$39.96,https://www.turnermotorsport.com/c-148-bmw-gaskets-hangers-and-parts?No=350&Nrpp=50#,
https://www.turnermotorsport.com/p-382412-copper-exhaust-lock-nut-priced-each/,Febi Copper Exhaust Lock Nut,382412,11621711954,$2.95,https://www.turnermotorsport.com/c-148-bmw-gaskets-hangers-and-parts?No=350&Nrpp=50#,Flange copper nut
https://www.turnermotorsport.com/p-381850-rubber-muffler-hanger/,"Febi Rubber Muffler Hanger - E10, E12, E21, E23, E24",381850,18211105677,$1.95,https://www.turnermotorsport.com/c-148-bmw-gaskets-hangers-and-parts?No=350&Nrpp=50#,Locates & insulates the rear muffler
https://www.turnermotorsport.com/p-381849-muffler-suspension-loop-priced-each/,Febi Muffler Suspension Loop - E39,381849,18201433957,$8.95,https://www.turnermotorsport.com/c-148-bmw-gaskets-hangers-and-parts?No=350&Nrpp=50#,Used to isolate the muffler assembly from vibrations
https://www.turnermotorsport.com/p-641384-bmw-exhaust-mounting/,Febi Rear Exhaust Hanger - Priced Each,641384,18207585358,$10.95,https://www.turnermotorsport.com/c-148-bmw-gaskets-hangers-and-parts?No=350&Nrpp=50#,Used to support the rear mufflers
https://www.turnermotorsport.com/p-382861-exhaust-pipe-hanger-priced-each/,"Vaico Exhaust Pipe Hanger - E31, E36",382861,18211723101,$8.95,https://www.turnermotorsport.com/c-148-bmw-gaskets-hangers-and-parts?No=350&Nrpp=50#,Rear muffler hanger
https://www.turnermotorsport.com/p-591020-copper-lock-nut-price-each/,Vaico Copper Lock Nut (8 mm) - Exhaust - E10 E12 E21 E23 E24 E28 E3 ...,591020,18307620549,$3.95,https://www.turnermotorsport.com/c-148-bmw-gaskets-hangers-and-parts?No=350&Nrpp=50#,
https://www.turnermotorsport.com/p-578800-muffler-strap/,Fischer and Plath Rear Muffler Strap - E21,578800,104.002,$8.95,https://www.turnermotorsport.com/c-148-bmw-gaskets-hangers-and-parts?No=350&Nrpp=50#,"Encircles the muffler, allows for support with rubber ring"
https://www.turnermotorsport.com/p-25765-e36-rear-muffler-clamp-kit/,E36 Rear Muffler Clamp Kit,25765,18211723410K,$9.95,https://www.turnermotorsport.com/c-148-bmw-gaskets-hangers-and-parts?No=350&Nrpp=50#,"This set of upper and lower clamps is the perfect addition to our Hanger Kit, especially if you're going back to a stock muffler from aftermarket and no longer have these required clamps. The stock mufflers (standard E36 or M3) use this clamp method around a lip on the muffler body. But most aftermarket muffler systems don't use the clamp and bolt straight to the rubber hanger. So these stock pieces are often thrown away which will make it impossible to re-install the stock muffler. These are the OEM muffler clamps."
https://www.turnermotorsport.com/p-428-e36-exhaust-hanger-and-gasket-kit/,E36 Exhaust Hanger and Gasket Kit,428,E36HANGERKIT,$87.74,https://www.turnermotorsport.com/c-148-bmw-gaskets-hangers-and-parts?No=350&Nrpp=50#,"The E36 Exhaust Hanger and Gasket Kit includes two rear muffler hangers, two catalytic converter hangers, both gasket rings and all necessary hardware."
https://www.turnermotorsport.com/p-596792-muffler-bracket-priced-each/,Muffler Bracket - Priced Each,596792,18211178340,$6.52,https://www.turnermotorsport.com/c-148-bmw-gaskets-hangers-and-parts?No=350&Nrpp=50#,Rear muffler bracket that provides support for the rear muffler. Priced each.
https://www.turnermotorsport.com/p-363090-exhaust-gasket-ring-left-pipe/,Eberspaecher Exhaust Gasket Ring - Left Pipe - E36,363090,18111719446,$2.26,https://www.turnermotorsport.com/c-148-bmw-gaskets-hangers-and-parts?No=350&Nrpp=50#,Gasket Ring for the left exhaust pipe
https://www.turnermotorsport.com/p-48302-18307536425-genuine-bmw-part/,"Rein 63.5mm ID Exhaust Clamp  - E39, E65, E66",48302,18307536425,$19.01,https://www.turnermotorsport.com/c-148-bmw-gaskets-hangers-and-parts?No=350&Nrpp=50#,"BMW Clamping Bush - D=63,5    E39 M5,E39,E65,E90,E92,E93     M62,N51,N51,N52,N52N,N54,N73,S62,W11"
https://www.turnermotorsport.com/p-594953-downpipe-gasket-priced-each/,Downpipe Gasket - Priced Each,594953,18111728364,$9.22,https://www.turnermotorsport.com/c-148-bmw-gaskets-hangers-and-parts?No=350&Nrpp=50#,Downpipe gasket between exhaust manifold and downpipe. This is the exhaust gasket from the manifold to the header pipe.
https://www.turnermotorsport.com/p-36790-11621723833-genuine-bmw-part/,Genuine BMW Exhaust manifold gasket - E30 318i M10 1.8L,36790,11621723833,$36.03,https://www.turnermotorsport.com/c-148-bmw-gaskets-hangers-and-parts?No=350&Nrpp=50#,"Genuine BMW Gasket W/Heat Prot.Shield Asbestosfree -      E30     M10,N51"
https://www.turnermotorsport.com/p-591049-exhaust-hanger/,MTC Exhaust Hanger - E34 525i,591049,18211728332,$1.53,https://www.turnermotorsport.com/c-148-bmw-gaskets-hangers-and-parts?No=350&Nrpp=50#,"Genuine BMW Rubber Ring -     E34     M20,M50"
https://www.turnermotorsport.com/p-48445-18307589503-genuine-bmw-part/,Genuine MINI Exhaust Gasket,48445,18307589503,$26.87,https://www.turnermotorsport.com/c-148-bmw-gaskets-hangers-and-parts?No=350&Nrpp=50#,"Genuine MINI GASKET    N14,N18"
https://www.turnermotorsport.com/p-25143-18302756352-genuine-bmw-part/,Genuine MINI Exhaust Clamp,25143,18302756352,$35.13,https://www.turnermotorsport.com/c-148-bmw-gaskets-hangers-and-parts?No=350&Nrpp=50#,"Genuine MINI CLAMP    N14,N18"
https://www.turnermotorsport.com/p-48227-18302756351-genuine-bmw-part/,Genuine MINI Exhaust Clamp,48227,18302756351,$35.13,https://www.turnermotorsport.com/c-148-bmw-gaskets-hangers-and-parts?No=350&Nrpp=50#,"Genuine MINI CLAMP    N12,N16"
https://www.turnermotorsport.com/p-22570-18111170941-genuine-bmw-part/,Genuine MINI Gasket For Exhaust Pipe,22570,18111170941,$26.87,https://www.turnermotorsport.com/c-148-bmw-gaskets-hangers-and-parts?No=350&Nrpp=50#,"Genuine MINI GASKET.--     MINI Cooper - Mini Cooper, Mini Cooper Convt, Mini Cooper S, Mini Cooper S Convt   --.   W10,W11"
https://www.turnermotorsport.com/p-551767-decoupling-element/,Genuine MINI Decoupling Element - Flex Pipe Fix,551767,18302455550,$154.96,https://www.turnermotorsport.com/c-148-bmw-gaskets-hangers-and-parts?No=350&Nrpp=50#,
https://www.turnermotorsport.com/p-36844-11627626106-genuine-bmw-part/,Genuine MINI Exhaust Manifold Gasket W/ Heat Sheild,36844,11627626106,$63.36,https://www.turnermotorsport.com/c-148-bmw-gaskets-hangers-and-parts?No=350&Nrpp=50#,"Genuine MINI GASKET W/HEAT PROT.SHIELD AS    N14,N18"
https://www.turnermotorsport.com/p-47676-18201493797-genuine-bmw-part/,Genuine MINI Supporting Bracket - Right,47676,18201493797,$45.52,https://www.turnermotorsport.com/c-148-bmw-gaskets-hangers-and-parts?No=400&Nrpp=50#,Genuine MINI SUPPORTING BRACKET RIGHT    W11
https://www.turnermotorsport.com/p-22611-18207521427-genuine-bmw-part/,Genuine MINI Exhaust Hanger,22611,18207521427,$33.59,https://www.turnermotorsport.com/c-148-bmw-gaskets-hangers-and-parts?No=400&Nrpp=50#,"Genuine MINI RUBBER MOUNTING.--     MINI Cooper - Mini Cooper, Mini Cooper Convt, Mini Cooper S, Mini Cooper S Convt   --.   N51,W10,W11"
https://www.turnermotorsport.com/p-637281-exhaust-gasket/,Exhaust Gasket,637281,18307574127,$6.36,https://www.turnermotorsport.com/c-148-bmw-gaskets-hangers-and-parts?No=400&Nrpp=50#,
https://www.turnermotorsport.com/p-522741-repair-kit-for-socket-housing/,Genuine MINI Repair kit for Socket Housing,522741,61132359998,$16.72,https://www.turnermotorsport.com/c-148-bmw-gaskets-hangers-and-parts?No=400&Nrpp=50#,
https://www.turnermotorsport.com/p-22636-18307574127-genuine-bmw-part/,Genuine MINI Exhaust Gasket,22636,18307574127,$26.87,https://www.turnermotorsport.com/c-148-bmw-gaskets-hangers-and-parts?No=400&Nrpp=50#,Genuine MINI GASKET    N14
https://www.turnermotorsport.com/p-637699-decoupling-element-and-v-clamp-kit-flex-pipe-fix-cooper/,"Decoupling Element And V Clamp Kit - Flex Pipe Fix - Cooper
       ...",637699,18302455550KT,$175.29,https://www.turnermotorsport.com/c-148-bmw-gaskets-hangers-and-parts?No=400&Nrpp=50#,
https://www.turnermotorsport.com/p-590496-exhaust-gasket/,Exhaust Gasket,590496,18307589503,$8.34,https://www.turnermotorsport.com/c-148-bmw-gaskets-hangers-and-parts?No=400&Nrpp=50#,
https://www.turnermotorsport.com/p-590497-exhaust-gasket/,Exhaust Gasket,590497,18307589503,$6.45,https://www.turnermotorsport.com/c-148-bmw-gaskets-hangers-and-parts?No=400&Nrpp=50#,
https://www.turnermotorsport.com/p-637280-exhaust-gasket/,Exhaust Gasket,637280,18307574127,$6.94,https://www.turnermotorsport.com/c-148-bmw-gaskets-hangers-and-parts?No=400&Nrpp=50#,
https://www.turnermotorsport.com/p-525057-exhaust-hanger-priced-each/,Genuine MINI Exhaust Hanger,525057,18208570671,$25.84,https://www.turnermotorsport.com/c-148-bmw-gaskets-hangers-and-parts?No=400&Nrpp=50#,
https://www.turnermotorsport.com/p-520362-exhaust-clamp/,Genuine MINI Exhaust Clamp - F56 F55,520362,18307606136,$40.09,https://www.turnermotorsport.com/c-148-bmw-gaskets-hangers-and-parts?No=400&Nrpp=50#,
https://www.turnermotorsport.com/p-48478-18307595606-genuine-bmw-part/,Genuine MINI Heat Resistant Plate,48478,18307595606,$43.08,https://www.turnermotorsport.com/c-148-bmw-gaskets-hangers-and-parts?No=400&Nrpp=50#,"Genuine MINI HEAT RESISTANT PLATE    N14,N18"
https://www.turnermotorsport.com/p-47366-18107573865-genuine-bmw-part/,Genuine MINI JCW Muffler Clamp,47366,18107573865,$40.43,https://www.turnermotorsport.com/c-148-bmw-gaskets-hangers-and-parts?No=400&Nrpp=50#,Genuine MINI MUFFLER CLAMP    W11
https://www.turnermotorsport.com/p-411628-exhaust-hanger-priced-each/,Genuine MINI Exhaust Hanger,411628,18302753085,$26.14,https://www.turnermotorsport.com/c-148-bmw-gaskets-hangers-and-parts?No=400&Nrpp=50#,
