web-scraper-order,web-scraper-start-url,name
"1631893452-4583","https://www.williams-sonoma.com/shop/homekeeping/all-kitchen-linens/?cm_type=lnav","'Twas the Night Apron"
"1631893452-4558","https://www.williams-sonoma.com/shop/homekeeping/all-kitchen-linens/?cm_type=lnav","Star Wars™ Adult & Kid Aprons"
"1631893452-4548","https://www.williams-sonoma.com/shop/homekeeping/all-kitchen-linens/?cm_type=lnav","Autumn Plymouth Turkey Oven Mitt & Potholder Set"
"1631893452-4534","https://www.williams-sonoma.com/shop/homekeeping/all-kitchen-linens/?cm_type=lnav","Heirloom Pumpkin Apron"
"1631893452-4595","https://www.williams-sonoma.com/shop/homekeeping/all-kitchen-linens/?cm_type=lnav","Boska Apron"
"1631893452-4551","https://www.williams-sonoma.com/shop/homekeeping/all-kitchen-linens/?cm_type=lnav","Open Kitchen by Williams Sonoma Potholder, Set of 2"
"1631893452-4596","https://www.williams-sonoma.com/shop/homekeeping/all-kitchen-linens/?cm_type=lnav","Dolly Parton Metallic Oven Mitt & Potholder Set"
"1631893452-4555","https://www.williams-sonoma.com/shop/homekeeping/all-kitchen-linens/?cm_type=lnav","Open Kitchen by Williams Sonoma Oven Mitts, Set of 2"
"1631893452-4494","https://www.williams-sonoma.com/shop/homekeeping/all-kitchen-linens/?cm_type=lnav","Williams Sonoma Super Absorbent Waffle Weave Multi-Pack Towels, Set of 4"
"1631893452-4542","https://www.williams-sonoma.com/shop/homekeeping/all-kitchen-linens/?cm_type=lnav","Williams Sonoma Autumn Stripe Kitchen Linens Essential Bundle"
"1631893452-4529","https://www.williams-sonoma.com/shop/homekeeping/all-kitchen-linens/?cm_type=lnav","Heirloom Pumpkin Oven Mitt & Potholder Set"
"1631893452-4503","https://www.williams-sonoma.com/shop/homekeeping/all-kitchen-linens/?cm_type=lnav","Williams Sonoma Absorbent Logo Towels, Set of 4"
"1631893452-4538","https://www.williams-sonoma.com/shop/homekeeping/all-kitchen-linens/?cm_type=lnav","Autumn Plymouth Turkey Towels, Set of 2"
"1631893452-4550","https://www.williams-sonoma.com/shop/homekeeping/all-kitchen-linens/?cm_type=lnav","Meyer Lemon Towels, Set of 2"
"1631893452-4575","https://www.williams-sonoma.com/shop/homekeeping/all-kitchen-linens/?cm_type=lnav","Unicorn Kids Apron"
"1631893452-4620","https://www.williams-sonoma.com/shop/homekeeping/all-kitchen-linens/?cm_type=lnav","Skellie Toile Tea Towel, Set of 2"
"1631893452-4605","https://www.williams-sonoma.com/shop/homekeeping/all-kitchen-linens/?cm_type=lnav","Natale Penguin Towels, Set of 2"
"1631893452-4513","https://www.williams-sonoma.com/shop/homekeeping/all-kitchen-linens/?cm_type=lnav","Open Kitchen by Williams Sonoma Oven Mitt & Potholder Set, Set of 2"
"1631893452-4613","https://www.williams-sonoma.com/shop/homekeeping/all-kitchen-linens/?cm_type=lnav","Snowman Kitchen Linens Bundle"
"1631893452-4496","https://www.williams-sonoma.com/shop/homekeeping/all-kitchen-linens/?cm_type=lnav","Williams Sonoma Classic Stripe Potholder"
"1631893452-4532","https://www.williams-sonoma.com/shop/homekeeping/all-kitchen-linens/?cm_type=lnav","Williams Sonoma Autumn Stripe Oven Mitt & Potholder Set"
"1631893452-4598","https://www.williams-sonoma.com/shop/homekeeping/all-kitchen-linens/?cm_type=lnav","Maritime Lobster Kitchen Linens Bundle"
"1631893452-4495","https://www.williams-sonoma.com/shop/homekeeping/all-kitchen-linens/?cm_type=lnav","Williams Sonoma Super Absorbent Multi-Pack Dishcloths"
"1631893452-4492","https://www.williams-sonoma.com/shop/homekeeping/all-kitchen-linens/?cm_type=lnav","Williams Sonoma Super Absorbent Waffle Weave Towels, Set of 4"
"1631893452-4565","https://www.williams-sonoma.com/shop/homekeeping/all-kitchen-linens/?cm_type=lnav","Canvas Apron"
"1631893452-4483","https://www.williams-sonoma.com/shop/homekeeping/all-kitchen-linens/?cm_type=lnav","Williams Sonoma Classic Solid Adult & Kid Aprons"
"1631893452-4489","https://www.williams-sonoma.com/shop/homekeeping/all-kitchen-linens/?cm_type=lnav","Williams Sonoma Multi-Pack Towels"
"1631893452-4602","https://www.williams-sonoma.com/shop/homekeeping/all-kitchen-linens/?cm_type=lnav","Embroidered Skier Guest Towel, Set of 2"
"1631893452-4504","https://www.williams-sonoma.com/shop/homekeeping/all-kitchen-linens/?cm_type=lnav","Williams Sonoma Ultimate Potholder"
"1631893452-4609","https://www.williams-sonoma.com/shop/homekeeping/all-kitchen-linens/?cm_type=lnav","Sentiment Holiday Towels, Set of 2"
"1631893452-4520","https://www.williams-sonoma.com/shop/homekeeping/all-kitchen-linens/?cm_type=lnav","Striped Flour Sack Towel, Set of 4"
"1631893452-4502","https://www.williams-sonoma.com/shop/homekeeping/all-kitchen-linens/?cm_type=lnav","Williams Sonoma Ultimate Oven Mitt, Potholder & Handle Holder Set"
"1631893452-4608","https://www.williams-sonoma.com/shop/homekeeping/all-kitchen-linens/?cm_type=lnav","Natale Reindeer Towels, Set of 2"
"1631893452-4592","https://www.williams-sonoma.com/shop/homekeeping/all-kitchen-linens/?cm_type=lnav","Grilling Kitchen Linen Bundles"
"1631893452-4481","https://www.williams-sonoma.com/shop/homekeeping/all-kitchen-linens/?cm_type=lnav","Williams Sonoma Classic Stripe Towels, Set of 4"
"1631893452-4488","https://www.williams-sonoma.com/shop/homekeeping/all-kitchen-linens/?cm_type=lnav","Williams Sonoma Classic Logo Towels, Set of 4"
"1631893452-4567","https://www.williams-sonoma.com/shop/homekeeping/all-kitchen-linens/?cm_type=lnav","Heart Adult & Kid Aprons"
"1631893452-4535","https://www.williams-sonoma.com/shop/homekeeping/all-kitchen-linens/?cm_type=lnav","Heirloom Pumpkin Kitchen Linens Bundle"
"1631893452-4584","https://www.williams-sonoma.com/shop/homekeeping/all-kitchen-linens/?cm_type=lnav","The Grinch™ Adult & Kid Aprons"
"1631893452-4547","https://www.williams-sonoma.com/shop/homekeeping/all-kitchen-linens/?cm_type=lnav","Monogram Towels, Set of 2"
"1631893452-4561","https://www.williams-sonoma.com/shop/homekeeping/all-kitchen-linens/?cm_type=lnav","Crossback Chambray Apron"
"1631893452-4566","https://www.williams-sonoma.com/shop/homekeeping/all-kitchen-linens/?cm_type=lnav","Microplane® Cut Resistant Glove"
"1631893452-4570","https://www.williams-sonoma.com/shop/homekeeping/all-kitchen-linens/?cm_type=lnav","Flour Sack Towels, Cheese, Set of 2"
"1631893452-4493","https://www.williams-sonoma.com/shop/homekeeping/all-kitchen-linens/?cm_type=lnav","Bar Mop Towels & Dishcloths, Set of 4"
"1631893452-4511","https://www.williams-sonoma.com/shop/homekeeping/all-kitchen-linens/?cm_type=lnav","Williams Sonoma Mini Oven Mitt"
"1631893452-4531","https://www.williams-sonoma.com/shop/homekeeping/all-kitchen-linens/?cm_type=lnav","Harvest Bloom Kitchen Linens Bundle"
"1631893452-4557","https://www.williams-sonoma.com/shop/homekeeping/all-kitchen-linens/?cm_type=lnav","Flour Sack Towels, Set of 4"
"1631893452-4560","https://www.williams-sonoma.com/shop/homekeeping/all-kitchen-linens/?cm_type=lnav","No Kid Hungry® Towels, Set of 2, Gaby Dalkin"
"1631893452-4607","https://www.williams-sonoma.com/shop/homekeeping/all-kitchen-linens/?cm_type=lnav","Woodland Berry Kitchen Linens Bundle"
"1631893452-4514","https://www.williams-sonoma.com/shop/homekeeping/all-kitchen-linens/?cm_type=lnav","Owl Towels, Set of 2"
"1631893452-4482","https://www.williams-sonoma.com/shop/homekeeping/all-kitchen-linens/?cm_type=lnav","Williams Sonoma Classic Stripe Dishcloths"
"1631893452-4616","https://www.williams-sonoma.com/shop/homekeeping/all-kitchen-linens/?cm_type=lnav","HARRY POTTER™ Adult & Kid Aprons"
"1631893452-4599","https://www.williams-sonoma.com/shop/homekeeping/all-kitchen-linens/?cm_type=lnav","Maritime Lobster Kitchen Linen Essentials Bundle"
"1631893452-4519","https://www.williams-sonoma.com/shop/homekeeping/all-kitchen-linens/?cm_type=lnav","Heirloom Linen Towels, Set of 2"
"1631893452-4563","https://www.williams-sonoma.com/shop/homekeeping/all-kitchen-linens/?cm_type=lnav","Meyer Lemon Oven Mitt & Potholder Set"
"1631893452-4623","https://www.williams-sonoma.com/shop/homekeeping/all-kitchen-linens/?cm_type=lnav","Williams Sonoma Potholder"
"1631893452-4571","https://www.williams-sonoma.com/shop/homekeeping/all-kitchen-linens/?cm_type=lnav","HARRY POTTER™ Hogwarts™ Adult Apron"
"1631893452-4543","https://www.williams-sonoma.com/shop/homekeeping/all-kitchen-linens/?cm_type=lnav","Autumn Plymouth Turkey Kitchen Linens Bundle"
"1631893452-4521","https://www.williams-sonoma.com/shop/homekeeping/all-kitchen-linens/?cm_type=lnav","fnnch Honey Bear Towels, Set of 2"
"1631893452-4579","https://www.williams-sonoma.com/shop/homekeeping/all-kitchen-linens/?cm_type=lnav","The Grinch's™ Cindy Lou Who Kids Apron"
"1631893452-4572","https://www.williams-sonoma.com/shop/homekeeping/all-kitchen-linens/?cm_type=lnav","Flour Shop Towels, Set of 2"
"1631893452-4553","https://www.williams-sonoma.com/shop/homekeeping/all-kitchen-linens/?cm_type=lnav","Honeycomb Towels, Set of 2"
"1631893452-4601","https://www.williams-sonoma.com/shop/homekeeping/all-kitchen-linens/?cm_type=lnav","'Twas the Night Before Christmas Snowman Jacquard Towels, Set of 2"
"1631893452-4591","https://www.williams-sonoma.com/shop/homekeeping/all-kitchen-linens/?cm_type=lnav","Snowman Towels, Set of 2"
"1631893452-4573","https://www.williams-sonoma.com/shop/homekeeping/all-kitchen-linens/?cm_type=lnav","Oil & Vinegar Jacquard Towels, Set of 2"
"1631893452-4541","https://www.williams-sonoma.com/shop/homekeeping/all-kitchen-linens/?cm_type=lnav","Williams Sonoma Ultimate Kitchen Linens Bundle"
"1631893452-4577","https://www.williams-sonoma.com/shop/homekeeping/all-kitchen-linens/?cm_type=lnav","Disney Mickey Mouse and Minnie Mouse™ Holiday Towels, Set of 2"
"1631893452-4582","https://www.williams-sonoma.com/shop/homekeeping/all-kitchen-linens/?cm_type=lnav","Disney Minnie™ Adult Apron & Oven Mitt Set"
"1631893452-4507","https://www.williams-sonoma.com/shop/homekeeping/all-kitchen-linens/?cm_type=lnav","Harvest Bloom Towels, Set of 2"
"1631893452-4552","https://www.williams-sonoma.com/shop/homekeeping/all-kitchen-linens/?cm_type=lnav","Open Kitchen by Williams Sonoma Towels, Set of 4"
"1631893452-4600","https://www.williams-sonoma.com/shop/homekeeping/all-kitchen-linens/?cm_type=lnav","Twas the Night Before Christmas Kitchen Linen Essentials Bundle"
"1631893452-4515","https://www.williams-sonoma.com/shop/homekeeping/all-kitchen-linens/?cm_type=lnav","Glow-in-the-Dark Skeleton Adult Apron"
"1631893452-4518","https://www.williams-sonoma.com/shop/homekeeping/all-kitchen-linens/?cm_type=lnav","Williams Sonoma Super-Absorbent Autumn Multi-Pack Towels, Set of 4"
"1631893452-4578","https://www.williams-sonoma.com/shop/homekeeping/all-kitchen-linens/?cm_type=lnav","Classic Tartan Oven Mitt & Potholder Set"
"1631893452-4604","https://www.williams-sonoma.com/shop/homekeeping/all-kitchen-linens/?cm_type=lnav","Holiday Stripe Kitchen Linens Bundle"
"1631893452-4569","https://www.williams-sonoma.com/shop/homekeeping/all-kitchen-linens/?cm_type=lnav","Pinstripe Apron"
"1631893452-4528","https://www.williams-sonoma.com/shop/homekeeping/all-kitchen-linens/?cm_type=lnav","Williams Sonoma Autumn Stripe Apron"
"1631893452-4556","https://www.williams-sonoma.com/shop/homekeeping/all-kitchen-linens/?cm_type=lnav","Autumnal Jacquard Towels, Set of 2"
"1631893452-4622","https://www.williams-sonoma.com/shop/homekeeping/all-kitchen-linens/?cm_type=lnav","Williams Sonoma Super Absorbent Waffle Weave Multi-Pack Towels, Set of 4"
"1631893452-4574","https://www.williams-sonoma.com/shop/homekeeping/all-kitchen-linens/?cm_type=lnav","Windowpane Plaid Flour Sack Towel"
"1631893452-4506","https://www.williams-sonoma.com/shop/homekeeping/all-kitchen-linens/?cm_type=lnav","Williams Sonoma Ultimate Patterned Oven Mitt"
"1631893452-4559","https://www.williams-sonoma.com/shop/homekeeping/all-kitchen-linens/?cm_type=lnav","No Kid Hungry® Towels, Set of 2, Tiny Chef"
"1631893452-4530","https://www.williams-sonoma.com/shop/homekeeping/all-kitchen-linens/?cm_type=lnav","Harvest Bloom Oven Mitt & Potholder Set"
"1631893452-4581","https://www.williams-sonoma.com/shop/homekeeping/all-kitchen-linens/?cm_type=lnav","Classic Tartan Towels, Set of 2"
"1631893452-4590","https://www.williams-sonoma.com/shop/homekeeping/all-kitchen-linens/?cm_type=lnav","The Grinch™ Adult Apron and Towels Bundle"
"1631893452-4536","https://www.williams-sonoma.com/shop/homekeeping/all-kitchen-linens/?cm_type=lnav","Williams Sonoma Super Absorbent Multi Pack Towels, Holiday Set of 4"
"1631893452-4619","https://www.williams-sonoma.com/shop/homekeeping/all-kitchen-linens/?cm_type=lnav","Junior Chef Jacket"
"1631893452-4540","https://www.williams-sonoma.com/shop/homekeeping/all-kitchen-linens/?cm_type=lnav","Honeycomb Kitchen Linen Essentials Bundle"
"1631893452-4611","https://www.williams-sonoma.com/shop/homekeeping/all-kitchen-linens/?cm_type=lnav","St. Jude Holiday Towels, Set of 2"
"1631893452-4594","https://www.williams-sonoma.com/shop/homekeeping/all-kitchen-linens/?cm_type=lnav","Holiday Stripe Adult Apron"
"1631893452-4517","https://www.williams-sonoma.com/shop/homekeeping/all-kitchen-linens/?cm_type=lnav","Flour Sack Towels, Bread, Set of 2"
"1631893452-4612","https://www.williams-sonoma.com/shop/homekeeping/all-kitchen-linens/?cm_type=lnav","Wine Country Harvest Jacquard Towels"
"1631893452-4576","https://www.williams-sonoma.com/shop/homekeeping/all-kitchen-linens/?cm_type=lnav","Holiday Stripe Kitchen Towels, Set of 2"
"1631893452-4546","https://www.williams-sonoma.com/shop/homekeeping/all-kitchen-linens/?cm_type=lnav","Honeycomb Kitchen Linens Bundle"
"1631893452-4587","https://www.williams-sonoma.com/shop/homekeeping/all-kitchen-linens/?cm_type=lnav","Disney Mickey™ Adult Apron & Oven Mitt Set"
"1631893452-4580","https://www.williams-sonoma.com/shop/homekeeping/all-kitchen-linens/?cm_type=lnav","Apres Ski Embroidered Towels, Set of 2"
"1631893452-4499","https://www.williams-sonoma.com/shop/homekeeping/all-kitchen-linens/?cm_type=lnav","Open Kitchen by Williams Sonoma Aprons"
"1631893452-4539","https://www.williams-sonoma.com/shop/homekeeping/all-kitchen-linens/?cm_type=lnav","Plymouth Cornucopia Towels, Set of 2"
"1631893452-4624","https://www.williams-sonoma.com/shop/homekeeping/all-kitchen-linens/?cm_type=lnav","Williams Sonoma Oven Mitt"
"1631893452-4508","https://www.williams-sonoma.com/shop/homekeeping/all-kitchen-linens/?cm_type=lnav","Heirloom Pumpkin Towels, Set of 2"
"1631893452-4533","https://www.williams-sonoma.com/shop/homekeeping/all-kitchen-linens/?cm_type=lnav","Gingham Towels, Set of 4"
"1631893452-4549","https://www.williams-sonoma.com/shop/homekeeping/all-kitchen-linens/?cm_type=lnav","Oversized Waffle Weave Towels"
"1631893452-4544","https://www.williams-sonoma.com/shop/homekeeping/all-kitchen-linens/?cm_type=lnav","Sicily Kitchen Linen Essentials Bundle"
"1631893452-4527","https://www.williams-sonoma.com/shop/homekeeping/all-kitchen-linens/?cm_type=lnav","Williams Sonoma Classic Autumn Stripe Dishcloths"
"1631893452-4568","https://www.williams-sonoma.com/shop/homekeeping/all-kitchen-linens/?cm_type=lnav","T-Rex Kids Apron"
"1631893452-4526","https://www.williams-sonoma.com/shop/homekeeping/all-kitchen-linens/?cm_type=lnav","Skeleton Oven Mitt"
"1631893452-4614","https://www.williams-sonoma.com/shop/homekeeping/all-kitchen-linens/?cm_type=lnav","Measurement Towel"
"1631893452-4615","https://www.williams-sonoma.com/shop/homekeeping/all-kitchen-linens/?cm_type=lnav","Unpaper Towels, Set of 10"
"1631893452-4562","https://www.williams-sonoma.com/shop/homekeeping/all-kitchen-linens/?cm_type=lnav","Meyer Lemon Apron"
"1631893452-4589","https://www.williams-sonoma.com/shop/homekeeping/all-kitchen-linens/?cm_type=lnav","Woodland Berry Oven Mitt & Potholder Set"
"1631893452-4537","https://www.williams-sonoma.com/shop/homekeeping/all-kitchen-linens/?cm_type=lnav","Autumn Plymouth Dog Towel, Set of 2"
"1631893452-4505","https://www.williams-sonoma.com/shop/homekeeping/all-kitchen-linens/?cm_type=lnav","Williams Sonoma Ultimate Mini Potholder"
"1631893452-4586","https://www.williams-sonoma.com/shop/homekeeping/all-kitchen-linens/?cm_type=lnav","Santa Oven Mitt"
"1631893452-4484","https://www.williams-sonoma.com/shop/homekeeping/all-kitchen-linens/?cm_type=lnav","Williams Sonoma Oven Mitt"
"1631893452-4603","https://www.williams-sonoma.com/shop/homekeeping/all-kitchen-linens/?cm_type=lnav","'Twas the Night Before Christmas Oven Mitt & Potholder Set"
"1631893452-4585","https://www.williams-sonoma.com/shop/homekeeping/all-kitchen-linens/?cm_type=lnav","Dolly Parton Metallic Adult & Kid Aprons"
"1631893452-4610","https://www.williams-sonoma.com/shop/homekeeping/all-kitchen-linens/?cm_type=lnav","Snowman Oven Mitt & Potholder Set"
"1631893452-4487","https://www.williams-sonoma.com/shop/homekeeping/all-kitchen-linens/?cm_type=lnav","Williams Sonoma Classic Stripe Aprons"
"1631893452-4509","https://www.williams-sonoma.com/shop/homekeeping/all-kitchen-linens/?cm_type=lnav","Honeycomb Oven Mitt & Potholder Set"
"1631893452-4501","https://www.williams-sonoma.com/shop/homekeeping/all-kitchen-linens/?cm_type=lnav","Williams Sonoma Kitchen Linens Essential Bundle"
"1631893452-4486","https://www.williams-sonoma.com/shop/homekeeping/all-kitchen-linens/?cm_type=lnav","Williams Sonoma Super-Absorbent Multi-Pack Towels, Set of 4"
"1631893452-4500","https://www.williams-sonoma.com/shop/homekeeping/all-kitchen-linens/?cm_type=lnav","Williams Sonoma Bay Stripe Adult & Kid Aprons"
"1631893452-4498","https://www.williams-sonoma.com/shop/homekeeping/all-kitchen-linens/?cm_type=lnav","Williams Sonoma Ultimate Oven Mitt"
"1631893452-4523","https://www.williams-sonoma.com/shop/homekeeping/all-kitchen-linens/?cm_type=lnav","Tencel Blend Towels, Set of 4"
"1631893452-4510","https://www.williams-sonoma.com/shop/homekeeping/all-kitchen-linens/?cm_type=lnav","Williams Sonoma Autumn Super Absorbent Waffle Weave Multi-Pack Towels, Set of 4"
"1631893452-4497","https://www.williams-sonoma.com/shop/homekeeping/all-kitchen-linens/?cm_type=lnav","Williams Sonoma Classic Stripe Oven Mitt"
"1631893452-4491","https://www.williams-sonoma.com/shop/homekeeping/all-kitchen-linens/?cm_type=lnav","Williams Sonoma Bay Stripe Oven Mitt & Potholder Set"
"1631893452-4522","https://www.williams-sonoma.com/shop/homekeeping/all-kitchen-linens/?cm_type=lnav","Day of the Dead Towels, Set of 2"
"1631893452-4490","https://www.williams-sonoma.com/shop/homekeeping/all-kitchen-linens/?cm_type=lnav","All Purpose Pantry Towels, Set of 4"
"1631893452-4545","https://www.williams-sonoma.com/shop/homekeeping/all-kitchen-linens/?cm_type=lnav","Williams Sonoma Autumn Stripe Kitchen Linens Bundle"
"1631893452-4525","https://www.williams-sonoma.com/shop/homekeeping/all-kitchen-linens/?cm_type=lnav","Harvest Bloom Apron"
"1631893452-4588","https://www.williams-sonoma.com/shop/homekeeping/all-kitchen-linens/?cm_type=lnav","Snowman Embroidered Towels, Set of 2"
"1631893452-4618","https://www.williams-sonoma.com/shop/homekeeping/all-kitchen-linens/?cm_type=lnav","Flour Shop Adult Oven Mitt"
"1631893452-4554","https://www.williams-sonoma.com/shop/homekeeping/all-kitchen-linens/?cm_type=lnav","Disney Mickey & Minnie™ Adult & Kid Aprons"
"1631893452-4597","https://www.williams-sonoma.com/shop/homekeeping/all-kitchen-linens/?cm_type=lnav","Holiday Carol Towels, Set of 2"
"1631893452-4621","https://www.williams-sonoma.com/shop/homekeeping/all-kitchen-linens/?cm_type=lnav","All Purpose Pantry Towels, Set of 4"
"1631893452-4512","https://www.williams-sonoma.com/shop/homekeeping/all-kitchen-linens/?cm_type=lnav","Williams Sonoma Ultimate Apron"
"1631893452-4593","https://www.williams-sonoma.com/shop/homekeeping/all-kitchen-linens/?cm_type=lnav","Merry Christmas Jacquard Apron"
"1631893452-4485","https://www.williams-sonoma.com/shop/homekeeping/all-kitchen-linens/?cm_type=lnav","Williams Sonoma Potholder"
"1631893452-4564","https://www.williams-sonoma.com/shop/homekeeping/all-kitchen-linens/?cm_type=lnav","The Grinch™ Towels, Set of 2"
"1631893452-4606","https://www.williams-sonoma.com/shop/homekeeping/all-kitchen-linens/?cm_type=lnav","Santa Adult Apron"
"1631893452-4617","https://www.williams-sonoma.com/shop/homekeeping/all-kitchen-linens/?cm_type=lnav","Star Wars™ Darth Vader & Stormtrooper Adult & Kid Aprons"
"1631893452-4524","https://www.williams-sonoma.com/shop/homekeeping/all-kitchen-linens/?cm_type=lnav","fnnch Honey Bear Apron"
"1631893452-4516","https://www.williams-sonoma.com/shop/homekeeping/all-kitchen-linens/?cm_type=lnav","Williams Sonoma Classic Autumn Stripe Towels, Set of 4"
