web-scraper-order,web-scraper-start-url,name
"1631893452-4173","https://www.williams-sonoma.com/shop/homekeeping/cleaning-view-all/?cm_type=lnav","Rowenta Steamforce Iron DW9280"
"1631893452-4304","https://www.williams-sonoma.com/shop/homekeeping/cleaning-view-all/?cm_type=lnav","Cuisinart PuRXium 4 in 1 Filter Pack for CAP-1000"
"1631893452-4273","https://www.williams-sonoma.com/shop/homekeeping/cleaning-view-all/?cm_type=lnav","simplehuman™ 35-L. Dual Compartment Under Counter Pull-Out Can"
"1631893452-4192","https://www.williams-sonoma.com/shop/homekeeping/cleaning-view-all/?cm_type=lnav","Tosca Dish Drainer Rack, White"
"1631893452-4168","https://www.williams-sonoma.com/shop/homekeeping/cleaning-view-all/?cm_type=lnav","Kuhn Rikon Silicone Sponge"
"1631893452-4231","https://www.williams-sonoma.com/shop/homekeeping/cleaning-view-all/?cm_type=lnav","De'Longhi Dragon Digital Full Room Radiant Heater"
"1631893452-4247","https://www.williams-sonoma.com/shop/homekeeping/cleaning-view-all/?cm_type=lnav","OXO Stainless-Steel Dish Brush"
"1631893452-4232","https://www.williams-sonoma.com/shop/homekeeping/cleaning-view-all/?cm_type=lnav","simplehuman Step Can with Liner Pocket, 45L"
"1631893452-4212","https://www.williams-sonoma.com/shop/homekeeping/cleaning-view-all/?cm_type=lnav","Williams Sonoma Meyer Lemon Hand Sanitizer Wipes"
"1631893452-4295","https://www.williams-sonoma.com/shop/homekeeping/cleaning-view-all/?cm_type=lnav","BONECO F230CC Cool and Clean Fan and Purifier"
"1631893452-4201","https://www.williams-sonoma.com/shop/homekeeping/cleaning-view-all/?cm_type=lnav","Brabantia Bo Touch Bin Hi Dual Compartment"
"1631893452-4202","https://www.williams-sonoma.com/shop/homekeeping/cleaning-view-all/?cm_type=lnav","Brabantia NewIcon Step Can"
"1631893452-4308","https://www.williams-sonoma.com/shop/homekeeping/cleaning-view-all/?cm_type=lnav","Miele Compact C1 Pure Suction Vacuum"
"1631893452-4285","https://www.williams-sonoma.com/shop/homekeeping/cleaning-view-all/?cm_type=lnav","Miele Active HEPA AirClean Filter SFHA30"
"1631893452-4184","https://www.williams-sonoma.com/shop/homekeeping/cleaning-view-all/?cm_type=lnav","Boos Cream & Mystery Board Oil"
"1631893452-4275","https://www.williams-sonoma.com/shop/homekeeping/cleaning-view-all/?cm_type=lnav","Blueair Blue Pure 211+ Auto Air Purifier"
"1631893452-4255","https://www.williams-sonoma.com/shop/homekeeping/cleaning-view-all/?cm_type=lnav","Miele AirClean 3D Efficiency Dustbags, Type FJM"
"1631893452-4176","https://www.williams-sonoma.com/shop/homekeeping/cleaning-view-all/?cm_type=lnav","Breville Claro Swiss Water Filter"
"1631893452-4221","https://www.williams-sonoma.com/shop/homekeeping/cleaning-view-all/?cm_type=lnav","Williams Sonoma White Gardenia Dish Soap Refill, 68 oz."
"1631893452-4190","https://www.williams-sonoma.com/shop/homekeeping/cleaning-view-all/?cm_type=lnav","Williams Sonoma Fleur de Sel Dish Soap Refill, 68oz."
"1631893452-4269","https://www.williams-sonoma.com/shop/homekeeping/cleaning-view-all/?cm_type=lnav","Tower Laundry Basket, Large"
"1631893452-4291","https://www.williams-sonoma.com/shop/homekeeping/cleaning-view-all/?cm_type=lnav","Blueair HealthProtect 7770i Air Purifier with Smart Filter"
"1631893452-4286","https://www.williams-sonoma.com/shop/homekeeping/cleaning-view-all/?cm_type=lnav","Vornado Alchemy Vintage Petite Fan"
"1631893452-4181","https://www.williams-sonoma.com/shop/homekeeping/cleaning-view-all/?cm_type=lnav","Le Creuset Cleaning Brush"
"1631893452-4294","https://www.williams-sonoma.com/shop/homekeeping/cleaning-view-all/?cm_type=lnav","Breville Clean and Green Compostable Juicer Bags"
"1631893452-4187","https://www.williams-sonoma.com/shop/homekeeping/cleaning-view-all/?cm_type=lnav","Rowenta Compact Pro Steam VR8324U1"
"1631893452-4253","https://www.williams-sonoma.com/shop/homekeeping/cleaning-view-all/?cm_type=lnav","Rowenta Steam Iron DW3261"
"1631893452-4195","https://www.williams-sonoma.com/shop/homekeeping/cleaning-view-all/?cm_type=lnav","Williams Sonoma Fleur de Sel Dish Soap"
"1631893452-4314","https://www.williams-sonoma.com/shop/homekeeping/cleaning-view-all/?cm_type=lnav","Williams Sonoma French Lavender Countertop Spray"
"1631893452-4243","https://www.williams-sonoma.com/shop/homekeeping/cleaning-view-all/?cm_type=lnav","Simplehuman Rechargeable Liquid Sensor Pump"
"1631893452-4283","https://www.williams-sonoma.com/shop/homekeeping/cleaning-view-all/?cm_type=lnav","Joseph Joseph Titan Trash"
"1631893452-4257","https://www.williams-sonoma.com/shop/homekeeping/cleaning-view-all/?cm_type=lnav","Tower Wire Dish Drainer, White"
"1631893452-4319","https://www.williams-sonoma.com/shop/homekeeping/cleaning-view-all/?cm_type=lnav","Rowenta Perfect Steam Pro DG8624U1"
"1631893452-4191","https://www.williams-sonoma.com/shop/homekeeping/cleaning-view-all/?cm_type=lnav","Miele Fashion Master 3847"
"1631893452-4209","https://www.williams-sonoma.com/shop/homekeeping/cleaning-view-all/?cm_type=lnav","Williams Sonoma Fleur De Sel Cleaning Set"
"1631893452-4169","https://www.williams-sonoma.com/shop/homekeeping/cleaning-view-all/?cm_type=lnav","Williams Sonoma Lavender Cedarwood Dish Soap"
"1631893452-4261","https://www.williams-sonoma.com/shop/homekeeping/cleaning-view-all/?cm_type=lnav","Hestan Professional Stainless-Steel Cleaner"
"1631893452-4194","https://www.williams-sonoma.com/shop/homekeeping/cleaning-view-all/?cm_type=lnav","Rowenta Pro Compact Ironing Board"
"1631893452-4227","https://www.williams-sonoma.com/shop/homekeeping/cleaning-view-all/?cm_type=lnav","Miele Compact C1 Turbo Team Vacuum"
"1631893452-4162","https://www.williams-sonoma.com/shop/homekeeping/cleaning-view-all/?cm_type=lnav","Williams Sonoma Lemongrass Ginger Dish Soap Refill, 68oz."
"1631893452-4303","https://www.williams-sonoma.com/shop/homekeeping/cleaning-view-all/?cm_type=lnav","BONECO F220CC Cool and Clean Fan and Purifier"
"1631893452-4217","https://www.williams-sonoma.com/shop/homekeeping/cleaning-view-all/?cm_type=lnav","Pop-Up Sponges"
"1631893452-4289","https://www.williams-sonoma.com/shop/homekeeping/cleaning-view-all/?cm_type=lnav","Vornado Alchemy Vintage Fan"
"1631893452-4248","https://www.williams-sonoma.com/shop/homekeeping/cleaning-view-all/?cm_type=lnav","Williams Sonoma Winter Berry Dish Soap"
"1631893452-4188","https://www.williams-sonoma.com/shop/homekeeping/cleaning-view-all/?cm_type=lnav","Williams Sonoma Meyer Lemon Dish Soap"
"1631893452-4171","https://www.williams-sonoma.com/shop/homekeeping/cleaning-view-all/?cm_type=lnav","Hexa Sink Mat"
"1631893452-4292","https://www.williams-sonoma.com/shop/homekeeping/cleaning-view-all/?cm_type=lnav","BONECO H300 Hybrid Humidifier Air Purifier"
"1631893452-4254","https://www.williams-sonoma.com/shop/homekeeping/cleaning-view-all/?cm_type=lnav","Rowenta Xcel Steam Minute DR7071"
"1631893452-4251","https://www.williams-sonoma.com/shop/homekeeping/cleaning-view-all/?cm_type=lnav","Williams Sonoma Fleur de Sel Kitchen Essentials Kit"
"1631893452-4180","https://www.williams-sonoma.com/shop/homekeeping/cleaning-view-all/?cm_type=lnav","Miele Rotary Iron"
"1631893452-4165","https://www.williams-sonoma.com/shop/homekeeping/cleaning-view-all/?cm_type=lnav","Williams Sonoma Pink Grapefruit Dish Soap Refill, 68oz."
"1631893452-4196","https://www.williams-sonoma.com/shop/homekeeping/cleaning-view-all/?cm_type=lnav","Williams Sonoma Spiced Chestnut Dish Soap"
"1631893452-4237","https://www.williams-sonoma.com/shop/homekeeping/cleaning-view-all/?cm_type=lnav","Williams Sonoma Lavender Cedarwood Cleaning Wipes"
"1631893452-4223","https://www.williams-sonoma.com/shop/homekeeping/cleaning-view-all/?cm_type=lnav","Williams Sonoma Sunny Orange Citrus Dish Soap"
"1631893452-4229","https://www.williams-sonoma.com/shop/homekeeping/cleaning-view-all/?cm_type=lnav","Ceramic Two-Bottle Caddy, White and Gold Porcelain"
"1631893452-4313","https://www.williams-sonoma.com/shop/homekeeping/cleaning-view-all/?cm_type=lnav","Williams Sonoma French Lavender All-Purpose Cleaner"
"1631893452-4214","https://www.williams-sonoma.com/shop/homekeeping/cleaning-view-all/?cm_type=lnav","Williams Sonoma Meyer Lemon Countertop Spray"
"1631893452-4263","https://www.williams-sonoma.com/shop/homekeeping/cleaning-view-all/?cm_type=lnav","Williams Sonoma Fabric Softener, Lavender Cedarwood"
"1631893452-4287","https://www.williams-sonoma.com/shop/homekeeping/cleaning-view-all/?cm_type=lnav","Miele AirClean Type KK Dustbags"
"1631893452-4239","https://www.williams-sonoma.com/shop/homekeeping/cleaning-view-all/?cm_type=lnav","Two-Bottle Caddy"
"1631893452-4233","https://www.williams-sonoma.com/shop/homekeeping/cleaning-view-all/?cm_type=lnav","Williams Sonoma Lemongrass Ginger Cleaning Set"
"1631893452-4204","https://www.williams-sonoma.com/shop/homekeeping/cleaning-view-all/?cm_type=lnav","Williams Sonoma Lemongrass Ginger Dish Soap"
"1631893452-4211","https://www.williams-sonoma.com/shop/homekeeping/cleaning-view-all/?cm_type=lnav","Williams Sonoma Compact Dish Rack, White"
"1631893452-4320","https://www.williams-sonoma.com/shop/homekeeping/cleaning-view-all/?cm_type=lnav","Breville Espresso Cleaning Tablets"
"1631893452-4226","https://www.williams-sonoma.com/shop/homekeeping/cleaning-view-all/?cm_type=lnav","Williams Sonoma Dish Rack with Wine Glass Holder, White"
"1631893452-4279","https://www.williams-sonoma.com/shop/homekeeping/cleaning-view-all/?cm_type=lnav","Vornado Vfan Mini Modern"
"1631893452-4298","https://www.williams-sonoma.com/shop/homekeeping/cleaning-view-all/?cm_type=lnav","My Happi Air Purifier Filter"
"1631893452-4222","https://www.williams-sonoma.com/shop/homekeeping/cleaning-view-all/?cm_type=lnav","Brabantia Bo Touch Bin Hi"
"1631893452-4288","https://www.williams-sonoma.com/shop/homekeeping/cleaning-view-all/?cm_type=lnav","Emperor Soap Dispenser 11-Oz."
"1631893452-4312","https://www.williams-sonoma.com/shop/homekeeping/cleaning-view-all/?cm_type=lnav","Williams Sonoma Lavender Cedarwood Laundry Detergent"
"1631893452-4230","https://www.williams-sonoma.com/shop/homekeeping/cleaning-view-all/?cm_type=lnav","Nantucket Woven Seagrass Hamper on Wheels"
"1631893452-4321","https://www.williams-sonoma.com/shop/homekeeping/cleaning-view-all/?cm_type=lnav","Pop-Up Sponges, Yellow"
"1631893452-4234","https://www.williams-sonoma.com/shop/homekeeping/cleaning-view-all/?cm_type=lnav","Tosca Over-the-Sink Dish Drainer Rack, White"
"1631893452-4197","https://www.williams-sonoma.com/shop/homekeeping/cleaning-view-all/?cm_type=lnav","Brabantia Hanging Drying Rack"
"1631893452-4296","https://www.williams-sonoma.com/shop/homekeeping/cleaning-view-all/?cm_type=lnav","White Hanging Tension Caddy"
"1631893452-4210","https://www.williams-sonoma.com/shop/homekeeping/cleaning-view-all/?cm_type=lnav","Williams Sonoma White Gardenia Dish Soap"
"1631893452-4310","https://www.williams-sonoma.com/shop/homekeeping/cleaning-view-all/?cm_type=lnav","Brabantia Ironing Boards"
"1631893452-4280","https://www.williams-sonoma.com/shop/homekeeping/cleaning-view-all/?cm_type=lnav","simplehuman™ (D) Custom Fit Liners"
"1631893452-4183","https://www.williams-sonoma.com/shop/homekeeping/cleaning-view-all/?cm_type=lnav","Pop-Up Sponges, Yellow"
"1631893452-4238","https://www.williams-sonoma.com/shop/homekeeping/cleaning-view-all/?cm_type=lnav","Williams Sonoma Spiced Chestnut Kitchen Essentials Kit"
"1631893452-4282","https://www.williams-sonoma.com/shop/homekeeping/cleaning-view-all/?cm_type=lnav","Blueair Blue Pure 311 Auto Air Purifier"
"1631893452-4166","https://www.williams-sonoma.com/shop/homekeeping/cleaning-view-all/?cm_type=lnav","Williams Sonoma Pumpkin Spice Dish Soap"
"1631893452-4315","https://www.williams-sonoma.com/shop/homekeeping/cleaning-view-all/?cm_type=lnav","iHome UV-C Sanitizer Clock with Bluetooth Speaker"
"1631893452-4305","https://www.williams-sonoma.com/shop/homekeeping/cleaning-view-all/?cm_type=lnav","BONECO H300 Humidifer & Air Purifier with Comfort Filter"
"1631893452-4297","https://www.williams-sonoma.com/shop/homekeeping/cleaning-view-all/?cm_type=lnav","Pineapple Pop Up Sponges, Set of 6"
"1631893452-4240","https://www.williams-sonoma.com/shop/homekeeping/cleaning-view-all/?cm_type=lnav","Rowenta X-Cel Steam Plus Steamer DR8120"
"1631893452-4293","https://www.williams-sonoma.com/shop/homekeeping/cleaning-view-all/?cm_type=lnav","Folding Step Stool"
"1631893452-4267","https://www.williams-sonoma.com/shop/homekeeping/cleaning-view-all/?cm_type=lnav","OXO Stainless Steel Sinkware Caddy"
"1631893452-4259","https://www.williams-sonoma.com/shop/homekeeping/cleaning-view-all/?cm_type=lnav","Brabantia Dish Drying Rack"
"1631893452-4175","https://www.williams-sonoma.com/shop/homekeeping/cleaning-view-all/?cm_type=lnav","Breville Espresso Cleaning Tablets"
"1631893452-4163","https://www.williams-sonoma.com/shop/homekeeping/cleaning-view-all/?cm_type=lnav","Williams Sonoma Pink Grapefruit Cleaning Set"
"1631893452-4300","https://www.williams-sonoma.com/shop/homekeeping/cleaning-view-all/?cm_type=lnav","Blueair HealthProtect 7470i Air Purifier with Smart Filter"
"1631893452-4284","https://www.williams-sonoma.com/shop/homekeeping/cleaning-view-all/?cm_type=lnav","Otto Automatic Soap Dispenser with Caddy"
"1631893452-4301","https://www.williams-sonoma.com/shop/homekeeping/cleaning-view-all/?cm_type=lnav","Blueair Pure Fan Auto with Particle Filter"
"1631893452-4258","https://www.williams-sonoma.com/shop/homekeeping/cleaning-view-all/?cm_type=lnav","Miele Active HEPA AirClean SFHA50"
"1631893452-4224","https://www.williams-sonoma.com/shop/homekeeping/cleaning-view-all/?cm_type=lnav","Williams Sonoma Board Oil"
"1631893452-4250","https://www.williams-sonoma.com/shop/homekeeping/cleaning-view-all/?cm_type=lnav","Lucano 3 Step Ladder"
"1631893452-4215","https://www.williams-sonoma.com/shop/homekeeping/cleaning-view-all/?cm_type=lnav","Williams Sonoma Meyer Lemon Cleaning Wipes"
"1631893452-4200","https://www.williams-sonoma.com/shop/homekeeping/cleaning-view-all/?cm_type=lnav","Williams Sonoma Pink Grapefruit Dish Soap"
"1631893452-4318","https://www.williams-sonoma.com/shop/homekeeping/cleaning-view-all/?cm_type=lnav","Red, White & Blue Star Pop Up Sponges, Set of 6"
"1631893452-4208","https://www.williams-sonoma.com/shop/homekeeping/cleaning-view-all/?cm_type=lnav","Williams Sonoma Winter Forest Dish Soap"
"1631893452-4262","https://www.williams-sonoma.com/shop/homekeeping/cleaning-view-all/?cm_type=lnav","Bo Touch Top 2-Can"
"1631893452-4207","https://www.williams-sonoma.com/shop/homekeeping/cleaning-view-all/?cm_type=lnav","Williams Sonoma French Lavender Dish Soap"
"1631893452-4186","https://www.williams-sonoma.com/shop/homekeeping/cleaning-view-all/?cm_type=lnav","Vitamix FoodCycler"
"1631893452-4179","https://www.williams-sonoma.com/shop/homekeeping/cleaning-view-all/?cm_type=lnav","Williams Sonoma White Gardenia Hand Soap Refill, 68 oz."
"1631893452-4272","https://www.williams-sonoma.com/shop/homekeeping/cleaning-view-all/?cm_type=lnav","Cuisinart PuRXium Countertop Air Purifier"
"1631893452-4264","https://www.williams-sonoma.com/shop/homekeeping/cleaning-view-all/?cm_type=lnav","Cuisinart PuRXium Free Standing Air Purifier"
"1631893452-4281","https://www.williams-sonoma.com/shop/homekeeping/cleaning-view-all/?cm_type=lnav","BONECO F120 Medium Pedestal Fan"
"1631893452-4225","https://www.williams-sonoma.com/shop/homekeeping/cleaning-view-all/?cm_type=lnav","Brabantia Dish Drying Rack"
"1631893452-4185","https://www.williams-sonoma.com/shop/homekeeping/cleaning-view-all/?cm_type=lnav","Lodge Seasoned Cast Iron Cookware Care Kit"
"1631893452-4260","https://www.williams-sonoma.com/shop/homekeeping/cleaning-view-all/?cm_type=lnav","Brabantia Tower Drying Rack"
"1631893452-4218","https://www.williams-sonoma.com/shop/homekeeping/cleaning-view-all/?cm_type=lnav","Storage Cart with Handle, White"
"1631893452-4306","https://www.williams-sonoma.com/shop/homekeeping/cleaning-view-all/?cm_type=lnav","BONECO AH300 POLLEN Filter"
"1631893452-4178","https://www.williams-sonoma.com/shop/homekeeping/cleaning-view-all/?cm_type=lnav","Rowenta Master Valet Garment Steamer IS6300"
"1631893452-4322","https://www.williams-sonoma.com/shop/homekeeping/cleaning-view-all/?cm_type=lnav","Breville The Descaler"
"1631893452-4199","https://www.williams-sonoma.com/shop/homekeeping/cleaning-view-all/?cm_type=lnav","Rolling Storage Cart, White"
"1631893452-4299","https://www.williams-sonoma.com/shop/homekeeping/cleaning-view-all/?cm_type=lnav","BONECO F230 Pedestal Fan with Adjustable Height"
"1631893452-4268","https://www.williams-sonoma.com/shop/homekeeping/cleaning-view-all/?cm_type=lnav","Wesco Single Boy Waste Bin"
"1631893452-4245","https://www.williams-sonoma.com/shop/homekeeping/cleaning-view-all/?cm_type=lnav","Lucano 2 Step Ladder"
"1631893452-4164","https://www.williams-sonoma.com/shop/homekeeping/cleaning-view-all/?cm_type=lnav","OXO Stainless-Steel Soap Dispensing Dish Brush"
"1631893452-4265","https://www.williams-sonoma.com/shop/homekeeping/cleaning-view-all/?cm_type=lnav","Williams Sonoma French Lavender Cleaning Set"
"1631893452-4198","https://www.williams-sonoma.com/shop/homekeeping/cleaning-view-all/?cm_type=lnav","Joseph Joseph Totem Compact"
"1631893452-4309","https://www.williams-sonoma.com/shop/homekeeping/cleaning-view-all/?cm_type=lnav","Brabantia Ironing Boards"
"1631893452-4235","https://www.williams-sonoma.com/shop/homekeeping/cleaning-view-all/?cm_type=lnav","Sheila Maid Clothes Dryer"
"1631893452-4316","https://www.williams-sonoma.com/shop/homekeeping/cleaning-view-all/?cm_type=lnav","iHome UV-C Sanitizer"
"1631893452-4174","https://www.williams-sonoma.com/shop/homekeeping/cleaning-view-all/?cm_type=lnav","Breville The Descaler"
"1631893452-4220","https://www.williams-sonoma.com/shop/homekeeping/cleaning-view-all/?cm_type=lnav","Williams Sonoma Meyer Lemon Kitchen Essentials Kit"
"1631893452-4219","https://www.williams-sonoma.com/shop/homekeeping/cleaning-view-all/?cm_type=lnav","Nantucket Woven Seagrass Double Hamper on Wheels"
"1631893452-4203","https://www.williams-sonoma.com/shop/homekeeping/cleaning-view-all/?cm_type=lnav","Stainless-Steel Soap & Lotion Pump"
"1631893452-4290","https://www.williams-sonoma.com/shop/homekeeping/cleaning-view-all/?cm_type=lnav","BONECO AH300 COMFORT Filter"
"1631893452-4205","https://www.williams-sonoma.com/shop/homekeeping/cleaning-view-all/?cm_type=lnav","Boos Block Board Cream"
"1631893452-4216","https://www.williams-sonoma.com/shop/homekeeping/cleaning-view-all/?cm_type=lnav","Williams Sonoma French Lavender Dish Soap Refill, 68oz."
"1631893452-4271","https://www.williams-sonoma.com/shop/homekeeping/cleaning-view-all/?cm_type=lnav","Tower X Shaped Dish Drainer Rack, White"
"1631893452-4206","https://www.williams-sonoma.com/shop/homekeeping/cleaning-view-all/?cm_type=lnav","Mauviel Copper Cleaner"
"1631893452-4182","https://www.williams-sonoma.com/shop/homekeeping/cleaning-view-all/?cm_type=lnav","Le Creuset Cast-Iron Cleaner"
"1631893452-4252","https://www.williams-sonoma.com/shop/homekeeping/cleaning-view-all/?cm_type=lnav","Miele AirClean 3D Efficiency Dustbags, Type GN"
"1631893452-4278","https://www.williams-sonoma.com/shop/homekeeping/cleaning-view-all/?cm_type=lnav","simplehuman™ (Q) Custom Fit Liners"
"1631893452-4276","https://www.williams-sonoma.com/shop/homekeeping/cleaning-view-all/?cm_type=lnav","Bo Step Can 3-Buckets"
"1631893452-4170","https://www.williams-sonoma.com/shop/homekeeping/cleaning-view-all/?cm_type=lnav","Williams Sonoma White Gardenia Countertop Spray"
"1631893452-4189","https://www.williams-sonoma.com/shop/homekeeping/cleaning-view-all/?cm_type=lnav","Rowenta Everlast Anticalc Iron DW7180"
"1631893452-4228","https://www.williams-sonoma.com/shop/homekeeping/cleaning-view-all/?cm_type=lnav","Williams Sonoma Pink Grapefruit Countertop Spray"
"1631893452-4167","https://www.williams-sonoma.com/shop/homekeeping/cleaning-view-all/?cm_type=lnav","Williams Sonoma Lemongrass Ginger Countertop Spray"
"1631893452-4274","https://www.williams-sonoma.com/shop/homekeeping/cleaning-view-all/?cm_type=lnav","Brabantia Laundry Bin with Cork Lid"
"1631893452-4302","https://www.williams-sonoma.com/shop/homekeeping/cleaning-view-all/?cm_type=lnav","Miele Active HEPA Filter H10"
"1631893452-4266","https://www.williams-sonoma.com/shop/homekeeping/cleaning-view-all/?cm_type=lnav","Brabantia Drying Rack"
"1631893452-4249","https://www.williams-sonoma.com/shop/homekeeping/cleaning-view-all/?cm_type=lnav","Gold Soap & Lotion Pump"
"1631893452-4277","https://www.williams-sonoma.com/shop/homekeeping/cleaning-view-all/?cm_type=lnav","Blueair Blue Pure 411 Auto Air Purifier"
"1631893452-4213","https://www.williams-sonoma.com/shop/homekeeping/cleaning-view-all/?cm_type=lnav","Williams Sonoma Meyer Lemon Hand Sanitizer Spray"
"1631893452-4236","https://www.williams-sonoma.com/shop/homekeeping/cleaning-view-all/?cm_type=lnav","Miele Blizzard Vacuum"
"1631893452-4242","https://www.williams-sonoma.com/shop/homekeeping/cleaning-view-all/?cm_type=lnav","Williams Sonoma French Lavender Hand Sanitizer Wipes"
"1631893452-4317","https://www.williams-sonoma.com/shop/homekeeping/cleaning-view-all/?cm_type=lnav","Miele S142-S168 HEPA Vacuum Filter"
"1631893452-4172","https://www.williams-sonoma.com/shop/homekeeping/cleaning-view-all/?cm_type=lnav","Rowenta Perfect Steam Pro DG8624U1"
"1631893452-4311","https://www.williams-sonoma.com/shop/homekeeping/cleaning-view-all/?cm_type=lnav","Kitchen Gloves, Red"
"1631893452-4270","https://www.williams-sonoma.com/shop/homekeeping/cleaning-view-all/?cm_type=lnav","Vitamix FoodCycler Replacement Lid Filters, 3-pack"
"1631893452-4177","https://www.williams-sonoma.com/shop/homekeeping/cleaning-view-all/?cm_type=lnav","Williams Sonoma Meyer Lemon Dish Soap Refill, 68oz."
"1631893452-4246","https://www.williams-sonoma.com/shop/homekeeping/cleaning-view-all/?cm_type=lnav","Brabantia Bo Touch Top Can"
"1631893452-4244","https://www.williams-sonoma.com/shop/homekeeping/cleaning-view-all/?cm_type=lnav","Williams Sonoma Fleur de Sel Countertop Spray"
"1631893452-4241","https://www.williams-sonoma.com/shop/homekeeping/cleaning-view-all/?cm_type=lnav","Full Circle Coffee Machine Descaling Liquid & Powder"
"1631893452-4307","https://www.williams-sonoma.com/shop/homekeeping/cleaning-view-all/?cm_type=lnav","Cuisinart PuRXium 2 in 1 Filter Pack for CAP-500"
"1631893452-4256","https://www.williams-sonoma.com/shop/homekeeping/cleaning-view-all/?cm_type=lnav","Williams Sonoma White Gardenia Kitchen Essentials Kit"
"1631893452-4193","https://www.williams-sonoma.com/shop/homekeeping/cleaning-view-all/?cm_type=lnav","Williams Sonoma Meyer Lemon Cleaning Set"
