web-scraper-order,web-scraper-start-url,nnn
1631563433-4788,https://www.officedepot.com/a/browse/stools/N=5+593070/,"New Ridge Home Goods Julian Faux Leather Bar Stool, Tan/Espresso"
1631563433-4557,https://www.officedepot.com/a/browse/stools/N=5+593070/,"Office Star™ Sunnydale Fabric Mid-Back Office Chair, Orchid"
1631563433-2472,https://www.officedepot.com/a/browse/stools/N=5+593070/,"Boss Multipurpose Mesh Stool, Charcoal Gray/Black4.6 out of 5 stars. 8 reviews"
1631563433-4093,https://www.officedepot.com/a/browse/stools/N=5+593070/,"LumiSource Fuji Stacker Counter Stools, Blue Seat/Black Frame, Set Of 2 Stools0.0 out of 5 stars."
1631563433-2738,https://www.officedepot.com/a/browse/stools/N=5+593070/,"Ave Six Luna 31 1/2""H Counter Stool, Azure/Gold0.0 out of 5 stars."
1631563433-2928,https://www.officedepot.com/a/browse/stools/N=5+593070/,"National Public Seating Elephant Z-Stools, 18""H, Black/Chrome, Set Of 30.0 out of 5 stars."
1631563433-4567,https://www.officedepot.com/a/browse/stools/N=5+593070/,"LumiSource Ahoy Floral Counter Stool, Walnut Bamboo/Black"
1631563433-2712,https://www.officedepot.com/a/browse/stools/N=5+593070/,"Linon Franklin Bar Stool, Black/Dove Gray0.0 out of 5 stars."
1631563433-3693,https://www.officedepot.com/a/browse/stools/N=5+593070/,"LumiSource Fabrico Counter Stools, Cream Seat/Walnut Frame/Black Square Footrest...0.0 out of 5 stars."
1631563433-4635,https://www.officedepot.com/a/browse/stools/N=5+593070/,"LumiSource Fuji Stacker Counter Stools, Blue Seat/Gold Frame, Set Of 2 Stools"
1631563433-3601,https://www.officedepot.com/a/browse/stools/N=5+593070/,"LumiSource Folia Bar Stool, Black/Light Gray5.0 out of 5 stars. 1 review"
1631563433-3008,https://www.officedepot.com/a/browse/stools/N=5+593070/,"Coast to Coast Adjustable Accent Bar Stool, Honey Brown/Antique Silver0.0 out of 5 stars."
1631563433-4467,https://www.officedepot.com/a/browse/stools/N=5+593070/,"LumiSource Fuji Stacker Counter Stools, Gray Seat/Antique Frame, Set of 2 Stools"
1631563433-4576,https://www.officedepot.com/a/browse/stools/N=5+593070/,"Safco® Steel Guest Bistro Stool, Silver"
1631563433-4605,https://www.officedepot.com/a/browse/stools/N=5+593070/,"Baxton Studio Carson Bar Stools With Backs, Gray/Walnut, Set Of 2 Bar Stools"
1631563433-4657,https://www.officedepot.com/a/browse/stools/N=5+593070/,"LumiSource Dakota Bar Stools, Gray/Brown, Set Of 2 Stools"
1631563433-3140,https://www.officedepot.com/a/browse/stools/N=5+593070/,"National Public Seating Vinyl-Padded Stools With Backs, 18""H, Gray, Set of 50.0 out of 5 stars."
1631563433-4292,https://www.officedepot.com/a/browse/stools/N=5+593070/,"LumiSource Fuji DLX Counter Stools-Set of 2, Gold/Blue0.0 out of 5 stars."
1631563433-2740,https://www.officedepot.com/a/browse/stools/N=5+593070/,"With its slight lip back and flat seat, the Equino is comfortable and stylish. F...0.0 out of 5 stars."
1631563433-4754,https://www.officedepot.com/a/browse/stools/N=5+593070/,"Coast to Coast Accent Counter-Height Barstools, Gray/Santa Clara Putty, Set Of 2..."
1631563433-3512,https://www.officedepot.com/a/browse/stools/N=5+593070/,"Zuo Modern® Marius Counter Stools, Gunmetal, Set Of 2 Stools0.0 out of 5 stars."
1631563433-4165,https://www.officedepot.com/a/browse/stools/N=5+593070/,"Linon Tempest Stool, Gold/Orange0.0 out of 5 stars."
1631563433-2901,https://www.officedepot.com/a/browse/stools/N=5+593070/,"Lumisource Mirage Bar Stool, Black/Silver4.0 out of 5 stars. 1 review"
1631563433-2742,https://www.officedepot.com/a/browse/stools/N=5+593070/,"Glamour Home Amery Bar Stools, Brown, Set Of 2 Stools0.0 out of 5 stars."
1631563433-4433,https://www.officedepot.com/a/browse/stools/N=5+593070/,"Monarch Specialties Aaron Swivel Barstools With Backs, Gray/White, Set Of 2 Bars..."
1631563433-4687,https://www.officedepot.com/a/browse/stools/N=5+593070/,"LumiSource Fuji Stacker Counter Stools, Black Seat/Black Frame, Set of 2 Stools"
1631563433-4669,https://www.officedepot.com/a/browse/stools/N=5+593070/,"Linon Ellington Counter Stools, Unfinished, Set Of 2 Stools"
1631563433-4400,https://www.officedepot.com/a/browse/stools/N=5+593070/,"OFM 161 Collection Mid-Century Modern Bentwood Swivel Stool, Walnut/Black5.0 out of 5 stars. 10 reviews"
1631563433-3028,https://www.officedepot.com/a/browse/stools/N=5+593070/,"Linon Home Décor Products Marshall Backless Bar Stool, Walnut/Brown0.0 out of 5 stars."
1631563433-2782,https://www.officedepot.com/a/browse/stools/N=5+593070/,"LumiSource Oregon Low-Back Bar Stools, Gray/Brown, Set Of 2 Stools0.0 out of 5 stars."
1631563433-3050,https://www.officedepot.com/a/browse/stools/N=5+593070/,"Linon Rockford Counter Stool, Wenge/Brown0.0 out of 5 stars."
1631563433-4648,https://www.officedepot.com/a/browse/stools/N=5+593070/,"Flash Furniture 24"" Metal Counter-Height Bar Stools, Set Of 4 Bar Stools, Black"
1631563433-4516,https://www.officedepot.com/a/browse/stools/N=5+593070/,"Linon Mantello Adjustable Stool, Aged Walnut/Black"
1631563433-2707,https://www.officedepot.com/a/browse/stools/N=5+593070/,"DHP Luxor Metal Bar Stools, Charcoal, Set Of 20.0 out of 5 stars."
1631563433-3184,https://www.officedepot.com/a/browse/stools/N=5+593070/,"LumiSource Dali Low-Back Counter Stools, Espresso Seat And Back/Black Frame, Set...0.0 out of 5 stars."
1631563433-4561,https://www.officedepot.com/a/browse/stools/N=5+593070/,"LumiSource Roman Counter Stools, Antique/Cream, Set Of 2 Stools"
1631563433-4353,https://www.officedepot.com/a/browse/stools/N=5+593070/,"Safco® Steel Guest Bistro Stool, Baby Blue0.0 out of 5 stars."
1631563433-3590,https://www.officedepot.com/a/browse/stools/N=5+593070/,"Boss Drafting Stool, Gray/Chrome, B1615-GY3.8 out of 5 stars. 8 reviews"
1631563433-4856,https://www.officedepot.com/a/browse/stools/N=5+593070/,"Powell Cagney Swivel Counter Stool, Brown/Rustic Oak"
1631563433-4911,https://www.officedepot.com/a/browse/stools/N=5+593070/,"LumiSource Rhonda Counter Stools, Gold/Cream, Set Of 2 Stools"
1631563433-2638,https://www.officedepot.com/a/browse/stools/N=5+593070/,"LumiSource Duke 26"" Counter Stools, Black/Blue Cowboy, Set Of 2 Stools0.0 out of 5 stars."
1631563433-4826,https://www.officedepot.com/a/browse/stools/N=5+593070/,"Zuo Modern Ace Bar Chairs, Gray/Walnut, Set Of 2 Chairs"
1631563433-4737,https://www.officedepot.com/a/browse/stools/N=5+593070/,"National Public Seating Elephant Task Z-Stool, Black Seat/Chrome Frame, Quantity..."
1631563433-3149,https://www.officedepot.com/a/browse/stools/N=5+593070/,"Zuo® Modern Bree Counter Stools, Burgundy/Gold, Set Of 20.0 out of 5 stars."
1631563433-2631,https://www.officedepot.com/a/browse/stools/N=5+593070/,"National Public Seating Hardboard Stool, 30""H, Gray0.0 out of 5 stars."
1631563433-3537,https://www.officedepot.com/a/browse/stools/N=5+593070/,"Coast to Coast Sheesham/Iron Adjustable Accent Barstool, Honey Brown/Charcoal0.0 out of 5 stars."
1631563433-3037,https://www.officedepot.com/a/browse/stools/N=5+593070/,"National Public Seating 6400 Vinyl Stool, 24""H, Black, No Assembly Required0.0 out of 5 stars."
1631563433-4718,https://www.officedepot.com/a/browse/stools/N=5+593070/,"Lumisource Grotto Counter Stools, Cherry/White, Set Of 2 Stools"
1631563433-4177,https://www.officedepot.com/a/browse/stools/N=5+593070/,"Flash Furniture 30"" Metal Indoor Bar Stools, Set Of 4 Bar Stools, Black0.0 out of 5 stars."
1631563433-3902,https://www.officedepot.com/a/browse/stools/N=5+593070/,"Safco® Steel Counter Stool, White0.0 out of 5 stars."
1631563433-4690,https://www.officedepot.com/a/browse/stools/N=5+593070/,"KFI Studios Jive Low-Back Bar Stool, Fudge/Natural"
1631563433-4508,https://www.officedepot.com/a/browse/stools/N=5+593070/,"Boss Stand Up Fabric Drafting Stool with Foot Rest, Black - Burgundy Crepe Fabri..."
1631563433-4476,https://www.officedepot.com/a/browse/stools/N=5+593070/,"Coast to Coast Swiveling Barstool, Gray/Gold"
1631563433-3035,https://www.officedepot.com/a/browse/stools/N=5+593070/,"Safco® Apprentice II Extended-Height Vinyl Chair, Black/Chrome0.0 out of 5 stars."
1631563433-3160,https://www.officedepot.com/a/browse/stools/N=5+593070/,"Flash Furniture Cozy Mid-Back Adjustable Bar Stool, Gray/White0.0 out of 5 stars."
1631563433-3095,https://www.officedepot.com/a/browse/stools/N=5+593070/,"Linon Tomer Backless Counter Stool, Brown/Mossy Oak0.0 out of 5 stars."
1631563433-4541,https://www.officedepot.com/a/browse/stools/N=5+593070/,"LumiSource Curvo Bar Stool, Light Gray Seat/Chrome/Walnut Wood Frame"
1631563433-3689,https://www.officedepot.com/a/browse/stools/N=5+593070/,"Ave Six Luna 31 1/2""H Counter Stool, White/Gold0.0 out of 5 stars."
1631563433-4095,https://www.officedepot.com/a/browse/stools/N=5+593070/,"Flash Furniture Cozy Mid-Back Adjustable Bar Stool, Gray/Brown5.0 out of 5 stars. 2 reviews"
1631563433-3438,https://www.officedepot.com/a/browse/stools/N=5+593070/,"Zuo Modern® Piccolo Counter Chair, Yellow/Black0.0 out of 5 stars."
1631563433-3998,https://www.officedepot.com/a/browse/stools/N=5+593070/,"Marco Group Cushioned Swivel Stool, Sprite Green0.0 out of 5 stars."
1631563433-4695,https://www.officedepot.com/a/browse/stools/N=5+593070/,"National Public Seating Hardboard Stool With Back, 30""H, Gray"
1631563433-4749,https://www.officedepot.com/a/browse/stools/N=5+593070/,"Safco® Steel Counter Stool, Baby Blue"
1631563433-3290,https://www.officedepot.com/a/browse/stools/N=5+593070/,"HON® Solve Fabric Mid-Back Task Chair, ReActiv Back, Midnight/Black0.0 out of 5 stars."
1631563433-2324,https://www.officedepot.com/a/browse/stools/N=5+593070/,"Linon Hudson Adjustable Stools, Brown, Set Of 3 Stools"
1631563433-4840,https://www.officedepot.com/a/browse/stools/N=5+593070/,"Flash Furniture 24""H Commercial-Grade Metal Backless Counter Stool, Silver"
1631563433-4374,https://www.officedepot.com/a/browse/stools/N=5+593070/,"Elama Retro Adjustable Bar Stools, Black/Chrome, Set Of 2 Stools0.0 out of 5 stars."
1631563433-4456,https://www.officedepot.com/a/browse/stools/N=5+593070/,"HON® Medical Exam Stool, Without Back"
1631563433-4002,https://www.officedepot.com/a/browse/stools/N=5+593070/,"Baxton Studio Alexandra Bar Stools, Walnut Brown/Gray, Pack of 20.0 out of 5 stars."
1631563433-3502,https://www.officedepot.com/a/browse/stools/N=5+593070/,"Zuo® Modern Bree Counter Stools, White/Gold, Set Of 20.0 out of 5 stars."
1631563433-2920,https://www.officedepot.com/a/browse/stools/N=5+593070/,"Flash Furniture Commercial-Grade Indoor/Outdoor Bar Stools, Silver, Set Of 4 Bar...0.0 out of 5 stars."
1631563433-3587,https://www.officedepot.com/a/browse/stools/N=5+593070/,"Baxton Studio Kaelin Bar Stools, Rose Gold/Navy Blue, Set Of 4 Stools0.0 out of 5 stars."
1631563433-4575,https://www.officedepot.com/a/browse/stools/N=5+593070/,"Baxton Studio Chandler Counter Stools, Gray/Espresso Brown, Set Of 2 Stools"
1631563433-4325,https://www.officedepot.com/a/browse/stools/N=5+593070/,"Boss Fabric Drafting Stool, Black/Chrome3.0 out of 5 stars. 2 reviews"
1631563433-4867,https://www.officedepot.com/a/browse/stools/N=5+593070/,"Baxton Studio Calista Bar Stools, Sand/Espresso Brown, Set Of 2 Stools"
1631563433-2710,https://www.officedepot.com/a/browse/stools/N=5+593070/,"LumiSource Daniella Counter Stools, Black/Camel, Set Of 2 Stools0.0 out of 5 stars."
1631563433-4431,https://www.officedepot.com/a/browse/stools/N=5+593070/,"Safco® Resi Bistro Stool, Natural/Gray"
1631563433-4392,https://www.officedepot.com/a/browse/stools/N=5+593070/,"LumiSource Velvet Fuji Stacker Bar Stools, Gold/Blue, Set Of 2 Stools0.0 out of 5 stars."
1631563433-4196,https://www.officedepot.com/a/browse/stools/N=5+593070/,"Powell Carden Bar Stool, Neutral/Black0.0 out of 5 stars."
1631563433-2704,https://www.officedepot.com/a/browse/stools/N=5+593070/,"National Public Seating 6800 Designer Wood Swivel Stools, Wood/Gray, Set Of 20.0 out of 5 stars."
1631563433-2897,https://www.officedepot.com/a/browse/stools/N=5+593070/,"Linon Home Décor Products Colette Bar Stool, Brown/Black0.0 out of 5 stars."
1631563433-4426,https://www.officedepot.com/a/browse/stools/N=5+593070/,"LumiSource Captain Bar Stool, White/Chrome"
1631563433-4425,https://www.officedepot.com/a/browse/stools/N=5+593070/,"LumiSource Fuji Stacker Counter Stools, Blue Seat/White Frame, Set Of 2 Stools"
1631563433-4886,https://www.officedepot.com/a/browse/stools/N=5+593070/,"Linon Home Décor Products Milone Bar Stool, Mossy Oak/Dark Walnut"
1631563433-3650,https://www.officedepot.com/a/browse/stools/N=5+593070/,"Linon Corie Counter Stool, Gray Wash4.8 out of 5 stars. 6 reviews"
1631563433-2903,https://www.officedepot.com/a/browse/stools/N=5+593070/,"LumiSource Chloe Counter Stools, Gold/White, Set Of 2 Stools0.0 out of 5 stars."
1631563433-3353,https://www.officedepot.com/a/browse/stools/N=5+593070/,"LumiSource Winston Counter Stool, Black0.0 out of 5 stars."
1631563433-3514,https://www.officedepot.com/a/browse/stools/N=5+593070/,"Powell® Home Fashions Barrel Back Adjustable Bar Stool, White/Chrome0.0 out of 5 stars."
1631563433-4681,https://www.officedepot.com/a/browse/stools/N=5+593070/,"LumiSource Roman Counter Stools, White/Espresso, Set Of 2 Stools"
1631563433-3739,https://www.officedepot.com/a/browse/stools/N=5+593070/,"Linon Home Décor Products Taylor Bar Stool, Brown/Black0.0 out of 5 stars."
1631563433-3483,https://www.officedepot.com/a/browse/stools/N=5+593070/,"LumiSource Finn Counter Stools, Gray Seat/White Frame, Set Of 2 Stools0.0 out of 5 stars."
1631563433-3971,https://www.officedepot.com/a/browse/stools/N=5+593070/,"LumiSource Winston Counter Stool, Whitewash/Antique Copper0.0 out of 5 stars."
1631563433-4674,https://www.officedepot.com/a/browse/stools/N=5+593070/,"Linon Walker Backless Counter Stool, Dark Brown/Natural"
1631563433-4626,https://www.officedepot.com/a/browse/stools/N=5+593070/,"LumiSource Saddle Counter Stools, Gray/Cream, Set Of 2 Stools"
1631563433-4276,https://www.officedepot.com/a/browse/stools/N=5+593070/,"Boss Drafting Stool, Adjustable Arms, Black/Chrome, B1691-BK5.0 out of 5 stars. 1 review"
1631563433-2351,https://www.officedepot.com/a/browse/stools/N=5+593070/,"Powell® Home Fashions Bar Stool, Black/Chrome5.0 out of 5 stars. 1 review"
1631563433-3623,https://www.officedepot.com/a/browse/stools/N=5+593070/,"Linon Mira Faux Fur Stool, Gold/Pink0.0 out of 5 stars."
1631563433-4145,https://www.officedepot.com/a/browse/stools/N=5+593070/,"Linon Pullman Craftsman Bar Stool, Espresso/Black0.0 out of 5 stars."
1631563433-4879,https://www.officedepot.com/a/browse/stools/N=5+593070/,"LumiSource Winston Counter Stool, Dark Walnut/Brown"
1631563433-2861,https://www.officedepot.com/a/browse/stools/N=5+593070/,"Linon Home Decor Products Mica Ladder Back Bar Stool, Espresso/Dark Brown0.0 out of 5 stars."
1631563433-4677,https://www.officedepot.com/a/browse/stools/N=5+593070/,"LumiSource Symphony Counter Stools, Light Gray/White, Set Of 2 Stools"
1631563433-4454,https://www.officedepot.com/a/browse/stools/N=5+593070/,"Baxton Studio Malcom Bar Stools, Black, Set Of 4 Stools"
1631563433-4460,https://www.officedepot.com/a/browse/stools/N=5+593070/,"LumiSource Jasmine Vanity Stool, White Seat/Gold Frame"
1631563433-4731,https://www.officedepot.com/a/browse/stools/N=5+593070/,"Baxton Studio Darrin Bar Stools, Black/Walnut, Set Of 2 Stools"
1631563433-4579,https://www.officedepot.com/a/browse/stools/N=5+593070/,"Linon Milone Counter Stool, Walnut/Mossy Oak"
1631563433-4128,https://www.officedepot.com/a/browse/stools/N=5+593070/,"Ave Six Mayson 30""H Polyester Barstools, Charcoal/Gunmetal, Set Of 2 Barstools0.0 out of 5 stars."
1631563433-4003,https://www.officedepot.com/a/browse/stools/N=5+593070/,"Elama Diamond-Stitched Faux Leather Bar Chairs, Black, Set Of 2 Chairs0.0 out of 5 stars."
1631563433-4071,https://www.officedepot.com/a/browse/stools/N=5+593070/,"New Ridge Home Goods Chapman Swivel Counter Stool, Alabaster White0.0 out of 5 stars."
1631563433-2930,https://www.officedepot.com/a/browse/stools/N=5+593070/,"Powell Madaio Backless Swivel Counter Stool, Espresso/Brown0.0 out of 5 stars."
1631563433-4138,https://www.officedepot.com/a/browse/stools/N=5+593070/,"DHP Nova Metal Mesh Backless Bar Stool, Black0.0 out of 5 stars."
1631563433-2936,https://www.officedepot.com/a/browse/stools/N=5+593070/,"DHP Luxor Metal Counter Stool, Brown, Set Of 20.0 out of 5 stars."
1631563433-4771,https://www.officedepot.com/a/browse/stools/N=5+593070/,Safco® Diesel Bonded Leather High-Back Stool
1631563433-4842,https://www.officedepot.com/a/browse/stools/N=5+593070/,"LumiSource Chloe Counter Stools, Gold/Green, Set Of 2 Stools"
1631563433-2836,https://www.officedepot.com/a/browse/stools/N=5+593070/,"LumiSource Gardenia Mid-Century Modern Counter Stools, Walnut/Light Gray, Set Of...5.0 out of 5 stars. 1 review"
1631563433-3241,https://www.officedepot.com/a/browse/stools/N=5+593070/,"Linon Home Décor Products Walton Counter Stool, Dove Gray/Black0.0 out of 5 stars."
1631563433-3372,https://www.officedepot.com/a/browse/stools/N=5+593070/,"Elama Square Tufted Faux Leather Adjustable Bar Stools, Black/Chrome, Set Of 2 S...0.0 out of 5 stars."
1631563433-4136,https://www.officedepot.com/a/browse/stools/N=5+593070/,"LumiSource Canary Counter Stools, Gold/Green, Set Of 2 Stools0.0 out of 5 stars."
1631563433-3500,https://www.officedepot.com/a/browse/stools/N=5+593070/,"Linon Kincaid Accent Stool, Black/Brown/Neutral0.0 out of 5 stars."
1631563433-4500,https://www.officedepot.com/a/browse/stools/N=5+593070/,"Koplus Tonique Mesh Drafting Chair, Midnight Black"
1631563433-3469,https://www.officedepot.com/a/browse/stools/N=5+593070/,"Baxton Studio Calista Bar Stools, Gray/Espresso Brown, Set Of 2 Stools0.0 out of 5 stars."
1631563433-4866,https://www.officedepot.com/a/browse/stools/N=5+593070/,"LumiSource Oregon High-Back Counter Stools, Gray/Brown, Set Of 2 Stools"
1631563433-2328,https://www.officedepot.com/a/browse/stools/N=5+593070/,"Glamour Home Agalia Bar Stools, Chrome/Cream, Set Of 2 Stools"
1631563433-4672,https://www.officedepot.com/a/browse/stools/N=5+593070/,"Safco® Metro™ Extended Height Chair, Chrome/Black"
1631563433-4844,https://www.officedepot.com/a/browse/stools/N=5+593070/,"LumiSource Ahoy Counter Stool, Walnut Bamboo/Black"
1631563433-3217,https://www.officedepot.com/a/browse/stools/N=5+593070/,"LumiSource Pino Bar Stool, Chrome/Walnut/Gray0.0 out of 5 stars."
1631563433-3540,https://www.officedepot.com/a/browse/stools/N=5+593070/,"Coast to Coast Swivel Counter Stools, Oatmeal/Brown, Set Of 2 Stools0.0 out of 5 stars."
1631563433-4553,https://www.officedepot.com/a/browse/stools/N=5+593070/,"LumiSource Marcel Counter Stools, Gold/Navy Blue, Set Of 2 Stools"
1631563433-4420,https://www.officedepot.com/a/browse/stools/N=5+593070/,"Baxton Studio Chloe Bar Stools, Navy Blue, Set Of 2 Stools"
1631563433-2598,https://www.officedepot.com/a/browse/stools/N=5+593070/,"HON® Volt Bonded Leather Task Stool, Black0.0 out of 5 stars."
1631563433-3834,https://www.officedepot.com/a/browse/stools/N=5+593070/,"Linon Home Décor Products Brea Bar Stool, White/White Wash0.0 out of 5 stars."
1631563433-4776,https://www.officedepot.com/a/browse/stools/N=5+593070/,"Linon Home Décor Products Alice Swivel Stool, Brown/Black"
1631563433-3726,https://www.officedepot.com/a/browse/stools/N=5+593070/,"Baxton Studio Oscar Counter Stools, Gray/Walnut, Set Of 2 Stools0.0 out of 5 stars."
1631563433-2232,https://www.officedepot.com/a/browse/stools/N=5+593070/,"Boss Drafting Stool, Adjustable Arms, Black, B1616-BK"
1631563433-4709,https://www.officedepot.com/a/browse/stools/N=5+593070/,"National Public Seating Hardboard Stools, 24""H, Gray, Set of 4"
1631563433-4818,https://www.officedepot.com/a/browse/stools/N=5+593070/,"Safco® Steel Counter Stool, Red"
1631563433-4794,https://www.officedepot.com/a/browse/stools/N=5+593070/,"Linon Walker Backless Bar Stool, Rustic Brown/Natural Striped"
1631563433-4837,https://www.officedepot.com/a/browse/stools/N=5+593070/,"Lorell® Breathable Mesh/Fabric Drafting Stool, Black"
1631563433-4254,https://www.officedepot.com/a/browse/stools/N=5+593070/,"Elama Diamond-Stitched Faux Leather Bar Stools, Black/Chrome, Set Of 2 Stools0.0 out of 5 stars."
1631563433-4415,https://www.officedepot.com/a/browse/stools/N=5+593070/,"National Public Seating Adjustable Vinyl-Padded Task Stool, Gray Seat/Gray Frame...3.0 out of 5 stars. 1 review"
1631563433-4098,https://www.officedepot.com/a/browse/stools/N=5+593070/,"Monarch Specialties Aspen Faux Leather Barstools, Gray/White, Set Of 2 Barstools0.0 out of 5 stars."
1631563433-3794,https://www.officedepot.com/a/browse/stools/N=5+593070/,"National Public Seating Hardboard Stool With Back, 18""H, Black0.0 out of 5 stars."
1631563433-2277,https://www.officedepot.com/a/browse/stools/N=5+593070/,"Eurotech Apollo Drafting Stool, Black"
1631563433-2474,https://www.officedepot.com/a/browse/stools/N=5+593070/,"LumiSource Elisa Mid-Century Modern Counter Stools, Walnut/Cream, Set Of 2 Stool...0.0 out of 5 stars."
1631563433-4871,https://www.officedepot.com/a/browse/stools/N=5+593070/,"LumiSource Grotto Mid-Century Modern Counter Stools, Walnut/Brown, Set Of 2 Stoo..."
1631563433-4644,https://www.officedepot.com/a/browse/stools/N=5+593070/,"HON® Ignition® Series Mesh Back Task Stool, Black"
1631563433-3015,https://www.officedepot.com/a/browse/stools/N=5+593070/,Office Star Space Series 15 Air Grid/Mesh Drafting Chair0.0 out of 5 stars.
1631563433-2316,https://www.officedepot.com/a/browse/stools/N=5+593070/,"HON® Accommodate Cafe Stool, Armless, Fabric, Black"
1631563433-3768,https://www.officedepot.com/a/browse/stools/N=5+593070/,"Lumisource  Emery Barstool, Antique Metal0.0 out of 5 stars."
1631563433-3120,https://www.officedepot.com/a/browse/stools/N=5+593070/,"Zuo® Modern Bree Barstools, White/Gold, Set Of 20.0 out of 5 stars."
1631563433-4387,https://www.officedepot.com/a/browse/stools/N=5+593070/,"LumiSource Curvini 24'' Counter Stools, Blue Seat/Walnut Frame, Set Of 2 Stools5.0 out of 5 stars. 1 review"
1631563433-4495,https://www.officedepot.com/a/browse/stools/N=5+593070/,"LumiSource Mara Counter Stools, Black/White, Set Of 2 Stools"
1631563433-2655,https://www.officedepot.com/a/browse/stools/N=5+593070/,"Ave Six Mayson 30""H Polyester Barstools, Sand/Gunmetal, Set Of 2 Barstools0.0 out of 5 stars."
1631563433-2448,https://www.officedepot.com/a/browse/stools/N=5+593070/,"Powell® Home Fashions Big & Tall Copper Stamped Back Bar Stool, Brown/Bronze5.0 out of 5 stars. 1 review"
1631563433-4482,https://www.officedepot.com/a/browse/stools/N=5+593070/,"LumiSource Venti Barstool, Clear/Chrome"
1631563433-4632,https://www.officedepot.com/a/browse/stools/N=5+593070/,"LumiSource Finn Counter Stools, Black Seat/Gray Frame, Set Of 2 Stools"
1631563433-2234,https://www.officedepot.com/a/browse/stools/N=5+593070/,"Linon Home Decor Products Franklin Bar Stool, Dark Red/Espresso"
1631563433-4832,https://www.officedepot.com/a/browse/stools/N=5+593070/,"National Public Seating Hardboard Stools With Backs, 18""H, Black, Set of 5"
1631563433-2397,https://www.officedepot.com/a/browse/stools/N=5+593070/,"Eurotech Apollo Drafting Stool, Black3.9 out of 5 stars. 13 reviews"
1631563433-4902,https://www.officedepot.com/a/browse/stools/N=5+593070/,"Powell® Home Fashions Quilted Bar Stool, Black/Chrome"
1631563433-4835,https://www.officedepot.com/a/browse/stools/N=5+593070/,"Boss Multipurpose Mesh Stool, Black"
1631563433-2285,https://www.officedepot.com/a/browse/stools/N=5+593070/,Deluxe AirGrid® Back Drafting Chair with Mesh Seat and Adjustable Footring and N...
1631563433-4429,https://www.officedepot.com/a/browse/stools/N=5+593070/,"LumiSource Fuji Stacker Contemporary Counter Stools, Brown Cowboy Seat/White Fra..."
1631563433-4305,https://www.officedepot.com/a/browse/stools/N=5+593070/,"Flash Furniture Ergonomic Adjustable Drafting Chair, Gray/Black3.0 out of 5 stars. 1 review"
1631563433-4592,https://www.officedepot.com/a/browse/stools/N=5+593070/,"LumiSource Oregon High-Back Counter Stools, Antique/Espresso, Set Of 2 Stools"
1631563433-2905,https://www.officedepot.com/a/browse/stools/N=5+593070/,"Linon Home Décor Products Walker Backless Bar Stool, Dark Brown/Jute0.0 out of 5 stars."
1631563433-3773,https://www.officedepot.com/a/browse/stools/N=5+593070/,"LumiSource Fuji Stacker Bar Stools, Silver/Stone, Set Of 2 Stools0.0 out of 5 stars."
1631563433-2751,https://www.officedepot.com/a/browse/stools/N=5+593070/,"LumiSource Geo Upholstered Counter Stools, Black, Set Of 2 Stools0.0 out of 5 stars."
1631563433-4409,https://www.officedepot.com/a/browse/stools/N=5+593070/,"Linon Home Décor Products Dixie Counter Stool, Gray Wash0.0 out of 5 stars."
1631563433-2730,https://www.officedepot.com/a/browse/stools/N=5+593070/,"Flash Furniture Ghost Counter Stool, Clear4.5 out of 5 stars. 2 reviews"
1631563433-4439,https://www.officedepot.com/a/browse/stools/N=5+593070/,"Linon Mantello Adjustable Stool, Aged Walnut/White"
1631563433-4806,https://www.officedepot.com/a/browse/stools/N=5+593070/,"LumiSource York Counter Stool, Walnut/Cream"
1631563433-3081,https://www.officedepot.com/a/browse/stools/N=5+593070/,"Baxton Studio Carson Bar Stools With Backs, Sand/Espresso, Set Of 2 Bar Stools0.0 out of 5 stars."
1631563433-3936,https://www.officedepot.com/a/browse/stools/N=5+593070/,"LumiSource Grotto Bar Stools, Cherry/White, Set Of 2 Stools0.0 out of 5 stars."
1631563433-2476,https://www.officedepot.com/a/browse/stools/N=5+593070/,"Linon Home Decor Products Andrea 29"" Gathered Back Bar Stool, Light Brown/Brown2.5 out of 5 stars. 2 reviews"
1631563433-3029,https://www.officedepot.com/a/browse/stools/N=5+593070/,"Powell Pederson Bar Stools, Natural, Set Of 2 Stools0.0 out of 5 stars."
1631563433-4609,https://www.officedepot.com/a/browse/stools/N=5+593070/,"LumiSource Mirage Bar Stool, Black/Silver"
