web-scraper-order,web-scraper-start-url,nnn
1631563433-2213,https://www.officedepot.com/a/browse/stools/N=5+593070/,"Flash Furniture Mid-Back Mesh Ergonomic Drafting Chair, Black"
1631563433-4898,https://www.officedepot.com/a/browse/stools/N=5+593070/,"Powell® Home Fashions Stool, Sand Through Terra Cotta, Bar Height, Antique Black"
1631563433-3471,https://www.officedepot.com/a/browse/stools/N=5+593070/,"LumiSource Gardenia Mid-Century Modern Counter Stools, Walnut/Teal, Set Of 2 Sto...0.0 out of 5 stars."
1631563433-4566,https://www.officedepot.com/a/browse/stools/N=5+593070/,"Linon Home Décor Products Cleo Adjustable Stool, Snow Leopard"
1631563433-2690,https://www.officedepot.com/a/browse/stools/N=5+593070/,"LumiSource Chloe Counter Stools, Gold/Black, Set Of 2 Stools0.0 out of 5 stars."
1631563433-2807,https://www.officedepot.com/a/browse/stools/N=5+593070/,"Powell® Home Fashions Stool, Saddle, Bar Height, Honey Brown0.0 out of 5 stars."
1631563433-4413,https://www.officedepot.com/a/browse/stools/N=5+593070/,"Safco® Steel Guest Bistro Stool, Black0.0 out of 5 stars."
1631563433-4301,https://www.officedepot.com/a/browse/stools/N=5+593070/,"Coast to Coast Swivel Counter Stools, Cream/Gray, Set Of 2 Stools0.0 out of 5 stars."
1631563433-3692,https://www.officedepot.com/a/browse/stools/N=5+593070/,"LumiSource Cavalier Counter Stools, Silver Seat/Black/Gold Frame, Set Of 2 Stool...0.0 out of 5 stars."
1631563433-2295,https://www.officedepot.com/a/browse/stools/N=5+593070/,"Office Star™ Avenue Six Sullivan Swivel Stool, Walnut/Pewter"
1631563433-2650,https://www.officedepot.com/a/browse/stools/N=5+593070/,"Coast to Coast Pub Height Accent Bar Stool, Honey Brown/Black0.0 out of 5 stars."
1631563433-4821,https://www.officedepot.com/a/browse/stools/N=5+593070/,"Safco® Saddle Seat Lab Task Stool, Black Seat/Black Frame, Quantity: 1"
1631563433-3175,https://www.officedepot.com/a/browse/stools/N=5+593070/,"National Public Seating 6800 Steel Designer Swivel Stools, Black/Gray, Set Of 2 ...0.0 out of 5 stars."
1631563433-4758,https://www.officedepot.com/a/browse/stools/N=5+593070/,"Linon Lana Backless Counter Stool, Rustic Brown/Neutral Stripe"
1631563433-2600,https://www.officedepot.com/a/browse/stools/N=5+593070/,"Linon Home Décor Products Walker Counter Stool, Red/Dark Espresso0.0 out of 5 stars."
1631563433-2839,https://www.officedepot.com/a/browse/stools/N=5+593070/,"Linon Linton Counter Stool, Black/Brown0.0 out of 5 stars."
1631563433-4537,https://www.officedepot.com/a/browse/stools/N=5+593070/,"Powell Taima Swivel Counter Stool, Gray Washed/Gray Beige"
1631563433-4348,https://www.officedepot.com/a/browse/stools/N=5+593070/,"Coast to Coast Counter Height Dining Bar Stools, Cream/Black/Brown, Set Of 2 Sto...0.0 out of 5 stars."
1631563433-2501,https://www.officedepot.com/a/browse/stools/N=5+593070/,"Linon Home Decor Products Clay 30"" Swag Back Bar Stool, Brown/Brown0.0 out of 5 stars."
1631563433-4049,https://www.officedepot.com/a/browse/stools/N=5+593070/,"LumiSource Toriano Counter Stools, Walnut/Cream/Chrome, Set Of 2 Stools0.0 out of 5 stars."
1631563433-3361,https://www.officedepot.com/a/browse/stools/N=5+593070/,"LumiSource Dali Low-Back Counter Stools, Espresso Seat/Black Back And Frame, Set...0.0 out of 5 stars."
1631563433-4258,https://www.officedepot.com/a/browse/stools/N=5+593070/,"Flash Furniture 30"" Metal Indoor Bar Stools, Set Of 4 Bar Stools, Teal0.0 out of 5 stars."
1631563433-3995,https://www.officedepot.com/a/browse/stools/N=5+593070/,"Zuo Modern® Elio Counter Chairs, Gunmetal, Set Of 2 Chairs0.0 out of 5 stars."
1631563433-3159,https://www.officedepot.com/a/browse/stools/N=5+593070/,"DHP Nova Metal Mesh Backless Bar Stool, Red0.0 out of 5 stars."
1631563433-2985,https://www.officedepot.com/a/browse/stools/N=5+593070/,"LumiSource Toriano Counter Stools, Walnut/Gray, Set Of 2 Stools0.0 out of 5 stars."
1631563433-3592,https://www.officedepot.com/a/browse/stools/N=5+593070/,"LumiSource Fuji Stacker Contemporary Counter Stools, Light Gray Cowboy Seat/Blac...0.0 out of 5 stars."
1631563433-2899,https://www.officedepot.com/a/browse/stools/N=5+593070/,"Linon Home Décor Products Luke Backless Bar Stool, Walnut0.0 out of 5 stars."
1631563433-3591,https://www.officedepot.com/a/browse/stools/N=5+593070/,"Linon Kent Backless Counter Stools, Black, Set Of 2 Stools0.0 out of 5 stars."
1631563433-3399,https://www.officedepot.com/a/browse/stools/N=5+593070/,"Flash Furniture Cozy Mid-Back Adjustable Bar Stool, Gray/Burgundy0.0 out of 5 stars."
1631563433-3916,https://www.officedepot.com/a/browse/stools/N=5+593070/,"Linon Walton Bar Stool, Brown/Natural0.0 out of 5 stars."
1631563433-2435,https://www.officedepot.com/a/browse/stools/N=5+593070/,"Safco® Precision Extended-Height Fabric Chair, Black4.0 out of 5 stars. 5 reviews"
1631563433-4629,https://www.officedepot.com/a/browse/stools/N=5+593070/,"LumiSource Saddle Counter Stools, Cream Seat/White Washed Frame, Set Of 2 Stools"
1631563433-3710,https://www.officedepot.com/a/browse/stools/N=5+593070/,"Baxton Studio Jason Bar Stools, Espresso Brown/Gray, Set Of 2 Stools0.0 out of 5 stars."
1631563433-2943,https://www.officedepot.com/a/browse/stools/N=5+593070/,"Zuo Modern® Magnus Counter Chairs, White/Brushed Stainless Steel, Set Of 2 Chair...0.0 out of 5 stars."
1631563433-4753,https://www.officedepot.com/a/browse/stools/N=5+593070/,"Flash Furniture Bentwood Adjustable Bar Stool, Walnut/Black"
1631563433-3494,https://www.officedepot.com/a/browse/stools/N=5+593070/,"Boss Drafting Stool, Adjustable Arms, Blue/Chrome,  B1691-BE5.0 out of 5 stars. 1 review"
1631563433-3635,https://www.officedepot.com/a/browse/stools/N=5+593070/,"Baxton Studio Lanier Counter Stools, Gray/Walnut, Set Of 2 Stools0.0 out of 5 stars."
1631563433-2911,https://www.officedepot.com/a/browse/stools/N=5+593070/,"Powell Duarte Bar Stool, Espresso0.0 out of 5 stars."
1631563433-3213,https://www.officedepot.com/a/browse/stools/N=5+593070/,"Flash Furniture Backless Counter Stool With Swivel Seat, Cappuccino/Black0.0 out of 5 stars."
1631563433-2778,https://www.officedepot.com/a/browse/stools/N=5+593070/,"LumiSource Pebble Counter Stools, Walnut/Light Gray, Set Of 2 Stools0.0 out of 5 stars."
1631563433-4309,https://www.officedepot.com/a/browse/stools/N=5+593070/,"National Public Seating 6800 Steel Designer Swivel Stools, Persian Blue/Gray, Se...0.0 out of 5 stars."
1631563433-2962,https://www.officedepot.com/a/browse/stools/N=5+593070/,"LumiSource Fuji Stacker Counter Stools, Gray Seat/Black Frame, Set of 2 Stools0.0 out of 5 stars."
1631563433-4533,https://www.officedepot.com/a/browse/stools/N=5+593070/,"LumiSource Marcel Contemporary Glam Counter Stools, Black, Set Of 2 Stools"
1631563433-3233,https://www.officedepot.com/a/browse/stools/N=5+593070/,"Linon Home Decor Products Andrea 24"" Gathered Back Counter Stool, Light Brown/Br...0.0 out of 5 stars."
1631563433-3509,https://www.officedepot.com/a/browse/stools/N=5+593070/,"Lorell® Mesh Back Stackable Guest Stool, Black/Gray0.0 out of 5 stars."
1631563433-2272,https://www.officedepot.com/a/browse/stools/N=5+593070/,Sculptured Seat and Back Drafting Chair with Adjustable Foot ring. Pneumatic Hei...
1631563433-3920,https://www.officedepot.com/a/browse/stools/N=5+593070/,"Glamour Home Alee Bar Stool, Antique/Beige0.0 out of 5 stars."
1631563433-2430,https://www.officedepot.com/a/browse/stools/N=5+593070/,"Office Star™ SPACE Deluxe Ergonomic Air Grid/Mesh Armless Drafting Chair, Black5.0 out of 5 stars. 3 reviews"
1631563433-4448,https://www.officedepot.com/a/browse/stools/N=5+593070/,"LumiSource Durango Counter Stools, Gray Vintage Seat/Black Frame, Set Of 2 Stool..."
1631563433-2354,https://www.officedepot.com/a/browse/stools/N=5+593070/,"Flash Furniture Contemporary Adjustable Bar Stool, Gray0.0 out of 5 stars."
1631563433-2349,https://www.officedepot.com/a/browse/stools/N=5+593070/,"Flash Furniture Swivel Bar Stool With Bucket Seat, Black4.5 out of 5 stars. 75 reviews"
1631563433-3115,https://www.officedepot.com/a/browse/stools/N=5+593070/,"Linon Chisholm Round Stool, Gray0.0 out of 5 stars."
1631563433-2321,https://www.officedepot.com/a/browse/stools/N=5+593070/,"HON® ComforTask Stool, 26-7/8""W x 30""D x 49-7/8, Navy"
1631563433-2697,https://www.officedepot.com/a/browse/stools/N=5+593070/,"Monarch Specialties Avery Bar Stools, Gray/White, Set Of 2 Stools0.0 out of 5 stars."
1631563433-2687,https://www.officedepot.com/a/browse/stools/N=5+593070/,"Honey-can-do TBL-02977 Folding Step Stool, Black - Black Seat - Four-legged Base...4.7 out of 5 stars. 6 reviews"
1631563433-4243,https://www.officedepot.com/a/browse/stools/N=5+593070/,"LumiSource Duke Counter Stools, White Seat/Gold Frame, Set Of 2 Stools0.0 out of 5 stars."
1631563433-4060,https://www.officedepot.com/a/browse/stools/N=5+593070/,"Linon Home Décor Products Maddie Bar Stool, Espresso0.0 out of 5 stars."
1631563433-3908,https://www.officedepot.com/a/browse/stools/N=5+593070/,"DHP Nova Metal Mesh Backless Counter Stool, Black0.0 out of 5 stars."
1631563433-4333,https://www.officedepot.com/a/browse/stools/N=5+593070/,"LumiSource Folia Modern Counter Stools, Walnut/Orange, Set Of 2 Stools0.0 out of 5 stars."
1631563433-3423,https://www.officedepot.com/a/browse/stools/N=5+593070/,"Linon Tempest Stool, Gold/Light Blue5.0 out of 5 stars. 3 reviews"
1631563433-4490,https://www.officedepot.com/a/browse/stools/N=5+593070/,"LumiSource Cecina Bar Stools, Walnut/Cream, Set Of 2 Stools"
1631563433-4521,https://www.officedepot.com/a/browse/stools/N=5+593070/,"LumiSource Braided Matisse Counter Stool, Gray/Cream Fabric/Black Frame"
1631563433-2824,https://www.officedepot.com/a/browse/stools/N=5+593070/,"LumiSource Trevi Counter Stools, Walnut/Gray, Set Of 2 Stools0.0 out of 5 stars."
1631563433-4660,https://www.officedepot.com/a/browse/stools/N=5+593070/,"LumiSource Vasari Bar Stool, Chrome/Walnut/Gray"
1631563433-4688,https://www.officedepot.com/a/browse/stools/N=5+593070/,"Flash Furniture Vibrant Drafting Stool, Pink/Chrome"
1631563433-3367,https://www.officedepot.com/a/browse/stools/N=5+593070/,"Powell Faye Fox Youth Stool, Natural/Gray/White0.0 out of 5 stars."
1631563433-4507,https://www.officedepot.com/a/browse/stools/N=5+593070/,"Baxton Studio Aria Counter Stools, Gray/Walnut, Set Of 2 Stools"
1631563433-4540,https://www.officedepot.com/a/browse/stools/N=5+593070/,"LumiSource Industrial Nunzio Counter Stools, Black/Blue, Set Of 2 Stools"
1631563433-4207,https://www.officedepot.com/a/browse/stools/N=5+593070/,"Zuo Modern® Magnus Counter Chairs, Black/Gray, Set Of 2 Chairs0.0 out of 5 stars."
1631563433-2947,https://www.officedepot.com/a/browse/stools/N=5+593070/,"National Public Seating Adjustable Hardboard Stools With Backs, 25""-33""H, Black,...0.0 out of 5 stars."
1631563433-2481,https://www.officedepot.com/a/browse/stools/N=5+593070/,Flash Furniture Ergonomic Mesh Mid-Back Drafting Chair With Adjustable Foot Ring...0.0 out of 5 stars.
1631563433-3339,https://www.officedepot.com/a/browse/stools/N=5+593070/,"Office Star™ WorkSmart Vinyl Mid-Back Drafting Chair, Graphite0.0 out of 5 stars."
1631563433-4603,https://www.officedepot.com/a/browse/stools/N=5+593070/,"Linon Walker Backless Bar Stool, Rustic Brown/Natural"
1631563433-4492,https://www.officedepot.com/a/browse/stools/N=5+593070/,"LumiSource Grotto Bar Stools, Walnut/Brown, Set Of 2 Stools"
1631563433-3778,https://www.officedepot.com/a/browse/stools/N=5+593070/,"LumiSource Elisa Counter Stools, Gray Seat/White Washed Frame, Set Of 2 Stools0.0 out of 5 stars."
1631563433-4069,https://www.officedepot.com/a/browse/stools/N=5+593070/,"National Public Seating 6400B-10 Stationary Stools With Backrests, 18""H, Black, ...0.0 out of 5 stars."
1631563433-3873,https://www.officedepot.com/a/browse/stools/N=5+593070/,"LumiSource Masters Bar Stool, Black/Gray0.0 out of 5 stars."
1631563433-4440,https://www.officedepot.com/a/browse/stools/N=5+593070/,"LumiSource Marcel Counter Stools, Chrome/Navy Blue, Set Of 2 Stools"
1631563433-4080,https://www.officedepot.com/a/browse/stools/N=5+593070/,"Linon Tempest Stool, Gold/Light Green0.0 out of 5 stars."
1631563433-3207,https://www.officedepot.com/a/browse/stools/N=5+593070/,"LumiSource Fuji Stacker Counter Stools, White Seat/Antique Frame, Set Of 2 Stool...0.0 out of 5 stars."
1631563433-3534,https://www.officedepot.com/a/browse/stools/N=5+593070/,"Flash Furniture Contemporary Adjustable Fabric Bar Stool, Gray/Blue4.0 out of 5 stars. 1 review"
1631563433-4423,https://www.officedepot.com/a/browse/stools/N=5+593070/,"LumiSource Cosini Counter Stools, Walnut/Cream, Set Of 2 Stools"
1631563433-4890,https://www.officedepot.com/a/browse/stools/N=5+593070/,"Zuo® Modern Bree Barstools, Burgundy/Gold, Set Of 2"
1631563433-4174,https://www.officedepot.com/a/browse/stools/N=5+593070/,"LumiSource Symphony Counter Stools, Walnut/Black, Set Of 2 Stools0.0 out of 5 stars."
1631563433-4772,https://www.officedepot.com/a/browse/stools/N=5+593070/,"Safco® Bosk Stool, Beech/Chrome"
1631563433-4859,https://www.officedepot.com/a/browse/stools/N=5+593070/,"Zuo Modern® Wire Counter Chairs, Chrome, Set Of 2 Chairs"
1631563433-3638,https://www.officedepot.com/a/browse/stools/N=5+593070/,"LumiSource Fabrico Counter Stools, Blue Seat/Walnut Frame/Silver Round Footrest,...0.0 out of 5 stars."
1631563433-2230,https://www.officedepot.com/a/browse/stools/N=5+593070/,"OFM Mesh Comfort Series Ergonomic Fabric Task Chair With Arms And Drafting Kit, ..."
1631563433-4406,https://www.officedepot.com/a/browse/stools/N=5+593070/,"Baxton Studio Jason Bar Stools, Walnut/Gray, Set Of 2 Stools0.0 out of 5 stars."
1631563433-4597,https://www.officedepot.com/a/browse/stools/N=5+593070/,"Powell Zerner Backless Counter Stools, White, Set Of 2 Stools"
1631563433-4271,https://www.officedepot.com/a/browse/stools/N=5+593070/,"National Public Seating Vinyl-Padded Stool, 18""H, Gray0.0 out of 5 stars."
1631563433-2912,https://www.officedepot.com/a/browse/stools/N=5+593070/,"LumiSource Corazza Mid-Century Modern Counter Stool, Walnut/Orange0.0 out of 5 stars."
1631563433-3795,https://www.officedepot.com/a/browse/stools/N=5+593070/,"LumiSource Velvet Fuji Stacker Bar Stools, Silver/Blue, Set Of 2 Stools0.0 out of 5 stars."
1631563433-4097,https://www.officedepot.com/a/browse/stools/N=5+593070/,"LumiSource Fuji Stackable Bar Stools, Bronze/Black, Set Of 2 Stools0.0 out of 5 stars."
1631563433-3062,https://www.officedepot.com/a/browse/stools/N=5+593070/,"KFI Studios Jive Low-Back Bar Stool, Tuxedo/White0.0 out of 5 stars."
1631563433-4478,https://www.officedepot.com/a/browse/stools/N=5+593070/,"Monarch Specialties Hydraulic-Lift Bar Stool, Bonded Leather, Black"
1631563433-4515,https://www.officedepot.com/a/browse/stools/N=5+593070/,"Monarch Specialties Ariel Swivel Barstools, Gray/White, Set Of 2 Barstools"
1631563433-2969,https://www.officedepot.com/a/browse/stools/N=5+593070/,"LumiSource Lana Contemporary Counter Stools, Black/Blue, Set Of 2 Stools0.0 out of 5 stars."
1631563433-3366,https://www.officedepot.com/a/browse/stools/N=5+593070/,"Monarch Specialties Bar Stools, Black/Chrome, Set Of 20.0 out of 5 stars."
1631563433-4172,https://www.officedepot.com/a/browse/stools/N=5+593070/,"Linon Walker Backless Bar Stool, Rustic Dark Brown/Gray5.0 out of 5 stars. 1 review"
1631563433-2336,https://www.officedepot.com/a/browse/stools/N=5+593070/,"Linon Home Decor Products Dayton 30"" Bar Stool, Black/Dark Brown0.0 out of 5 stars."
1631563433-4637,https://www.officedepot.com/a/browse/stools/N=5+593070/,"DHP Nova Metal Mesh Backless Bar Stool, White"
1631563433-4712,https://www.officedepot.com/a/browse/stools/N=5+593070/,"Linon Rockford Backless Counter Stool, Black"
1631563433-4891,https://www.officedepot.com/a/browse/stools/N=5+593070/,"Flash Furniture Vibrant Drafting Stool, Deep Blue/Chrome"
1631563433-4817,https://www.officedepot.com/a/browse/stools/N=5+593070/,"Powell® Home Fashions Metal Quilted PU Bar Stool, Black/Chrome"
1631563433-4580,https://www.officedepot.com/a/browse/stools/N=5+593070/,"Safco® Extended Drafting Stool, Black"
1631563433-2556,https://www.officedepot.com/a/browse/stools/N=5+593070/,"Flash Furniture Ergonomic Mesh Mid-Back Drafting Chair, Black4.0 out of 5 stars. 2 reviews"
1631563433-4315,https://www.officedepot.com/a/browse/stools/N=5+593070/,"Flash Furniture Contemporary Adjustable Bar Stool, Brown5.0 out of 5 stars. 1 review"
1631563433-2610,https://www.officedepot.com/a/browse/stools/N=5+593070/,"LumiSource Canary Contemporary Counter Stools, Gold/Black, Set Of 2 Stools0.0 out of 5 stars."
1631563433-3779,https://www.officedepot.com/a/browse/stools/N=5+593070/,"Linon Home Décor Products Walton Bar Stool, Sapele/Red0.0 out of 5 stars."
1631563433-3698,https://www.officedepot.com/a/browse/stools/N=5+593070/,"Zuo® Modern Bree Counter Stools, Black/Gold, Set Of 20.0 out of 5 stars."
1631563433-3489,https://www.officedepot.com/a/browse/stools/N=5+593070/,"National Public Seating Café Time Barstool, Charcoal Slate/Silver0.0 out of 5 stars."
1631563433-2299,https://www.officedepot.com/a/browse/stools/N=5+593070/,"Allermuir Lyft Task Stool, Black"
1631563433-3296,https://www.officedepot.com/a/browse/stools/N=5+593070/,"Linon Walker Counter Stool, White0.0 out of 5 stars."
1631563433-4742,https://www.officedepot.com/a/browse/stools/N=5+593070/,"Linon Conner Counter Stool With Backrest, 26""H Seat, Beige/Gray Wash"
1631563433-3376,https://www.officedepot.com/a/browse/stools/N=5+593070/,"LumiSource Oregon Low-Back Bar Stools, Antique/Espresso, Set Of 2 Stools0.0 out of 5 stars."
1631563433-4359,https://www.officedepot.com/a/browse/stools/N=5+593070/,"LumiSource Fuji Stacker Counter Stools, Blue Seat/Stainless-Steel Frame, Set Of ...0.0 out of 5 stars."
1631563433-3485,https://www.officedepot.com/a/browse/stools/N=5+593070/,"Boss Medical Stool With Back, 27""H x 17""W x 25""D, Beige/Chrome4.8 out of 5 stars. 6 reviews"
1631563433-4782,https://www.officedepot.com/a/browse/stools/N=5+593070/,"Powell Mabon Backless Swivel Counter Stool, White/Natural Sea Grass"
1631563433-4757,https://www.officedepot.com/a/browse/stools/N=5+593070/,"Flash Furniture Mesh Mid-Back Drafting Chair, Gray/Black"
1631563433-3405,https://www.officedepot.com/a/browse/stools/N=5+593070/,"Flash Furniture Commercial-Grade Vertical Slat Back Counter Stool, Silver4.8 out of 5 stars. 30 reviews"
1631563433-2403,https://www.officedepot.com/a/browse/stools/N=5+593070/,"Linon Home Decor Products Franklin Bar Stool, Dark Red/Espresso3.6 out of 5 stars. 5 reviews"
1631563433-4668,https://www.officedepot.com/a/browse/stools/N=5+593070/,"Glamour Home Aled Bar Stools, Gray/Antique Wood, Set Of 2 Stools"
1631563433-3134,https://www.officedepot.com/a/browse/stools/N=5+593070/,"Alera Height-Adjustable Utility Task Stool, Black Seat/Chrome Frame, Quantity: 15.0 out of 5 stars. 1 review"
1631563433-2575,https://www.officedepot.com/a/browse/stools/N=5+593070/,"Flash Furniture Vibrant Tractor Seat Stool, Black/Chrome5.0 out of 5 stars. 1 review"
1631563433-3123,https://www.officedepot.com/a/browse/stools/N=5+593070/,"Boss Medical Stool With Back And Foot Ring, 47""H x 25""W x 25""D, Beige/Chrome4.0 out of 5 stars. 1 review"
1631563433-4547,https://www.officedepot.com/a/browse/stools/N=5+593070/,"Flash Furniture 30"" Metal Indoor Bar Stools, Set Of 4 Bar Stools, Silver"
1631563433-3651,https://www.officedepot.com/a/browse/stools/N=5+593070/,"LumiSource Symphony Counter Stools, Light Gray/Black, Set Of 2 Stools0.0 out of 5 stars."
1631563433-2986,https://www.officedepot.com/a/browse/stools/N=5+593070/,"LumiSource Fuji Stackable Bar Stools, Gold/Gray, Set Of 2 Stools0.0 out of 5 stars."
1631563433-4208,https://www.officedepot.com/a/browse/stools/N=5+593070/,"Global® File Buddy Pneumatic Swivel Task Stool, Black Seat/Black Frame, Quantity...0.0 out of 5 stars."
1631563433-3973,https://www.officedepot.com/a/browse/stools/N=5+593070/,"Safco® Task Master® Economy Workbench Task Stool, Black0.0 out of 5 stars."
1631563433-3480,https://www.officedepot.com/a/browse/stools/N=5+593070/,"LumiSource Trilogy Bar Stools, Walnut/Cream, Set Of 2 Stools0.0 out of 5 stars."
1631563433-4884,https://www.officedepot.com/a/browse/stools/N=5+593070/,"Safco® Steel Guest Bistro Stool, White"
1631563433-2808,https://www.officedepot.com/a/browse/stools/N=5+593070/,"LumiSource Trevi Counter Stools, Walnut/Green, Set Of 2 Stools0.0 out of 5 stars."
1631563433-4900,https://www.officedepot.com/a/browse/stools/N=5+593070/,"LumiSource Fuji Stacker Counter Stools, White Seat/Gold Frame, Set Of 2 Stools"
1631563433-3743,https://www.officedepot.com/a/browse/stools/N=5+593070/,"LumiSource Toriano Counter Stools, Walnut/Blue, Set Of 2 Stools0.0 out of 5 stars."
1631563433-4065,https://www.officedepot.com/a/browse/stools/N=5+593070/,"LumiSource Fuji Stacker Bar Stools, Antique/Gray, Set Of 2 Stools0.0 out of 5 stars."
1631563433-2668,https://www.officedepot.com/a/browse/stools/N=5+593070/,"Baxton Studio Catherine Bar Stools, Tan, Pack of 40.0 out of 5 stars."
1631563433-4421,https://www.officedepot.com/a/browse/stools/N=5+593070/,"LumiSource Marcel Contemporary Glam Counter Stools, White/Gold, Set Of 2 Stools"
1631563433-2633,https://www.officedepot.com/a/browse/stools/N=5+593070/,"Linon Home Décor Products Jandrell Bar Stool, Black & White Cow/Black0.0 out of 5 stars."
1631563433-2245,https://www.officedepot.com/a/browse/stools/N=5+593070/,Flash Furniture Ergonomic Mesh Mid-Back Drafting Chair With Adjustable Foot Ring...
1631563433-3281,https://www.officedepot.com/a/browse/stools/N=5+593070/,"LumiSource Serena Mid-Century Modern Barstool, Gray/Chrome0.0 out of 5 stars."
1631563433-2394,https://www.officedepot.com/a/browse/stools/N=5+593070/,"Linon Home Decor Products Franklin Counter Stool, Espresso0.0 out of 5 stars."
1631563433-3833,https://www.officedepot.com/a/browse/stools/N=5+593070/,"OFM 161 Collection Mid-Century Modern Bentwood Swivel Stool, Walnut/Ivory0.0 out of 5 stars."
1631563433-3278,https://www.officedepot.com/a/browse/stools/N=5+593070/,"Space Seating Deluxe AirGrid Mid-Back Drafting Chair, Gray0.0 out of 5 stars."
1631563433-4185,https://www.officedepot.com/a/browse/stools/N=5+593070/,"Powell Mabon Backless Swivel Bar Stool, Brown/Natural Sea Grass0.0 out of 5 stars."
1631563433-2829,https://www.officedepot.com/a/browse/stools/N=5+593070/,"LumiSource Rhonda Counter Stools, Gold/Blue, Set Of 2 Stools0.0 out of 5 stars."
1631563433-3197,https://www.officedepot.com/a/browse/stools/N=5+593070/,"LumiSource Upholstered Boyne Bar Stool, Black/Dark Gray0.0 out of 5 stars."
1631563433-4739,https://www.officedepot.com/a/browse/stools/N=5+593070/,"Linon Home Décor Products Walker Counter Stool, Black"
1631563433-3893,https://www.officedepot.com/a/browse/stools/N=5+593070/,"DHP Wexford Swivel Bar Stool, White/Stainless Steel0.0 out of 5 stars."
1631563433-2329,https://www.officedepot.com/a/browse/stools/N=5+593070/,"New Ridge Home Goods Julian Faux Leather Counter Stool, Black/Espresso"
1631563433-4260,https://www.officedepot.com/a/browse/stools/N=5+593070/,"Ave Six Austin Barstool, Klein Azure/Mocha/Antique Bronze0.0 out of 5 stars."
1631563433-4646,https://www.officedepot.com/a/browse/stools/N=5+593070/,"Linon Home Décor Products Williams Saddle Task Stool, Dark Brown Seat/Dark Brown..."
1631563433-4713,https://www.officedepot.com/a/browse/stools/N=5+593070/,"Zuo Modern Elio Bar Chairs, Gunmetal, Set Of 2 Chairs"
1631563433-4473,https://www.officedepot.com/a/browse/stools/N=5+593070/,"Baxton Studio Kaelin Bar Stools, Rose Gold/Gray, Set Of 4 Stools"
1631563433-3092,https://www.officedepot.com/a/browse/stools/N=5+593070/,"LumiSource Cosmo Counter Stools, Black Seat/Walnut Frame0.0 out of 5 stars."
1631563433-2486,https://www.officedepot.com/a/browse/stools/N=5+593070/,"Boss Office Products Oversized Armless Drafting Stool, Black4.0 out of 5 stars. 1 review"
1631563433-3068,https://www.officedepot.com/a/browse/stools/N=5+593070/,"National Public Seating 6800 Height-Adjustable Swivel Stool, Black/Gray0.0 out of 5 stars."
1631563433-2305,https://www.officedepot.com/a/browse/stools/N=5+593070/,"HON® Solve Task Stool, Ink/Black"
1631563433-4746,https://www.officedepot.com/a/browse/stools/N=5+593070/,"Glamour Home Aleco Counter-Height Stools, Gray/Antique Wood, Set Of 2 Stools"
1631563433-3930,https://www.officedepot.com/a/browse/stools/N=5+593070/,"Iceberg CaféWorks Bistro Stool, Graphite/Silver0.0 out of 5 stars."
1631563433-2261,https://www.officedepot.com/a/browse/stools/N=5+593070/,null
1631563433-4487,https://www.officedepot.com/a/browse/stools/N=5+593070/,"LumiSource Oracle Counter Stool, Walnut/Cream"
1631563433-4194,https://www.officedepot.com/a/browse/stools/N=5+593070/,"Zuo Modern® Reykjavik Chairs, Pea/Chrome, Pack Of 2 Chairs0.0 out of 5 stars."
1631563433-4131,https://www.officedepot.com/a/browse/stools/N=5+593070/,"LumiSource Gardenia Mid-Century Modern Counter Stools, Walnut/Orange, Set Of 2 S...0.0 out of 5 stars."
1631563433-2492,https://www.officedepot.com/a/browse/stools/N=5+593070/,"Linon Walton Bar Stool, Black/Dove Gray0.0 out of 5 stars."
1631563433-4858,https://www.officedepot.com/a/browse/stools/N=5+593070/,"LumiSource Matisse Counter Stools, Gold/Blue, Set Of 2 Stools"
1631563433-3552,https://www.officedepot.com/a/browse/stools/N=5+593070/,"LumiSource Fuji Stacker Counter Stools, Green Seat/Gold Frame, Set Of 2 Stools0.0 out of 5 stars."
1631563433-4723,https://www.officedepot.com/a/browse/stools/N=5+593070/,"Boss Office Products Dot Stool, Gray/Black"
1631563433-3410,https://www.officedepot.com/a/browse/stools/N=5+593070/,"Office Star™ Preston Counter Stools, Marlow Charcoal, Set Of 2 Stools0.0 out of 5 stars."
1631563433-3245,https://www.officedepot.com/a/browse/stools/N=5+593070/,"Baxton Studio Reneau Counter Stools, Gray/Walnut, Set Of 2 Stools0.0 out of 5 stars."
