web-scraper-order,web-scraper-start-url,nnn
1631563433-2440,https://www.officedepot.com/a/browse/stools/N=5+593070/,"Flash Furniture Contemporary Mid-Back Adjustable Bar Stool, Chrome/Black0.0 out of 5 stars."
1631563433-2450,https://www.officedepot.com/a/browse/stools/N=5+593070/,"HON® Torch Mesh Mid-Back Task Stool, Black Seat, Quantity: 12.0 out of 5 stars. 1 review"
1631563433-4552,https://www.officedepot.com/a/browse/stools/N=5+593070/,"Powell Cagney Swivel Bar Stool, Brown/Rustic Oak"
1631563433-2376,https://www.officedepot.com/a/browse/stools/N=5+593070/,"Glamour Home Agalia Bar Stools, Chrome/Cream, Set Of 2 Stools5.0 out of 5 stars. 1 review"
1631563433-4465,https://www.officedepot.com/a/browse/stools/N=5+593070/,"Powell Gemway Big And Tall Counter Stool, Whitewash Natural"
1631563433-4701,https://www.officedepot.com/a/browse/stools/N=5+593070/,"National Public Seating Adjustable Vinyl-Padded Stools, 25 - 32 1/2""H, Gray, Set..."
1631563433-2410,https://www.officedepot.com/a/browse/stools/N=5+593070/,"Linon Home Decor Products Franklin 30"" Bar Stool, Espresso0.0 out of 5 stars."
1631563433-4663,https://www.officedepot.com/a/browse/stools/N=5+593070/,"Linon Home Décor Products Baker Bar Stool, Lava/Brown"
1631563433-3371,https://www.officedepot.com/a/browse/stools/N=5+593070/,"Zuo Modern Dresden Bar Chair, Black0.0 out of 5 stars."
1631563433-4862,https://www.officedepot.com/a/browse/stools/N=5+593070/,"LumiSource Marcel Contemporary Glam Counter Stools, Black/Gold, Set Of 2 Stools"
1631563433-3223,https://www.officedepot.com/a/browse/stools/N=5+593070/,"Linon Home Décor Products Everett Bar Stool, Neutral/Blue0.0 out of 5 stars."
1631563433-2433,https://www.officedepot.com/a/browse/stools/N=5+593070/,"Safco® Vue™ Mesh Extended Height Chair, Black3.7 out of 5 stars. 3 reviews"
1631563433-3648,https://www.officedepot.com/a/browse/stools/N=5+593070/,"Flash Furniture 24""H Commercial-Grade Metal Backless Counter Stool, Red5.0 out of 5 stars. 4 reviews"
1631563433-4679,https://www.officedepot.com/a/browse/stools/N=5+593070/,"LumiSource Marcel Contemporary Counter Stools, Chrome/Brown, Set Of 2 Stools"
1631563433-3055,https://www.officedepot.com/a/browse/stools/N=5+593070/,"LumiSource Velvet Fuji Stacker Bar Stools, Silver/Green, Set Of 2 Stools0.0 out of 5 stars."
1631563433-4250,https://www.officedepot.com/a/browse/stools/N=5+593070/,"Flash Furniture HERCULES Big And Tall Leather Drafting Chair, Black0.0 out of 5 stars."
1631563433-4802,https://www.officedepot.com/a/browse/stools/N=5+593070/,"Glamour Home Anya Bar Stools, Blue/Golden, Set Of 2 Stools"
1631563433-2489,https://www.officedepot.com/a/browse/stools/N=5+593070/,"Flash Furniture Mid-Back Mesh Ergonomic Drafting Chair, Red3.0 out of 5 stars. 2 reviews"
1631563433-2762,https://www.officedepot.com/a/browse/stools/N=5+593070/,"Inval Rimax Bar Stools, Espresso, Set Of 2 Stools0.0 out of 5 stars."
1631563433-4488,https://www.officedepot.com/a/browse/stools/N=5+593070/,"Linon Mantell Adjustable Stool, Matte Chrome/Brown"
1631563433-4864,https://www.officedepot.com/a/browse/stools/N=5+593070/,"Safco® Twixt® Active Seating Chair, Desk Height, Black"
1631563433-4144,https://www.officedepot.com/a/browse/stools/N=5+593070/,"New Ridge Home Goods Zoey Bar Stool, White0.0 out of 5 stars."
1631563433-3934,https://www.officedepot.com/a/browse/stools/N=5+593070/,"LumiSource Pebble Counter Stools, Walnut/Blue, Set Of 2 Stools0.0 out of 5 stars."
1631563433-2259,https://www.officedepot.com/a/browse/stools/N=5+593070/,"Flash Furniture Ergonomic Mesh Mid-Back Drafting Chair, Dark Gray"
1631563433-2660,https://www.officedepot.com/a/browse/stools/N=5+593070/,"National Public Seating 6400 Adjustable Vinyl Task Stool, Black Seat/Black Frame0.0 out of 5 stars."
1631563433-3840,https://www.officedepot.com/a/browse/stools/N=5+593070/,"Linon Mantell Adjustable Stool, Matte Gold/Brown0.0 out of 5 stars."
1631563433-3596,https://www.officedepot.com/a/browse/stools/N=5+593070/,"LumiSource Gianna Counter Stools, Walnut/Light Gray, Set Of 2 Stools0.0 out of 5 stars."
1631563433-3887,https://www.officedepot.com/a/browse/stools/N=5+593070/,"LumiSource Vasari Bar Stool, Walnut/Black/Chrome0.0 out of 5 stars."
1631563433-4340,https://www.officedepot.com/a/browse/stools/N=5+593070/,"National Public Seating Adjustable Hardboard Stools With Backs, 25""-33""H, Gray, ...0.0 out of 5 stars."
1631563433-2478,https://www.officedepot.com/a/browse/stools/N=5+593070/,"Powell Vinessa Counter Stool, Rustic Umber/Brown0.0 out of 5 stars."
1631563433-2961,https://www.officedepot.com/a/browse/stools/N=5+593070/,"Safco® Steel Bar Stool, White0.0 out of 5 stars."
1631563433-3886,https://www.officedepot.com/a/browse/stools/N=5+593070/,"Baxton Studio Lenoir Counter Stools, Gray/Walnut, Set Of 2 Stools0.0 out of 5 stars."
1631563433-4850,https://www.officedepot.com/a/browse/stools/N=5+593070/,"National Public Seating Adjustable Hardboard Stools, 31.5 - 38.5""H, Gray, Set of..."
1631563433-3630,https://www.officedepot.com/a/browse/stools/N=5+593070/,"LumiSource Symphony Counter Stools, Walnut/Cream, Set Of 2 Stools0.0 out of 5 stars."
1631563433-3521,https://www.officedepot.com/a/browse/stools/N=5+593070/,"Linon Home Décor Products Walker Backless Counter Stool, Gray/Black0.0 out of 5 stars."
1631563433-2224,https://www.officedepot.com/a/browse/stools/N=5+593070/,"Office Star™ Deluxe Mesh-Back Drafting Chair With Foot Ring, Black"
1631563433-3274,https://www.officedepot.com/a/browse/stools/N=5+593070/,"Glamour Home Adel Bar Stools, Gray/Dark Brown, Set Of 2 Stools0.0 out of 5 stars."
1631563433-3190,https://www.officedepot.com/a/browse/stools/N=5+593070/,"Linon Home Decor Products Pullman Craftsman Bar Stool, Dark Cherry/Dark Brown0.0 out of 5 stars."
1631563433-3343,https://www.officedepot.com/a/browse/stools/N=5+593070/,"Glamour Home Amery Bar Stools, Black/Brown, Set Of 2 Stools0.0 out of 5 stars."
1631563433-3474,https://www.officedepot.com/a/browse/stools/N=5+593070/,"National Public Seating Vinyl Padded Stools, 24""H, Black, Set of 40.0 out of 5 stars."
1631563433-3789,https://www.officedepot.com/a/browse/stools/N=5+593070/,"LumiSource Upholstered Boyne Bar Stool, Black/Light Gray0.0 out of 5 stars."
1631563433-4760,https://www.officedepot.com/a/browse/stools/N=5+593070/,"National Public Seating Adjustable Vinyl-Padded Stools With Backs, 38 - 47 1/2""H..."
1631563433-4807,https://www.officedepot.com/a/browse/stools/N=5+593070/,"Powell Mabon Backless Swivel Counter Stool, Navy/Natural"
1631563433-3981,https://www.officedepot.com/a/browse/stools/N=5+593070/,"Linon Hoffman Metal Bar Stools, Cherry/Silver, Set Of 2 Stools0.0 out of 5 stars."
1631563433-3974,https://www.officedepot.com/a/browse/stools/N=5+593070/,"LumiSource Cosi Bar Stool, Gray Faux Leather Seat/Chrome/Walnut Wood Frame0.0 out of 5 stars."
1631563433-4633,https://www.officedepot.com/a/browse/stools/N=5+593070/,"Powell® Home Fashions Thin-Seat Adjustable-Height Bar Stool, Black/Chrome"
1631563433-4571,https://www.officedepot.com/a/browse/stools/N=5+593070/,"LumiSource Daniella Bar Stool, Light Gray Seat/Chrome Frame"
1631563433-3435,https://www.officedepot.com/a/browse/stools/N=5+593070/,"Lorell® Metal Stool, 26""H, Lime, Set Of 20.0 out of 5 stars."
1631563433-4380,https://www.officedepot.com/a/browse/stools/N=5+593070/,"Baxton Studio Catherine Bar Stools, Gray/Walnut, Set Of 4 Stools0.0 out of 5 stars."
1631563433-2344,https://www.officedepot.com/a/browse/stools/N=5+593070/,Flash Furniture Contemporary Adjustable Height Swivel Bar Stool With Support Pil...0.0 out of 5 stars.
1631563433-2517,https://www.officedepot.com/a/browse/stools/N=5+593070/,"Linon Walker Backless Bar Stool, Black/Gray5.0 out of 5 stars. 1 review"
1631563433-2717,https://www.officedepot.com/a/browse/stools/N=5+593070/,"Flash Furniture 24"" Metal Counter-Height Bar Stools, Set Of 4 Bar Stools, Teal5.0 out of 5 stars. 1 review"
1631563433-3209,https://www.officedepot.com/a/browse/stools/N=5+593070/,"LumiSource Matisse Faux Leather Counter Stools, Black/Chrome, Set Of 2 Stools0.0 out of 5 stars."
1631563433-4189,https://www.officedepot.com/a/browse/stools/N=5+593070/,"LumiSource Fuji Contemporary Counter Stools, Gold/Black, Set Of 2 Stools0.0 out of 5 stars."
1631563433-3073,https://www.officedepot.com/a/browse/stools/N=5+593070/,"LumiSource Cosmo Counter Stools, Gray Seat/Walnut Frame0.0 out of 5 stars."
1631563433-2334,https://www.officedepot.com/a/browse/stools/N=5+593070/,"Office Star™ Sunnydale Fabric Mid-Back Office Chair, Basil5.0 out of 5 stars. 2 reviews"
1631563433-4237,https://www.officedepot.com/a/browse/stools/N=5+593070/,"Koplus Switch Fabric Drafting Chair, Midnight Black0.0 out of 5 stars."
1631563433-2363,https://www.officedepot.com/a/browse/stools/N=5+593070/,"HON® ValuTask Low-Back Task Stool, Black Seat/Black/Chrome Frame, Quantity: 13.4 out of 5 stars. 5 reviews"
1631563433-3889,https://www.officedepot.com/a/browse/stools/N=5+593070/,"LumiSource Margarite Bar Stools, Black/Cream, Set Of 2 Stools0.0 out of 5 stars."
1631563433-4493,https://www.officedepot.com/a/browse/stools/N=5+593070/,"Baxton Studio Carson Bar Stools With Backs, Gray/Espresso, Set Of 2 Bar Stools"
1631563433-4774,https://www.officedepot.com/a/browse/stools/N=5+593070/,"Zuo Modern® Lids Counter Stools, Green/Brushed Steel, Set Of 2 Stools"
1631563433-2673,https://www.officedepot.com/a/browse/stools/N=5+593070/,"LumiSource Matisse Fabric Counter Stools, Gold/Cream, Set Of 2 Stools0.0 out of 5 stars."
1631563433-2662,https://www.officedepot.com/a/browse/stools/N=5+593070/,"LumiSource Emery Bar Stools, Black, Set Of 2 Stools0.0 out of 5 stars."
1631563433-3377,https://www.officedepot.com/a/browse/stools/N=5+593070/,"Office Star™ Deluxe AirGrid Mesh Mid-Back Chair, Black0.0 out of 5 stars."
1631563433-2979,https://www.officedepot.com/a/browse/stools/N=5+593070/,"Powell® Home Fashions Metal Quilted PU Bar Stool, White/Chrome0.0 out of 5 stars."
1631563433-3138,https://www.officedepot.com/a/browse/stools/N=5+593070/,"LumiSource Trevi Counter Stools, Walnut/Orange, Set Of 2 Stools0.0 out of 5 stars."
1631563433-4228,https://www.officedepot.com/a/browse/stools/N=5+593070/,"Linon Jordan Metal Bar Stool, Brown0.0 out of 5 stars."
1631563433-2881,https://www.officedepot.com/a/browse/stools/N=5+593070/,"Baxton Studio Alexandra Bar Stools, Espresso Brown/Sand, Pack Of 2 Stools0.0 out of 5 stars."
1631563433-2727,https://www.officedepot.com/a/browse/stools/N=5+593070/,"Office Star™ Sunnydale Fabric Mid-Back Office Chair, Fog0.0 out of 5 stars."
1631563433-4634,https://www.officedepot.com/a/browse/stools/N=5+593070/,"Linon Charlotte Counter Stool, Black/Glitz Crystal"
1631563433-2377,https://www.officedepot.com/a/browse/stools/N=5+593070/,"New Ridge Home Goods Julian Faux Leather Counter Stool, Black/Espresso0.0 out of 5 stars."
1631563433-4716,https://www.officedepot.com/a/browse/stools/N=5+593070/,"Powell® Saddle Counter Stool, Honey Brown"
1631563433-4843,https://www.officedepot.com/a/browse/stools/N=5+593070/,"LumiSource Fuji DLX Counter Stools, White Seat/Antique Frame, Set Of 2 Stools"
1631563433-4279,https://www.officedepot.com/a/browse/stools/N=5+593070/,"LumiSource Fuji Stacker Counter Stools, Gray Seat/Stainless Steel Frame, Set of ...0.0 out of 5 stars."
1631563433-3409,https://www.officedepot.com/a/browse/stools/N=5+593070/,"Linon Jandrell Backless Counter Stool, Gray/Walnut0.0 out of 5 stars."
1631563433-3781,https://www.officedepot.com/a/browse/stools/N=5+593070/,"LumiSource Marla Vanity Stool, Chrome/Silver0.0 out of 5 stars."
1631563433-3569,https://www.officedepot.com/a/browse/stools/N=5+593070/,"LumiSource Fuji Stacker Contemporary Counter Stools, Brown Cowboy Seat/Black Fra...0.0 out of 5 stars."
1631563433-3799,https://www.officedepot.com/a/browse/stools/N=5+593070/,"Linon Home Décor Products Lana Bar Stool, Neutral/Brown0.0 out of 5 stars."
1631563433-3860,https://www.officedepot.com/a/browse/stools/N=5+593070/,"LumiSource Matisse Counter Stools, Gold/Silver, Set Of 2 Stools0.0 out of 5 stars."
1631563433-2743,https://www.officedepot.com/a/browse/stools/N=5+593070/,"Zuo Modern® Tangiers Counter Chairs, White/Black, Pack Of 2 Chairs0.0 out of 5 stars."
1631563433-3704,https://www.officedepot.com/a/browse/stools/N=5+593070/,"LumiSource Maya Bar Stool, Chrome/Walnut/Cream0.0 out of 5 stars."
1631563433-3933,https://www.officedepot.com/a/browse/stools/N=5+593070/,"Powell Edina Big & Tall Swivel Counter Stool, Gray/Matte Black1.0 out of 5 stars. 1 review"
1631563433-4578,https://www.officedepot.com/a/browse/stools/N=5+593070/,"Boss Mesh Drafting Stool, Black"
1631563433-2352,https://www.officedepot.com/a/browse/stools/N=5+593070/,"Linon Home Décor Products Alice Bar Stool, Brown0.0 out of 5 stars."
1631563433-4624,https://www.officedepot.com/a/browse/stools/N=5+593070/,"LumiSource Fuji Stacker Bar Stools, Espresso Bamboo Seat/Antique Metal Frame, Se..."
1631563433-3993,https://www.officedepot.com/a/browse/stools/N=5+593070/,"Office Star Versailles Velvet Mid-Back Office Chair, Rose/Chrome0.0 out of 5 stars."
1631563433-2596,https://www.officedepot.com/a/browse/stools/N=5+593070/,"Flash Furniture HERCULES Big And Tall Fabric Drafting Chair, Black3.0 out of 5 stars. 1 review"
1631563433-3087,https://www.officedepot.com/a/browse/stools/N=5+593070/,"LumiSource Cecina Bar Stools, Walnut/Brown, Set Of 2 Stools0.0 out of 5 stars."
1631563433-2287,https://www.officedepot.com/a/browse/stools/N=5+593070/,"Bush Business Furniture Accord Drafting Stool With Chrome Foot Ring, Black Fabri..."
1631563433-2365,https://www.officedepot.com/a/browse/stools/N=5+593070/,"Vari Drafting Chair, Black1.0 out of 5 stars. 1 review"
1631563433-3093,https://www.officedepot.com/a/browse/stools/N=5+593070/,"Safco® Fidget Active Stool, 14"", Black0.0 out of 5 stars."
1631563433-2537,https://www.officedepot.com/a/browse/stools/N=5+593070/,"HON® ComforTask Stool, 26-7/8""W x 30""D x 49-7/8, Navy0.0 out of 5 stars."
1631563433-3206,https://www.officedepot.com/a/browse/stools/N=5+593070/,"Safco® Swivel Keg Stool, Black0.0 out of 5 stars."
1631563433-4896,https://www.officedepot.com/a/browse/stools/N=5+593070/,"Safco® Steel Bar Stool, Baby Blue"
1631563433-3676,https://www.officedepot.com/a/browse/stools/N=5+593070/,"Zuo Modern® Piccolo Counter Chair, Green/Black0.0 out of 5 stars."
1631563433-2685,https://www.officedepot.com/a/browse/stools/N=5+593070/,"LumiSource Pebble Bar Stools, Walnut/Light Gray, Set Of 2 Stools0.0 out of 5 stars."
1631563433-3671,https://www.officedepot.com/a/browse/stools/N=5+593070/,"Linon Home Décor Products Everett Bar Stool, Backless, Neutral/Rustic Black0.0 out of 5 stars."
1631563433-2584,https://www.officedepot.com/a/browse/stools/N=5+593070/,"Glamour Home Amery Bar Stools, Black/Cappuccino, Set Of 2 Stools0.0 out of 5 stars."
1631563433-4542,https://www.officedepot.com/a/browse/stools/N=5+593070/,"Flash Furniture Commercial-Grade 24""H Distressed Indoor/Outdoor Metal Bar Stools..."
1631563433-4518,https://www.officedepot.com/a/browse/stools/N=5+593070/,"Flash Furniture Bentwood 3-Slot Cutout Adjustable Bar Stool, Walnut/Black"
1631563433-4595,https://www.officedepot.com/a/browse/stools/N=5+593070/,"OFM 161 Collection Mid-Century Modern Low-Back Bentwood Frame Swivel-Seat Stool,..."
1631563433-2813,https://www.officedepot.com/a/browse/stools/N=5+593070/,"LumiSource Toriano Counter Stools, Blue/Walnut, Set Of 2 Stools0.0 out of 5 stars."
1631563433-3212,https://www.officedepot.com/a/browse/stools/N=5+593070/,"LumiSource Cecina Mid-Century Modern Counter Stools, Walnut/Brown, Set Of 2 Stoo...0.0 out of 5 stars."
1631563433-2950,https://www.officedepot.com/a/browse/stools/N=5+593070/,"DHP Luxor Metal Counter Stool, Charcoal, Set Of 20.0 out of 5 stars."
1631563433-3005,https://www.officedepot.com/a/browse/stools/N=5+593070/,"Linon Home Décor Products Franklin Counter Stool, Dove Gray/Black0.0 out of 5 stars."
1631563433-4868,https://www.officedepot.com/a/browse/stools/N=5+593070/,"Linon Hendry Counter Stool, Black/Agean Blue"
1631563433-3507,https://www.officedepot.com/a/browse/stools/N=5+593070/,"Zuo Modern® Wedge Bar Stools, Black/Chrome, Set Of 2 Stools0.0 out of 5 stars."
1631563433-4572,https://www.officedepot.com/a/browse/stools/N=5+593070/,"Powell® Home Fashions Hamilton Bar Stool, Tan/Pewter"
1631563433-3161,https://www.officedepot.com/a/browse/stools/N=5+593070/,"Flash Furniture 24""H Commercial-Grade Metal Backless Counter Stool, White5.0 out of 5 stars. 5 reviews"
1631563433-3753,https://www.officedepot.com/a/browse/stools/N=5+593070/,"Baxton Studio Violet Counter Stools, Gray/Walnut, Set Of 2 Stools0.0 out of 5 stars."
1631563433-3429,https://www.officedepot.com/a/browse/stools/N=5+593070/,"Powell® Home Fashions Hamilton Swivel Bar Stool, Tan/Pewter0.0 out of 5 stars."
1631563433-2876,https://www.officedepot.com/a/browse/stools/N=5+593070/,"Zuo Modern Marina Bar Stool, White0.0 out of 5 stars."
1631563433-3641,https://www.officedepot.com/a/browse/stools/N=5+593070/,"National Public Seating Hardboard Stools With Backs, 30""H, Gray, Set of 30.0 out of 5 stars."
1631563433-3232,https://www.officedepot.com/a/browse/stools/N=5+593070/,"Linon Luke Backless Counter Stool, Brown0.0 out of 5 stars."
1631563433-2744,https://www.officedepot.com/a/browse/stools/N=5+593070/,"Zuo Modern® Reykjavik Chairs, Tangerine/Chrome, Pack Of 2 Chairs0.0 out of 5 stars."
1631563433-4643,https://www.officedepot.com/a/browse/stools/N=5+593070/,"Flash Furniture Vibrant Drafting Stool, Green/Chrome"
1631563433-2423,https://www.officedepot.com/a/browse/stools/N=5+593070/,"Linon Home Decor Products Rankin 26"" Counter Stool, Dark Walnut/Beige4.0 out of 5 stars. 2 reviews"
1631563433-4602,https://www.officedepot.com/a/browse/stools/N=5+593070/,"Linon Home Décor Products Walton Counter Stool, Sapele/Black"
1631563433-4720,https://www.officedepot.com/a/browse/stools/N=5+593070/,"Linon Brea Counter Stool With Backrest, 24""H Seat, Neutral/White Wash"
1631563433-4613,https://www.officedepot.com/a/browse/stools/N=5+593070/,"Powell Madaio Backless Swivel Bar Stool, Espresso/Brown"
1631563433-2469,https://www.officedepot.com/a/browse/stools/N=5+593070/,"Flash Furniture Contemporary Adjustable Bar Stool, Black/Chrome4.7 out of 5 stars. 3 reviews"
1631563433-3557,https://www.officedepot.com/a/browse/stools/N=5+593070/,"Elama Tufted Faux Leather Adjustable Bar Stools, White/Chrome, Set Of 2 Stools0.0 out of 5 stars."
1631563433-4263,https://www.officedepot.com/a/browse/stools/N=5+593070/,"Powell® Home Fashions Saddle Bar Stool, White0.0 out of 5 stars."
1631563433-3203,https://www.officedepot.com/a/browse/stools/N=5+593070/,"Zuo Modern Zip Bar Chair, White0.0 out of 5 stars."
1631563433-3228,https://www.officedepot.com/a/browse/stools/N=5+593070/,"Boss Drafting Stool With Antimicrobial Protection, Footring, Black0.0 out of 5 stars."
1631563433-4546,https://www.officedepot.com/a/browse/stools/N=5+593070/,"National Public Seating Vinyl-Padded Task Stool, Gray Seat/Gray Frame, Quantity:..."
1631563433-2297,https://www.officedepot.com/a/browse/stools/N=5+593070/,"Flash Furniture Mid-Back Mesh Ergonomic Drafting Chair, Red"
1631563433-3360,https://www.officedepot.com/a/browse/stools/N=5+593070/,"LumiSource Lombardi Bar Stool, Black/Cream0.0 out of 5 stars."
1631563433-3918,https://www.officedepot.com/a/browse/stools/N=5+593070/,"LumiSource Fuji Stacker Counter Stools, Black Seat/Gold Frame, Set of 2 Stools0.0 out of 5 stars."
1631563433-3249,https://www.officedepot.com/a/browse/stools/N=5+593070/,"LumiSource Hydra Bar Stool, White/Brown0.0 out of 5 stars."
1631563433-2421,https://www.officedepot.com/a/browse/stools/N=5+593070/,"Boss Medical Stool, 27""H x 25""W x 25""D, Beige/Chrome5.0 out of 5 stars. 15 reviews"
1631563433-3724,https://www.officedepot.com/a/browse/stools/N=5+593070/,"Zuo Modern Soar Bar Chairs, White, Set Of 2 Chairs0.0 out of 5 stars."
1631563433-3602,https://www.officedepot.com/a/browse/stools/N=5+593070/,"Safco® Twixt® Active Seating Chair, Extended Height, Black0.0 out of 5 stars."
1631563433-2460,https://www.officedepot.com/a/browse/stools/N=5+593070/,"Linon Home Décor Products Baker Folding Counter Stool, Espresso/Dark Brown5.0 out of 5 stars. 2 reviews"
1631563433-3636,https://www.officedepot.com/a/browse/stools/N=5+593070/,"Zuo Modern® Lids Counter Stools, Dark Gray/Brushed Steel, Set Of 2 Stools0.0 out of 5 stars."
1631563433-2467,https://www.officedepot.com/a/browse/stools/N=5+593070/,"Allermuir Lyft Task Stool, Black0.0 out of 5 stars."
1631563433-3814,https://www.officedepot.com/a/browse/stools/N=5+593070/,"Linon Home Décor Products Baker Bar Stool, Driftwood/Black0.0 out of 5 stars."
1631563433-4099,https://www.officedepot.com/a/browse/stools/N=5+593070/,"National Public Seating Hardboard Stool With Back, 24""H, Gray0.0 out of 5 stars."
1631563433-3741,https://www.officedepot.com/a/browse/stools/N=5+593070/,"LumiSource Marcel Contemporary Glam Counter Stools, Black/Chrome, Set Of 2 Stool...0.0 out of 5 stars."
1631563433-4125,https://www.officedepot.com/a/browse/stools/N=5+593070/,"LumiSource Marcel Contemporary Counter Stools, Brown/Black, Set Of 2 Stools0.0 out of 5 stars."
1631563433-2431,https://www.officedepot.com/a/browse/stools/N=5+593070/,"Boss Ergonomic Works Adjustable Drafting Chair Without Arms, Black/Chrome4.1 out of 5 stars. 11 reviews"
1631563433-3628,https://www.officedepot.com/a/browse/stools/N=5+593070/,"Linon Home Decor Products Holmes Counter Stool, Brown/Matte Bronze5.0 out of 5 stars. 1 review"
1631563433-4539,https://www.officedepot.com/a/browse/stools/N=5+593070/,"Baxton Studio Addie Bar Stools, Gray/Rose Gold, Set Of 4 Stools"
1631563433-2885,https://www.officedepot.com/a/browse/stools/N=5+593070/,"KFI Studios Jive Low-Back Stacking Bar Stool, White/Silver0.0 out of 5 stars."
1631563433-3752,https://www.officedepot.com/a/browse/stools/N=5+593070/,"Flash Furniture Ergonomic Mesh Mid-Back Drafting Chair, Black0.0 out of 5 stars."
1631563433-3393,https://www.officedepot.com/a/browse/stools/N=5+593070/,"Baxton Studio Maritta Bar Stools, Black, Set Of 2 Stools0.0 out of 5 stars."
1631563433-2526,https://www.officedepot.com/a/browse/stools/N=5+593070/,"HON® Solve Fabric Mid-Back Task Chair, Ink/Titanium0.0 out of 5 stars."
1631563433-2907,https://www.officedepot.com/a/browse/stools/N=5+593070/,"Powell Caelan Bar Stool, Gray/Chrome0.0 out of 5 stars."
1631563433-4496,https://www.officedepot.com/a/browse/stools/N=5+593070/,"LumiSource Ahoy Floral Counter Stool, Walnut Bamboo/White"
1631563433-3850,https://www.officedepot.com/a/browse/stools/N=5+593070/,"LumiSource Marcel Contemporary Glam Counter Stools, Chrome/Silver, Set Of 2 Stoo...0.0 out of 5 stars."
1631563433-3258,https://www.officedepot.com/a/browse/stools/N=5+593070/,"Powell Pederson Counter Stools, Natural, Set Of 2 Stools0.0 out of 5 stars."
1631563433-2215,https://www.officedepot.com/a/browse/stools/N=5+593070/,"Boss Multi-Function Budget Drafting Stool, Black/Chrome"
1631563433-4294,https://www.officedepot.com/a/browse/stools/N=5+593070/,"New Ridge Home Goods Saddle-Style Counter Stool, Weathered Gray/Cobble0.0 out of 5 stars."
1631563433-3939,https://www.officedepot.com/a/browse/stools/N=5+593070/,"Linon Home Décor Products Cleo Adjustable Stool, White4.5 out of 5 stars. 4 reviews"
1631563433-2872,https://www.officedepot.com/a/browse/stools/N=5+593070/,"LumiSource Trilogy Counter Stools, Walnut/Green, Set Of 2 Stools0.0 out of 5 stars."
1631563433-2957,https://www.officedepot.com/a/browse/stools/N=5+593070/,"Powell Mabon Backless Swivel Bar Stool, White/Natural Sea Grass0.0 out of 5 stars."
1631563433-3268,https://www.officedepot.com/a/browse/stools/N=5+593070/,"Glamour Home Amery Bar Stools, Black/Gray, Set Of 2 Stools0.0 out of 5 stars."
1631563433-2315,https://www.officedepot.com/a/browse/stools/N=5+593070/,"HON® ValuTask Low-Back Task Stool, Black Seat/Black/Chrome Frame, Quantity: 1"
1631563433-4021,https://www.officedepot.com/a/browse/stools/N=5+593070/,"Zuo Modern® Piccolo Counter Chair, Pink/Black0.0 out of 5 stars."
1631563433-2345,https://www.officedepot.com/a/browse/stools/N=5+593070/,"Lorell® Millenia Pneumatic Task Stool, Black3.0 out of 5 stars. 2 reviews"
1631563433-3307,https://www.officedepot.com/a/browse/stools/N=5+593070/,"Ave Six Luna 35 1/2""H Barstool, Azure/Gold0.0 out of 5 stars."
1631563433-3975,https://www.officedepot.com/a/browse/stools/N=5+593070/,"Powell Hala Stump Stool, Gray0.0 out of 5 stars."
1631563433-4299,https://www.officedepot.com/a/browse/stools/N=5+593070/,"LumiSource Masters Bar Stool, Chrome/Black/Red0.0 out of 5 stars."
1631563433-2237,https://www.officedepot.com/a/browse/stools/N=5+593070/,"Office Star™ SPACE Deluxe Ergonomic Air Grid/Mesh Armless Drafting Chair, Black"
1631563433-4283,https://www.officedepot.com/a/browse/stools/N=5+593070/,"Flash Furniture 24""H Commercial-Grade Metal Backless Counter Stool, Mint Green4.5 out of 5 stars. 2 reviews"
1631563433-3364,https://www.officedepot.com/a/browse/stools/N=5+593070/,"LumiSource Folia Bar Stool, Chrome/Walnut/Cream0.0 out of 5 stars."
1631563433-4793,https://www.officedepot.com/a/browse/stools/N=5+593070/,"LumiSource Cecina Mid-Century Modern Counter Stools, Walnut/Cream, Set Of 2 Stoo..."
1631563433-2590,https://www.officedepot.com/a/browse/stools/N=5+593070/,"Boss Office Products DOT Mesh Stool, Gray/Black0.0 out of 5 stars."
1631563433-3813,https://www.officedepot.com/a/browse/stools/N=5+593070/,"LumiSource Dakota Mid-Back Bar Stool, Medium Brown Seat/Black Base0.0 out of 5 stars."
1631563433-4176,https://www.officedepot.com/a/browse/stools/N=5+593070/,"Elama Faux Leather Adjustable Bar Stools, White/Chrome, Set Of 2 Stools0.0 out of 5 stars."
1631563433-4159,https://www.officedepot.com/a/browse/stools/N=5+593070/,"LumiSource Fuji Stacker Counter Stools, White Seat/White Frame, Set of 2 Stools0.0 out of 5 stars."
