web-scraper-order,web-scraper-start-url,nnn
1631563433-2396,https://www.officedepot.com/a/browse/stools/N=5+593070/,"Flash Furniture Ergonomic Mesh Mid-Back Drafting Chair, Blue4.0 out of 5 stars. 3 reviews"
1631563433-3004,https://www.officedepot.com/a/browse/stools/N=5+593070/,"Linon Home Décor Products Walker Backless Bar Stool, Dark Espresso/Red0.0 out of 5 stars."
1631563433-2459,https://www.officedepot.com/a/browse/stools/N=5+593070/,"Boss Office Products Oversized Drafting Stool With Arms, Black0.0 out of 5 stars."
1631563433-4530,https://www.officedepot.com/a/browse/stools/N=5+593070/,"Flash Furniture LeatherSoft Counter-Height Bar Stools, Gray, Set Of 2 Stools"
1631563433-4358,https://www.officedepot.com/a/browse/stools/N=5+593070/,"National Public Seating 6800 Steel Designer Swivel Stools, Black, Set Of 2 Stool...0.0 out of 5 stars."
1631563433-4676,https://www.officedepot.com/a/browse/stools/N=5+593070/,"LumiSource Gardenia Mid-Century Modern Counter Stools, Walnut/Cream, Set Of 2 St..."
1631563433-3374,https://www.officedepot.com/a/browse/stools/N=5+593070/,"LumiSource Lombardi Bar Stool, Black/Walnut0.0 out of 5 stars."
1631563433-3383,https://www.officedepot.com/a/browse/stools/N=5+593070/,"Boss Mesh Drafting Stool With Loop Arms, Black1.7 out of 5 stars. 6 reviews"
1631563433-3057,https://www.officedepot.com/a/browse/stools/N=5+593070/,"Ave Six Mayson 26""H Polyester Counter Stools, Charcoal/Gunmetal, Set Of 2 Stools0.0 out of 5 stars."
1631563433-4067,https://www.officedepot.com/a/browse/stools/N=5+593070/,"Flash Furniture Vibrant Drafting Stool, Orange-Yellow/Chrome5.0 out of 5 stars. 1 review"
1631563433-2973,https://www.officedepot.com/a/browse/stools/N=5+593070/,"LumiSource Finn Counter Stools, Light Gray Seat/Black Frame, Set Of 2 Stools0.0 out of 5 stars."
1631563433-2528,https://www.officedepot.com/a/browse/stools/N=5+593070/,"Flash Furniture 30"" Metal Indoor Bar Stools, Set Of 4 Bar Stools, Gunmetal0.0 out of 5 stars."
1631563433-2333,https://www.officedepot.com/a/browse/stools/N=5+593070/,"LumiSource Master Bar Stool, Black/Silver0.0 out of 5 stars."
1631563433-2653,https://www.officedepot.com/a/browse/stools/N=5+593070/,"Linon Home Décor Products Marshall Backless Bar Stool, Dark Cherry/Black0.0 out of 5 stars."
1631563433-2570,https://www.officedepot.com/a/browse/stools/N=5+593070/,"Linon Home Decor Products Hamilton Curves Back Counter Stool, Metallic Brown/Bro...0.0 out of 5 stars."
1631563433-4888,https://www.officedepot.com/a/browse/stools/N=5+593070/,"KFI Studios KOOL Stacking Barstool, Lime Green/Silver"
1631563433-3253,https://www.officedepot.com/a/browse/stools/N=5+593070/,"LumiSource Stout Bar Stool, Black/Gray0.0 out of 5 stars."
1631563433-4430,https://www.officedepot.com/a/browse/stools/N=5+593070/,"Coast to Coast Aspen Court II Counter Height Dining Barstools, Gray/White Herrin..."
1631563433-3872,https://www.officedepot.com/a/browse/stools/N=5+593070/,"LumiSource Duke Adjustable Industrial Bar Stools With Backs, Brown, Set Of 2 Sto...0.0 out of 5 stars."
1631563433-4388,https://www.officedepot.com/a/browse/stools/N=5+593070/,"LumiSource Canary Contemporary Counter Stools, Gold/White, Set Of 2 Stools0.0 out of 5 stars."
1631563433-3941,https://www.officedepot.com/a/browse/stools/N=5+593070/,"National® Irma Upholstered Bar Stool, Dark Gray/Natural0.0 out of 5 stars."
1631563433-3380,https://www.officedepot.com/a/browse/stools/N=5+593070/,"Baxton Studio Devon Counter Stools, Gray/Espresso Brown, Set Of 2 Stools0.0 out of 5 stars."
1631563433-2340,https://www.officedepot.com/a/browse/stools/N=5+593070/,"LumiSource Ale Bar Stools, Camel Seat/Antique Frame, Set of 2 Stools0.0 out of 5 stars."
1631563433-4702,https://www.officedepot.com/a/browse/stools/N=5+593070/,"Flash Furniture 30""H Backless Distressed Bar Stool, Copper"
1631563433-3661,https://www.officedepot.com/a/browse/stools/N=5+593070/,"Coast to Coast Bristol Barstool, Brown/Silver0.0 out of 5 stars."
1631563433-3308,https://www.officedepot.com/a/browse/stools/N=5+593070/,"LumiSource Marcel Contemporary Counter Stools, Black/White, Set Of 2 Stools0.0 out of 5 stars."
1631563433-2343,https://www.officedepot.com/a/browse/stools/N=5+593070/,"Flash Furniture Vibrant Drafting Stool, Spicy Lime/Chrome3.0 out of 5 stars. 1 review"
1631563433-3422,https://www.officedepot.com/a/browse/stools/N=5+593070/,"LumiSource Cecina Bar Stools, Zebra/Cream, Set Of 2 Stools0.0 out of 5 stars."
1631563433-2393,https://www.officedepot.com/a/browse/stools/N=5+593070/,"Office Star™ Deluxe Mesh-Back Drafting Chair With Foot Ring, Black4.3 out of 5 stars. 14 reviews"
1631563433-4273,https://www.officedepot.com/a/browse/stools/N=5+593070/,"Linon Ramath Faux Leather Stool, Gray0.0 out of 5 stars."
1631563433-4673,https://www.officedepot.com/a/browse/stools/N=5+593070/,"Zuo Modern® Smart Counter Chair, Vintage Espresso/Black"
1631563433-2759,https://www.officedepot.com/a/browse/stools/N=5+593070/,"Baxton Studio Aldon Bar Stools, Light Beige/Dark Brown, Set Of 2 Stools0.0 out of 5 stars."
1631563433-3026,https://www.officedepot.com/a/browse/stools/N=5+593070/,"LumiSource Foundry Bar Stools, Black/Green, Set Of 2 Stools0.0 out of 5 stars."
1631563433-2798,https://www.officedepot.com/a/browse/stools/N=5+593070/,"Linon Vern Metal Bar Stools, Natural/Silver, Set Of 2 Stools0.0 out of 5 stars."
1631563433-3311,https://www.officedepot.com/a/browse/stools/N=5+593070/,"LumiSource Mid-Century Modern Folia Counter Stools, Black/Walnut, Set Of 2 Stool...0.0 out of 5 stars."
1631563433-3198,https://www.officedepot.com/a/browse/stools/N=5+593070/,"Zuo Modern® Eclipse Counter Chairs, Silver, Set Of 2 Chairs0.0 out of 5 stars."
1631563433-4523,https://www.officedepot.com/a/browse/stools/N=5+593070/,"LumiSource Finn Counter Stools, Black Seat/White Frame, Set Of 2 Stools"
1631563433-4053,https://www.officedepot.com/a/browse/stools/N=5+593070/,"LumiSource Dakota Upholstered Bar Stools, Gold/Green, Set Of 2 Stools5.0 out of 5 stars. 1 review"
1631563433-4783,https://www.officedepot.com/a/browse/stools/N=5+593070/,"Flash Furniture Commercial-Grade 30"" High-Back Metal Bar Stools, Set Of 4 Bar St..."
1631563433-4800,https://www.officedepot.com/a/browse/stools/N=5+593070/,"National Public Seating Vinyl-Padded Stools With Backs, 30""H, Gray, Set Of 3"
1631563433-4094,https://www.officedepot.com/a/browse/stools/N=5+593070/,"KFI Studios KOOL Stacking Barstool, Coral Orange/Silver0.0 out of 5 stars."
1631563433-3058,https://www.officedepot.com/a/browse/stools/N=5+593070/,"Ave Six Luna 35 1/2""H Barstool, Ash/Gold0.0 out of 5 stars."
1631563433-3425,https://www.officedepot.com/a/browse/stools/N=5+593070/,"Zuo Modern® Lids Bar Stools, Dark Gray/Chrome, Set Of 2 Stools0.0 out of 5 stars."
1631563433-2355,https://www.officedepot.com/a/browse/stools/N=5+593070/,"New Ridge Home Goods Julian Faux Leather Bar Stool, Red/Espresso0.0 out of 5 stars."
1631563433-4801,https://www.officedepot.com/a/browse/stools/N=5+593070/,"Flash Furniture Commercial Backless Bar Stool, Red"
1631563433-2367,https://www.officedepot.com/a/browse/stools/N=5+593070/,"Boss Fabric Drafting Stool, Black/Chrome5.0 out of 5 stars. 1 review"
1631563433-4245,https://www.officedepot.com/a/browse/stools/N=5+593070/,"HON® Solve Fabric Mid-Back Task Chair, ReActiv Back, Ink/Black0.0 out of 5 stars."
1631563433-3354,https://www.officedepot.com/a/browse/stools/N=5+593070/,"Flash Furniture HERCULES Ladder Back Restaurant Bar Stool, Black4.6 out of 5 stars. 22 reviews"
1631563433-2371,https://www.officedepot.com/a/browse/stools/N=5+593070/,"Boss Ergonomic Kneeling Stool, 25""H x 19 1/2""W x 26""D, Black3.8 out of 5 stars. 18 reviews"
1631563433-4449,https://www.officedepot.com/a/browse/stools/N=5+593070/,"Flash Furniture Mid-Back Mesh Ergonomic Drafting Chair, Blue"
1631563433-3148,https://www.officedepot.com/a/browse/stools/N=5+593070/,"Flash Furniture Commercial Backless Bar Stool, Orange5.0 out of 5 stars. 11 reviews"
1631563433-3103,https://www.officedepot.com/a/browse/stools/N=5+593070/,"LumiSource Santi Bar Stool, Walnut/Cream/Chrome0.0 out of 5 stars."
1631563433-3866,https://www.officedepot.com/a/browse/stools/N=5+593070/,"Glamour Home Aled Counter-Height Stools, Beige/Antique Wood, Set Of 2 Chairs0.0 out of 5 stars."
1631563433-3542,https://www.officedepot.com/a/browse/stools/N=5+593070/,"National Public Seating Hardboard Task Stool 30""H, Gray Seat/Gray Frame, Set of ...0.0 out of 5 stars."
1631563433-2568,https://www.officedepot.com/a/browse/stools/N=5+593070/,"Office Star™ Avenue Six Luna Barstool, White/Gold0.0 out of 5 stars."
1631563433-4630,https://www.officedepot.com/a/browse/stools/N=5+593070/,"National Public Seating 6400 Adjustable-Height Task Stool, Black Seat/Black Fram..."
1631563433-3482,https://www.officedepot.com/a/browse/stools/N=5+593070/,"Linon Home Décor Products Victoria Bar Stool, Walnut/Cream0.0 out of 5 stars."
1631563433-2944,https://www.officedepot.com/a/browse/stools/N=5+593070/,"Powell Edina Big & Tall Swivel Bar Stool, Gray/Matte Black0.0 out of 5 stars."
1631563433-2748,https://www.officedepot.com/a/browse/stools/N=5+593070/,"LumiSource Braided Matisse Counter Stool, Gray Fabric/Black Frame0.0 out of 5 stars."
1631563433-4328,https://www.officedepot.com/a/browse/stools/N=5+593070/,"DHP Fusion Backless Bar Stool, Brown0.0 out of 5 stars."
1631563433-2678,https://www.officedepot.com/a/browse/stools/N=5+593070/,"New Ridge Home Goods Saddle-Style Bar Stool, Weathered Gray/Cobble0.0 out of 5 stars."
1631563433-3334,https://www.officedepot.com/a/browse/stools/N=5+593070/,"Baxton Studio Alexandra Bar Stools, Espresso Brown/Gray, Pack of 20.0 out of 5 stars."
1631563433-2841,https://www.officedepot.com/a/browse/stools/N=5+593070/,"Flash Furniture LeatherSoft Counter-Height Bar Stools, Dark Brown, Set Of 2 Stoo...5.0 out of 5 stars. 1 review"
1631563433-4171,https://www.officedepot.com/a/browse/stools/N=5+593070/,"OFM 161 Collection Mid-Century Modern Low-Back Stool, Navy/Walnut4.9 out of 5 stars. 10 reviews"
1631563433-4647,https://www.officedepot.com/a/browse/stools/N=5+593070/,"LumiSource Mara Counter Stools, Black/Camel, Set Of 2 Stools"
1631563433-3246,https://www.officedepot.com/a/browse/stools/N=5+593070/,"National Public Seating Adjustable Vinyl-Padded Task Stool, Gray Seat/Gray Frame...0.0 out of 5 stars."
1631563433-2964,https://www.officedepot.com/a/browse/stools/N=5+593070/,"Linon Home Décor Products Lucille Bar Stool, Natural/White0.0 out of 5 stars."
1631563433-4581,https://www.officedepot.com/a/browse/stools/N=5+593070/,"Boss Office Products Stool With Foot Ring, Black/Chrome"
1631563433-3561,https://www.officedepot.com/a/browse/stools/N=5+593070/,"Glamour Home Adan Bar Stools, Vintage Gray/Black, Set Of 2 Stools0.0 out of 5 stars."
1631563433-3607,https://www.officedepot.com/a/browse/stools/N=5+593070/,"Boss Office Products DOT Mesh Stool, Black1.0 out of 5 stars. 1 review"
1631563433-2830,https://www.officedepot.com/a/browse/stools/N=5+593070/,"Flash Furniture Swivel Bar Stool, Burgundy5.0 out of 5 stars. 3 reviews"
1631563433-2691,https://www.officedepot.com/a/browse/stools/N=5+593070/,"LumiSource Saddle Counter Stools, Black, Set Of 2 Stools0.0 out of 5 stars."
1631563433-4434,https://www.officedepot.com/a/browse/stools/N=5+593070/,"Flash Furniture LeatherSoft Counter-Height Bar Stools, Light Brown, Set Of 2 Sto..."
1631563433-2844,https://www.officedepot.com/a/browse/stools/N=5+593070/,"Monarch Specialties Counter-Height Bar Stools, Black/Chrome, Set Of 20.0 out of 5 stars."
1631563433-2853,https://www.officedepot.com/a/browse/stools/N=5+593070/,"LumiSource Fuji Bamboo Stacker Counter Stools, Espresso Seat/Antique Frame, Set ...0.0 out of 5 stars."
1631563433-3295,https://www.officedepot.com/a/browse/stools/N=5+593070/,"LumiSource Curvini 30'' Bar Stools, Blue Seat/Walnut Frame, Set of 2 Stools5.0 out of 5 stars. 1 review"
1631563433-3237,https://www.officedepot.com/a/browse/stools/N=5+593070/,"Office Star Milo Mid-Back Office Chair, White/Chrome0.0 out of 5 stars."
1631563433-2696,https://www.officedepot.com/a/browse/stools/N=5+593070/,"National Public Seating 6400H-10 Adjustable-Height Stools With Backrests, 25""H, ...0.0 out of 5 stars."
1631563433-2978,https://www.officedepot.com/a/browse/stools/N=5+593070/,"Flash Furniture Hercules Big And Tall Fabric Drafting Chair, Black0.0 out of 5 stars."
1631563433-4659,https://www.officedepot.com/a/browse/stools/N=5+593070/,"LumiSource Velvet Fuji Stacker Bar Stools, Silver/White, Set Of 2 Stools"
1631563433-2317,https://www.officedepot.com/a/browse/stools/N=5+593070/,"Vari Drafting Chair, Black"
1631563433-4653,https://www.officedepot.com/a/browse/stools/N=5+593070/,"Flash Furniture Commercial-Grade 30""H Distressed Metal Bar Stool, Black"
1631563433-2292,https://www.officedepot.com/a/browse/stools/N=5+593070/,"Linon Home Décor Products Baker Folding Counter Stool, Espresso/Dark Brown"
1631563433-2626,https://www.officedepot.com/a/browse/stools/N=5+593070/,"Boss Medical Stool With Foot Ring And Antimicrobial Vinyl, 34""H x 25""W X 25""D, B...4.8 out of 5 stars. 4 reviews"
1631563433-3486,https://www.officedepot.com/a/browse/stools/N=5+593070/,"Boss Drafting Stool, Gray/Chrome, B1617-GY3.0 out of 5 stars. 1 review"
1631563433-4710,https://www.officedepot.com/a/browse/stools/N=5+593070/,"Powell Saber Swivel Bar Stool, Light Blue/Cream"
1631563433-3964,https://www.officedepot.com/a/browse/stools/N=5+593070/,"LumiSource Toriano Counter Stools, Gray/Walnut, Set Of 2 Stools0.0 out of 5 stars."
1631563433-3663,https://www.officedepot.com/a/browse/stools/N=5+593070/,"OFM 161 Collection Mid-Century Modern Low-Back Stool, 38""H, Navy/Walnut0.0 out of 5 stars."
1631563433-3342,https://www.officedepot.com/a/browse/stools/N=5+593070/,"Linon Home Décor Milano Stool, Counter 24"", Medium Dark Walnut/Dark Brown Vinyl0.0 out of 5 stars."
1631563433-3788,https://www.officedepot.com/a/browse/stools/N=5+593070/,"National Public Seating Adjustable Hardboard Stool, 31 1/2 - 38 1/2""H, Gray0.0 out of 5 stars."
1631563433-3122,https://www.officedepot.com/a/browse/stools/N=5+593070/,"Zuo Modern® Siena Counter Chairs, Black/Gold, Pack Of 2 Chairs0.0 out of 5 stars."
1631563433-3629,https://www.officedepot.com/a/browse/stools/N=5+593070/,"Baxton Studio Walter Bar Stools, Gray/Walnut, Set Of 4 Stools0.0 out of 5 stars."
1631563433-3230,https://www.officedepot.com/a/browse/stools/N=5+593070/,"Linon Everett Counter Stool With Backrest, 24""H Seat, Neutral/Walnut0.0 out of 5 stars."
1631563433-3677,https://www.officedepot.com/a/browse/stools/N=5+593070/,"LumiSource Mara Counter Stools, Silver/Walnut/White, Set Of 2 Stools0.0 out of 5 stars."
1631563433-2692,https://www.officedepot.com/a/browse/stools/N=5+593070/,"LumiSource Marcel Contemporary Counter Stools, Chrome/Black, Set Of 2 Stools0.0 out of 5 stars."
1631563433-4693,https://www.officedepot.com/a/browse/stools/N=5+593070/,"Safco® Diesel Bonded Leather High-Base Stool With Back, Pewter"
1631563433-4394,https://www.officedepot.com/a/browse/stools/N=5+593070/,"New Ridge Home Goods Saddle-Style Counter Stool, Natural/Cream0.0 out of 5 stars."
1631563433-4535,https://www.officedepot.com/a/browse/stools/N=5+593070/,"LumiSource Fuji Stacker Counter Stools, White Seat/White Frame, Set Of 2 Stools"
1631563433-2338,https://www.officedepot.com/a/browse/stools/N=5+593070/,"Flash Furniture Mesh High-Back Drafting Chair, Black0.0 out of 5 stars."
1631563433-3766,https://www.officedepot.com/a/browse/stools/N=5+593070/,"Zuo Modern® Ambrose Bar Chairs, Gray/Walnut, Set Of 2 Chairs0.0 out of 5 stars."
1631563433-4825,https://www.officedepot.com/a/browse/stools/N=5+593070/,"National Public Seating Hardboard Task Stool With Backrest 24""H, Black Seat/Blac..."
1631563433-2364,https://www.officedepot.com/a/browse/stools/N=5+593070/,"HON® Accommodate Cafe Stool, Armless, Fabric, Black0.0 out of 5 stars."
1631563433-3856,https://www.officedepot.com/a/browse/stools/N=5+593070/,"LumiSource Ahoy Counter Stool, Gray Seat/Walnut Frame0.0 out of 5 stars."
1631563433-3063,https://www.officedepot.com/a/browse/stools/N=5+593070/,"Linon Marshall Backless Counter Stool, Black/Gray Tweed0.0 out of 5 stars."
1631563433-3240,https://www.officedepot.com/a/browse/stools/N=5+593070/,"Flash Furniture Cozy Mid-Back Adjustable Bar Stool, Gray/Red0.0 out of 5 stars."
1631563433-4498,https://www.officedepot.com/a/browse/stools/N=5+593070/,"Linon Home Décor Products Alice Bar Stool, Rice/Brown"
1631563433-2347,https://www.officedepot.com/a/browse/stools/N=5+593070/,"Flash Furniture Bentwood Adjustable-Height Barstool, Beech/Black/Silver4.7 out of 5 stars. 3 reviews"
1631563433-2254,https://www.officedepot.com/a/browse/stools/N=5+593070/,"Linon Home Decor Products Rankin 26"" Counter Stool, Dark Walnut/Beige"
1631563433-2735,https://www.officedepot.com/a/browse/stools/N=5+593070/,"LumiSource Fuji DLX Counter Stools, Blue Seat/Stainless-Steel Frame, Set Of 2 St...0.0 out of 5 stars."
1631563433-4766,https://www.officedepot.com/a/browse/stools/N=5+593070/,"LumiSource Fuji Stacker Counter Stools, Green Seat/White Frame, Set Of 2 Stools"
1631563433-3511,https://www.officedepot.com/a/browse/stools/N=5+593070/,"LumiSource Mara Counter Stools, White/Stainless Steel, Set Of 2 Stools0.0 out of 5 stars."
1631563433-2842,https://www.officedepot.com/a/browse/stools/N=5+593070/,"Flash Furniture Vibrant Drafting Stool, White/Chrome4.0 out of 5 stars. 2 reviews"
1631563433-4885,https://www.officedepot.com/a/browse/stools/N=5+593070/,"Baxton Studio Walter Bar Stools, Black/Tan, Set Of 4 Stools"
1631563433-2725,https://www.officedepot.com/a/browse/stools/N=5+593070/,"LumiSource Folia Mid-Century Modern Counter Stools, Walnut/Light Gray, Set Of 2 ...0.0 out of 5 stars."
1631563433-2869,https://www.officedepot.com/a/browse/stools/N=5+593070/,"Powell Quaid Swivel Bar Stool, White/Chrome0.0 out of 5 stars."
1631563433-3670,https://www.officedepot.com/a/browse/stools/N=5+593070/,"New Ridge Home Goods Julian Faux Leather Bar Stool, Gray/Espresso0.0 out of 5 stars."
1631563433-2671,https://www.officedepot.com/a/browse/stools/N=5+593070/,"DHP Fusion Backless Counter Stool, Bronze0.0 out of 5 stars."
1631563433-2577,https://www.officedepot.com/a/browse/stools/N=5+593070/,"Powell® Home Fashions Stool, Sand Through Terra Cotta, Counter Height, Antique B...0.0 out of 5 stars."
1631563433-3416,https://www.officedepot.com/a/browse/stools/N=5+593070/,"LumiSource Pebble Bar Stools, Walnut/Blue, Set Of 2 Stools0.0 out of 5 stars."
1631563433-2412,https://www.officedepot.com/a/browse/stools/N=5+593070/,"Linon Home Decor Products Hendry Bar Stool, White/Espresso4.5 out of 5 stars. 2 reviews"
1631563433-4112,https://www.officedepot.com/a/browse/stools/N=5+593070/,"LumiSource Beta Bar Stools, Camel Seat/Antique Frame, Set of 2 Stools0.0 out of 5 stars."
1631563433-3731,https://www.officedepot.com/a/browse/stools/N=5+593070/,"LumiSource Marcel Contemporary Glam Counter Stools, Black/Silver, Set Of 2 Stool...0.0 out of 5 stars."
1631563433-2274,https://www.officedepot.com/a/browse/stools/N=5+593070/,"Linon Home Decor Products Franklin Counter Stool, Espresso"
1631563433-3304,https://www.officedepot.com/a/browse/stools/N=5+593070/,"LumiSource Ale Bar Stools, Brown Seat/Antique Frame, Set of 2 Stools0.0 out of 5 stars."
1631563433-3711,https://www.officedepot.com/a/browse/stools/N=5+593070/,"Boss Office Products Contract Mesh Drafting Stool, Black0.0 out of 5 stars."
1631563433-3468,https://www.officedepot.com/a/browse/stools/N=5+593070/,"Boss Office Products Stools, White/Chrome, Set Of 4 Stools0.0 out of 5 stars."
1631563433-3827,https://www.officedepot.com/a/browse/stools/N=5+593070/,"LumiSource Claire Counter Stools, Light Blue/Black/Gold, Set Of 2 Stools0.0 out of 5 stars."
1631563433-3725,https://www.officedepot.com/a/browse/stools/N=5+593070/,"LumiSource Fuji DLX Counter Stools, Blue Seat/Antique Frame, Set Of 2 Stools0.0 out of 5 stars."
1631563433-3854,https://www.officedepot.com/a/browse/stools/N=5+593070/,"Safco® Fidget Active Stool, 18"", Black4.0 out of 5 stars. 1 review"
1631563433-3150,https://www.officedepot.com/a/browse/stools/N=5+593070/,"LumiSource Mirage Bar Stool, Black0.0 out of 5 stars."
1631563433-2802,https://www.officedepot.com/a/browse/stools/N=5+593070/,"KFI Studios KOOL Stacking Barstool, Peri Blue/Silver0.0 out of 5 stars."
1631563433-3211,https://www.officedepot.com/a/browse/stools/N=5+593070/,"Safco® Shell Extended-Height Chair, Black0.0 out of 5 stars."
1631563433-4750,https://www.officedepot.com/a/browse/stools/N=5+593070/,"Powell Vinessa Swivel Bar Stool, Pewter/Gray"
1631563433-4615,https://www.officedepot.com/a/browse/stools/N=5+593070/,"Boss Drafting Stool, Gray, B1616-GY"
1631563433-2894,https://www.officedepot.com/a/browse/stools/N=5+593070/,"Linon Home Décor Products Victoria Counter Stool, Cream/Walnut0.0 out of 5 stars."
1631563433-2781,https://www.officedepot.com/a/browse/stools/N=5+593070/,"Zuo Modern Piccolo Bar Chair, Yellow0.0 out of 5 stars."
1631563433-4464,https://www.officedepot.com/a/browse/stools/N=5+593070/,"LumiSource Curvini Bar Stools, Walnut/Cream, Set Of 2 Stools"
1631563433-2652,https://www.officedepot.com/a/browse/stools/N=5+593070/,"HON® Accommodate Cafe Stool, Fixed Arms, Fabric, Black0.0 out of 5 stars."
1631563433-2750,https://www.officedepot.com/a/browse/stools/N=5+593070/,"LumiSource Avery Metal Counter Stools, Brushed Stainless Steel, Set Of 2 Stools0.0 out of 5 stars."
1631563433-3021,https://www.officedepot.com/a/browse/stools/N=5+593070/,"Linon Ellington Counter Stools, Espresso, Set Of 2 Stools0.0 out of 5 stars."
1631563433-3176,https://www.officedepot.com/a/browse/stools/N=5+593070/,"LumiSource Velvet Fuji Stacker Bar Stools, Gold/White, Set Of 2 Stools0.0 out of 5 stars."
1631563433-4558,https://www.officedepot.com/a/browse/stools/N=5+593070/,"LumiSource Outlaw Counter Stools, Black/Blue, Set Of 2 Stools"
1631563433-3955,https://www.officedepot.com/a/browse/stools/N=5+593070/,"Ave Six Kate Counter Stool, Cocoa/Mocha0.0 out of 5 stars."
1631563433-2648,https://www.officedepot.com/a/browse/stools/N=5+593070/,"LumiSource Pebble Counter Stools, Walnut/Beige, Set Of 2 Stools0.0 out of 5 stars."
1631563433-4399,https://www.officedepot.com/a/browse/stools/N=5+593070/,"LumiSource Lana Contemporary Counter Stools, Black/Green, Set Of 2 Stools0.0 out of 5 stars."
1631563433-4777,https://www.officedepot.com/a/browse/stools/N=5+593070/,"AlphaBetter Adjustable-Height Student Stool, Black"
1631563433-2605,https://www.officedepot.com/a/browse/stools/N=5+593070/,"LumiSource Saddle Counter Stools, Black/Camel, Set Of 2 Stools0.0 out of 5 stars."
1631563433-3083,https://www.officedepot.com/a/browse/stools/N=5+593070/,"National Public Seating Adjustable Hardboard Task Stool, Gray Seat/Gray Frame0.0 out of 5 stars."
1631563433-3532,https://www.officedepot.com/a/browse/stools/N=5+593070/,"Office Star™ ProGrid Mesh Mid-Back Drafting Chair, Coal/Black0.0 out of 5 stars."
1631563433-4289,https://www.officedepot.com/a/browse/stools/N=5+593070/,"National Public Seating Hardboard Stool With Back, 24""H, Black0.0 out of 5 stars."
1631563433-4641,https://www.officedepot.com/a/browse/stools/N=5+593070/,"Linon Home Décor Products Jasper Bar Stool, Coffee Brown"
1631563433-2635,https://www.officedepot.com/a/browse/stools/N=5+593070/,"Elama Shell-Back Faux Leather Adjustable Bar Stools, Dark Gray/Chrome, Set Of 2 ...0.0 out of 5 stars."
1631563433-4166,https://www.officedepot.com/a/browse/stools/N=5+593070/,"Zuo Modern® Magnus Counter Chairs, Gray/Walnut, Set Of 2 Chairs0.0 out of 5 stars."
1631563433-4264,https://www.officedepot.com/a/browse/stools/N=5+593070/,"Flash Furniture Mid-Back Mesh Drafting Chair, Black1.0 out of 5 stars. 1 review"
1631563433-4587,https://www.officedepot.com/a/browse/stools/N=5+593070/,"Flash Furniture Commercial-Grade Distressed Metal Counter Stool, Copper"
1631563433-3276,https://www.officedepot.com/a/browse/stools/N=5+593070/,"Linon Everett Backless Counter Stool, Blue/Neutral0.0 out of 5 stars."
1631563433-3260,https://www.officedepot.com/a/browse/stools/N=5+593070/,"National Public Seating 6400 Vinyl Task Stool, Black Seat/Black Frame0.0 out of 5 stars."
1631563433-3527,https://www.officedepot.com/a/browse/stools/N=5+593070/,"National Public Seating 6800 Height-Adjustable Swivel Stool, Persian Blue/Gray0.0 out of 5 stars."
1631563433-3952,https://www.officedepot.com/a/browse/stools/N=5+593070/,"LumiSource Mara Counter Stools, Black, Set Of 2 Stools0.0 out of 5 stars."
1631563433-4839,https://www.officedepot.com/a/browse/stools/N=5+593070/,"Linon Home Décor Products Walker Counter Stool, Jute/Dark Brown"
1631563433-2572,https://www.officedepot.com/a/browse/stools/N=5+593070/,"Linon Home Décor Products Cleo Adjustable Stool, Cow Print0.0 out of 5 stars."
1631563433-3286,https://www.officedepot.com/a/browse/stools/N=5+593070/,"Powell Mabon Backless Swivel Counter Stool, Walnut/Natural Sea Grass0.0 out of 5 stars."
1631563433-4664,https://www.officedepot.com/a/browse/stools/N=5+593070/,"Baxton Studio Malcom Bar Stools, Dark Brown, Set Of 4 Stools"
1631563433-4306,https://www.officedepot.com/a/browse/stools/N=5+593070/,"Zuo Modern® Confidence Counter Chairs, Black, Set Of 2 Chairs0.0 out of 5 stars."
1631563433-2795,https://www.officedepot.com/a/browse/stools/N=5+593070/,"HON® Solve Fabric Mid-Back Task Chair, Midnight/Titanium2.0 out of 5 stars. 1 review"
1631563433-4272,https://www.officedepot.com/a/browse/stools/N=5+593070/,"LumiSource Waco Industrial Counter Stool, Black/Gray0.0 out of 5 stars."
1631563433-3870,https://www.officedepot.com/a/browse/stools/N=5+593070/,"LumiSource Clubhouse Counter Stools, Gray Seat/Black Frame, Set Of 2 Stools0.0 out of 5 stars."
1631563433-3348,https://www.officedepot.com/a/browse/stools/N=5+593070/,"LumiSource Durango Counter Stools, Green Vintage Seat/Black Frame, Set Of 2 Stoo...0.0 out of 5 stars."
