web-scraper-order,web-scraper-start-url,nnn,ppp
"1635226495-16529","https://colemanfurniture.com/accents/plant-stands.htm","Antique White Blue Accents Small Venice Planter","$75.00"
"1635226495-16354","https://colemanfurniture.com/accents/plant-stands.htm","Turbo Aluminum and Black Large Planter","$869.00"
"1635226495-16465","https://colemanfurniture.com/accents/plant-stands.htm","Zoo Dark Green 5"" Planter","$65.00"
"1635226495-16364","https://colemanfurniture.com/accents/plant-stands.htm","Ripple Gel White Outdoor Planter","$749.00"
"1635226495-16404","https://colemanfurniture.com/accents/plant-stands.htm","Alon Gel Coat White 17"" Planter","$499.00"
"1635226495-16472","https://colemanfurniture.com/accents/plant-stands.htm","Moonstone Gray Large Planter","$205.00"
"1635226495-16538","https://colemanfurniture.com/accents/plant-stands.htm","String Theory Silver Leaf Medium Planter","$749.00"
"1635226495-16531","https://colemanfurniture.com/accents/plant-stands.htm","Rustica White 5"" Planter","$69.00"
"1635226495-16340","https://colemanfurniture.com/accents/plant-stands.htm","Oyster Blue Large Selena Slab Planter","$127.50"
"1635226495-16431","https://colemanfurniture.com/accents/plant-stands.htm","Crazy Cut Stainless Steel Triangle Large Planter","$2949.00"
"1635226495-16323","https://colemanfurniture.com/accents/plant-stands.htm","Mari Calla Moss Accent Planter","$261.80"
"1635226495-16343","https://colemanfurniture.com/accents/plant-stands.htm","3044 Cappuccino Marble / Bronze Metal Plant Stand","$155.00"
"1635226495-16482","https://colemanfurniture.com/accents/plant-stands.htm","Rustica White 7"" Planter","$105.00"
"1635226495-16462","https://colemanfurniture.com/accents/plant-stands.htm","String Theory Bronze Medium Planter","$949.00"
"1635226495-16430","https://colemanfurniture.com/accents/plant-stands.htm","Facet Chrome Rectangular Antique Mirror Planter","$289.00"
"1635226495-16546","https://colemanfurniture.com/accents/plant-stands.htm","Alon Polished Aluminum Planter","$449.00"
"1635226495-16313","https://colemanfurniture.com/accents/plant-stands.htm","Elonga Banana Small Planter","$829.00"
"1635226495-16455","https://colemanfurniture.com/accents/plant-stands.htm","ID85102 Brown and Black Teak Planter","$569.00"
"1635226495-16379","https://colemanfurniture.com/accents/plant-stands.htm","Puro Gold Leaf Large Planter","$889.00"
"1635226495-16357","https://colemanfurniture.com/accents/plant-stands.htm","Elonga Brown Large Planter","$1899.00"
"1635226495-16544","https://colemanfurniture.com/accents/plant-stands.htm","Classic Polished Aluminum Medium Planter","$929.00"
"1635226495-16384","https://colemanfurniture.com/accents/plant-stands.htm","Xhatch Brown Medium Antique Mirror Planter","$289.00"
"1635226495-16317","https://colemanfurniture.com/accents/plant-stands.htm","Big Sky Blue Glaze Large Planter","$79.00"
"1635226495-16533","https://colemanfurniture.com/accents/plant-stands.htm","Botanical Natural 4"" Planter","$65.00"
"1635226495-16400","https://colemanfurniture.com/accents/plant-stands.htm","Thayer Ingall Grey Ombre Planter","$329.00"
"1635226495-16345","https://colemanfurniture.com/accents/plant-stands.htm","Home Accents Taupe Gray 36"" X Side Plant Stand","$165.00"
"1635226495-16432","https://colemanfurniture.com/accents/plant-stands.htm","JP Roman Stone Right Slant Wall Planter","$499.00"
"1635226495-16388","https://colemanfurniture.com/accents/plant-stands.htm","Bullard Pewter Gray Large Planter","$235.00"
"1635226495-16513","https://colemanfurniture.com/accents/plant-stands.htm","Inda Brushed Brass Modern Ivory Plant Stand","$407.00"
"1635226495-16554","https://colemanfurniture.com/accents/plant-stands.htm","Rubia Multi Plant Stand","$639.00"
"1635226495-16420","https://colemanfurniture.com/accents/plant-stands.htm","Marlow White High Gloss Jed Tall Planter","$179.00"
"1635226495-16476","https://colemanfurniture.com/accents/plant-stands.htm","Spice Black 7"" Planter","$79.00"
"1635226495-16441","https://colemanfurniture.com/accents/plant-stands.htm","Spirula Pewter Planter","$425.00"
"1635226495-16507","https://colemanfurniture.com/accents/plant-stands.htm","Ribbit Terracotta 12"" Planter","$79.00"
"1635226495-16574","https://colemanfurniture.com/accents/plant-stands.htm","Mando Gel Coat White Small Outdoor Planter","$599.00"
"1635226495-16505","https://colemanfurniture.com/accents/plant-stands.htm","Zoo Dark Grey 7"" Planter","$89.00"
"1635226495-16503","https://colemanfurniture.com/accents/plant-stands.htm","Santa Clarita Oval Marble Top Plant Stand","$239.00"
"1635226495-16537","https://colemanfurniture.com/accents/plant-stands.htm","Classic Polished Bronze Medium Planter","$929.00"
"1635226495-16523","https://colemanfurniture.com/accents/plant-stands.htm","Spiral White Tall Planter","$429.00"
"1635226495-16567","https://colemanfurniture.com/accents/plant-stands.htm","Oroville Sandstone Small Planter","$95.00"
"1635226495-16573","https://colemanfurniture.com/accents/plant-stands.htm","Abaca Brown Medium Classic Planter","$1249.00"
"1635226495-16560","https://colemanfurniture.com/accents/plant-stands.htm","June Raw Grey Extra Small Planter","$4499.00"
"1635226495-16334","https://colemanfurniture.com/accents/plant-stands.htm","Leos Large Planter","$115.00"
"1635226495-16366","https://colemanfurniture.com/accents/plant-stands.htm","Elaine Grey Small Planter","$469.00"
"1635226495-16480","https://colemanfurniture.com/accents/plant-stands.htm","Purple Glaze Small Aatos Planter","$139.00"
"1635226495-16450","https://colemanfurniture.com/accents/plant-stands.htm","June Raw Grey Large Slim Planter","$1239.00"
"1635226495-16338","https://colemanfurniture.com/accents/plant-stands.htm","Cappuccino 32"" Plant Stand","$149.00"
"1635226495-16514","https://colemanfurniture.com/accents/plant-stands.htm","Kenzie Copper Small Planter","$645.00"
"1635226495-16575","https://colemanfurniture.com/accents/plant-stands.htm","Lourdes Grey Large Planter","$599.00"
"1635226495-16348","https://colemanfurniture.com/accents/plant-stands.htm","Leos Small Planter","$79.00"
"1635226495-16321","https://colemanfurniture.com/accents/plant-stands.htm","Belmonte Floral Artificial Flowers Planter","$206.80"
"1635226495-16541","https://colemanfurniture.com/accents/plant-stands.htm","Santa Clarita Round Marble Top Plant Stand","$215.00"
