web-scraper-order,web-scraper-start-url,nnn,ppp
"1635226495-16492","https://colemanfurniture.com/accents/plant-stands.htm","Abaca Brown Large Classic Planter","$1879.00"
"1635226495-16519","https://colemanfurniture.com/accents/plant-stands.htm","Illustrator Cream 12"" Planter","$95.00"
"1635226495-16474","https://colemanfurniture.com/accents/plant-stands.htm","Alon Polished Aluminium Tall Planter","$999.00"
"1635226495-16481","https://colemanfurniture.com/accents/plant-stands.htm","Primrose Lava Small Planter","$445.00"
"1635226495-16352","https://colemanfurniture.com/accents/plant-stands.htm","Bullard Pewter Gray Small Planter","$175.00"
"1635226495-16393","https://colemanfurniture.com/accents/plant-stands.htm","Lourdes Grey Small Planter","$429.00"
"1635226495-16344","https://colemanfurniture.com/accents/plant-stands.htm","3094 Black / Silver Metal Plant Stand","$155.00"
"1635226495-16376","https://colemanfurniture.com/accents/plant-stands.htm","Rosen Large Planter","$99.00"
"1635226495-16407","https://colemanfurniture.com/accents/plant-stands.htm","Faceted Antique Mirror Round Planter","$249.00"
"1635226495-16315","https://colemanfurniture.com/accents/plant-stands.htm","Libby Lime Green Greek Key Motif Small Planter","$139.00"
"1635226495-16372","https://colemanfurniture.com/accents/plant-stands.htm","Classic Antique Mirror Planter","$159.00"
"1635226495-16511","https://colemanfurniture.com/accents/plant-stands.htm","Barren Polished Aluminum Resin Small Outdoor Planter","$399.00"
"1635226495-16337","https://colemanfurniture.com/accents/plant-stands.htm","Home Accents Taupe Gray 30"" X Side Plant Stand","$149.00"
"1635226495-16552","https://colemanfurniture.com/accents/plant-stands.htm","JP Bronze Medium Planter","$1249.00"
"1635226495-16350","https://colemanfurniture.com/accents/plant-stands.htm","Belmonte Floral Artificial Flowers Planter","$206.80"
"1635226495-16328","https://colemanfurniture.com/accents/plant-stands.htm","Bullard Pewter Gray Large Planter","$235.00"
"1635226495-16460","https://colemanfurniture.com/accents/plant-stands.htm","Elonga Polished Bronze Medium Planter","$1379.00"
"1635226495-16402","https://colemanfurniture.com/accents/plant-stands.htm","Rucco Off White Small Outdoor Planter","$329.00"
"1635226495-16427","https://colemanfurniture.com/accents/plant-stands.htm","PH67845 Gel Coat White Flamingo Planter","$599.00"
"1635226495-16510","https://colemanfurniture.com/accents/plant-stands.htm","Griswold Grey Large Planter","$679.00"
"1635226495-16490","https://colemanfurniture.com/accents/plant-stands.htm","Cassidy Grey Medium Planter","$149.00"
"1635226495-16408","https://colemanfurniture.com/accents/plant-stands.htm","Homage Ash Gray Small Planter","$69.00"
"1635226495-16498","https://colemanfurniture.com/accents/plant-stands.htm","Atlantic And Lava Rectangular Planter","$519.00"
"1635226495-16471","https://colemanfurniture.com/accents/plant-stands.htm","Botanical Natural 6"" Planter","$69.00"
"1635226495-16417","https://colemanfurniture.com/accents/plant-stands.htm","Ava White Small Planter","$399.00"
"1635226495-16486","https://colemanfurniture.com/accents/plant-stands.htm","900934 Cherry Accent Table","$135.00"
"1635226495-16545","https://colemanfurniture.com/accents/plant-stands.htm","Griswold Grey Small Planter","$449.00"
"1635226495-16312","https://colemanfurniture.com/accents/plant-stands.htm","Santa Clarita Rectangular Marble Top Plant Stand","$545.00"
"1635226495-16415","https://colemanfurniture.com/accents/plant-stands.htm","Alon Gel Coat White Outdoor Planter","$649.00"
"1635226495-16495","https://colemanfurniture.com/accents/plant-stands.htm","Holland Rustic Patina Planter","$280.00"
"1635226495-16570","https://colemanfurniture.com/accents/plant-stands.htm","Everest Ivory And Atlantic Round Planter","$315.00"
"1635226495-16525","https://colemanfurniture.com/accents/plant-stands.htm","Cache Creek Brown Sandstone Small Planter","$69.00"
"1635226495-16371","https://colemanfurniture.com/accents/plant-stands.htm","Katie Off White Medium Planter","$1329.00"
"1635226495-16445","https://colemanfurniture.com/accents/plant-stands.htm","Katie Off White Small Planter","$1249.00"
"1635226495-16442","https://colemanfurniture.com/accents/plant-stands.htm","Woodland Ebony And Warm Wheat Rattan Bogar Large Planter","$379.00"
"1635226495-16356","https://colemanfurniture.com/accents/plant-stands.htm","Libby Yellow Greek Key Motif Small Planter","$139.00"
"1635226495-16515","https://colemanfurniture.com/accents/plant-stands.htm","Kenzie Copper Large Planter","$1150.00"
"1635226495-16454","https://colemanfurniture.com/accents/plant-stands.htm","Cami White Orchid Planter","$261.80"
"1635226495-16550","https://colemanfurniture.com/accents/plant-stands.htm","Harvest Light Grey Large Planter","$199.00"
"1635226495-16478","https://colemanfurniture.com/accents/plant-stands.htm","Luce Aged Brass Large Planter","$458.75"
"1635226495-16551","https://colemanfurniture.com/accents/plant-stands.htm","JP Roman Stone Center Slant Wall Planter","$499.00"
"1635226495-16542","https://colemanfurniture.com/accents/plant-stands.htm","ID85101 Black and Grey Teak Planter","$629.00"
"1635226495-16414","https://colemanfurniture.com/accents/plant-stands.htm","JP Silver Leaf Medium Planter","$1249.00"
"1635226495-16502","https://colemanfurniture.com/accents/plant-stands.htm","Antique White Blue Accents Medium Venice Planter","$335.00"
"1635226495-16395","https://colemanfurniture.com/accents/plant-stands.htm","Libby Turquoise Greek Key Motif Planter","$139.00"
"1635226495-16458","https://colemanfurniture.com/accents/plant-stands.htm","June Grey Large Square Planter","$1079.00"
"1635226495-16318","https://colemanfurniture.com/accents/plant-stands.htm","Chamos Blue Large Planter","$79.00"
"1635226495-16572","https://colemanfurniture.com/accents/plant-stands.htm","June Raw Grey Large Planter","$999.00"
"1635226495-16413","https://colemanfurniture.com/accents/plant-stands.htm","Elonga Polished Aluminum Large Planter","$1899.00"
"1635226495-16536","https://colemanfurniture.com/accents/plant-stands.htm","June Raw Grey Extra Large Planter","$729.00"
"1635226495-16564","https://colemanfurniture.com/accents/plant-stands.htm","June White Medium Planter","$1249.00"
"1635226495-16361","https://colemanfurniture.com/accents/plant-stands.htm","Bristol Ivory Terrazzo Bristol Planter","$529.00"
"1635226495-16457","https://colemanfurniture.com/accents/plant-stands.htm","Harvest Dark Grey Small Planter","$99.00"
"1635226495-16548","https://colemanfurniture.com/accents/plant-stands.htm","Heritage Jardiniere","$469.00"
"1635226495-16362","https://colemanfurniture.com/accents/plant-stands.htm","Elonga Banana Large Planter","$1699.00"
"1635226495-16309","https://colemanfurniture.com/accents/plant-stands.htm","Domele Antique Gray And Brown Planter Set Of 2","$99.00"
"1635226495-16381","https://colemanfurniture.com/accents/plant-stands.htm","Breathe Aluminum Outdoor Planter","$749.00"
"1635226495-16487","https://colemanfurniture.com/accents/plant-stands.htm","900936 Espresso Accent Table","$129.00"
"1635226495-16316","https://colemanfurniture.com/accents/plant-stands.htm","Libby Yellow Greek Key Motif Small Planter","$139.00"
"1635226495-16353","https://colemanfurniture.com/accents/plant-stands.htm","Elonga Banana Small Planter","$829.00"
"1635226495-16518","https://colemanfurniture.com/accents/plant-stands.htm","Primrose Lava Large Planter","$715.00"
"1635226495-16477","https://colemanfurniture.com/accents/plant-stands.htm","900926 Brown Accent Table","$135.00"
"1635226495-16493","https://colemanfurniture.com/accents/plant-stands.htm","Erie Hors D'Oeuvres Planter","$209.00"
"1635226495-16444","https://colemanfurniture.com/accents/plant-stands.htm","Katie Off White Large Planter","$2249.00"
"1635226495-16325","https://colemanfurniture.com/accents/plant-stands.htm","Elonga Brown Large Planter","$1899.00"
"1635226495-16341","https://colemanfurniture.com/accents/plant-stands.htm","Green Crackle Small Accordion Planter","$102.50"
"1635226495-16499","https://colemanfurniture.com/accents/plant-stands.htm","Rustica Brown 6"" Planter","$85.00"
"1635226495-16330","https://colemanfurniture.com/accents/plant-stands.htm","Oyster Blue Large Selena Slab Planter","$127.50"
"1635226495-16532","https://colemanfurniture.com/accents/plant-stands.htm","Herb White 7"" Planter","$75.00"
"1635226495-16569","https://colemanfurniture.com/accents/plant-stands.htm","Santa Clarita Square Marble Top Plant Stand","$215.00"
"1635226495-16346","https://colemanfurniture.com/accents/plant-stands.htm","White 32"" Plant Stand","$165.00"
"1635226495-16565","https://colemanfurniture.com/accents/plant-stands.htm","June White Small Planter","$929.00"
"1635226495-16561","https://colemanfurniture.com/accents/plant-stands.htm","Moonstone Gray Small Planter","$175.00"
"1635226495-16401","https://colemanfurniture.com/accents/plant-stands.htm","Elonga Brown Medium Planter","$1329.00"
"1635226495-16374","https://colemanfurniture.com/accents/plant-stands.htm","Big Sky Blue Glaze Small Planter","$69.00"
"1635226495-16351","https://colemanfurniture.com/accents/plant-stands.htm","Chamos Blue Large Planter","$79.00"
"1635226495-16483","https://colemanfurniture.com/accents/plant-stands.htm","Barren Polished Aluminum Resin Medium Outdoor Planter","$569.00"
"1635226495-16464","https://colemanfurniture.com/accents/plant-stands.htm","Cache Creek Brown Sandstone Large Planter","$79.00"
"1635226495-16556","https://colemanfurniture.com/accents/plant-stands.htm","Scoria Gray Small Planter","$222.50"
"1635226495-16491","https://colemanfurniture.com/accents/plant-stands.htm","Illustrator Cream 8"" Planter","$69.00"
"1635226495-16355","https://colemanfurniture.com/accents/plant-stands.htm","Libby Lime Green Greek Key Motif Small Planter","$139.00"
"1635226495-16440","https://colemanfurniture.com/accents/plant-stands.htm","Kinsale Moss Centerpiece Planter","$349.80"
"1635226495-16469","https://colemanfurniture.com/accents/plant-stands.htm","Scoria Gray Large Planter","$235.00"
"1635226495-16359","https://colemanfurniture.com/accents/plant-stands.htm","String Theory Bronze Small Planter","$579.00"
"1635226495-16429","https://colemanfurniture.com/accents/plant-stands.htm","Ibero Split Leaf Palm Planter","$363.00"
"1635226495-16489","https://colemanfurniture.com/accents/plant-stands.htm","Isela Medium Planter","$85.00"
"1635226495-16500","https://colemanfurniture.com/accents/plant-stands.htm","Elonga Polished Bronze Large Planter","$1899.00"
"1635226495-16382","https://colemanfurniture.com/accents/plant-stands.htm","Spiral White Small Planter","$429.00"
"1635226495-16470","https://colemanfurniture.com/accents/plant-stands.htm","Specimen White And Black 12"" Planter","$125.00"
"1635226495-16512","https://colemanfurniture.com/accents/plant-stands.htm","Ava White Large Planter","$699.00"
"1635226495-16484","https://colemanfurniture.com/accents/plant-stands.htm","Grenton Natural Outdoor 4 Tier Plant Stand","$159.00"
"1635226495-16363","https://colemanfurniture.com/accents/plant-stands.htm","Rucco Off White Medium Outdoor Planter","$499.00"
"1635226495-16559","https://colemanfurniture.com/accents/plant-stands.htm","June Raw Grey Small Planter","$2249.00"
"1635226495-16456","https://colemanfurniture.com/accents/plant-stands.htm","Harvest Dark Grey Large Planter","$199.00"
"1635226495-16534","https://colemanfurniture.com/accents/plant-stands.htm","Herb White 9"" Planter","$95.00"
"1635226495-16392","https://colemanfurniture.com/accents/plant-stands.htm","String Theory Silver Leaf Small Planter","$479.00"
"1635226495-16557","https://colemanfurniture.com/accents/plant-stands.htm","Woodgra Grey 7"" Planter","$69.00"
"1635226495-16368","https://colemanfurniture.com/accents/plant-stands.htm","Xhatch Brown Small Antique Mirror Planter","$219.00"
"1635226495-16333","https://colemanfurniture.com/accents/plant-stands.htm","Home Accents White 36"" X Side Plant Stand","$165.00"
"1635226495-16524","https://colemanfurniture.com/accents/plant-stands.htm","Metalworks Heritage Planter","$479.00"
"1635226495-16466","https://colemanfurniture.com/accents/plant-stands.htm","Cassidy Grey Large Planter","$189.00"
"1635226495-16406","https://colemanfurniture.com/accents/plant-stands.htm","Bubbles Gold and White Small Planter","$2369.00"
"1635226495-16370","https://colemanfurniture.com/accents/plant-stands.htm","Harvest Light Grey Small Planter","$99.00"
"1635226495-16397","https://colemanfurniture.com/accents/plant-stands.htm","Big Sky Blue Glaze Large Planter","$79.00"
"1635226495-16539","https://colemanfurniture.com/accents/plant-stands.htm","4040 Warm Brown Accent Table","$195.00"
"1635226495-16443","https://colemanfurniture.com/accents/plant-stands.htm","Alon Gel Coat White Planter","$449.00"
"1635226495-16516","https://colemanfurniture.com/accents/plant-stands.htm","Mezzanine Planters","$225.00"
"1635226495-16520","https://colemanfurniture.com/accents/plant-stands.htm","Spice Dark Grey 5"" Planter","$69.00"
"1635226495-16473","https://colemanfurniture.com/accents/plant-stands.htm","Natural Stone Large Selena Basin Planter","$145.00"
"1635226495-16488","https://colemanfurniture.com/accents/plant-stands.htm","Oroville Sandstone Large Planter","$116.25"
"1635226495-16347","https://colemanfurniture.com/accents/plant-stands.htm","Golden Antique Small Acorn Planter","$122.50"
"1635226495-16453","https://colemanfurniture.com/accents/plant-stands.htm","Ripple Gel Coat Black Outdoor Planter","$749.00"
"1635226495-16549","https://colemanfurniture.com/accents/plant-stands.htm","Round Farmhouse Beauty Planter","$175.00"
"1635226495-16461","https://colemanfurniture.com/accents/plant-stands.htm","PH61015 Off White Small Squarish Planter","$149.00"
"1635226495-16331","https://colemanfurniture.com/accents/plant-stands.htm","Green Crackle Small Accordion Planter","$102.50"
"1635226495-16521","https://colemanfurniture.com/accents/plant-stands.htm","Woodgra Dark Grey 9"" Planter","$89.00"
"1635226495-16496","https://colemanfurniture.com/accents/plant-stands.htm","Taft Large Planter","$157.50"
"1635226495-16509","https://colemanfurniture.com/accents/plant-stands.htm","Herb White 5"" Planter","$65.00"
"1635226495-16320","https://colemanfurniture.com/accents/plant-stands.htm","Cascade Screen Planter","$437.50"
"1635226495-16380","https://colemanfurniture.com/accents/plant-stands.htm","Turbo Gel Coat White Outdoor Planter","$449.00"
"1635226495-16319","https://colemanfurniture.com/accents/plant-stands.htm","Bullard Pewter Gray Small Planter","$175.00"
"1635226495-16447","https://colemanfurniture.com/accents/plant-stands.htm","La Costa Greenery Set 3","$437.80"
"1635226495-16535","https://colemanfurniture.com/accents/plant-stands.htm","Woodgra Coffee 5"" Planter","$65.00"
"1635226495-16394","https://colemanfurniture.com/accents/plant-stands.htm","Mixt Grey Arbor Small Planter","$275.00"
"1635226495-16332","https://colemanfurniture.com/accents/plant-stands.htm","Marlow White High Gloss Jed Planter","$179.00"
"1635226495-16506","https://colemanfurniture.com/accents/plant-stands.htm","Ribbit Terracotta 10"" Planter","$79.00"
"1635226495-16526","https://colemanfurniture.com/accents/plant-stands.htm","Taft Small Planter","$77.50"
"1635226495-16571","https://colemanfurniture.com/accents/plant-stands.htm","Naturalist Warm Grey Small Planter","$59.00"
"1635226495-16396","https://colemanfurniture.com/accents/plant-stands.htm","Regency Antique Mirror Planter","$249.00"
"1635226495-16412","https://colemanfurniture.com/accents/plant-stands.htm","Elonga Polished Aluminum Small Planter","$829.00"
"1635226495-16501","https://colemanfurniture.com/accents/plant-stands.htm","Claire White Large Planter","$699.00"
"1635226495-16326","https://colemanfurniture.com/accents/plant-stands.htm","Lala Green Glaze Lamb Planter","$32.50"
"1635226495-16448","https://colemanfurniture.com/accents/plant-stands.htm","Crazy Cut Stainless Steel Triangle Small Planter","$1699.00"
"1635226495-16411","https://colemanfurniture.com/accents/plant-stands.htm","Brianna String Raw Grey Medium Planter","$1079.00"
"1635226495-16367","https://colemanfurniture.com/accents/plant-stands.htm","Claire White Small Planter","$379.00"
"1635226495-16369","https://colemanfurniture.com/accents/plant-stands.htm","Harvest Dark Grey Medium Planter","$149.00"
"1635226495-16342","https://colemanfurniture.com/accents/plant-stands.htm","Cappuccino 32"" Storage Plant Stand","$165.00"
"1635226495-16563","https://colemanfurniture.com/accents/plant-stands.htm","Specimen White And Black 9"" Planter","$89.00"
"1635226495-16522","https://colemanfurniture.com/accents/plant-stands.htm","Elonga Natural Weave Medium Planter","$949.00"
"1635226495-16433","https://colemanfurniture.com/accents/plant-stands.htm","June Raw Grey Small Slim Planter","$629.00"
"1635226495-16410","https://colemanfurniture.com/accents/plant-stands.htm","June Raw Grey Medium Slim Planter","$949.00"
"1635226495-16558","https://colemanfurniture.com/accents/plant-stands.htm","Brianna String Raw Grey Large Planter","$1239.00"
"1635226495-16475","https://colemanfurniture.com/accents/plant-stands.htm","Byers Small Planter","$202.50"
"1635226495-16562","https://colemanfurniture.com/accents/plant-stands.htm","Tait Small Planter","$109.00"
"1635226495-16467","https://colemanfurniture.com/accents/plant-stands.htm","Elonga Brown Small Planter","$829.00"
"1635226495-16553","https://colemanfurniture.com/accents/plant-stands.htm","Mando Aluminum Large Outdoor Planter","$949.00"
"1635226495-16389","https://colemanfurniture.com/accents/plant-stands.htm","Marlow White High Gloss Jed Planter","$179.00"
"1635226495-16387","https://colemanfurniture.com/accents/plant-stands.htm","Big Sky Blue Glaze Medium Planter","$69.00"
"1635226495-16428","https://colemanfurniture.com/accents/plant-stands.htm","Turbo Aluminum and Black Small Planter","$469.00"
"1635226495-16452","https://colemanfurniture.com/accents/plant-stands.htm","JP Bronze Small Planter","$749.00"
"1635226495-16438","https://colemanfurniture.com/accents/plant-stands.htm","PH60980 White Short Spiral Planter","$379.00"
"1635226495-16437","https://colemanfurniture.com/accents/plant-stands.htm","Potomac Pewter Gray Large Planter","$95.00"
"1635226495-16335","https://colemanfurniture.com/accents/plant-stands.htm","Raleigh Planter","$132.50"
"1635226495-16311","https://colemanfurniture.com/accents/plant-stands.htm","Antique Blue Small Marina Bay Planter","$127.50"
"1635226495-16508","https://colemanfurniture.com/accents/plant-stands.htm","Naturalist Dark Grey Large Planter","$59.00"
"1635226495-16336","https://colemanfurniture.com/accents/plant-stands.htm","Leos Medium Planter","$95.00"
"1635226495-16566","https://colemanfurniture.com/accents/plant-stands.htm","Homage Ash Gray Large Planter","$79.00"
"1635226495-16365","https://colemanfurniture.com/accents/plant-stands.htm","Mando Gel Coat White Large Outdoor Planter","$879.00"
"1635226495-16449","https://colemanfurniture.com/accents/plant-stands.htm","JP Roman Stone Left Slant Wall Planter","$499.00"
"1635226495-16485","https://colemanfurniture.com/accents/plant-stands.htm","Cast Iron and Stone Jardiniere","$469.00"
"1635226495-16468","https://colemanfurniture.com/accents/plant-stands.htm","Byers Large Planter","$437.50"
"1635226495-16422","https://colemanfurniture.com/accents/plant-stands.htm","June White Large Planter","$1999.00"
"1635226495-16377","https://colemanfurniture.com/accents/plant-stands.htm","Everest White and Brown Large Planter","$379.00"
"1635226495-16527","https://colemanfurniture.com/accents/plant-stands.htm","Coliseum Large Planter","$255.00"
"1635226495-16324","https://colemanfurniture.com/accents/plant-stands.htm","Dark Taupe Reclaimed-Look 32"" Plant Stand","$165.00"
"1635226495-16423","https://colemanfurniture.com/accents/plant-stands.htm","June White Extra Small Planter","$649.00"
"1635226495-16373","https://colemanfurniture.com/accents/plant-stands.htm","Masterpiece Chatswoth Cottage White Pedestal Plant Stand","$239.00"
"1635226495-16349","https://colemanfurniture.com/accents/plant-stands.htm","Oyster Blue Small Selena Slab Planter","$67.50"
"1635226495-16385","https://colemanfurniture.com/accents/plant-stands.htm","Xhatch Brown Large Antique Mirror Planter","$289.00"
"1635226495-16494","https://colemanfurniture.com/accents/plant-stands.htm","3315 Merlot Accent Table","$119.00"
"1635226495-16497","https://colemanfurniture.com/accents/plant-stands.htm","Home Accents White 30"" X Side Plant Stand","$149.00"
"1635226495-16528","https://colemanfurniture.com/accents/plant-stands.htm","Natural Stone Small Selena Basin Planter","$99.00"
"1635226495-16425","https://colemanfurniture.com/accents/plant-stands.htm","PH59427 Silver Leaf Large Honey Dipper Planter","$499.00"
"1635226495-16517","https://colemanfurniture.com/accents/plant-stands.htm","Green Crackle Large Accordion Planter","$167.50"
"1635226495-16378","https://colemanfurniture.com/accents/plant-stands.htm","Classic Polished Aluminum Large Planter","$1499.00"
"1635226495-16398","https://colemanfurniture.com/accents/plant-stands.htm","Masterpiece Pedestal Plant Stand","$269.00"
"1635226495-16435","https://colemanfurniture.com/accents/plant-stands.htm","Brianna String Raw Grey Small Planter","$699.00"
"1635226495-16451","https://colemanfurniture.com/accents/plant-stands.htm","Rucco Off White Large Outdoor Planter","$699.00"
"1635226495-16463","https://colemanfurniture.com/accents/plant-stands.htm","Elaine Grey Large Planter","$1419.00"
"1635226495-16375","https://colemanfurniture.com/accents/plant-stands.htm","Potomac Pewter Gray Small Planter","$79.00"
"1635226495-16446","https://colemanfurniture.com/accents/plant-stands.htm","Mixt Grey Arbor Large Planter","$395.00"
"1635226495-16327","https://colemanfurniture.com/accents/plant-stands.htm","Big Sky Blue Glaze Medium Planter","$69.00"
"1635226495-16434","https://colemanfurniture.com/accents/plant-stands.htm","June Grey Small Square Planter","$739.00"
"1635226495-16547","https://colemanfurniture.com/accents/plant-stands.htm","Elaine Grey Medium Planter","$849.00"
"1635226495-16555","https://colemanfurniture.com/accents/plant-stands.htm","Fasita Antique Brass Planter","$380.60"
"1635226495-16530","https://colemanfurniture.com/accents/plant-stands.htm","Specimen White And Black 7"" Planter","$79.00"
"1635226495-16418","https://colemanfurniture.com/accents/plant-stands.htm","Lourdes Grey Medium Planter","$479.00"
"1635226495-16391","https://colemanfurniture.com/accents/plant-stands.htm","Elonga Natural Weave Small Planter","$629.00"
"1635226495-16409","https://colemanfurniture.com/accents/plant-stands.htm","Large Round Stoney Planter","$99.00"
"1635226495-16383","https://colemanfurniture.com/accents/plant-stands.htm","Bubbles Gold and White Large Planter","$3739.00"
"1635226495-16479","https://colemanfurniture.com/accents/plant-stands.htm","Small Round Stoney Planter","$79.00"
"1635226495-16329","https://colemanfurniture.com/accents/plant-stands.htm","Coliseum Small Planter","$157.50"
"1635226495-16358","https://colemanfurniture.com/accents/plant-stands.htm","Mari Calla Moss Accent Planter","$261.80"
"1635226495-16426","https://colemanfurniture.com/accents/plant-stands.htm","JP Off White Roman Stone Medium Planter","$879.00"
"1635226495-16439","https://colemanfurniture.com/accents/plant-stands.htm","Ripple Gel Coat White Outdoor Planter","$399.00"
"1635226495-16416","https://colemanfurniture.com/accents/plant-stands.htm","Alon Polished Aluminium Small Planter","$1169.00"
"1635226495-16339","https://colemanfurniture.com/accents/plant-stands.htm","Coliseum Small Planter","$157.50"
"1635226495-16360","https://colemanfurniture.com/accents/plant-stands.htm","Marlow Dark Brass Jed Planter","$179.00"
"1635226495-16403","https://colemanfurniture.com/accents/plant-stands.htm","Breathe Gel Coat White Outdoor Planter","$799.00"
"1635226495-16390","https://colemanfurniture.com/accents/plant-stands.htm","Harvest Light Grey Medium Planter","$149.00"
"1635226495-16504","https://colemanfurniture.com/accents/plant-stands.htm","Cassidy Grey Small Planter","$96.00"
"1635226495-16436","https://colemanfurniture.com/accents/plant-stands.htm","Chamos Blue Small Planter","$69.00"
"1635226495-16459","https://colemanfurniture.com/accents/plant-stands.htm","June Grey Extra Large Square Planter","$1479.00"
"1635226495-16386","https://colemanfurniture.com/accents/plant-stands.htm","Libby Yellow Greek Key Motif Large Planter","$165.00"
"1635226495-16405","https://colemanfurniture.com/accents/plant-stands.htm","Terra Black and Brass Planter","$3739.00"
"1635226495-16314","https://colemanfurniture.com/accents/plant-stands.htm","Turbo Aluminum and Black Large Planter","$869.00"
"1635226495-16310","https://colemanfurniture.com/accents/plant-stands.htm","3078 Black Metal Plant Stand","$169.00"
"1635226495-16322","https://colemanfurniture.com/accents/plant-stands.htm","String Theory Bronze Small Planter","$579.00"
"1635226495-16568","https://colemanfurniture.com/accents/plant-stands.htm","Isela Large Planter","$116.25"
"1635226495-16424","https://colemanfurniture.com/accents/plant-stands.htm","June Grey Medium Square Planter","$879.00"
"1635226495-16399","https://colemanfurniture.com/accents/plant-stands.htm","Masterpiece Chatswoth Driftwood Pedestal Plant Stand","$259.00"
"1635226495-16543","https://colemanfurniture.com/accents/plant-stands.htm","June Raw Grey Medium Planter","$1499.00"
"1635226495-16540","https://colemanfurniture.com/accents/plant-stands.htm","Luce Aged Brass Small Planter","$258.75"
"1635226495-16421","https://colemanfurniture.com/accents/plant-stands.htm","June White Extra Large Planter","$3999.00"
"1635226495-16419","https://colemanfurniture.com/accents/plant-stands.htm","Woodland Ebony And Warm Wheat Rattan Bogar Small Planter","$199.00"
