web-scraper-order,web-scraper-start-url,nnn,ppp
"1635221837-2650","https://colemanfurniture.com/accents/coffee-tables-cocktail-tables.htm","Miniore Black Coffee Table","$519.00"
"1635221837-5460","https://colemanfurniture.com/accents/coffee-tables-cocktail-tables.htm","Ikon Gold Shiloh Coffee Table","$3639.00"
"1635221837-2818","https://colemanfurniture.com/accents/coffee-tables-cocktail-tables.htm","Conga Metallic Coffee Table","$599.00"
"1635221837-5225","https://colemanfurniture.com/accents/coffee-tables-cocktail-tables.htm","Volker Fresh White Coffee Table","$1075.80"
"1635221837-3025","https://colemanfurniture.com/accents/coffee-tables-cocktail-tables.htm","Waco Espresso Cocktail Table","$255.00"
"1635221837-3940","https://colemanfurniture.com/accents/coffee-tables-cocktail-tables.htm","Crosscut Black and Grey Stone Forged Coffee Table","$749.00"
"1635221837-4071","https://colemanfurniture.com/accents/coffee-tables-cocktail-tables.htm","PH102848 Faux Grey Cast Organic River Stone Coffee Table","$1129.00"
"1635221837-3132","https://colemanfurniture.com/accents/coffee-tables-cocktail-tables.htm","Penderton Rectangular Lift-top Cocktail Table","$679.00"
"1635221837-3633","https://colemanfurniture.com/accents/coffee-tables-cocktail-tables.htm","Shell Grey and Silver Ming Coffee Table","$6749.00"
"1635221837-5302","https://colemanfurniture.com/accents/coffee-tables-cocktail-tables.htm","Cindy Clear Acrylic Coffee Table","$1974.00"
"1635221837-4578","https://colemanfurniture.com/accents/coffee-tables-cocktail-tables.htm","Santa Fe Dark Chocolate Coffee Table","$370.00"
"1635221837-4959","https://colemanfurniture.com/accents/coffee-tables-cocktail-tables.htm","Altamonte Dark Charcoal Grey Storage Cocktail Table","$765.00"
"1635221837-3075","https://colemanfurniture.com/accents/coffee-tables-cocktail-tables.htm","Shelton Oilslick Honeycomb Cocktail Table","$789.00"
"1635221837-2656","https://colemanfurniture.com/accents/coffee-tables-cocktail-tables.htm","Bodalli Brown Coffee Table","$269.00"
"1635221837-4846","https://colemanfurniture.com/accents/coffee-tables-cocktail-tables.htm","Cypress Root Brown Coffee Table","$1025.00"
"1635221837-5522","https://colemanfurniture.com/accents/coffee-tables-cocktail-tables.htm","Westport Ash Grey Brunetto Small Coffee Table","$2769.00"
"1635221837-3544","https://colemanfurniture.com/accents/coffee-tables-cocktail-tables.htm","Clover Grey Stone Chamcha Wood Coffee Table","$2499.00"
"1635221837-4636","https://colemanfurniture.com/accents/coffee-tables-cocktail-tables.htm","Manchester Coffee Table","$979.00"
"1635221837-4088","https://colemanfurniture.com/accents/coffee-tables-cocktail-tables.htm","Hamilton Dark Stain Tranquil Square Cocktail Table","$425.00"
"1635221837-5394","https://colemanfurniture.com/accents/coffee-tables-cocktail-tables.htm","Homestead Tobacco Leaf Small Cocktail Table","$495.00"
"1635221837-3725","https://colemanfurniture.com/accents/coffee-tables-cocktail-tables.htm","Drew Cherry Rectangular Coffee Table","$349.00"
"1635221837-4848","https://colemanfurniture.com/accents/coffee-tables-cocktail-tables.htm","724178 Champagne And Silver Coffee Table","$1015.00"
"1635221837-2616","https://colemanfurniture.com/accents/coffee-tables-cocktail-tables.htm","Americana Modern Cotton Cocktail Table","$759.00"
"1635221837-5371","https://colemanfurniture.com/accents/coffee-tables-cocktail-tables.htm","673 Modern Grey Coffee Table","$799.00"
"1635221837-3831","https://colemanfurniture.com/accents/coffee-tables-cocktail-tables.htm","Bellamy Grey Round Cocktail Table","$379.00"
"1635221837-2952","https://colemanfurniture.com/accents/coffee-tables-cocktail-tables.htm","ID85099 Grey Round Top Coffee Table","$1499.00"
"1635221837-5080","https://colemanfurniture.com/accents/coffee-tables-cocktail-tables.htm","Leveni Wooden Coffee Table","$803.00"
"1635221837-2677","https://colemanfurniture.com/accents/coffee-tables-cocktail-tables.htm","Danell Ridge Brown Rectangular Cocktail Table","$219.00"
"1635221837-3048","https://colemanfurniture.com/accents/coffee-tables-cocktail-tables.htm","Allure Pie Shaped Cocktail Table","$379.00"
"1635221837-4580","https://colemanfurniture.com/accents/coffee-tables-cocktail-tables.htm","Island Fusion Castaway Rectangular Cocktail Table","$2099.00"
"1635221837-5161","https://colemanfurniture.com/accents/coffee-tables-cocktail-tables.htm","Ikon Skyy Antique Brass Coffee Table","$2329.00"
"1635221837-4079","https://colemanfurniture.com/accents/coffee-tables-cocktail-tables.htm","Metal Designs Silver Leaf Per Se Square Cocktail Table","$1899.00"
"1635221837-3607","https://colemanfurniture.com/accents/coffee-tables-cocktail-tables.htm","Sutton Dark Burnished Steel Round Cocktail Table","$389.00"
"1635221837-3850","https://colemanfurniture.com/accents/coffee-tables-cocktail-tables.htm","Metro Cappuccino Round Cocktail Table","$865.00"
"1635221837-4727","https://colemanfurniture.com/accents/coffee-tables-cocktail-tables.htm","Isabelle Silver Acrylic Cocktail Table","$1455.00"
"1635221837-3500","https://colemanfurniture.com/accents/coffee-tables-cocktail-tables.htm","Dockside II White Cocktail Table","$392.00"
"1635221837-3752","https://colemanfurniture.com/accents/coffee-tables-cocktail-tables.htm","Metropolian Dark Cherry & Birch Oval Lift-Top Cocktail Table","$515.00"
"1635221837-3586","https://colemanfurniture.com/accents/coffee-tables-cocktail-tables.htm","Lincoln Park Gray Round Coffee Table","$1099.00"
"1635221837-3564","https://colemanfurniture.com/accents/coffee-tables-cocktail-tables.htm","DS-D486-202-1 Light Brown Metal Cocktail Table","$535.00"
"1635221837-4309","https://colemanfurniture.com/accents/coffee-tables-cocktail-tables.htm","Kingley Brown Tufted Cocktail Leather Ottoman","$1039.00"
"1635221837-4300","https://colemanfurniture.com/accents/coffee-tables-cocktail-tables.htm","Randi White Lacquer And Glass And Chrome 2 Tier Square Cocktail Table","$279.00"
"1635221837-3004","https://colemanfurniture.com/accents/coffee-tables-cocktail-tables.htm","Jefferson Gray Rectangular Coffee Table","$645.00"
"1635221837-3794","https://colemanfurniture.com/accents/coffee-tables-cocktail-tables.htm","Minot Brown Cherry Lift Top Drawer Cocktail Table","$904.00"
"1635221837-4696","https://colemanfurniture.com/accents/coffee-tables-cocktail-tables.htm","Mosaic Golden Wheat Small Square Cocktail Table","$865.00"
"1635221837-5217","https://colemanfurniture.com/accents/coffee-tables-cocktail-tables.htm","Bridle Black Belts Cocktail Table","$1257.90"
"1635221837-4070","https://colemanfurniture.com/accents/coffee-tables-cocktail-tables.htm","Ripple Silver Leaf With Antiquing Coffee Table","$1699.00"
"1635221837-5105","https://colemanfurniture.com/accents/coffee-tables-cocktail-tables.htm","723368 Golden Oak And Black Lift Top Coffee Table","$339.00"
"1635221837-5462","https://colemanfurniture.com/accents/coffee-tables-cocktail-tables.htm","Modern Farmhouse Buttermilk Round Cocktail Table","$1070.00"
"1635221837-4470","https://colemanfurniture.com/accents/coffee-tables-cocktail-tables.htm","Nina Magon White And Brown Magritte Round Cocktail Table","$2095.00"
"1635221837-4322","https://colemanfurniture.com/accents/coffee-tables-cocktail-tables.htm","Milano Sandstone Square Cocktail Table By Rachael Ray","$719.00"
"1635221837-5469","https://colemanfurniture.com/accents/coffee-tables-cocktail-tables.htm","Highgrove Silver Cocktail Table","$2309.00"
"1635221837-5046","https://colemanfurniture.com/accents/coffee-tables-cocktail-tables.htm","Zila Round Cocktail Table","$499.00"
"1635221837-3891","https://colemanfurniture.com/accents/coffee-tables-cocktail-tables.htm","Key West Pure White Oak Coffee Table","$345.00"
"1635221837-4669","https://colemanfurniture.com/accents/coffee-tables-cocktail-tables.htm","Molly Brown And Black 28"" Coffee Table","$589.00"
"1635221837-5268","https://colemanfurniture.com/accents/coffee-tables-cocktail-tables.htm","Orson Black And Gold Cap Cocktail Table","$185.00"
"1635221837-2768","https://colemanfurniture.com/accents/coffee-tables-cocktail-tables.htm","Denise Oak Cocktail Table","$353.00"
"1635221837-4613","https://colemanfurniture.com/accents/coffee-tables-cocktail-tables.htm","Sunbury Gold And Antiqued Silver Coffee Table","$1752.75"
"1635221837-3167","https://colemanfurniture.com/accents/coffee-tables-cocktail-tables.htm","Clark Station Rustic White Oak Coffee Table","$209.00"
"1635221837-4417","https://colemanfurniture.com/accents/coffee-tables-cocktail-tables.htm","Chicopee Sandstone Small Oval Cocktail Table","$95.00"
"1635221837-4182","https://colemanfurniture.com/accents/coffee-tables-cocktail-tables.htm","21 Cosmopolitan Diablo Orange And Umber Round Cocktail Table","$794.00"
"1635221837-2882","https://colemanfurniture.com/accents/coffee-tables-cocktail-tables.htm","Newport Sunbleached Ash Rectangular Cocktail Table","$1059.00"
"1635221837-4530","https://colemanfurniture.com/accents/coffee-tables-cocktail-tables.htm","Ad Modern Synergy Echo Bunching Cocktail Table","$300.00"
"1635221837-3745","https://colemanfurniture.com/accents/coffee-tables-cocktail-tables.htm","Sylvie Brushed Oak And Metal Round Coffee Table","$705.00"
"1635221837-4467","https://colemanfurniture.com/accents/coffee-tables-cocktail-tables.htm","Asia Round Coffee Table With Shelf","$635.00"
"1635221837-2633","https://colemanfurniture.com/accents/coffee-tables-cocktail-tables.htm","Rogness Rustic Brown Round Cocktail Table","$389.00"
"1635221837-5303","https://colemanfurniture.com/accents/coffee-tables-cocktail-tables.htm","Winnipeg Forged Champagne Coffee Table","$1082.00"
"1635221837-4674","https://colemanfurniture.com/accents/coffee-tables-cocktail-tables.htm","723268 Black Nickel Coffee Table","$459.00"
"1635221837-2941","https://colemanfurniture.com/accents/coffee-tables-cocktail-tables.htm","Allyson Park Wirebrushed White Rectangular Cocktail Table","$559.00"
"1635221837-5205","https://colemanfurniture.com/accents/coffee-tables-cocktail-tables.htm","Cast Naturals Silver Leaf Cast Root Square Coffee Table","$5749.00"
"1635221837-4007","https://colemanfurniture.com/accents/coffee-tables-cocktail-tables.htm","Molly Brown And Black 39"" Coffee Table","$1128.00"
"1635221837-3721","https://colemanfurniture.com/accents/coffee-tables-cocktail-tables.htm","Barry Dark Taupe Teardrop Cocktail Table","$139.00"
"1635221837-2946","https://colemanfurniture.com/accents/coffee-tables-cocktail-tables.htm","Hughes Bluestone Harlow Small Coffee Table","$1199.00"
"1635221837-3074","https://colemanfurniture.com/accents/coffee-tables-cocktail-tables.htm","23901 Greystone Inn Storage Coffee Table","$1449.00"
"1635221837-3784","https://colemanfurniture.com/accents/coffee-tables-cocktail-tables.htm","Hamilton Medium Stain Saddletree Rectangular Coffee Table","$475.00"
"1635221837-3210","https://colemanfurniture.com/accents/coffee-tables-cocktail-tables.htm","3054 Dark Taupe Cocktail Table","$259.00"
"1635221837-3055","https://colemanfurniture.com/accents/coffee-tables-cocktail-tables.htm","Lucia White Cocktail Table","$259.00"
"1635221837-2956","https://colemanfurniture.com/accents/coffee-tables-cocktail-tables.htm","700846 White And Brass Coffee Table","$747.00"
"1635221837-3422","https://colemanfurniture.com/accents/coffee-tables-cocktail-tables.htm","Rylee Gray Faux Sandstone And Black Rectangle Cocktail Table","$379.00"
"1635221837-5113","https://colemanfurniture.com/accents/coffee-tables-cocktail-tables.htm","Douglas Dark Brown 48"" Coffee Table","$305.00"
"1635221837-2759","https://colemanfurniture.com/accents/coffee-tables-cocktail-tables.htm","Milani Natural Cocktail Table","$439.00"
"1635221837-5187","https://colemanfurniture.com/accents/coffee-tables-cocktail-tables.htm","Accent Bench 56314","$535.00"
"1635221837-2747","https://colemanfurniture.com/accents/coffee-tables-cocktail-tables.htm","Nelson Cherry Lift-Top Cocktail Table","$445.00"
"1635221837-5509","https://colemanfurniture.com/accents/coffee-tables-cocktail-tables.htm","Hunter Brown Parquet Cocktail Table","$1009.00"
"1635221837-4936","https://colemanfurniture.com/accents/coffee-tables-cocktail-tables.htm","Grand Gray And Black Coffee Table","$1019.00"
"1635221837-2642","https://colemanfurniture.com/accents/coffee-tables-cocktail-tables.htm","Chevanna Platinum Coffee Table","$419.00"
"1635221837-3317","https://colemanfurniture.com/accents/coffee-tables-cocktail-tables.htm","Kiara White And Gunmetal Coffee Table","$1569.00"
"1635221837-4807","https://colemanfurniture.com/accents/coffee-tables-cocktail-tables.htm","Manelin Ash Gray Storage Drawer Cocktail Table","$529.00"
"1635221837-2712","https://colemanfurniture.com/accents/coffee-tables-cocktail-tables.htm","Candice Coffee Table","$1599.00"
"1635221837-5220","https://colemanfurniture.com/accents/coffee-tables-cocktail-tables.htm","Marley Brown Rectangular Coffee Table","$935.00"
"1635221837-4797","https://colemanfurniture.com/accents/coffee-tables-cocktail-tables.htm","Boswell Peppercorn Round Cocktail Table","$719.00"
"1635221837-3514","https://colemanfurniture.com/accents/coffee-tables-cocktail-tables.htm","Dynasty Rectangular Blue Glass Top Coffee Table","$1649.00"
"1635221837-3225","https://colemanfurniture.com/accents/coffee-tables-cocktail-tables.htm","Vue Gray Cocktail Table","$285.00"
"1635221837-2850","https://colemanfurniture.com/accents/coffee-tables-cocktail-tables.htm","Harvest Home Chalkboard Round Cocktail Table","$555.00"
"1635221837-3045","https://colemanfurniture.com/accents/coffee-tables-cocktail-tables.htm","Curated Divergence Charcoal Cocktail Table","$1150.00"
"1635221837-4682","https://colemanfurniture.com/accents/coffee-tables-cocktail-tables.htm","Stevens Painted Seagrass and Brass Coffee Table","$1389.00"
"1635221837-4754","https://colemanfurniture.com/accents/coffee-tables-cocktail-tables.htm","Tempo Dark Brown Round Cocktail Table","$874.00"
"1635221837-2839","https://colemanfurniture.com/accents/coffee-tables-cocktail-tables.htm","Bowery Tinsley Gray Square Coffee Table","$1049.00"
"1635221837-4343","https://colemanfurniture.com/accents/coffee-tables-cocktail-tables.htm","Homestead Tobacco Leaf Coffee Table","$503.00"
"1635221837-4952","https://colemanfurniture.com/accents/coffee-tables-cocktail-tables.htm","Hamilton Light Stain Pasadena Round Cocktail Table","$495.00"
"1635221837-5401","https://colemanfurniture.com/accents/coffee-tables-cocktail-tables.htm","Peace Satin Gold Cocktail Table","$299.00"
"1635221837-5365","https://colemanfurniture.com/accents/coffee-tables-cocktail-tables.htm","23800 Edgewater And Antique Brass Oval Coffee Table","$649.00"
"1635221837-5358","https://colemanfurniture.com/accents/coffee-tables-cocktail-tables.htm","Meyer Slate Gray 48"" Coffee Table","$295.00"
"1635221837-3015","https://colemanfurniture.com/accents/coffee-tables-cocktail-tables.htm","Palermo Warm Walnut Square Cocktail Table","$569.00"
"1635221837-3723","https://colemanfurniture.com/accents/coffee-tables-cocktail-tables.htm","Plantation Cherry 2427024 Butler Table","$429.00"
"1635221837-4251","https://colemanfurniture.com/accents/coffee-tables-cocktail-tables.htm","Laurel Canyon Esplanade Cherry Rectangular Cocktail Table","$1799.00"
"1635221837-2816","https://colemanfurniture.com/accents/coffee-tables-cocktail-tables.htm","Monterey Mink Cocktail Table","$529.00"
"1635221837-4059","https://colemanfurniture.com/accents/coffee-tables-cocktail-tables.htm","Metal Designs Black Ellipse Rectangular Cocktail Table","$1749.00"
"1635221837-3475","https://colemanfurniture.com/accents/coffee-tables-cocktail-tables.htm","Dynasty Rectangular Yellow Glass Top Coffee Table","$1649.00"
"1635221837-4243","https://colemanfurniture.com/accents/coffee-tables-cocktail-tables.htm","Signature Designs Bleached Walnut Chiavari Rect Cocktail Table","$3379.00"
"1635221837-5063","https://colemanfurniture.com/accents/coffee-tables-cocktail-tables.htm","Roman Dark Antique Silver Clock Cocktail Table","$339.00"
"1635221837-4701","https://colemanfurniture.com/accents/coffee-tables-cocktail-tables.htm","Chloe White Coffee Table","$1850.00"
"1635221837-3974","https://colemanfurniture.com/accents/coffee-tables-cocktail-tables.htm","Ninove I White High Gloss Coffee Table","$509.00"
"1635221837-3911","https://colemanfurniture.com/accents/coffee-tables-cocktail-tables.htm","Chalet Chrome And Grey Rectangular Coffee Table","$539.00"
"1635221837-4609","https://colemanfurniture.com/accents/coffee-tables-cocktail-tables.htm","Flora Natural And Brass Round Cocktail Table","$375.00"
"1635221837-4402","https://colemanfurniture.com/accents/coffee-tables-cocktail-tables.htm","Constantine Cherry Cocktail Table","$1081.00"
"1635221837-3101","https://colemanfurniture.com/accents/coffee-tables-cocktail-tables.htm","Highland Park Brushed White Loft Booker Round Cocktail Table","$787.00"
"1635221837-3605","https://colemanfurniture.com/accents/coffee-tables-cocktail-tables.htm","Gio Pewter Coffee Table","$1210.00"
"1635221837-3366","https://colemanfurniture.com/accents/coffee-tables-cocktail-tables.htm","Daniels Grayed Oak Rectangular Cocktail table","$689.00"
"1635221837-3931","https://colemanfurniture.com/accents/coffee-tables-cocktail-tables.htm","Signature Designs Silver Metropole Rectangular Cocktail Table","$3099.00"
"1635221837-4248","https://colemanfurniture.com/accents/coffee-tables-cocktail-tables.htm","Ad Modern Organics Smokey Quartz Ogden Rectangular Cocktail Table","$725.00"
"1635221837-3851","https://colemanfurniture.com/accents/coffee-tables-cocktail-tables.htm","Sibyl Brushed Brass Moon Coffee Table","$559.00"
"1635221837-4341","https://colemanfurniture.com/accents/coffee-tables-cocktail-tables.htm","Pamina Travertine Cocktail Table","$1009.00"
"1635221837-4890","https://colemanfurniture.com/accents/coffee-tables-cocktail-tables.htm","Molten Brown and Gold Poured Brass Small Coffee Table","$1749.00"
"1635221837-3385","https://colemanfurniture.com/accents/coffee-tables-cocktail-tables.htm","Isida Storm Grey 44"" Coffee Table","$239.00"
"1635221837-3618","https://colemanfurniture.com/accents/coffee-tables-cocktail-tables.htm","Heartland Antique White Rectangular Rustic Cocktail Table","$475.00"
"1635221837-4270","https://colemanfurniture.com/accents/coffee-tables-cocktail-tables.htm","Zelda Black Powder Coat And Antique Brass Square Coffee Table","$2379.00"
"1635221837-3742","https://colemanfurniture.com/accents/coffee-tables-cocktail-tables.htm","DS-D472-210-1 Brown Cocktail Table","$429.00"
"1635221837-4770","https://colemanfurniture.com/accents/coffee-tables-cocktail-tables.htm","Ponderay Gray And Black Coffee Table","$559.00"
"1635221837-4236","https://colemanfurniture.com/accents/coffee-tables-cocktail-tables.htm","Aria Silver Metal Cocktail Table","$1424.00"
"1635221837-3827","https://colemanfurniture.com/accents/coffee-tables-cocktail-tables.htm","Trance Cosmo Oval Cocktail Table","$780.00"
"1635221837-4510","https://colemanfurniture.com/accents/coffee-tables-cocktail-tables.htm","St. Armand Light Natural And Antique Bronze Square Cocktail Table","$629.00"
"1635221837-3222","https://colemanfurniture.com/accents/coffee-tables-cocktail-tables.htm","Kensington Place Richmond Rectangular Cocktail Table","$1629.00"
"1635221837-5055","https://colemanfurniture.com/accents/coffee-tables-cocktail-tables.htm","Slice Brown Square Teak Coffee Table","$1499.00"
"1635221837-3656","https://colemanfurniture.com/accents/coffee-tables-cocktail-tables.htm","705218 Sandy Black Coffee Table","$325.00"
"1635221837-4278","https://colemanfurniture.com/accents/coffee-tables-cocktail-tables.htm","Theory Rustic Fossil Felix Round Coffee Table","$1799.00"
"1635221837-3158","https://colemanfurniture.com/accents/coffee-tables-cocktail-tables.htm","Pinebrook Rectangular Cocktail Table with 2 braking casters","$999.00"
"1635221837-3481","https://colemanfurniture.com/accents/coffee-tables-cocktail-tables.htm","Rustic Patina Sand Upholstered Cocktail Table","$1174.00"
"1635221837-4119","https://colemanfurniture.com/accents/coffee-tables-cocktail-tables.htm","Keelin White And Black Lacquer Cocktail Table","$405.00"
"1635221837-4269","https://colemanfurniture.com/accents/coffee-tables-cocktail-tables.htm","Crossroads Distressed Smokey Grey Rectangular Cocktail Table","$619.00"
"1635221837-4892","https://colemanfurniture.com/accents/coffee-tables-cocktail-tables.htm","Boscage Brown and Black Round Coffee Table","$3129.00"
"1635221837-5431","https://colemanfurniture.com/accents/coffee-tables-cocktail-tables.htm","Brixton Natural Coffee Table","$769.00"
"1635221837-4303","https://colemanfurniture.com/accents/coffee-tables-cocktail-tables.htm","Willow Clear Cocktail Table","$715.00"
"1635221837-3635","https://colemanfurniture.com/accents/coffee-tables-cocktail-tables.htm","Wilshire White Sands Rectangle Cocktail Table","$652.00"
"1635221837-4035","https://colemanfurniture.com/accents/coffee-tables-cocktail-tables.htm","Signature Designs Silver Leaf Treville Rectangular Cocktail Table","$2249.00"
"1635221837-4404","https://colemanfurniture.com/accents/coffee-tables-cocktail-tables.htm","Zoe Brown Cocktail Table Storage Trunk","$635.00"
"1635221837-3023","https://colemanfurniture.com/accents/coffee-tables-cocktail-tables.htm","Conundrum Brown Cocktail Table","$665.00"
"1635221837-3413","https://colemanfurniture.com/accents/coffee-tables-cocktail-tables.htm","Log Silver Leaf Coffee Table","$1249.00"
"1635221837-3869","https://colemanfurniture.com/accents/coffee-tables-cocktail-tables.htm","Cardano Driftwood Light Brown 4 Drawer Cocktail Table","$882.00"
"1635221837-3766","https://colemanfurniture.com/accents/coffee-tables-cocktail-tables.htm","Bar Harbor Blue Cocktail Table","$549.00"
"1635221837-3185","https://colemanfurniture.com/accents/coffee-tables-cocktail-tables.htm","Jersey Antique Tobacco Cocktail Table","$219.00"
"1635221837-4241","https://colemanfurniture.com/accents/coffee-tables-cocktail-tables.htm","J004-100-010 Rustic Oak  And Black Rustic Industrial Storage Coffee Table","$289.00"
"1635221837-2970","https://colemanfurniture.com/accents/coffee-tables-cocktail-tables.htm","Lorenza Distressed Honey Cocktail Table","$439.00"
"1635221837-3953","https://colemanfurniture.com/accents/coffee-tables-cocktail-tables.htm","Prescott Satin Black Warrington Nesting Coffee Table","$749.00"
"1635221837-4691","https://colemanfurniture.com/accents/coffee-tables-cocktail-tables.htm","Kona Raisin Coffee Table","$295.00"
"1635221837-4495","https://colemanfurniture.com/accents/coffee-tables-cocktail-tables.htm","Randi White Lacquer And Glass And Chrome 2 Tier Square Cocktail Table","$279.00"
"1635221837-3325","https://colemanfurniture.com/accents/coffee-tables-cocktail-tables.htm","Amigo Black and Walnut Coffee Table","$555.00"
"1635221837-5304","https://colemanfurniture.com/accents/coffee-tables-cocktail-tables.htm","Hamilton Medium Stain Pasadena Coffee Table","$435.00"
"1635221837-4016","https://colemanfurniture.com/accents/coffee-tables-cocktail-tables.htm","Bremen Antique Brown Coffee Table","$699.00"
"1635221837-4226","https://colemanfurniture.com/accents/coffee-tables-cocktail-tables.htm","Heritage Bombe Trunk Table","$1429.00"
"1635221837-5421","https://colemanfurniture.com/accents/coffee-tables-cocktail-tables.htm","Bedford Park Brown and Gray Iron Strapping Rectangular Coffee Table","$899.00"
"1635221837-2852","https://colemanfurniture.com/accents/coffee-tables-cocktail-tables.htm","Aviator Silver Cocktail Table","$509.00"
"1635221837-3217","https://colemanfurniture.com/accents/coffee-tables-cocktail-tables.htm","Hattie Glass Top Coffee Table with Brushed Gold Legs","$1369.00"
"1635221837-4042","https://colemanfurniture.com/accents/coffee-tables-cocktail-tables.htm","Cascade Driftwood Beige Cocktail Table","$1564.50"
"1635221837-2760","https://colemanfurniture.com/accents/coffee-tables-cocktail-tables.htm","Benjamin Gold Coffee Table","$279.00"
"1635221837-2810","https://colemanfurniture.com/accents/coffee-tables-cocktail-tables.htm","Crystal Falls Dark Cherry Coffee Table","$625.00"
"1635221837-3760","https://colemanfurniture.com/accents/coffee-tables-cocktail-tables.htm","Morris Espresso Coffee Table with 3 Foldable Baskets","$275.00"
"1635221837-4954","https://colemanfurniture.com/accents/coffee-tables-cocktail-tables.htm","Grand Vista Brown Rectangular Coffee Table","$799.00"
"1635221837-4683","https://colemanfurniture.com/accents/coffee-tables-cocktail-tables.htm","West End Light Stain Square Coffee Table","$825.00"
"1635221837-4392","https://colemanfurniture.com/accents/coffee-tables-cocktail-tables.htm","Rubble Gray And Brown Coffee Table","$1314.00"
"1635221837-4033","https://colemanfurniture.com/accents/coffee-tables-cocktail-tables.htm","Sand Sand Crawford Cocktail Table","$1105.00"
"1635221837-4272","https://colemanfurniture.com/accents/coffee-tables-cocktail-tables.htm","Ad Modern Organics Smokey Quartz Brevard Live Edge Cocktail Table","$890.00"
"1635221837-4371","https://colemanfurniture.com/accents/coffee-tables-cocktail-tables.htm","Hidden Treasures Brown Hex Cocktail Table","$739.00"
"1635221837-4264","https://colemanfurniture.com/accents/coffee-tables-cocktail-tables.htm","Novella Light Wood Cabrillo Rectangle Cocktail Table","$799.00"
"1635221837-3151","https://colemanfurniture.com/accents/coffee-tables-cocktail-tables.htm","Darrington Glazed Mocha Rectangular Cocktail Table","$630.00"
"1635221837-4177","https://colemanfurniture.com/accents/coffee-tables-cocktail-tables.htm","Constantine Black Maximus 30"" Square Coffee Table","$455.00"
"1635221837-4105","https://colemanfurniture.com/accents/coffee-tables-cocktail-tables.htm","Laguna Hills White Glaze And Silver Rectangle Coffee Table","$849.00"
"1635221837-2821","https://colemanfurniture.com/accents/coffee-tables-cocktail-tables.htm","Fusion Brindled Fawn Round Cocktail Table","$336.00"
