web-scraper-order,web-scraper-start-url,nnn,ppp
"1635221837-4310","https://colemanfurniture.com/accents/coffee-tables-cocktail-tables.htm","Toffee Brown Accent Cocktail Bench","$425.00"
"1635221837-4004","https://colemanfurniture.com/accents/coffee-tables-cocktail-tables.htm","Graham Black And Ash Rectangle Coffee Table","$439.00"
"1635221837-5211","https://colemanfurniture.com/accents/coffee-tables-cocktail-tables.htm","Manelin White Washed Storage Drawer Cocktail Table","$529.00"
"1635221837-2974","https://colemanfurniture.com/accents/coffee-tables-cocktail-tables.htm","Luan Dark Walnut Coffee Table","$585.00"
"1635221837-5103","https://colemanfurniture.com/accents/coffee-tables-cocktail-tables.htm","Caracole Modern Black Stained Ash Remix Hexagon Cocktail Table","$405.00"
"1635221837-4673","https://colemanfurniture.com/accents/coffee-tables-cocktail-tables.htm","705948 Rustic Oak And Black Coffee Table","$339.00"
"1635221837-5408","https://colemanfurniture.com/accents/coffee-tables-cocktail-tables.htm","Metal Designs Silver Leaf Ellipse Rectangular Cocktail Table","$1899.00"
"1635221837-2638","https://colemanfurniture.com/accents/coffee-tables-cocktail-tables.htm","Dorrinson Two Tone Coffee Table","$259.00"
"1635221837-4451","https://colemanfurniture.com/accents/coffee-tables-cocktail-tables.htm","Parkcrest Brown Round Cocktail Table","$749.00"
"1635221837-3114","https://colemanfurniture.com/accents/coffee-tables-cocktail-tables.htm","Selwyn Cottage Kelsey Square Coffee Table","$709.00"
"1635221837-4810","https://colemanfurniture.com/accents/coffee-tables-cocktail-tables.htm","Carlton White And Light Oak Modern Side Storage Lacquer Cocktail Table","$535.00"
"1635221837-3988","https://colemanfurniture.com/accents/coffee-tables-cocktail-tables.htm","Classic Leaf It To Me Neutral Metallic Cocktail Table","$1205.00"
"1635221837-3014","https://colemanfurniture.com/accents/coffee-tables-cocktail-tables.htm","Hawthorne Glossy Acacia Cocktail Table","$715.00"
"1635221837-2622","https://colemanfurniture.com/accents/coffee-tables-cocktail-tables.htm","Glasslore Light Grayish Brown Coffee Table","$349.00"
"1635221837-5056","https://colemanfurniture.com/accents/coffee-tables-cocktail-tables.htm","Galet Black Stone Small Coffee Table","$2369.00"
"1635221837-5498","https://colemanfurniture.com/accents/coffee-tables-cocktail-tables.htm","Sheridan Burnished Cherry Lift Top Cocktail Table","$1006.00"
"1635221837-4228","https://colemanfurniture.com/accents/coffee-tables-cocktail-tables.htm","Gracewood Brown 48"" Coffee Table","$1019.00"
"1635221837-4066","https://colemanfurniture.com/accents/coffee-tables-cocktail-tables.htm","7608-45 Warm Coffee Bean Lift Top Cocktail Table","$659.00"
"1635221837-3712","https://colemanfurniture.com/accents/coffee-tables-cocktail-tables.htm","Rocco Ash Black Wood Cocktail Table","$259.00"
"1635221837-4998","https://colemanfurniture.com/accents/coffee-tables-cocktail-tables.htm","Francis White Marble Top Cocktail Table","$459.00"
"1635221837-5461","https://colemanfurniture.com/accents/coffee-tables-cocktail-tables.htm","Zenn Bravo Cream Decker Lift Top Coffee Table","$1135.00"
"1635221837-3898","https://colemanfurniture.com/accents/coffee-tables-cocktail-tables.htm","Kayley Glass And Gray Oak Cocktail Table","$329.00"
"1635221837-2689","https://colemanfurniture.com/accents/coffee-tables-cocktail-tables.htm","Freedan Grayish Brown Coffee Table","$129.00"
"1635221837-2667","https://colemanfurniture.com/accents/coffee-tables-cocktail-tables.htm","Calmoni Brown Coffee Table","$299.00"
"1635221837-3547","https://colemanfurniture.com/accents/coffee-tables-cocktail-tables.htm","Rylee Gray Faux Sandstone And Black Rectangle Cocktail Table","$379.00"
"1635221837-5001","https://colemanfurniture.com/accents/coffee-tables-cocktail-tables.htm","Ikon High Gloss White And Stainless Steel Dalton Coffee Table","$2419.00"
"1635221837-5377","https://colemanfurniture.com/accents/coffee-tables-cocktail-tables.htm","Emanuel Black Leather Coffee Table","$1875.00"
"1635221837-5448","https://colemanfurniture.com/accents/coffee-tables-cocktail-tables.htm","Wood Panel White Large Cocktail Table","$2845.50"
"1635221837-2660","https://colemanfurniture.com/accents/coffee-tables-cocktail-tables.htm","Johurst Grayish Brown Coffee Table Lift Top","$409.00"
"1635221837-3244","https://colemanfurniture.com/accents/coffee-tables-cocktail-tables.htm","Teresa Distressed Vintage Black Rectangular Cocktail Table","$525.00"
"1635221837-4852","https://colemanfurniture.com/accents/coffee-tables-cocktail-tables.htm","Westfield Teal Coffee Table","$395.00"
"1635221837-5118","https://colemanfurniture.com/accents/coffee-tables-cocktail-tables.htm","Staffield Cream Linen Texture Coffee Table","$1769.00"
"1635221837-3454","https://colemanfurniture.com/accents/coffee-tables-cocktail-tables.htm","Nonie Antique White Cocktail Table With Tray Top","$219.00"
"1635221837-2883","https://colemanfurniture.com/accents/coffee-tables-cocktail-tables.htm","Traine Brown Lift Top Cocktail Table","$893.00"
"1635221837-4305","https://colemanfurniture.com/accents/coffee-tables-cocktail-tables.htm","Walter Warm Pine Cocktail Table","$403.00"
"1635221837-3024","https://colemanfurniture.com/accents/coffee-tables-cocktail-tables.htm","Cassidy Ebony Cocktail Table","$369.00"
"1635221837-3241","https://colemanfurniture.com/accents/coffee-tables-cocktail-tables.htm","Meyers White Marble Rectangular Coffee Table","$439.00"
"1635221837-3386","https://colemanfurniture.com/accents/coffee-tables-cocktail-tables.htm","Anisha White And Oak Coffee Table","$409.00"
"1635221837-3102","https://colemanfurniture.com/accents/coffee-tables-cocktail-tables.htm","Avondale White Clarendon Upholstered Cocktail Table","$4229.00"
"1635221837-4219","https://colemanfurniture.com/accents/coffee-tables-cocktail-tables.htm","Carver Elm Wood And Gold Stainless Steel Rectangular Coffee Table","$2419.00"
"1635221837-3737","https://colemanfurniture.com/accents/coffee-tables-cocktail-tables.htm","DS-D486-202-2 Dark Brown Metal Cocktail Table","$535.00"
"1635221837-3923","https://colemanfurniture.com/accents/coffee-tables-cocktail-tables.htm","Aspen Distressed Natural Rustic Maple Coffee Table","$629.00"
"1635221837-5233","https://colemanfurniture.com/accents/coffee-tables-cocktail-tables.htm","Sunset Grey Top Coffee Table","$875.00"
"1635221837-4170","https://colemanfurniture.com/accents/coffee-tables-cocktail-tables.htm","Aspen Court Herringbone 2 Drawer Cocktail Table","$699.00"
"1635221837-4465","https://colemanfurniture.com/accents/coffee-tables-cocktail-tables.htm","Davenport Medium Brown Cocktail Table with Locking Casters","$444.00"
"1635221837-3089","https://colemanfurniture.com/accents/coffee-tables-cocktail-tables.htm","Thayer Grey Concrete Ivan Square Coffee Table","$615.00"
"1635221837-5309","https://colemanfurniture.com/accents/coffee-tables-cocktail-tables.htm","27518 Gray And Brown Coffee Table","$949.00"
"1635221837-5192","https://colemanfurniture.com/accents/coffee-tables-cocktail-tables.htm","Hidden Treasures High-Low Table","$595.00"
"1635221837-3381","https://colemanfurniture.com/accents/coffee-tables-cocktail-tables.htm","Cosmo Walnut And Black Coffee Table","$419.00"
"1635221837-4522","https://colemanfurniture.com/accents/coffee-tables-cocktail-tables.htm","Loxley White Marble And Black Metal Coffee Table","$515.00"
"1635221837-4634","https://colemanfurniture.com/accents/coffee-tables-cocktail-tables.htm","Ikon Maldini Gray White And Antique Brass Coffee Table","$1875.00"
"1635221837-3173","https://colemanfurniture.com/accents/coffee-tables-cocktail-tables.htm","722498 Clear Mirror Coffee Table","$1060.00"
"1635221837-5040","https://colemanfurniture.com/accents/coffee-tables-cocktail-tables.htm","HM19007-30 Chrome Cocktail Table","$249.00"
"1635221837-5276","https://colemanfurniture.com/accents/coffee-tables-cocktail-tables.htm","Mesa Heather Gray Cocktail Table","$1572.90"
"1635221837-3136","https://colemanfurniture.com/accents/coffee-tables-cocktail-tables.htm","Henzler Mirrored Glass Coffee Table","$725.00"
"1635221837-4386","https://colemanfurniture.com/accents/coffee-tables-cocktail-tables.htm","Taos Canyon Coffee Table with Casters","$539.00"
"1635221837-4178","https://colemanfurniture.com/accents/coffee-tables-cocktail-tables.htm","Cleo Black Gold Coffee Table","$463.01"
"1635221837-4282","https://colemanfurniture.com/accents/coffee-tables-cocktail-tables.htm","Morgan Mottled Grey And Black Round Cocktail Table","$199.00"
"1635221837-4823","https://colemanfurniture.com/accents/coffee-tables-cocktail-tables.htm","Mixt Dali White Coffee Table","$1895.00"
"1635221837-2784","https://colemanfurniture.com/accents/coffee-tables-cocktail-tables.htm","Ashford Antiqued Honey Cocktail Table","$229.00"
"1635221837-4012","https://colemanfurniture.com/accents/coffee-tables-cocktail-tables.htm","Mia Bella Taupe Leather Cocktail Table","$1328.00"
"1635221837-5125","https://colemanfurniture.com/accents/coffee-tables-cocktail-tables.htm","Spectacular Brown Cocktail Table","$2656.50"
"1635221837-2739","https://colemanfurniture.com/accents/coffee-tables-cocktail-tables.htm","Vogue Umber Cocktail Table","$619.00"
"1635221837-3357","https://colemanfurniture.com/accents/coffee-tables-cocktail-tables.htm","Key West Bing Cherry Coffee Table","$339.00"
"1635221837-4808","https://colemanfurniture.com/accents/coffee-tables-cocktail-tables.htm","Vanna Melamine Lift Top Cocktail Table","$399.00"
"1635221837-4991","https://colemanfurniture.com/accents/coffee-tables-cocktail-tables.htm","Montvale Beige Cocktail Table","$895.00"
"1635221837-3695","https://colemanfurniture.com/accents/coffee-tables-cocktail-tables.htm","Daxton Black And Gold Faux Marble Square Cocktail Table","$229.00"
"1635221837-5292","https://colemanfurniture.com/accents/coffee-tables-cocktail-tables.htm","722208 Dark Grey And Black Nickel Coffee Table","$469.00"
"1635221837-3259","https://colemanfurniture.com/accents/coffee-tables-cocktail-tables.htm","Charlestown Soft White Lift Top Coffee Table","$679.00"
"1635221837-3168","https://colemanfurniture.com/accents/coffee-tables-cocktail-tables.htm","Baja II Cocoa Rectangular Coffee Table","$689.00"
"1635221837-3274","https://colemanfurniture.com/accents/coffee-tables-cocktail-tables.htm","Reclamation Place Shiplap Black Olive Rectangular Cocktail Table","$540.00"
"1635221837-3446","https://colemanfurniture.com/accents/coffee-tables-cocktail-tables.htm","Moa White And Natural Tone Coffee Table","$715.00"
"1635221837-2755","https://colemanfurniture.com/accents/coffee-tables-cocktail-tables.htm","Vendi White Coffee Table","$389.00"
"1635221837-3154","https://colemanfurniture.com/accents/coffee-tables-cocktail-tables.htm","Uptown Walnut and Black Coffee Table","$909.00"
"1635221837-3188","https://colemanfurniture.com/accents/coffee-tables-cocktail-tables.htm","Thistle Black And White Coffee Table","$725.00"
"1635221837-2698","https://colemanfurniture.com/accents/coffee-tables-cocktail-tables.htm","Hidden Treasures Light Stain Acrylic Cocktail Table","$535.00"
"1635221837-3265","https://colemanfurniture.com/accents/coffee-tables-cocktail-tables.htm","Stilt Smoked Large Coffee Table","$1507.00"
"1635221837-4200","https://colemanfurniture.com/accents/coffee-tables-cocktail-tables.htm","Kitano Rich Brown Hazelnut Cascade Rectangular Cocktail Table","$1629.00"
"1635221837-4327","https://colemanfurniture.com/accents/coffee-tables-cocktail-tables.htm","Mila White Marble And White Pedestal Cocktail Table","$435.00"
"1635221837-4001","https://colemanfurniture.com/accents/coffee-tables-cocktail-tables.htm","Monterey Point Deep Brown And Black Splayed Leg Small Coffee Table","$899.00"
"1635221837-3193","https://colemanfurniture.com/accents/coffee-tables-cocktail-tables.htm","Carina Graphite Coffee Table","$647.50"
"1635221837-3036","https://colemanfurniture.com/accents/coffee-tables-cocktail-tables.htm","Bellamy Peppercorn Round Cocktail Table","$885.00"
"1635221837-3870","https://colemanfurniture.com/accents/coffee-tables-cocktail-tables.htm","Sanctuary Silver C Est La Vie Cocktail Table","$1769.00"
"1635221837-3708","https://colemanfurniture.com/accents/coffee-tables-cocktail-tables.htm","Geometry Brown and Black Coffee Table","$1579.00"
"1635221837-4791","https://colemanfurniture.com/accents/coffee-tables-cocktail-tables.htm","Malibu Brown Decker Woven Cocktail Table By Barclay Butera","$2549.00"
"1635221837-5387","https://colemanfurniture.com/accents/coffee-tables-cocktail-tables.htm","Levinson White And Gold Gold Cap Cocktail Table","$349.00"
"1635221837-5397","https://colemanfurniture.com/accents/coffee-tables-cocktail-tables.htm","Mixt Cara White Coffee Table","$1539.00"
"1635221837-4725","https://colemanfurniture.com/accents/coffee-tables-cocktail-tables.htm","Levinson Brown And Gold Gold Cap Cocktail Table","$349.00"
"1635221837-4534","https://colemanfurniture.com/accents/coffee-tables-cocktail-tables.htm","Artisans Craft Washed Grey Cocktail Table","$695.00"
"1635221837-3239","https://colemanfurniture.com/accents/coffee-tables-cocktail-tables.htm","Dara Silver Cocktail Table","$545.00"
"1635221837-4815","https://colemanfurniture.com/accents/coffee-tables-cocktail-tables.htm","Classic Chinese White Cocktail Table","$3139.50"
"1635221837-4413","https://colemanfurniture.com/accents/coffee-tables-cocktail-tables.htm","Wellington Place Distressed Oak And Antique White Round Cocktail Table","$475.00"
"1635221837-4933","https://colemanfurniture.com/accents/coffee-tables-cocktail-tables.htm","Willow Natural 60"" Coffee Table","$1575.00"
"1635221837-2869","https://colemanfurniture.com/accents/coffee-tables-cocktail-tables.htm","705328 Clear Coffee Table","$521.00"
"1635221837-5293","https://colemanfurniture.com/accents/coffee-tables-cocktail-tables.htm","723208 White And Gold Coffee Table","$734.00"
"1635221837-2704","https://colemanfurniture.com/accents/coffee-tables-cocktail-tables.htm","Essentials Linen Townsend Tufted Upholstered Coffee Table","$1189.00"
"1635221837-3108","https://colemanfurniture.com/accents/coffee-tables-cocktail-tables.htm","Painted Canyon Brown Box Cocktail Table","$785.00"
"1635221837-3588","https://colemanfurniture.com/accents/coffee-tables-cocktail-tables.htm","Tower Place Deerfield Round Cocktail Table","$2379.00"
"1635221837-4160","https://colemanfurniture.com/accents/coffee-tables-cocktail-tables.htm","Bear Creek Rustic Ivory And Honey Lift Top Cocktail Table","$679.00"
"1635221837-3813","https://colemanfurniture.com/accents/coffee-tables-cocktail-tables.htm","Clark Dark Brown Oval Cocktail Table","$1074.00"
"1635221837-3092","https://colemanfurniture.com/accents/coffee-tables-cocktail-tables.htm","Parkland Falls Weathered Taupe Square Lift Top Cocktail Table","$678.00"
"1635221837-3637","https://colemanfurniture.com/accents/coffee-tables-cocktail-tables.htm","Telone Black Modern Coffee Table","$1177.00"
"1635221837-4481","https://colemanfurniture.com/accents/coffee-tables-cocktail-tables.htm","736028 Grey Faux Marble And Gunmetal 2 Piece Nesting Coffee Table","$375.00"
"1635221837-4106","https://colemanfurniture.com/accents/coffee-tables-cocktail-tables.htm","Wellington Hall Java Rectangle Pedestal Coffee Table","$1149.00"
"1635221837-3118","https://colemanfurniture.com/accents/coffee-tables-cocktail-tables.htm","Brayden Natural Wood Bunching Coffee Table","$429.00"
"1635221837-4095","https://colemanfurniture.com/accents/coffee-tables-cocktail-tables.htm","Classsic Dark Antique Silver Iron Cocktail Table","$319.00"
"1635221837-4469","https://colemanfurniture.com/accents/coffee-tables-cocktail-tables.htm","Cluster Antique Brass Cocktail Table","$799.00"
"1635221837-5065","https://colemanfurniture.com/accents/coffee-tables-cocktail-tables.htm","Brass Gate White Marble Cocktail Table","$2013.90"
"1635221837-3389","https://colemanfurniture.com/accents/coffee-tables-cocktail-tables.htm","7817 Black 36"" Coffee Table","$269.00"
"1635221837-5101","https://colemanfurniture.com/accents/coffee-tables-cocktail-tables.htm","Trade Rustic White Rectangular Cocktail Table","$499.00"
"1635221837-4811","https://colemanfurniture.com/accents/coffee-tables-cocktail-tables.htm","Basil White And Oak 2 Tier Cocktail Table","$285.00"
"1635221837-4475","https://colemanfurniture.com/accents/coffee-tables-cocktail-tables.htm","Profile Warm Taupe Round Cocktail Table","$1661.00"
"1635221837-4126","https://colemanfurniture.com/accents/coffee-tables-cocktail-tables.htm","Constantine Cyrus Black And Light Grey Round Coffee Table","$599.00"
"1635221837-4440","https://colemanfurniture.com/accents/coffee-tables-cocktail-tables.htm","Botera Onyx Round Cocktail Table","$639.00"
"1635221837-5392","https://colemanfurniture.com/accents/coffee-tables-cocktail-tables.htm","52851 Gold 48"" Faux Bamboo Metal Cocktail Table","$855.00"
"1635221837-2823","https://colemanfurniture.com/accents/coffee-tables-cocktail-tables.htm","702588 Black and Chrome Coffee Table","$355.00"
"1635221837-3203","https://colemanfurniture.com/accents/coffee-tables-cocktail-tables.htm","Bellamy Deep Weathered Pine Rectangular Cocktail Table","$635.00"
"1635221837-4134","https://colemanfurniture.com/accents/coffee-tables-cocktail-tables.htm","Carlyle Pierre Deep Espresso Square Cocktail Table","$2549.00"
"1635221837-2634","https://colemanfurniture.com/accents/coffee-tables-cocktail-tables.htm","Budmore Brown Rectangular Cocktail Table","$449.00"
"1635221837-3849","https://colemanfurniture.com/accents/coffee-tables-cocktail-tables.htm","Laurel Sandy Pine Oval Cocktail table","$765.00"
"1635221837-2718","https://colemanfurniture.com/accents/coffee-tables-cocktail-tables.htm","Pure Modern Soft Moonstone Rectangular Cocktail Table","$795.00"
"1635221837-3143","https://colemanfurniture.com/accents/coffee-tables-cocktail-tables.htm","Curated Brownstone Quinton Storage Cocktail Table","$1610.00"
"1635221837-5447","https://colemanfurniture.com/accents/coffee-tables-cocktail-tables.htm","Winchester Brown Cocktail Table","$1102.50"
"1635221837-4713","https://colemanfurniture.com/accents/coffee-tables-cocktail-tables.htm","Distressed Blocks Black and Gold Leaf Small Coffee Table","$3989.00"
"1635221837-4484","https://colemanfurniture.com/accents/coffee-tables-cocktail-tables.htm","Calgary Dark Walnut Coffee Table","$439.00"
"1635221837-3449","https://colemanfurniture.com/accents/coffee-tables-cocktail-tables.htm","707758 Natural Honey and Black Coffee Table","$615.00"
"1635221837-5186","https://colemanfurniture.com/accents/coffee-tables-cocktail-tables.htm","St. Claire Cream 4 Drawer Lift Top Cocktail Table","$1019.00"
"1635221837-4857","https://colemanfurniture.com/accents/coffee-tables-cocktail-tables.htm","Nahara Gray Coffee Table","$545.00"
"1635221837-3350","https://colemanfurniture.com/accents/coffee-tables-cocktail-tables.htm","Pinnacle White Sands Rectangle Cocktail Table","$518.00"
"1635221837-2652","https://colemanfurniture.com/accents/coffee-tables-cocktail-tables.htm","Haffenburg Medium Brown Coffee Table","$419.00"
"1635221837-5362","https://colemanfurniture.com/accents/coffee-tables-cocktail-tables.htm","Hancock Black Rectangular Coffee Table","$609.00"
"1635221837-2835","https://colemanfurniture.com/accents/coffee-tables-cocktail-tables.htm","Holland Copper Cocktail Table","$525.00"
"1635221837-4821","https://colemanfurniture.com/accents/coffee-tables-cocktail-tables.htm","Rivas Gray And Black Coffee Table","$1229.00"
"1635221837-2842","https://colemanfurniture.com/accents/coffee-tables-cocktail-tables.htm","Reverb Rustic Coffee Table","$869.00"
"1635221837-2774","https://colemanfurniture.com/accents/coffee-tables-cocktail-tables.htm","Ocean Isle Rectangular Cocktail Table","$505.00"
"1635221837-5152","https://colemanfurniture.com/accents/coffee-tables-cocktail-tables.htm","Edythe Gold Leaf And Clear Cocktail Table","$535.00"
"1635221837-4765","https://colemanfurniture.com/accents/coffee-tables-cocktail-tables.htm","Eastbrook Matte Brass Coffee Table","$389.00"
"1635221837-3527","https://colemanfurniture.com/accents/coffee-tables-cocktail-tables.htm","Amalya Dark Gray Modern Wood Cocktail Table","$495.00"
"1635221837-2891","https://colemanfurniture.com/accents/coffee-tables-cocktail-tables.htm","Savona Cecilia Rectangular Cocktail Table","$515.00"
"1635221837-4023","https://colemanfurniture.com/accents/coffee-tables-cocktail-tables.htm","Linea Cerused Charcoal Rectangular Cocktail Table","$1049.00"
"1635221837-4486","https://colemanfurniture.com/accents/coffee-tables-cocktail-tables.htm","Kellson Rustic Oak And Black Cocktail Table","$155.00"
"1635221837-4987","https://colemanfurniture.com/accents/coffee-tables-cocktail-tables.htm","Keelin Black Laquer Lacquer Cocktail Table","$419.00"
"1635221837-3657","https://colemanfurniture.com/accents/coffee-tables-cocktail-tables.htm","Carlo Brown Wooden Top And Black Round Coffee Table","$199.00"
"1635221837-4948","https://colemanfurniture.com/accents/coffee-tables-cocktail-tables.htm","Holland Soft Grey Rubbed Cortado Coffee Table","$1449.00"
"1635221837-2637","https://colemanfurniture.com/accents/coffee-tables-cocktail-tables.htm","Ezmonei Black and Gray Lift Top Cocktail Table","$289.00"
"1635221837-4557","https://colemanfurniture.com/accents/coffee-tables-cocktail-tables.htm","Salem Black Coffee Table","$1075.00"
"1635221837-3428","https://colemanfurniture.com/accents/coffee-tables-cocktail-tables.htm","Zelda Black Powder Coat And Nickel Square Coffee Table","$2379.00"
"1635221837-2741","https://colemanfurniture.com/accents/coffee-tables-cocktail-tables.htm","Cottage Beach White Square Coffee Table","$489.00"
"1635221837-4051","https://colemanfurniture.com/accents/coffee-tables-cocktail-tables.htm","Modern Wyatt Chrome Cocktail Table","$1150.00"
"1635221837-4456","https://colemanfurniture.com/accents/coffee-tables-cocktail-tables.htm","Lancaster Dovetail Grey Lift Top Storage Cocktail Table with Casters","$939.00"
"1635221837-3177","https://colemanfurniture.com/accents/coffee-tables-cocktail-tables.htm","Lake House Lift Top Cocktail Table","$455.00"
"1635221837-3826","https://colemanfurniture.com/accents/coffee-tables-cocktail-tables.htm","Caracole Classic Gold And Silver Oval Cocktail Table","$1795.00"
"1635221837-5069","https://colemanfurniture.com/accents/coffee-tables-cocktail-tables.htm","3161WB-C Weathered Brown Round 39"" Coffee Table","$549.00"
"1635221837-3130","https://colemanfurniture.com/accents/coffee-tables-cocktail-tables.htm","Arista Cobblestone Brown Rectangular Cocktail Table","$469.00"
"1635221837-3415","https://colemanfurniture.com/accents/coffee-tables-cocktail-tables.htm","Dante Root Silver Leaf Coffee Table","$1499.00"
"1635221837-3591","https://colemanfurniture.com/accents/coffee-tables-cocktail-tables.htm","Marlow Matte Brass Felicity Coffee Table","$849.00"
"1635221837-3734","https://colemanfurniture.com/accents/coffee-tables-cocktail-tables.htm","Benton Espresso Coffee Table","$495.00"
"1635221837-3650","https://colemanfurniture.com/accents/coffee-tables-cocktail-tables.htm","Haven Hall Aged Chestnut Rectangular Cocktail Table","$555.00"
"1635221837-4221","https://colemanfurniture.com/accents/coffee-tables-cocktail-tables.htm","Highland Park Morel And Glazed Silver Loft Milo Cocktail Table","$787.00"
"1635221837-3344","https://colemanfurniture.com/accents/coffee-tables-cocktail-tables.htm","Winslow Grey Marble Coffee Table","$1175.00"
"1635221837-2657","https://colemanfurniture.com/accents/coffee-tables-cocktail-tables.htm","Brazburn Dark Brown and Gold Coffee Table","$459.00"
"1635221837-5396","https://colemanfurniture.com/accents/coffee-tables-cocktail-tables.htm","Ikon Chelsea Gold Coffee Table","$1585.00"
"1635221837-3579","https://colemanfurniture.com/accents/coffee-tables-cocktail-tables.htm","Parisian Marketplace Two Tone Heathered Brownstone Rectangular Cocktail Table","$555.00"
"1635221837-3903","https://colemanfurniture.com/accents/coffee-tables-cocktail-tables.htm","Fnam Gold Leaf Antique Mirror Sabor Coffee Table","$1339.00"
"1635221837-5114","https://colemanfurniture.com/accents/coffee-tables-cocktail-tables.htm","Ringling Brown Coffee Table","$1401.75"
"1635221837-4190","https://colemanfurniture.com/accents/coffee-tables-cocktail-tables.htm","Willowick Antique White And Brown Cherry Castered Cocktail Table","$824.00"
"1635221837-5503","https://colemanfurniture.com/accents/coffee-tables-cocktail-tables.htm","Helmsley Brushed Auburn Cocktail Table","$485.00"
"1635221837-5350","https://colemanfurniture.com/accents/coffee-tables-cocktail-tables.htm","Tuco Rectangular Cocktail Table","$1979.00"
"1635221837-4357","https://colemanfurniture.com/accents/coffee-tables-cocktail-tables.htm","Nash White Coffee Table","$2499.00"
"1635221837-4405","https://colemanfurniture.com/accents/coffee-tables-cocktail-tables.htm","Plantation Cherry 3012024 Oval Cocktail Table","$689.00"
"1635221837-3145","https://colemanfurniture.com/accents/coffee-tables-cocktail-tables.htm","721038 Walnut Lift Top Coffee Table","$439.00"
"1635221837-4631","https://colemanfurniture.com/accents/coffee-tables-cocktail-tables.htm","Barrington Two Tone Antique Oak And Matte Black Round Cocktail Table","$394.00"
"1635221837-5363","https://colemanfurniture.com/accents/coffee-tables-cocktail-tables.htm","Hamilton Medium Stain Saddletree Round Lift Top Coffee Table","$545.00"
"1635221837-3970","https://colemanfurniture.com/accents/coffee-tables-cocktail-tables.htm","Club Collection Smoked Oak Carmella Coffee Table","$3989.00"
"1635221837-3549","https://colemanfurniture.com/accents/coffee-tables-cocktail-tables.htm","Saunders Green And Black High Coffee Table","$745.00"
"1635221837-4813","https://colemanfurniture.com/accents/coffee-tables-cocktail-tables.htm","Cheyenne Black Cocktail Table","$635.00"
"1635221837-2894","https://colemanfurniture.com/accents/coffee-tables-cocktail-tables.htm","Calypso Espresso Square Cocktail Table","$435.00"
