web-scraper-order,web-scraper-start-url,nnn,ppp
"1635221837-5035","https://colemanfurniture.com/accents/coffee-tables-cocktail-tables.htm","Berkshire Cognac Pearson Rectangular Coffee Table","$745.00"
"1635221837-5075","https://colemanfurniture.com/accents/coffee-tables-cocktail-tables.htm","Gotham Coffee Table","$1415.00"
"1635221837-2802","https://colemanfurniture.com/accents/coffee-tables-cocktail-tables.htm","Fairview Oak Cocktail Table","$655.00"
"1635221837-5173","https://colemanfurniture.com/accents/coffee-tables-cocktail-tables.htm","Signature Designs Silver Ss Sangiovese Round Cocktail Table","$2209.00"
"1635221837-3150","https://colemanfurniture.com/accents/coffee-tables-cocktail-tables.htm","Junction Timber Chic Compass Cocktail Table","$655.00"
"1635221837-4836","https://colemanfurniture.com/accents/coffee-tables-cocktail-tables.htm","Metal Designs Gold Leaf Sangiovese Round Cocktail Table","$1899.00"
"1635221837-3253","https://colemanfurniture.com/accents/coffee-tables-cocktail-tables.htm","Kinetic High Gloss White Lacquer Coffee Table","$1139.00"
"1635221837-3065","https://colemanfurniture.com/accents/coffee-tables-cocktail-tables.htm","Lucida Rustic Brown And White 42"" Coffee Table","$255.00"
"1635221837-2758","https://colemanfurniture.com/accents/coffee-tables-cocktail-tables.htm","Vitya Glass Coffee Table","$803.00"
"1635221837-4577","https://colemanfurniture.com/accents/coffee-tables-cocktail-tables.htm","Gina Dark Oak And Black Lift Top Cocktail Table","$345.00"
"1635221837-5194","https://colemanfurniture.com/accents/coffee-tables-cocktail-tables.htm","Artists Beige Iron Rectangular Coffee Table","$999.00"
"1635221837-3867","https://colemanfurniture.com/accents/coffee-tables-cocktail-tables.htm","Chalet Chrome And Grey Rectangular Coffee Table","$539.00"
"1635221837-5245","https://colemanfurniture.com/accents/coffee-tables-cocktail-tables.htm","Laguna Dark Walnut Rectangular Storage Coffee Table","$689.00"
"1635221837-2964","https://colemanfurniture.com/accents/coffee-tables-cocktail-tables.htm","Rowan Natural Cocktail Table","$339.00"
"1635221837-5128","https://colemanfurniture.com/accents/coffee-tables-cocktail-tables.htm","Trolley Brown Castered Cocktail Table","$1155.00"
"1635221837-3989","https://colemanfurniture.com/accents/coffee-tables-cocktail-tables.htm","Hill Country Medina Saddle Brown and Black Round Cocktail Table","$1549.00"
"1635221837-4533","https://colemanfurniture.com/accents/coffee-tables-cocktail-tables.htm","Decker Antique White 36'' Round Cocktail Table","$715.00"
"1635221837-4329","https://colemanfurniture.com/accents/coffee-tables-cocktail-tables.htm","Old World Round Cocktail Table","$950.00"
"1635221837-4614","https://colemanfurniture.com/accents/coffee-tables-cocktail-tables.htm","Elliott Antique Brown Lift Top Cocktail Table","$975.00"
"1635221837-5018","https://colemanfurniture.com/accents/coffee-tables-cocktail-tables.htm","Cohesion Program Brown Grantland Rectangular Cocktail Table","$1579.00"
"1635221837-3433","https://colemanfurniture.com/accents/coffee-tables-cocktail-tables.htm","Maguire Weathered Barley Rectangular Extendable Cocktail Table","$789.00"
"1635221837-3326","https://colemanfurniture.com/accents/coffee-tables-cocktail-tables.htm","Fusion Brindled Fawn Rectangle Cocktail Table","$344.00"
"1635221837-4650","https://colemanfurniture.com/accents/coffee-tables-cocktail-tables.htm","Skyline Gray Coffee Table","$669.00"
"1635221837-4920","https://colemanfurniture.com/accents/coffee-tables-cocktail-tables.htm","La Scala Ivory And Nickel Round Cocktail Table","$1779.00"
"1635221837-3285","https://colemanfurniture.com/accents/coffee-tables-cocktail-tables.htm","Magnolia Manor Antique White Lift Top Cocktail Table","$625.00"
"1635221837-3658","https://colemanfurniture.com/accents/coffee-tables-cocktail-tables.htm","3416 Brown And Black Coffee Table","$255.00"
"1635221837-4005","https://colemanfurniture.com/accents/coffee-tables-cocktail-tables.htm","Kona Grove Rustic Chocolate Rectangular Cocktail Table","$615.00"
"1635221837-2813","https://colemanfurniture.com/accents/coffee-tables-cocktail-tables.htm","Jocelyn Light Grey Cocktail Table","$209.00"
"1635221837-3910","https://colemanfurniture.com/accents/coffee-tables-cocktail-tables.htm","Sully Black And Gray Sully Bunching Cocktail Table","$675.00"
"1635221837-3401","https://colemanfurniture.com/accents/coffee-tables-cocktail-tables.htm","Millie Navy And Gold Loft Bench Cocktail Table","$439.00"
"1635221837-4906","https://colemanfurniture.com/accents/coffee-tables-cocktail-tables.htm","Andros Glass Top Coffee Table","$1319.00"
"1635221837-4784","https://colemanfurniture.com/accents/coffee-tables-cocktail-tables.htm","Mapai Matte Black Rectangular Coffee Table","$561.00"
"1635221837-3718","https://colemanfurniture.com/accents/coffee-tables-cocktail-tables.htm","Sorella Taupe Rectangular Cocktail Table","$1729.00"
"1635221837-4628","https://colemanfurniture.com/accents/coffee-tables-cocktail-tables.htm","Natures Edge Rich Brown Cocktail Table","$665.00"
"1635221837-4772","https://colemanfurniture.com/accents/coffee-tables-cocktail-tables.htm","Annabel Walnut Coffee Table","$1119.00"
"1635221837-3011","https://colemanfurniture.com/accents/coffee-tables-cocktail-tables.htm","Mythos Grey Coffee Table","$1150.00"
"1635221837-4814","https://colemanfurniture.com/accents/coffee-tables-cocktail-tables.htm","Casablanca Tan Cocktail Table","$1344.00"
"1635221837-2986","https://colemanfurniture.com/accents/coffee-tables-cocktail-tables.htm","Biscayne Weathered Cocktail Table","$599.00"
"1635221837-2664","https://colemanfurniture.com/accents/coffee-tables-cocktail-tables.htm","Haroflyn Gray Square Cocktail Table","$319.00"
"1635221837-4561","https://colemanfurniture.com/accents/coffee-tables-cocktail-tables.htm","Wishbone Natural Coffee Table","$1741.50"
"1635221837-5149","https://colemanfurniture.com/accents/coffee-tables-cocktail-tables.htm","Tania Bronze Metal 3 Piece Nesting Cocktail Table","$595.00"
"1635221837-4397","https://colemanfurniture.com/accents/coffee-tables-cocktail-tables.htm","Blue Smoke Gray and Blue Stone Coffee Table","$2459.00"
"1635221837-2945","https://colemanfurniture.com/accents/coffee-tables-cocktail-tables.htm","Caracole Classic Social Gathering Cocktail Table","$1340.00"
"1635221837-3669","https://colemanfurniture.com/accents/coffee-tables-cocktail-tables.htm","East Bay Distressed Woodtone Tile Rectangular Cocktail Table","$439.00"
"1635221837-5278","https://colemanfurniture.com/accents/coffee-tables-cocktail-tables.htm","Solterra Odis White Coffee Table","$1569.00"
"1635221837-5489","https://colemanfurniture.com/accents/coffee-tables-cocktail-tables.htm","Nahara White Coffee Table","$545.00"
"1635221837-4034","https://colemanfurniture.com/accents/coffee-tables-cocktail-tables.htm","Freestanding Carson Rose Gold Retangular Cocktail Table","$1424.00"
"1635221837-4159","https://colemanfurniture.com/accents/coffee-tables-cocktail-tables.htm","MacArthur Park Hermosa Brown and Silver Center Table","$2729.00"
"1635221837-3990","https://colemanfurniture.com/accents/coffee-tables-cocktail-tables.htm","Elise Aura Hand-rubbed amaretto Cocktail Table","$779.00"
"1635221837-3689","https://colemanfurniture.com/accents/coffee-tables-cocktail-tables.htm","Wynton Black Lacquer Cocktail Table","$369.00"
"1635221837-4026","https://colemanfurniture.com/accents/coffee-tables-cocktail-tables.htm","Santana Proximity Square Cocktail Table","$1479.00"
"1635221837-4860","https://colemanfurniture.com/accents/coffee-tables-cocktail-tables.htm","Synchronicity Sable Rectangular Coffee Table","$585.00"
"1635221837-4002","https://colemanfurniture.com/accents/coffee-tables-cocktail-tables.htm","Flynn Walnut Trestle Coffee Table","$269.00"
"1635221837-4474","https://colemanfurniture.com/accents/coffee-tables-cocktail-tables.htm","Signature Designs Grey Arturo Rectangular Cocktail Table","$1229.00"
"1635221837-4072","https://colemanfurniture.com/accents/coffee-tables-cocktail-tables.htm","River Stone Silver Leaf Large Coffee Table","$1629.00"
"1635221837-5140","https://colemanfurniture.com/accents/coffee-tables-cocktail-tables.htm","Signature Designs Gold Foil Cumulus Large Round Cocktail Table","$3679.00"
"1635221837-3088","https://colemanfurniture.com/accents/coffee-tables-cocktail-tables.htm","Morgan Creek Antique White Drawer Square Cocktail Table","$785.00"
"1635221837-3715","https://colemanfurniture.com/accents/coffee-tables-cocktail-tables.htm","Suspension Antique Copper Rectangular Cocktail Table","$1579.00"
"1635221837-4331","https://colemanfurniture.com/accents/coffee-tables-cocktail-tables.htm","723778 Brown Oak And Sandy Black Lift Top Coffee Table","$499.00"
"1635221837-3288","https://colemanfurniture.com/accents/coffee-tables-cocktail-tables.htm","Zurich White And Satin Square Cocktail Table","$363.00"
"1635221837-3543","https://colemanfurniture.com/accents/coffee-tables-cocktail-tables.htm","Floating Natural Coffee Table With Acrylic Legs","$3489.00"
"1635221837-5433","https://colemanfurniture.com/accents/coffee-tables-cocktail-tables.htm","L'Object White Resin And Gray Dyed Bone Peak Cocktail Table","$2719.00"
"1635221837-5071","https://colemanfurniture.com/accents/coffee-tables-cocktail-tables.htm","Caspian Natural Matte Cocktail Table","$369.00"
"1635221837-5038","https://colemanfurniture.com/accents/coffee-tables-cocktail-tables.htm","Mid Century Walnut Round Coffee Table","$999.00"
"1635221837-4855","https://colemanfurniture.com/accents/coffee-tables-cocktail-tables.htm","Troper Brown Coffee Table","$949.00"
"1635221837-3774","https://colemanfurniture.com/accents/coffee-tables-cocktail-tables.htm","Saluki Retro Light Cherry Cocktail Table","$249.00"
"1635221837-3309","https://colemanfurniture.com/accents/coffee-tables-cocktail-tables.htm","Reflections Polished Chrome Round Cocktail Table","$729.00"
"1635221837-4334","https://colemanfurniture.com/accents/coffee-tables-cocktail-tables.htm","Copia Oval Cocktail Table","$525.00"
"1635221837-3495","https://colemanfurniture.com/accents/coffee-tables-cocktail-tables.htm","2061025 Industrial Chic Metalworks Cocktail Table","$909.00"
"1635221837-4395","https://colemanfurniture.com/accents/coffee-tables-cocktail-tables.htm","Chameau Black Metal And White Gray Marble Coffee Table","$2125.00"
"1635221837-2751","https://colemanfurniture.com/accents/coffee-tables-cocktail-tables.htm","720218 Cappuccino and Chrome Coffee Table and Stools","$549.00"
"1635221837-3502","https://colemanfurniture.com/accents/coffee-tables-cocktail-tables.htm","Coreene Antique Bronze Coffee Table","$759.00"
"1635221837-3881","https://colemanfurniture.com/accents/coffee-tables-cocktail-tables.htm","Caracole Classic Keep It On The Down Low Cocktail Table","$1345.00"
"1635221837-4668","https://colemanfurniture.com/accents/coffee-tables-cocktail-tables.htm","Caracole Classic Contemporary Taupe Silver Leaf Cocktail Table","$1340.00"
"1635221837-2890","https://colemanfurniture.com/accents/coffee-tables-cocktail-tables.htm","720338 Chrome and Tempered Glass Coffee Table","$375.00"
"1635221837-3272","https://colemanfurniture.com/accents/coffee-tables-cocktail-tables.htm","Roe White Lacquer Cocktail Table","$659.00"
"1635221837-4183","https://colemanfurniture.com/accents/coffee-tables-cocktail-tables.htm","Boho Distressed Rustic Barnside Round Cocktail Table","$495.00"
"1635221837-4527","https://colemanfurniture.com/accents/coffee-tables-cocktail-tables.htm","Whitfield Silver Coffee Table","$779.00"
"1635221837-5487","https://colemanfurniture.com/accents/coffee-tables-cocktail-tables.htm","Orchestra Brown Coffee Table","$1548.00"
"1635221837-3703","https://colemanfurniture.com/accents/coffee-tables-cocktail-tables.htm","7062-45 Brown Cocktail Table","$439.00"
"1635221837-3713","https://colemanfurniture.com/accents/coffee-tables-cocktail-tables.htm","Redondo Antique Brass Coffee Table","$975.00"
"1635221837-4422","https://colemanfurniture.com/accents/coffee-tables-cocktail-tables.htm","Malacca Brown Cocktail Table","$1109.25"
"1635221837-4743","https://colemanfurniture.com/accents/coffee-tables-cocktail-tables.htm","Continental Vintage Melange Square Cocktail Table","$655.00"
"1635221837-2678","https://colemanfurniture.com/accents/coffee-tables-cocktail-tables.htm","Mondoro Gray and Brown Lift Top Cocktail Table","$559.00"
"1635221837-4970","https://colemanfurniture.com/accents/coffee-tables-cocktail-tables.htm","Tyle Black Coffee Table","$1399.00"
"1635221837-4586","https://colemanfurniture.com/accents/coffee-tables-cocktail-tables.htm","La Sierra Grey And White Cocktail Table","$685.00"
"1635221837-4732","https://colemanfurniture.com/accents/coffee-tables-cocktail-tables.htm","Grand Whitewash White Tray Top Cocktail Table","$1533.00"
"1635221837-4678","https://colemanfurniture.com/accents/coffee-tables-cocktail-tables.htm","Steele Smokey Walnut Storage Coffee Table","$549.00"
"1635221837-3468","https://colemanfurniture.com/accents/coffee-tables-cocktail-tables.htm","Augustine Sepia Brown Bunching Cocktail Table","$225.00"
"1635221837-3417","https://colemanfurniture.com/accents/coffee-tables-cocktail-tables.htm","Rockford White And Chrome Cocktail Table","$295.00"
"1635221837-3462","https://colemanfurniture.com/accents/coffee-tables-cocktail-tables.htm","723078 Chrome Rectangle Coffee Table","$585.00"
"1635221837-4427","https://colemanfurniture.com/accents/coffee-tables-cocktail-tables.htm","Astrid Industrial Grey Coffee Table","$359.00"
"1635221837-5200","https://colemanfurniture.com/accents/coffee-tables-cocktail-tables.htm","Portolone Rectangular Cocktail Table","$675.00"
"1635221837-3294","https://colemanfurniture.com/accents/coffee-tables-cocktail-tables.htm","Signature Designs Champagne Foil Finish Colette Oval Cocktail Table","$1699.00"
"1635221837-4728","https://colemanfurniture.com/accents/coffee-tables-cocktail-tables.htm","Laramie Brown Trunk Cocktail Table","$1942.50"
"1635221837-4726","https://colemanfurniture.com/accents/coffee-tables-cocktail-tables.htm","Isabelle Brass Acrylic Cocktail Table","$1455.00"
"1635221837-3056","https://colemanfurniture.com/accents/coffee-tables-cocktail-tables.htm","Cyrano Natural Elm Circular Coffee Table","$1523.00"
"1635221837-4188","https://colemanfurniture.com/accents/coffee-tables-cocktail-tables.htm","AD Modern Synergy Dyed Oak Avant Rectangular Cocktail Table","$759.00"
"1635221837-4032","https://colemanfurniture.com/accents/coffee-tables-cocktail-tables.htm","Pacific Canyon Coffee Bean Cocktail Table","$715.00"
"1635221837-4489","https://colemanfurniture.com/accents/coffee-tables-cocktail-tables.htm","Paxton Place Dovetail Grey Rectangle Castered Cocktail Table","$639.00"
"1635221837-3976","https://colemanfurniture.com/accents/coffee-tables-cocktail-tables.htm","Modern Pumice And Glacier Whitley Cocktail Table","$1880.00"
"1635221837-4336","https://colemanfurniture.com/accents/coffee-tables-cocktail-tables.htm","Arlington Antique White Coffee Table","$669.00"
"1635221837-3384","https://colemanfurniture.com/accents/coffee-tables-cocktail-tables.htm","Mariposa Pewter Round Cocktail Table","$1049.00"
"1635221837-3308","https://colemanfurniture.com/accents/coffee-tables-cocktail-tables.htm","Clayton Cherry Nouveau Standard Coffee Table","$649.00"
"1635221837-4211","https://colemanfurniture.com/accents/coffee-tables-cocktail-tables.htm","Stitch & Hand Ore Gray Synthetic and Brushed Brass Brule Upholstered Cocktail Table","$1529.00"
"1635221837-4128","https://colemanfurniture.com/accents/coffee-tables-cocktail-tables.htm","Hamilton Dark Stain Tranquil Rectangular Cocktail Table","$425.00"
"1635221837-3100","https://colemanfurniture.com/accents/coffee-tables-cocktail-tables.htm","Canyon Ridge Desert Taupe Square Cocktail Table","$999.00"
"1635221837-4883","https://colemanfurniture.com/accents/coffee-tables-cocktail-tables.htm","Axel Black And Flamingo Terrazzo Coffee Table","$847.00"
"1635221837-3485","https://colemanfurniture.com/accents/coffee-tables-cocktail-tables.htm","Trails Willow Colton Round Coffee Table","$759.00"
"1635221837-5249","https://colemanfurniture.com/accents/coffee-tables-cocktail-tables.htm","Nahara White Coffee Table","$545.00"
"1635221837-2773","https://colemanfurniture.com/accents/coffee-tables-cocktail-tables.htm","Jocelyn Decorative Classic Cocktail Table","$235.00"
"1635221837-4338","https://colemanfurniture.com/accents/coffee-tables-cocktail-tables.htm","Ikon Walnut And Bravo Black Zenzi Storage Coffee Table","$765.00"
"1635221837-4904","https://colemanfurniture.com/accents/coffee-tables-cocktail-tables.htm","Ada Gray Cocktail Table","$2593.50"
"1635221837-2977","https://colemanfurniture.com/accents/coffee-tables-cocktail-tables.htm","Urbana Dark Merlot Round Cocktail Table","$435.00"
"1635221837-4247","https://colemanfurniture.com/accents/coffee-tables-cocktail-tables.htm","Royal Kahala Black Sands Brown Bunching Cocktail Table","$929.00"
"1635221837-3320","https://colemanfurniture.com/accents/coffee-tables-cocktail-tables.htm","Bina Dark Grey Parish Coffee Table","$1099.00"
"1635221837-3232","https://colemanfurniture.com/accents/coffee-tables-cocktail-tables.htm","Discoveries Glass Round Entry Table","$2205.00"
"1635221837-4202","https://colemanfurniture.com/accents/coffee-tables-cocktail-tables.htm","Stepford Smokehouse Wood Flip Top Cocktail Table","$939.00"
"1635221837-3410","https://colemanfurniture.com/accents/coffee-tables-cocktail-tables.htm","Montebello Carob Brown Round Cocktail Table","$1089.00"
"1635221837-5327","https://colemanfurniture.com/accents/coffee-tables-cocktail-tables.htm","Traditions Brushed Gold Carrera Nesting Coffee Table","$2249.00"
"1635221837-4285","https://colemanfurniture.com/accents/coffee-tables-cocktail-tables.htm","705168 Cappuccino Coffee Table","$335.00"
"1635221837-3671","https://colemanfurniture.com/accents/coffee-tables-cocktail-tables.htm","The Marlowe Rustic Charcoal Rectangular Cocktail Table","$615.00"
"1635221837-3890","https://colemanfurniture.com/accents/coffee-tables-cocktail-tables.htm","Metal Designs Gold Leaf Ellipse Rectangular Cocktail Table","$1899.00"
"1635221837-5338","https://colemanfurniture.com/accents/coffee-tables-cocktail-tables.htm","Hexagonal Gold Embossed Leather Top Cocktail Table","$745.00"
"1635221837-3267","https://colemanfurniture.com/accents/coffee-tables-cocktail-tables.htm","Asteroid Grey Stone Medium Coffee Table","$1339.00"
"1635221837-3068","https://colemanfurniture.com/accents/coffee-tables-cocktail-tables.htm","Emma Walnut And Black Coffee Table","$1149.00"
"1635221837-4656","https://colemanfurniture.com/accents/coffee-tables-cocktail-tables.htm","Suspension Renaissance Rectangular Cocktail Table","$1579.00"
"1635221837-3857","https://colemanfurniture.com/accents/coffee-tables-cocktail-tables.htm","Saunders Green And Black Low Coffee Table","$745.00"
"1635221837-3566","https://colemanfurniture.com/accents/coffee-tables-cocktail-tables.htm","Maya Black Top Round Coffee Table","$155.00"
"1635221837-3279","https://colemanfurniture.com/accents/coffee-tables-cocktail-tables.htm","Colton Charcoal Oak and Black Coffee Table","$1832.00"
"1635221837-5216","https://colemanfurniture.com/accents/coffee-tables-cocktail-tables.htm","Trapezoid Black Marble Top Cocktail Table","$859.00"
"1635221837-5526","https://colemanfurniture.com/accents/coffee-tables-cocktail-tables.htm","Radford Lacquered White Linen Rectangular Coffee Table","$1589.00"
"1635221837-3027","https://colemanfurniture.com/accents/coffee-tables-cocktail-tables.htm","Contarini Gunmetal Coffee Table","$765.60"
"1635221837-3407","https://colemanfurniture.com/accents/coffee-tables-cocktail-tables.htm","Ridgeview Stone Gray Rectangular Coffee Table","$475.00"
"1635221837-3756","https://colemanfurniture.com/accents/coffee-tables-cocktail-tables.htm","Signature Designs Gray And Silver Iridium Rectangular Cocktail Table","$3099.00"
"1635221837-2863","https://colemanfurniture.com/accents/coffee-tables-cocktail-tables.htm","Lodia Gray Coffee Table","$499.00"
"1635221837-3609","https://colemanfurniture.com/accents/coffee-tables-cocktail-tables.htm","Haven Distressed Reclaimed Fir Reclaimed Door Extendable Cocktail Table","$629.00"
"1635221837-4480","https://colemanfurniture.com/accents/coffee-tables-cocktail-tables.htm","705168 Cappuccino Coffee Table","$335.00"
"1635221837-4150","https://colemanfurniture.com/accents/coffee-tables-cocktail-tables.htm","Parker Distressed Whiskey Lift Top Cocktail Table","$629.00"
"1635221837-5385","https://colemanfurniture.com/accents/coffee-tables-cocktail-tables.htm","Adelyn Crema Gray Round Cocktail Table","$479.00"
"1635221837-4762","https://colemanfurniture.com/accents/coffee-tables-cocktail-tables.htm","705708 Glossy White Windowpane Coffee Table","$419.00"
"1635221837-2672","https://colemanfurniture.com/accents/coffee-tables-cocktail-tables.htm","Havalance Gray and White Coffee Table","$419.00"
"1635221837-4544","https://colemanfurniture.com/accents/coffee-tables-cocktail-tables.htm","Folio Kildair Antique White Coffee Table","$975.00"
"1635221837-5337","https://colemanfurniture.com/accents/coffee-tables-cocktail-tables.htm","Blayne Storm Cloud Cocktail Table","$1803.90"
"1635221837-5341","https://colemanfurniture.com/accents/coffee-tables-cocktail-tables.htm","Hailee Industrial Cocktail Table","$484.00"
"1635221837-5179","https://colemanfurniture.com/accents/coffee-tables-cocktail-tables.htm","Naomie Brass Rectangular Cocktail Table","$449.00"
"1635221837-4459","https://colemanfurniture.com/accents/coffee-tables-cocktail-tables.htm","Cube Gold Metal Coffee Table","$1243.00"
"1635221837-4867","https://colemanfurniture.com/accents/coffee-tables-cocktail-tables.htm","Madison County Barnwood Harris Lift Lid Cocktail Table","$815.00"
"1635221837-2925","https://colemanfurniture.com/accents/coffee-tables-cocktail-tables.htm","Fortune Black Walnut Rectanuglar Cocktail Table","$685.00"
"1635221837-2834","https://colemanfurniture.com/accents/coffee-tables-cocktail-tables.htm","Foundry Rectangular Cocktail Table","$490.00"
"1635221837-4225","https://colemanfurniture.com/accents/coffee-tables-cocktail-tables.htm","Bina Warm Brown Acacia Ryan Coffee Table","$2299.00"
"1635221837-3896","https://colemanfurniture.com/accents/coffee-tables-cocktail-tables.htm","Wren Industrial And Black Metal Cocktail Table","$245.00"
"1635221837-2651","https://colemanfurniture.com/accents/coffee-tables-cocktail-tables.htm","Arlenbry Gray Lift Top Coffee Table","$269.00"
"1635221837-3430","https://colemanfurniture.com/accents/coffee-tables-cocktail-tables.htm","Reclamation Place Dark Tobacco Round Cocktail Table","$685.00"
"1635221837-4757","https://colemanfurniture.com/accents/coffee-tables-cocktail-tables.htm","Groot Brown Coffee Table","$1025.00"
"1635221837-2923","https://colemanfurniture.com/accents/coffee-tables-cocktail-tables.htm","Amity Gray Drawer Coffee Table","$395.00"
"1635221837-4915","https://colemanfurniture.com/accents/coffee-tables-cocktail-tables.htm","Design District Walnut Coffee Table","$819.00"
"1635221837-4287","https://colemanfurniture.com/accents/coffee-tables-cocktail-tables.htm","Foley Antique Pine And Black 36"" Coffee Table","$349.00"
"1635221837-4644","https://colemanfurniture.com/accents/coffee-tables-cocktail-tables.htm","Strato Silver Coffee Table","$1199.00"
"1635221837-4926","https://colemanfurniture.com/accents/coffee-tables-cocktail-tables.htm","Cordova Ebonized Cocktail Table","$1673.00"
"1635221837-5068","https://colemanfurniture.com/accents/coffee-tables-cocktail-tables.htm","3159FR2-C2 Brown Coffee Table","$615.00"
"1635221837-2888","https://colemanfurniture.com/accents/coffee-tables-cocktail-tables.htm","704418 Dark Brown and White Coffee Table","$405.00"
"1635221837-4151","https://colemanfurniture.com/accents/coffee-tables-cocktail-tables.htm","Per Se St Laurent Square Cocktail Table","$1749.00"
"1635221837-5366","https://colemanfurniture.com/accents/coffee-tables-cocktail-tables.htm","24101 Sierra And Black Oval Coffee Table","$849.00"
"1635221837-5141","https://colemanfurniture.com/accents/coffee-tables-cocktail-tables.htm","Signature Designs Polished Stainless Steel Sangiovese Round Cocktail Table","$1785.00"
"1635221837-4426","https://colemanfurniture.com/accents/coffee-tables-cocktail-tables.htm","Bone Inlay White And Black Cocktail Table","$899.00"
"1635221837-5287","https://colemanfurniture.com/accents/coffee-tables-cocktail-tables.htm","Signature Designs Gray And Brown Foray Rectangular Cocktail Table","$1979.00"
"1635221837-4838","https://colemanfurniture.com/accents/coffee-tables-cocktail-tables.htm","Appellation Medium Gray Wirebrushed Square Cocktail Table","$1979.00"
"1635221837-3757","https://colemanfurniture.com/accents/coffee-tables-cocktail-tables.htm","Saunders White And Black Low Coffee Table","$745.00"
"1635221837-4622","https://colemanfurniture.com/accents/coffee-tables-cocktail-tables.htm","Signature Designs Gray And Gun Metal Cirro Rectangular Cocktail Table","$1979.00"
"1635221837-4458","https://colemanfurniture.com/accents/coffee-tables-cocktail-tables.htm","Ashiko Metallic Coffee Table","$629.00"
"1635221837-4880","https://colemanfurniture.com/accents/coffee-tables-cocktail-tables.htm","Nathan Black Coffee Table","$1525.00"
"1635221837-4749","https://colemanfurniture.com/accents/coffee-tables-cocktail-tables.htm","Honeycomb Renaissance Rectangular Cocktail Table","$1899.00"
"1635221837-2621","https://colemanfurniture.com/accents/coffee-tables-cocktail-tables.htm","Leopold White Marble Cocktail Table","$549.00"
"1635221837-2654","https://colemanfurniture.com/accents/coffee-tables-cocktail-tables.htm","Havalance Gray And White Lift Top Coffee Table","$419.00"
"1635221837-4565","https://colemanfurniture.com/accents/coffee-tables-cocktail-tables.htm","Foundry Brushed Pewter Coffee Table","$475.00"
