web-scraper-order,web-scraper-start-url,nnn,ppp
"1635221837-4550","https://colemanfurniture.com/accents/coffee-tables-cocktail-tables.htm","Regina Bone Inlay Black And White Cocktail Table","$259.00"
"1635221837-4719","https://colemanfurniture.com/accents/coffee-tables-cocktail-tables.htm","Drake Ashen Grey And Black Round Drum Cocktail Table","$745.00"
"1635221837-4624","https://colemanfurniture.com/accents/coffee-tables-cocktail-tables.htm","Gallagher Cathedral Gray 35"" Round Coffee Table","$165.00"
"1635221837-4098","https://colemanfurniture.com/accents/coffee-tables-cocktail-tables.htm","Saunders Green And Gold High Coffee Table","$745.00"
"1635221837-4986","https://colemanfurniture.com/accents/coffee-tables-cocktail-tables.htm","Pine Natural And Gold Iron Two Drawer Cocktail Table","$279.00"
"1635221837-3347","https://colemanfurniture.com/accents/coffee-tables-cocktail-tables.htm","Puzzle Beige Teak Coffee Table","$1999.00"
"1635221837-4084","https://colemanfurniture.com/accents/coffee-tables-cocktail-tables.htm","Wesson Natural Yukas And Distressed Iron Saxon Coffee Table","$1749.00"
"1635221837-4364","https://colemanfurniture.com/accents/coffee-tables-cocktail-tables.htm","Archivist Dark Wood Round Cocktail Table","$819.00"
"1635221837-5213","https://colemanfurniture.com/accents/coffee-tables-cocktail-tables.htm","Dockworker Board Brown Cocktail Table","$2097.90"
"1635221837-5237","https://colemanfurniture.com/accents/coffee-tables-cocktail-tables.htm","Tori Sandy Shore Coffee Table","$869.00"
"1635221837-3480","https://colemanfurniture.com/accents/coffee-tables-cocktail-tables.htm","Honeycomb St Laurent Rectangular Cocktail Table","$1899.00"
"1635221837-4536","https://colemanfurniture.com/accents/coffee-tables-cocktail-tables.htm","Charleston Barley Oak Rectangular Motion Cocktail Table","$669.00"
"1635221837-3040","https://colemanfurniture.com/accents/coffee-tables-cocktail-tables.htm","Wynton Cognac Square Cocktail Table","$769.00"
"1635221837-4312","https://colemanfurniture.com/accents/coffee-tables-cocktail-tables.htm","Metro Polished Nickel Cocktail Bench","$415.00"
"1635221837-3749","https://colemanfurniture.com/accents/coffee-tables-cocktail-tables.htm","Metal Designs Gold Leaf Ellipse Rectangular Cocktail Table","$1899.00"
"1635221837-3073","https://colemanfurniture.com/accents/coffee-tables-cocktail-tables.htm","Baja II Cocoa Round Coffee Table","$475.00"
"1635221837-3363","https://colemanfurniture.com/accents/coffee-tables-cocktail-tables.htm","Wellington Hall Driftwood Oval Coffee Table","$599.00"
"1635221837-2682","https://colemanfurniture.com/accents/coffee-tables-cocktail-tables.htm","Lindalon Light Brown Coffee Table","$349.00"
"1635221837-5270","https://colemanfurniture.com/accents/coffee-tables-cocktail-tables.htm","Charleston Brass Acrylic Cocktail Table","$1205.00"
"1635221837-4878","https://colemanfurniture.com/accents/coffee-tables-cocktail-tables.htm","Reed Natural Coffee Table","$969.00"
"1635221837-5090","https://colemanfurniture.com/accents/coffee-tables-cocktail-tables.htm","Andress Argento Round Cocktail Table","$1299.00"
"1635221837-4396","https://colemanfurniture.com/accents/coffee-tables-cocktail-tables.htm","Alamo Gray Round Cocktail Table","$332.00"
"1635221837-5434","https://colemanfurniture.com/accents/coffee-tables-cocktail-tables.htm","River Stone Dark Granite Large Coffee Table","$1739.00"
"1635221837-4423","https://colemanfurniture.com/accents/coffee-tables-cocktail-tables.htm","Clifton White Cerused Oak And Brass Coffee Table","$2249.00"
"1635221837-2873","https://colemanfurniture.com/accents/coffee-tables-cocktail-tables.htm","Winslet Cherry Oval Cocktail Table","$489.00"
"1635221837-2640","https://colemanfurniture.com/accents/coffee-tables-cocktail-tables.htm","Vailbry Brown Lift Top Cocktail Table","$439.00"
"1635221837-3234","https://colemanfurniture.com/accents/coffee-tables-cocktail-tables.htm","Log Bronze Coffee Table","$1379.00"
"1635221837-4779","https://colemanfurniture.com/accents/coffee-tables-cocktail-tables.htm","Reclamation Place Sundried Natural Rectangular Cocktail Table","$475.00"
"1635221837-5072","https://colemanfurniture.com/accents/coffee-tables-cocktail-tables.htm","Whitford Dove Gray Cocktail Table","$255.00"
"1635221837-5003","https://colemanfurniture.com/accents/coffee-tables-cocktail-tables.htm","Blakely Gunmetal Steel and Matte Black Coffee Table","$2069.00"
"1635221837-5028","https://colemanfurniture.com/accents/coffee-tables-cocktail-tables.htm","Balance Graphite Coffee Table","$1012.50"
"1635221837-3458","https://colemanfurniture.com/accents/coffee-tables-cocktail-tables.htm","Sonoma Road Weathered Beaten Bark Rectangular Cocktail Table","$424.00"
"1635221837-3211","https://colemanfurniture.com/accents/coffee-tables-cocktail-tables.htm","Essentials Pebble Townsend Upholstered Coffee Table","$1149.00"
"1635221837-3518","https://colemanfurniture.com/accents/coffee-tables-cocktail-tables.htm","23801 Edgewater And Antique Brass Rectangle Coffee Table","$1199.00"
"1635221837-3077","https://colemanfurniture.com/accents/coffee-tables-cocktail-tables.htm","Atka Clear Acrylic Cocktail Table","$359.00"
"1635221837-3979","https://colemanfurniture.com/accents/coffee-tables-cocktail-tables.htm","Mountain Manor Heritage Cherry Rectangular Cocktail Table","$519.00"
"1635221837-3351","https://colemanfurniture.com/accents/coffee-tables-cocktail-tables.htm","Deion Lacquer White Lacquer Cocktail Table","$765.00"
"1635221837-5214","https://colemanfurniture.com/accents/coffee-tables-cocktail-tables.htm","Cleveland Gold Cocktail Table","$939.00"
"1635221837-3248","https://colemanfurniture.com/accents/coffee-tables-cocktail-tables.htm","Storia Gray Round Cocktail Table","$1399.00"
"1635221837-2655","https://colemanfurniture.com/accents/coffee-tables-cocktail-tables.htm","Gerdanet Natural Lift Top Coffee Table","$179.00"
"1635221837-4368","https://colemanfurniture.com/accents/coffee-tables-cocktail-tables.htm","Harcourt Rectangular Cocktail Table With Casters","$555.00"
"1635221837-3847","https://colemanfurniture.com/accents/coffee-tables-cocktail-tables.htm","Metro Oyster White Rectangular Cocktail Table","$695.00"
"1635221837-4780","https://colemanfurniture.com/accents/coffee-tables-cocktail-tables.htm","Portman Raw Umber Rectangular Lift Top Coffee Table","$735.00"
"1635221837-5041","https://colemanfurniture.com/accents/coffee-tables-cocktail-tables.htm","La Grange Medium Wood Faison Oval Cocktail Table","$1499.00"
"1635221837-4946","https://colemanfurniture.com/accents/coffee-tables-cocktail-tables.htm","Erabella Iron With A Satin Gold Coffee Table","$1449.00"
"1635221837-4872","https://colemanfurniture.com/accents/coffee-tables-cocktail-tables.htm","Kitano Rich Brown Hazelnut Gianni Square Cocktail Table","$2579.00"
"1635221837-5258","https://colemanfurniture.com/accents/coffee-tables-cocktail-tables.htm","Sheridan Burnished Cherry Lift Top Cocktail Table","$1006.00"
"1635221837-3861","https://colemanfurniture.com/accents/coffee-tables-cocktail-tables.htm","Metropolian Dark Cherry & Birch Oval Lift-Top Cocktail Table","$515.00"
"1635221837-4253","https://colemanfurniture.com/accents/coffee-tables-cocktail-tables.htm","Great Voyage Antique Beige Door Cocktail Table","$1362.90"
"1635221837-4865","https://colemanfurniture.com/accents/coffee-tables-cocktail-tables.htm","Drake Rustic White and French Oak Coffee Table","$555.00"
"1635221837-3187","https://colemanfurniture.com/accents/coffee-tables-cocktail-tables.htm","Winston Medium Cherry Cocktail Table","$349.00"
"1635221837-2933","https://colemanfurniture.com/accents/coffee-tables-cocktail-tables.htm","Element Abel Sunburst Square Coffee Table","$1099.00"
"1635221837-2705","https://colemanfurniture.com/accents/coffee-tables-cocktail-tables.htm","Matteo Gray And Black Cocktail Table","$239.00"
"1635221837-4777","https://colemanfurniture.com/accents/coffee-tables-cocktail-tables.htm","Hancock Black Round Coffee Table","$485.00"
"1635221837-4415","https://colemanfurniture.com/accents/coffee-tables-cocktail-tables.htm","Weatherford Heather Bolton Round Cocktail Table","$975.00"
"1635221837-3333","https://colemanfurniture.com/accents/coffee-tables-cocktail-tables.htm","Carlisle Powder Gary Cocktail Table","$429.00"
"1635221837-3368","https://colemanfurniture.com/accents/coffee-tables-cocktail-tables.htm","Orchard Park White Rub Cocktail Table","$529.00"
"1635221837-4053","https://colemanfurniture.com/accents/coffee-tables-cocktail-tables.htm","Ellen Brown 2 Drawer Coffee Table","$1460.00"
"1635221837-5002","https://colemanfurniture.com/accents/coffee-tables-cocktail-tables.htm","Hudson Antique Brass Square Coffee Table","$3639.00"
"1635221837-5488","https://colemanfurniture.com/accents/coffee-tables-cocktail-tables.htm","Meadow Antique White Coffee Table","$475.00"
"1635221837-4899","https://colemanfurniture.com/accents/coffee-tables-cocktail-tables.htm","Jasmine White And Gray Bi Level Cocktail Table","$315.00"
"1635221837-5082","https://colemanfurniture.com/accents/coffee-tables-cocktail-tables.htm","Black Nesting Coffee Tables Set of 2","$575.00"
"1635221837-3284","https://colemanfurniture.com/accents/coffee-tables-cocktail-tables.htm","Ad Modern Classics Hyde Rectangular Cocktail Table","$725.00"
"1635221837-3254","https://colemanfurniture.com/accents/coffee-tables-cocktail-tables.htm","The Beckham Dark Sable Base Round Cocktail Table","$485.00"
"1635221837-4887","https://colemanfurniture.com/accents/coffee-tables-cocktail-tables.htm","District Natural Gray And Silver Roto Large Coffee Table","$1779.00"
"1635221837-3388","https://colemanfurniture.com/accents/coffee-tables-cocktail-tables.htm","2836 Walnut Drawer Coffee Table","$209.00"
"1635221837-4358","https://colemanfurniture.com/accents/coffee-tables-cocktail-tables.htm","Richard White and Black Marble Cocktail Table","$499.00"
"1635221837-3904","https://colemanfurniture.com/accents/coffee-tables-cocktail-tables.htm","Hanover Coffee Bean Square Cocktail Table","$685.00"
"1635221837-3037","https://colemanfurniture.com/accents/coffee-tables-cocktail-tables.htm","Agate Brown and Silver Coffee Table","$2239.00"
"1635221837-3270","https://colemanfurniture.com/accents/coffee-tables-cocktail-tables.htm","Keelin Gray Wood Cocktail Table","$405.00"
"1635221837-3503","https://colemanfurniture.com/accents/coffee-tables-cocktail-tables.htm","Modern Farmhouse Dusty Charcoal Splay Leg Round Cocktail Table","$455.00"
"1635221837-3387","https://colemanfurniture.com/accents/coffee-tables-cocktail-tables.htm","Paxton Weathered Walnut 48"" Coffee Table","$789.00"
"1635221837-4692","https://colemanfurniture.com/accents/coffee-tables-cocktail-tables.htm","Cyrus Black And Browns Lift Top Cocktail Table","$825.00"
"1635221837-2878","https://colemanfurniture.com/accents/coffee-tables-cocktail-tables.htm","Estelle Washed Gray Round Cocktail Table","$705.00"
"1635221837-3782","https://colemanfurniture.com/accents/coffee-tables-cocktail-tables.htm","Carlton Rich Chestnut Brown And Brushed Silver Metal Rectangular Coffee Table","$609.00"
"1635221837-4198","https://colemanfurniture.com/accents/coffee-tables-cocktail-tables.htm","Beckford Chrome and Grayed Oak Rectangle Cocktail Table","$575.00"
"1635221837-5086","https://colemanfurniture.com/accents/coffee-tables-cocktail-tables.htm","Arch Salvage Parchment Sloane Cocktail Table","$1175.00"
"1635221837-4349","https://colemanfurniture.com/accents/coffee-tables-cocktail-tables.htm","Elise Cocktail Table","$1095.00"
"1635221837-4520","https://colemanfurniture.com/accents/coffee-tables-cocktail-tables.htm","Mixt Gia White Coffee Table","$1625.00"
"1635221837-4632","https://colemanfurniture.com/accents/coffee-tables-cocktail-tables.htm","Myra Natural Leg Cocktail Table","$689.00"
"1635221837-4078","https://colemanfurniture.com/accents/coffee-tables-cocktail-tables.htm","Playlist Brown Eyed Girl Round Cocktail Table","$1340.00"
"1635221837-3787","https://colemanfurniture.com/accents/coffee-tables-cocktail-tables.htm","Appellation Medium Gray Wirebrushed Rectangular Cocktail Table","$2829.00"
"1635221837-3104","https://colemanfurniture.com/accents/coffee-tables-cocktail-tables.htm","Bryanna Antique Light Oak Coffee Table","$765.00"
"1635221837-5354","https://colemanfurniture.com/accents/coffee-tables-cocktail-tables.htm","Donnelly White Marble Cocktail Table","$3345.00"
"1635221837-5464","https://colemanfurniture.com/accents/coffee-tables-cocktail-tables.htm","Rollo Gold Leaf 2 Tier Round Coffee Table","$1749.00"
"1635221837-4714","https://colemanfurniture.com/accents/coffee-tables-cocktail-tables.htm","Francisca Distressed Vintage White Cocktail Trunk","$825.00"
"1635221837-3171","https://colemanfurniture.com/accents/coffee-tables-cocktail-tables.htm","Matilda Gold Leaf Glass Cocktail Table","$765.00"
"1635221837-3002","https://colemanfurniture.com/accents/coffee-tables-cocktail-tables.htm","Nonie Slate Gray Cocktail Table With Tray Top","$219.00"
"1635221837-3720","https://colemanfurniture.com/accents/coffee-tables-cocktail-tables.htm","Coastal Living Boardwalk Cocktail Table","$780.00"
"1635221837-4828","https://colemanfurniture.com/accents/coffee-tables-cocktail-tables.htm","Matthew Silver Leaf Inset Mirror Cocktail Table","$255.00"
"1635221837-3968","https://colemanfurniture.com/accents/coffee-tables-cocktail-tables.htm","Hill Country Luckenbach Cast Iron Round Cocktail Table","$1179.00"
"1635221837-4028","https://colemanfurniture.com/accents/coffee-tables-cocktail-tables.htm","Cube Polished Silver Metal Coffee Table","$1111.00"
"1635221837-5407","https://colemanfurniture.com/accents/coffee-tables-cocktail-tables.htm","Metal Designs Black Claret Round Cocktail Table","$1899.00"
"1635221837-4414","https://colemanfurniture.com/accents/coffee-tables-cocktail-tables.htm","Corliss Americano and Rose Brass Coffee Table","$709.00"
"1635221837-5435","https://colemanfurniture.com/accents/coffee-tables-cocktail-tables.htm","River Stone Dark Granite Small Coffee Table","$1499.00"
"1635221837-4192","https://colemanfurniture.com/accents/coffee-tables-cocktail-tables.htm","Versailles Brushed Gold and Seared Wood Coffee Table","$1958.00"
"1635221837-5066","https://colemanfurniture.com/accents/coffee-tables-cocktail-tables.htm","Grand Artisan Gray Tray Top Cocktail Table","$1528.00"
"1635221837-3469","https://colemanfurniture.com/accents/coffee-tables-cocktail-tables.htm","Lucentio Polished Brass Octagon Cocktail Table","$775.00"
"1635221837-2789","https://colemanfurniture.com/accents/coffee-tables-cocktail-tables.htm","Kareem Metallic Gray Coffee Table","$963.60"
"1635221837-3553","https://colemanfurniture.com/accents/coffee-tables-cocktail-tables.htm","Zelda Black Powder Coat And Nickel Square Coffee Table","$2379.00"
"1635221837-4826","https://colemanfurniture.com/accents/coffee-tables-cocktail-tables.htm","Nina Magon Bronze Marcel Cocktail Table","$1285.00"
"1635221837-4136","https://colemanfurniture.com/accents/coffee-tables-cocktail-tables.htm","River Stone Bronze Small Stone Coffee Table","$1249.00"
"1635221837-2918","https://colemanfurniture.com/accents/coffee-tables-cocktail-tables.htm","Hemingway Alabaster Lift Top Coffee Table","$459.00"
"1635221837-2896","https://colemanfurniture.com/accents/coffee-tables-cocktail-tables.htm","3258 Dark Taupe / Chrome Cocktail Table","$259.00"
"1635221837-3018","https://colemanfurniture.com/accents/coffee-tables-cocktail-tables.htm","Marguerite Silver And Black Cocktail Table","$743.00"
"1635221837-4464","https://colemanfurniture.com/accents/coffee-tables-cocktail-tables.htm","Farmhouse Natural Cocktail Table","$1782.90"
"1635221837-4744","https://colemanfurniture.com/accents/coffee-tables-cocktail-tables.htm","Continental Weathered Nutmeg Square Cocktail Table","$655.00"
"1635221837-4627","https://colemanfurniture.com/accents/coffee-tables-cocktail-tables.htm","Roslyn County Dark Wood Round Cocktail Table","$1489.00"
"1635221837-4610","https://colemanfurniture.com/accents/coffee-tables-cocktail-tables.htm","Malone Light Gray Wood Cocktail Table","$299.00"
"1635221837-5361","https://colemanfurniture.com/accents/coffee-tables-cocktail-tables.htm","Evelina Royale Leaf Coffee Table","$915.00"
"1635221837-3139","https://colemanfurniture.com/accents/coffee-tables-cocktail-tables.htm","Clark Dark Brown Round Cocktail Table","$999.00"
"1635221837-4497","https://colemanfurniture.com/accents/coffee-tables-cocktail-tables.htm","Allene Gold Leaf And Mirror Retro Cocktail Table","$539.00"
"1635221837-4585","https://colemanfurniture.com/accents/coffee-tables-cocktail-tables.htm","Claude Chrome and Clear Acrylic Rectangular Coffee Table","$489.00"
"1635221837-4184","https://colemanfurniture.com/accents/coffee-tables-cocktail-tables.htm","Caracole Classic A Whole Bunch Cocktail Table","$1065.00"
"1635221837-5453","https://colemanfurniture.com/accents/coffee-tables-cocktail-tables.htm","U207-As Dark Gray Pedestal Cocktail Table","$1354.50"
"1635221837-2702","https://colemanfurniture.com/accents/coffee-tables-cocktail-tables.htm","Sierra Brown Cocktail Table","$709.00"
"1635221837-3678","https://colemanfurniture.com/accents/coffee-tables-cocktail-tables.htm","Westlake Dark Brown Veneer Coffee Table","$815.00"
"1635221837-4707","https://colemanfurniture.com/accents/coffee-tables-cocktail-tables.htm","Glossy White and Chrome Metal Coffee Table","$275.00"
"1635221837-4436","https://colemanfurniture.com/accents/coffee-tables-cocktail-tables.htm","Passage Light Oak And Silver Round Cocktail Table","$1235.00"
"1635221837-5484","https://colemanfurniture.com/accents/coffee-tables-cocktail-tables.htm","Scottsdale Sand Dune And Black Round Coffee Table","$675.00"
"1635221837-5204","https://colemanfurniture.com/accents/coffee-tables-cocktail-tables.htm","Bella Antique White Wash And White Quartz Spruce Square Coffee Table","$1989.00"
"1635221837-4216","https://colemanfurniture.com/accents/coffee-tables-cocktail-tables.htm","Carmen Black Marble Veneer And Brass Leg Square Cocktail Table","$395.00"
"1635221837-2902","https://colemanfurniture.com/accents/coffee-tables-cocktail-tables.htm","Truman Espresso Castered Cocktail Table","$235.00"
"1635221837-5202","https://colemanfurniture.com/accents/coffee-tables-cocktail-tables.htm","Prii Black Coffee Table","$1725.00"
"1635221837-5274","https://colemanfurniture.com/accents/coffee-tables-cocktail-tables.htm","Wood Panel Blue Large Cocktail Table","$2845.50"
"1635221837-3876","https://colemanfurniture.com/accents/coffee-tables-cocktail-tables.htm","Canary White Velvet And Gold Metal Coffee Table","$439.00"
"1635221837-3738","https://colemanfurniture.com/accents/coffee-tables-cocktail-tables.htm","Marlow Antique Brass Olivia Square Coffee Table","$1199.00"
"1635221837-5318","https://colemanfurniture.com/accents/coffee-tables-cocktail-tables.htm","7611-45 Rich Coffee Lift Top Cocktail Table","$395.00"
"1635221837-3770","https://colemanfurniture.com/accents/coffee-tables-cocktail-tables.htm","Theory Charcoal And Gunmetal Round Coffee Table","$949.00"
"1635221837-4293","https://colemanfurniture.com/accents/coffee-tables-cocktail-tables.htm","Visby Warm Nutmeg Rectangular Lift Top Cocktail Table","$529.00"
"1635221837-4529","https://colemanfurniture.com/accents/coffee-tables-cocktail-tables.htm","Madisyn White and Chrome Coffee Table","$349.00"
"1635221837-2927","https://colemanfurniture.com/accents/coffee-tables-cocktail-tables.htm","Ulysses Polished Steel Round Cocktail Table","$745.00"
"1635221837-3060","https://colemanfurniture.com/accents/coffee-tables-cocktail-tables.htm","Oyster Bay Litchfield Square Cocktail Table","$1929.00"
"1635221837-3076","https://colemanfurniture.com/accents/coffee-tables-cocktail-tables.htm","Arlene Gold And Mirror Cocktail Table","$835.00"
"1635221837-2844","https://colemanfurniture.com/accents/coffee-tables-cocktail-tables.htm","David Driftwood Cocktail Table","$249.00"
"1635221837-3640","https://colemanfurniture.com/accents/coffee-tables-cocktail-tables.htm","Ad Modern Synergy Avant Rectangular Cocktail Table","$759.00"
"1635221837-4325","https://colemanfurniture.com/accents/coffee-tables-cocktail-tables.htm","Sangiovese Antique Copper Small Rectangular Cocktail Table","$1449.00"
"1635221837-3751","https://colemanfurniture.com/accents/coffee-tables-cocktail-tables.htm","Hanover Coffee Bean Square Cocktail Table","$685.00"
"1635221837-2897","https://colemanfurniture.com/accents/coffee-tables-cocktail-tables.htm","Mesa Antique White Cocktail Table","$655.00"
"1635221837-3852","https://colemanfurniture.com/accents/coffee-tables-cocktail-tables.htm","Frazier Brown Cherry Cocktail Table","$802.00"
"1635221837-5230","https://colemanfurniture.com/accents/coffee-tables-cocktail-tables.htm","Mina White And Gold Marble Coffee Table","$475.00"
"1635221837-3853","https://colemanfurniture.com/accents/coffee-tables-cocktail-tables.htm","Grove Park Chocolate Mahogany Round Cocktail Table","$439.00"
"1635221837-5301","https://colemanfurniture.com/accents/coffee-tables-cocktail-tables.htm","40-180 Black Coffee Table","$1431.00"
"1635221837-3748","https://colemanfurniture.com/accents/coffee-tables-cocktail-tables.htm","Metal Designs Gold Leaf Bonaire Rectangular Cocktail Table","$1749.00"
"1635221837-4024","https://colemanfurniture.com/accents/coffee-tables-cocktail-tables.htm","Brown And Beige Rectangular Coffee Table","$949.00"
"1635221837-3396","https://colemanfurniture.com/accents/coffee-tables-cocktail-tables.htm","Deion Lacquer White Lacquer Cocktail Table","$765.00"
"1635221837-4661","https://colemanfurniture.com/accents/coffee-tables-cocktail-tables.htm","Villa Toscana Criollo Rectangular Cocktail Table","$899.00"
"1635221837-4748","https://colemanfurniture.com/accents/coffee-tables-cocktail-tables.htm","Bonaire St Laurent Rectangular Cocktail Table","$1579.00"
"1635221837-3183","https://colemanfurniture.com/accents/coffee-tables-cocktail-tables.htm","Sullivan Country White Cocktail Table","$745.00"
"1635221837-4751","https://colemanfurniture.com/accents/coffee-tables-cocktail-tables.htm","Metal Designs Black Claret Rectangular Cocktail Table","$1899.00"
"1635221837-3258","https://colemanfurniture.com/accents/coffee-tables-cocktail-tables.htm","Modern Farmhouse Dusty Charcoal Drum Cocktail Table","$685.00"
"1635221837-3332","https://colemanfurniture.com/accents/coffee-tables-cocktail-tables.htm","Caracole Classic Chocolate Bronze Be All Cocktail Table","$1119.00"
"1635221837-4027","https://colemanfurniture.com/accents/coffee-tables-cocktail-tables.htm","Vancouver Light Brown Coffee Table","$1425.00"
"1635221837-3649","https://colemanfurniture.com/accents/coffee-tables-cocktail-tables.htm","Cascade Wire Brush Rustic Brown Oval Cocktail Table","$412.00"
"1635221837-3641","https://colemanfurniture.com/accents/coffee-tables-cocktail-tables.htm","Aspen Skies Russet Brown Motion Cocktail Table","$424.00"
"1635221837-5107","https://colemanfurniture.com/accents/coffee-tables-cocktail-tables.htm","753308 Buttermilk Coffee Table","$615.00"
"1635221837-4447","https://colemanfurniture.com/accents/coffee-tables-cocktail-tables.htm","Donelson Brown Rectangular Coffee Table","$719.00"
"1635221837-2607","https://colemanfurniture.com/accents/coffee-tables-cocktail-tables.htm","Marlow Hammered Grey Adair Coffee Table","$999.00"
"1635221837-4356","https://colemanfurniture.com/accents/coffee-tables-cocktail-tables.htm","Terzo Black Marble Cocktail Table","$499.00"
"1635221837-2886","https://colemanfurniture.com/accents/coffee-tables-cocktail-tables.htm","Corvus White And Coffee White Marble Top Cocktail Table","$474.00"
"1635221837-5189","https://colemanfurniture.com/accents/coffee-tables-cocktail-tables.htm","Somani Gray and Ivory Coffee Table","$529.00"
"1635221837-4870","https://colemanfurniture.com/accents/coffee-tables-cocktail-tables.htm","Hampton Taupe Gray Rectangular Coffee Table","$369.00"
"1635221837-4868","https://colemanfurniture.com/accents/coffee-tables-cocktail-tables.htm","Madison County Vintage White 3 Drawer Cocktail Table","$705.00"
"1635221837-4057","https://colemanfurniture.com/accents/coffee-tables-cocktail-tables.htm","Signature Designs Gray Precept Square Cocktail Table","$2979.00"
"1635221837-3029","https://colemanfurniture.com/accents/coffee-tables-cocktail-tables.htm","Jango Black 44"" Coffee Table","$1699.00"
"1635221837-3567","https://colemanfurniture.com/accents/coffee-tables-cocktail-tables.htm","Joanna Brown Glass Square Coffee Table","$3639.00"
"1635221837-5130","https://colemanfurniture.com/accents/coffee-tables-cocktail-tables.htm","Ikon Skyy Antique Brass Coffee Table","$2329.00"
"1635221837-5151","https://colemanfurniture.com/accents/coffee-tables-cocktail-tables.htm","Elaine Black And Gold 2 Drawer Cocktail Table","$265.00"
"1635221837-4021","https://colemanfurniture.com/accents/coffee-tables-cocktail-tables.htm","Bar Harbor Blue 2 Drawer Lift Top Cocktail Table","$1075.00"
"1635221837-3443","https://colemanfurniture.com/accents/coffee-tables-cocktail-tables.htm","Prescott Rustic Honey Small Rectangular Cocktail Table","$629.00"
"1635221837-2663","https://colemanfurniture.com/accents/coffee-tables-cocktail-tables.htm","Nallynx Metallic Gray Coffee Table","$239.00"
"1635221837-3054","https://colemanfurniture.com/accents/coffee-tables-cocktail-tables.htm","Nuevo Walnut Coffee Table","$809.00"
"1635221837-5166","https://colemanfurniture.com/accents/coffee-tables-cocktail-tables.htm","Maris Nickel Modern 2 Tier Square Coffee Table","$1749.00"
"1635221837-2988","https://colemanfurniture.com/accents/coffee-tables-cocktail-tables.htm","Candice Walnut Coffee Table","$1599.00"
"1635221837-3829","https://colemanfurniture.com/accents/coffee-tables-cocktail-tables.htm","Bonaire Renaissance Rectangular Cocktail Table","$1579.00"
"1635221837-4441","https://colemanfurniture.com/accents/coffee-tables-cocktail-tables.htm","Emerald Black Ash Oval Coffee Table","$514.00"
