web-scraper-order,web-scraper-start-url,nnn
1631785857-10012,https://www.officedepot.com/a/browse/cooking-utensils/N=5+1176171/,"Winco Metal/Wood Strainer, 8"", Brown0.0 out of 5 stars."
1631785857-9963,https://www.officedepot.com/a/browse/cooking-utensils/N=5+1176171/,"Vollrath French Whip, 18"", Silver0.0 out of 5 stars."
1631785857-10148,https://www.officedepot.com/a/browse/cooking-utensils/N=5+1176171/,"Dura-Kool™ Tongs, 12"", Green, Pack Of 120.0 out of 5 stars."
1631785857-9559,https://www.officedepot.com/a/browse/cooking-utensils/N=5+1176171/,"American Metalcraft Stainless-Steel Salad Tong, 8"", Silver0.0 out of 5 stars."
1631785857-8941,https://www.officedepot.com/a/browse/cooking-utensils/N=5+1176171/,"Winco Wood Spoon, 14"", Brown"
1631785857-9122,https://www.officedepot.com/a/browse/cooking-utensils/N=5+1176171/,"Winco Stainless-Steel Pastry Blender, Silver0.0 out of 5 stars."
1631785857-9048,https://www.officedepot.com/a/browse/cooking-utensils/N=5+1176171/,"Martha Stewart Stainless Steel Long Grater, Silver0.0 out of 5 stars."
1631785857-8943,https://www.officedepot.com/a/browse/cooking-utensils/N=5+1176171/,"Crestware Piano Wire Whip, 10"", Silver"
1631785857-10143,https://www.officedepot.com/a/browse/cooking-utensils/N=5+1176171/,"Mind Reader EZ Board Disposable Cutting Boards, Clear, Pack Of 40 Sheets0.0 out of 5 stars."
1631785857-10131,https://www.officedepot.com/a/browse/cooking-utensils/N=5+1176171/,"Tablecraft Stainless-Steel Serving Ladle, 2 Oz, Silver0.0 out of 5 stars."
1631785857-9876,https://www.officedepot.com/a/browse/cooking-utensils/N=5+1176171/,"Cambro Camwear Liquid Measuring Cup, 4 Qt, Clear0.0 out of 5 stars."
1631785857-10123,https://www.officedepot.com/a/browse/cooking-utensils/N=5+1176171/,"Carlisle Carly® Salad Tongs, 6-1/4"", Black0.0 out of 5 stars."
1631785857-9194,https://www.officedepot.com/a/browse/cooking-utensils/N=5+1176171/,"American Metalcraft Round Aluminum Pizza Peel, 13 1/2"", Silver0.0 out of 5 stars."
1631785857-8947,https://www.officedepot.com/a/browse/cooking-utensils/N=5+1176171/,"Spill-Stop Plastic Ice Scoop, 82 Oz, White"
1631785857-9288,https://www.officedepot.com/a/browse/cooking-utensils/N=5+1176171/,"Winco Heavy-Duty Utility Tongs, 12"", Silver0.0 out of 5 stars."
1631785857-8861,https://www.officedepot.com/a/browse/cooking-utensils/N=5+1176171/,"Tablecraft Bamboo Fork Picks, 3-1/2"", Brown, Pack Of 100 Picks"
1631785857-9783,https://www.officedepot.com/a/browse/cooking-utensils/N=5+1176171/,"Winco Solid Portion Spoon, 4 Oz, Green0.0 out of 5 stars."
1631785857-9964,https://www.officedepot.com/a/browse/cooking-utensils/N=5+1176171/,"Adcraft French Whip, 36"", Silver0.0 out of 5 stars."
1631785857-10261,https://www.officedepot.com/a/browse/cooking-utensils/N=5+1176171/,"Mind Reader 2-Piece Rope Dessert Utensil Set, Silver0.0 out of 5 stars."
1631785857-9178,https://www.officedepot.com/a/browse/cooking-utensils/N=5+1176171/,"Carlisle Buffet Pasta Forks, 9 1/2"", Black, Pack Of 12 Forks0.0 out of 5 stars."
1631785857-8933,https://www.officedepot.com/a/browse/cooking-utensils/N=5+1176171/,"Update International Potato Masher, 24"", Silver"
1631785857-9417,https://www.officedepot.com/a/browse/cooking-utensils/N=5+1176171/,"Disco Griddle Pad Holder, 18"", Black0.0 out of 5 stars."
1631785857-9127,https://www.officedepot.com/a/browse/cooking-utensils/N=5+1176171/,"Vollrath No. 6 Disher With Antimicrobial Protection, 5-1/3 Oz, White0.0 out of 5 stars."
1631785857-10294,https://www.officedepot.com/a/browse/cooking-utensils/N=5+1176171/,"Winco Nylon Serving Spoon, Slotted, 12"", Black0.0 out of 5 stars."
1631785857-9388,https://www.officedepot.com/a/browse/cooking-utensils/N=5+1176171/,"San Jamar Saf-T-Grip® Cutting Board, 1/2""H x 15""W x 20""D, Red0.0 out of 5 stars."
1631785857-9486,https://www.officedepot.com/a/browse/cooking-utensils/N=5+1176171/,"Carlisle Solid Spoons, 0.5 Oz, 9"", Black, Pack Of 12 Spoons0.0 out of 5 stars."
1631785857-10129,https://www.officedepot.com/a/browse/cooking-utensils/N=5+1176171/,"Winco Scalloped Tongs, 12"", Red0.0 out of 5 stars."
1631785857-9679,https://www.officedepot.com/a/browse/cooking-utensils/N=5+1176171/,"Winco Bamboo Skewers, 8"", Brown, Pack Of 100 Skewers4.0 out of 5 stars. 1 review"
1631785857-9951,https://www.officedepot.com/a/browse/cooking-utensils/N=5+1176171/,"Mind Reader 4-Piece Bar Utensil Set With Organizer Stand, Silver0.0 out of 5 stars."
1631785857-9386,https://www.officedepot.com/a/browse/cooking-utensils/N=5+1176171/,"Cambro Camwear® Polycarbonate Serving Spoon, 13"", Black0.0 out of 5 stars."
1631785857-9184,https://www.officedepot.com/a/browse/cooking-utensils/N=5+1176171/,"Vollrath Spoodle Perforated Portion Spoon With Antimicrobial Protection, 4 Oz, B...0.0 out of 5 stars."
1631785857-10249,https://www.officedepot.com/a/browse/cooking-utensils/N=5+1176171/,"Vollrath 16"" Tongs With Antimicrobial Protection, Yellow0.0 out of 5 stars."
1631785857-9223,https://www.officedepot.com/a/browse/cooking-utensils/N=5+1176171/,"Adcraft French Whip, 12"", Silver0.0 out of 5 stars."
1631785857-9469,https://www.officedepot.com/a/browse/cooking-utensils/N=5+1176171/,Tablecraft 1/4 Tsp Measuring Spoon0.0 out of 5 stars.
1631785857-9947,https://www.officedepot.com/a/browse/cooking-utensils/N=5+1176171/,"Cambro Camwear Measuring Cups, 8 Oz, Clear, Pack Of 12 Cups0.0 out of 5 stars."
1631785857-9618,https://www.officedepot.com/a/browse/cooking-utensils/N=5+1176171/,"Winco Nylon Serving Ladle, 12"", Black0.0 out of 5 stars."
1631785857-9628,https://www.officedepot.com/a/browse/cooking-utensils/N=5+1176171/,"Vollrath Spoodle Solid Portion Spoon With Antimicrobial Protection, Notch, 4 Oz,...0.0 out of 5 stars."
1631785857-8996,https://www.officedepot.com/a/browse/cooking-utensils/N=5+1176171/,"Zeroll #20 Ice Cream Scoop, 2 Oz, Silver/Gold0.0 out of 5 stars."
1631785857-8844,https://www.officedepot.com/a/browse/cooking-utensils/N=5+1176171/,"Winco Plastic Funnel, 5-1/4"", White"
1631785857-8954,https://www.officedepot.com/a/browse/cooking-utensils/N=5+1176171/,"Carlisle Plastic Serving Spoon, 10"", Clear"
1631785857-10325,https://www.officedepot.com/a/browse/cooking-utensils/N=5+1176171/,"Oster Rochester 3-Stage Handheld Sharpener, Brown0.0 out of 5 stars."
1631785857-9188,https://www.officedepot.com/a/browse/cooking-utensils/N=5+1176171/,Starfrit Spiral Slicer4.8 out of 5 stars. 4 reviews
1631785857-10299,https://www.officedepot.com/a/browse/cooking-utensils/N=5+1176171/,"Vollrath Spoodle Perforated Portion Spoon With Antimicrobial Protection, 3 Oz, B...0.0 out of 5 stars."
1631785857-9734,https://www.officedepot.com/a/browse/cooking-utensils/N=5+1176171/,"Martha Stewart Beech Wood Spoonula, Gray0.0 out of 5 stars."
1631785857-8865,https://www.officedepot.com/a/browse/cooking-utensils/N=5+1176171/,"Starfrit Set of Ceramic Knives - 3"" Length Paring Knife, 5"" Length Utility Knife..."
1631785857-8858,https://www.officedepot.com/a/browse/cooking-utensils/N=5+1176171/,"Winco Metal/Plastic Ice Cream Spade, 9"", Black"
1631785857-9788,https://www.officedepot.com/a/browse/cooking-utensils/N=5+1176171/,"Cambro Camwear® Polycarbonate Tongs, 6"", Beige0.0 out of 5 stars."
1631785857-10078,https://www.officedepot.com/a/browse/cooking-utensils/N=5+1176171/,"Winco Wood Pizza Peel, 12"" x 14"", Brown0.0 out of 5 stars."
1631785857-9149,https://www.officedepot.com/a/browse/cooking-utensils/N=5+1176171/,"American Metalcraft Metal Pan Grabber, Silver0.0 out of 5 stars."
1631785857-9819,https://www.officedepot.com/a/browse/cooking-utensils/N=5+1176171/,"Mind Reader Salad Spinner With Handle, 2.5 Quart, Blue/White0.0 out of 5 stars."
1631785857-9606,https://www.officedepot.com/a/browse/cooking-utensils/N=5+1176171/,"Johnson Rose Stainless-Steel Skewer, 12"", Silver0.0 out of 5 stars."
1631785857-10036,https://www.officedepot.com/a/browse/cooking-utensils/N=5+1176171/,"American Metalcraft Nickel-Plated Loop-Style Card Holder, 2-1/2"", Silver0.0 out of 5 stars."
1631785857-9737,https://www.officedepot.com/a/browse/cooking-utensils/N=5+1176171/,"American Metalcraft Cast-Iron Grill Press, 5"" x 9"", Black5.0 out of 5 stars. 1 review"
1631785857-9711,https://www.officedepot.com/a/browse/cooking-utensils/N=5+1176171/,"Winco Polycarbonate Measuring Cup, 16 Oz, Clear5.0 out of 5 stars. 4 reviews"
1631785857-8906,https://www.officedepot.com/a/browse/cooking-utensils/N=5+1176171/,"Adcraft Aluminum Self-Cleaning Garlic Press, 7-1/2"""
1631785857-9979,https://www.officedepot.com/a/browse/cooking-utensils/N=5+1176171/,"Winco No. 8 Disher, 4 Oz, Gray0.0 out of 5 stars."
1631785857-9200,https://www.officedepot.com/a/browse/cooking-utensils/N=5+1176171/,"Admiral Craft Stainless-Steel Hinged Spring Tongs, 9 1/2"", Silver5.0 out of 5 stars. 1 review"
1631785857-9808,https://www.officedepot.com/a/browse/cooking-utensils/N=5+1176171/,"Vollrath Half-Size Super Pan 3 Wire Grate, Gray0.0 out of 5 stars."
1631785857-9187,https://www.officedepot.com/a/browse/cooking-utensils/N=5+1176171/,"Sparta Nylon-Bristle Brushes, 1""W, Brown, Pack Of 120.0 out of 5 stars."
1631785857-9275,https://www.officedepot.com/a/browse/cooking-utensils/N=5+1176171/,"Zeroll #60 Stainless-Steel Disher, 0.54 Oz, Silver/Pink0.0 out of 5 stars."
1631785857-8852,https://www.officedepot.com/a/browse/cooking-utensils/N=5+1176171/,"Admiral Craft Stainless-Steel Tongs, 16"""
1631785857-9006,https://www.officedepot.com/a/browse/cooking-utensils/N=5+1176171/,"Martha Stewart Stainless Steel Kitchen Scoop, Silver0.0 out of 5 stars."
1631785857-9358,https://www.officedepot.com/a/browse/cooking-utensils/N=5+1176171/,"Victorinox Plastic Dough Scraper, 6"", White0.0 out of 5 stars."
1631785857-9472,https://www.officedepot.com/a/browse/cooking-utensils/N=5+1176171/,"American Metalcraft Solid Serving Spoon, 13"", Silver0.0 out of 5 stars."
1631785857-10341,https://www.officedepot.com/a/browse/cooking-utensils/N=5+1176171/,"Winco Polyethylene Cutting Board, 1/2""H x 15""W x 20""D, Blue0.0 out of 5 stars."
1631785857-9114,https://www.officedepot.com/a/browse/cooking-utensils/N=5+1176171/,"Winco Rubber Spatula, 10"", Red0.0 out of 5 stars."
1631785857-10043,https://www.officedepot.com/a/browse/cooking-utensils/N=5+1176171/,"Winco Polyethylene Cutting Board, 3/4""H x 18""W x 24""D, White0.0 out of 5 stars."
1631785857-9904,https://www.officedepot.com/a/browse/cooking-utensils/N=5+1176171/,"Vollrath French Whip, 12"", Silver0.0 out of 5 stars."
1631785857-9214,https://www.officedepot.com/a/browse/cooking-utensils/N=5+1176171/,"Measure Miser Solid Short-Handle Measuring Spoons, 2 Oz, Beige, Pack Of 120.0 out of 5 stars."
1631785857-8888,https://www.officedepot.com/a/browse/cooking-utensils/N=5+1176171/,Starfrit Maple Cutting Board - For Cutting
1631785857-9676,https://www.officedepot.com/a/browse/cooking-utensils/N=5+1176171/,"American Metalcraft Stainless-Steel Scraper, 4"", Brown0.0 out of 5 stars."
1631785857-9173,https://www.officedepot.com/a/browse/cooking-utensils/N=5+1176171/,"Tablecraft Serrated Vegetable Peeler, Silver0.0 out of 5 stars."
1631785857-10004,https://www.officedepot.com/a/browse/cooking-utensils/N=5+1176171/,"Zeroll #8 Stainless-Steel Disher, 4 Oz, Silver/Gray0.0 out of 5 stars."
1631785857-9717,https://www.officedepot.com/a/browse/cooking-utensils/N=5+1176171/,"Vollrath Measuring Cup, 64 Oz, Silver0.0 out of 5 stars."
1631785857-9264,https://www.officedepot.com/a/browse/cooking-utensils/N=5+1176171/,"Crestware Rubber Spatula, 9-1/2"", White0.0 out of 5 stars."
1631785857-8862,https://www.officedepot.com/a/browse/cooking-utensils/N=5+1176171/,"Starfrit Antibacterial Cutting Board (16"" x 10"") - For Cutting"
1631785857-9502,https://www.officedepot.com/a/browse/cooking-utensils/N=5+1176171/,"SO-MINE Glasses On The Go Keychain Mobile Reading Glasses, Assorted Colors4.1 out of 5 stars. 49 reviews"
1631785857-9781,https://www.officedepot.com/a/browse/cooking-utensils/N=5+1176171/,"American Metalcraft Stainless-Steel Turner, 3"" x 5"", Brown3.0 out of 5 stars. 1 review"
1631785857-9891,https://www.officedepot.com/a/browse/cooking-utensils/N=5+1176171/,"Winco Stainless-Steel Ladle, 4 Oz, Green0.0 out of 5 stars."
1631785857-8899,https://www.officedepot.com/a/browse/cooking-utensils/N=5+1176171/,"Martha Stewart Stainless Steel Slotted Spatula, Gray"
1631785857-9218,https://www.officedepot.com/a/browse/cooking-utensils/N=5+1176171/,"WNA Caterline Plastic Tongs, 9"", Black, Pack Of 480.0 out of 5 stars."
1631785857-9012,https://www.officedepot.com/a/browse/cooking-utensils/N=5+1176171/,"Winco Plastic Funnel, 5-1/4"", White0.0 out of 5 stars."
1631785857-9140,https://www.officedepot.com/a/browse/cooking-utensils/N=5+1176171/,"Winco Perforated Portion Spoon, 3 Oz, Beige0.0 out of 5 stars."
1631785857-9279,https://www.officedepot.com/a/browse/cooking-utensils/N=5+1176171/,"Victorinox Steel/Wood Turner, 4"" x 5"", Brown0.0 out of 5 stars."
1631785857-9199,https://www.officedepot.com/a/browse/cooking-utensils/N=5+1176171/,"Vollrath Grill Tender Griddle Scraper, Black0.0 out of 5 stars."
1631785857-9850,https://www.officedepot.com/a/browse/cooking-utensils/N=5+1176171/,"Zeroll #30 Ice Cream Scoop, 1 Oz, Silver/Red0.0 out of 5 stars."
1631785857-9886,https://www.officedepot.com/a/browse/cooking-utensils/N=5+1176171/,"Vollrath Disher, No. 16, 2 Oz, Silver0.0 out of 5 stars."
1631785857-8871,https://www.officedepot.com/a/browse/cooking-utensils/N=5+1176171/,"Winco Stainless-Steel Rotary Sifter, 8 Cup, Silver"
1631785857-10034,https://www.officedepot.com/a/browse/cooking-utensils/N=5+1176171/,"Carlisle Solid High-Heat Serving Spoons, 11""L, Black, Pack Of 120.0 out of 5 stars."
1631785857-10314,https://www.officedepot.com/a/browse/cooking-utensils/N=5+1176171/,Victorinox® Manual Knife Sharpener0.0 out of 5 stars.
1631785857-9767,https://www.officedepot.com/a/browse/cooking-utensils/N=5+1176171/,"Vollrath No. 20 Disher With Antimicrobial Protection, 1-5/8 Oz, Yellow0.0 out of 5 stars."
1631785857-9141,https://www.officedepot.com/a/browse/cooking-utensils/N=5+1176171/,"American Metalcraft Swirl-Base Number Stand, 1-1/2"", Black0.0 out of 5 stars."
1631785857-10210,https://www.officedepot.com/a/browse/cooking-utensils/N=5+1176171/,"Crestware Stainless-Steel Basting/Serving Spoon, 15""0.0 out of 5 stars."
1631785857-8863,https://www.officedepot.com/a/browse/cooking-utensils/N=5+1176171/,"Winco Round Metal Skimmer, 6"", Silver"
1631785857-9595,https://www.officedepot.com/a/browse/cooking-utensils/N=5+1176171/,"Winco Stainless-Steel Ladle, 2 Oz, Red0.0 out of 5 stars."
1631785857-8913,https://www.officedepot.com/a/browse/cooking-utensils/N=5+1176171/,"Martha Stewart Stainless Steel Skimmer, Gray"
1631785857-9030,https://www.officedepot.com/a/browse/cooking-utensils/N=5+1176171/,"Starfrit Antibacterial Cutting Board (16"" x 10"") - For Cutting4.5 out of 5 stars. 2 reviews"
1631785857-8928,https://www.officedepot.com/a/browse/cooking-utensils/N=5+1176171/,"Martha Stewart Stainless Steel Balloon Whisk, 9”, Silver"
1631785857-10115,https://www.officedepot.com/a/browse/cooking-utensils/N=5+1176171/,"Carlisle Sparta Dual Broiler Brush, 48"" x 7-3/4"", Black0.0 out of 5 stars."
1631785857-9890,https://www.officedepot.com/a/browse/cooking-utensils/N=5+1176171/,"Winco Egg Slicer, Silver0.0 out of 5 stars."
1631785857-9703,https://www.officedepot.com/a/browse/cooking-utensils/N=5+1176171/,"Winco Stainless-Steel Potato Ricer, Silver0.0 out of 5 stars."
1631785857-9271,https://www.officedepot.com/a/browse/cooking-utensils/N=5+1176171/,"Winco Liquid Measuring Cup, 1 Qt, Clear0.0 out of 5 stars."
1631785857-9542,https://www.officedepot.com/a/browse/cooking-utensils/N=5+1176171/,"Victorinox High-Heat Square Turner, 6"" x 3"", Silver0.0 out of 5 stars."
1631785857-9269,https://www.officedepot.com/a/browse/cooking-utensils/N=5+1176171/,"Measure Miser Solid Long-Handle Measuring Spoons, 4 Oz, Beige, Pack Of 120.0 out of 5 stars."
1631785857-9403,https://www.officedepot.com/a/browse/cooking-utensils/N=5+1176171/,"Sparta Boar-Bristle Brushes, 2""W, Brown, Pack Of 120.0 out of 5 stars."
1631785857-9098,https://www.officedepot.com/a/browse/cooking-utensils/N=5+1176171/,Starfrit Kitchen Shear - Stainless Steel4.8 out of 5 stars. 11 reviews
1631785857-10063,https://www.officedepot.com/a/browse/cooking-utensils/N=5+1176171/,"Teknor Apex Rubber Cutting Board, 18"" x 24"", Brown0.0 out of 5 stars."
1631785857-9861,https://www.officedepot.com/a/browse/cooking-utensils/N=5+1176171/,"Vollrath Spoodle Perforated Portion Spoon With Antimicrobial Protection, 8 Oz, B...0.0 out of 5 stars."
1631785857-9234,https://www.officedepot.com/a/browse/cooking-utensils/N=5+1176171/,"Winco Perforated Serving Spoon, 13"", Black0.0 out of 5 stars."
1631785857-8955,https://www.officedepot.com/a/browse/cooking-utensils/N=5+1176171/,"Vollrath Slotted Serving Spoon, 13"", Silver"
1631785857-9751,https://www.officedepot.com/a/browse/cooking-utensils/N=5+1176171/,"Update International 4-Piece Measuring Cup Set, Silver4.5 out of 5 stars. 4 reviews"
1631785857-10198,https://www.officedepot.com/a/browse/cooking-utensils/N=5+1176171/,"San Jamar Saf-T-Grip® Cutting Board, 1/2""H x 15""W x 20""D, Green0.0 out of 5 stars."
1631785857-9774,https://www.officedepot.com/a/browse/cooking-utensils/N=5+1176171/,"Vollrath Avocado Spoon, Silver0.0 out of 5 stars."
1631785857-8841,https://www.officedepot.com/a/browse/cooking-utensils/N=5+1176171/,"American Metalcraft Stainless-Steel Ice Scoop, 1/2 Cup, Silver"
1631785857-10169,https://www.officedepot.com/a/browse/cooking-utensils/N=5+1176171/,"Winco Slotted Serving Spoon, 13"", Black/Silver5.0 out of 5 stars. 2 reviews"
1631785857-10250,https://www.officedepot.com/a/browse/cooking-utensils/N=5+1176171/,"American Metalcraft Stainless-Steel Turner, 3"" x 8"", Brown0.0 out of 5 stars."
1631785857-9257,https://www.officedepot.com/a/browse/cooking-utensils/N=5+1176171/,"Winco Aluminum Apple Divider/Corer, Silver5.0 out of 5 stars. 1 review"
1631785857-10044,https://www.officedepot.com/a/browse/cooking-utensils/N=5+1176171/,"Bamboo Food Skewer Picks, 8"", Box Of 2,4000.0 out of 5 stars."
1631785857-9555,https://www.officedepot.com/a/browse/cooking-utensils/N=5+1176171/,"Zeroll #12 Ice Cream Scoop, 3 Oz, Silver/Blue0.0 out of 5 stars."
1631785857-9052,https://www.officedepot.com/a/browse/cooking-utensils/N=5+1176171/,"American Metalcraft Steel/Wood Grill Brush, 13-1/2"", Brown0.0 out of 5 stars."
1631785857-8912,https://www.officedepot.com/a/browse/cooking-utensils/N=5+1176171/,"Winco Metal/Wood Fish Spatula, 6-1/2"", Silver"
1631785857-9823,https://www.officedepot.com/a/browse/cooking-utensils/N=5+1176171/,"Cambro Lugano® Flay-Grip Tongs, 6"", Clear0.0 out of 5 stars."
1631785857-9300,https://www.officedepot.com/a/browse/cooking-utensils/N=5+1176171/,"Winco Stainless-Steel Ladle, 2 Oz, Silver0.0 out of 5 stars."
1631785857-10185,https://www.officedepot.com/a/browse/cooking-utensils/N=5+1176171/,"American Metalcraft Pizza Oven Brush, 60"", Silver0.0 out of 5 stars."
1631785857-9629,https://www.officedepot.com/a/browse/cooking-utensils/N=5+1176171/,"Vollrath Spoodle Solid Portion Spoon With Antimicrobial Protection, 8 Oz, Black0.0 out of 5 stars."
1631785857-9858,https://www.officedepot.com/a/browse/cooking-utensils/N=5+1176171/,"Carlisle Carly Salad Tongs, 9"" x 1 3/4"", Black0.0 out of 5 stars."
1631785857-9226,https://www.officedepot.com/a/browse/cooking-utensils/N=5+1176171/,"American Metalcraft Waiter's Corkscrew, Silver0.0 out of 5 stars."
1631785857-9452,https://www.officedepot.com/a/browse/cooking-utensils/N=5+1176171/,"Vollrath Aluminum Scoop, 40 Oz, Silver0.0 out of 5 stars."
1631785857-10281,https://www.officedepot.com/a/browse/cooking-utensils/N=5+1176171/,"American Metalcraft Polished Stainless-Steel Bar Spoon, 10""0.0 out of 5 stars."
1631785857-10066,https://www.officedepot.com/a/browse/cooking-utensils/N=5+1176171/,"Vollrath Spoodle Solid Portion Spoon With Antimicrobial Protection, 5 Oz, Black0.0 out of 5 stars."
1631785857-10088,https://www.officedepot.com/a/browse/cooking-utensils/N=5+1176171/,"Zeroll #12 Stainless-Steel Disher, 2.67 Oz, Silver/Green0.0 out of 5 stars."
1631785857-9237,https://www.officedepot.com/a/browse/cooking-utensils/N=5+1176171/,"Vollrath 6"" Pom Tongs, Silver0.0 out of 5 stars."
1631785857-9845,https://www.officedepot.com/a/browse/cooking-utensils/N=5+1176171/,"Carlisle Solid Serving Spoon, 8"", White0.0 out of 5 stars."
1631785857-10272,https://www.officedepot.com/a/browse/cooking-utensils/N=5+1176171/,"Winco Plastic Cutting Board, 1/2""H x 12""W x 18""D, White0.0 out of 5 stars."
1631785857-8934,https://www.officedepot.com/a/browse/cooking-utensils/N=5+1176171/,"American Metalcraft Aluminum Scoop, 5 Oz, Silver"
1631785857-9937,https://www.officedepot.com/a/browse/cooking-utensils/N=5+1176171/,"Winco Aluminum Ice And Food Scoop, 85 Oz, Silver0.0 out of 5 stars."
1631785857-10256,https://www.officedepot.com/a/browse/cooking-utensils/N=5+1176171/,"Winco Stainless Steel Tea Infuser Ball With Chain, 2""0.0 out of 5 stars."
1631785857-10051,https://www.officedepot.com/a/browse/cooking-utensils/N=5+1176171/,"Winco 9"" Heat-Resistant Tongs, Black0.0 out of 5 stars."
1631785857-9552,https://www.officedepot.com/a/browse/cooking-utensils/N=5+1176171/,"Martha Stewart Nylon Turner, Gray0.0 out of 5 stars."
1631785857-10070,https://www.officedepot.com/a/browse/cooking-utensils/N=5+1176171/,"American Metalcraft High-Heat Rubber Spatula, 16"", Silver0.0 out of 5 stars."
1631785857-9083,https://www.officedepot.com/a/browse/cooking-utensils/N=5+1176171/,"Crestware Vegetable Peeler, Silver2.0 out of 5 stars. 1 review"
1631785857-9232,https://www.officedepot.com/a/browse/cooking-utensils/N=5+1176171/,"Nemco Cutting Wire For 55350A Cheese Block Cutter, Silver, Pack Of 3 Pieces0.0 out of 5 stars."
1631785857-9102,https://www.officedepot.com/a/browse/cooking-utensils/N=5+1176171/,"American Metalcraft Aluminum Scoop, 5 Oz, Silver0.0 out of 5 stars."
1631785857-9324,https://www.officedepot.com/a/browse/cooking-utensils/N=5+1176171/,"Admiral Craft Stainless-Steel Hinged Spring Tongs, 12"", Silver4.0 out of 5 stars. 1 review"
1631785857-10298,https://www.officedepot.com/a/browse/cooking-utensils/N=5+1176171/,"Winco Silicone Spatula, 16"", White0.0 out of 5 stars."
1631785857-9582,https://www.officedepot.com/a/browse/cooking-utensils/N=5+1176171/,"Winco Stainless-Steel Fish Turner, 6-3/4"", Black0.0 out of 5 stars."
1631785857-8962,https://www.officedepot.com/a/browse/cooking-utensils/N=5+1176171/,"Winco Wood Spoon, 12"", Brown0.0 out of 5 stars."
1631785857-9763,https://www.officedepot.com/a/browse/cooking-utensils/N=5+1176171/,"Carlisle Portion Cup, 16 Oz, Brown0.0 out of 5 stars."
1631785857-9569,https://www.officedepot.com/a/browse/cooking-utensils/N=5+1176171/,"Tucker Safety BurnGuard Puppet Oven Mitt, 15"", Blue0.0 out of 5 stars."
1631785857-9468,https://www.officedepot.com/a/browse/cooking-utensils/N=5+1176171/,"Vollrath Disher, No. 10, 3-1/8 Oz, Silver0.0 out of 5 stars."
1631785857-10059,https://www.officedepot.com/a/browse/cooking-utensils/N=5+1176171/,"Vollrath 9"" Tongs With Antimicrobial Protection, Green0.0 out of 5 stars."
1631785857-9705,https://www.officedepot.com/a/browse/cooking-utensils/N=5+1176171/,"Update International Meat Tenderizer, 10"", Silver0.0 out of 5 stars."
1631785857-9432,https://www.officedepot.com/a/browse/cooking-utensils/N=5+1176171/,"American Metalcraft Curved Waiter's Corkscrew, Silver0.0 out of 5 stars."
1631785857-9580,https://www.officedepot.com/a/browse/cooking-utensils/N=5+1176171/,"Cambro Camwear Scoops, 6 Oz, Clear, Pack Of 12 Scoops0.0 out of 5 stars."
1631785857-9742,https://www.officedepot.com/a/browse/cooking-utensils/N=5+1176171/,"Carlisle Portion Control Ladle, 1 Oz, Yellow0.0 out of 5 stars."
1631785857-9196,https://www.officedepot.com/a/browse/cooking-utensils/N=5+1176171/,"American Metalcraft Stainless-Steel Harp-Style Card Holder, 1-1/2"", Silver0.0 out of 5 stars."
1631785857-8929,https://www.officedepot.com/a/browse/cooking-utensils/N=5+1176171/,"CDN 60-Minute Mechanical Cooking Timer, 2 1/2"", White"
1631785857-9835,https://www.officedepot.com/a/browse/cooking-utensils/N=5+1176171/,"Winco Bamboo Skewers, 6"", Brown, Pack Of 100 Skewers0.0 out of 5 stars."
1631785857-9996,https://www.officedepot.com/a/browse/cooking-utensils/N=5+1176171/,"American Metalcraft Stainless Steel Scraper, 3"" Blade0.0 out of 5 stars."
1631785857-8950,https://www.officedepot.com/a/browse/cooking-utensils/N=5+1176171/,"Dura-Kool™ Tongs, 12"", Yellow, Pack Of 12"
1631785857-9638,https://www.officedepot.com/a/browse/cooking-utensils/N=5+1176171/,"American Metalcraft Pom Tong, 6-1/2"", Silver0.0 out of 5 stars."
1631785857-8880,https://www.officedepot.com/a/browse/cooking-utensils/N=5+1176171/,"Martha Stewart Stainless Steel Long Grater, Silver"
1631785857-9186,https://www.officedepot.com/a/browse/cooking-utensils/N=5+1176171/,"Alegacy Stainless-Steel Basting/Serving Spoon, 13""4.5 out of 5 stars. 2 reviews"
1631785857-8949,https://www.officedepot.com/a/browse/cooking-utensils/N=5+1176171/,"Winco Plastic Cutting Board, 1/2""H x 15""W x 20""D, White"
1631785857-10288,https://www.officedepot.com/a/browse/cooking-utensils/N=5+1176171/,"Vollrath 6 Oz Ladle, 14"", Silver0.0 out of 5 stars."
1631785857-10187,https://www.officedepot.com/a/browse/cooking-utensils/N=5+1176171/,"American Metalcraft Stainless-Steel Tong, 12"", Silver0.0 out of 5 stars."
1631785857-9616,https://www.officedepot.com/a/browse/cooking-utensils/N=5+1176171/,"Winco Check Presenter, 6"" x 11 1/2"", Black0.0 out of 5 stars."
1631785857-9337,https://www.officedepot.com/a/browse/cooking-utensils/N=5+1176171/,"Starfrit® Snap Fit Measuring Cups, Set Of 50.0 out of 5 stars."
1631785857-9715,https://www.officedepot.com/a/browse/cooking-utensils/N=5+1176171/,"Victorinox Slotted Fish Turner, 3"" x 6"", Silver0.0 out of 5 stars."
