web-scraper-order,web-scraper-start-url,nnn
1631785857-9796,https://www.officedepot.com/a/browse/cooking-utensils/N=5+1176171/,"Carlisle Carly® Acetate Salad Tongs, 9 1/16"", Black, Pack Of 12 Tongs0.0 out of 5 stars."
1631785857-9843,https://www.officedepot.com/a/browse/cooking-utensils/N=5+1176171/,"American Metalcraft Aluminum Pizza Screen, 20"", Silver0.0 out of 5 stars."
1631785857-9121,https://www.officedepot.com/a/browse/cooking-utensils/N=5+1176171/,"Martha Stewart Silicone Mini Spatula, Gray0.0 out of 5 stars."
1631785857-9527,https://www.officedepot.com/a/browse/cooking-utensils/N=5+1176171/,"Vollrath Waiter's Corkscrew, Black0.0 out of 5 stars."
1631785857-9721,https://www.officedepot.com/a/browse/cooking-utensils/N=5+1176171/,"Dura-Kool™ Tongs, 12"", Red, Pack Of 120.0 out of 5 stars."
1631785857-9830,https://www.officedepot.com/a/browse/cooking-utensils/N=5+1176171/,"Disco Griddle Pad Holder, 5-1/2"" x 4-1/2"", Blue0.0 out of 5 stars."
1631785857-8937,https://www.officedepot.com/a/browse/cooking-utensils/N=5+1176171/,"Winco Stainless-Steel Egg Ring, 4"", Silver"
1631785857-9863,https://www.officedepot.com/a/browse/cooking-utensils/N=5+1176171/,"Winco Rolling Pin, 18"", Silver0.0 out of 5 stars."
1631785857-9189,https://www.officedepot.com/a/browse/cooking-utensils/N=5+1176171/,"Cambro High-Heat Cover For 2 - 4 Qt Measuring Cups, Amber0.0 out of 5 stars."
1631785857-9933,https://www.officedepot.com/a/browse/cooking-utensils/N=5+1176171/,"Starfrit Tritan Blade Pizza Wheel - Cutting - Dishwasher Safe - Plastic, Tritan0.0 out of 5 stars."
1631785857-9071,https://www.officedepot.com/a/browse/cooking-utensils/N=5+1176171/,"Winco Polyethylene Cutting Board, 1/2""H x 12""W x 18""D, Red0.0 out of 5 stars."
1631785857-9079,https://www.officedepot.com/a/browse/cooking-utensils/N=5+1176171/,"Winco Metal/Wood Turner, 3"" x 9-1/2"", Brown0.0 out of 5 stars."
1631785857-9841,https://www.officedepot.com/a/browse/cooking-utensils/N=5+1176171/,"Tablecraft Right-Hand French Fry Scoop, Silver0.0 out of 5 stars."
1631785857-8838,https://www.officedepot.com/a/browse/cooking-utensils/N=5+1176171/,"Martha Stewart Stainless Steel Kitchen Scoop, Silver"
1631785857-9346,https://www.officedepot.com/a/browse/cooking-utensils/N=5+1176171/,"Winco Chrome-Plated Wire Grate Cooling Rack, Half-Size, Silver5.0 out of 5 stars. 1 review"
1631785857-9401,https://www.officedepot.com/a/browse/cooking-utensils/N=5+1176171/,"Measure Miser Perforated Long-Handle Measuring Spoons, 6 Oz, Beige, Pack Of 120.0 out of 5 stars."
1631785857-9884,https://www.officedepot.com/a/browse/cooking-utensils/N=5+1176171/,"Vollrath Oval Spoodle Solid Portion Spoon With Antimicrobial Protection, 2 Oz, B...0.0 out of 5 stars."
1631785857-9976,https://www.officedepot.com/a/browse/cooking-utensils/N=5+1176171/,"Vollrath Measuring Spoon Set, Silver0.0 out of 5 stars."
1631785857-9712,https://www.officedepot.com/a/browse/cooking-utensils/N=5+1176171/,"Cambro Camwear Measuring Cups, 16 Oz, Allergen-Free Purple, Pack Of 12 Cups0.0 out of 5 stars."
1631785857-9577,https://www.officedepot.com/a/browse/cooking-utensils/N=5+1176171/,"Winco Solid Portion Spoon, 3 Oz, Beige0.0 out of 5 stars."
1631785857-10320,https://www.officedepot.com/a/browse/cooking-utensils/N=5+1176171/,"Amscan Plastic Slotted Serving Spoons, 1""H x 2""W x 7""D, Clear, Pack Of 7 Spoons0.0 out of 5 stars."
1631785857-9473,https://www.officedepot.com/a/browse/cooking-utensils/N=5+1176171/,"Vollrath 6"" Heavy-Duty Tongs With Antimicrobial Protection, Silver0.0 out of 5 stars."
1631785857-9778,https://www.officedepot.com/a/browse/cooking-utensils/N=5+1176171/,"Carlisle Carly® Acetate Salad Tongs, 6 1/4"", Black, Pack Of 12 Tongs0.0 out of 5 stars."
1631785857-9156,https://www.officedepot.com/a/browse/cooking-utensils/N=5+1176171/,"Winco No. 40 Disher, 0.88 Oz, Orchid0.0 out of 5 stars."
1631785857-10149,https://www.officedepot.com/a/browse/cooking-utensils/N=5+1176171/,"American Metalcraft No. 6 Disher, 5 Oz, White0.0 out of 5 stars."
1631785857-9410,https://www.officedepot.com/a/browse/cooking-utensils/N=5+1176171/,"Tablecraft Stainless-Steel Pasta Server, 13"", Silver0.0 out of 5 stars."
1631785857-8917,https://www.officedepot.com/a/browse/cooking-utensils/N=5+1176171/,"Martha Stewart Fish Turner, Gray"
1631785857-9581,https://www.officedepot.com/a/browse/cooking-utensils/N=5+1176171/,"Zeroll #100 Stainless-Steel Disher, 0.32 Oz, Silver/Orange0.0 out of 5 stars."
1631785857-10334,https://www.officedepot.com/a/browse/cooking-utensils/N=5+1176171/,"American Metalcraft Stainless-Steel Tong, 16"", Silver0.0 out of 5 stars."
1631785857-9954,https://www.officedepot.com/a/browse/cooking-utensils/N=5+1176171/,"Pick Frills, 4"", Box Of 1,0000.0 out of 5 stars."
1631785857-9603,https://www.officedepot.com/a/browse/cooking-utensils/N=5+1176171/,"Winco Handheld Strainer, 8"", Silver5.0 out of 5 stars. 2 reviews"
1631785857-9095,https://www.officedepot.com/a/browse/cooking-utensils/N=5+1176171/,"Vollrath Heavy-Duty Slotted Basting Spoon, 15-1/2"", Silver0.0 out of 5 stars."
1631785857-9834,https://www.officedepot.com/a/browse/cooking-utensils/N=5+1176171/,"Bar Maid Large Scoop Holder, White0.0 out of 5 stars."
1631785857-9351,https://www.officedepot.com/a/browse/cooking-utensils/N=5+1176171/,"American Metalcraft Aluminum Funnel, 2 Qt, Silver0.0 out of 5 stars."
1631785857-9484,https://www.officedepot.com/a/browse/cooking-utensils/N=5+1176171/,"Winco Pizza Pan Stand, Silver0.0 out of 5 stars."
1631785857-10228,https://www.officedepot.com/a/browse/cooking-utensils/N=5+1176171/,"Winco Polyethylene Cutting Board, 1/2""H x 18""W x 24""D, Blue0.0 out of 5 stars."
1631785857-10268,https://www.officedepot.com/a/browse/cooking-utensils/N=5+1176171/,"Winco Stainless-Steel Rotary Cheese Grater, Silver0.0 out of 5 stars."
1631785857-8920,https://www.officedepot.com/a/browse/cooking-utensils/N=5+1176171/,"Winco Stainless-Steel Colander, 10"", Silver"
1631785857-9878,https://www.officedepot.com/a/browse/cooking-utensils/N=5+1176171/,"Zyliss Rotary Cheese Grater, Silver0.0 out of 5 stars."
1631785857-9665,https://www.officedepot.com/a/browse/cooking-utensils/N=5+1176171/,"Vollrath No. 4 Disher With Antimicrobial Protection, 4 Oz, Gray0.0 out of 5 stars."
1631785857-10014,https://www.officedepot.com/a/browse/cooking-utensils/N=5+1176171/,"Vollrath Piano Whip, 10"", Silver0.0 out of 5 stars."
1631785857-8885,https://www.officedepot.com/a/browse/cooking-utensils/N=5+1176171/,"Winco Stainless-Steel Serving Tongs, 9"", Silver"
1631785857-9454,https://www.officedepot.com/a/browse/cooking-utensils/N=5+1176171/,"American Metalcraft Rectangular Aluminum Pizza Screen, 16"" x 24"", Silver0.0 out of 5 stars."
1631785857-9541,https://www.officedepot.com/a/browse/cooking-utensils/N=5+1176171/,"American Metalcraft Aluminum Scoop, 84 Oz, Silver0.0 out of 5 stars."
1631785857-9317,https://www.officedepot.com/a/browse/cooking-utensils/N=5+1176171/,"Vollrath Disher, No. 30, 1-1/4 Oz, Silver0.0 out of 5 stars."
1631785857-10200,https://www.officedepot.com/a/browse/cooking-utensils/N=5+1176171/,"Amscan Plastic Pie Cutters, 1""H x 2""W x 11""D, Clear, Pack Of 15 Pie Cutters0.0 out of 5 stars."
1631785857-10234,https://www.officedepot.com/a/browse/cooking-utensils/N=5+1176171/,"Starfrit Herb Stripper, Green0.0 out of 5 stars."
1631785857-9405,https://www.officedepot.com/a/browse/cooking-utensils/N=5+1176171/,"Martha Stewart Stainless Steel Pasta Server, Gray0.0 out of 5 stars."
1631785857-9075,https://www.officedepot.com/a/browse/cooking-utensils/N=5+1176171/,"American Metalcraft Stainless-Steel Dough Cutter, 4-1/2"", Brown"
1631785857-9366,https://www.officedepot.com/a/browse/cooking-utensils/N=5+1176171/,"San Jamar Saf-T-Grip® Cutting Board, 1/2""H x 15""W x 20""D, Yellow0.0 out of 5 stars."
1631785857-9584,https://www.officedepot.com/a/browse/cooking-utensils/N=5+1176171/,"Amscan Plastic Salad Tongs, 1""H x 6""W x 12""D, Clear, Pack Of 6 Salad Tongs0.0 out of 5 stars."
1631785857-9231,https://www.officedepot.com/a/browse/cooking-utensils/N=5+1176171/,"Vollrath Slotted Serving Spoon, 15"", Silver0.0 out of 5 stars."
1631785857-10144,https://www.officedepot.com/a/browse/cooking-utensils/N=5+1176171/,"Taylor Precision Bi-Thermal Pocket Thermometer, 0 - 200°F, Silver0.0 out of 5 stars."
1631785857-9319,https://www.officedepot.com/a/browse/cooking-utensils/N=5+1176171/,"Good Cook Mixing Spoons, Assorted Sizes, Red, Pack Of 3 Spoons5.0 out of 5 stars. 1 review"
1631785857-9347,https://www.officedepot.com/a/browse/cooking-utensils/N=5+1176171/,"Starfrit 9"" Silicone Tongs - 1 Piece(s) - 1 x Grill Tong - Silicone, Stainless S...5.0 out of 5 stars. 5 reviews"
1631785857-9846,https://www.officedepot.com/a/browse/cooking-utensils/N=5+1176171/,"Martha Stewart Stainless Steel Masher, Gray0.0 out of 5 stars."
1631785857-9923,https://www.officedepot.com/a/browse/cooking-utensils/N=5+1176171/,"Vollrath Disher, No. 100, 3/8 Oz, Silver0.0 out of 5 stars."
1631785857-9657,https://www.officedepot.com/a/browse/cooking-utensils/N=5+1176171/,"Winco Polyethylene Cutting Board, 1/2""H x 15""W x 20""D, Yellow5.0 out of 5 stars. 1 review"
1631785857-10114,https://www.officedepot.com/a/browse/cooking-utensils/N=5+1176171/,"Winco Scalloped Tongs, 9"", Red0.0 out of 5 stars."
1631785857-9842,https://www.officedepot.com/a/browse/cooking-utensils/N=5+1176171/,"Winco Solid Portion Spoon, 2 Oz, Red0.0 out of 5 stars."
1631785857-9648,https://www.officedepot.com/a/browse/cooking-utensils/N=5+1176171/,"Martha Stewart Nylon Slotted Spoon, Gray0.0 out of 5 stars."
1631785857-9382,https://www.officedepot.com/a/browse/cooking-utensils/N=5+1176171/,"Winco Stainless-Steel Ladle, 0.5 Oz, Silver0.0 out of 5 stars."
1631785857-8846,https://www.officedepot.com/a/browse/cooking-utensils/N=5+1176171/,"Mind Reader Rice And Grain Washer, White"
1631785857-8848,https://www.officedepot.com/a/browse/cooking-utensils/N=5+1176171/,"Martha Stewart Stainless Steel 4-Sided Box Grater, Silver"
1631785857-9724,https://www.officedepot.com/a/browse/cooking-utensils/N=5+1176171/,"Victorinox New Haven Oyster Knife, 2-3/4"", Silver0.0 out of 5 stars."
1631785857-10161,https://www.officedepot.com/a/browse/cooking-utensils/N=5+1176171/,"Martha Stewart Stainless Steel Slotted Turner, Gray0.0 out of 5 stars."
1631785857-9875,https://www.officedepot.com/a/browse/cooking-utensils/N=5+1176171/,"American Metalcraft Aluminum Pizza Peel, 16"" x 18"", Silver0.0 out of 5 stars."
1631785857-9131,https://www.officedepot.com/a/browse/cooking-utensils/N=5+1176171/,"Vollrath Grip 'N Serv Basting Spoon, 14"", Black0.0 out of 5 stars."
1631785857-10233,https://www.officedepot.com/a/browse/cooking-utensils/N=5+1176171/,"American Metalcraft 2-Piece Ladle, 1 Oz, Silver0.0 out of 5 stars."
1631785857-9499,https://www.officedepot.com/a/browse/cooking-utensils/N=5+1176171/,"American Metalcraft Stainless-Steel Loop-Style Card Holder, 1-5/8"", Silver0.0 out of 5 stars."
1631785857-10323,https://www.officedepot.com/a/browse/cooking-utensils/N=5+1176171/,"Winco Fryer Brush, Black0.0 out of 5 stars."
1631785857-10027,https://www.officedepot.com/a/browse/cooking-utensils/N=5+1176171/,"Cambro High-Heat Measuring Cup, 128 Oz, Amber0.0 out of 5 stars."
1631785857-8924,https://www.officedepot.com/a/browse/cooking-utensils/N=5+1176171/,"American Metalcraft Pizza Cutter, 4"", Black/Silver"
1631785857-9458,https://www.officedepot.com/a/browse/cooking-utensils/N=5+1176171/,"Winco Plastic Y Peeler, 6-1/2"", Black0.0 out of 5 stars."
1631785857-9872,https://www.officedepot.com/a/browse/cooking-utensils/N=5+1176171/,"Vollrath Measuring Spoon, 2 Tbs0.0 out of 5 stars."
1631785857-10158,https://www.officedepot.com/a/browse/cooking-utensils/N=5+1176171/,"Winco Pastry Tongs, 8-3/4"", Silver0.0 out of 5 stars."
1631785857-9438,https://www.officedepot.com/a/browse/cooking-utensils/N=5+1176171/,"Winco Pastry Brush, 1 1/2"", Brown5.0 out of 5 stars. 1 review"
1631785857-9945,https://www.officedepot.com/a/browse/cooking-utensils/N=5+1176171/,"Vollrath 16"" Tongs With Antimicrobial Protection, Green0.0 out of 5 stars."
1631785857-9973,https://www.officedepot.com/a/browse/cooking-utensils/N=5+1176171/,"American Metalcraft Stainless-Steel Turner, 3"" x 6"", Brown0.0 out of 5 stars."
1631785857-10005,https://www.officedepot.com/a/browse/cooking-utensils/N=5+1176171/,"Vollrath SoftSpoon Rubber Spatula, 9-1/2"", White0.0 out of 5 stars."
1631785857-10203,https://www.officedepot.com/a/browse/cooking-utensils/N=5+1176171/,"Tablecraft Mesh Strainer, 4-3/4"", Brown0.0 out of 5 stars."
1631785857-9168,https://www.officedepot.com/a/browse/cooking-utensils/N=5+1176171/,"Zeroll Zerolon #16 Ice Cream Scoop, 2.5 Oz, Black/Green0.0 out of 5 stars."
1631785857-9879,https://www.officedepot.com/a/browse/cooking-utensils/N=5+1176171/,"Amscan Plastic Cake Knives, 1-1/2"" x 11"", Silver, Pack Of 5 Knives0.0 out of 5 stars."
1631785857-9740,https://www.officedepot.com/a/browse/cooking-utensils/N=5+1176171/,"Update International Baster, 10 1/2"", White4.0 out of 5 stars. 1 review"
1631785857-10064,https://www.officedepot.com/a/browse/cooking-utensils/N=5+1176171/,"Vollrath Disher, No. 5, 6 Oz, Teal0.0 out of 5 stars."
1631785857-10247,https://www.officedepot.com/a/browse/cooking-utensils/N=5+1176171/,"Tablecraft Metal Ice Scoop, 58 Oz, Silver0.0 out of 5 stars."
1631785857-10084,https://www.officedepot.com/a/browse/cooking-utensils/N=5+1176171/,"Vollrath No. 40 Disher With Antimicrobial Protection, 3/4 Oz, Orchid Purple0.0 out of 5 stars."
1631785857-9917,https://www.officedepot.com/a/browse/cooking-utensils/N=5+1176171/,"Martha Stewart Silicone Scraper, Gray0.0 out of 5 stars."
1631785857-9064,https://www.officedepot.com/a/browse/cooking-utensils/N=5+1176171/,"American Metalcraft Plastic Bowl Scraper, 5-3/4"", Silver0.0 out of 5 stars."
1631785857-8935,https://www.officedepot.com/a/browse/cooking-utensils/N=5+1176171/,"Winco Metal/Wood Turner, 3"" x 9-1/2"", Brown"
1631785857-9824,https://www.officedepot.com/a/browse/cooking-utensils/N=5+1176171/,"Vollrath Spoodle Perforated Portion Spoon With Antimicrobial Protection, Notch, ...0.0 out of 5 stars."
1631785857-9446,https://www.officedepot.com/a/browse/cooking-utensils/N=5+1176171/,"Cambro Camwear® Polycarbonate Ladle, 1 Oz, Beige0.0 out of 5 stars."
1631785857-8973,https://www.officedepot.com/a/browse/cooking-utensils/N=5+1176171/,"American Metalcraft Aluminum Hamburger Press, 4-1/2"", Silver0.0 out of 5 stars."
1631785857-10121,https://www.officedepot.com/a/browse/cooking-utensils/N=5+1176171/,"Winco Solid Portion Spoon, 8 Oz, Blue0.0 out of 5 stars."
1631785857-9370,https://www.officedepot.com/a/browse/cooking-utensils/N=5+1176171/,"Winco Polycarbonate Scoop, 32 Oz, Clear0.0 out of 5 stars."
1631785857-10038,https://www.officedepot.com/a/browse/cooking-utensils/N=5+1176171/,"Winco Nylon Serving Spoon, Solid, 12"", Black5.0 out of 5 stars. 2 reviews"
1631785857-8960,https://www.officedepot.com/a/browse/cooking-utensils/N=5+1176171/,"Victorinox® High Heat Turner, 5"" x 4"", Silver0.0 out of 5 stars."
1631785857-9938,https://www.officedepot.com/a/browse/cooking-utensils/N=5+1176171/,"Tablecraft Flexible Cutting Boards, 12"" x 18"", Assorted Colors, Set Of 6 Boards0.0 out of 5 stars."
1631785857-10321,https://www.officedepot.com/a/browse/cooking-utensils/N=5+1176171/,"Vollrath Tongs With Antimicrobial Protection, 9-1/2"", Black0.0 out of 5 stars."
1631785857-9562,https://www.officedepot.com/a/browse/cooking-utensils/N=5+1176171/,"American Metalcraft Stainless-Steel Pizza Cutter, 4"", Green0.0 out of 5 stars."
1631785857-8914,https://www.officedepot.com/a/browse/cooking-utensils/N=5+1176171/,"Martha Stewart Stainless Steel Long Grater, Gray"
1631785857-9278,https://www.officedepot.com/a/browse/cooking-utensils/N=5+1176171/,"Vollrath Disher, No. 40, 0.74 Oz, Orchid0.0 out of 5 stars."
1631785857-9894,https://www.officedepot.com/a/browse/cooking-utensils/N=5+1176171/,"Winco Polyethylene Cutting Board, 1/2""H x 18""W x 24""D, Green0.0 out of 5 stars."
1631785857-9243,https://www.officedepot.com/a/browse/cooking-utensils/N=5+1176171/,"Carlisle Sparta French Whip, 36"", Silver0.0 out of 5 stars."
1631785857-10278,https://www.officedepot.com/a/browse/cooking-utensils/N=5+1176171/,Rubbermaid Commercial Utility Scoop - 1 Piece(s) - 1Each - 1 x Scoop - Dishwashe...0.0 out of 5 stars.
1631785857-10170,https://www.officedepot.com/a/browse/cooking-utensils/N=5+1176171/,"Carlisle Stainless Serving Tongs, 11-3/4"", Silver0.0 out of 5 stars."
1631785857-9785,https://www.officedepot.com/a/browse/cooking-utensils/N=5+1176171/,"Vollrath Spoodle Perforated Portion Spoon With Antimicrobial Protection, 6 Oz, B...0.0 out of 5 stars."
1631785857-9567,https://www.officedepot.com/a/browse/cooking-utensils/N=5+1176171/,"Cambro Plastic Tongs, 9"", Black0.0 out of 5 stars."
1631785857-9393,https://www.officedepot.com/a/browse/cooking-utensils/N=5+1176171/,"Martha Stewart Nylon Serving Spoon, Gray0.0 out of 5 stars."
1631785857-10132,https://www.officedepot.com/a/browse/cooking-utensils/N=5+1176171/,"American Metalcraft Serving Tongs, 12"", Silver0.0 out of 5 stars."
1631785857-9216,https://www.officedepot.com/a/browse/cooking-utensils/N=5+1176171/,"American Metalcraft Aluminum Pocket Crumber, 6"", Silver0.0 out of 5 stars."
1631785857-9587,https://www.officedepot.com/a/browse/cooking-utensils/N=5+1176171/,"American Metalcraft Steel/Plastic Dough Cutter, 4-1/2"", Silver0.0 out of 5 stars."
1631785857-8969,https://www.officedepot.com/a/browse/cooking-utensils/N=5+1176171/,"American Metalcraft Swirl-Base Chrome Number Stand, 12"", Silver0.0 out of 5 stars."
1631785857-10079,https://www.officedepot.com/a/browse/cooking-utensils/N=5+1176171/,"Dexter Russell Pizza Cutter, 4"", Black/Silver0.0 out of 5 stars."
1631785857-9143,https://www.officedepot.com/a/browse/cooking-utensils/N=5+1176171/,"Winco Stainless-Steel Tongs, 9"", Green0.0 out of 5 stars."
1631785857-10231,https://www.officedepot.com/a/browse/cooking-utensils/N=5+1176171/,"Victorinox® Diamond Oval Sharpening Steel, 12""0.0 out of 5 stars."
1631785857-9471,https://www.officedepot.com/a/browse/cooking-utensils/N=5+1176171/,"Carlisle Measure Miser Portion Spoon, 2 Oz, Red0.0 out of 5 stars."
1631785857-9753,https://www.officedepot.com/a/browse/cooking-utensils/N=5+1176171/,"Tablecraft Bamboo Knot Picks, 4-1/2"", Pack Of 100 Picks0.0 out of 5 stars."
1631785857-9008,https://www.officedepot.com/a/browse/cooking-utensils/N=5+1176171/,Starfrit Maple Cutting Board - For Cutting4.0 out of 5 stars. 3 reviews
1631785857-10162,https://www.officedepot.com/a/browse/cooking-utensils/N=5+1176171/,"Victorinox® Regular Cut Sharpening Steel, 12""0.0 out of 5 stars."
1631785857-10336,https://www.officedepot.com/a/browse/cooking-utensils/N=5+1176171/,"American Metalcraft Stainless-Steel Pizza Cutter, 2-5/8"", Silver0.0 out of 5 stars."
1631785857-9318,https://www.officedepot.com/a/browse/cooking-utensils/N=5+1176171/,"Vollrath Spoodle Solid Portion Spoon With Antimicrobial Protection, 2 Oz, Black0.0 out of 5 stars."
1631785857-9664,https://www.officedepot.com/a/browse/cooking-utensils/N=5+1176171/,"Winco Solid Portion Spoon, 6 Oz, Black0.0 out of 5 stars."
1631785857-9812,https://www.officedepot.com/a/browse/cooking-utensils/N=5+1176171/,"Martha Stewart Beech Wood Spatula, Gray0.0 out of 5 stars."
1631785857-9686,https://www.officedepot.com/a/browse/cooking-utensils/N=5+1176171/,"Rubbermaid® Mini Scraper Spatula, 9.5"" Handle, White0.0 out of 5 stars."
1631785857-9589,https://www.officedepot.com/a/browse/cooking-utensils/N=5+1176171/,"Measure Miser Solid Short-Handle Measuring Spoons, 6 Oz, Beige, Pack Of 120.0 out of 5 stars."
1631785857-10340,https://www.officedepot.com/a/browse/cooking-utensils/N=5+1176171/,"Vollrath Disher, No. 70, 1/2 Oz, Silver0.0 out of 5 stars."
1631785857-9576,https://www.officedepot.com/a/browse/cooking-utensils/N=5+1176171/,"Vollrath Piano Whip, 14"", Silver0.0 out of 5 stars."
1631785857-9353,https://www.officedepot.com/a/browse/cooking-utensils/N=5+1176171/,"Vollrath 9""Tongs With Antimicrobial Protection, Yellow0.0 out of 5 stars."
1631785857-9801,https://www.officedepot.com/a/browse/cooking-utensils/N=5+1176171/,"Winco Stainless-Steel Spout Ladle, 2 Oz, Silver0.0 out of 5 stars."
1631785857-10126,https://www.officedepot.com/a/browse/cooking-utensils/N=5+1176171/,"Vollrath Disher, Blue0.0 out of 5 stars."
1631785857-9730,https://www.officedepot.com/a/browse/cooking-utensils/N=5+1176171/,"Vollrath 4 Oz Ladle, 14"", Silver0.0 out of 5 stars."
1631785857-10276,https://www.officedepot.com/a/browse/cooking-utensils/N=5+1176171/,"Carlisle Disher Scoops, 2 Oz, Yellow, Pack Of 120.0 out of 5 stars."
1631785857-10241,https://www.officedepot.com/a/browse/cooking-utensils/N=5+1176171/,"Carlisle Perforated High-Heat Serving Spoons, 13""L, Black, Pack Of 120.0 out of 5 stars."
1631785857-9476,https://www.officedepot.com/a/browse/cooking-utensils/N=5+1176171/,"Winco Wood Bread/Cheese Board, 3/4""H x 12""W x 15""D, Brown0.0 out of 5 stars."
1631785857-8834,https://www.officedepot.com/a/browse/cooking-utensils/N=5+1176171/,"Cuisinart 15pc Triple Rivet Block Set - 15 Piece(s) - Wood, High Carbon Stainles..."
1631785857-9602,https://www.officedepot.com/a/browse/cooking-utensils/N=5+1176171/,"Tablecraft Mesh Strainer, 10-1/4"", Silver0.0 out of 5 stars."
1631785857-9245,https://www.officedepot.com/a/browse/cooking-utensils/N=5+1176171/,American Metalcraft French Fry Scoop0.0 out of 5 stars.
1631785857-9663,https://www.officedepot.com/a/browse/cooking-utensils/N=5+1176171/,"American Metalcraft Aluminum/Plastic Dough Docker, 6"", Silver0.0 out of 5 stars."
1631785857-9429,https://www.officedepot.com/a/browse/cooking-utensils/N=5+1176171/,"American Metalcraft High-Heat Rubber Spatula, 14"", Silver5.0 out of 5 stars. 1 review"
1631785857-9592,https://www.officedepot.com/a/browse/cooking-utensils/N=5+1176171/,"American Metalcraft Right-Hand French Fry Scoop, Silver0.0 out of 5 stars."
1631785857-9252,https://www.officedepot.com/a/browse/cooking-utensils/N=5+1176171/,"Martha Stewart Stainless Steel Spoon, Gray0.0 out of 5 stars."
1631785857-9692,https://www.officedepot.com/a/browse/cooking-utensils/N=5+1176171/,"American Metalcraft Aluminum Ice Scoop, 1/4 Cup, Silver0.0 out of 5 stars."
1631785857-9086,https://www.officedepot.com/a/browse/cooking-utensils/N=5+1176171/,"Crestware Piano Wire Whip, 14"", Silver4.5 out of 5 stars. 2 reviews"
1631785857-9185,https://www.officedepot.com/a/browse/cooking-utensils/N=5+1176171/,"Vollrath Spoodle Perforated Portion Spoon With Antimicrobial Protection, 1 Oz, B...0.0 out of 5 stars."
1631785857-9204,https://www.officedepot.com/a/browse/cooking-utensils/N=5+1176171/,"Cambro Perforated Camwear® Serving Spoon, 13"", Black0.0 out of 5 stars."
1631785857-10308,https://www.officedepot.com/a/browse/cooking-utensils/N=5+1176171/,"Amscan Plastic Salad Tongs, 1""H x 6""W x 12""D, Black, Pack Of 6 Salad Tongs0.0 out of 5 stars."
1631785857-9880,https://www.officedepot.com/a/browse/cooking-utensils/N=5+1176171/,"Martha Stewart Nylon Pancake Turner, Gray0.0 out of 5 stars."
1631785857-9691,https://www.officedepot.com/a/browse/cooking-utensils/N=5+1176171/,"Vollrath Spoodle Solid Portion Spoon With Antimicrobial Protection, 4 Oz, Gray0.0 out of 5 stars."
1631785857-9160,https://www.officedepot.com/a/browse/cooking-utensils/N=5+1176171/,"Vollrath Spoodle Solid Portion Spoon With Antimicrobial Protection, 1 Oz, Black0.0 out of 5 stars."
1631785857-9993,https://www.officedepot.com/a/browse/cooking-utensils/N=5+1176171/,"Winco Perforated Portion Spoon, 2 Oz, Red0.0 out of 5 stars."
1631785857-9339,https://www.officedepot.com/a/browse/cooking-utensils/N=5+1176171/,"Vollrath Silicone Pan Handle, 4-1/2"", Blue0.0 out of 5 stars."
1631785857-8909,https://www.officedepot.com/a/browse/cooking-utensils/N=5+1176171/,"Libertyware Wire Cheese Cutter, 40"", White"
1631785857-9044,https://www.officedepot.com/a/browse/cooking-utensils/N=5+1176171/,"Martha Stewart Rolling Pin, 16”, Olive Wood0.0 out of 5 stars."
1631785857-8897,https://www.officedepot.com/a/browse/cooking-utensils/N=5+1176171/,"Winco Polyethylene Cutting Board, 1/2""H x 24""W x 18""D, White"
1631785857-9281,https://www.officedepot.com/a/browse/cooking-utensils/N=5+1176171/,Emerson® Replacement Oven Element0.0 out of 5 stars.
1631785857-9060,https://www.officedepot.com/a/browse/cooking-utensils/N=5+1176171/,"Update International Stainless-Steel Teaspoons, Windsor Pattern, Silver, Pack Of...5.0 out of 5 stars. 2 reviews"
1631785857-9513,https://www.officedepot.com/a/browse/cooking-utensils/N=5+1176171/,"Vollrath Grip 'N Serv Perforated Serving Spoon, 13"", Black0.0 out of 5 stars."
1631785857-9512,https://www.officedepot.com/a/browse/cooking-utensils/N=5+1176171/,"Martha Stewart Stainless Steel Pizza Cutter, Gray0.0 out of 5 stars."
1631785857-9461,https://www.officedepot.com/a/browse/cooking-utensils/N=5+1176171/,"Cambro Camwear Scoops, 24 Oz, Clear, Pack Of 12 Scoops0.0 out of 5 stars."
1631785857-9074,https://www.officedepot.com/a/browse/cooking-utensils/N=5+1176171/,Starfrit Kitchen Shear - Stainless Steel
1631785857-9007,https://www.officedepot.com/a/browse/cooking-utensils/N=5+1176171/,"Winco Serving Spoon, 13"", Black/Silver4.8 out of 5 stars. 4 reviews"
1631785857-9826,https://www.officedepot.com/a/browse/cooking-utensils/N=5+1176171/,"Vollrath 16"" Tongs With Antimicrobial Protection, Red0.0 out of 5 stars."
1631785857-10303,https://www.officedepot.com/a/browse/cooking-utensils/N=5+1176171/,"American Metalcraft Bottle Stoppers, Assorted Colors, Pack Of 3 Stoppers0.0 out of 5 stars."
1631785857-10184,https://www.officedepot.com/a/browse/cooking-utensils/N=5+1176171/,"Vollrath French Whip, 20"", Silver0.0 out of 5 stars."
1631785857-9273,https://www.officedepot.com/a/browse/cooking-utensils/N=5+1176171/,Martha Stewart Stainless Steel Slotted Spoon. Gray0.0 out of 5 stars.
